{
  "year": 2022,
  "seq": 21,
  "meta": {
    "date": "2022-10-23",
    "from": "MYM MANDABA SCI <mymmandaba@gmail.com>",
    "to": "Marc Mandaba <m.mandaba@themisenergy.com>, \"Yannick Mandaba (Perso)\"",
    "subject": "ReÂ : ReÂ : Tout le monde Ã  bien travaillÃ©"
  },
  "proposals": [
    {
      "index": -21,
      "etiquette": "Achat mÃ©tal (argent) pour prod",
      "category": "MIN",
      "duration": "LT",
      "source": "AI",
      "score": 1,
      "matched_from": [
        "ai_new"
      ]
    }
  ],
  "raw_excerpt": "ğŸ—• Date : 2022-10-23\nğŸ‘¤ From : MYM MANDABA SCI <mymmandaba@gmail.com>\nğŸ“¨ To   : Marc Mandaba <m.mandaba@themisenergy.com>, \"Yannick Mandaba (Perso)\"\n <y.mandaba@gmail.com>\nğŸ§• Subject : ReÂ : ReÂ : Tout le monde Ã  bien travaillÃ©\n---\nBonjour, La journÃ©e d'hier Ã©tait bien. Messe Ã  ND d'afrique Ã  06:00DÃ©pÃ´t de gerbes sur les tombes Ã  11hRepas sous les arbresRetour Ã  Bangui Visite au Pr Nali ( programme CNY +/-) Photos suivront\nAujourd'hui, rangements, mÃ©nage. Juliana, jef, Philippe. DÃ©barras, et nettoyage de tout le couloir, Mise en entrepÃ´t Ã  l'office des banquettes, Ã‰tagÃ¨res blanches (2)libÃ©rÃ©es pour rangements dans la chambre bleue. \nDemain lundi, j'essaie de retarder mon retour. Selon le dÃ», pour changement. +3j\nJonathan pourra venir pour, mesures de ma SDB, siphon office, alimentation eau cuisine. Romaric pourra continuer la peinture extÃ©rieure, j'ai achetÃ©, Ã  socaps, avec un chÃ¨que du Cabinet : 5 agrisol gris1 pot de durcisseur pour 5 pots d'agrisolRouleaux, badigeons= 571 000 fcfaFacture quand ils auront touchÃ© le chÃ¨que, le matÃ©riel est dÃ©jÃ  Ã  la maison. \nMardi, (ou plus) Rangement de tous les objets et meubles vers le fond Salle Ã  Manger. Protections par draps. Jo pourra ajouter des plastiques pour la poussiÃ¨re. \nJe fais pour le mieux. \nPs, cabinet, rÃ©union GML, Sur 6 personnes au dÃ©cret du ministÃ¨re de la santÃ©, 1 excusÃ© Dr kossi mazouka (thÃ¨se de sa fille+en convalescence AVC+Ã©tait Ã  la messe+lundi donnera un trimestre loyer). 3 presents MM BoÃ¯ko M et Mme2 absents CNY et Regakouzou. \nJ'ai achetÃ© Ã  socaps ce qu'il faut pour peintures extÃ©rieures. Socaps dÃ©livrera au fur et Ã  mesure. Question = puis-je employer Romaric quand il aura fini ici.?. En ville le but est : Propre au 1er dÃ©cembre. Lavoirs, WC, seront rÃ©parÃ©s, DÃ©jÃ  fait :2eme palmier malade abattu, Taille des 2 magnoliasNettoyage de la cour de CNY(recevra t'il ? Paiera t'il ? le matÃ©riel numÃ©rique prÃ©vu ? Actuellement tous mes Ã©lÃ¨ves de sa gÃ©nÃ©ration sont mis Ã  la retraite le 31 dÃ©cembre 22)\nMerci Ã  Marc de me redonner les nÂ° de Jo et Romaric\nBon dimanche\n\n\n\nEnvoyÃ© depuis mon tÃ©lÃ©phone Huawei\n\n-------- Message original --------\nDeÂ : Marc Mandaba &lt;m.mandaba@themisenergy.com&gt;\nDateÂ : ven. 21 oct. 2022 Ã  11:01\nÃ€Â : MYM MANDABA SCI &lt;mymmandaba@gmail.com&gt;, \"Yannick Mandaba (Perso)\" &lt;y.mandaba@gmail.com&gt;\nObjetÂ : Re: ReÂ : Tout le monde Ã  bien travaillÃ©\n\nBonjour,\n\n\n\nSi tu veux rester qques jours de plus, ce n&#39;est pas Ã§Ã  qui va changer fondamentalement le planning des travaux. Mais ne te force pas trop si tu es\n fatiguÃ©e, l&#39;essentiel est de commencer.Â Comme discutÃ©, nous pourrons revenir ensemble au 1er trimestre.\n\n\n\nPour les housses de siÃ¨ge, si elles te paraissent de bonne qualitÃ©, prends les Ã  Bangui. Sinon j&#39;en ramÃ¨nerai.\n\n\n\nPour la liste de quincaillerie, je m&#39;en occuperai en France.\n\n\n\nConcernant les meubles, il les pousser vers le fond pour dÃ©gager l&#39;accÃ¨s au couloir. Il y aura de l&#39;Ã©vacuation de gravats.\nBien mettre le canapÃ© et les fauteuils comme une barriÃ¨re au milieu de la piÃ¨ce. Effectivement rentrer les dÃ©corations.Â  Il faudra aussi couvrir le meuble Ã  vaisselle de droite. Si tu peux le faire avec Philippe et un manÅ“uvre, tant mieux. Sinon\n je verrai Ã§a avec Jo et il le fera avec Philippe.\n\n\n\nJe viens d&#39;arriver Ã  Paris d&#39;Abidjan ce matin.\n\n\n\n\n\n\n\n\n\nMarc Mandaba \n\nCIO / THEMIS Energy\n\nMobile CasablancaÂ &#43;212 6 1252 3030\n\nMobile FranceÂ &#43;33 6 1119 3955 (WhatApp)\n\nm.mandaba@themisenergy.com\n\n\n\n\n\n\n\n\n\nDeÂ : MYM MANDABA SCI &lt;mymmandaba@gmail.com&gt;\n\nEnvoyÃ©Â : vendredi 21 octobre 2022, 5:31 AM\n\nÃ€Â : Marc Mandaba &lt;m.mandaba@themisenergy.com&gt;; Yannick Mandaba (Perso) &lt;y.mandaba@gmail.com&gt;\n\nObjetÂ : ReÂ : Tout le monde Ã  bien travaillÃ©\n\n\n\n\nBonjour,\nLes housses de siÃ¨ge, pour la voiture:\nLes acheter ici, ou en France ? \nLes crochets pour placards Ã  2 battants:\nLes acheter en France ( recherche site spÃ©cialisÃ© \nLes objets du salon:\nLes ranger dans le buffet Penone ? \nLes coussins des siÃ¨ges terrasse:\nJe les range "
}