{
  "year": 2022,
  "seq": 10,
  "meta": {
    "date": "2022-08-08",
    "from": "MYM MANDABA SCI <mymmandaba@gmail.com>",
    "to": "Yannick Mandaba <y.mandaba@gmail.com>",
    "subject": "Fwd: Paiements scolaritÃ© MANDABA Tristan"
  },
  "proposals": [
    {
      "index": -10,
      "etiquette": "Dossier de bourse Tristan",
      "category": "MIN",
      "duration": "LT",
      "source": "AI",
      "score": 1,
      "matched_from": [
        "ai_new"
      ]
    }
  ],
  "raw_excerpt": "ðŸ—• Date : 2022-08-08\nðŸ‘¤ From : MYM MANDABA SCI <mymmandaba@gmail.com>\nðŸ“¨ To   : Yannick Mandaba <y.mandaba@gmail.com>\nðŸ§• Subject : Fwd: Paiements scolaritÃ© MANDABA Tristan \n---\n--\nEnvoyÃ© depuis l'application Outlook Email App pour Android -------- Message transfÃ©rÃ© --------\nDeÂ : maryvonne masseron-mandaba  maryvonnemm@hotmail.com\nÃ€Â : Kingkan  kingkan.k@lfib.ac.th\nCcÂ :  Y.mandaba@hotmail.com\nDateÂ : lundi, 08 aoÃ»t 2022, 00:43PM +02:00\nObjetÂ : Paiements scolaritÃ© MANDABA Tristan \n\n>Au Service ComptabilitÃ© ScolaritÃ© du LycÃ©e FranÃ§ais International de Bangkok,\n>\n>Madame,Â \n>Monsieur,Â \n>Merci de m'envoyer le reÃ§u des virements,Â \n>Du 17/06/2022 = 1600 euros\n>Du 08/08/2022 = 600 euros\n>Virements bancaires, pour Tristan MANDABA\n>fils de Yannick MANDABAÂ \n>DOSSIER MY008\n>\n>Tristan Ã©tait en ce2\n>Il va entrer en cm1\n>\n>Merci de le rÃ©inscrire, et de bien vouloir nous informer de la date de dÃ©pÃ´t du dossier de renouvellement de bourse.\n>\n>CordialementÂ \n>\n>Maryvonne Mandaba Masseron, grand mÃ¨reÂ \n>Maryvonnemm@hotmail.comÂ \n>\n>\n>TÃ©lÃ©charger  Outlook pour Android"
}