{
  "year": 2022,
  "seq": 137,
  "meta": {
    "date": "2022-05-10",
    "from": "maryvonne masseron-mandaba <maryvonnemm@hotmail.com>",
    "to": "Yannick Mandaba <y.mandaba@gmail.com>",
    "subject": "Re: Comprendre la psychologie des empathes"
  },
  "proposals": [],
  "raw_excerpt": "ðŸ—• Date : 2022-05-10\nðŸ‘¤ From : maryvonne masseron-mandaba <maryvonnemm@hotmail.com>\nðŸ“¨ To   : Yannick Mandaba <y.mandaba@gmail.com>\nðŸ§• Subject : Re: Comprendre la psychologie des empathes\n---\nTa faon de progresser est  un petit niveau. Tu me donnes  entendre une confrence d'une association de personnes qui publient sans signer. Ni psychiatres, ni psychologues, ni comit de lecture. Le promoteur Franck Lepage, n'est pas un spcialiste de quoique ce soit, juste promoteur de l'ducation populaire dans la ville de... Grenoble...\nEt vois sa photo,...\nLe moteur de recherche est bien conu, pour rgler ses problmes avec sa mre.\nAu moins  l'universitaire de Caen, ils ont Michel Onfray.\nTu perds ton temps, encore et toujours.\n\nSi tu avais t voir ce que lisait Tristan,\nPour les plus de 9 ans.\nL'auteur, morris grieztman,\nEst n en Angleterre, australien,\nJuif, a crit des livres sur l'haulocoste, destins aux enfants.\nEt la srie de la bibliothque rose /verte, lue par ton fils, date de 1993... Et ce n'est pas de la grande littrature...\nLes problmatiques dcrites, crainte d'adoption, etc, ne sont pas les siennes.\n\nArrte les rseaux sociaux,\nUtilise internet pour t'informer. Point.\n\nL'argent envoy est pour le billet d'avion.\nSinon tu le gardes pour le 1er trimestre.\nS'il est gaspill, je risque de m'nerver.\n\n\n\nTlcharger Outlook pour Android\n________________________________\nFrom: Yannick Mandaba \nSent: Sunday, May 8, 2022 11:32:44 AM\nTo: maryvonne masseron-mandaba \nSubject: Comprendre la psychologie des empathes\n\nhttps://www.youtube.com/watch?v=5ZTgVn-1hr8&t=1109s\n\n--\nYannick Mandaba\nMobile: +66.8782.00.622"
}