{
  "year": 2022,
  "seq": 66,
  "meta": {
    "date": "2022-02-25",
    "from": "maryvonne masseron-mandaba <maryvonnemm@hotmail.com>",
    "to": "Yannick Mandaba <y.mandaba@gmail.com>",
    "subject": "Re: SociÃ©tÃ© Generale"
  },
  "proposals": [
    {
      "index": -66,
      "etiquette": "Dossier de bourse Tristan",
      "category": "MIN",
      "duration": "LT",
      "source": "AI",
      "score": 1,
      "matched_from": [
        "ai_new"
      ]
    }
  ],
  "raw_excerpt": "ðŸ—• Date : 2022-02-25\nðŸ‘¤ From : maryvonne masseron-mandaba <maryvonnemm@hotmail.com>\nðŸ“¨ To   : Yannick Mandaba <y.mandaba@gmail.com>\nðŸ§• Subject : Re: SociÃ©tÃ© Generale\n---\nNon, on repart  zro.\nCode Client ok (8 chiffres)\nCode Secret  demander sur internet, selon la procdure que nous avions faite, mais tu n'avais pas utilis le Code Provisoire dans les 12 heures, donc refaire la demande,\nEt dcider d'un Code Secret de 6 chiffres.\n\nRien  voir avec le Tlphone de Scurit qui sert essentiellement quand on perd sa carte bleue.\n\nTlcharger Outlook pour Android\n________________________________\nFrom: Yannick Mandaba \nSent: Friday, February 25, 2022 11:26:13 AM\nTo: maryvonne masseron-mandaba \nSubject: Re: Socit Generale\n\nTu proposes une action  entreprendre sur le site auquel j'aurai accs une fois que tu m'auras transmis le code qui va arriver dans ta bote au lettre ?\nOui ok d'accord.\n\nOn Fri, Feb 25, 2022, 5:17 PM maryvonne masseron-mandaba > wrote:\n\nTu refais une demande de R initialisation de ton code secret.\nTu auras accs  ton compte.\nTu imprimera tes 12 relevs avec en-tte de 2021.\nTu complteras ton dossier de bourse.\nAprs, on pourras discuter.\n\nEt tu auras conomis 137,5 euros\nTlcharger Outlook pour Android"
}