{
  "year": 2022,
  "seq": 52,
  "meta": {
    "date": "2022-01-21",
    "from": "maryvonne masseron-mandaba <maryvonnemm@hotmail.com>",
    "to": "\"Yannick MANDABA (personnal)\" <y.mandaba@gmail.com>",
    "subject": "Re: LFIB"
  },
  "proposals": [],
  "raw_excerpt": "ðŸ—• Date : 2022-01-21\nðŸ‘¤ From : maryvonne masseron-mandaba <maryvonnemm@hotmail.com>\nðŸ“¨ To   : \"Yannick MANDABA (personnal)\" <y.mandaba@gmail.com>\nðŸ§• Subject : Re: LFIB\n---\nTu as reu du docteur kossi mazouka = dbut decembre,\n610 euros pour Tristan, 2eme trimestre... Et son cadeau de Nol.\n\nJ'avais pay 710 euros au lfib, pour le 1er trimestre, et les AES, et le transport.\n\nTlcharger Outlook pour Android\n________________________________\nFrom: Yannick MANDABA (personnal) \nSent: Thursday, January 20, 2022 4:48:59 PM\nTo: maryvonne masseron-mandaba \nSubject: LFIB\n\n\nBonjour,\n\n\n\nPourrais-tu menvoyer une copie de tes paiements ?\n\nJe ne comprends pas pourquoi ils narrtent pas de me relancer pour des paiement trs anciens.\n\n\n\nSouvent tu me dis leur avoir envoy mais je nai pas de copie.\n\nUne simple copie decran ou une photo des transfers cela me permet de garder une copie dans mon dossier depenses familles dans lequel je garde toutes les depenses au quotidien.\n\n\n\nBisous"
}