{
  "year": 2022,
  "seq": 29,
  "meta": {
    "date": "2022-10-28",
    "from": "MYM MANDABA SCI <mymmandaba@gmail.com>",
    "to": "Marc Mandaba <marcmandaba@gmail.com>, maryvonne masseron-mandaba",
    "subject": "ReÂ : ReÂ : 20221026 photos Maison Peinture"
  },
  "proposals": [],
  "raw_excerpt": "ğŸ—• Date : 2022-10-28\nğŸ‘¤ From : MYM MANDABA SCI <mymmandaba@gmail.com>\nğŸ“¨ To   : Marc Mandaba <marcmandaba@gmail.com>, maryvonne masseron-mandaba\n <maryvonnemm@hotmail.com>, \"y.mandaba@gmail.com\" <y.mandaba@gmail.com>\nğŸ§• Subject : ReÂ : ReÂ : 20221026 photos Maison Peinture\n---\nMerci Marc, \nRomaric a enfin fait les raccords ciments. La peinture semble mieux, mais j'attends la prochaine pluie. Voici quelques photos. J'ai dÃ» racheter peinture et Durcisseur, et comme ils ne faisaient rien, j'ai donnÃ© un Detex pour le dessous de la terrasse. Je ne contrÃ´le plus. \nPour le jardin, Alphonse est venu, j'ai donnÃ© pour le produit et la main d'Å“uvre. Ce que je ne comprends pas c'est que l'aide de Philippe, ne fait pas le jardin potager, vers les voisins, mais des pÃ©piniÃ¨res de Tecks...lÃ  oÃ¹ je croyais qu'il y aurait une pelouse... Voir photos. C'est ce que tu as demandÃ© ? \nJ'ai fini de ranger les dossiers de papa, et votre chambre. Il me reste ma salle de bain. Mais je suis Ã©puisÃ©e. \n\n\nEnvoyÃ© depuis mon tÃ©lÃ©phone Huawei\n\n-------- Message original --------\nDeÂ : Marc Mandaba &lt;marcmandaba@gmail.com&gt;\nDateÂ : ven. 28 oct. 2022 Ã  11:42\nÃ€Â : MYM MANDABA SCI &lt;mymmandaba@gmail.com&gt;, maryvonne masseron-mandaba &lt;maryvonnemm@hotmail.com&gt;, y.mandaba@gmail.com\nObjetÂ : Re: ReÂ : 20221026 photos Maison Peinture\n\nMerci des nouvelles. J&#39;ai relancÃ© Romaric pour les reprises ciment.\n\n\n\n\n\nPour la peinture, peut-Ãªtre faut-il une sous couche et une &#34;vraie&#34; peinture extÃ©rieure. La marque franÃ§aise &#34;Seigneurie&#34; Ã  gauche de Dias FrÃ¨re a de bons produits.\n\nSi tu veux essayer le durcisseur, ok. Sinon j&#39;essaierai Seigneurie. Je pense revenir du 21 ou 28 novembre (puis en mars).\n\n\n\n\n\n\n\n\n\n\n\nMarc Mandaba\n\nFrance &#43;33 611193955 (WhatsApp)\n\n\n\nDeÂ : MYM MANDABA SCI &lt;mymmandaba@gmail.com&gt;\n\nEnvoyÃ©Â : vendredi 28 octobre 2022, 11:05 AM\n\nÃ€Â : Marc Mandaba &lt;marcmandaba@gmail.com&gt;; maryvonne masseron-mandaba &lt;maryvonnemm@hotmail.com&gt;; y.mandaba@gmail.com &lt;y.mandaba@gmail.com&gt;\n\nObjetÂ : ReÂ : 20221026 photos Maison Peinture\n\n\n\n\n22021028\nBelle couleur de la 2Ã¨me couche de l&#39;agrisol gris. \nAprÃ¨s la grosse pluie, la rambarde terrasse s&#39;Ã©caille comme avant... Le DeteX blanc n&#39;est pas une solution, il faut Detex et Durcisseur Ã  150 000 le pot. Je fais refaire.\n\nLes raccords de Ciment ne sont pas faits. \nJe n&#39;arrive pas Ã  rÃ©duire les photos sur Gmail, c&#39;est pourquoi je passe par hotmail\n\n\n\n\nEnvoyÃ© depuis mon tÃ©lÃ©phone Huawei\n\n\n\n\n\n-------- Message original --------\n\nDeÂ : Marc Mandaba &lt;marcmandaba@gmail.com&gt;\n\nDateÂ : mer. 26 oct. 2022 Ã  22:59\n\nÃ€Â : maryvonne masseron-mandaba &lt;maryvonnemm@hotmail.com&gt;, y.mandaba@gmail.com, MYM MANDABA SCI &lt;mymmandaba@gmail.com&gt;\n\nCcÂ : MYM MANDABA SCI &lt;mymmandaba@gmail.com&gt;\n\nObjetÂ : Re: 20221026 photos Maison Peinture\n\n\n\nBonsoir,\n\n\n\nMessage bien reÃ§u. Je suis un peu sous l&#39;eau cette fin de semaine, mais je ferai un email propre ce weekend pour la fin de sÃ©jour (clÃ©s, voiture Ã  dÃ©placer, action Ã  suivre, etc.). J&#39;appellerai maman avant.\n\n\n\nMerci pour les housses.Â \n\n\n\nEffectivement le cabinet mÃ©rite mieux. C&#39;Ã©tait un centre de mÃ©decine privÃ©e avec un standard Ã©quilibrÃ©. Je me rappelle la serpilliÃ¨re passÃ©e plusieurs fois par jour, la lampe UV et l&#39;alcool sur chaque instrument avant utilisation, etc. Le besoin\n et la demande de structure sanitaire fiable sont toujours lÃ , voire supÃ©rieure. Plus de clinique Chouaib, plus de mÃ©decin de la coopÃ©ration, et des milliers de personnels &#34;de la paix&#34;.Â \n\n\n\nBonne journÃ©e demain.\nMarc\n\n\n\nMarc Mandaba\n\nFrance &#43;33 611193955 (WhatsApp)\n\n\n\nDeÂ : maryvonne masseron-mandaba &lt;maryvonnemm@hotmail.com&gt;\n\nEnvoyÃ©Â : mercredi 26 octobre 2022, 6:50 PM\n\nÃ€Â : y.mandaba@gmail.com &lt;y.mandaba@gmail.com&gt;; marcmandaba &lt;marcmandaba@gmail.com&gt;; MYM MANDABA SCI &lt;mymmandaba@gmail.com&gt;\n\nCcÂ : MYM MANDABA SCI &lt;mymmandaba@gmail.com&gt;\n\nObjetÂ : Fwd: 20221026 photos Maison Peinture\n\n\n\n\n\n\n\n\nBonsoir,Â \n\n\n\nLe"
}