{
  "year": 2022,
  "seq": 147,
  "meta": {
    "date": "2022-06-12",
    "from": "maryvonne masseron-mandaba <maryvonnemm@hotmail.com>",
    "to": "Marc MANDABA <marcmandaba@hotmail.com>, Yannick Mandaba",
    "subject": "Re: Stop au harcÃ¨lement"
  },
  "proposals": [],
  "raw_excerpt": "ðŸ—• Date : 2022-06-12\nðŸ‘¤ From : maryvonne masseron-mandaba <maryvonnemm@hotmail.com>\nðŸ“¨ To   : Marc MANDABA <marcmandaba@hotmail.com>, Yannick Mandaba\n\t<y.mandaba@gmail.com>\nðŸ§• Subject : Re: Stop au harcÃ¨lement\n---\nJe ne comprends pas trop ce mpris de la libert de pense, et d'expression, des femmes...\n\nTlcharger Outlook pour Android\n________________________________\nFrom: Marc MANDABA \nSent: Sunday, June 12, 2022 4:48:56 PM\nTo: Yannick Mandaba \nCc: maryvonne masseron-mandaba ; maryvonne.masseron@free.fr \nSubject: Stop au harclement\n\n\nBonjour Yannick,\n\nJe souhaite tinformer que Maman a dpass les bornes avec Ccile. Je vais donc bloquer son numro pour quelle cesse ses mchancets avec ma femme. Aucun besoin dentrer dans les dtails, cest avr et rpt, et aujourdhui cela prend fin.\n\nMaman peut toujours me joindre par tlphone et par email (jai du bloquer son contact WhatsApp car trop de harclement galement).\n\nMerci\n\nMarc\n\n\n\nMarc Mandaba\n\nMobile +33 6 1119 3955 (WhatsApp)"
}