{
  "year": 2022,
  "seq": 99,
  "meta": {
    "date": "2022-04-06",
    "from": "maryvonne masseron-mandaba <maryvonnemm@hotmail.com>",
    "to": "Marc MANDABA <marcmandaba@hotmail.com>",
    "subject": "Les voitures"
  },
  "proposals": [],
  "raw_excerpt": "ðŸ—• Date : 2022-04-06\nðŸ‘¤ From : maryvonne masseron-mandaba <maryvonnemm@hotmail.com>\nðŸ“¨ To   : Marc MANDABA <marcmandaba@hotmail.com>\nðŸ§• Subject : Les voitures\n---\nMarc,\n\nMerci de ta communication.\nEt de ce que tu fais.\n\nTu trouveras la carte grise de la Renault 9,\nderrire ton permis de conduire caf\ndans ta chambre, en entrant,  droite, dans un petit panier en osier, avec la cl de contact.\n\nPour la Mitsubishi, j'ai ici la carte grise, dois-je te l'envoyer, en urgence ? Voici dj la photocopie recto verso.\nLes cls sont dans ma chambre  Bangui.\n\nJe ne tiens pas  ce que ma chambre soit ouverte en mon absence.\n\nPour matre Roosalem, je dois Co signer ?\n\nSuis dispo au tel ou par mail\nMaman\n\n\n\n\nTlcharger Outlook pour Android"
}