{
  "year": 2022,
  "seq": 96,
  "meta": {
    "date": "2022-03-31",
    "from": "maryvonne masseron-mandaba <maryvonnemm@hotmail.com>",
    "to": "\"y.mandaba@gmail.com\" <y.mandaba@gmail.com>",
    "subject": "Urgent"
  },
  "proposals": [],
  "raw_excerpt": "ðŸ—• Date : 2022-03-31\nðŸ‘¤ From : maryvonne masseron-mandaba <maryvonnemm@hotmail.com>\nðŸ“¨ To   : \"y.mandaba@gmail.com\" <y.mandaba@gmail.com>\nðŸ§• Subject : Urgent\n---\nBonjour,\nTu laisses Tristan jouer avec ton tlphone...\nTu manques d'autorit.\nIl m'a bloque, sur son tlphone et le tien.\nTu ne vois pas le mal que je me donne pour son ouverture  la culture. Tu l'enfermes dans votre vie trique. Maintenant il pense les changes entre personnes en terme de bagarre, de dispute, de points, de chantage, de brimades. Il tait motiv pour passer les tests, maintenant cela ne fait que 5 leons ce mois ci.\n\nQuel est le problme ?\n(Outre ta fiert blesse)\nPour moi aussi c'est parti d'une vexation.\nComme j'expliquais  Tristan que l'cole cotait cher, il m'a rpondu que je pouvais demander de l'argent  son papa, pour payer l'cole................\n\nTlcharger Outlook pour Android"
}