{
  "year": 2022,
  "seq": 180,
  "meta": {
    "date": "2022-09-20",
    "from": "Yannick Mandaba <y.mandaba@gmail.com>",
    "to": "maryvonne masseron-mandaba <maryvonnemm@hotmail.com>",
    "subject": "Quand j'Ã©cris Ã§a je n'ai pas encore lu tes emails..."
  },
  "proposals": [],
  "raw_excerpt": "ğŸ—• Date : 2022-09-20\nğŸ‘¤ From : Yannick Mandaba <y.mandaba@gmail.com>\nğŸ“¨ To   : maryvonne masseron-mandaba <maryvonnemm@hotmail.com>\nğŸ§• Subject : Quand j'Ã©cris Ã§a je n'ai pas encore lu tes emails...\n---\nIl sait pour les 600k mais je crois que c'est une rÃ©action punitive (ref:\nPergo, les contenaires).\n\nEn gros il veut aider mais pas Ãªtre tÃ©lÃ©guidÃ© car Ã§a chamboule ses plans.\nForcer Ã  dÃ©lÃ©guer...\n\nBon je ne comprends pas tout dans vos rapports.\n\nIl a fait tout ce que tu voulais de nous, bonnes Ã©tudes, femme pas trop\ngrosse, de beaux enfants et cela ne semble pas te satisfaire.\n\nDernier Ã©lÃ©ment fÃ¢cheux:\n\nVexÃ© de ta remarque sur LÃ©a 1ere de tout son niveau qui aurait reÃ§u une\nremarque sur le sport au lieu de fÃ©licitations.\n\nOutrÃ© d'avoir trouvÃ© Philippe maigre Ã  faire peur dormant sous la paillotte\ndÃ©garnie.\n\n T'en veux pour une myriade de petites choses mais ce n'est pas agressif.\n\nIl se preserve en quelques sorte. ExaspÃ©ration.\n\nJe ne cache pas ma responsabilitÃ© d'avoir chamboulÃ© et gaspillÃ© en un sens\ntes efforts.\nMais je ne peux pas Ãªtre responsable de tout.\n\nMon dernier rÃ´le de grand frÃ¨re que je peux encore exercer c'est un rÃ´le de\nmÃ©diateur (mÃªme si parti prenante et cause d'une part des contraintes et\ntension).\n\nDonc de grÃ¢ce si on peut arrÃªter de pointer du doigt comme c'est Ã  la mode\nen France. Et juste pragmatiquement essayer de faire avec.\n\nCe n'est pas un chantage Ã  la dÃ©cision mais un chantage pour des dÃ©cisions\ncollÃ©giales et qui prennent en compte tout le monde.\n\nNormalement sans conflit d'intÃ©rÃªt, c'est une question de ce mettre\nd'accord sur ce qui est le mieux.\n\nMarc a t'il des intÃ©rÃªts qui vont contre toi ou moi?\n\nEt toi c'est pareil sauf sur la carte postale de la maison que tu veux\ngarder et l'accÃ¨s.\nAu dÃ©but j'ai un peu niÃ© cela outrÃ© par le gaspillage pendant que je doit\nquÃ©mander.\n\nC'est ce vide de plan gÃ©nÃ©ral que Marc ne supporte pas.\nDonc si tu n'arrives pas Ã  faire une rupture tu le laisse faire et cela\nm'Ã©tonnerait beaucoup qu'il se plante complÃ¨tement, que tes affaires soient\nvolÃ©es, ou que la maison soit moins bien qu'au dÃ©part.\n\nA ta prochaine visite, grÃ¢ce Ã  Marc. Tu auras un frigidaire, une gaziniÃ¨re,\nune machine Ã  laver qui se remplie seule. Plus besoin de descendre pour de\nl'eau, une bonne voiture.\n\nBloquer cette salle de bain. Gaspiller son voyage, la dispo des ouvriers\netc... Penses-tu que cela vaut le coup?\n\nComment on peut faire si on ne parle pas ? Ou qu'on parle avec toujours des\narriÃ©rÃ©s pensÃ©es ?\n\nIl faut 5 secondes pour dire une contre vÃ©ritÃ© ou faire dÃ©vier une\ndiscussion. Il en faut 300 pour rectifier le tir.\n\nSi en fait tu ne veux pas louer la maison, comme Marc a revu Ã  la baisse la\nrÃ©novation il reste un peu de budget pour transfÃ©rer sur le cabinet.\n\nMoi si tu acceptes Ã§a je n'y gagnÃ© pas. Mon pacte avec Marc c'Ã©tait de lui\nlaisser le choix du terrain et la possibilitÃ© mÃªme de construire, contre\nune aide pour avancer l'argent permettant de gÃ©nÃ©rer des revenus pour moi.\n\nQue ce soit par ton cabinet ou la maison... Bien sÃ»r garder l'accÃ¨s Ã  la\nmaison c'est mieux.\n La diffÃ©rence c'est que le cabinet c'est Ã  toi.\nDonc c'est lÃ  qu'un arrangement de transfer  avec toi devient d'actualitÃ©.\nTu veux rester Ã  la maison et ton cabinet pourrait faire mieux.\n\nLa maison ayant les choses urgentes faites (clÃ´ture, plomberie, SDB\nchambres, cuisine il fera avec du local carrelage blanc pareil au lieu de\ntour refaire moderne. Carrelage chambres sauf la tienne), une maniÃ¨re\nÃ©lÃ©gante d'apprÃ©ciation serait de le laisser faire pareil au cabinet pour\npouvoir se refaire.\n\nParce qu'en fait comme on ne loue pas la maison il ne reverra jamais cet\nargent. Mais je pense qu'il n'a mÃªme pas Ã§a en tÃªte en prioritÃ©.\nIl voit bien que si on ne loue pas c'est moi qui reste en plan..."
}