{
  "year": 2022,
  "seq": 49,
  "meta": {
    "date": "2022-06-16",
    "from": "Yannick Mandaba <y.mandaba@gmail.com>",
    "to": "maryvonne masseron-mandaba <maryvonnemm@hotmail.com>",
    "subject": "Fwd: solde impayÃ© Ã  rÃ©gulariser avant validation rÃ©inscription"
  },
  "proposals": [],
  "raw_excerpt": "ğŸ—• Date : 2022-06-16\nğŸ‘¤ From : Yannick Mandaba <y.mandaba@gmail.com>\nğŸ“¨ To   : maryvonne masseron-mandaba <maryvonnemm@hotmail.com>\nğŸ§• Subject : Fwd: solde impayÃ© Ã  rÃ©gulariser avant validation rÃ©inscription\n---\ndonc je savais bien que cette annee 2022 n'etait pas payee. j etais tres\netonne qua d tu me disais avoir tout paye.\n\nDonc je vais voir mais sans doute que je ne peux pas venir. Tu ramÃ¨neras\nTristan ?\n\n---------- Forwarded message ---------\nFrom: Facturation \nDate: Thu, Jun 16, 2022, 11:42 AM\nSubject: solde impayÃ© Ã  rÃ©gulariser avant validation rÃ©inscription\nTo: MANDABA Yannick \n\n\nBonjour Madame, Monsieur,\n\nNous sommes en train dâ€™examiner votre demande de rÃ©inscription et il\napparait sauf erreur de notre part quâ€™il vous reste un solde Ã  payer de *81\n346.06 THB*.\nNous vous remercions de bien vouloir rÃ©gulariser votre situation afin que\nnous puissions procÃ©der Ã  la rÃ©inscription de votre, (vos) enfant(s).\nVous pouvez nous contacter pour nous proposer un plan dâ€™apurement.\nNous restons donc dans lâ€™attente de votre retour\n\nbien cordialement\n\nle service facturation"
}