{
  "year": 2022,
  "seq": 45,
  "meta": {
    "date": "2022-09-23",
    "from": "Yannick Mandaba <y.mandaba@gmail.com>",
    "to": "maryvonne masseron-mandaba <maryvonnemm@hotmail.com>",
    "subject": "Fwd: Facture frais de scolarit√© / Invoice frais de scolarit√©"
  },
  "proposals": [
    {
      "index": -45,
      "etiquette": "Dossier de bourse Tristan",
      "category": "MIN",
      "duration": "LT",
      "source": "AI",
      "score": 1,
      "matched_from": [
        "ai_new"
      ]
    }
  ],
  "raw_excerpt": "üóï Date : 2022-09-23\nüë§ From : Yannick Mandaba <y.mandaba@gmail.com>\nüì® To   : maryvonne masseron-mandaba <maryvonnemm@hotmail.com>\nüßï Subject : Fwd: Facture frais de scolarit√© / Invoice frais de scolarit√©\n---\nBizarre cette ann√©e enti√®re est moins ch√®re que le restant de l'ann√©e\nderni√®re.\n\nJ'ai demand√© plus de bourse.\nDe 70% ils ont donn√© 73% mais ils ont int√©gr√© la Cantine cette fois.\n\nEn fait de payer en retard le service de l'ambassade n'a pas envoy√© la\nlettre habituelle avec les conditions de la bourse.\nC'√©tait suspendu au paiement en retard.\n\nVoil√† l'explication\n\n---------- Forwarded message ---------\nFrom: Facturation \nDate: Thu, Sep 15, 2022, 3:35 PM\nSubject: Facture frais de scolarit√© / Invoice frais de scolarit√©\nTo: MANDABA Yannick \n\n\nChers parents,\n\nVous trouverez en pi√®ce jointe la facture relative aux frais de\nrestauration scolaire.\n La facture concernant les activit√©s extra-scolaires et de l‚Äôassociation\nsportive sera √©mise la semaine prochaine.\n Les parents qui ont exprim√© le choix lors de l‚Äôinscription ou de la\nr√©inscription sur notre plateforme EDUKA de recourir √† un paiement\n√©chelonn√© recevront la semaine prochaine un √©ch√©ancier global r√©capitulant\nles deux types de facturation (frais scolaires et frais extra- scolaire).\n Les parents qui ont √©mis le souhait de payer en une seule fois, peuvent le\nfaire d√®s r√©ception des factures.\n Les frais √©ventuels de consultation en orthophonie ou de repas pris\noccasionnellement √† la cantine par les lyc√©ens (repas √† la carte) feront\nl‚Äôobjet d‚Äôune facturation mensuelle √† r√©gler sous 8 jours. Ces derni√®res\nfactures ne seront pas int√©gr√©es √† l‚Äô√©ch√©ancier de paiement √©voqu√©\nci-dessus.\n Dans tous les cas il est imp√©ratif de nous adresser par retour de mail √†\nl‚Äôadresse suivante : facturation@lfib.ac.th\n\nvotre justificatif de paiement.\n A chaque paiement constat√© par nos soins sur nos comptes bancaires un re√ßu\nsera automatiquement √©mis et envoy√© par email.\n Vous pourrez retrouver vos factures vos re√ßus et suivre l‚Äô√©volution de\nvotre solde sur votre portail finances dans notre plateforme EDUKA. Lorsque\nc‚Äôest la soci√©t√© qui paie les frais de scolarit√© les parents doivent\ntransmettre eux m√™mes leur facture.\n Nous vous informons d√®s √† pr√©sent que conform√©ment √† notre nouveau\nr√®glement financier des p√©nalit√©s s‚Äôappliqueront en cas de retard de\npaiement suite au non-respect des √©ch√©ances fix√©es.\n Nous restons √† votre disposition pour toutes questions √©ventuelles.\n\nBien cordialement,\n\n---------------------------------------------------------------------------------------------------------------------------------------------------------------------------------------------------------------------------------------------------------------------------------------------------------------------------------------------\n\n Dear parents,\n\nYou will find attached to this email the invoice for your child‚Äôs school\nmeals .\nThe invoice for those registered to extracurricular activities and the\nsports association will be issued next week.\nParents who have requested to pay in installments when registering on the\nEDUKA platform will receive a schedule of payments next week for both types\nof billing (school fees and extracurricular fees).\nParents who chose to pay in one installment may do so once they have\nreceived the invoices.\nAny fees for speech therapy sessions or occasional meals taken in the\ncanteen by Lyc√©e students (√† la carte meals) will be billed monthly and to\nbe paid within 8 days. These invoices will not be included in the\nabove-mentioned payment schedule.\nOnce you have issued the payment, it is important to send us the proof of\npayment by email at this address : facturation@lfib.ac.th\n\nOnce we have confirmed the receipt of funds on our bank account, a receipt\nwill automatically be issued and sent to you by email.\nYou will be able to find your invoices and receipts and your current\nbalance on your finance portal in the EDUKA platform. In case of the\ncompany paies the invoices, parents must forward th"
}