{
  "year": 2022,
  "seq": 27,
  "meta": {
    "date": "2022-10-26",
    "from": "MYM MANDABA SCI <mymmandaba@gmail.com>",
    "to": "Marc MANDABA <marcmandaba@hotmail.com>",
    "subject": "Re: Re : Re : Re : Re : Tout le monde Ã  bien travaillÃ©"
  },
  "proposals": [],
  "raw_excerpt": "ðŸ—• Date : 2022-10-26\nðŸ‘¤ From : MYM MANDABA SCI <mymmandaba@gmail.com>\nðŸ“¨ To   : Marc MANDABA <marcmandaba@hotmail.com>\nðŸ§• Subject : Re: Re : Re : Re : Re : Tout le monde Ã  bien travaillÃ©\n---\nBonjour,\nMettrai les photos dans messages sÃ©parÃ©s, car dossiers trop lourds.\n\nOui, Marc, merci, internet fonctionne trÃ¨s bien.\nIl y a des dÃ©lestages Enerca qui durent 20 mn. La saison sÃ¨che a commencÃ©.\nEt aussi merci pour l'eau. Je me douche souvent, et cela me donne de\nl'Ã©nergie.\n\nEnerca n'est pas revenu.\nEn mÃªme temps, je ne suis pas sÃ»re que le compteur Ã  l'extÃ©rieur soit une\nbonne idÃ©e. Tu gÃ©reras...\nFacture Sodeca dans un dossier \"Photos\" datÃ© du jour, ex 20221026.\n\nPb couleur peinture agrisol. Le gris me semble un peu tro bleutÃ©, Ã  Yannick\naussi. Je vais voir si l'on peut renvoyer les pots pour une 2Ã¨me couche\nplus claire, et moins bleutÃ©e. Si c'est compliquÃ©, je laisse. Le travail\nest trÃ¨s bien fait...\n\nLe Dr Ngoufolo Ã©tant dÃ©cÃ©dÃ© dimanche, les confrÃ¨res sont injoignables.\nRÃ©alitÃ© et Esquive.\n\nEnfin Nali a un Whatsapp !!!. De mission en Angola, ne pouvant joindre\npersonne en raison du deuil, il m'a appelÃ©e.\nLes 3 enfants sont en mÃ©decine Ã  Dakar.\n\nDÃ¨s que les dÃ©bris des Ã©laguages et abattages  seront rangÃ©s, j'appelle le\njardinier. Ce midi je pense.\n\nJ'envoie les photos.\nBonne journÃ©e\n\n\n\nLe mar. 25 oct. 2022 Ã  19:43, Marc MANDABA  a\nÃ©crit :\n\n> Bonsoir,\n>\n>\n>\n> Je confirme que Joan a la clÃ© du cadenas de la grille de la cuisine. Il\n> lâ€™utilise pour rentrer et remettre le disjoncteur quand ca saute. Il garde\n> la clÃ© personnellement.\n>\n>\n>\n> TrÃ¨s bien de remettre lâ€™eau Ã  la cuisine et Ã  lâ€™office. Il faut profiter\n> des travailleurs de Jo. Je referai le carrelage blanc de la paillasse de la\n> cuisine, et renforcerai/repeindrai les portes le trimestre prochain.\n>\n>\n>\n> Le jardin reprend des couleurs, câ€™est bien. Jâ€™ai donnÃ© Ã  Philippe\n> lâ€™objectif de juin pour quâ€™il soit entiÃ¨rement refait. Il fera venir des\n> aides de temps en temps pour maitriser les herbes en saison des pluies. Il\n> nâ€™y arrive pas tout seul.\n>\n>\n>\n> Le jardinier du consulat doit faire dÃ©sherbant + engrais *et semi de\n> gazon*. Câ€™Ã©tait vu avec lui pour un forfait de 55.000FCFA\n>\n>\n>\n> Pour la SODECA, ne fait rien, je mâ€™en occuperai. Ils facturent\n> consciencieusement tous les 2 mois alors quâ€™il nâ€™y a pas dâ€™eau... Jâ€™ai reÃ§u\n> une facture Ã©galement (dans le porte lettre Ã  droite de lâ€™entrÃ©e sur le\n> meuble). Autant Enerca sâ€™ameliore, autant le rÃ©seau dâ€™eau est une calamitÃ©,\n> mÃªme en ville. Je vais leur rendre le compteur. On reprendra un abonnement\n> dans quelques annÃ©es peut-Ãªtre...\n>\n>\n>\n> Merci pour le suivi. Jonathan te trouve en forme !\n>\n>\n>\n> (PS : dis moi si internet fonctionne toujours bien)\n>\n>\n>\n> Marc Mandaba\n>\n> Mobile +33 6 1119 3955 (WhatsApp)\n>\n>\n>\n> *From:* MYM MANDABA SCI \n> *Sent:* Tuesday, October 25, 2022 8:10 PM\n> *To:* Marc MANDABA ; Yannick Mandaba (Perso)  y.mandaba@gmail.com>\n> *Subject:* Re : Re : Re : Re : Tout le monde Ã  bien travaillÃ©\n>\n>\n>\n> Bonsoir,\n>\n>\n>\n> Romaric travaille vite,\n>\n> Il a mis la 1ere couche d'agrisol ( gris bleutÃ©, dommage, j'Ã©tais lÃ , et\n> n'ai pas regardÃ©, c'est socap qui a composÃ© les pots, ce n'est pas la faute\n> de Romaric).\n>\n> Nous verrons cela demain.\n>\n>\n>\n> Pour la perceuse, je n'avais pas vu la tienne, elle est lÃ , sur le lit,\n> ainsi qu'une boÃ®te Ã  outils qui fait rÃªver... Mais il y a peu Ã  faire,\n> Romaric m'aidera avec la sienne.\n>\n>\n>\n> Je vais donc contacter la jardinier demain pour engrais+dÃ©sherbant, et le\n> payer.\n>\n>\n>\n> J'ai parlÃ© avec Fijalkowski pÃ¨re et fils. Vont envoyer un plombier pour le\n> syphon de l'office, et l'adduction d'eau Ã  la cuisine.\n>\n> Les gravas seront Ã©vacuÃ©s par le sÃ©jour, brouettes sur planches, pour ne\n> rien dÃ©grader.\n>\n> Confirme moi que Joan a la clÃ© du cadenas grille de devant.\n>\n>\n>\n> J'ai trouvÃ© les Ã©tiquettes plastique Ã  glissiÃ¨re pour identifier et\n> marquer les clÃ©s.\n>\n>\n>\n> J'ai Ã©vacuÃ© beaucoup des dossiers de papa, surtout les cours de mÃ©decine.\n> J'ai classÃ© les documen"
}