{
  "year": 2022,
  "seq": 71,
  "meta": {
    "date": "2022-03-08",
    "from": "maryvonne masseron-mandaba <maryvonnemm@hotmail.com>",
    "to": "\"y.mandaba@gmail.com\" <y.mandaba@gmail.com>, Marc MANDABA",
    "subject": "DÃ©cÃ¨s"
  },
  "proposals": [],
  "raw_excerpt": "ðŸ—• Date : 2022-03-08\nðŸ‘¤ From : maryvonne masseron-mandaba <maryvonnemm@hotmail.com>\nðŸ“¨ To   : \"y.mandaba@gmail.com\" <y.mandaba@gmail.com>, Marc MANDABA\n\t<marcmandaba@hotmail.com>\nðŸ§• Subject : DÃ©cÃ¨s \n---\nBonjour,\nCe matin, chez Marie-Odile Oumar, j'ai tlphon  Yangue, pour savoir s'il voulait parler  l'pouse de Alphonse Oumar, le dfunt.\nIl m'a rpondu que non, tant lui-mme touch par un deuil. Sandrine a perdu la maman de son compagnon. Christian tait  la place mortuaire.\nLes obsques de A Oumar taient dans l'intimit. La famille de Oumar reprsente par 3 enfants de son frre Adriss. Des amis d'enfance et du lyce.\nEt la famille de Marie-Odile, dans le village de laquelle ils avaient fait construire une maison.\nIls avaient vcu en Cte d'Ivoire, BAD. Venus  Bangui en 1983 en vacances. Retraite en France 2001. Revenus en vacances en RCA pendant que j'y tais en 2003, sauf la maman et l'an trs handicap.\nJe viens de rentrer. 450 kms.\nVous pouvez mettre un mot de condolances  votre oncle.\nMaman\n\nTlcharger Outlook pour Android"
}