{
  "year": 2022,
  "seq": 192,
  "meta": {
    "date": "2022-10-26",
    "from": "maryvonne masseron-mandaba <maryvonnemm@hotmail.com>",
    "to": "\"y.mandaba@gmail.com\" <y.mandaba@gmail.com>, marcmandaba",
    "subject": "Fwd: 20221026 photos Maison Peinture"
  },
  "proposals": [],
  "raw_excerpt": "ðŸ—• Date : 2022-10-26\nðŸ‘¤ From : maryvonne masseron-mandaba <maryvonnemm@hotmail.com>\nðŸ“¨ To   : \"y.mandaba@gmail.com\" <y.mandaba@gmail.com>, marcmandaba\n\t<marcmandaba@gmail.com>, MYM MANDABA SCI <mymmandaba@gmail.com>\nðŸ§• Subject : Fwd: 20221026 photos Maison Peinture\n---\nBonsoir,\n\nLe travail de Romaric est soign,\nLa 2eme couche sera avec un gris non bleut.\nLes nouveaux pots sont arrivs  la maison. La 2eme couche sera commence demain.\n\nMarc, ton cadeau d'anniversaire, les housses de siges taient indispensables, et ont dj prouv leur efficacit. Impermables, et protgent de la poussire de latrite.\n\nDsole, mais  chaque fois que je vais au Cabinet, je suis dmoralise. J'ai honte de ce que le lieu est devenu. Et due que les personnes qui y travaillent ne ralisent pas la dchance. Donc, avec Romaric, nous restaurons l'extrieur. Quand je reviendrai avec Marc, si aucune amlioration intrieure n'est ralise, comme il l'a dit, tout le monde dehors, et on reprend les contrats de bail avec eux ou sans eux.\n\nLes dernires grosses pluies sont survenues ce soir.\nMes oiseaux chantent le matin.  6h.\nFatigue +++\n\nMarc doit commencer  rcapituler les tapes de ma fin de sjour =\nCadenas grille devant\nCadenas grille derrire\nEn fait je n'ai qu'une cl pour chaque.\n\nVu les Fijalkowski ce midi =\nLes gravas seront vacus par devant, terrasse, avec des planches pour pargner les marches.\nLes cls devant et derrire seront confies  Joan, qui a dj la cl de derrire.\nLes autres cls seront dans le bar. La cl du bar est dj sur le porte-cl de la voiture. Toutes les cls ont une tiquette.\n\n\n\n\n\nTlcharger Outlook pour Android\n________________________________\nFrom: maryvonne masseron-mandaba\nSent: Wednesday, October 26, 2022 1:51:19 PM\nTo: marcmandaba ; Y.mandaba@hotmail.com ; mymmandaba \nSubject: 20221026 photos Maison Peinture\n\n\n\n\nTlcharger Outlook pour Android"
}