{
  "year": 2022,
  "seq": 93,
  "meta": {
    "date": "2022-03-23",
    "from": "maryvonne masseron-mandaba <maryvonnemm@hotmail.com>",
    "to": "Yannick Mandaba <y.mandaba@gmail.com>",
    "subject": "Re: A me traduire, oralement, demain, merci. ( texte de Ratmanski, chorÃ©graphe russe vivant aux USA)"
  },
  "proposals": [],
  "raw_excerpt": "ğŸ—• Date : 2022-03-23\nğŸ‘¤ From : maryvonne masseron-mandaba <maryvonnemm@hotmail.com>\nğŸ“¨ To   : Yannick Mandaba <y.mandaba@gmail.com>\nğŸ§• Subject : Re: A me traduire, oralement, demain, merci. ( texte de Ratmanski, chorÃ©graphe russe vivant aux USA)\n---\nMerci pour la traduction, je ne l'avais pas vue... Je ne sais pas utiliser mon traducteur pour de longs textes.\n\nTÃ©lÃ©charger Outlook pour Android\n________________________________\nFrom: maryvonne masseron-mandaba \nSent: Wednesday, March 23, 2022 7:55:29 AM\nTo: Yannick Mandaba \nSubject: Re: A me traduire, oralement, demain, merci. ( texte de Ratmanski, chorÃ©graphe russe vivant aux USA)\n\nJ'ai demandÃ© une traduction, pas du bla bla anti amÃ©ricain. Tu as, encore, perdu ton temps, et le mien. TÃªtu !\n\nTÃ©lÃ©charger Outlook pour Android\n________________________________\nFrom: Yannick Mandaba \nSent: Tuesday, March 22, 2022 11:54:54 PM\nTo: maryvonne masseron-mandaba \nSubject: Re: A me traduire, oralement, demain, merci. ( texte de Ratmanski, chorÃ©graphe russe vivant aux USA)\n\nDonc comme c'est bien dit La Douma a approuvÃ© l'opÃ©ration anti avancÃ©e de l'OTAN.aux portes de la Russie par Putin...?\n\nDe l'autre cÃ´tÃ© la Van Der L n'a pas demandÃ© Ã  qui conque avant d'envoyer des armes et prendre part au conflit. Ni pour couper RT et Sputnik dans toute l'Europe.\nEt on traite Putin de dictateur....\n\n Le dictat de l'Europe qui engage ses membres dans un conflit sans leur demander et qui censure.\n\nEnsuite on parle de propagande. Elle est des 2 cÃ´tÃ©s. AprÃ¨s l'Ã©lection de Macron, le traitement des GJ on sais qu'elle est trÃ¨s forte dans les mÃ©dias de NOS oligarques aussi\n\nEn gÃ©nÃ©ral il me semble que l'on vote les guerres Ã  l'assemblÃ©e en France, et qu'il y a la libertÃ© de la presse.\n\nC'est passÃ© oÃ¹ tout Ã§a ?\nLes violons de cet article engagÃ© ignorent que des accords sont violÃ©s au dÃ©part de l'histoire. L'agression des USA est constante et depuis le dÃ©part ont maintenu l'OTAN pour agresser la Russie. Tous les dirigeants Russes ont dÃ©plorÃ© ce choix et ont prÃ©dit que ce jour viendrai.\n\nStop au lavage de cerveau. On sais qui est le chien mÃ©chant dans cette cour. C'est celui qui eguise ses dents et fait des ronds autour de sa prochaine victime.\n\nJe veux bien condamner cette invasion si les USA s'excusent pour celle de Cuba. Les Ukrainiens n'avaient qu'Ã  respecter les traitÃ©s et ne pas croire qu'ils pouvaient pisser sur les nez de Poutine en se cachant derriÃ¨re l'Ã©paule des USA.\n\nCe schÃ©ma existe depuis le bac Ã  sable. Tout le monde connaÃ®t.\n\n\n\nOn Wed, Mar 23, 2022, 4:36 AM maryvonne masseron-mandaba > wrote:\nâ€¼ï¸ My view on the â€˜cancellationâ€™ of Russian culture:\n\nIn 2014, more than 500 prominent cultural figures (cinema, theater, TV, pop, opera, ballet, literature, arts, science, sport etc), including big ballet personalities like Vyacheslav Gordeyev, Marina Leonova, Nikolay Tsiskaridze, Svetlana Zakharova, Ivan Vasiliev, and also Valery Gergiev, Vladimir Urin, Sergei Danilian, Vladimir Kekhman, Elena Scherbakova - signed a letter of support for Putin's annexation of Crimea. After this letter, every performance or any public action of these 500, could be seen as an act of propaganda. Especially those who have gone on to perform in the West. These people have made a strong political statement supporting their President's unlawful actions. They are playing politics and therefore should be held responsible or at least asked serious questions.\nIt is precisely because of the support of the most visible figures of Russian culture that Putin gained his unlimited power and now is using it against humanity in this bloody war that is destroying Ukraine. The 2018 list of Putin 'representatives' ('doverennye litsa') included hundreds of the biggest names in sport and culture, Boris Eifman, Tsiskaridze and Zakharova among them. Sergei Polunin and Andrei Uvarov took over high administrative positions in Sevastopol in occupied Crimea. Many celebrities are serving as members of the State Duma, whose unanimous vote gave Putin formal righ"
}