{
  "year": 2022,
  "seq": 102,
  "meta": {
    "date": "2022-04-09",
    "from": "maryvonne masseron-mandaba <maryvonnemm@hotmail.com>",
    "to": "Yannick Mandaba <y.mandaba@gmail.com>",
    "subject": "Re: Je partage Â« T2 LeÃ¬a 5e Â»"
  },
  "proposals": [],
  "raw_excerpt": "ğŸ—• Date : 2022-04-09\nğŸ‘¤ From : maryvonne masseron-mandaba <maryvonnemm@hotmail.com>\nğŸ“¨ To   : Yannick Mandaba <y.mandaba@gmail.com>\nğŸ§• Subject : Re: Je partage Â« T2 LeÃ¬a 5e Â»\n---\nTimidit Familiale...\nEt encore, elle a fait des progrs dans sa participation aux cours, ce qui est not !!!\n\nAujourd'hui c'est l'anniversaire de Ccile. 45 ans. J'ai fait livrer des fleurs et un champagne. J'irai dner ce soir. Demain dimanche, fte des Rameaux, je les accompagnerai  l'glise St Julien, car il y a leur prparation, au baptme pour Maxime, et  la 1re communion pour La. Ccile est contente que je vienne, en l'absence de Marc. Il sera de retour pour leurs congs scolaires.\n\nTlcharger Outlook pour Android\n________________________________\nFrom: Yannick Mandaba \nSent: Saturday, April 9, 2022 6:18:57 AM\nTo: maryvonne masseron-mandaba \nSubject: Re: Je partage  T2 Lea 5e \n\nSuperbe tableau.\nQue se passe t il en sport ? Va a l'air moi tout a\n\nOn Sat, Apr 9, 2022, 2:39 AM maryvonne masseron-mandaba > wrote:\n\n\nTlcharger Outlook pour Android"
}