{
  "year": 2022,
  "seq": 33,
  "meta": {
    "date": "2022-11-23",
    "from": "maryvonne.masseron@free.fr",
    "to": "Marc MANDABA <marcmandaba@hotmail.com>",
    "subject": "ReÂ : Update Bangui 22/11/22"
  },
  "proposals": [],
  "raw_excerpt": "ğŸ—• Date : 2022-11-23\nğŸ‘¤ From : maryvonne.masseron@free.fr\nğŸ“¨ To   : Marc MANDABA <marcmandaba@hotmail.com>\nğŸ§• Subject : ReÂ : Update Bangui 22/11/22\n---\nMarc, \nMerci pour la mise au point. \nMerci pour les photos. \nPour les voitures, OK, pour l'acheteur, OK pour les dispositions, mais pour le produit de la vente, on peut encore discuter. \nPour la peinture Agrisol grise, il faut l'utiliser, et ne pas la conserver, elle s'abimera. Il y a un nuancier Ã  Socap, que l'on ne m'avait pas prÃ©sentÃ© Ã  ma premiÃ¨re commande. Cette peinture est chÃ¨re, mais le Durcisseur qu'il\nfaut ajouter, pour un effet protecteur, est plus cher encore. Donc tu peux l'utiliser pour les murs, et le bas de ta maison si tu v\n\nmaryvonne masseron - 41 rue du puits-mauger 35000 rennes 0299302000 0680078113"
}