{
  "year": 2022,
  "seq": 12,
  "meta": {
    "date": "2022-09-12",
    "from": "maryvonne masseron-mandaba <mymmandaba@gmail.com>",
    "to": "\"y.mandaba@gmail.com\" <y.mandaba@gmail.com>,",
    "subject": "---"
  },
  "proposals": [
    {
      "index": -12,
      "etiquette": "Frais d'Ã©cole / bus Tristan",
      "category": "MIN",
      "duration": "LT",
      "source": "AI",
      "score": 1,
      "matched_from": [
        "ai_new"
      ]
    }
  ],
  "raw_excerpt": "ğŸ—• Date : 2022-09-12\nğŸ‘¤ From : maryvonne masseron-mandaba <mymmandaba@gmail.com>\nğŸ“¨ To   : \"y.mandaba@gmail.com\" <y.mandaba@gmail.com>, \n\tWadeekanya Soonthornsingha <beebeau89@hotmail.com>\nğŸ§• Subject : \n---\nBonjour,&nbsp;Je regrette de ne pas avoir reÃ§u de rÃ©ponse Ã  mon courriel du 6 septembre.Que Bee lise soigneusement, il y a un bon traducteur chez Google.&nbsp;Depuis le 6 septembre, jour oÃ¹ le son de son tÃ©lÃ©phone Ã©tait Ã©teint, nous nâ€™avons pas eu de conversation normale. Soit il Ã©tait fatiguÃ©, soit il Ã©tait Ã©nervÃ©. Le 7, 8, 9 il a raccrochÃ©, de faÃ§on impolie.Il dit quâ€™il a droit de raccrocher si je fais des critiques de ses parents.&nbsp;Câ€™est le retour de lâ€™enfant-roi.&nbsp;Je ne lâ€™ai jamais critiquÃ©, lui. Je lâ€™encourage toujours.Dâ€™ailleurs, jusquâ€™au 27 aout, il a fait un excellent travail de gÃ©ographie.&nbsp;AprÃ¨s les 6 jours de lâ€™anniversaire&nbsp;!!! il a perdu le lien avec la langue franÃ§aise, et câ€™est NORMAL.&nbsp;Donc câ€™est difficile pour lui, de penser en 3 langues, je veux bien le croire.&nbsp;Sâ€™il avait Ã©tÃ© autorisÃ© Ã  passer un mois de vacances en France, il aurait eu un bain linguistique et culturel, qui lui aurait facilitÃ© sa rentrÃ©e scolaire.&nbsp;Vous voudrez bien lui expliquer que je ne critique personne, que je donne des conseils en tant que mamie et mÃ©decin-pÃ©diatre.&nbsp;Jâ€™attends une rÃ©ponse de Bee pour continuer mon aide.&nbsp;Les conditionsQue vous soyez strict avec luiQuâ€™au retour de lâ€™Ã©cole, il y aura un gouter, une petite sieste, zÃ©ro Ã©cran, un peu de dessin ou de basket avec papa, un peu de piano avec maman. Et ensuite que lâ€™un des parents mâ€™appelle pour le franÃ§ais.Que lâ€™on dise Ã  Tristan que câ€™est un cadeau que mamie lui fait en passant du temps avec lui. Mamie en est contente, mais nâ€™est pas obligÃ©e de le faire. Tristan non plus nâ€™est pas obligÃ©, mais il peut sâ€™exprimer, sans se fÃ¢cher, sâ€™expliquer de faÃ§on honnÃªte, sans manipuler, pour fixer le programme, les heures, la durÃ©e.Se rappeler quâ€™il ne faut jamais mentir Ã  un enfant, comme on apprend au catÃ©chisme, ni en pensÃ©e, ni en paroles, ni en action, ni en omission.&nbsp;&nbsp;EnvoyÃ© Ã  partir de Courrier pour Windows&nbsp;\nSans virus.www.avg.com"
}