{
  "year": 2022,
  "seq": 129,
  "meta": {
    "date": "2022-05-01",
    "from": "maryvonne masseron-mandaba <maryvonnemm@hotmail.com>",
    "to": "Yannick Mandaba <y.mandaba@gmail.com>",
    "subject": "Re: Tristan 220429"
  },
  "proposals": [],
  "raw_excerpt": "ðŸ—• Date : 2022-05-01\nðŸ‘¤ From : maryvonne masseron-mandaba <maryvonnemm@hotmail.com>\nðŸ“¨ To   : Yannick Mandaba <y.mandaba@gmail.com>\nðŸ§• Subject : Re: Tristan 220429\n---\nMoi, je ne te reproche pas de ne pas sortir. Mais de ne pas donner  ton enfant une vie d'enfant de 8 ans\n\n....\n\nTlcharger Outlook pour Android\n________________________________\nFrom: Yannick Mandaba \nSent: Sunday, May 1, 2022 12:13:25 PM\nTo: maryvonne masseron-mandaba \nSubject: Re: Tristan 220429\n\nJe suis honnte avec lui. Je lui ai dit que je n'avais pas la force d'organiser quelque chose.\n\nSur le statu social je lui dit que Papa n'a pas toujours de l'argent liquide, mais que lui Tristan n'est pas pauvre car ces grandparents lui laisseront des terrains, appartement ou maison qui valent beaucoup mes ce n'est pas de l'argent  utiliser.\nQue Tonton Marc travaille pour rnover sa maison en Afrique.\n\nAprs sur la marginalit, on n'est pas des expats. Donc ses copains Franco-thai il y en a 4 enfants de les amis.\nAprs il y a des enfants de vieux Franais maris avec des jeunes Tha inintressantes qui eux mme se marginaliser mme s'ils ont des sous.\nLes couples spars, o c'est pas trs chouette.\nLes expats qui sont  70% RN et qui ne nous apportent rien, ou les autres comme ses ami Zin et Safi. 2 ans ici et do t au Japon...\n\nMais oui mes amis me reprochent de ne pas sortir plus.\nIls sont sans famille ou riche comme Guichard...  Ou salaris sans enfants\n\n\n\nOn Sun, May 1, 2022, 4:49 PM maryvonne masseron-mandaba > wrote:\nJe te redis\n1 je ne supporte pas l'ide que Bee cherche toujours la bagarre, et que cela devient un mode de communication familiale. Au bureau, si tu lui explique qqch elle demande pourquoi jusqu' vouloir avoir raison, et puisement du sujet.\nTristan agit pareil maintenant, pression, chantage, opposition, conditions multiples, jusqu' ce que chacun oublie le but de la conversation.\nC'est une faute de fonctionnement mental, qui va lui nuire dans ses tudes.\n2 il est addict sur internet. La faute  qui, je ne sais pas. Toujours est-il que je me suis beaucoup implique, pour le dtourner de cela.\nMais, du fait de votre ge, et de vos soucis, vous tes faibles, devant lui. Il vous contourne sans cesse.\nChaque mois, les rgles changent, car vous acceptez son chantage.\nL'histoire de Roblox est un bon exemple. Je suis implique dedans.\nIl n'a pas d'amis, du fait de votre mode de vie de marginaux.\nDu coup, il pense, et vous fait penser que c'est,  cause de mamie, (ennemie culturelle, et fire de l'tre), qui l'empche d'tre avec ses copains sue Roblox...\nMais non, c'est une faon de vous dire qu'il est mis  part, car il ne vit pas comme les autres enfants de son cole.\nJe le sais trs bien, car j'ai vcu la mme chose, avec vous  Bangui. Sauf que moi je veillais sur votre cursus scolaire +++. Mme Virginie Mongonou m'a dit rcemment qu'elle tait tonne de la faon dont vous avez volu, du fait de votre vie d'enfants pauvres  Bangui...\n\nDonc, c'est pour te dire que je connais bien la difficult de ta vie,\nQue je sais la faon dont tu dois t'occuper de Tristan,\nQue tu peux couter mes conseils, dsintresss, et si tu penses que j'ai besoin de voir Tristan chaque jour pour tre heureuse, tu te trompes, j'ai des amies, j'aime aller  St malo chaque jour, et il fera beau jusqu'au 30 octobre !!!\nMais que j'ai du mal  comprendre comment des parents d'un enfant gentil et intelligent, peuvent l'inclure dans des querelles d'adultes.\n\nEn tant que pdiatre, je ne supporte pas les svices moraux  un enfant. En tant que mamie, encore moins.\n\nTu dois la vrit  Tristan,  chaque moment, sur chaque chose. Sinon il raisonne dans le brouillard.\n\nSi tu n'as pu lui donner des vacances de Pques intressantes, tu dois lui dire, non pas \"je suis fatigu\", ce qui alimente sa dpression, en le faisant s'inquiter pour toi, mais \"nous n'avons pas mis de l'argent de ct pour cela\".\n\nLa relle difficult est sa mre, qui se comporte encore en enfant gte. Elle n'a pas uvr pour avoir un travail, ni obtenir la reconnaissance de sa famille.\nElle doit fai"
}