{
  "year": 2022,
  "seq": 148,
  "meta": {
    "date": "2022-06-16",
    "from": "maryvonne masseron-mandaba <maryvonnemm@hotmail.com>",
    "to": "LFIB Comptabilite <kingkan.k@lfib.ac.th>",
    "subject": "Re: ScolaritÃ© MANDABA Tristan CE2"
  },
  "proposals": [],
  "raw_excerpt": "ðŸ—• Date : 2022-06-16\nðŸ‘¤ From : maryvonne masseron-mandaba <maryvonnemm@hotmail.com>\nðŸ“¨ To   : LFIB Comptabilite <kingkan.k@lfib.ac.th>\nðŸ§• Subject : Re: ScolaritÃ© MANDABA Tristan CE2\n---\nBonjour, monsieur le comptable.\nMerci de prendre en compte ce virement de 1600 euros (=59000 Tha baths).\nJe vous envoie le document bancaire de ma banque, la Socit Gnrale.\n\nMerci de m'diter un reu.\n\nMerci aussi de me faire un tat comptable de la situation, que j'ignore, car vos dcomptes et reus ne sont pas clairs pour moi.\nMon fils me disait avoir acquitt certains paiements, mais je ne les vois pas. Peut-tre n'a t'il pas pu les faire, faute de revenus ?\n\nQue reste-t-il  verser ?\nY compris la rinscription pour 22-23\n\nJe vous remercie\nCordialement\nMaryvonne Mandaba Masseron\nmaryvonnemm@hotmail.com\nWhatsApp 0783359723\n\nTlcharger Outlook pour Android\n________________________________\nFrom: LFIB Comptabilite \nSent: Friday, April 8, 2022 9:17:18 AM\nTo: maryvonne masseron-mandaba \nCc: y.mandaba@gmail.com \nSubject: Re: Scolarit MANDABA Tristan CE2\n\nBonjour,\nNous vous remercions pour votre paiement.\nVous trouverez ci-joint les deux reus souhaits.\nVous souhaitant une bonne journe.\nBien cordialement,\n\nOn Tue, Apr 5, 2022 at 4:34 PM maryvonne masseron-mandaba > wrote:\nBonjour,\nVeuillez trouver les documents justificatifs du paiement de la scolarit de mon petit-fils\n\n Tristan MANDABA PRIMAIRE CE2 b.\n\nCe virement de 600 euros, au 4 avril 2022,\nFait suite au virement de 600 euros, au 2 fvrier 2022,\nMerci de me faire parvenir le reu de ces 2 virements.\n\nCordialement\nMaryvonne Mandaba\n\n\nTlcharger Outlook pour Android"
}