{
  "year": 2022,
  "seq": 17,
  "meta": {
    "date": "2022-10-18",
    "from": "MYM MANDABA SCI <mymmandaba@gmail.com>",
    "to": "Yannick Mandaba <y.mandaba@gmail.com>, marcmandaba <marcmandaba@gmail.com>",
    "subject": "Tout le monde √† bien travaill√©"
  },
  "proposals": [
    {
      "index": -17,
      "etiquette": "Achat m√©tal (argent) pour prod",
      "category": "MIN",
      "duration": "LT",
      "source": "AI",
      "score": 1,
      "matched_from": [
        "ai_new"
      ]
    }
  ],
  "raw_excerpt": "üóï Date : 2022-10-18\nüë§ From : MYM MANDABA SCI <mymmandaba@gmail.com>\nüì® To   : Yannick Mandaba <y.mandaba@gmail.com>, marcmandaba <marcmandaba@gmail.com>\nüßï Subject : Tout le monde √† bien travaill√©\n---\nLes pbs en suspens =\nLe serrurier inefficace\nRomaric ok voir photo\nJuliana ok elle comprend vite et bien\nLe chauffeur ok super\nRichard ok ( il fait venir la tron√ßonneuse demain, a coiff√© le palmier √†\nl'angle rue-Epaye, car je ne sais pas si Marc veut l'abattre, le terminalia\na deux sortes de parasites, des larges feuilles et des jets, et demain\nRichard s'en occupera selon les directives ;des 2 manguiers vers la banque,\nl'un √† des champignons, donc il faut l'abattre, photo, et aussi couper chez\nle jumeau de grosses branches qui vont chez le voisin, en plus l'√©teter)\n\nEnerca, coincidence, sont pass√©s, comme dans tout le quartier, pour sortir\nle compteur, prepaiement, sera accroch√© au poteau m√©tallique o√π nous avons\njustement bien √©lagu√© ce matin. Je dois aller demain matin dans leur\nservice commercial, pour mettre √† jour le dossier administratif, et payer\nles c√¢bles pour ce faire. Il y aura une t√©l√©commande pour g√©rer le compteur.\n\nBonne soir√©e"
}