{
  "year": 2022,
  "seq": 46,
  "meta": {
    "date": "2022-09-23",
    "from": "Yannick Mandaba <y.mandaba@gmail.com>",
    "to": "maryvonne masseron-mandaba <maryvonnemm@hotmail.com>",
    "subject": "Re: J'en suis restÃ©e lÃ "
  },
  "proposals": [
    {
      "index": -46,
      "etiquette": "Dossier de bourse Tristan",
      "category": "MIN",
      "duration": "LT",
      "source": "AI",
      "score": 1,
      "matched_from": [
        "ai_new"
      ]
    },
    {
      "index": -46,
      "etiquette": "Paiements via Western Union",
      "category": "MIN",
      "duration": "LT",
      "source": "AI",
      "score": 1,
      "matched_from": [
        "ai_new"
      ]
    },
    {
      "index": -46,
      "etiquette": "Frais d'Ã©cole / bus Tristan",
      "category": "MIN",
      "duration": "LT",
      "source": "AI",
      "score": 1,
      "matched_from": [
        "ai_new"
      ]
    }
  ],
  "raw_excerpt": "ðŸ—• Date : 2022-09-23\nðŸ‘¤ From : Yannick Mandaba <y.mandaba@gmail.com>\nðŸ“¨ To   : maryvonne masseron-mandaba <maryvonnemm@hotmail.com>\nðŸ§• Subject : Re: J'en suis restÃ©e lÃ \n---\nDÃ©solÃ© pour l'insulte mais franchement...\n\nLa cantine j'ai reÃ§u une facture Ã©norme. Sache que la cantine et la\nscolaritÃ© sont sÃ©parÃ©s.\nAES est dans les frais scolaires pour les rappels et , pas la cantine.\n\nPar contre mÃªme avec la bourse je trouve que cela reste cher la cantine\nmais bon c'est cumulÃ©.... Ils ont changÃ© de traiteur et je crois c'est un\npeu trop haut de gamme, votÃ©, adoptÃ©.\nTristan dit que c'est super, tout le monde adorÃ©, ya intÃ©rÃªt.\nOÃ¹ alors la bourse ne couvrait pas la cantine l'annÃ©e derniÃ¨re.\n\nBon je vais juste te montrer l'email s'il est dans mon tÃ©l ..il y a une\nfacture Ã  jour donc bon...mais n'attaque pas le Monsieur. Ils essayent\nd'Ãªtre gentils et enfin de prendre en compte ses rÃ©sultats.\n Tristan est cÃ©lÃ¨bre Ã  l'Ã©cole. Pas pour le travail mais sa personnalitÃ© et\nses cheveux bouclÃ©s pour les dames du staff... Parfois il y a des parents\njaloux et des histoires il faut avoir le soutien du personnel.\nAussi le directeur d'Ã©tablissement a une voie importante pour le vote des\nbourses au conseil centralisÃ© 2 fois par an pour toute la France.\nOn ne s'efface pas mais bon restons aimables et patients avec la compta.\n\n\nMouais je crois que les fous c'est toi et moi. Toi tu es un paranoÃ¯aque\navec des tendances narcissique (imaginer, contrÃ´ler, manipuler)\nMoi, moins nÃ©vrosÃ© je pense. Je suis associale du moins je prÃ©fÃ¨re Ãªtre\nseul, et zÃ©ro auto-discipline. Typique du gamin douÃ© livrÃ© Ã  lui-mÃªme qui\nn'a jamais appris Ã  travailler la dame en a parlÃ© en me regardant fixement\net elle a dit c'est le danger numÃ©ro 1 pour tous les enfants un peu douÃ©s\nmÃªme en dessous du niveau de Tristan.\n\nTransmettre ce qu'on ne procÃ©dÃ© pas c'est dur.\n\nAutant je n'accepte pas que Marc ne parle pas Ã  sa mÃ¨re, qui ne l'a quand\nmÃªme pas laissÃ© sur le pas d'une porte, autant tu ne dois pas nous monter\nl'un contre l'autre.\nTiens je viens de voir l'histoire du fils cachÃ© d Alain Delon ... sordide\n\nComme je dis Ã  Marc. Faut pas Ãªtre triste de ne pas faire des projets\nensembles etc.\nOn vient du pays le plus pauvre du monde. On a de beaux enfants, la santÃ©,\napparente du moins, lui en plus il a plein de sous...il est pas fou et\ns'est trop endurcis c'est le prix qu'il paye.\n\nMoi c'est le manque de, sommeil qui me tue depuis toujours. Depuis Bangui\nj'ai des insomnies, Ã§a n'arrÃªte pas dans ma tÃªte  mÃªme si je me lÃ¨ve tÃ´t je\nne peux dormir que d'Ã©puisement.\nIl faudrait que je cours tous les jours peut-Ãªtre...les bonnes habitudes...\n\nIl est 5 heure...Paris...je n'ai pas sommeil\n\nOn Fri, Sep 23, 2022, 4:08 AM maryvonne masseron-mandaba  wrote:\n\n> Tu peux rÃ©diger en franÃ§ais correct, afin que je comprenne.\n> La cantine, les aes, les transports, la scolaritÃ©, j'ai tout payÃ© jusqu'Ã \n> fin 2022.\n> EssayÃ© de prendre attache avec la cfe, pour assurance et retraite. Je\n> paierai.\n>\n> Cesse tout contact avec Marc, ce sera mieux pour ta sÃ©rÃ©nitÃ©, il est fou.\n> Je m'en occupe.\n>\n> Occupe toi de ton travail, et de Tristan.,\n>\n> TÃ©lÃ©charger Outlook pour Android \n> ------------------------------\n> *From:* Yannick Mandaba \n> *Sent:* Thursday, September 22, 2022 10:26:29 PM\n> *To:* maryvonne masseron-mandaba \n> *Subject:* Re: J'en suis restÃ©e lÃ \n>\n> C'est moi qui dÃ©cide de quoi Tristan a besoin en prioritÃ©.\n> LÃ  ce sera la cantine en retard de 1 an, ou l'assurance. Je ne sais mÃªme\n> pas si on est assurÃ©s encore mais sans courrier d'Ã©radication je suppose\n> que oui. Sa carte a expirÃ© en avril dernier.\n>\n> Si cela ne te plaÃ®t pas tu peux garder ton aide inutile.\n>\n> On a subit un vol assez important il y a quelques semaines. Et on est au\n> creux de la vague aprÃ¨s le remplacement des 139 bagues. Bref.\n>\n> Tristan fait du sport avec moi tous les jours. C'est quoi encore ce\n> nouveau fantasme ?\n>\n>\n> Si on ne manquait de rien d'essentiel on n'aurait pas besoin de ton aide.\n> C'est pas possible d'Ãªtre con Ã  ce "
}