{
  "year": 2022,
  "seq": 36,
  "meta": {
    "date": "2022-06-15",
    "from": "maryvonne.masseron@free.fr",
    "to": "Yannick Mandaba <y.mandaba@gmail.com>",
    "subject": "ReÂ : Re: Loyer labo"
  },
  "proposals": [
    {
      "index": -36,
      "etiquette": "Frais d'Ã©cole / bus Tristan",
      "category": "MIN",
      "duration": "LT",
      "source": "AI",
      "score": 1,
      "matched_from": [
        "ai_new"
      ]
    }
  ],
  "raw_excerpt": "ğŸ—• Date : 2022-06-15\nğŸ‘¤ From : maryvonne.masseron@free.fr\nğŸ“¨ To   : Yannick Mandaba <y.mandaba@gmail.com>\nğŸ§• Subject : ReÂ : Re: Loyer labo\n---\nCe n'est pas inutile... \n\nEn histoire, les programmes ont Ã©liminÃ© l'Ã©tude de la shoa. Il n'y aurait pas eu le dÃ©portation des juifs, 6 millions, ni camps de concentration, ni camps d'extermination. \nJ'ai offert \"Le journal d'anne Franck\" Ã  LÃ©a. Non lu. CensurÃ©. Trop triste. \n\nEn sciences, le niveau est trÃ¨s bas. \n\nEn maths, le manque de professeurs fait que certaines classes de collÃ¨ge et de lycÃ©e n'ont pas de maths au programme. La France est avant dernier de l'Europe en niveau de math. \n\nJe suis AbonnÃ©e au Journal des enseignants. J'ai des prof de LycÃ©e dans mes amies. Il est Ã©vident qu'en attendant que l'Ã©tat rÃ©agisse, les parents doivent supplÃ©er ces lacunes. \n\nJe suis consciente de cela. Des bonnes notes Ã  l'Ã©cole ne me suffisent pas. \n\nDe plus, je suis d'une famille oÃ¹ toute la fratrie a Ã©tÃ© traitÃ©e en bloc, et ai dÃ» me faire un chemin Ã  travers les journaux, et les revues auxquelles ma tante ( Juliette = qui avait Ã©tÃ© au lycÃ©e d'Ã©tat) abonnait son frÃ¨re, mon pÃ¨re, et elle m'a poussÃ© bien haut. Merci Ã  elle. \nmaryvonne masseron - 41 rue du puits-mauger 35000 rennes 0299302000 0680078113"
}