{
  "year": 2022,
  "seq": 42,
  "meta": {
    "date": "2022-12-27",
    "from": "maryvonne masseron-mandaba <maryvonnemm@hotmail.com>",
    "to": "\"y.mandaba@gmail.com\" <y.mandaba@gmail.com>",
    "subject": "La bourse de Tristan"
  },
  "proposals": [
    {
      "index": -42,
      "etiquette": "Dossier de bourse Tristan",
      "category": "MIN",
      "duration": "LT",
      "source": "AI",
      "score": 1,
      "matched_from": [
        "ai_new"
      ]
    }
  ],
  "raw_excerpt": "ðŸ—• Date : 2022-12-27\nðŸ‘¤ From : maryvonne masseron-mandaba <maryvonnemm@hotmail.com>\nðŸ“¨ To   : \"y.mandaba@gmail.com\" <y.mandaba@gmail.com>\nðŸ§• Subject : La bourse de Tristan \n---\nBonsoir Yannick,\nBonsoir Marc,\n\nDu document reu ce soir,  ma demande, je constate que la bourse d'tudes de mon petit-fils, Tristan, n'est pas renouvele.\n\nL'Aefe accorde une aide pour la cantine...?\n\nNormalement, en cas de continuation de l'attribution de la bourse  73%, la somme  verser pour le T3 ne devrait tre que de 19 000 baths. (incluant  : Etudes, Cantine, Transport).\n\nLe dossier de demande de Bourse a-t-il t envoy en temps utile ?\nVos revenus ont-ils augment ?\n\nJe demande une explication.\nCar je souhaite une bonne scolarit pour cet enfant intelligent, mais en danger.\nJe souligne que j'assure le financement de ses tudes, et aussi un complment quotidien de culture franaise.\nCeci est le n1 d'un conseil de famille concernant Tristan.\n\nMMM\n\n\n\n\nTlcharger Outlook pour Android"
}