{
  "year": 2022,
  "seq": 35,
  "meta": {
    "date": "2022-06-12",
    "from": "maryvonne.masseron@free.fr",
    "to": "'Marc MANDABA' <marcmandaba@hotmail.com>,",
    "subject": "TRÂ : ?? L'hebdo de Pour la Science #99"
  },
  "proposals": [],
  "raw_excerpt": "ğŸ—• Date : 2022-06-12\nğŸ‘¤ From : maryvonne.masseron@free.fr\nğŸ“¨ To   : 'Marc MANDABA' <marcmandaba@hotmail.com>, \n\t'Yannick Mandaba' <y.mandaba@gmail.com>\nğŸ§• Subject : TRÂ : ?? L'hebdo de Pour la Science #99\n---\nLÃ©a est AbonnÃ©e Ã  \"pour la Science\" depuis aoÃ»t 2021. Elle a eu en cadeau les numÃ©ros d'Ã©tÃ©, et ensuite elle reÃ§oit tous les magazines, depuis le numÃ©ro 91, on en est au 99. A sa communion, elle n'en avait lu qu'un. On ne lui donne pas. Il parait qu'elle doit les dÃ©couvrir, avec ses parents, et avec Maxime. Lecture chaque 2 semaines. \nLes sÃ©jours en pays musulman favorisent-ils cette discrimination ?. \nPourquoi une jeune fille de 13 ans ne peut-elle pas lire seule une revue scientifique dÃ©diÃ©e aux jeunes Ã  partir de 12 ans ? \nContrÃ´le ? \nBoisseau ? \nDans ma famille, j'ai reÃ§u le message qu'un enfant doit Ãªtre conduit Ã  dÃ©passer ses parents. \nJe ne comprends pas. \n\n\n\n\nmaryvonne masseron - 41 rue du puits-mauger 35000 rennes 0299302000 0680078113"
}