{
  "year": 2022,
  "seq": 32,
  "meta": {
    "date": "2022-10-31",
    "from": "MYM MANDABA SCI <mymmandaba@gmail.com>",
    "to": "MYM MANDABA SCI <mymmandaba@gmail.com>, marcmandaba <marcmandaba@gmail.com>,",
    "subject": "22022 10 30 courrier / photos √† suivre"
  },
  "proposals": [
    {
      "index": -32,
      "etiquette": "Paiement salaires atelier",
      "category": "MIN",
      "duration": "LT",
      "source": "AI",
      "score": 1,
      "matched_from": [
        "ai_new"
      ]
    }
  ],
  "raw_excerpt": "üóï Date : 2022-10-31\nüë§ From : MYM MANDABA SCI <mymmandaba@gmail.com>\nüì® To   : MYM MANDABA SCI <mymmandaba@gmail.com>, marcmandaba <marcmandaba@gmail.com>, \n\tYannick Mandaba <y.mandaba@gmail.com>\nüßï Subject : 22022 10 30 courrier / photos √† suivre\n---\nVol\nQuitter la maison √† 11h00\nEnregistrement de 11h30 √† 14h30\nFormalit√©s police et douane >12h\nOn est autoris√© √† ressortir\nEmbarquement 15h/ vol 16h55\n\nCl√©s\nCadenas  de derriere √† Juan, ainsi que cl√© office- salle de s√©jour.\nCadenas de devant √† Jonhattan.\nLa cl√© de mr Bar est au trousseau de la voiture, depuis le d√©part de Marc.\nChanger ???. Elle n'a aucun identifiant... J'ai un double avec moi.\n\nArgent\n1 M en liquide sous le Connecticut. Merci √† Marc de me les renvoyer en\neuros pour payer mon billet de f√©vrier... 11-22 ou 9-24.\nPour les 600 milles, OK pour 1/2: pour Tristan, 1/2:pour L√©a et Maxime.\n\nFactures\n\nPaye de Romaric 250 000\nJ'avais n√©goci√© √† 225 000 ferme\nMais il a fait des choses en plus,\nEt il redoit l'argent des spots,\nOn reste √† 225\nLe hublot, je ne  suis pas au courant.\n\nPar contre il y a une 2 eme facture de peinture et durcisseur, √† cause de\nla peinture bleue qu'il avait appliqu√©e d'abord. J'ai rachet√© Durcisseur et\npeinture grise pour 820 mille moitie pour la maison 410 mille, et moiti√©\npour le cabinet, 410, j'ai eu un prix avantageux, pour le tout. Du coup il\nen reste pour les poteaux du sous-sol. Mais comme tu n'avais pas donn√© ton\naccord, cela reste en suspens. Je n'aimerais pas qu'il revienne apr√®s mon\nd√©part.\n\nPour le jardinier,\nLa facture √©tait 57 000 herbicide et 15 000 engrais. J'ai donn√© 47 000. (\n2/3 des produits et main d'≈ìuvre). Il devait revenir pour finir...\n\nLe serrurier a disparu, 15000 de mat√©riel au march√©, et 5000 de MO.\n\nLe plombier, √† ouvert la vanne ext√©rieure de l'alimentation eau cuisine. Je\nn'ai pas eu le temps de nettoyer le filtre Buron. Je bois l'eau de notre\npuits, sans aucun soucis.\nIl a r√©par√© le syphon de l'office, en changeant les pi√®ces, 16 500  de\nmat√©riel, et de MO.\n\nRichard, OK, travail pour 150 000,  restent √† abattre, 1 teck malade, celui\nqui est isol√©, et un palmier ( non urgent).\n\nPour la nourriture, je n'ai utilis√©, comme avec Marc, que les soupes\nasiatiques. Mais on n'en trouve pas ici. Par contre, il y a des plats\npr√©par√©s √† emporter, dans une moyenne surface, qui a un fast food, au fond\nde la cour, face √† ex-papyrus. En fait, pour √©conomiser le carburant, pain\net fromage.\n\nJuliana\nJe lui ai donn√© les 8000 que tu lui devais. Apres le 26 , je lui dois un\nsalaire de combien par jour.\nQuand elle part, je lui donne 2000 pour le transport, et combien lui\ndois-je encore. Elle travaille tous les jours.\n\nJef vient aussi, quand il ne travaille pas ailleurs... Car tout le bazar du\ncouloir vient du bureau de l'h√¥pital, il faut trier, jeter, nettoyer. C'est\nsans fin.\n\nJ'aurais d√ª finir tranquillement. Mais la nuit de samedi au dimanche, il y\na eu du rififi √† Bangkok, et j'ai pris le temps de calmer les\nprotagonistes. Nuit blanche.\n\n\n\n\n\n\n\n\n\nChambres √†  Bar"
}