{
  "year": 2022,
  "seq": 53,
  "meta": {
    "date": "2022-01-22",
    "from": "maryvonne masseron-mandaba <maryvonnemm@hotmail.com>",
    "to": "LFIB Comptabilite <kingkan.k@lfib.ac.th>",
    "subject": "Re: Ecolage MANDABA/MY008/IN000018838"
  },
  "proposals": [],
  "raw_excerpt": "ðŸ—• Date : 2022-01-22\nðŸ‘¤ From : maryvonne masseron-mandaba <maryvonnemm@hotmail.com>\nðŸ“¨ To   : LFIB Comptabilite <kingkan.k@lfib.ac.th>\nðŸ§• Subject : Re: Ecolage MANDABA/MY008/IN000018838\n---\nService comptable du LFIB,\nJe vous renvoie le document du paiement que j'ai fait pour l'ecolage de mon petit-fils Tristan MANDABA, en fin 2021,pour l'anne 2021-2022.\nJe ferai juste une remarque sur le libell de votre reu, du 1er trimestre 21-22, qui ne fait pas clairement apparaitre l'anne : 11/10/202\nVeuillez rectifier.\nNous sommes en retard, mais ferons face.\nCordialement\nMaryvonne Mandaba Masseron\n\nTlcharger Outlook pour Android\n\n________________________________\nDe : LFIB Comptabilite \nEnvoy : mardi 12 octobre 2021  04:03\n : maryvonne masseron-mandaba\nCc : daf@lfib.ac.th\nObjet : Re: Ecolage MANDABA/MY008/IN000018838\n\nBonjour,\nNous accusons bonne rception de votre message et vous en remercions.\nLe virement a t crdit sur le compte du LFIB avec un montant de 29,550 THB le 11/10/202 qui couvre bien la facture des frais de scolarit du 1er trimestre.\n\nBien cordialement,\n\n\n\n\nOn Mon, Oct 11, 2021 at 8:23 PM maryvonne masseron-mandaba > wrote:\nMessieurs,\nVeuillez trouver ci-joint le justificatif de virement fait le 7 octobre 2021,\nPour le reste  charge du 1er trimestre de mon petit-fils MANDABA Tristan\nclasse de CE2B,\n30000 baths\nCordialement\nMaryvonne Mandaba\n\nTlcharger Outlook pour Android"
}