{
  "year": 2022,
  "seq": 136,
  "meta": {
    "date": "2022-05-07",
    "from": "maryvonne masseron-mandaba <maryvonnemm@hotmail.com>",
    "to": "\"y.mandaba@gmail.com\" <y.mandaba@gmail.com>, Marc MANDABA",
    "subject": "---"
  },
  "proposals": [],
  "raw_excerpt": "ğŸ—• Date : 2022-05-07\nğŸ‘¤ From : maryvonne masseron-mandaba <maryvonnemm@hotmail.com>\nğŸ“¨ To   : \"y.mandaba@gmail.com\" <y.mandaba@gmail.com>, Marc MANDABA\n\t<marcmandaba@hotmail.com>\nğŸ§• Subject : \n---\nQuand les parents vieillissent...\n\nLaissez-les vieillir avec le mÃªme amour qu'ils vous ont fait grandir...\n\nLaissez-les parler et raconter Ã  plusieurs reprises des histoires avec la mÃªme patience et l'intÃ©rÃªt avec lesquels ils ont Ã©coutÃ© les vÃ´tres quand vous Ã©tiez enfant...\n\nLaissez-les gagner, comme ils vous ont souvent laissÃ© gagner..\n\nLaissez-les profiter des discussions avec leurs petits-enfants car ils vous voient en eux...\n\nLaissez-les vivre parmi les objets qui les ont accompagnÃ©s pendant longtemps, car ils souffrent en sentant que vous leur arrachez des morceaux de leur vie...\n\nLaissez-les se tromper, comme vous vous Ãªtes trompÃ© tant de fois...\n\nLaissez-les vivre et essayez de les rendre heureux sur le dernier chemin qui leur reste Ã  parcourir, de la mÃªme maniÃ¨re qu'ils vous ont donnÃ© leur main lorsque vous initiez le vÃ´tre..\n\n~ Pablo Neruda ~\n\nâ¤ğŸŒ¿âš˜ğŸŒ±â¤ğŸŒ¿âš˜ğŸŒ±â¤ğŸŒ¿âš˜ğŸŒ±â¤ğŸŒ¿âš˜ğŸŒ±â¤\n\nTÃ©lÃ©charger Outlook pour Android"
}