{
  "year": 2022,
  "seq": 67,
  "meta": {
    "date": "2022-02-25",
    "from": "maryvonne masseron-mandaba <maryvonnemm@hotmail.com>",
    "to": "\"y.mandaba@gmail.com\" <y.mandaba@gmail.com>",
    "subject": "Re: Comment activer l'enregistrement de ton tÃ©lÃ©phone de SÃ©curitÃ© ( il faut d'abord redemander un Code Secret)"
  },
  "proposals": [],
  "raw_excerpt": "ðŸ—• Date : 2022-02-25\nðŸ‘¤ From : maryvonne masseron-mandaba <maryvonnemm@hotmail.com>\nðŸ“¨ To   : \"y.mandaba@gmail.com\" <y.mandaba@gmail.com>\nðŸ§• Subject : Re: Comment activer l'enregistrement de ton tÃ©lÃ©phone de SÃ©curitÃ© ( il faut d'abord redemander un Code Secret) \n---\nCette dmarche est uniquement pour activer ton tel de scurit.\nTu as, sur ton profil 3 tel\n-mobile\n-fixe\n-tel de scurit\n( avec ton accord nous avions mis le mien en 2014, puisque tu avais perdu ton tel aprs la fte des 100 ans de mamie)...\n\nTu ne pourras confirmer ton tel de scurit que quand tu auras accs  ton compte.\nDEMANDER SUR INTERNET COMME NOUS AVIONS FAIT UN NOUVEAU CODE D'ACCS PROVISOIRE\n\n\nTlcharger Outlook pour Android\n________________________________\nFrom: maryvonne masseron-mandaba\nSent: Friday, February 25, 2022 1:03:01 PM\nTo: y.mandaba@gmail.com \nSubject: Comment activer l'enregistrement de ton tlphone de Scurit ( il faut d'abord redemander un Code Secret)\n\n\n\nTlcharger Outlook pour Android"
}