{
  "year": 2022,
  "seq": 110,
  "meta": {
    "date": "2022-04-23",
    "from": "maryvonne masseron-mandaba <maryvonnemm@hotmail.com>",
    "to": "Marc MANDABA <marcmandaba@hotmail.com>",
    "subject": "TOA ZIKI"
  },
  "proposals": [],
  "raw_excerpt": "ðŸ—• Date : 2022-04-23\nðŸ‘¤ From : maryvonne masseron-mandaba <maryvonnemm@hotmail.com>\nðŸ“¨ To   : Marc MANDABA <marcmandaba@hotmail.com>\nðŸ§• Subject : TOA ZIKI\n---\nMarc,\nFlicitations pour le travail accompli.\nJe sais combien raliser quelque chose  Bangui est difficile.\nJe suis consciente que ma chambre te pose un problme.\nIl mest aussi difficile de renoncer aux dispositions antrieures.\nPour les voitures, je tavais propos de les vendre  SCAR-Mitsubishi.\nIl ne faut pas les donner, pour une question de responsabilit civile.\nLa Mitsubishi est en  garage mort  chez Axa.\nQuand jaurai une rponse pour Tristan, je verrai des dates pour Bangui.\nPour largent, partageons en trois, pour Tristan, pour la communion et baptme, pour moi.\nSi tout le monde est daccord. Tu me le donneras en liquide.\nJaurai le retour de Fidal lundi pour la dclaration SCI.\nJai pratiquement fini la rfection de limmobilier en France.\nBonne fte. Ton cadeau nest pas encore parti \nmaman\n\n\n\nEnvoy  partir de Courrier pour Windows"
}