{
  "year": 2022,
  "seq": 60,
  "meta": {
    "date": "2022-02-19",
    "from": "maryvonne masseron-mandaba <maryvonnemm@hotmail.com>",
    "to": "\"y.mandaba@gmail.com\" <y.mandaba@gmail.com>",
    "subject": "RÃ©initialisation code secret perdu"
  },
  "proposals": [],
  "raw_excerpt": "ðŸ—• Date : 2022-02-19\nðŸ‘¤ From : maryvonne masseron-mandaba <maryvonnemm@hotmail.com>\nðŸ“¨ To   : \"y.mandaba@gmail.com\" <y.mandaba@gmail.com>\nðŸ§• Subject : RÃ©initialisation code secret perdu\n---\nhttps://particuliers.societegenerale.fr/services-en-ligne/reinitialisation-code-secret-perdu\n\n\n\nYannick.\nFaisons ta demande de nouveau mot de passe,  en ligne, demain, ds que possible.\nTu fais la demande, depuis ton ordinateur.\nJe connais la plupart des renseignements demands.\nIl ne m'appartient pas de le faire...\nNe change rien d'autre que le code secret.\n\nEt, faisons cela sans nous nerver, ni commentaires...\nLes consquences seront lourdes pour moi.\nMaman\n\nTlcharger Outlook pour Android"
}