{
  "year": 2022,
  "seq": 175,
  "meta": {
    "date": "2022-09-08",
    "from": "maryvonne masseron-mandaba <maryvonnemm@hotmail.com>",
    "to": "Yannick Mandaba <y.mandaba@gmail.com>",
    "subject": "Re: lectures de Tristan"
  },
  "proposals": [],
  "raw_excerpt": "ðŸ—• Date : 2022-09-08\nðŸ‘¤ From : maryvonne masseron-mandaba <maryvonnemm@hotmail.com>\nðŸ“¨ To   : Yannick Mandaba <y.mandaba@gmail.com>\nðŸ§• Subject : Re: lectures de Tristan\n---\nJe dteste des Jack London\n\nTlcharger Outlook pour Android\n________________________________\nFrom: Yannick Mandaba \nSent: Thursday, September 8, 2022 9:04:03 AM\nTo: maryvonne masseron-mandaba \nSubject: Re: lectures de Tristan\n\nJ'avais slectionn des livre de la BDC en pdf. J'avais demand Croc Blanc.\nIl y a un dossier avec mes slections CE2.\n\nTu choisis comme tu veux mais Harry Potter il a vu le film il ne ragit pas du tout  la magie du truc. Et c'est  lire en anglais.\n\nIl ne trouve pas les coupable dans les enqutes de Mickey Parade alors...\nFais attention il n'a pas de patience pour la mise en place du scnario.\n\nS'il ne voit pas le scnario se mettre en place il dira que c'est ennuyeux.\n\nIl aime Sa majest des mouches mais les phrases sont trop longue. Meme c'est un style qui me fatigue.\n\nOk je vous laisse choisir.\nvous pouvez aussi regarder la BCD ensemble et choisir ensemble car il y a des rsums et des recommandations pour aider  choisir.\n\nBise\n\nOn Wed, Sep 7, 2022, 8:48 PM maryvonne masseron-mandaba > wrote:\n\nYannick,\n\nNous devons reprendre les lectures avec Tristan,\n\nCela ne demande pas deffort, et permet de le cultiver.\n\nIl peut choisir entre Harry Potter, le Tome 1 est dj sur le mail  Trs,\n\nEt une srie denqutes de Maurice Leblanc : Arsne Lupin gentleman cambrioleur\n\n(jadorais  son ge, et les ai tous lus)\n\nJe vous envoie le pdf  tous les 2\n\n\n\nEnvoy  partir de Courrier pour Windows"
}