{
  "year": 2022,
  "seq": 127,
  "meta": {
    "date": "2022-05-01",
    "from": "maryvonne masseron-mandaba <maryvonnemm@hotmail.com>",
    "to": "Yannick Mandaba <y.mandaba@gmail.com>",
    "subject": "Re: Tristan 220429"
  },
  "proposals": [],
  "raw_excerpt": "ðŸ—• Date : 2022-05-01\nðŸ‘¤ From : maryvonne masseron-mandaba <maryvonnemm@hotmail.com>\nðŸ“¨ To   : Yannick Mandaba <y.mandaba@gmail.com>\nðŸ§• Subject : Re: Tristan 220429\n---\nJe sais que c'est une question de moyens. Le problme pour moi d'aider, est que l'aide n'est pas pour une personne, mais pour 3.\n\nTlcharger Outlook pour Android\n________________________________\nFrom: Yannick Mandaba \nSent: Sunday, May 1, 2022 10:05:05 AM\nTo: maryvonne masseron-mandaba \nSubject: Re: Tristan 220429\n\nJe n'avais pas l'nergie. Je voulais me reposer. Nous tions convis avec pleins d'amis sur Kho Make.\n\nC'est mon choix.\nTout voyage ce sont des dpenses, mme l'enterrement on devait dpenser A et on a dpens Ax2\n\nC'est comme a.\nTristan a demand pourquoi on allait pas sr une plage j'ai dit que j'tais trop fatigu.\nPoint.\n\nOn Sat, Apr 30, 2022, 5:33 PM maryvonne masseron-mandaba > wrote:\nEn fait, la question pose est: qu'avez-vous fait pour que Tristan ne soit pas ENCORE Confin, pendant les congs de Pques. Ils durent deux semaines...en fait 18 jours conscutifs sans cole. Tristan aurait d tre accompagn au grand air,  la campagne,  la montagne, ou  la mer. Je note qu'en Thalande, il y a un bon rseau ferr. Et je suis d'accord aussi pour que soient vits les voyages routiers qui sont meurtriers  cette priode.\nJe ne demande pas de comptes.\nIl est toujours invit en France.\nJ'tais inquite, et le suis toujours, car il s'ennuie. Trouver ses camarades sur internet est mauvais. Sa mamie pareil.\n\nTlcharger Outlook pour Android\n________________________________\nFrom: maryvonne masseron-mandaba >\nSent: Saturday, April 30, 2022 12:09:30 PM\nTo: Yannick Mandaba >\nSubject: Re: Tristan 220429\n\nNon, ce n'est pas gonfl...\nC'est vous qui vous exposez sur les rseaux sociaux. Aprs, les gens qui vous voient, vous ne les contrlez pas... Ils font ce qu'ils veulent des images.\n\nTlcharger Outlook pour Android\n________________________________\nFrom: Yannick Mandaba >\nSent: Saturday, April 30, 2022 11:11:15 AM\nTo: maryvonne masseron-mandaba >\nSubject: Re: Tristan 220429\n\nMais comment tu as trouv cela? Tu n'es pas sur notre liste d'amis.\n\nPourquoi on doit te rendre compte sur la date o l'on met une photo?\n\nCette photo tait en lien avec un fils de discussion sur les ligne intrieures avion, voiture ou train lequel le moins cher, etc.\n\nCela ne t'est pas adress donc tu peux espionner mais c'est gonfl de te mler de la conversation sans y tre invite et en plus demander des comptes.\n\nNon?\n\n\nOn Sat, Apr 30, 2022, 3:30 PM maryvonne masseron-mandaba > wrote:\nOui.\nJe ne suis et ne serai jamais votre amie sur facebook.\nPourquoi avoir publi cette photo le jour des vacances de Pques ? Soit 6 semaines plus tard...\n\nSt Roblox sera honor les mardi et vendredi.\nBien compris.\n\nTlcharger Outlook pour Android\n________________________________\nFrom: Yannick Mandaba >\nSent: Saturday, April 30, 2022 6:06:57 AM\nTo: maryvonne masseron-mandaba >\nSubject: Re: Tristan 220429\n\nOk...heu... C'est quoi cette histoire de fausses photos d'avion Facebook?\n\nTu n'es pas notre contact Facebook, alors de quoi tu te mles ? Si tu tais notre contact FB tu saurais que cette photo c'est notre dpart aux funrailles de la grande Tante.\n\n\nJe rpte  chaque message.\nArrtes de juger quand tu n'as pas d'lments. Je suis fatigu de justifier sur base d'accusations du type prche faux pour savoir le vrai.\nC'est agressif, dsagrable, manipulateur, violent.\nTu sors un truc comme a comme si on tait l  faire des faux pour frimer o je ne sais quoi.\nC'est de l'insulte.\n\nNe m'envoie plus de liens Facebook STP. Nous ne sommes pas amis sur FB donc je me les ouvre pas\n\nTristan Roblox / pas de copain\nTu ne comprends pas. Ses amis jouent  16h le mardi et vendredi. Il les manque  chaque fois. Ils parlent de leurs jeux ensembles et il est exclu. Ils lui reproche d'avoir dit qu'il serait l et n'est pa as venu plusieurs fois.\n\nJ'ai dit un vrai copain ne t'oblige pas  faire ceci ou cela. Bon cela va passer mais 16h mardi vendredi il rejoindra ses ami5\n\nOn Sat, Apr 30, 2022, 1:"
}