{
  "year": 2022,
  "seq": 20,
  "meta": {
    "date": "2022-10-21",
    "from": "MYM MANDABA SCI <mymmandaba@gmail.com>",
    "to": "Marc Mandaba <m.mandaba@themisenergy.com>, \"Yannick Mandaba (Perso)\"",
    "subject": "ReÂ : ReÂ : Tout le monde Ã  bien travaillÃ©"
  },
  "proposals": [
    {
      "index": -20,
      "etiquette": "Achat mÃ©tal (argent) pour prod",
      "category": "MIN",
      "duration": "LT",
      "source": "AI",
      "score": 1,
      "matched_from": [
        "ai_new"
      ]
    }
  ],
  "raw_excerpt": "ğŸ—• Date : 2022-10-21\nğŸ‘¤ From : MYM MANDABA SCI <mymmandaba@gmail.com>\nğŸ“¨ To   : Marc Mandaba <m.mandaba@themisenergy.com>, \"Yannick Mandaba (Perso)\"\n <y.mandaba@gmail.com>\nğŸ§• Subject : ReÂ : ReÂ : Tout le monde Ã  bien travaillÃ©\n---\nMerci Marc pour les consignes. - les housses, je les ai achetÃ©es, car les siÃ¨ges deviennent rouges au fil des jours. Et il faut faire la route de Damara... Belle esthÃ©tique, boutiqu\n\nEnvoyÃ© depuis mon tÃ©lÃ©phone Huawei\n\n-------- Message original --------\nDeÂ : Marc Mandaba &lt;m.mandaba@themisenergy.com&gt;\nDateÂ : ven. 21 oct. 2022 Ã  11:01\nÃ€Â : MYM MANDABA SCI &lt;mymmandaba@gmail.com&gt;, \"Yannick Mandaba (Perso)\" &lt;y.mandaba@gmail.com&gt;\nObjetÂ : Re: ReÂ : Tout le monde Ã  bien travaillÃ©\n\nBonjour,\n\n\n\nSi tu veux rester qques jours de plus, ce n&#39;est pas Ã§Ã  qui va changer fondamentalement le planning des travaux. Mais ne te force pas trop si tu es\n fatiguÃ©e, l&#39;essentiel est de commencer.Â Comme discutÃ©, nous pourrons revenir ensemble au 1er trimestre.\n\n\n\nPour les housses de siÃ¨ge, si elles te paraissent de bonne qualitÃ©, prends les Ã  Bangui. Sinon j&#39;en ramÃ¨nerai.\n\n\n\nPour la liste de quincaillerie, je m&#39;en occuperai en France.\n\n\n\nConcernant les meubles, il les pousser vers le fond pour dÃ©gager l&#39;accÃ¨s au couloir. Il y aura de l&#39;Ã©vacuation de gravats.\nBien mettre le canapÃ© et les fauteuils comme une barriÃ¨re au milieu de la piÃ¨ce. Effectivement rentrer les dÃ©corations.Â  Il faudra aussi couvrir le meuble Ã  vaisselle de droite. Si tu peux le faire avec Philippe et un manÅ“uvre, tant mieux. Sinon\n je verrai Ã§a avec Jo et il le fera avec Philippe.\n\n\n\nJe viens d&#39;arriver Ã  Paris d&#39;Abidjan ce matin.\n\n\n\n\n\n\n\n\n\nMarc Mandaba \n\nCIO / THEMIS Energy\n\nMobile CasablancaÂ &#43;212 6 1252 3030\n\nMobile FranceÂ &#43;33 6 1119 3955 (WhatApp)\n\nm.mandaba@themisenergy.com\n\n\n\n\n\n\n\n\n\nDeÂ : MYM MANDABA SCI &lt;mymmandaba@gmail.com&gt;\n\nEnvoyÃ©Â : vendredi 21 octobre 2022, 5:31 AM\n\nÃ€Â : Marc Mandaba &lt;m.mandaba@themisenergy.com&gt;; Yannick Mandaba (Perso) &lt;y.mandaba@gmail.com&gt;\n\nObjetÂ : ReÂ : Tout le monde Ã  bien travaillÃ©\n\n\n\n\nBonjour,\nLes housses de siÃ¨ge, pour la voiture:\nLes acheter ici, ou en France ? \nLes crochets pour placards Ã  2 battants:\nLes acheter en France ( recherche site spÃ©cialisÃ© \nLes objets du salon:\nLes ranger dans le buffet Penone ? \nLes coussins des siÃ¨ges terrasse:\nJe les range dans des sacs plastique sur l&#39;armoire de l&#39;office. Les housses dans la chambre bleue.\n\nDemande de mettre la vaisselle dans la bibliothÃ¨que de droite, qui ferme bien, pour gagner du volume de rangement dans la chambre. ClÃ©s dans le placard des clÃ©s. Bar.\n\nMerci \n\n\n\n\nEnvoyÃ© depuis mon tÃ©lÃ©phone Huawei\n\n\n\n\n\n\n-------- Message original --------\n\nDeÂ : Marc Mandaba &lt;m.mandaba@themisenergy.com&gt;\n\nDateÂ : mer. 19 oct. 2022 Ã  23:33\n\nÃ€Â : MYM MANDABA SCI &lt;mymmandaba@gmail.com&gt;, &#34;Yannick Mandaba (Perso)&#34; &lt;y.mandaba@gmail.com&gt;\n\nObjetÂ : Re: Tout le monde Ã  bien travaillÃ©\n\n\n\nBonsoir,\nDÃ©solÃ© grosse journÃ©e et pas eu le temps de prendre des nouvelles de maman.\nJ&#39;ai eu un appel de Nestor, il me pensait encore Ã  Bangui. Il devait venir Ã  Damara la semaine derniÃ¨re mais n&#39;a pas pu.\n\n\n\nJonathan Ã§a commencer la SDB du fond mercredi aprÃ¨s le dÃ©part de maman. Il voulait commencer dÃ¨s demain mais la dÃ©molition fera du bruit. Donc non.Â \n\n\n\nMerci\nMarcÂ \n\n\n\n\nMarc Mandaba \n\nCIO / THEMIS Energy\n\nMobile CasablancaÂ &#43;212 6 1252 3030\n\nMobile FranceÂ &#43;33 6 1119 3955 (WhatApp)\n\nm.mandaba@themisenergy.com\n\n\n\n\n\n\n\n\n\nDeÂ : MYM MANDABA SCI &lt;mymmandaba@gmail.com&gt;\n\nEnvoyÃ©Â : mardi 18 octobre 2022, 6:52 PM\n\nÃ€Â : marcmandaba &lt;marcmandaba@gmail.com&gt;\n\nObjetÂ : Re: Tout le monde Ã  bien travaillÃ©\n\n\n\n\nÃ€ demain.Â \n\n\n\nLe mar. 18 oct. 2022 Ã  19:49, Marc Mandaba &lt;marcmandaba@gmail.com&gt; a Ã©critÂ :\n\n\n\n\n\nMerci pour les nouvelles et le suivi des actions.\nLes serruriers c&#39;est une catastrophe. C&#39;est le 3eme que j&#39;essaie. Je vais demander Ã  Jo si il en connaÃ®t un bien.Â \nPour les arbres, j&#39;avais peut de "
}