{
  "year": 2022,
  "seq": 140,
  "meta": {
    "date": "2022-05-14",
    "from": "maryvonne masseron-mandaba <maryvonnemm@hotmail.com>",
    "to": "Yannick Mandaba <y.mandaba@gmail.com>",
    "subject": "Re: Tristan. Mai 2022"
  },
  "proposals": [
    {
      "index": -140,
      "etiquette": "Frais d'Ã©cole / bus Tristan",
      "category": "MIN",
      "duration": "LT",
      "source": "AI",
      "score": 1,
      "matched_from": [
        "ai_new"
      ]
    }
  ],
  "raw_excerpt": "ğŸ—• Date : 2022-05-14\nğŸ‘¤ From : maryvonne masseron-mandaba <maryvonnemm@hotmail.com>\nğŸ“¨ To   : Yannick Mandaba <y.mandaba@gmail.com>\nğŸ§• Subject : Re: Tristan. Mai 2022\n---\nBien compris.\n\nLe souci que j'ai, c'est que je sens un chantage permanent. C'est lui le censeur, c'est lui le tribunal, Au Nom de Papa (c'est papa qui lui a dit de bloquer si je critique ses parents).\n\nDonc quand je donne ou conseils, ou consignes, ou rÃ¨gles, qui lui semblent contraignantes, il dit que ses parents ne sont pas d'accord, que je les contre, que je les critique.\n\nExcuse-moi, mais il est dans la confusion...\n\nCar nos rÃ¨gles sont souvent contraires.\nExemple\nLe temps passÃ© sur internet. C'Ã©tait cadrÃ© l'an dernier, lÃ  il joue jour et nuit....\nLes friandises, cochonneries chimiques, au lieu des fruits, donnÃ©es, exprÃ¨s, devant moi.\nLui donner Ã  manger en dehors des repas, cela se nomme grignotage, et juste au moment des leÃ§ons (provocation).\nParler fort ou rire fort pendant les leÃ§ons, ce qui se veut Ãªtre mÃ©pris du travail (rÃ©el) qu'il fournit, nuit Ã  sa concentration, donc m'agace ++++\nLui laisser Ã  penser que j'ai besoin de le voir chaque jour..., or je m'y oblige, pour faire Ã©panouir ses capacitÃ©s. Pour lui c'est encore une source de confusion, car il sait, que tu fais cela quand tu peux, et que sa mÃ¨re s'en fout (il l'a dit), car elle ne sait pas le travail qu'il faut fournir pour rester dans la course.... MÃªme si on est intelligent.\n\nMoi j'essaie de lui ouvrir l'esprit, mais il est sous l'influence d'un petit esprit, on dirait ma sÅ“ur Marie - Annick, qui a des phrases toutes faites sur chaque sujet.\n\nIl faudrait lui rendre la fluiditÃ© qu'il avait l'an dernier....\n\nSoit il vient en France, soit il va chez la sÅ“ur de Bee, ou chez sa tante.\nMais lÃ  c'est une rÃ©gression intellectuelle pas trop, mais affective, et des centres d'intÃ©rÃªt.\n\nPs : pour rire, Claudie a dÃ©boulÃ© dÃ¨s ce matin Ã  Levallois-Perret, obligeant CÃ©cile Ã  prÃ©parer un dÃ©jeuner, ce qui n'Ã©tait pas prÃ©vu, alors que justement je devais l'amener de la gare Ã  l'hÃ´tel, pour arriver aux cÃ©rÃ©monies, en temps utile, sans dÃ©ranger la famille de Marc. (Maxime Ã©tait en camp dans les PyrÃ©nÃ©es avec son Ã©cole, et Marc est parti la nuit pour le rÃ©cupÃ©rer...). Sans-gÃªne quand tu nous tiens...\n\nTÃ©lÃ©charger Outlook pour Android\n________________________________\nFrom: Yannick Mandaba \nSent: Saturday, May 14, 2022 8:37:42 AM\nTo: maryvonne masseron-mandaba \nSubject: Re: Tristan. Mai 2022\n\nPas du tout.\nVous faites comme vous voulez je vous ramÃ¨ne sur vos rails quand je sens la dispute oubliÃ© tournage en bourrique de Tristan braquÃ©.\n\nJ'ai la mÃªme chose ne t'inquiÃ¨tes pas.\n\nS'il ne comprends pas des questions qui lui semblent inquisitoires, oÃ¹ il ne connait pas le rÃ©ponse, alors il chercher une sortie honorable.\nEn gÃ©nÃ©ral la sortie c'est la contre-attaque, mÃªme s'il n'y a pas eu d'attaque.\n\nDepuis 6 mois ou 1 an  il faut gagner, surtout que Papa ne gagne pas.\nSi je gagne trop alors  j'ai trichÃ©...et il pleure mÃªme en le disant donc il s'en persuadÃ© pour Ã©viter de perdre.\n\nAvec toi c'est autre chose. Il comble l'Ã©crasement quotidien des adultes. En voilÃ  1 Ã  sa merci et il a une arme : le blocage.\n\nMoi aussi je me fais bloquer.\nJe pense que c'est bien qu'il soit un peu en contrÃ´le, pas toujours dominÃ©.\n\nPar contre il faut qu'il l'enlever , donc un ban temporaire, pas un ban def.\nBan def â‰  ban dÃ©finitif sur les rÃ©seaux sociaux comme Twitch oÃ¹ les abonnÃ©s interagissent avec les streamers.\nLe streamer est celui qui fait une vidÃ©o en temps rÃ©el, et qui apparaÃ®t en gÃ©nÃ©ral dans un carrÃ© d'Ã©cran avec des commentaires de la communautÃ© qui dÃ©filent.\n\nDonc Tristan qui rÃªve de devenir un Streamer et d'avoir 10 millions d'abonnÃ©s comme son cher Kelly, se prend Ã  bloquer les gens, etc, etc.\n\n\n\nCe n'est pas moi, c'est la culture de commu sur Twitch oÃ¹ les gens considÃ©rÃ©s toxiques sont bloquÃ©s soit 15mn, 1cheure, des jours, ou dÃ©finitivement.\n\nVoilÃ  un peu l'univers qui se cache derriÃ¨re ces blocages.\n\nOn Sat, May 14, 2022, 2:20 "
}