{
  "year": 2022,
  "seq": 22,
  "meta": {
    "date": "2022-10-24",
    "from": "MYM MANDABA SCI <mymmandaba@gmail.com>",
    "to": "Marc MANDABA <marcmandaba@hotmail.com>, \"Yannick Mandaba (Perso)\"",
    "subject": "ReÂ : ReÂ : ReÂ : Tout le monde Ã  bien travaillÃ©"
  },
  "proposals": [
    {
      "index": -22,
      "etiquette": "Achat mÃ©tal (argent) pour prod",
      "category": "MIN",
      "duration": "LT",
      "source": "AI",
      "score": 1,
      "matched_from": [
        "ai_new"
      ]
    }
  ],
  "raw_excerpt": "ğŸ—• Date : 2022-10-24\nğŸ‘¤ From : MYM MANDABA SCI <mymmandaba@gmail.com>\nğŸ“¨ To   : Marc MANDABA <marcmandaba@hotmail.com>, \"Yannick Mandaba (Perso)\"\n <y.mandaba@gmail.com>\nğŸ§• Subject : ReÂ : ReÂ : ReÂ : Tout le monde Ã  bien travaillÃ©\n---\nBonsoir, \n- il m'est impossible de tout faire en 9 jours. J'ai essayÃ©, mÃªme en faisant travailler les 3 tout le dimanche... Je range et nettoie 12 heures par jour... Aussi ce matin j'ai repoussÃ© mon vol retour au mardi 1er novembre. Les vols sont dÃ©sormais mardi et samedi. \n-peinture Romaric N'zengue Da-Silva =\nPhoto des pots utilisÃ©s pour Detex. Photos cÃ´tÃ© jardinLes ampoules led pour la terrasse donnent un bon Ã©clairage, mÃªme s'il est blanc, les autres de couleur plus jaunes sont difficiles Ã  trouver... On reste sur les blanches. Demain il pose les derniers nÃ©ons, et fait les raccords de Ciment en bordure de terrasse. \nDossier Agrisol gris. Photo de la facture payÃ©e par chÃ¨que, montant dÃ©jÃ  communiquÃ© = 571 000 xafPayÃ©e par chÃ¨que Ã  Socap MatÃ©riel Ã  la Colline. Proforma main d'Å“uvre = 225 000 Fait un chÃ¨que ce jour de 125 000Le reste, soit 100 000 Ã  l'achÃ¨vement. \nPour Richard =PayÃ© 150 000 xaf en liquide Il restera 2 arbres Ã  abattre, mais pas urgent, un palmier Ã  l'angle rue Epaye, un teck qui serait malade, celui qui est isolÃ© le long du mur Epaye. Pas fait, car trop de branchages Ã  laisser sÃ©cher. \nPour le jardinier, je le rappelle demain. Il voulait faire engrais puis dÃ©sherbant, j'ai regardÃ© sur internet, c'est correct. \nJe te laisse 500 000 en liquide, sous la plaque Connecticut, il y aura peut-Ãªtre plus. Photo. \nN'oublie pas que la clÃ© du bar est la clÃ© des clÃ©s... Des serrures ont Ã©tÃ© facturÃ©es, portes et placards. C'est dur Ã  restaurer. Je n'ai plus ma perceuse orange qui m'avait tant aidÃ©e... \nNous avons terminÃ© le rangement du sÃ©jour, tout est dans les placards, ceux-ci seront recouverts par des draps avant mon dÃ©part. Jo pourra mettre des plastiques par dessus ? Il n'y aura que des Ã©tagÃ¨res vides dans le couloir. \nJe joins des photos dans un autre courrielBonne soirÃ©e. \n\n\nEnvoyÃ© depuis mon tÃ©lÃ©phone Huawei\n\n-------- Message original --------\nDeÂ : Marc MANDABA &lt;marcmandaba@hotmail.com&gt;\nDateÂ : dim. 23 oct. 2022 Ã  10:42\nÃ€Â : MYM MANDABA SCI &lt;mymmandaba@gmail.com&gt;, \"Yannick Mandaba (Perso)\" &lt;y.mandaba@gmail.com&gt;\nObjetÂ : Re: ReÂ : ReÂ : Tout le monde Ã  bien travaillÃ©\n\nBonjour,\n\n\n\nContent que tout se soit bien passÃ©.Â \nEt merci pour le suivi des travaux et la contribution pour peinture.\nBien sÃ»r tu peux utiliser Romaric. Pour l&#39;instant il est sÃ©rieux, mais il faudra garder la rigueur.\nJe repasserai Ã  Bangui avant la fin d&#39;annÃ©e pour faire la revue des travaux.Â \n\n\n\n\n\nRomaric DasilvaÂ &#43;236 75 75 15 15 (c&#39;est aussi son numero WhatsApp. Mais en ce moment il a un tÃ©lÃ©phone simple, donc pas de WhatsApp)\n\n\n\n\n\nJonathan FijalkowskiÂ &#43;236 72 12 25 02 (Ã©galement WhatsApp. Jo fonctionne bien avec messages WhatsApp)\n\n\n\nBonne journÃ©e\nMarcÂ \n\n\n\n\n\n\n\nMarc Mandaba\n\n\nFrance &#43;33 611193955 (WhatsApp)\n\n\n\n\n\nDeÂ : MYM MANDABA SCI &lt;mymmandaba@gmail.com&gt;\n\nEnvoyÃ©Â : dimanche 23 octobre 2022, 10:15 AM\n\nÃ€Â : Marc Mandaba &lt;m.mandaba@themisenergy.com&gt;; Yannick Mandaba (Perso) &lt;y.mandaba@gmail.com&gt;\n\nObjetÂ : ReÂ : ReÂ : Tout le monde Ã  bien travaillÃ©\n\n\n\n\nBonjour,\nLa journÃ©e d&#39;hier Ã©tait bien. \nMesse Ã  ND d&#39;afrique Ã  06:00\nDÃ©pÃ´t de gerbes sur les tombes Ã  11h\nRepas sous les arbres\nRetour Ã  Bangui \nVisite au Pr Nali ( programme CNY &#43;/-) \nPhotos suivront\n\n\n\nAujourd&#39;hui, rangements, mÃ©nage. \nJuliana, jef, Philippe. \nDÃ©barras, et nettoyage de tout le couloir, \nMise en entrepÃ´t Ã  l&#39;office des banquettes, \nÃ‰tagÃ¨res blanches (2)libÃ©rÃ©es pour rangements dans la chambre bleue. \n\n\n\nDemain lundi, j&#39;essaie de retarder mon retour. Selon le dÃ», pour changement. &#43;3j\n\n\n\nJonathan pourra venir pour, mesures de ma SDB, siphon office, alimentation eau cuisine.\n\nRomaric pourra continuer la peinture extÃ©rieure, j&#39;ai achetÃ©, Ã  socaps, avec un chÃ¨que du Cabinet :\n\n5 agriso"
}