{
  "year": 2022,
  "seq": 50,
  "meta": {
    "date": "2022-02-25",
    "from": "Yannick Mandaba <y.mandaba@gmail.com>",
    "to": "maryvonne masseron-mandaba <maryvonnemm@hotmail.com>",
    "subject": "Fwd: Votre demande de devis ‚Äì Henner Expat Sant√© 1er euro"
  },
  "proposals": [
    {
      "index": -50,
      "etiquette": "Dossier de bourse Tristan",
      "category": "MIN",
      "duration": "LT",
      "source": "AI",
      "score": 1,
      "matched_from": [
        "ai_new"
      ]
    }
  ],
  "raw_excerpt": "üóï Date : 2022-02-25\nüë§ From : Yannick Mandaba <y.mandaba@gmail.com>\nüì® To   : maryvonne masseron-mandaba <maryvonnemm@hotmail.com>\nüßï Subject : Fwd: Votre demande de devis ‚Äì Henner Expat Sant√© 1er euro\n---\nSi tu as le temps tu regardes mon contrat HENNER\n\n---------- Forwarded message ---------\nFrom: \nDate: Thu, Feb 24, 2022 at 5:40 PM\nSubject: Votre demande de devis ‚Äì Henner Expat Sant√© 1er euro\nTo: \n\n\n\nNotre √©quipe traite actuellement votre demande\n\nVotre demande de devis\n\n\nMonsieur,\n\nVous nous avez sollicit√©s pour une demande de devis dans le cadre de votre\nmobilit√© internationale.\n\nNous vous remercions de l‚Äôint√©r√™t que vous portez √† nos solutions.\n\n*Suite √† l‚Äô√©tude de vos besoins, nous vous recommandons notre offre Henner\nExpat Sant√© au 1 er Euro. *\n\nVous trouverez en pi√®ces jointes * le devis d√©taill√© * et le * bulletin\nd'adh√©sion. *\n\nNous vous invitons √©galement √† prendre connaissance des diff√©rents\ndocuments relatifs √† votre adh√©sion :\n\nBrochure\n& Garanties\n\nCe document essentiel vous indique les niveaux de remboursement selon les\ngaranties de votre contrat\n\nMandat\nde r√©siliation\n\n\nEn remplissant ce document, nous r√©silions pour vous votre contrat aupr√®s\nde votre pr√©c√©dent assureur fran√ßais\n\nBrochure\n& Garanties\n\nCe document essentiel vous indique les niveaux de remboursement selon les\ngaranties de votre contrat\n\n\nMandat\nde r√©siliation\n\nEn remplissant ce document, nous r√©silions pour vous votre contrat aupr√®s\nde votre pr√©c√©dent assureur fran√ßais\n\n\nCharte\nRGPD\n\n\nLa Charte RGPD regroupe toutes les informations relatives au traitement de\nvos donn√©es personnelles\n\nConditions\nG√©n√©rales\n\n\nRetrouvez ici toutes les informations pratiques et l√©gales sur le produit\nd'assurance Expat au 1er euro\n\nL'IPID\n\nDocument standardis√© reprenant de fa√ßon simplifi√©e  les informations\nessentielles de cette offre d'assurance\nQuels sont ses avantages ?\n\n*Prise en charge directe et int√©grale * de vos frais d‚Äôhospitalisation dans\nnotre r√©seau de soins\n\nTransmission de * vos demandes de remboursement * digitalis√©es jusqu‚Äô√† 1000\n‚Ç¨,\n\n* par simple photo Votre fid√©lit√© est r√©compens√©e * √† partir de la 4 e ann√©e\nd'adh√©sion, avec des garanties am√©lior√©es\n\n*Renforcez votre couverture Sant√© * gr√¢ce √† des options d'assistance, de\nresponsabilit√© civile et de pr√©voyance\n\n*Pas d'avance de frais et aucun reste √† charge * en cas d'hospitalisation\ngr√¢ce au r√©seau de soins m√©dical Henner (hors chambre particuli√®re)\nComment adh√©rer ?\n1\n\nCompl√©tez le bulletin d'adh√©sion\n2\nJoignez les pi√®ces justificatives list√©es en fonction de votre situation\n3\nAdressez-nous votre dossier par email ou par courrier\n4\nCompl√©tez le questionnaire m√©dical et transmettez-le √† notre M√©decin Conseil\nVous avez des questions ?\n\nVous pouvez me contacter par mail ou par t√©l√©phone pour toute information\ncompl√©mentaire.\n\nTr√®s cordialement,\n\n\n\n*Sebastien Florin *\nConseiller Henner\nTel : 03 28 76 37 38 du lundi au vendredi de 8h30 √† 18h (heure fran√ßaise)\nE-Mail : sante.international.individuels@henner.com\n\n\n\nHenner Expat Sant√© est r√©serv√© aux ressortissants fran√ßais √¢g√©s de moins de\n70 ans √† l'adh√©sion et r√©sidant dehors de leur pays d'origine pour une\ndur√©e minimale d'un an, sous r√©serve de l'acceptation du questionnaire\nm√©dical par le d√©partement M√©dical.\nUn d√©lai de carence de 10 mois est appliqu√© aux frais relatifs au suivi de\nla grossesse et √† l'accouchement.\nLes d√©lais de 3 et 6 mois sont supprim√©s si vous justifiez d'une assurance\nde m√™me niveau imm√©diatement ant√©rieure.\nCe contrat ne permet pas de d√©roger aux √©ventuelles obligations locales en\nmati√®re d'assurance maladie.\n\nL'adh√©sion n'est pas autoris√©e pour les pays suivants : Etats-Unis, Emirats\nArabes Unis, Cuba, Iran, Cor√©e du Nord, Syrie et r√©gion de Crim√©e.\n\nLes documents joints sont pr√©sent√©s au format PDF acrobat Reader. Pour les\nconsulter et/ou les imprimer vous aurez besoin du logiciel Adobe Acrobat\nReader que vous pouvez t√©l√©charger en cliquant sur le lien suivant :\nhttps://www.adobe.com/fr\n\nHenner, SAS de gestion et de courtage d'a"
}