{
  "year": 2022,
  "seq": 44,
  "meta": {
    "date": "2022-11-16",
    "from": "Yannick Mandaba <y.mandaba@gmail.com>",
    "to": "maryvonne masseron-mandaba <maryvonnemm@hotmail.com>",
    "subject": "Fwd: Courrier de relance d'impay√©s"
  },
  "proposals": [],
  "raw_excerpt": "üóï Date : 2022-11-16\nüë§ From : Yannick Mandaba <y.mandaba@gmail.com>\nüì® To   : maryvonne masseron-mandaba <maryvonnemm@hotmail.com>\nüßï Subject : Fwd: Courrier de relance d'impay√©s\n---\nMaman est-ce que tu peux prendre cela en charge?\nEn fait je suis en train de payer l'hotel pour le s√©jour √† la mer de Noel\n(8 jours √† Kho Mak notre Pouliguen √† nous). Donc la je ne peux pas payer .\n\nLe papier n'explique pas √† quoi cela correspond. mais s√ªrement la\npremi√®re tranche pour cette ann√©e pour la Cantine? Ou bien un reliquat de\nl'ann√©e derni√®re? Pourquoi ils ne disent pas ce que c'est?\nTristan est en distanciel aujourd'hui jusqu'√† la fin de l' APEC.\n\n\n---------- Forwarded message ---------\nFrom: Facturation \nDate: Fri, Nov 11, 2022 at 5:24 PM\nSubject: Courrier de relance d'impay√©s\nTo: MANDABA Yannick \n\n\nA l'attention de / To:  *MANDABA Yannick*\nDe la part de / From: *Lyc√©e Fran√ßais International de Bangkok*\n\nMadame, Monsieur\n\nSauf erreur ou omission, nous vous informons que votre √©ch√©ancier de\npaiement n‚Äôa pas √©t√© respect√© .\n\nVous trouverez en pi√®ce attach√©e au pr√©sent courriel le solde restant d√ª\nqui est √©galement visible sur votre portail EDUKA module finances.\n\nNous vous remercions de bien vouloir r√©gulariser votre situation *sous 8\njours *et/ou  de nous faire parvenir la preuve de versement si vous avez\nfait un r√®glement dont nous n‚Äôaurions pas eu connaissance √† l‚Äôadresse\nsuivante : facturation@lfib.ac.th\n\n.\n\nNous vous remercions par avance et restons √† votre disposition pour toute\nquestion.\n\nCordialement,\n\n\nDear Sir/Madam\n\nUnless we are mistaken, please be informed that your payment installment is\noverdue.\n\nYou will find the invoice(s) attached to this email that is also visible on\nyour EDUKA online finance portal.\n\nWe would appreciate it if you could settle the payment *within 8 days *and/or\nsend us the evidence of payment to the following email address:\nfacturation@lfib.ac.th\n\n.\nWe remain at your disposition for any questions and thank you for your kind\nattention to this matter.\n\nBest regards,\n\n\n*Service Comptabilit√© / Accounts Department*\n*Lyc√©e Fran√ßais International de Bangkok*\nLyc√©e Fran√ßais International de Bangkok\n498, soi Ramkhamhaeng 39 (Thep Leela 1)\nWangthonglang\nBangkok 10310\n[image: Logo]\n\n\n-- \nYannick Mandaba\nMobile: +66.8782.00.622"
}