{
  "year": 2015,
  "seq": 6,
  "meta": {
    "date": "2015-01-01",
    "from": "maryvonne masseron-mandaba <maryvonnemm@hotmail.com>",
    "to": "\"y.mandaba@gmail.com\" <y.mandaba@gmail.com>",
    "subject": "RE: rosÃ©ole probable"
  },
  "proposals": [],
  "raw_excerpt": "ðŸ—• Date : 2015-01-01\nðŸ‘¤ From : maryvonne masseron-mandaba <maryvonnemm@hotmail.com>\nðŸ“¨ To   : \"y.mandaba@gmail.com\" <y.mandaba@gmail.com>\nðŸ§• Subject : RE: rosÃ©ole probable \n---\noui=\nvirus influenzae type A ( autre nom pour la grippe, la vraie ) = beaucoup de fivre\n\nen thailande le systme de sant est vraiment bien fait, bon diagnostic\n\nviter les fruits de mer, on en a dj parl, vu que toi tu es allergique, les essayer un par un\n\nDure exprience que les maladies de son bb !\n\nmerci des nouvelles, bonnes demain,\n\nDate: Thu, 1 Jan 2015 19:27:40 +0700\nSubject: Re: rosole probable\nFrom: y.mandaba@gmail.com\nTo: maryvonnemm@hotmail.com\n\nIls on depiste une fluenza de type A. Les eruptions il en a depuis son oremier repas de fruits de mer mais il etait probablement deja contamine"
}