{
  "year": 2015,
  "seq": 9,
  "meta": {
    "date": "2015-01-12",
    "from": "maryvonne masseron-mandaba <maryvonnemm@hotmail.com>",
    "to": "\"y.mandaba@gmail.com\" <y.mandaba@gmail.com>, Marc Mandaba",
    "subject": "Choc trÃ¨s dur le 7 janv, mais belle journÃ©e du 11"
  },
  "proposals": [],
  "raw_excerpt": "ğŸ—• Date : 2015-01-12\nğŸ‘¤ From : maryvonne masseron-mandaba <maryvonnemm@hotmail.com>\nğŸ“¨ To   : \"y.mandaba@gmail.com\" <y.mandaba@gmail.com>, Marc Mandaba\n\t<marcmandaba@hotmail.com>\nğŸ§• Subject : Choc trÃ¨s dur le 7 janv, mais belle journÃ©e du 11\n---\nhttp://www.francetvinfo.fr/faits-divers/attaque-au-siege-de-charlie-hebdo/en-images-dix-citations-de-cabu-charb-wolinski-et-tignous-a-ne-pas-oublier_790973.html#xtatc=INT-1\nhttp://www.ouest-france.fr/tout-rennes-est-charlie-les-images-dune-journee-historique-3109899\n\nJ'ai surtout t mue par la prsence au dfil de Paris, du 1er ministre isrelien , et , du prsident palestinien ( mme si cela n'a pas t totalement souhait par F.H )\nIci en France, on sent un vent de fraternit, de pardon, de fiert nationale ... pourvu que ceci change les mentalits et force les nantis  se proccuper des jeunes sans emploi et sans but dans la vie, et aussi  raliser l'importance de la culture gnrale ... autre que celle des medias faciles qui sont devenus l'opium du peuple de France. ( cet attentat  Charlie Hebdo est une mprise de  un manque de connaissances... ces journalistes attaquaient toutes les parties, en se moquant, et dfendaient toutes les parties, aussi, ... et surtout auraient craint que cet attentat ne vienne entrainer une rpression ... un tat, ou mme un continent \"policier\", avec un moindre respect des droits de l'homme )"
}