{
  "year": 2015,
  "seq": 20,
  "meta": {
    "date": "2015-12-30",
    "from": "maryvonne masseron-mandaba <maryvonnemm@hotmail.com>",
    "to": "\"y.mandaba@gmail.com\" <y.mandaba@gmail.com>,",
    "subject": "Passera, passera pas..."
  },
  "proposals": [],
  "raw_excerpt": "ğŸ—• Date : 2015-12-30\nğŸ‘¤ From : maryvonne masseron-mandaba <maryvonnemm@hotmail.com>\nğŸ“¨ To   : \"y.mandaba@gmail.com\" <y.mandaba@gmail.com>, \n\tMarc Mandaba <marcmandaba@gmail.com>\nğŸ§• Subject : Passera, passera pas...\n---\nMER. 30 DÃ‰C. 2015Â Ã‰DITION DE LA MI-JOURNÃ‰E\nâ€¢ RSS\nâ€¢ TWITTER\nâ€¢ FACEBOOK\nâ€¢ FRENCH LEAKS\nMENU DU JOURNAL\nâ€¢ LE JOURNAL\nâ€¢ MONDE\nâ€¢ FRANCE\nâ€¢ Ã‰CONOMIE\nâ€¢ CULTURE\nâ€¢ DOSSIERS\nâ€¢ ENGLISH\nâ€¢ ESPAÃ‘OL\nâ€¢ LE CLUB\nâ€¢ PARTICIPEZ\nâ€¢ FRANCE\nÂ \nâ€¢ DOCUMENT\nContre le projet de loi constitutionnelle, lâ€™appel de Pierre Joxe Ã  la gauche vivante\n30 DÃ‰CEMBRE 2015 | PARÂ LA RÃ‰DACTION DE MEDIAPART\nDans un texte confiÃ© Ã  Mediapart, Pierre Joxe lance un appelÂ Ã  laÂ Â«Â gauche bien vivanteÂ Â»Â pour quâ€™elle rejette leÂ Â«Â stupÃ©fiantÂ Â»Â projet de loi constitutionnelle sur la dÃ©chÃ©ance de nationalitÃ©. Sur un ton mobilisateur, cette figure du socialisme franÃ§ais â€“Â ancien parlementaire, ancien ministre, ancien membre du Conseil constitutionnel, ancien prÃ©sident de la Cour des comptesÂ â€“ souligneÂ Â«Â lâ€™effet politique instantanÃ©Â Â»Â dâ€™une dÃ©cision controversÃ©eÂ :Â Â«Â Soudain, la gauche anesthÃ©siÃ©e se rÃ©veille.Â Â»Â Article en accÃ¨s libre.\nâ€¢ FAVORI\nâ€¢ RECOMMANDER\nâ€¢ IMPRIMER\nâ€¢ ARTICLE EN PDF\nâ€¢ PartagerÂ \nâ€¢ Tweet\nâ€¢ \n1\nâ€¢ Offrir l'article\nâ€¢ 216 COMMENTAIRES\nâ€¢ \no A +\no A -\nCet article est en accÃ¨s libre.\nVoici cet appel tel que nous lâ€™a confiÃ© Pierre Joxe, aujourdâ€™hui avocat au barreau de Paris aprÃ¨s un parcours autant administratif que politique, durant lequel, depuis le dÃ©but des annÃ©es 1960, il a accompagnÃ© la reconstruction de la gauche socialiste autour de FranÃ§ois Mitterrand aprÃ¨s la dÃ©bÃ¢cle de la SFIO. DÃ©putÃ© socialiste de 1973 Ã  1984, puis de 1986 Ã  1988, Pierre Joxe a Ã©tÃ© ministre de lâ€™intÃ©rieur (1984-1986, puis 1988-1991), ministre de la dÃ©fense (1991-1993), premier prÃ©sident de la Cour des comptes (1993-2001) et membre du Conseil constitutionnel (2001-2010).\n\n\nUne gauche bien vivanteÂ !\n\nBonne annÃ©eÂ ! Bonne nouvelleÂ ! La gauche est bien vivanteÂ !\nOn pensait bien â€“ malgrÃ© les mots crispÃ©s dâ€™un oracle nerveux au regard sombreÂ â€“, on savait bien que non, la gauche ne pouvait pas mourir.\nMais aujourdâ€™hui on le voit bienÂ : elle est en pleine santÃ© la gauche, jeune, claire et tonique, affirmant sa volontÃ© avec confiance et sâ€™adressant â€“Â comme il convientÂ â€“ Ã  lâ€™armature dÃ©mocratique de la RÃ©publique, aux reprÃ©sentants du peuple, ceux qui sont les seuls, tous ensemble, Ã  pouvoir faire la Loi, expression de la volontÃ© gÃ©nÃ©raleÂ : les parlementaires.\nJe viens de lire sur internetÂ lâ€™appel adoptÃ© par le Mouvement des Jeunes Socialistes.\nJugez vous-mÃªmes. Allez les lireÂ !\nJe les cite iciÂ :\nÂ«Â Les Jeunes Socialistes dÃ©plorent le choix fait par le gouvernementâ€¦\nÂ«Â Permettre la dÃ©chÃ©ance de nationalitÃ© de binationaux, mÃªme lorsquâ€™ils sont nÃ©s en France, crÃ©e une inÃ©galitÃ© de droit entre les citoyens. Cette mesure place les FranÃ§ais binationaux sous un rÃ©gime juridique diffÃ©rent de celui de tous les autres FranÃ§ais. Elle fige une diffÃ©rence symbolique et de droit entre les citoyens franÃ§ais.\nÂ«Â Cette mesure ouvre une brÃ¨che dans le droit du sol, qui fait partie de notre identitÃ© rÃ©publicaine et qui est attaquÃ© depuis des dÃ©cennies par lâ€™extrÃªme droite.\nÂ«Â Cette mesure est surtout inefficace car elle nâ€™a aucun caractÃ¨re dissuasif. En effet, comment imaginer que des fanatiques puissent renoncer Ã  commettre des actes sanglants par peur de perdre leur nationalitÃ© franÃ§aise alors quâ€™ils sont prÃªts Ã  mourirÂ ?\nÂ«Â Si cette mesure est autant contestÃ©e et avait Ã©tÃ© Ã©cartÃ©e par le gouvernement Ã  la suite des attentats de janvier, câ€™est sans doute parce quâ€™elle heurte nos valeurs de justice, notre conception de la RÃ©publique, et que son inefficacitÃ© est certaine.\nÂ«Â Les Jeunes Socialistes espÃ¨rent que la sagesse parlementaire permettra dâ€™Ã©carter cette mesure et de concentrer lâ€™action de lâ€™Etat sur ce qui permet de lutter efficacement contre le terrorisme, et de prÃ©server notre modÃ¨le dÃ©mocratique et rÃ©publicain pour lâ€™Ã©galitÃ© de tous les citoyens.Â Â»\nCes Jeunes Socialistes ont bien raison de se tourner vers le Parle"
}