{
  "year": 2017,
  "seq": 15,
  "meta": {
    "date": "2017-05-30",
    "from": "maryvonne masseron-mandaba <maryvonnemm@hotmail.com>",
    "to": "Yannick Mandaba <y.mandaba@gmail.com>",
    "subject": "Re: Fwd: RE: revenus de votre maman"
  },
  "proposals": [],
  "raw_excerpt": "ğŸ—• Date : 2017-05-30\nğŸ‘¤ From : maryvonne masseron-mandaba <maryvonnemm@hotmail.com>\nğŸ“¨ To   : Yannick Mandaba <y.mandaba@gmail.com>\nğŸ§• Subject : Re: Fwd: RE: revenus de votre maman\n---\nJ'ai rÃ©pondu a Marc sur le patrimoine. Par contre, comme tu considÃ¨res que ce qui est a moi, est a toi, en disant nous, dÃ©solÃ©e de ne pas te faire participer... Bisous. ( J'ai beaucoup de soucis a VitrÃ©, cela je veux bien le partager.... Mais tu n'as jamais de temps pour parler ) ( de mÃªme pas vu Tristan depuis mon dÃ©part )\n\nTÃ©lÃ©charger Outlook pour Android\n\n________________________________\nFrom: Yannick Mandaba \nSent: Tuesday, May 30, 2017 3:35:30 AM\nTo: maryvonne masseron-mandaba\nCc: Marc Mandaba; Ymanda\nSubject: Re: Fwd: RE: revenus de votre maman\n\nJe continue la partie patrimoine de Marc. On dit de ne pas mettre la tÃªte dans le sable et au moins considÃ©rer ensemble.\nDialogue sujet taboo ok. Passons.\n\nYannick Mandaba\n+66878200622\n\nOn May 29, 2017 22:39, \"maryvonne masseron-mandaba\" > wrote:\nRÃ©ponse : Yannick mÃ©lange tout, addiction a quoi ? TÃªte a l'envers,  Je parlais juste de CERGY .....\n\n\nEx - maman\n\nTÃ©lÃ©charger Outlook pour Android\n\n________________________________\nFrom: Yannick Mandaba >\nSent: Monday, May 29, 2017 5:29:33 PM\nTo: Marc Mandaba\nCc: maryvonne masseron-mandaba; Ymanda\nSubject: RE: revenus de votre maman\n\nMaman,\nDÃ©solÃ© pour ce weekend.\nMon tÃ©lÃ©phone avait glissÃ© dans le sofa, c'est la bonne qui me l'a trouvÃ©.\n\nPour les impÃ´ts no comment.\nPour l'appart tu fais comme tu veux c'est toi qui l'a achetÃ©. Marc voit qu'il faut banquer, encaisser la marge et refaire une opÃ©ration pour replacer cela et fixer le gain avant que cela ne retombe.\nAttention vice cachÃ© car si l'Ã©tude est faite est doit probablement Ãªtre divulguÃ©e Ã  un acheteur.\nJ'y connais rien.\n\nMaman elke, ne veut pas se crÃ©er du travail et voit un revenu stable pour elle et pour moi.\n\nNous avons vu par le passÃ© que la peur de perdre ou de rater se transforme parfois en manque Ã  gagner voire en Ã©chec. En effet le conservatisme et le manque d audace peuvent entraÃ®ner des pertes au lieu de sÃ©curiser.\n\nJe pense que Marc s'y connait et que Maman a un but peut-Ãªtre diffÃ©rant.\n\nSi le but est d augmenter les revenus Marc a raison.\nSi le but est de sÃ©curiser un revenu, mÃªme moindre, je dois dire Maman a raison tant qu'on n'a pas trouvÃ©â€‹ une autre acquisition. Cela montrerait la marge rÃ©elle et ce qu'on pourrait dÃ©gager pour Y.B.T de construction Ã  Bkk.\n\nEn gros, ok Marc pour que Maman accepte il nous faut trouver une affaire soit au prix de vente Pergo, soit au prix d'achat Pergo margÃ©...et on voit ce qu'il pourrait y avoir pour bkk.\n\nSavoir oÃ¹ on va acheter avant de vendre mais le temps est comptÃ© pas le temps. Donc Au moins faire Ã©tudier tous les coÃ»ts par avance car chaque mois c'est un .\n\nPS Nantes je crois c'est cher en taxe d'habitation. Mais Macron va changer Ã§a hein?! LÃ  aussi acheter\n\n\nYannick Mandaba\n+66878200622\n\nOn May 29, 2017 21:28, \"Marc MANDABA\" > wrote:\nJe calendrier des dÃ©clarations dâ€™impÃ´ts nâ€™est malheureusement pas notre choix, et recevoir des informations 2 heures avant la clÃ´ture nâ€™est certainement pas souhaitable. Tu devrais faire la remarque Ã  lâ€™agence de Cergy.\n\nPour le patrimoine, Ã  chacun sa faÃ§on. Je ne pense pas que garder les biens ad vitam soit une recette applicable dans tous les cas. Vendre et acheter est quelque chose de normal, sinon il nâ€™y aurait aucun bien Ã  acheter ! Jâ€™espÃ¨re sincÃ¨rement que Michele a tort et quâ€™il nâ€™t aura pas de problÃ¨me avec lâ€™immeuble. Dans tous les cas, ma proposition est de vendre et racheter un autre bien.\n\nJe viens de regarder les ratio prix achat m2 / location m2 dans les grandes villes car je veux moi aussi acheter. Par exemple, Nantes est nettement plus profitable que paris : retour sur capital de 2.9% Ã  Paris, et 4.1% Ã  Nantes.\nNantes est entre 3 et 4 fois moins cher Ã  lâ€™achat, mais seulement 2 Ã  3 fois mois cher en location. Autrement dit, en vendant Paris au prix haut (dans les 12 mois, le marchÃ© a bien repris) et en "
}