{
  "year": 2017,
  "seq": 10,
  "meta": {
    "date": "2017-05-29",
    "from": "Yannick Mandaba <y.mandaba@gmail.com>",
    "to": "Marc Mandaba <marcmandaba@hotmail.com>",
    "subject": "RE: revenus de votre maman"
  },
  "proposals": [],
  "raw_excerpt": "ğŸ—• Date : 2017-05-29\nğŸ‘¤ From : Yannick Mandaba <y.mandaba@gmail.com>\nğŸ“¨ To   : Marc Mandaba <marcmandaba@hotmail.com>\nğŸ§• Subject : RE: revenus de votre maman\n---\nMaman,\nDÃ©solÃ© pour ce weekend.\nMon tÃ©lÃ©phone avait glissÃ© dans le sofa, c'est la bonne qui me l'a trouvÃ©.\n\nPour les impÃ´ts no comment.\nPour l'appart tu fais comme tu veux c'est toi qui l'a achetÃ©. Marc voit\nqu'il faut banquer, encaisser la marge et refaire une opÃ©ration pour\nreplacer cela et fixer le gain avant que cela ne retombe.\nAttention vice cachÃ© car si l'Ã©tude est faite est doit probablement Ãªtre\ndivulguÃ©e Ã  un acheteur.\nJ'y connais rien.\n\nMaman elke, ne veut pas se crÃ©er du travail et voit un revenu stable pour\nelle et pour moi.\n\nNous avons vu par le passÃ© que la peur de perdre ou de rater se transforme\nparfois en manque Ã  gagner voire en Ã©chec. En effet le conservatisme et le\nmanque d audace peuvent entraÃ®ner des pertes au lieu de sÃ©curiser.\n\nJe pense que Marc s'y connait et que Maman a un but peut-Ãªtre diffÃ©rant.\n\nSi le but est d augmenter les revenus Marc a raison.\nSi le but est de sÃ©curiser un revenu, mÃªme moindre, je dois dire Maman a\nraison tant qu'on n'a pas trouvÃ©â€‹ une autre acquisition. Cela montrerait la\nmarge rÃ©elle et ce qu'on pourrait dÃ©gager pour Y.B.T de construction Ã  Bkk.\n\nEn gros, ok Marc pour que Maman accepte il nous faut trouver une affaire\nsoit au prix de vente Pergo, soit au prix d'achat Pergo margÃ©...et on voit\nce qu'il pourrait y avoir pour bkk.\n\nSavoir oÃ¹ on va acheter avant de vendre mais le temps est comptÃ© pas le\ntemps. Donc Au moins faire Ã©tudier tous les coÃ»ts par avance car chaque\nmois c'est un .\n\nPS Nantes je crois c'est cher en taxe d'habitation. Mais Macron va changer\nÃ§a hein?! LÃ  aussi acheter\n\n\nYannick Mandaba\n+66878200622\n\nOn May 29, 2017 21:28, \"Marc MANDABA\"  wrote:\n\n> Je calendrier des dÃ©clarations dâ€™impÃ´ts nâ€™est malheureusement pas notre\n> choix, et recevoir des informations 2 heures avant la clÃ´ture nâ€™est\n> certainement pas souhaitable. Tu devrais faire la remarque Ã  lâ€™agence de\n> Cergy.\n>\n>\n>\n> Pour le patrimoine, Ã  chacun sa faÃ§on. Je ne pense pas que garder les\n> biens ad vitam soit une recette applicable dans tous les cas. Vendre et\n> acheter est quelque chose de normal, sinon il nâ€™y aurait aucun bien Ã \n> acheter ! Jâ€™espÃ¨re sincÃ¨rement que Michele a tort et quâ€™il nâ€™t aura pas de\n> problÃ¨me avec lâ€™immeuble. Dans tous les cas, ma proposition est de vendre\n> et racheter un autre bien.\n>\n>\n>\n> Je viens de regarder les ratio prix achat m2 / location m2 dans les\n> grandes villes car je veux moi aussi acheter. Par exemple, Nantes est\n> nettement plus profitable que paris : retour sur capital de 2.9% Ã  Paris,\n> et 4.1% Ã  Nantes.\n>\n> Nantes est entre 3 et 4 fois moins cher Ã  lâ€™achat, mais seulement 2 Ã  3\n> fois mois cher en location. Autrement dit, en vendant Paris au prix haut\n> (dans les 12 mois, le marchÃ© a bien repris) et en rachetant Ã  Nantes avec\n> le mÃªme montant, on fait 35% de mieux en revenu locatif. Ou bien on peut\n> financer la maison de Yannick Ã  Bangkok pour 40kEUR, et le montant restant\n> investit Ã  Nantes maintiendra le mÃªme revenu locatif que Paris.\n>\n> Bien sur il faut prendre en compte les frais de transactions, mais cela\n> reste rentable, dâ€™autant plus que les charges sont moindre Ã  Nantes.\n>\n>\n>\n> Jâ€™essaie juste de rationaliserâ€¦\n>\n>\n> Le prix du m2 dans les grandes villes de France\n>\n> Ville\n>\n> Prix m2 moyen\n> appartement\n>\n> Loyer m2 moyen\n> appartement\n>\n> *Paris *\n>\n> *8 589 â‚¬*\n>\n> *26,0 â‚¬*\n>\n> *Nantes *\n>\n> *2 679 â‚¬*\n>\n> *11,0 â‚¬*\n>\n>\n>\n>\n>\n> Pour la fÃªte des mÃ¨res, malheureusement la vie est ce quâ€™elle est.\n> Certaines choses ne se dÃ©crÃ¨tent pas, et dâ€™autres sont difficiles Ã  oublier.\n>\n>\n>\n>\n>\n> *From:* maryvonne masseron-mandaba [mailto:maryvonnemm@hotmail.com]\n> *Sent:* 29 May 2017 16:36\n> *To:* Yannick Mandaba ; Marc Mandaba  marcmandaba@hotmail.com>\n> *Subject:* revenus de votre maman\n>\n>\n>\n> bonjour,\n>\n> veuillez noter que je ne reÃ§ois que ce matin les documents de l'agence qui\n> gÃ¨re CERGY pour"
}