{
  "year": 2017,
  "seq": 14,
  "meta": {
    "date": "2017-05-30",
    "from": "Yannick Mandaba <y.mandaba@gmail.com>",
    "to": "maryvonne masseron-mandaba <maryvonnemm@hotmail.com>",
    "subject": "Re: Fwd: RE: revenus de votre maman"
  },
  "proposals": [],
  "raw_excerpt": "ğŸ—• Date : 2017-05-30\nğŸ‘¤ From : Yannick Mandaba <y.mandaba@gmail.com>\nğŸ“¨ To   : maryvonne masseron-mandaba <maryvonnemm@hotmail.com>\nğŸ§• Subject : Re: Fwd: RE: revenus de votre maman\n---\nJe continue la partie patrimoine de Marc. On dit de ne pas mettre la tÃªte\ndans le sable et au moins considÃ©rer ensemble.\nDialogue sujet taboo ok. Passons.\n\nYannick Mandaba\n+66878200622\n\nOn May 29, 2017 22:39, \"maryvonne masseron-mandaba\" \nwrote:\n\n> RÃ©ponse : Yannick mÃ©lange tout, addiction a quoi ? TÃªte a l'envers,  Je\n> parlais juste de CERGY .....\n>\n>\n> Ex - maman\n>\n> TÃ©lÃ©charger Outlook pour Android \n>\n> ------------------------------\n> *From:* Yannick Mandaba \n> *Sent:* Monday, May 29, 2017 5:29:33 PM\n> *To:* Marc Mandaba\n> *Cc:* maryvonne masseron-mandaba; Ymanda\n> *Subject:* RE: revenus de votre maman\n>\n> Maman,\n> DÃ©solÃ© pour ce weekend.\n> Mon tÃ©lÃ©phone avait glissÃ© dans le sofa, c'est la bonne qui me l'a trouvÃ©.\n>\n> Pour les impÃ´ts no comment.\n> Pour l'appart tu fais comme tu veux c'est toi qui l'a achetÃ©. Marc voit\n> qu'il faut banquer, encaisser la marge et refaire une opÃ©ration pour\n> replacer cela et fixer le gain avant que cela ne retombe.\n> Attention vice cachÃ© car si l'Ã©tude est faite est doit probablement Ãªtre\n> divulguÃ©e Ã  un acheteur.\n> J'y connais rien.\n>\n> Maman elke, ne veut pas se crÃ©er du travail et voit un revenu stable pour\n> elle et pour moi.\n>\n> Nous avons vu par le passÃ© que la peur de perdre ou de rater se transforme\n> parfois en manque Ã  gagner voire en Ã©chec. En effet le conservatisme et le\n> manque d audace peuvent entraÃ®ner des pertes au lieu de sÃ©curiser.\n>\n> Je pense que Marc s'y connait et que Maman a un but peut-Ãªtre diffÃ©rant.\n>\n> Si le but est d augmenter les revenus Marc a raison.\n> Si le but est de sÃ©curiser un revenu, mÃªme moindre, je dois dire Maman a\n> raison tant qu'on n'a pas trouvÃ©â€‹ une autre acquisition. Cela montrerait la\n> marge rÃ©elle et ce qu'on pourrait dÃ©gager pour Y.B.T de construction Ã  Bkk.\n>\n> En gros, ok Marc pour que Maman accepte il nous faut trouver une affaire\n> soit au prix de vente Pergo, soit au prix d'achat Pergo margÃ©...et on voit\n> ce qu'il pourrait y avoir pour bkk.\n>\n> Savoir oÃ¹ on va acheter avant de vendre mais le temps est comptÃ© pas le\n> temps. Donc Au moins faire Ã©tudier tous les coÃ»ts par avance car chaque\n> mois c'est un .\n>\n> PS Nantes je crois c'est cher en taxe d'habitation. Mais Macron va changer\n> Ã§a hein?! LÃ  aussi acheter\n>\n>\n> Yannick Mandaba\n> +66878200622\n>\n> On May 29, 2017 21:28, \"Marc MANDABA\"  wrote:\n>\n>> Je calendrier des dÃ©clarations dâ€™impÃ´ts nâ€™est malheureusement pas notre\n>> choix, et recevoir des informations 2 heures avant la clÃ´ture nâ€™est\n>> certainement pas souhaitable. Tu devrais faire la remarque Ã  lâ€™agence de\n>> Cergy.\n>>\n>>\n>>\n>> Pour le patrimoine, Ã  chacun sa faÃ§on. Je ne pense pas que garder les\n>> biens ad vitam soit une recette applicable dans tous les cas. Vendre et\n>> acheter est quelque chose de normal, sinon il nâ€™y aurait aucun bien Ã \n>> acheter ! Jâ€™espÃ¨re sincÃ¨rement que Michele a tort et quâ€™il nâ€™t aura pas de\n>> problÃ¨me avec lâ€™immeuble. Dans tous les cas, ma proposition est de vendre\n>> et racheter un autre bien.\n>>\n>>\n>>\n>> Je viens de regarder les ratio prix achat m2 / location m2 dans les\n>> grandes villes car je veux moi aussi acheter. Par exemple, Nantes est\n>> nettement plus profitable que paris : retour sur capital de 2.9% Ã  Paris,\n>> et 4.1% Ã  Nantes.\n>>\n>> Nantes est entre 3 et 4 fois moins cher Ã  lâ€™achat, mais seulement 2 Ã  3\n>> fois mois cher en location. Autrement dit, en vendant Paris au prix haut\n>> (dans les 12 mois, le marchÃ© a bien repris) et en rachetant Ã  Nantes avec\n>> le mÃªme montant, on fait 35% de mieux en revenu locatif. Ou bien on peut\n>> financer la maison de Yannick Ã  Bangkok pour 40kEUR, et le montant restant\n>> investit Ã  Nantes maintiendra le mÃªme revenu locatif que Paris.\n>>\n>> Bien sur il faut prendre en compte les frais de transactions, mais cela\n>> reste rentable, dâ€™autant plus que les charges sont moin"
}