{
  "year": 2017,
  "seq": 6,
  "meta": {
    "date": "2017-04-17",
    "from": "maryvonne masseron-mandaba <maryvonnemm@hotmail.com>",
    "to": "\"y.mandaba@gmail.com\" <y.mandaba@gmail.com>",
    "subject": "pourquoi les LAPINS Ã  PÃ¢ques ???"
  },
  "proposals": [],
  "raw_excerpt": "ðŸ—• Date : 2017-04-17\nðŸ‘¤ From : maryvonne masseron-mandaba <maryvonnemm@hotmail.com>\nðŸ“¨ To   : \"y.mandaba@gmail.com\" <y.mandaba@gmail.com>\nðŸ§• Subject : pourquoi les LAPINS Ã  PÃ¢ques ???\n---\nA lire,\n\n( et , arrter de me frustrer tout le temps ! , des fois je parle de choses que je connais ) =\n\n\nhttp://www.lemonde.fr/culture/video/2017/04/16/des-ufs-des-cloches-mais-pourquoi-trouve-t-on-aussi-des-lapins-de-paques_5111995_3246.html\n\n[https://www.bing.com/th?id=OVF.n8hOm1tFA0g%2brPbyj5kivg&pid=Api]\n\nDes ufs, des cloches mais pourquoi trouve-t-on aussi des ...\nwww.lemonde.fr\nLa fte de Pques clbre la rsurrection du Christ. Cest pour cela quon mange des ufs en chocolat, symbole de fcondit et de renouveau, qui voquent ..."
}