{
  "year": 2017,
  "seq": 42,
  "meta": {
    "date": "2017-12-10",
    "from": "maryvonne masseron-mandaba <maryvonnemm@hotmail.com>",
    "to": "\"y.mandaba@gmail.com\" <y.mandaba@gmail.com>, Marc MANDABA",
    "subject": "succession tante jeannette"
  },
  "proposals": [],
  "raw_excerpt": "ðŸ—• Date : 2017-12-10\nðŸ‘¤ From : maryvonne masseron-mandaba <maryvonnemm@hotmail.com>\nðŸ“¨ To   : \"y.mandaba@gmail.com\" <y.mandaba@gmail.com>, Marc MANDABA\n\t<marcmandaba@hotmail.com>\nðŸ§• Subject : succession tante jeannette\n---\nbonsoir, vous deux,\nj'ai reu  l'instant un courrier de Thrse qui me demande de me dterminer sur la succession de Tante Jeannette, et de me rendre  la runion chez le notaire le 27 dcembre.\nJe vous ai dj envoy le courriel du notaire.\nPuisque je serais, apparemment incapable psychologiquement, merci de me dire, chacun, ce que je dois, dire, ou faire, merci.\nSi je demande  ce que l'appartement me soit attribu, en leur laissant le Bas-Pont, terrain et btiments, ce qui a une valeur trs suprieure  l'estimation du notaire, en seriez-vous d'accord ?\nSi vous prfrez entrer dans \"le pot commun\", et avoir votre part de ce patrimoine, inestimable !,  ( le Bas-Pont ), vous me le dites.\nPour ma part, je suis dpite, car, ayant accompagn ma tante sans argent pour le faire, car la tutrice, trs parresseuse, ne vendait rien , et du coup je n'avais pas assez pour subvenir  ses besoins, et je travaillais beaucoup , de ma personne, pour qu'elle soit bien.\nJe ne souhaite pas forcment profiter du travail pnible que j'ai fait.\nJe souhaite que vous donniez votre avis, dfinitif, et ne plus en entendre parler !\n\nIl y a un ultimatum car tante Jeannette tant dcde le 31 juillet, la succession doit tre rgle avant le 31 dcembre,\nsinon ? je ne sais pas ?\n\nMerci de me rpondre, ou au notaire, ou  Sainte Thrse, mais me dire ce que vous voulez.\nmaman"
}