{
  "year": 2017,
  "seq": 35,
  "meta": {
    "date": "2017-11-26",
    "from": "maryvonne masseron-mandaba <maryvonnemm@hotmail.com>",
    "to": "marcmandaba <marcmandaba@gmail.com>",
    "subject": "Re:"
  },
  "proposals": [],
  "raw_excerpt": "ðŸ—• Date : 2017-11-26\nðŸ‘¤ From : maryvonne masseron-mandaba <maryvonnemm@hotmail.com>\nðŸ“¨ To   : marcmandaba <marcmandaba@gmail.com>\nðŸ§• Subject : Re: \n---\nIntressant, au mme moment je t'ai envoy un message WhatsApp, sans ampliation  quiconque ....\n\nTlcharger Outlook pour Android\n\n________________________________\nFrom: marcmandaba \nSent: Sunday, November 26, 2017 2:02:29 PM\nTo: docteur docteur maryvonne masseron-mandaba mandaba, mandaba\nCc: Yannick Mandaba\nSubject:\n\nBonjour\n\nComme discut hier soir je souhaiterais que tu cesses de me harceler, ainsi sue ma famille, par tes emails aggressifs et tes sautes d'humeurs destabilisantes.\n\nJe trouve trs dommage que tu trouves le moyen - et que tu prouves le besoin - de \"toujours tout gcher\". Cela allait bien depuis les obsques de tante Jeannette. Pourquoi tout d'un coup un mail accusateur et dplac ?Pourquoi ne peux tu t'empcher de toujours accuser quelqu'un, trouver un bouc missaire, une cible a ton fiel  ? Je ne sais pas, mais la rponse ne m'intresse plus. Je souhaite pouvoir construire une famille plus sereine et moins violente que celle que tu as construire.\n\nJe voudrais que tu respecte cela. Si tu ne le veut pas je suis prt  engager des dmarches avec l'aide du reste de la famille, des \"deux cts\".\n\nTout cela est bien dommage mais c'est mon devoir de protger ma femme, mes enfants, et moi mme contre ta maladie que tu as refuse de soigner.\n\nJe ne compte pas lancer un dbat. J ai le droit  la paix, quoique tu penses de tes actes, tu n'as pas le droit  de me les imposer.\n\nMarc"
}