{
  "year": 2017,
  "seq": 9,
  "meta": {
    "date": "2017-05-11",
    "from": "maryvonne masseron-mandaba <maryvonnemm@hotmail.com>",
    "to": "Marc MANDABA <marcmandaba@hotmail.com>",
    "subject": "RE: SCI DE CLERVILLLE - Plaquette 2016"
  },
  "proposals": [],
  "raw_excerpt": "ðŸ—• Date : 2017-05-11\nðŸ‘¤ From : maryvonne masseron-mandaba <maryvonnemm@hotmail.com>\nðŸ“¨ To   : Marc MANDABA <marcmandaba@hotmail.com>\nðŸ§• Subject : RE: SCI DE CLERVILLLE - Plaquette 2016\n---\nBonjour,\n\nYannick et Marc,\n\nj'ai cass mon PC portable au retour de Bkk,\n\nvais ce jour  Darty, le chercher,\n\nenvoi du compte de la SCI MYM MANDABA demain,\n\nvir hier  chaque socitaire 1000 euros sur les comptes respectifs  la socit gnrale,\n\nbonne journe\n\nmmm\n\n\n\n________________________________\nDe : Marc MANDABA \nEnvoy : jeudi 11 mai 2017 07:47\n : maryvonne.masseron-mandaba; Yannick Mandaba\nObjet : Fwd: SCI DE CLERVILLLE - Plaquette 2016\n\nBonjour\n\nCi joint les comptes Clerville pour dclaration impts. Dsol du retard dans la transmission.\n\nAvez vous les comptes Pergo ou faut il estimer?\n\nMerci\nMarc\n\nMarc Mandaba\nFrance +33 6 11 19 39 55\nTurquie +90 543 245 95 27\nDubai +971 565204800\n\n\n-------- Original message --------\nFrom: Contact Vitre \nDate: 27/04/2017 2:28 pm (GMT+03:00)\nTo: \"'marcmandaba@hotmail.com'\" \nCc: \"'gilbertmasseron@gmail.com'\" \nSubject: SCI DE CLERVILLLE - Plaquette 2016\n\n\nBonjour,\n\nVous trouverez en pice jointe, la plaquette 2016 des comptes annuels de la SCI DE CLERVILLE. Si toutefois, vous souhaitez la version papier de ces documents, nous restons  votre disposition pour vous les communiquer.\n\nVous en souhaitant bonne rception\n\nCordialement\n\n\nMarie-Bernadette HURAULT\n\n@expert Vitr - Socit dExpertise Comptable et de Conseil\n\n[cid:image003.png@01D282F6.06FC2800]\n\n\n\n191, boulevard de Laval  BP 80102\n35501 VITRE cedex\nTl 02 99 75 01 03\ncontact.vitre@aexpert.fr\nwww.aexpert.fr"
}