{
  "year": 2017,
  "seq": 40,
  "meta": {
    "date": "2017-12-08",
    "from": "maryvonne masseron-mandaba <maryvonnemm@hotmail.com>",
    "to": "Marc MANDABA <marcmandaba@hotmail.com>, Yannick Mandaba",
    "subject": "RE: suite"
  },
  "proposals": [
    {
      "index": -40,
      "etiquette": "Frais d'Ã©cole / bus Tristan",
      "category": "MIN",
      "duration": "LT",
      "source": "AI",
      "score": 1,
      "matched_from": [
        "ai_new"
      ]
    }
  ],
  "raw_excerpt": "ğŸ—• Date : 2017-12-08\nğŸ‘¤ From : maryvonne masseron-mandaba <maryvonnemm@hotmail.com>\nğŸ“¨ To   : Marc MANDABA <marcmandaba@hotmail.com>, Yannick Mandaba\n\t<y.mandaba@gmail.com>\nğŸ§• Subject : RE: suite\n---\nMarc,\n\n\nje ne suis pas sÃ»re que tout cela sois juste, ni pertinent, Ã  la pÃ©riode actuelle.\n\nJe viens de perdre ma tante, qui Ã©tait autant pour moi que ma mÃ¨re.\n\n\nIl n'est pas bon de prendre mes frÃ¨res Ã  tÃ©moin, car, si tu as lu les courriels, nous n'avons pas Ã©tÃ© Ã©levÃ©s pareil,\n\net\n\nnous avons la succession de tante Jeannette Ã  rÃ©gler, et cela nous pose beaucoup de soucis Ã©thiques.\n\n\nJe vous envoie Ã  tous les deux le mail du notaire, reÃ§u il a 2 jours,\n\net je ne sais vraiment quelle suite donner.\n\n\nMarc, tu as besoin de repos, cela est certain,\n\nje ne voudrais pas t'impliquer, car 2 semaines avec ta famille seraient mieux pour toi;\n\nmais si tu pouvais aller Ã  VitrÃ©, aux vacances de NoÃ«l, comme je te l'ai dÃ©jÃ  demandÃ©, cela serait un acte positif pour la famille.\n\n\nmaman\n\n\nPs: depuis le 15 septembre 1997, 20 ans dÃ©jÃ , je me rends pour mes cours de danse Ã  l'acadÃ©mie Anne de Bretagne, chaque mardi matin, et vendredi matin, de 10h Ã  12h30, et mÃªme la pÃ©riode oÃ¹ je travaillais Ã  LoudÃ©ac, puis Saint-malo, puis Rennes, et ce jour, j'en arrive. Depuis que je suis plus Ã¢gÃ©e, je prends en plus des cours de Pilates, pour garder ma musculation, les lundi, mercredi, samedi; et le jeudi, aquagym. Yannick sait que j'essaie de me plier Ã  la mÃªme discipline , quand je suis Ã  Bangkok.\n\n\n\n________________________________\nDe : Marc MANDABA \nEnvoyÃ© : vendredi 8 dÃ©cembre 2017 02:34:46\nÃ€ : maryvonne masseron-mandaba\nCc : Yannick Mandaba; Yannick Mandaba, (Perso)\nObjet : Re: suite\n\n(Je remets Yannick en copie)\n\nPetit souvenir pour remettre les choses Ã  leur place. Je ne sais pas si tu as oubliÃ© ou si tu penses que nous avons oubliÃ©.\n\nTu te rappelles quand tu voulais me gifler et que je protÃ©geais mes joues avec mes mains. Tu me pincais le ventre jusqu'Ã  ce que je baisse les mains pour protÃ©ger mon ventre et la tu pouvais me gifler.\nJusqu'Ã  ce que je sois assez grand pour te bloquer la main.\n\nDonc on va arrÃªter de se raconter des histoires avec  \"le corps d'un enfant c'est sacrÃ© \", et avec Cecile qui giflerai ma fille depuis qu'elle a 15 mois. D'aprÃ¨s tes \"dÃ©ductions\".\nMoi je parle de faits, pas de suppositions.\n\nEst ce que tu crois toi mÃªme Ã  ce que tu racontes? Arrives tu Ã  te persuader avec le temps?\n\nMimer mon pÃ¨re comme un singe en hurlant que c'est comme Ã§a qu'il  \"baise ses putes\".\nMe faire dormir Ã  la place de mon pÃ¨re dans votre lit durant des annÃ©es Ã©tant dÃ©jÃ  prÃ© ado.\nNe mÃªme pas laver tes enfants tous les jours. HygiÃ¨ne dÃ©plorable et maladie d'un autre Ã¢ge (le comble pour un docteur).\nSpectacles hebdomadaires de violences a la maison: insultes, objets lancÃ©s, coup de ceinture.\nToi qui encourageait Yannick (et moi) a se rebeller contre son pere, mÃªme physiquement. Situation jamais rÃ©glÃ©e emmenÃ©e dans la tombe avec les regrets Ã©ternels de Yannick.\nTraiter toutes nos copines de 15 Ã  25 ans de putes, sans exception.\nMe dire d'arrÃªter d'utiliser le nom de mon pÃ¨re a l'Ã©cole.\nDire que la grand mÃ¨re de Cecile est une prostituÃ©e.\nDire que mes enfants Ã  13 mois font des gestes pornographique entre eux car nous regardons des film pornos devant eux ou couchons devant eux.\nM'accuser d'avoir tuÃ© mon pÃ¨re.\nHumilier Yannick devant ses amis et sa belle famille.\nAmener tes frÃ¨res et soeurs Ã  te rejeter en les accusant de maltraiter leur maman, et de casser intentionnellement le doigt de leur tante pour l'empÃªcher de signer un document.\nFaire la guerre au notaire, aux chargÃ©s de tutelle.\nEt mentir en prÃ©tendant faire une thÃ©rapie avec un docteur qui est en fait au Canada? Et ensuite prÃ©tendre, une fois prise en flagrant dÃ©lit de mensonge, que tu fais une thÃ©rapie par tÃ©lÃ©phone...\n\nEt tout va bien...? Et tu donnes des leÃ§ons d'Ã©ducation et d'Ã©quilibre ? Et tu demandes le droit Ã .... quoi exactement ? Faire subir Ã§a a mes enfants?\n\nJe ne sais pas dans quel monde tu "
}