{
  "year": 2017,
  "seq": 5,
  "meta": {
    "date": "2017-04-05",
    "from": "maryvonne masseron-mandaba <maryvonnemm@hotmail.com>",
    "to": "\"y.mandaba@gmail.com\" <y.mandaba@gmail.com>",
    "subject": "VOL PARIS BKK par TEHERAN ( mahan airlines )"
  },
  "proposals": [],
  "raw_excerpt": "ðŸ—• Date : 2017-04-05\nðŸ‘¤ From : maryvonne masseron-mandaba <maryvonnemm@hotmail.com>\nðŸ“¨ To   : \"y.mandaba@gmail.com\" <y.mandaba@gmail.com>\nðŸ§• Subject : VOL PARIS BKK par TEHERAN ( mahan airlines )\n---\n*\n9 Vous avez besoin daide ?\n\n\n\n  *\n  *\n  *   Mes voyages\n  *\n  *\naConnexion\n  *\n  *\n ,\n     *   \n     *   \n     *   \n     *   \n        *\n        *\n        *\n     *   \n     *   \n     *   \n     *   \n     *   \n     *   \n     *   \n     *   \n     *   \n     *   \n     *   \n     *   \n     *   \n\n\nVoyagez plus loin\ntapes de la rservation:\n\n  *\nRecherche\n  *\nSlection des vols\n  *\nCoordonnes des passagers\n  *\nPaiement\n  *\nConfirmation\n\nStatut de votre rservation\n8\nRservation confirme\nVotre code de rservation est : Vols : 23530061\nProchaines tapes\nVous recevrez bientt un e-mail  l'adresse maryvonnemm@hotmail.com contenant le statut de votre rservation\nPensez  consulter les spams et la corbeille et, pour les rservations de vol, n'oubliez pas de vous enregistrer auprs des compagnies ariennes concernes.\nVous pouvez consulter le statut de votre rservation ou accder aux dtails de votre voyage  tout moment, n'importe o, depuis un ordinateur ou un smartphone, dans la rubrique Mes voyages.\nMes voyages\nDtails du voyage\nS\nAller\nDure\n14 h 35 min\nDpart\n11:50 lun., 10 avr.\nCharles De Gaulle  Paris\nCompagnie\nMahan Airlines W5 107\nOpr par\nMahan Airlines\nArrive\n19:40 lun., 10 avr.\nImam Khomeini Intl  Thran\nAvion/vhicule\nClasse\nconomique\nDure de l'escale 2 h 30 min Vrifiez l'heure et la porte d'embarquement avec la compagnie arienne.\nCorrespondance : changement d'avion.\nDpart\n22:10 lun., 10 avr.\nImam Khomeini Intl  Thran\nCompagnie\nMahan Airlines W5 51\nOpr par\nMahan Airlines\nArrive\n07:25 mar., 11 avr.\nSuvarnabhumi Airport  Bangkok\nAvion/vhicule\nClasse\nconomique\nT\nRetour\nDure\n16 h 45 min\nDpart\n22:35 ven., 21 avr.\nSuvarnabhumi Airport  Bangkok\nCompagnie\nMahan Airlines W5 50\nOpr par\nMahan Airlines\nArrive\n03:45 sam., 22 avr.\nImam Khomeini Intl  Thran\nAvion/vhicule\nClasse\nconomique\nDure de l'escale 3 h 00 min Vrifiez l'heure et la porte d'embarquement avec la compagnie arienne.\nCorrespondance : changement d'avion.\nDpart\n06:45 sam., 22 avr.\nImam Khomeini Intl  Thran\nCompagnie\nMahan Airlines W5 106\nOpr par\nMahan Airlines\nArrive\n10:20 sam., 22 avr.\nCharles De Gaulle  Paris\nAvion/vhicule\nClasse\nconomique\nPassagers\nPassager\nType\nCarte d'identit\nBagage  enregistrer\nmaryvonne masseron mandaba\nAdulte\nPasseport 15AY98831\n1 bagage  enregistrer inclus dans le tarif\nOpodo Extra\nVous avez choisi le Service Basique d'Opodo, l'option conomique qui n'inclut que la confirmation de rservation par e-mail. Ce service ne comprend pas de notifications de changement d'horaire, nous vous conseillons fortement de contacter votre compagnie arienne avant le dpart. Si vous souhaitez nous contacter, vous pouvez composer le 01 70 91 75 75. Toute modification ou annulation sera facture 50  par passager, auxquels peuvent s'ajouter des frais additionnels de la compagnie arienne (voir les conditions tarifaires applicables).\nPaiement\n\nLe montant total de votre rservation est : 601,41 \n\nConditions relatives aux prix de cette rservation\n\nTrouvez ci-dessous le dtail de la somme dbite de votre carte"
}