{
  "year": 2017,
  "seq": 26,
  "meta": {
    "date": "2017-09-25",
    "from": "maryvonne masseron-mandaba <maryvonnemm@hotmail.com>",
    "to": "\"y.mandaba@gmail.com\" <y.mandaba@gmail.com>",
    "subject": "deux fois encore le virement de ton compte sogÃ©nÃ© de 1000 euros vers ton compte thai a Ã©chouÃ©"
  },
  "proposals": [],
  "raw_excerpt": "ðŸ—• Date : 2017-09-25\nðŸ‘¤ From : maryvonne masseron-mandaba <maryvonnemm@hotmail.com>\nðŸ“¨ To   : \"y.mandaba@gmail.com\" <y.mandaba@gmail.com>\nðŸ§• Subject : deux fois encore le virement de ton compte sogÃ©nÃ© de 1000 euros vers ton compte thai a Ã©chouÃ©\n---\nLibell Slection de la prestation Solde au 22/09/2017\n\n+2 774,52 EUR [https://particuliers.secure.societegenerale.fr/img/restitution/i_blanc.gif]\n Total des oprations en cours de traitement :  0,00 EUR\n Oprations  venir :   [Consulter les oprations] \n Caractristiques de la prestation n 01713 00050105599\n Solde au dernier relev le 04/09/2017 :         +799,52 EUR\nDtail des oprations au 24/09/2017\n[Relevs en ligne] [Version imprimable]\nDate    [https://particuliers.secure.societegenerale.fr/img/restitution/pictohorlogebleu.gif]   Libell Dbit   Crdit\n18/09/2017\n         RETOUR DE FONDS V              +975,00 EUR\n16/09/2017\n         VIREMENT DIVIDE                +1 000,00 EUR\n31/08/2017\n         FRAIS VIR INTL AG      -26,00 EUR\n30/08/2017\n         000001 VIR INTL E      -1 000,00 EUR\n24/07/2017\n         FRAIS VIR INTL RE      -22,00 EUR\n21/07/2017\n         VIR RECU 71936         +1 000,00 EUR\n21/07/2017\n         FRAIS SUR OPERATI      -16,00 EUR\n12/07/2017\n         FRAIS DE TENUE DE      -6,00 EUR\n06/07/2017\n         COTISATION ANNUEL      -30,00 EUR\n[Haut de page]Haut de page\nFin de l'historique de vos oprations\n[convertit de l'EUR vers le FRF ou l'inverse]"
}