{
  "year": 2017,
  "seq": 11,
  "meta": {
    "date": "2017-05-29",
    "from": "maryvonne masseron-mandaba <maryvonnemm@hotmail.com>",
    "to": "\"y.mandaba@gmail.com\" <y.mandaba@gmail.com>",
    "subject": "dÃ©solÃ©e"
  },
  "proposals": [],
  "raw_excerpt": "ğŸ—• Date : 2017-05-29\nğŸ‘¤ From : maryvonne masseron-mandaba <maryvonnemm@hotmail.com>\nğŸ“¨ To   : \"y.mandaba@gmail.com\" <y.mandaba@gmail.com>\nğŸ§• Subject : dÃ©solÃ©e\n---\ndsole Yannick, je n'avais pas vu que c'tait Marc qui t'avait mis la tte  l'envers, je parlais juste de Cergy.\n\nEt du retard qu'ils ont occasionn pour les comptes de Pergolse.\n\nCela fait un mois que j'avais envoy les chiffres bruts de Pergo  Fidal.\n\nIls ne pouvaient finaliser faute de retour de SERGIC qui gre Cergy.\n\nCar je ne suis qu'un tout petit compte pour eux.\n\nVu que la fiscalit change chaque anne, je prfre payer Fidal plutt que me tromper.\n\nDemain j'aurai les chiffres exacts.\n\nSur le principe de vendre Pergolse, je n'ai pas encore reu le compte-rendu d'expertise \"infiltrations\".\n\nex M"
}