{
  "year": 2020,
  "seq": 61,
  "meta": {
    "date": "2020-05-09",
    "from": "\"Yannick Mandaba\" <y.mandaba@gmail.com>",
    "to": "\"maryvonne masseron-mandaba\" <maryvonnemm@hotmail.com>",
    "subject": "FW: Distribution des factures des frais de scolarit√© 2019-2020 / The 2019-2020 school fee invoices are distributed to the students."
  },
  "proposals": [
    {
      "index": -61,
      "etiquette": "Dossier de bourse Tristan",
      "category": "MIN",
      "duration": "LT",
      "source": "AI",
      "score": 1,
      "matched_from": [
        "ai_new"
      ]
    }
  ],
  "raw_excerpt": "üóï Date : 2020-05-09\nüë§ From : \"Yannick Mandaba\" <y.mandaba@gmail.com>\nüì® To   : \"maryvonne masseron-mandaba\" <maryvonnemm@hotmail.com>\nüßï Subject : FW: Distribution des factures des frais de scolarit√© 2019-2020 / The 2019-2020 school fee invoices are distributed to the students.\n---\nFrom: Kingkan [mailto:kingkan.k@lfib.ac.th] \nSent: Thursday, November 21, 2019 09:36\nTo: Yannick Mandaba \nCc: 'Wadeekanya Soonthornsingha' \nSubject: Re: Distribution des factures des frais de scolarit√© 2019-2020 / The 2019-2020 school fee invoices are distributed to the students.\n \nBonjour Monsieur,\nDe notre c√¥t√©, nous avons re√ßu :\nle 1er versement le 16/10/19 : 16900 THB\n\nle 2√®me versement le 19/11/19 : 107395.57 THB\n\navec un exc√©dent accumul√© de l'ann√©e derni√®re : 454.69 THB\n \nTotal re√ßu : 124 750.26 THB.\n\n\nBien cordialement,\n \n \n \n \n \n \nLyc√©e Fran√ßais International\nBangkok, Tha√Ølande\n\nKingkan KONG-IN\nService Comptabilit√©\n \n498, Soi Ramkhamhaeng 39 (Thep Leela 1), Wangthonglang, Bangkok, 10310\nT√©l :  66 (0) 29 34 80 08\nemail : kingkan.k@lfib.ac.th  \n\n  www.lfib.ac.th |   LinkedIn |   Facebook\n \n\n \nCe courriel (de m√™me que les fichiers joints) est strictement r√©serv√© √† l'usage de la personne ou de l'entit√© √† qui il est adress√© et peut contenir de l'information privil√©gi√©e et confidentielle. Toute divulgation, distribution ou copie de ce courriel est strictement prohib√©e. Si vous avez re√ßu ce courriel par erreur, veuillez nous en aviser sur-le-champ, d√©truire toutes les copies et le supprimer de votre syst√®me informatique.\nThis communication (including any files transmitted with it) is intended solely for the person or entity to whom it is addressed, and may contain confidential or privileged information. The disclosure, distribution or copying of this message is strictly forbidden. Should you have received this communication in error, kindly contact the sender promptly, destroy any copies and delete this message from your computer system.\nOn 15/11/2019 14:25, Yannick Mandaba wrote:\nBonjour,\n \nJustificatif frais de scolarit√©, \n \nVersement num√©ro 2 (ci-joint)\n=2 200 000 f cfa = 3354 euros\n√Ä envoyer au Lyc√©e de Bangkok\n \n17 000 baths envoy√©s le 14 octobre 19\n=520 euros\nVersement num√©ro 1\n \nAu total = 3874 euros\nSoit 129 106 baths\n \nCordialement,\n \nYannick Mandaba \n \nFrom: Kingkan [mailto:kingkan.k@lfib.ac.th] \nSent: Friday, November 15, 2019 10:49\nTo: Yannick Mandaba   \nSubject: Re: Distribution des factures des frais de scolarit√© 2019-2020 / The 2019-2020 school fee invoices are distributed to the students.\n \nBonjour,\nDans le cas o√π vous auriez r√©gl√© le paiement, merci de nous envoyer la preuve du paiement s'il vous pla√Æt.\n \nBien cordialement,\n \n \n \n \n \n \nLyc√©e Fran√ßais International\nBangkok, Tha√Ølande\n\nKingkan KONG-IN\nService Comptabilit√©\n \n498, Soi Ramkhamhaeng 39 (Thep Leela 1), Wangthonglang, Bangkok, 10310\nT√©l :  66 (0) 29 34 80 08\nemail : kingkan.k@lfib.ac.th  \n\n  www.lfib.ac.th |   LinkedIn |   Facebook\n \n\n \nCe courriel (de m√™me que les fichiers joints) est strictement r√©serv√© √† l'usage de la personne ou de l'entit√© √† qui il est adress√© et peut contenir de l'information privil√©gi√©e et confidentielle. Toute divulgation, distribution ou copie de ce courriel est strictement prohib√©e. Si vous avez re√ßu ce courriel par erreur, veuillez nous en aviser sur-le-champ, d√©truire toutes les copies et le supprimer de votre syst√®me informatique.\nThis communication (including any files transmitted with it) is intended solely for the person or entity to whom it is addressed, and may contain confidential or privileged information. The disclosure, distribution or copying of this message is strictly forbidden. Should you have received this communication in error, kindly contact the sender promptly, destroy any copies and delete this message from your computer system.\nOn 18/10/2019 18:14, Yannick Mandaba wrote:\nBonjour,\n \nJe vous remercie. \nUn prochain paiement sera initi√© depuis la RCA au courant de la semaine prochaine.\nJe confirmerai le d√©part du transfert et le"
}