{
  "year": 2020,
  "seq": 79,
  "meta": {
    "date": "2020-11-13",
    "from": "maryvonne masseron-mandaba <maryvonnemm@hotmail.com>",
    "to": "'yannick mandaba' <y.mandaba@gmail.com>, \"maryvonne.masseron@free.fr\"",
    "subject": "Re: TRÂ : TRÂ : RE: Degat des eaux"
  },
  "proposals": [
    {
      "index": -79,
      "etiquette": "Appartement PergolÃ¨se (vente/location)",
      "category": "MIN",
      "duration": "LT",
      "source": "AI",
      "score": 1,
      "matched_from": [
        "ai_new"
      ]
    }
  ],
  "raw_excerpt": "ðŸ—• Date : 2020-11-13\nðŸ‘¤ From : maryvonne masseron-mandaba <maryvonnemm@hotmail.com>\nðŸ“¨ To   : 'yannick mandaba' <y.mandaba@gmail.com>, \"maryvonne.masseron@free.fr\"\n\t<maryvonne.masseron@free.fr>, Marc MANDABA <marcmandaba@hotmail.com>\nðŸ§• Subject : Re: TRÂ : TRÂ : RE: Degat des eaux\n---\nBonjour,\nUn chque de la SCI a d arriver par voie postale au domicile de Braidy Charbel, il peut tre utilis de prfrence, pour simplifier la gestion.\nL'Ordre du Jour de la runion de coproprit du 9 rue Pergolese 75116 Paris\n- dat du 3 novembre 2020\n- pour se tenir le 25 novembre\nne fait pas figurer ce problme de fuites d'eau.\nJ'avais prvu de participer  cette runion par visioconference zoom, comme propos par le syndic ( visioconference, ou vote par correspondance, ou pouvoir).\nLa rponse dfinitive est  donner ce jour.\nDonc si Marc est volontaire pour s'exposer,  malgr un confinement lgal, il peut le faire, mais ce n'est pas ma prfrence. S'il veut y participer, je lui envoie un pouvoir.\nJe n'ai pas t destinataire d'un double du courrier de notre part, au Syndic, signalant la fuite, et demandant une enqute par la DDE.\nMerci des rponses, avant 16h.\nMMM\n\nTlcharger Outlook pour Android\n\n________________________________\nFrom: Marc MANDABA \nSent: Friday, November 13, 2020 11:44:10 AM\nTo: ''maryvonne masseron-mandaba'' ; 'yannick mandaba' ; maryvonne.masseron@free.fr \nSubject: Re: TR : TR : RE: Degat des eaux\n\nBonjour,\n\nJe viens de remettre l'argent  Charbel pour Adergaz. J'ai aussi crois notre concierge. Apparemment la fuite est en cours depuis 4-5 mois. Elle a d'abord touch le voisin, et elle n'atteint notre appartement que maintenant.\nDes experts sont dj passs et n'ont pas trouv l'origine exacte car il est ncessaire de casser le sol de la salle de bain en cause au 5eme. Cel va tre fait dans les jours/semaines qui viennent.\n\nC'est un sujet qui mrite d'tre soulev  l'AG car les rseaux d'eau entre appartements tombent en gnral sous la responsabilit de la copro. L'assurance pour ce dgt est une chose, mais il faut que le sujet soit dfinitivement rgler, si on cela recommencera.\n\nComme j'ai les accs au compte internet de la copro (sur l'appel de charges transmis par maman), je vais jeter un coup d'oeil aux statuts et demander ventuellement une mise  l'ordre du jour de la prochaine AG  laquelle je devrais pouvoir me rendre. Mme si le sujet se rgle d'ici l il faut le documenter.\n\nSauf opposition de votre part, je procde comme propos ci dessus.\n\nMerci\nMarc\n\nMarc Mandaba\nFrance +33 611193955 (WhatsApp)\n\n________________________________\nFrom: Marc MANDABA \nSent: Tuesday, November 10, 2020 9:36:56 AM\nTo: ''maryvonne masseron-mandaba'' ; 'yannick mandaba' ; maryvonne.masseron@free.fr \nSubject: Re: TR : TR : RE: Degat des eaux\n\nMerci.\n\nJe vois que je n'tais pas destinataire.\n\nJe leur rpondrai et j'insisterai pour tre dans la boucle.\nMerci\n\nMarc Mandaba\nFrance +33 611193955 (WhatsApp)\nMorocco   +212 6 1252 3030\n\n________________________________\nFrom: maryvonne.masseron@free.fr \nSent: Tuesday, November 10, 2020 9:13:49 AM\nTo: marcmandaba@hotmail.com ; ''maryvonne masseron-mandaba'' ; 'yannick mandaba' \nSubject: TR : TR : RE: Degat des eaux\n\nSuivi Assurance Axa\nSCI MYM MANDABA\n9 rue Pergolese 75116 Paris\n\nmaryvonne masseron - 41 rue du puits-mauger 35000 rennes 0299302000 0680078113"
}