{
  "year": 2020,
  "seq": 55,
  "meta": {
    "date": "2020-03-27",
    "from": "maryvonne masseron-mandaba <maryvonnemm@hotmail.com>",
    "to": "Yannick Mandaba <y.mandaba@gmail.com>",
    "subject": "Re: merci pour les devoirs"
  },
  "proposals": [],
  "raw_excerpt": "ðŸ—• Date : 2020-03-27\nðŸ‘¤ From : maryvonne masseron-mandaba <maryvonnemm@hotmail.com>\nðŸ“¨ To   : Yannick Mandaba <y.mandaba@gmail.com>\nðŸ§• Subject : Re: merci pour les devoirs\n---\nOK, merci.\nTu pourras reprendre avec lui=\nlever\nleveur\nAu lieu de fermier, qui tait cependant trs bien, mais pas de la mme racine\nIl est fort +++\nEt le texte  la matresse, aprs les rosaces, il l'a crit seul ?... C'est parfait. ++++\n\nTlcharger Outlook pour Android\n\n________________________________\nFrom: Yannick Mandaba \nSent: Friday, March 27, 2020 4:29:40 AM\nTo: 'maryvonne masseron-mandaba' \nSubject: RE: merci pour les devoirs\n\n\nBonjour,\n\n\n\nCorrections en ligne (publies, pas lve par lve).\n\nTristan fait les devoirs seul.\n\nJe regarde les exercices, je ne corrige plus les dictes (jamais de fautes), je regarde quil appuie bine sur le crayon et forme bien les mots.\n\n\n\n\n\nFrom: maryvonne masseron-mandaba [mailto:maryvonnemm@hotmail.com]\nSent: Thursday, March 26, 2020 21:04\nTo: y.mandaba@gmail.com\nSubject: merci pour les devoirs\n\n\n\nEst-ce que Tristan a des corrections, par la maitresse ?\n\nEst-ce que Tristan a fait les devoirs de ce jour seul ?\n\n\n\nTu pourras me commenter les termes du decret du 1 er ministre de ce jour, concernant la fermeture des frontires ?\n\n\n\nmerci\n\n\n\n\n\nProvenance : Courrier pour Windows 10"
}