{
  "year": 2020,
  "seq": 52,
  "meta": {
    "date": "2020-03-13",
    "from": "maryvonne masseron-mandaba <maryvonnemm@hotmail.com>",
    "to": "\"y.mandaba@gmail.com\" <y.mandaba@gmail.com>",
    "subject": "Echange de courriel avec Service ComptabilitÃ© LFIB TRISTAN MANDABA CPD AES"
  },
  "proposals": [],
  "raw_excerpt": "ðŸ—• Date : 2020-03-13\nðŸ‘¤ From : maryvonne masseron-mandaba <maryvonnemm@hotmail.com>\nðŸ“¨ To   : \"y.mandaba@gmail.com\" <y.mandaba@gmail.com>\nðŸ§• Subject : Echange de courriel avec Service ComptabilitÃ© LFIB TRISTAN MANDABA CPD AES\n---\nBonjour,\n\nLe virement a t crdit sur le compte du LFIB 21/02/2020 avec un montant de 11630 THB. Il vous reste donc les 250 THB  solder.\n\n\n\nBien cordialement,\n\n\n\n\n\n\nLyce Franais International\nBangkok, Thalande\n\nKingkan KONG-IN\nService Comptabilit\n\n498, Soi Ramkhamhaeng 39 (Thep Leela 1), Wangthonglang, Bangkok, 10310\nTl :  66 (0) 29 34 80 08\nemail : kingkan.k@lfib.ac.th\n\nwww.lfib.ac.th | LinkedIn | Facebook\n\n[cid:image001.png@01D5F94B.CBD38C80][cid:image003.jpg@01D5F94C.1BAC8720]\n\nCe courriel (de mme que les fichiers joints) est strictement rserv  l'usage de la personne ou de l'entit  qui il est adress et peut contenir de l'information privilgie et confidentielle. Toute divulgation, distribution ou copie de ce courriel est strictement prohibe. Si vous avez reu ce courriel par erreur, veuillez nous en aviser sur-le-champ, dtruire toutes les copies et le supprimer de votre systme informatique.\nThis communication (including any files transmitted with it) is intended solely for the person or entity to whom it is addressed, and may contain confidential or privileged information. The disclosure, distribution or copying of this message is strictly forbidden. Should you have received this communication in error, kindly contact the sender promptly, destroy any copies and delete this message from your computer system.\nOn 22/02/2020 02:39, maryvonne masseron-mandaba wrote:\nBonjour,\n\nMerci de trouver le justificatif de virement de 11880 Tha baths\nPour mon petit-fils Tristan MANDABA, en CPD.\n- 2860 BATH\npour le lundi  15h10\nSports collectifs\n- 5120 BATH\npour le mercredi  15h10\nTaekwondo\n- 3900 BATH\npour le vendredi  15h10\nArts plastiques\n\nCordialement\nMaryvonne Mandaba\nmaryvonnemm@hotmail.com\n\n\n[Image]\n\nTlcharger Outlook pour Android\n\n\nProvenance : Courrier pour Windows 10"
}