{
  "year": 2020,
  "seq": 80,
  "meta": {
    "date": "2020-11-23",
    "from": "\"Yannick Mandaba\" <y.mandaba@gmail.com>",
    "to": "\"'Marc MANDABA'\" <marcmandaba@hotmail.com>,",
    "subject": "RE: Pergolese (privÃ©)"
  },
  "proposals": [
    {
      "index": -80,
      "etiquette": "Appartement PergolÃ¨se (vente/location)",
      "category": "MIN",
      "duration": "LT",
      "source": "AI",
      "score": 1,
      "matched_from": [
        "ai_new"
      ]
    },
    {
      "index": -80,
      "etiquette": "Frais bus Tristan",
      "category": "MIN",
      "duration": "LT",
      "source": "AI",
      "score": 1,
      "matched_from": [
        "ai_new"
      ]
    }
  ],
  "raw_excerpt": "ðŸ—• Date : 2020-11-23\nðŸ‘¤ From : \"Yannick Mandaba\" <y.mandaba@gmail.com>\nðŸ“¨ To   : \"'Marc MANDABA'\" <marcmandaba@hotmail.com>,\n\t\"'maryvonne masseron-mandaba'\" <maryvonnemm@hotmail.com>,\n\t\"'Yannick Mandaba'\" <ymandaba@gmail.com>\nðŸ§• Subject : RE: Pergolese (privÃ©) \n---\nMais Maman, je pense que Marc est capable de gÃ©rer Ã§a.\nCe ne serait trop dur pour lui?\n \nEt mÃªme si cela va moins vite que tu voudrais, il vient Ã  peine dâ€™essayer et tu es sur son dos, Ã  dÃ©busquer ceci et cela.\nIl avait demandÃ© la paix et câ€™est 10 emails quâ€™il doit se bouffer pour canaliser tes critiques, rectifier ceci et cela.\n \nIls ne lisent pas leur plateforme, soit, un coup de fils et un email Marc a dit lâ€™avoir faitâ€¦ bon\nSâ€™il nâ€™a pas de retour il est grand pour trouver son chemin ou te demander sâ€™il a besoin de on aide.\nVisiblement la fuite est lÃ  depuis des mois, donc si Marc prend 8 jours pour avoir un meilleurs prixâ€¦\n \n \nLÃ  le moindre compte rendu est Ã©pluchÃ© â€¦ \nÂ« Mais oÃ¹ est la copie du devis trop cher ? Mais pourquoi tu nâ€™as pas fait comme jâ€™aurais fait? Â»\nÂ« MAISâ€¦ATTEND UN PEU NON ? Câ€™est comment !!! HÃ©Ã©Ã©Ã©Ã©eeeeh ! Â»\n \n \n \nFrom: Marc MANDABA [mailto:marcmandaba@hotmail.com] \nSent: Monday, November 23, 2020 20:38\nTo: maryvonne masseron-mandaba ; Yannick Mandaba \nSubject: RE: Pergolese (privÃ©) \n \nLes Ã©crits sont ci-dessous. Ne peux-tu pas accepter mÃªme les preuves sous ton nez ? \n \nMarc Mandaba\nMobile France  +33 6 1119 3955 (WhatApp)\n \nFrom: maryvonne masseron-mandaba  > \nSent: 23 November 2020 14:37\nTo: Yannick Mandaba  >; Marc MANDABA  >\nSubject: Re: Pergolese (privÃ©) \n \nMarc, \nSuite, \nJe n'ai jamais eu communication du devis. \nC'est Braidy Charbel qui m'a dit hier, \nQue tu avais trouvÃ© le devis trop cher. \nDonc il a repondu nÃ©gativement aux peintres, \nIl ne peut demander leur un avis sur le dÃ©gÃ¢t, \nOn doit trouver une autre entreprise \nTu ne peux t'impliquer \nPuis te dÃ©sengager \nPuis contrÃ´ler Ã  nouveau \nEt te desengager encore \nCe n'est pas responsable. \nDÃ©solÃ©e, je vais marcher avec ma voisine. \nMM \nTÃ©lÃ©charger Outlook pour Android  \n \n  _____  \n\nFrom: Marc MANDABA  >\nSent: Monday, November 23, 2020 2:23:30 PM\nTo: maryvonne masseron-mandaba  >; Yannick Mandaba  >\nSubject: RE: Pergolese (privÃ©) \n \nCe nâ€™est pas vrai. Jâ€™ai informÃ© pour le devis cher le 9 novembre. Jâ€™ai dit que je lancerai un second devis et que ce sera fait apÃ¨s le reglement du sinistre\n \nCi joint le mail. Ci-dessous lâ€™extrait\n \nTROP DE MENSONGES. JE ME DESENGAGE\n \n \nFrom: Marc MANDABA \nSent: 09 November 2020 16:39\nTo: Yannick Mandaba  y.mandaba@gmail.com>; 'maryvonne masseron@free. fr'  maryvonne.masseron@free.fr>; 'docteur docteur docteur maryvonne masseron-mandaba mandaba mandaba mandaba'  maryvonnemm@hotmail.com>; 'Yannick Mandaba'  ymandaba@gmail.com>\nSubject: RE: DÃ©gÃ¢ts des eaux Pergo\n \nBonsoir,\n \nLe point sur Pergo :\n*  DÃ©gat des eaux \no   Jâ€™ai envoyÃ© un mail au syndic et je les ai appelÃ© pour confirmer rÃ©ception. Ils confirment quâ€™il engagent une investigation. Un voisin du 4eme (cotÃ© rue de pense, un certain M. Manier) les a dÃ©jÃ  alertÃ©\no   Pas encore dâ€™action auprÃ¨s de lâ€™assureur mais maman leur a fait un mail\n*  Adergaz programmÃ© ce vendredi 13 Ã  13h (!) pour rÃ©vision chaudiÃ¨re. 154â‚¬ TTC Ã  lâ€™ordre de la SCI. Je rÃ¨glerai et fournirai la facture\n*  Premier devis obtenu pour peinture, trÃ¨s cher (5,500EUR pour tout lâ€™appart). Un partie sera couverte par lâ€™assurance pour dÃ©gÃ¢t des eaux. Je lance un second devis. Quoi quâ€™il en soit, maintenant il faut attendre le rÃ¨glement du sinistre.\n*  Charbel a Ã©tÃ© diagnostiquÃ© COVID il y a 7 jours et est isolÃ© jusquâ€™Ã  ce weekend (il restera au salon pour la visite Adergaz ce vendredi)\nMerci\nMarc\n \n \n \nMarc Mandaba\nMobile France  +33 6 1119 3955 (WhatApp)\n \nFrom: maryvonne masseron-mandaba  > \nSent: 23 November 2020 14:14\nTo: Yannick Mandaba  >; Marc MANDABA  >\nSubject: Re: Pergolese (privÃ©) \n \nMarc,\nJustement, cela me gÃªne que tu transmettes, (et avec retard) les messages de mr braidy charbel.\nPar exemple , tu as proposÃ© de faire une avance pour les"
}