{
  "year": 2020,
  "seq": 83,
  "meta": {
    "date": "2020-12-16",
    "from": "\"Yannick Mandaba\" <y.mandaba@gmail.com>",
    "to": "\"'Marc MANDABA'\" <marcmandaba@hotmail.com>,",
    "subject": "RE: Bangui 2021"
  },
  "proposals": [
    {
      "index": -83,
      "etiquette": "Visa / immigration",
      "category": "MIN",
      "duration": "LT",
      "source": "AI",
      "score": 1,
      "matched_from": [
        "ai_new"
      ]
    }
  ],
  "raw_excerpt": "ðŸ—• Date : 2020-12-16\nðŸ‘¤ From : \"Yannick Mandaba\" <y.mandaba@gmail.com>\nðŸ“¨ To   : \"'Marc MANDABA'\" <marcmandaba@hotmail.com>,\n\t\"'Yannick Mandaba'\" <ymandaba@gmail.com>,\n\t\"'Yannick Mandaba'\" <ymanda@gmail.com>,\n\t\"'docteur maryvonne masseron-mandaba mandaba mandaba'\" <maryvonnemm@hotmail.com>\nðŸ§• Subject : RE: Bangui 2021\n---\nSuper, merci Marc pour le temps et largent dpenss pour lentretien et la\nvalorisation du bien commun.\nBise.\n \nFrom: Marc MANDABA [mailto:marcmandaba@hotmail.com] \nSent: Wednesday, December 16, 2020 06:39\nTo: Yannick Mandaba ; Yannick Mandaba\n; 'docteur maryvonne masseron-mandaba mandaba mandaba\n(maryvonnemm@hotmail.com)' \nSubject: Bangui 2021\n \nBonsoir,\n \nJai eu de Yannick un message de consensus pour faire une rnovation de la\nmaison a minima (sans toucher  la chambre et sdb de maman) et lancer le\nprojet de construction dannexes.\n \nPar ailleurs je pense que la petite investigation de ce matin de maman a\nvalid ce que jai dit : je nai pas touch  sa chambre. Je suis surement\nun animal trange car je dis ce que je fais et fais ce que je dis. Je note\nque Yangu est le nouveau garant moral de nos relations charg de vrifier\nmes dires  dont acte.\n \nEn bref, le projet mis  jour :\n \nMaison \n-        Entretien/reno extrieure (en cours)\n-        rnovation lgre des deux chambres du fond (carrelage, peinture,\nluminaire et clim)\n-        Renovation sdb du fond (remplacement des porcelaines, carrelage et\nchauffe eau)\n-        Renovation legere cuisine (paillasse + portes placard) \n-        Equipement cuisine (plaques lectriques, frigo)\nPas de rnovation lec ou plomberie. On ne touche pas au salon ni couloir ni\nchambre parents et sdb.\nJe verrai  quel point je pousse la rnovation de la grande maison car (i)\nlancer une rno partielle nest pas optimal (ii)cest vou  se dgrader en\nlabsence doccupants, et (iii) cest  fonds perdus\n \nExtrieur \n-        Clture aux normes ONU (portail, occultation et mur 3m de haut) \n-        Forage et chteau deau pour alimentation autonome\n-        Groupe lectrogne\n-        Travail paysager\n \nAnnexe 1 (Marc)\n-        Maison 2 ou 3 chambres, ventuellement  tage pour limiter\nlemprise au sol. (Mais la construction dtage est chre  Bangui, ciment\net fer. Je regarderai au mieux pour que la concession soit harmonieuse)\n \nAnnex 2 (Yan) \n-        Prparation des attentes eau/elec, et positionnement sur plan de\nmasse\n \nJe vais confier le travail  LePrevost. Ce qui est envisag :\n1.\tConfirmation du schma global (cf. ci-dessus) avant la fin danne\n2.\tVisite de larchi avec mtreur pour prendre les mesures du jardin,\nde la maison, et rflchir  limplantation\n3.\tPlan de masse, production du projet rnovation maison et projet\nconstruction annexe \n4.\tDevis \n5.\tDmarrage travaux (2nd semestre si possible)\n \nMon prochain passage  Bangui sera probablement en fvrier.\n \nMerci\n \nMarc Mandaba\nMobile France  +33 6 1119 3955 (WhatApp)"
}