{
  "year": 2020,
  "seq": 63,
  "meta": {
    "date": "2020-05-26",
    "from": "\"Yannick Mandaba\" <y.mandaba@gmail.com>",
    "to": "\"'BANGKOK-AMBA Bourses'\" <bourses.bangkok-amba@diplomatie.gouv.fr>",
    "subject": "RE: Demande de Bourse Scolaire Exceptionelle COVID-19 - Tristan, RenÃ©, Sawaad, MANDABA (demande d'accusÃ© reception 3 parties)"
  },
  "proposals": [
    {
      "index": -63,
      "etiquette": "Dossier de bourse Tristan",
      "category": "MIN",
      "duration": "LT",
      "source": "AI",
      "score": 1,
      "matched_from": [
        "ai_new"
      ]
    }
  ],
  "raw_excerpt": "ðŸ—• Date : 2020-05-26\nðŸ‘¤ From : \"Yannick Mandaba\" <y.mandaba@gmail.com>\nðŸ“¨ To   : \"'BANGKOK-AMBA Bourses'\" <bourses.bangkok-amba@diplomatie.gouv.fr>\nðŸ§• Subject : RE: Demande de Bourse Scolaire Exceptionelle COVID-19 - Tristan, RenÃ©, Sawaad, MANDABA (demande d'accusÃ© reception 3 parties)\n---\nBonjour Madame de Jesus,\n \nSi je comprends bien il vous manque:\n1.      La signature du formulaire \n(dsol tant  la limite des dates nous avons fait trs vite)\n2.      Dment rempli : Il manquerai une information importante.\n3.      Les relevs bancaires fournis ne remontent pas assez loin \n(mme raison : en ligne on avait accs aux 6 derniers mois, mais je vais\naller  la banque)\n\n\n4.      La mre de Tristan et moi-mme ne sommes pas maris.\nJai la garde financire totale dcrte par le juge denfant  Bangkok.\nDois-je faire traduire le document officiel en Franais ?\nJe dois quand mme fournir les relevs de la mre ?\n \nMerci de confirmer si les 4 lignes en gras sont correctes.\nSil vous manque dautres informations que celles que je viens de citer\nmerci de bien vouloir me le faire savoir.\n \nJe vais faire mon possible pour vous envoyer les informations manquantes au\nplus vite.\nCordialement,\n \nYannick Mandaba\nNUMIC : 00423770\n+66 878200622\n \nFrom: BANGKOK-AMBA Bourses [mailto:bourses.bangkok-amba@diplomatie.gouv.fr] \nSent: Tuesday, May 26, 2020 16:31\nTo: 'Yannick Mandaba' \nCc: 'maryvonne masseron-mandaba' ; 'BANGKOK-AMBA\nBourses' \nSubject: RE: Demande de Bourse Scolaire Exceptionelle COVID-19 - Tristan,\nRen, Sawaad, MANDABA (demande d'accus reception 3 parties)\n \nBonjour Monsieur,\n \nVotre dossier est incomplet.\n \nMerci de bien vouloir nous envoyer le formulaire de demande de bourse pour\nlanne 2029/2020 (3me trimestre) dument rempli, dat et sign ainsi que\nles relevs bancaires de tous vos comptes en France et en Thailande depuis\navril 2019  avril 2020, pour vous et votre conjointe.\n \nCordialement,\n \n \n\nPatricia de JESUS\nAmbassade de France en Thalande\nAffaires Sociales\n35 Charoenkrung Road, Soi 36\n10500 Bangkok\nTel: +66 (0) 2 657 51 79\nPortable : +66 (0) 6 5918 16 81\nFax : +66 (0) 2 657 51 54\n \n \nDe : Yannick Mandaba [mailto:y.mandaba@gmail.com] \nEnvoy : jeudi 7 mai 2020 15:49\n : bourses.bangkok-amba@diplomatie.gouv.fr\n \nCc : maryvonne masseron-mandaba\nObjet : Demande de Bourse Scolaire Exceptionelle COVID-19 - Tristan, Ren,\nSawaad, MANDABA (demande d'accus reception 3 parties)\n \nBonjour,\n \nAyant envoy des emails proches de la limite des 3 Mo je demande par la\nprsente un accus de bonne rception du dossier (3 emails) envoys le mardi\n5 mai.\nDossier : Tristan Mandaba  tablissement LFIB  Classe de CPD\n \nEn vous remerciant,\nCordialement,\n \nYannick Mandaba\nNUMIC : 00423770\n+66 878200622"
}