{
  "year": 2020,
  "seq": 76,
  "meta": {
    "date": "2020-11-02",
    "from": "\"Yannick Mandaba\" <y.mandaba@gmail.com>",
    "to": "\"'Kingkan KONG-IN'\" <kingkan.k@lfib.ac.th>",
    "subject": "RE: 1er rappel : paiement des frais de scolarit√© 2020/2021 - 1st reminder school fee payment 2020/2021"
  },
  "proposals": [],
  "raw_excerpt": "üóï Date : 2020-11-02\nüë§ From : \"Yannick Mandaba\" <y.mandaba@gmail.com>\nüì® To   : \"'Kingkan KONG-IN'\" <kingkan.k@lfib.ac.th>\nüßï Subject : RE: 1er rappel : paiement des frais de scolarit√© 2020/2021 - 1st reminder school fee payment 2020/2021\n---\nBonjour,\n \nJ‚Äôai bien re√ßu votre email et je reviens vers vous tr√®s prochainement pour le r√®glement.\nMerci.\n \nCordialement,\n \nYannick Mandaba\n \n \nFrom: Kingkan KONG-IN [mailto:kingkan.k@lfib.ac.th] \nSent: Thursday, October 29, 2020 12:23\nTo: undisclosed-recipients:\nSubject: 1er rappel : paiement des frais de scolarit√© 2020/2021 - 1st reminder school fee payment 2020/2021\n \nMadame, Monsieur,\n\nSauf erreur de notre part, la facture des frais de scolarit√© et cantine - 1er paiement n'a toujours pas √©t√© r√©gl√© √† ce jour. Nous pensons qu'il s'agit d'un oubli, et nous vous remercions de bien vouloir nous adresser dans les plus brefs d√©lais votre r√®glement.\nUOB\nNom de la banque : United Overseas Bank (Thai) Public Company Limited\nNom du compte : Lycee Francais International de Bangkok\nNum√©ro du compte : 7943190953, savings account\nAgence : Thai Wha Building South Sathorn\n\nKasikorn Bank *mode de paiement : Bill payment UNIQUEMENT* \n1.    au guichet d‚Äôune agence Kasikorn sur pr√©sentation du bordereau de paiement de LFIB\n2.    par K-Cyber Banking, veillez √† choisir le lien ¬´ Bill payment ¬ª\nNom de la banque : Kasikornbank PCL.\nNom du compte : Lycee Francais International de Bangkok\nNum√©ro du compte : 7331028198 current account\nAgence :  Thiam ruammit Road, Huaykwang\nDans le cas o√π vous auriez r√©gl√© le paiement, merci de nous envoyer le justificatif du paiement √† comptabilite@lfib.ac.th    A d√©faut, votre r√®glement ne pourra √™tre identifi√© et enregistr√©.\nSi vous avez effectu√© le paiement entre-temps, veuillez ignorer cet e-mail.\n \nBien cordialement,\n-- \n \n \n \n \n \nLyc√©e Fran√ßais International\nBangkok, Tha√Ølande\n\nKingkan KONG-IN\nService Comptabilit√©\n \n498, Soi Ramkhamhaeng 39 (Thep Leela 1), Wangthonglang, Bangkok, 10310\nT√©l :  66 (0) 29 34 80 08\nemail : kingkan.k@lfib.ac.th  \n\n  www.lfib.ac.th |   LinkedIn |   Facebook\n \n\n\n \nCe courriel (de m√™me que les fichiers joints) est strictement r√©serv√© √† l'usage de la personne ou de l'entit√© √† qui il est adress√© et peut contenir de l'information privil√©gi√©e et confidentielle. Toute divulgation, distribution ou copie de ce courriel est strictement prohib√©e. Si vous avez re√ßu ce courriel par erreur, veuillez nous en aviser sur-le-champ, d√©truire toutes les copies et le supprimer de votre syst√®me informatique.\nThis communication (including any files transmitted with it) is intended solely for the person or entity to whom it is addressed, and may contain confidential or privileged information. The disclosure, distribution or copying of this message is strictly forbidden. Should you have received this communication in error, kindly contact the sender promptly, destroy any copies and delete this message from your computer system."
}