{
  "year": 2020,
  "seq": 5,
  "meta": {
    "date": "2020-11-10",
    "from": "maryvonne.masseron@free.fr",
    "to": "marcmandaba@hotmail.com",
    "subject": "Adergaz"
  },
  "proposals": [],
  "raw_excerpt": "ğŸ—• Date : 2020-11-10\nğŸ‘¤ From : maryvonne.masseron@free.fr\nğŸ“¨ To   : marcmandaba@hotmail.com\nğŸ§• Subject : Adergaz\n---\nBonsoir, Marc. \nMerci de m'adresser le devis adergaz, afin que je fasse le virement dÃ¨s que le locataire aura notifie leur passage. \nPour la gestion Fidal, c'est mieux. Habituellement j'envoie un chÃ¨que au locataire, qui le remet aprÃ¨s l'intervention de contrÃ´le. \nAvec l'Ã©pidÃ©mie Covid, nous allons proceder autrement que remettre un chÃ¨que de la main Ã  la main. \nDÃ¨s le passage du technicien, Braidy  Charbel m'envoie un mail, et je fais le  virement qui sera effectif immÃ©diatement. \nMerci de verifier que je recois bien, et le montant, et le RIB. Facturation comme d'habitude Ã  la SCI Ã  Rennes. \nMerci. \nMMM\n0680078113 \n0783359723 \n\nmaryvonne masseron - 41 rue du puits-mauger 35000 rennes 0299302000 0680078113"
}