{
  "year": 2020,
  "seq": 6,
  "meta": {
    "date": "2020-11-26",
    "from": "\"Yannick Mandaba\" <y.mandaba@gmail.com>",
    "to": "\"'Marc MANDABA'\" <marcmandaba@hotmail.com>,",
    "subject": "RE: ReÂ : Re: PergolÃ¨se (privÃ©) Suite AG"
  },
  "proposals": [
    {
      "index": -6,
      "etiquette": "Dossier de bourse Tristan",
      "category": "MIN",
      "duration": "LT",
      "source": "AI",
      "score": 1,
      "matched_from": [
        "ai_new"
      ]
    },
    {
      "index": -6,
      "etiquette": "Paiement salaires atelier",
      "category": "MIN",
      "duration": "LT",
      "source": "AI",
      "score": 1,
      "matched_from": [
        "ai_new"
      ]
    },
    {
      "index": -6,
      "etiquette": "Appartement PergolÃ¨se (vente/location)",
      "category": "MIN",
      "duration": "LT",
      "source": "AI",
      "score": 1,
      "matched_from": [
        "ai_new"
      ]
    },
    {
      "index": -6,
      "etiquette": "Appartement PergolÃ¨se (vente/location)",
      "category": "MIN",
      "duration": "LT",
      "source": "AI",
      "score": 1,
      "matched_from": [
        "ai_new"
      ]
    }
  ],
  "raw_excerpt": "ğŸ—• Date : 2020-11-26\nğŸ‘¤ From : \"Yannick Mandaba\" <y.mandaba@gmail.com>\nğŸ“¨ To   : \"'Marc MANDABA'\" <marcmandaba@hotmail.com>,\n\t<maryvonne.masseron@free.fr>\nğŸ§• Subject : RE: ReÂ : Re: PergolÃ¨se (privÃ©) Suite AG\n---\nBonjour Ã  tous les 2,\nJe donne mon avis 1 fois bien clair.\n\nEn effet nous avions eu une discussion au retour de Marc.\nJe sais donc dÃ©jÃ  tout ce qui est dans ce message et nous partageons une vision globale de pourquoi la situation n'est pas juste et ce que nous voulons faire de l'endroit.\n\nA Justice et bon sens\nPersonne ne parle de justice au sens institutionnel, mais au sens moral.\n1) Je ne suis pas d'accord pour Ãªtre culpabilisÃ© sur tes aides pendant que la maison de la colline ne rapporte pas 1 sous depuis 2000. En respectant 5 ans de deuil, cela fait 1,000,000 D'Euros potentiels manquÃ©s en loyers, brut.\n2) La maison se dÃ©labre. Le cabinet aussi mais c'est l'affaire de Maman. On comprend que c'est dur Ã  voir, Ã  financer, Ã  faire. Mais Marc a le courage de le faire alors on ne bloque pas si on a rien de mieux Ã  proposer\n\n\nB Remarques\nPour simplifier et pour Ã©viter certains points de fuite:\n1) Je ne base pas mon avenir sur la rente ou l'hÃ©ritage, mais Ã§a aide quand on n'est pas une profession libÃ©rale un peu de capital car je n'ai pas fait de carriÃ¨re comme Marc pour me donner du crÃ©dit. Personne n'investira dans mon affaire sinon moi-mÃªme.\n2) D'accord sur la valeur significative et symbolique de l'usufruit. Mais moralement c'est trÃ¨s Ã©goÃ¯ste de bloquer pour ne rien en faire.\n3) Un jour je vais y aller et faire un beau feu de la Saint-Jean avec tout ce qui est dans la maison. Ce sera aussi Ã©goÃ¯ste que nÃ©gliger l'hÃ©ritage de la maison qui tombe en ruine. Si c'est ces objets nous empÃªchent de vire d'une maniÃ¨re Ã©panouie qui feraient plaisir Ã  Papa, je vais les bruler.  Papa Ã©tait un entrepreneur, il aimait les projets. Il ne serait pas pour garder la maison comme Ã§a.\n\nMarc est motivÃ©, il faut le laisser maintenant.\n\nProposiiton1\n- Marc paye la rÃ©novation complÃ¨te Maison, sous-sol, jardin 70,00 EUROS \n- Location dans la foulÃ©e.\n- Il se rembourse pour les travaux en 1 an approx.\n- AprÃ¨s cela mÃªme si Maman a l'usufruit on coupe en 3 les loyers si elle veut bien.\n- Marc construit en mÃªme temps sa maison en haut Ã  gauche collÃ© aux Epaye, et fera en sorte que Maman puisse y sÃ©journer quand elle vient.\n- Les revenus de la grande maison aident Marc Ã  se rembourser les sommes avancÃ©es et il prÃ©voie d'aider Yannick Ã  financer une petite maison en bas Ã  gauche collÃ© aux Epaye. \n\nProposition2\n- Marc paye un minimum indispensable pour rendre la maison vivable (chambres Y et M, cuisine, salle de bain, Terrace).\n- Il construit et loue sa maison Ã  cÃ´tÃ©. Il vient en passage dans la grande puisque Maman bloque une location.\n- Marc perd les sous de la rÃ©novation de la grande sans contrepartie et pas de revenus locaux pour aider Ã  financer Y\n\n\nDonc moi mon avantage est de laisser Marc investir pour entretenir le bien et m'aider Ã  financer une nouvelle source de revenu que serait une 2eme petite maison (Ã©ventuellement, s'il ne peut pas cela ne change rien Ã  ma position)\n\nPlus Ã§a va vite, plus nous sommes dans de bonnes conditions pour pourvoir y aller, et quand Maman voudra bien virer les gens du cabinet pour tout rÃ©nover et rouvrir un cabinet digne de ce nom... et bien elle aura un endroit dÃ©cent et notre soutien.\nJe suis sÃ»r que si Marc va souvent, que moi peut-Ãªtre je peux venir aussi, on sera Ã  mÃªme d'aider/assister Maman pour le cabinet. Je suis sÃ»r que Marc saura nÃ©gocier les travaux, je serai lÃ  peut-Ãªtre aussi pour soutenir Maman le jour oÃ¹ elle s'y attaque.\n\nJe ne vois aucune raison valable qui aille dans un sens contraire au plan A.\nNe rien faire n'est pas une option.\nLe plan B je le perÃ§ois comme une attaque personnelle dans le sens oÃ¹ les 15 prochaines annÃ©es ne seront pas moins sÃ»res que les 15 derniÃ¨res et Maman n'a pas plus de raison d'y aller. Donc c'est juste pour le sentiment de : \"Si j'ai envie d'y aller j'y vais\". Oui donc c"
}