{
  "year": 2020,
  "seq": 64,
  "meta": {
    "date": "2020-05-28",
    "from": "\"Yannick Mandaba\" <y.mandaba@gmail.com>",
    "to": "\"'Kingkan KONG-IN'\" <kingkan.k@lfib.ac.th>",
    "subject": "RE: Remboursement cantine et AES non consomm√©s/ Refund for canteen services and extra-curricular activities not taken"
  },
  "proposals": [
    {
      "index": -64,
      "etiquette": "Dossier de bourse Tristan",
      "category": "MIN",
      "duration": "LT",
      "source": "AI",
      "score": 1,
      "matched_from": [
        "ai_new"
      ]
    }
  ],
  "raw_excerpt": "üóï Date : 2020-05-28\nüë§ From : \"Yannick Mandaba\" <y.mandaba@gmail.com>\nüì® To   : \"'Kingkan KONG-IN'\" <kingkan.k@lfib.ac.th>\nüßï Subject : RE: Remboursement cantine et AES non consomm√©s/ Refund for canteen services and extra-curricular activities not taken\n---\nBonjour,\n \nEtant toujours en attente de la bourse sp√©ciale COVID19, nous n‚Äôavons pas r√©gl√© le 3√®me trimestre de cette ann√©e 2019-2020.\nEst-il possible de d√©duire le montant du 3√©me trimestre ?\n \nEn effet si le dossier de bourse est refus√© nous devrons payer le 3eme trim√®tre enti√®rement de notre poche.\nCela nous permettra de demander moins aux membres de notre famille qui nous aident pour les paiements.\n \nSi ce n‚Äôest pas possile alors d√©duire du 1er trimetre 2020-2021.\nMerci.\n \nCordialement,\nYannick Mandaba\n \nTristan Mandaba - CPD\n \nFrom: Kingkan KONG-IN [mailto:kingkan.k@lfib.ac.th] \nSent: Thursday, May 28, 2020 13:32\nCc: J√©r√¥me Vannier \nSubject: Remboursement cantine et AES non consomm√©s/ Refund for canteen services and extra-curricular activities not taken\n \nBonjour,\n \nLes services comptables et financiers vous informent que les remboursements des services cantine et activit√©s extra-scolaires non consomm√©s du 18 mars au 3 juillet 2020 vont √™tre effectu√©s.\n \nIls peuvent se faire de deux mani√®res :\n \nOption 1 : un avoir au titre de la prochaine ann√©e scolaire 2020-2021 ;\n \nOption 2 : un remboursement par virement bancaire.\n \nSi vous choisissez l'option 1, vous n'avez donc pas de r√©ponse √† nous donner.\n \nPour ceux qui veulent choisir l'option 2, merci de nous donner vos coordonn√©es bancaires et une copie de votre passeport par retour de mail.\n \nLes services comptables et financiers se tiennent √† votre disposition pour tout √©l√©ment d‚Äôinformation compl√©mentaire.\n \nBien cordialement,\n \nDear Sir or Madam,\nThe accounting and financial department would like to inform you that refund for canteen services and extra-curricular activities not taken from March 18 to July 3, 2020 will be made. \nThey can be done in two ways: \n-Option 1: a credit for the next school year 2020-2021; \n-Option 2: a refund by bank transfer. \nIf you choose option 1, you therefore have no answer to give us.\nFor those who want to choose option 2, please give us your bank details and a copy of your passport by return email. \nThe accounting and financial department is at your disposal for any further information.\n \nBest regards,\n \n Bangkok, Tha√Ølande\n\nJ√©r√¥me VANNIER\nDirecteur des Affaires Administratives et Financi√®res / Financial Director \n498, Soi Ramkhamhaeng 39 (Thep Leela 1)\nWangthonglang - 10310 - Bangkok\nT√©l : 66 (0) 29 34 80 08\nFax : 66 (0) 29 34 66 70\n  j.vannier@lfib.ac.th\n  www.lfib.ac.th |   LinkedIn | Facebook   | Twitter"
}