{
  "year": 2020,
  "seq": 78,
  "meta": {
    "date": "2020-11-10",
    "from": "maryvonne masseron-mandaba <maryvonnemm@hotmail.com>",
    "to": "Yannick Mandaba <y.mandaba@gmail.com>, \"'maryvonne masseron@free. fr'\"",
    "subject": "Re: DÃ©gÃ¢ts des eaux Pergo"
  },
  "proposals": [],
  "raw_excerpt": "ðŸ—• Date : 2020-11-10\nðŸ‘¤ From : maryvonne masseron-mandaba <maryvonnemm@hotmail.com>\nðŸ“¨ To   : Yannick Mandaba <y.mandaba@gmail.com>, \"'maryvonne masseron@free. fr'\"\n\t<maryvonne.masseron@free.fr>, 'Yannick Mandaba' <ymandaba@gmail.com>, Marc\n MANDABA <marcmandaba@hotmail.com>\nðŸ§• Subject : Re: DÃ©gÃ¢ts des eaux Pergo\n---\nMerci, Marc,\nTu tais en destinataire pour la rponse de l'assurance, qui a t immdiate.\nPeux-tu leur envoyer la photo, comme annonc, et demander des explications sur le sigle indiqu dans la procdure.\nMerci\nMMM\n\nTlcharger Outlook pour Android\n\n________________________________\nFrom: Marc MANDABA \nSent: Monday, November 9, 2020 4:38:54 PM\nTo: Yannick Mandaba ; 'maryvonne masseron@free. fr' ; 'docteur docteur docteur maryvonne masseron-mandaba mandaba mandaba mandaba' ; 'Yannick Mandaba' \nSubject: RE: Dgts des eaux Pergo\n\n\nBonsoir,\n\n\n\nLe point sur Pergo :\n\n  Dgat des eaux\n\n     *   Jai envoy un mail au syndic et je les ai appel pour confirmer rception. Ils confirment quil engagent une investigation. Un voisin du 4eme (cot rue de pense, un certain M. Manier) les a dj alert\n     *   Pas encore daction auprs de lassureur mais maman leur a fait un mail\n\n  Adergaz programm ce vendredi 13  13h (!) pour rvision chaudire. 154 TTC  lordre de la SCI. Je rglerai et fournirai la facture\n\n  Premier devis obtenu pour peinture, trs cher (5,500EUR pour tout lappart). Un partie sera couverte par lassurance pour dgt des eaux. Je lance un second devis. Quoi quil en soit, maintenant il faut attendre le rglement du sinistre.\n\n  Charbel a t diagnostiqu COVID il y a 7 jours et est isol jusqu ce weekend (il restera au salon pour la visite Adergaz ce vendredi)\n\nMerci\n\nMarc\n\n\n\nMarc Mandaba\n\nMobile France  +33 6 1119 3955 (WhatApp)\n\n\n\nFrom: Yannick Mandaba \nSent: 03 November 2020 16:48\nTo: 'Marc MANDABA' ; 'maryvonne masseron@free. fr' ; 'docteur docteur docteur maryvonne masseron-mandaba mandaba mandaba mandaba' ; 'Yannick Mandaba' \nSubject: RE: Dgts des eaux Pergo\n\n\n\nOK, merci Marc.\n\n\n\nFrom: Marc MANDABA [mailto:marcmandaba@hotmail.com]\nSent: Monday, November 2, 2020 22:44\nTo: maryvonne masseron@free. fr >; docteur docteur docteur maryvonne masseron-mandaba mandaba mandaba mandaba (maryvonnemm@hotmail.com) >; Yannick Mandaba >; Yannick Mandaba (Perso) >\nSubject: Dgts des eaux Pergo\n\n\n\nComme discut, fuite mur du fond/angle cuisine dans le salon qui provient certainement du dessus mais le proprio est absent.\n\nAvons convenu avec Maman que je m'occupe de contacter le syndic et l'assurance.\n\nMerci\n\nMarc\n[Image]\n\n\n\n\n\nMarc Mandaba\nFrance +33 611193955 (WhatsApp)\nMorocco   +212 6 1252 3030"
}