{
  "year": 2020,
  "seq": 72,
  "meta": {
    "date": "2020-10-16",
    "from": "maryvonne masseron-mandaba <maryvonnemm@hotmail.com>",
    "to": "Yannick Mandaba <y.mandaba@gmail.com>",
    "subject": "Re: Tristan, ses Ã©tudes."
  },
  "proposals": [],
  "raw_excerpt": "ðŸ—• Date : 2020-10-16\nðŸ‘¤ From : maryvonne masseron-mandaba <maryvonnemm@hotmail.com>\nðŸ“¨ To   : Yannick Mandaba <y.mandaba@gmail.com>\nðŸ§• Subject : Re: Tristan, ses Ã©tudes. \n---\nTu ne peux rien faire.\n!?!\nMoi non plus.\nQue faire d'un chamalo ?\nElle ne comprend rien  l'ducation.\nLa nouvelle mode est de me laisser regarder, sur la tablette, Tristan qui joue sur son tlphone.\nElle croit que l'on m'attrape par la sduction. Eh bien non. Elle va l'apprendre.\nJe ne m'occupe plus de Tristan jusqu' ce qu'elle m'crive ses rsolutions.\nAmusez vous. Partez en vacances. Gchez de votre enfant... Je suis fatigue de contempler la paresse du chamalo.\n\nTlcharger Outlook pour Android\n\n________________________________\nFrom: Yannick Mandaba \nSent: Friday, October 16, 2020 11:46:20 AM\nTo: 'maryvonne masseron-mandaba' \nSubject: RE: Tristan, ses tudes.\n\n\nOui, heu tu ne te substitue pas aux parents pour intervenir auprs de lcole, merci.\n\n\n\nJe nai pas le temps de faire aucun devoir.\n\nMes conditions sont simples : Il vient au bureau aprs lcole faire les devoir.\n\nSil nest pas amen ici je ne peux rien faire.\n\n\n\n\n\n\n\nFrom: maryvonne masseron-mandaba [mailto:maryvonnemm@hotmail.com]\nSent: Friday, October 16, 2020 15:56\nTo: Yannick Mandaba ; BeeBaa \nSubject: Tristan, ses tudes.\n\n\n\nMerci de rpondre  ma question =\n\n\n\nLequel de nous fait rviser  Tristan ses leons de Sciences ?\n\n\n\nMerci aussi de me donner un lien VALABLE, pour suivre le travail de la classe.\n\nCE N'EST PAS QUE POUR LES ABSENTS.\n\n\n\nC'EST DIFFUSABLE AUX PERSONNES DE LA FAMILLE. Ecit par Vanessa Vaneau.\n\nFaute de rponse, je devrai crire  la maitresse.\n\n\n\nCE N'EST PAS L'ENFANT ROI QUI COMMANDE LA FAMILLE.\n\n\n\n\n\nTlcharger Outlook pour Android"
}