{
  "year": 2020,
  "seq": 81,
  "meta": {
    "date": "2020-11-23",
    "from": "maryvonne masseron-mandaba <maryvonnemm@hotmail.com>",
    "to": "'Marc MANDABA' <marcmandaba@hotmail.com>, 'Yannick Mandaba'",
    "subject": "Re: Pergolese (privÃ©)"
  },
  "proposals": [
    {
      "index": -81,
      "etiquette": "Appartement PergolÃ¨se (vente/location)",
      "category": "MIN",
      "duration": "LT",
      "source": "AI",
      "score": 1,
      "matched_from": [
        "ai_new"
      ]
    },
    {
      "index": -81,
      "etiquette": "Frais bus Tristan",
      "category": "MIN",
      "duration": "LT",
      "source": "AI",
      "score": 1,
      "matched_from": [
        "ai_new"
      ]
    }
  ],
  "raw_excerpt": "ðŸ—• Date : 2020-11-23\nðŸ‘¤ From : maryvonne masseron-mandaba <maryvonnemm@hotmail.com>\nðŸ“¨ To   : 'Marc MANDABA' <marcmandaba@hotmail.com>, 'Yannick Mandaba'\n\t<ymandaba@gmail.com>, Yannick Mandaba <y.mandaba@gmail.com>\nðŸ§• Subject : Re: Pergolese (privÃ©) \n---\nCela suffit\n\nIL Y A DEUX FUITES\n\nL'ancienne,\nque le syndic connait,\navec la plainte de notre voisin Magniez,\net pour laquelle mme Wollbrett va faire une exploration dans le plancher de sa salle de bain. J'en ai pris acte auprs d'elle.\n\nLa plus rcente,\nqui a fait ragir notre locataire\nqui entendait tomber les gouttes,\net qui a infiltr le mur de sa chambre trs rapidement,\nqui a dbute le 6 novembre, et rpare le 19.\nMais que mme Wollbrett a nglige pendant 13 jours, en \" pensant\" que c'tait la fuite ancienne.\n\nJ'avais le droit de ne pas \"penser\" comme elle.\n\nIl suffisait de lire Braidy Charbel, qui entendait des gouttes tomber.\n\nIl faut rsoudre le problme de la fuite ancienne.\n\nArrtez de me troubler.\nSi vous n'tes pas contributifs.\n\nMM\n\nTlcharger Outlook pour Android\n\n________________________________\nFrom: Yannick Mandaba \nSent: Monday, November 23, 2020 3:56:23 PM\nTo: 'Marc MANDABA' ; 'maryvonne masseron-mandaba' ; 'Yannick Mandaba' \nSubject: RE: Pergolese (priv)\n\n\nMais Maman, je pense que Marc est capable de grer a.\n\nCe ne serait trop dur pour lui?\n\n\n\nEt mme si cela va moins vite que tu voudrais, il vient  peine dessayer et tu es sur son dos,  dbusquer ceci et cela.\n\nIl avait demand la paix et cest 10 emails quil doit se bouffer pour canaliser tes critiques, rectifier ceci et cela.\n\n\n\nIls ne lisent pas leur plateforme, soit, un coup de fils et un email Marc a dit lavoir fait bon\n\nSil na pas de retour il est grand pour trouver son chemin ou te demander sil a besoin de on aide.\n\nVisiblement la fuite est l depuis des mois, donc si Marc prend 8 jours pour avoir un meilleurs prix\n\n\n\n\n\nL le moindre compte rendu est pluch \n\n Mais o est la copie du devis trop cher ? Mais pourquoi tu nas pas fait comme jaurais fait? \n\n MAISATTEND UN PEU NON ? Cest comment !!! Heeeeh ! \n\n\n\n\n\n\n\nFrom: Marc MANDABA [mailto:marcmandaba@hotmail.com]\nSent: Monday, November 23, 2020 20:38\nTo: maryvonne masseron-mandaba ; Yannick Mandaba \nSubject: RE: Pergolese (priv)\n\n\n\nLes crits sont ci-dessous. Ne peux-tu pas accepter mme les preuves sous ton nez ?\n\n\n\nMarc Mandaba\n\nMobile France  +33 6 1119 3955 (WhatApp)\n\n\n\nFrom: maryvonne masseron-mandaba >\nSent: 23 November 2020 14:37\nTo: Yannick Mandaba >; Marc MANDABA >\nSubject: Re: Pergolese (priv)\n\n\n\nMarc,\n\nSuite,\n\nJe n'ai jamais eu communication du devis.\n\nC'est Braidy Charbel qui m'a dit hier,\n\nQue tu avais trouv le devis trop cher.\n\nDonc il a repondu ngativement aux peintres,\n\nIl ne peut demander leur un avis sur le dgt,\n\nOn doit trouver une autre entreprise\n\nTu ne peux t'impliquer\n\nPuis te dsengager\n\nPuis contrler  nouveau\n\nEt te desengager encore\n\nCe n'est pas responsable.\n\nDsole, je vais marcher avec ma voisine.\n\nMM\n\nTlcharger Outlook pour Android\n\n\n\n________________________________\n\nFrom: Marc MANDABA >\nSent: Monday, November 23, 2020 2:23:30 PM\nTo: maryvonne masseron-mandaba >; Yannick Mandaba >\nSubject: RE: Pergolese (priv)\n\n\n\nCe nest pas vrai. Jai inform pour le devis cher le 9 novembre. Jai dit que je lancerai un second devis et que ce sera fait aps le reglement du sinistre\n\n\n\nCi joint le mail. Ci-dessous lextrait\n\n\n\nTROP DE MENSONGES. JE ME DESENGAGE\n\n\n\n\n\nFrom: Marc MANDABA\nSent: 09 November 2020 16:39\nTo: Yannick Mandaba >; 'maryvonne masseron@free. fr' >; 'docteur docteur docteur maryvonne masseron-mandaba mandaba mandaba mandaba' >; 'Yannick Mandaba' >\nSubject: RE: Dgts des eaux Pergo\n\n\n\nBonsoir,\n\n\n\nLe point sur Pergo :\n\n  Dgat des eaux\n\no   Jai envoy un mail au syndic et je les ai appel pour confirmer rception. Ils confirment quil engagent une investigation. Un voisin du 4eme (cot rue de pense, un certain M. Manier) les a dj alert\n\no   Pas encore daction auprs de lassureur mais maman leur a fait un mail\n\n  Adergaz programm ce vendredi 13  13h (!) pour rvision"
}