{
  "year": 2024,
  "seq": 88,
  "meta": {
    "date": "2024-10-24",
    "from": "\"Yannick Mandaba\" <y.mandaba@gmail.com>",
    "to": "\"'MYM MANDABA SCI'\" <mymmandaba@gmail.com>",
    "subject": "RE:"
  },
  "proposals": [
    {
      "index": -88,
      "etiquette": "Paiements via Western Union",
      "category": "MIN",
      "duration": "LT",
      "source": "AI",
      "score": 1,
      "matched_from": [
        "ai_new"
      ]
    }
  ],
  "raw_excerpt": "ðŸ—• Date : 2024-10-24\nðŸ‘¤ From : \"Yannick Mandaba\" <y.mandaba@gmail.com>\nðŸ“¨ To   : \"'MYM MANDABA SCI'\" <mymmandaba@gmail.com>\nðŸ§• Subject : RE: \n---\nPas dâ€™Ã©mail reÃ§u le 19 octobre ni aprÃ¨s cette date.\n ???\n\nDernier en date le 10\n\nWU = Western Union\n\nRIA = RIA\n\n \n\nMerci de renvoyer par email.\n\nA cet email uniquement.\n\nJâ€™espÃ¨re que cette histoire ne va pas Ãªtre le prÃ©texte pour des salades toutes les semaines.\n\n \n\nJâ€™irai prendre le 15 et le 30. GroupÃ©.\n\nRoute pour RIA je nâ€™aime pas. Bretelles/pont/sortie du centre/Ã©nervement/danger \n\n\nJe te conseille de faire en ligne ce sera facile et sans intermÃ©diaires, sans queue.\n\nMarc le fait, si tu ne veux pas cette solution plus sÃ©curisÃ©e et plus facile alors je ne veux pas en entendre parler.\n\n \n\nJe te donne la possibilitÃ© de verser sur mon compte en France.\n\nMoi je veux le compte exact. On a dit 1000 Euros\n\nSi tu fais des westerns tu dÃ©duits tes frais.\n\n\nMoi de SG je peux mettre sur une banque en ligne sans frais.\n\nDonc je ne veux pas payer les frais stupides de Western Union.\n\nCâ€™est ton choix. Moi sur mon compte SG câ€™est trÃ¨s bien aussi.\n\n \n\nMerci.\n\n \n\n \n\nYannick MANDABA\n\nMobile: +66 878200622\n\n              \n\n \n\n(FR) Ce courriel (de mÃªme que les fichiers joints) est strictement rÃ©servÃ© Ã  l'usage de la personne ou de l'entitÃ© Ã  qui il est adressÃ© et peut contenir de l'information privilÃ©giÃ©e et confidentielle. Toute divulgation, distribution ou copie de ce courriel est strictement prohibÃ©e. Si vous avez reÃ§u ce courriel par erreur, veuillez nous en aviser sur-le-champ, dÃ©truire toutes les copies et le supprimer de votre systÃ¨me informatique.\n(ENG) This communication (including any files transmitted with it) is intended solely for the person or entity to whom it is addressed, and may contain confidential or privileged information. The disclosure, distribution or copying of this message is strictly forbidden. Should you have received this communication in error, kindly contact the sender promptly, destroy any copies and delete this message from your computer system\n\n \n\nFrom: MYM MANDABA SCI  \nSent: Thursday, October 24, 2024 1:06 PM\nTo: Yannick Mandaba \nSubject: Re:\n\n \n\nQue tu as choisi de vivre en ThaÃ¯lande.\nAs-tu Ã©tÃ© chercher ton WU du 19 octobre ?\nMerci du reÃ§u \n\n \n\nLe jeu. 24 oct. 2024, 06:45, Yannick Mandaba  > a Ã©crit :\n\nQuand on te demande pourquoi je ne suis pas lÃ  qu'est ce que tu rÃ©pond ?"
}