{
  "year": 2024,
  "seq": 1,
  "meta": {
    "date": "2024-01-09",
    "from": "\"Yannick Mandaba\" <y.mandaba@gmail.com>",
    "to": "\"'MYM MANDABA SCI'\" <mymmandaba@gmail.com>",
    "subject": "RE: Virement DHL BANGKOK pour MANDJA"
  },
  "proposals": [
    {
      "index": -1,
      "etiquette": "Paiement DHL / exp√©dition",
      "category": "MIN",
      "duration": "LT",
      "source": "AI",
      "score": 1,
      "matched_from": [
        "ai_new"
      ]
    }
  ],
  "raw_excerpt": "üóï Date : 2024-01-09\nüë§ From : \"Yannick Mandaba\" <y.mandaba@gmail.com>\nüì® To   : \"'MYM MANDABA SCI'\" <mymmandaba@gmail.com>\nüßï Subject : RE: Virement DHL BANGKOK pour MANDJA\n---\nJe ne comprends pas ce que tu as fait.\n\n \n\nAccount Name: DHL Express International (Thailand) Ltd,     et pas ‚ÄúDHL BANGKOK‚Äù\n\n \n\nBank Adress : Standard Chartered Bank (Thai) Pcl. \n\n140 Wireless Road, Lumpini, Patumwan, Bangkok 10330,          OK! \n\n \n\nAccount Number: 61301466731,  et pas  13014667316 √ßa c‚Äô√©tait juste pour la note car c‚Äôest notre compte client chez DHL qu‚Äôils sachent pour qui tu payes.\n\n \n\nPourtant j‚Äôai envoy√© les pi√®ces comptables pour √©viter toute confusion‚Ä¶.\n\nL√† :\n\n \n\n\n\n \n\nIl n‚Äôy a rien d‚Äôautre √† dire, il sufoft de copier √ßa sans r√©flechir √† 1000 trucs. Juste copier √ßa.\n\nOublie la note sinon carj‚Äôai l‚Äôimpression que tu as d√ª mal avec √ßa.\nEt le nom du compte tu ne peux pas changer le moindre charactere.\n\n \n\n \n\nYannick MANDABA\n\nMobile: +66 878200622\n\n              \n\n \n\n(FR) Ce courriel (de m√™me que les fichiers joints) est strictement r√©serv√© √† l'usage de la personne ou de l'entit√© √† qui il est adress√© et peut contenir de l'information privil√©gi√©e et confidentielle. Toute divulgation, distribution ou copie de ce courriel est strictement prohib√©e. Si vous avez re√ßu ce courriel par erreur, veuillez nous en aviser sur-le-champ, d√©truire toutes les copies et le supprimer de votre syst√®me informatique.\n(ENG) This communication (including any files transmitted with it) is intended solely for the person or entity to whom it is addressed, and may contain confidential or privileged information. The disclosure, distribution or copying of this message is strictly forbidden. Should you have received this communication in error, kindly contact the sender promptly, destroy any copies and delete this message from your computer system\n\n \n\nFrom: MYM MANDABA SCI  \nSent: Monday, 8 January, 2024 6:35 PM\nTo: Y M \nSubject: Virement DHL BANGKOK pour MANDJA"
}