{
  "year": 2024,
  "seq": 114,
  "meta": {
    "date": "2024-06-12",
    "from": "maryvonne.masseron@free.fr",
    "to": "'''Yannick Mandaba''' <y.mandaba@gmail.com>",
    "subject": "exposÃ© de Tristan / je suis dÃ©Ã§ue"
  },
  "proposals": [],
  "raw_excerpt": "ğŸ—• Date : 2024-06-12\nğŸ‘¤ From : maryvonne.masseron@free.fr\nğŸ“¨ To   : '''Yannick Mandaba''' <y.mandaba@gmail.com>\nğŸ§• Subject : exposÃ© de Tristan / je suis dÃ©Ã§ue\n---\nJe suis trÃ¨s dÃ©Ã§ue qu'il ait travaillÃ© son exposÃ© sur wikipedia, ou autre, \n\nEN LANGUE ANGLAISE;\n\nd'oÃ¹ des erreurs de TRADUCTION\nlecture au lieu d'Ã©criture\n\nrien sur les mots = oeuvre littÃ©raire, traduction \"production\"\nni sur le romantisme, \nni le mot politique, \nni ses fonctions de sÃ©nateur\nni acadÃ©mie franÃ§aise\n\nerreur sur sa mort,\nassassinat et non pneumonie\n\nrien sur ses obsÃ¨ques nationales\nles plus impressionnantes que la France ait connues ( jusqu'aux cÃ©rÃ©monie pour J Halliday )\n\nConnaissant Tristan, c'est du travail bÃ¢clÃ©.\nIl pouvait mieux faire.\nLes autres enfants se font aider par leurs parents\nje ne demande pas mieux que le faire\n\nJ'avais prÃ©venu que Tristan Ã©tait sur une mauvaise pente (d'oÃ¹ le couteux sÃ©jour au NÃ©pal )\nmais sa mÃ¨re est trop laxiste, et ne comprend rien Ã  rien\n\nexpliquer Ã  Bee si tu peux\nqu'il doit progresser, Ã©tudier, se concentrer\nLes auteurs franÃ§ais doivent Ãªtre Ã©tudiÃ© dans des documents d'origine franÃ§aise\nLa politique est une OPINION\n\n\n\n\nmaryvonne masseron - 41 rue du puits-mauger  35000  rennes  0299302000  0680078113"
}