{
  "year": 2024,
  "seq": 71,
  "meta": {
    "date": "2024-09-22",
    "from": "MYM MANDABA SCI <mymmandaba@gmail.com>",
    "to": "Marc Mandaba <marcmandaba@gmail.com>",
    "subject": "Re: Distribution de la cagnotte destinÃ©e Ã  l'entretien de l'indivision de Damara."
  },
  "proposals": [],
  "raw_excerpt": "ðŸ—• Date : 2024-09-22\nðŸ‘¤ From : MYM MANDABA SCI <mymmandaba@gmail.com>\nðŸ“¨ To   : Marc Mandaba <marcmandaba@gmail.com>\nðŸ§• Subject : Re: Distribution de la cagnotte destinÃ©e Ã  l'entretien de l'indivision de Damara.\n---\nMerci, Marc.\n\nLe dim. 22 sept. 2024, 16:54, Marc Mandaba  a Ã©crit :\n\n> La maison de Damara est dÃ©jÃ  entretenue par ceux qui ont les moyens.\n>\n> Cette annÃ©e :\n>\n> - j'ai remplacÃ© les portillons extÃ©rieurs et un cadre fenÃªtre bouffÃ© par\n> les termites est en installation.\n>\n> - Des jardiniÃ¨res en brique ont Ã©tÃ© ajoutÃ©s autour de la maison.\n>\n> - Les tuiles cassÃ©es ont Ã©tÃ© colmatÃ©es avec du \"pax aluminium\".\n>\n> - J'ai achetÃ© un salon de jardin en plus et des coussins.\n>\n> - Une chambre extÃ©rieure a Ã©tÃ© amÃ©nagÃ©e pour Alain. Ainsi il a quittÃ© la\n> chambre de papa qui est maintenant pour les aÃ®nÃ©s en visite (Yangue,\n> maman,etc.). Il y a 2 lits simples au lieu d'un grand lit double\n>\n> - Les faux plafonds ont Ã©tÃ© refait dans 2  chambres.\n>\n> - J'ai remis en marche le vieux groupe Ã©lectrogÃ¨ne rouge.\n>\n> - J'ai ramenÃ© une pompe immergÃ©e pour le puit pour remplir le chÃ¢teau\n> d'eau donc avoir douche, toilette, robinet\n>\n> - Des panneaux solaires+batterie+frigo sont en route dans un container.\n>\n> - J'ai mis du carrelage sur la tombe du fils de Gatien.\n>\n> Tout cela ci-dessus a Ã©tÃ© financÃ© et pilotÃ© par moi seul. Alain a aidÃ© Ã \n> transporter les matÃ©riaux et faire du suivi.\n> Donc non ce n'est pas illusoire, et mÃªme pas besoin de demander. Ceux qui\n> ont les moyens font, ca s'appelle la responsabilitÃ©. Finalement, soit on\n> est lÃ  et on fait, soit on n'est pas lÃ  et on a l'humilitÃ© de se retirer.\n> Pas besoin d'un papier pour donner l'illusion de la contrainte et\n> finalement se dÃ©douaner.\n>\n> Concernant le nouveau gardien de Damara, 30.000cfa par mois, divisÃ© entre\n> Alain, Claudie et Marc.\n>\n> Reste Ã  faire avant 22 octobre\n> - repeindre blanc Ã  eau et bleu Ã  huile\n> - repeindre la grille de la tombe de Papa\n>\n> Reste a faire fin 2024 :\n> - amÃ©liorer la douche\n> - installer les panneaux solaires (Donatien donne 3 panneaux, et moi les\n> convertisseurs, batterie, cables, etc..)\n>\n> Le flambeau est passÃ© de fait. Heureusement que l'on a pas attendu je ne\n> sais quelle dÃ©cision de l'autoritÃ© supÃ©rieure. A bon entendeur...\n>\n> Marc\n>\n> Sent from Outlook for Android \n>\n> ------------------------------\n> *From:* MYM MANDABA SCI \n> *Sent:* Sunday, September 22, 2024 3:21:35 PM\n> *To:* Yannick Mandaba ; marcmandaba  marcmandaba@gmail.com>\n> *Subject:* Distribution de la cagnotte destinÃ©e Ã  l'entretien de\n> l'indivision de Damara.\n>\n> Bonsoir,\n> Marc m'a demandÃ© pourquoi il avait reÃ§u 1/10e de cette cagnotte, sur son\n> compte, en France.\n> En violation des accords du conseil de famille, cette cagnotte, destinÃ©e Ã \n> l'entretien des tombÃ©s, et de la maison de Damara, Ã  Ã©tÃ© distribuÃ©e.\n> Cette gestion devait avoir lieu, par l'intermÃ©diaire d'un compte Ã©pargne,\n> et pour commencer indemniser Joseph Gayo, pour sa surveillance de la\n> propriÃ©tÃ©. Et cette gestion devait Ãªtre assurÃ©e par 2 ayant droit, et un\n> autre membre de la famille. Je sais que Alain et le tuteur de la fille de\n> HervÃ©, Ã©taient concernÃ©s, mais dans la pratique, l'oncle Gayo allait au\n> cabinet de Me Gotilogue, chaque mois, jusqu'Ã  son dÃ©cÃ¨s.\n> Me Gotilogue, Ã  son dÃ©part de Bangui, et sans en rÃ©fÃ©rer (?), ( lui\n> demander) , Ã  Me Rosalem, a procÃ©dÃ© Ã  une distribution, sur les comptes\n> donnÃ©s Ã  la notaire qui a liquidÃ© le compte bancaire en France = me\n> Dupont-Hamon.\n>\n> Pendant ce temps, Marc procÃ©dait a la rÃ©novation de la maison, sur ses\n> fonds propres.\n>\n> C'est une entorse Ã  ce qui avait Ã©tÃ© convenu au Conseil de Famille,\n> entÃ©rinÃ© par le document notariÃ©.\n>\n> Dans l'esprit des choses, il est illusoire de demander maintenant Ã  chacun\n> d'entretenir Ã  hauteur de ses moyens...\n>\n> Je vais en parler Ã  Christian, pour savoir s'il a Ã©tÃ© consultÃ© sur ce\n> point.\n>\n>"
}