{
  "year": 2024,
  "seq": 58,
  "meta": {
    "date": "2024-08-28",
    "from": "MYM MANDABA SCI <mymmandaba@gmail.com>",
    "to": "Yannick Mandaba <y.mandaba@gmail.com>, BeeBaa <beebeau89@gmail.com>,",
    "subject": "Conseils au sujet de Tristan"
  },
  "proposals": [
    {
      "index": -58,
      "etiquette": "Dossier de bourse Tristan",
      "category": "MIN",
      "duration": "LT",
      "source": "AI",
      "score": 1,
      "matched_from": [
        "ai_new"
      ]
    },
    {
      "index": -58,
      "etiquette": "Frais d'√©cole / bus Tristan",
      "category": "MIN",
      "duration": "LT",
      "source": "AI",
      "score": 1,
      "matched_from": [
        "ai_new"
      ]
    }
  ],
  "raw_excerpt": "üóï Date : 2024-08-28\nüë§ From : MYM MANDABA SCI <mymmandaba@gmail.com>\nüì® To   : Yannick Mandaba <y.mandaba@gmail.com>, BeeBaa <beebeau89@gmail.com>, \n\tTristan Mandaba <trs.mandaba@gmail.com>\nüßï Subject : Conseils au sujet de Tristan\n---\nIl n'y a pas de comp√©tition entre les personnes de l'entourage de Tristan.\nChacun fait ce qu'il sait faire, dans son domaine de comp√©tence. Tout cela\npour √©lever Tristan, \"√©lever\" c'est le porter plus haut que chacun de nous.\n\nJe me permets, en tant qu'ain√©e, exp√©riment√©e, et P√©diatre, de parler net.\nBee pourra continuer √† √™tre responsable de ses acquisitions en Anglais et\nTha√Ø. Selon le bulletin scolaire de fin d'ann√©e derni√®re, il est conseill√©\nde lui faire lire des fictions en anglais ( la librairie de seconde main,\nn'est pas moi de chez vous, m√™me trottoir sur Sukhumvit). De plus je\nconseille de la litt√©rature anglaise, puisqu'il a choisi la section\nbritannique. Commencer par de l'Oscar Wilde, David Copperfield, ou Oliver\nTwist, me para√Æt int√©ressant.\nYannick continue avec les sciences et les maths. Mon amie Cathy, qui est\nprof de maths √† Zola, trouve bien l'√©tude du Python, mais pour cet √¢ge,\nelle recommande scratch, qui est au programme 6e 5e.\nNous allons faire un test de niveau, pour nous en famille, avec des\n√©l√©ments du livre Nathan, classe de 6√®me.\nConcernant le fran√ßais, Tristan est excellent en orthographe et grammaire,\nje laisse son √©cole, faire avec la progression de son groupe. Mais je\nmaintiens la n√©cessit√© de d√©couvrir la litt√©rature fran√ßaise, par des\nlectures d'ouvrages, et non des extraits ou r√©sum√©s. Nous avons beaucoup\nprogress√© l'an dernier avec Victor Hugo. Il faut terminer et d√©couvrir\ncette ann√©e un autre grand auteur, juste par une ≈ìuvre. Ce ne sera pas\nforc√©ment facile, mais le go√ªt de l'effort fait partie du job de parents et\ngrands-parents.\nEst-ce que le papi peut s'investir dans l'√©tude du mandarin ?.\nMerci de penser √† inscrire Tristan √† l'association Sportive. Il me parle du\nfootball. Mais n'importe quel sport collectif sera bienvenu.\n\nN'oubliez pas le dossier de Bourse.\n\nPour l'alimentation, Tristan a eu un transit fluide (=caca tous les jours)\navec une alimentation √©quilibr√©e.\nLe matin, yaourts et fruits, omelette.\nSi pas possible, pain de mie √† la farine de bl√© compl√©te, avec du beurre.\nLe midi, l√©gumes vari√©s, poisson, ou viande, ou volaille.\nL'apr√®s midi, des fruits.\nLe soir, beaucoup de l√©gumes, avec des pommes de terre.\n\nIl faut √©viter ce qui constipe =\nLES C√âR√âALES\nFarine de bl√©, de ma√Øs, d'orge, de seigle, et le riz.\nLes nouilles sont √† base de bl√© ou de riz.\nREMPLACER par =\nDes pommes de terre ( riches en fibres, en magn√©sium, sucre lent, se lib√®re\nsur 12h)\nDes patates douces, ignames, tarot, haricots blancs ou rouges, lentilles,\netc ...\nET pr√©parer beaucoup de l√©gumes verts, haricots verts, choux, brocolis,\ncourgettes, aubergines...\nET des crudit√©s en entr√©e : concombres, carottes,\n\nLes fruits au go√ªter, retour de l'√©cole, je ne d√©taille pas, vous avez tout\nce qu'il faut en march√© de rue, melon, papaye, pamplemousse...\nC'est juste apr√®s le go√ªter, et avant tout contact avec les √©crans qu'il\nest disponible pour une lecture litt√©raire.\n\nAu sujet des √©crans. J'avais mis des r√®gles. Tout enfant accept√© les r√®gles\nsi elles sont motiv√©es et expliqu√©es par l'adulte.\n1 heure avec ses parents, qui devient 1 h avec mamie pour lecture de\nlitt√©rature fran√ßaise.\n1 heure de lecture des informations, site anglais, qui semble bien.\n1 heure d'√©change avec les copains de l'√©cole, si ce n'est pas un jour\nd'√©cole, o√π il peut voir ses amis √† la r√©cr√©ation.\n1 heure de jeux, pour lui-m√™me. Il sait contr√¥ler. C'est l√† qu'il y a\npossibilit√© d'addiction , car collecte de points, ou d'argent, et on fait\ncroire aux enfants qu'il faut √™tre constamment connect√© pour gagner\nquelques points ou sous.\n\nPlus je vous verrai clairs sur ces points, et plus je serai effac√©e. Plus\nje sentirai de flottement de votre part , et plus je serai pr√©sente.\n\nTristan a une personnalit√© forte, et des potent"
}