{
  "year": 2024,
  "seq": 81,
  "meta": {
    "date": "2024-10-16",
    "from": "MYM MANDABA SCI <mymmandaba@gmail.com>",
    "to": "Yannick Mandaba <y.mandaba@gmail.com>",
    "subject": "Re: FW: doc april"
  },
  "proposals": [
    {
      "index": -81,
      "etiquette": "Frais bus Tristan",
      "category": "MIN",
      "duration": "LT",
      "source": "AI",
      "score": 1,
      "matched_from": [
        "ai_new"
      ]
    }
  ],
  "raw_excerpt": "ðŸ—• Date : 2024-10-16\nðŸ‘¤ From : MYM MANDABA SCI <mymmandaba@gmail.com>\nðŸ“¨ To   : Yannick Mandaba <y.mandaba@gmail.com>\nðŸ§• Subject : Re: FW: doc april\n---\nOui, je t'ai demandÃ© de remplir, et pour CFE, et pour April, et comparer...\nJ'ai bien payÃ© LUMA. A chaque fois que tu m'as envoyÃ© la facture.\nJe suis encore plus inquiÃ¨te que toi, de vous savoir sans assurance santÃ©.\n\nLe mer. 16 oct. 2024, 05:36, Yannick Mandaba  a Ã©crit :\n\n> Je cherchais les status de MYM et je  tombe sur Ã§a.... O si je commence Ã \n> creuser... Non on est au delÃ  des mots. Et elle a l'indÃ©cence de continuer\n> Ã  batailler avec moi encore aujourd'hui voyez l'email ci-dessous...\n> PS : Je voudrais voir les status de MYM svp merci.\n>\n> ---------- Forwarded message ---------\n> From: Yannick Mandaba (personal business) \n> Date: Wed, Apr 10, 2013 at 6:39â€¯PM\n> Subject: FW: doc april\n> To: maryvonne masseron-mandaba \n>\n>\n> MAman,\n>\n>\n>\n> Ca fait 6 ans que je nâ€™ai pas dâ€™assurance. Juste une assurance en cas\n> dâ€™accident et une assurance qui couvre uniquement une hospitalisation pour\n> un moment limitÃ© Ã  20.000 Euro.\n>\n>\n>\n> Gautier a pris cette assurance lÃ  avant de venir.\n>\n> Tu penses que câ€™est bien ?\n>\n>\n>\n> Yannick\n>\n>\n> --\n> Yannick Mandaba\n> Mobile: +66.8782.00.622\n>"
}