{
  "year": 2024,
  "seq": 7,
  "meta": {
    "date": "2024-01-21",
    "from": "MYM MANDABA SCI <mymmandaba@gmail.com>",
    "to": "Yannick Mandaba <y.mandaba@gmail.com>, marcmandaba <marcmandaba@gmail.com>",
    "subject": "Titre de propriete Toa-Ziki nÂ°5338"
  },
  "proposals": [
    {
      "index": -7,
      "etiquette": "Visa / immigration",
      "category": "MIN",
      "duration": "LT",
      "source": "AI",
      "score": 1,
      "matched_from": [
        "ai_new"
      ]
    }
  ],
  "raw_excerpt": "ğŸ—• Date : 2024-01-21\nğŸ‘¤ From : MYM MANDABA SCI <mymmandaba@gmail.com>\nğŸ“¨ To   : Yannick Mandaba <y.mandaba@gmail.com>, marcmandaba <marcmandaba@gmail.com>\nğŸ§• Subject : Titre de propriete Toa-Ziki nÂ°5338\n---\nBonjour, Yannick et Marc,\nD'abord je vous souhaite une belle annÃ©e 2024, Ã  vous et vos proches.\nPaix, et empathie.\n\nVoici la copie du Titre de PropriÃ©tÃ© de Toa-Ziki. 5338.\n\nIl est souhaitable que, Ã  la demande de MaÃ®tre Roosalem,\n\nLa procuration de Yannick, pour ma signature, soit enregistrÃ©e au service\nnotarial du Consulat de France Ã  Bangkok, puis envoyÃ©e Ã  Bangui,\n\nL'original de la Copie du Titre, Ã  la Conservation de la PropriÃ©tÃ© FonciÃ¨re\nde la RCA, soit dÃ©posÃ©e Ã  l'Etude de Maitre Roosalem.\n\nQuelle est la procÃ©dure envisagÃ©e par Marc.?.\n\nEn attendant, je vais faire scanner le Titre, et vous l'envoyer par mail Ã \npartir de mymmandaba@gmail.com.\n\nBonne journÃ©e\nMaman"
}