{
  "year": 2024,
  "seq": 9,
  "meta": {
    "date": "2024-02-06",
    "from": "MYM MANDABA SCI <mymmandaba@gmail.com>",
    "to": "Marc Mandaba <marcmandaba@gmail.com>, Yannick Mandaba",
    "subject": "ReÂ : Titre de propriete Toa-Ziki nÂ°5338"
  },
  "proposals": [
    {
      "index": -9,
      "etiquette": "Visa / immigration",
      "category": "MIN",
      "duration": "LT",
      "source": "AI",
      "score": 1,
      "matched_from": [
        "ai_new"
      ]
    }
  ],
  "raw_excerpt": "ğŸ—• Date : 2024-02-06\nğŸ‘¤ From : MYM MANDABA SCI <mymmandaba@gmail.com>\nğŸ“¨ To   : Marc Mandaba <marcmandaba@gmail.com>, Yannick Mandaba\n <y.mandaba@gmail.com>\nğŸ§• Subject : ReÂ : Titre de propriete Toa-Ziki nÂ°5338\n---\nOui, D'accord. Je le donne Ã  Marc, Ou je l'amÃ¨ne moi-mÃªme. Quel est le degrÃ© d'urgence ? \n\nEnvoyÃ© depuis mon tÃ©lÃ©phone Huawei\n\n-------- Message original --------\nDeÂ : Marc Mandaba &lt;marcmandaba@gmail.com&gt;\nDateÂ : mar. 6 fÃ©vr. 2024 Ã  10:18\nÃ€Â : MYM MANDABA SCI &lt;mymmandaba@gmail.com&gt;, Yannick Mandaba &lt;y.mandaba@gmail.com&gt;\nObjetÂ : Re: Titre de propriete Toa-Ziki nÂ°5338\n\nBonjour\n\n\n\nSuite Ã  rÃ©union avec Me Roosalem ce matin.\n\n\n\nIl faut l&#39;original du titre foncier qui sera amenÃ© au domaine pour inscription de la copro sur le TF. Donc impossible de travailler sur les scan.\n\n\n\nÂ La mÃªme inscription sera portÃ©e en parallÃ¨le dans le grand livre qui demeure aux domaines.Â \n\n\n\nIl faudra donc que j&#39;amÃ¨ne le TF original ou que maman l&#39;amÃ¨ne.\n\n\n\nMerciÂ \n\n\n\nSent from \nOutlook for Android\n\nFrom: Marc Mandaba &lt;marcmandaba@gmail.com&gt;\n\nSent: Tuesday, January 23, 2024 10:28:28 AM\n\nTo: MYM MANDABA SCI &lt;mymmandaba@gmail.com&gt;; Yannick Mandaba &lt;y.mandaba@gmail.com&gt;\n\nSubject: Re: Titre de propriete Toa-Ziki nÂ°5338\nÂ \n\n\nPour information, j&#39;ai Ã©galement une copie lÃ©galisÃ©e du TF que je dÃ©pose\nMerci\n\n\n\n\n\n\nSent from \nOutlook for Android\n\nFrom: MYM MANDABA SCI &lt;mymmandaba@gmail.com&gt;\n\nSent: Sunday, January 21, 2024 10:12:29 AM\n\nTo: Yannick Mandaba &lt;y.mandaba@gmail.com&gt;; marcmandaba &lt;marcmandaba@gmail.com&gt;\n\nSubject: Titre de propriete Toa-Ziki nÂ°5338\nÂ \n\n\nBonjour, Yannick et Marc,\nD&#39;abord je vous souhaite une belle annÃ©e 2024, Ã  vous et vos proches.\nPaix, et empathie.Â \n\n\n\nVoici la copie du Titre de PropriÃ©tÃ© de Toa-Ziki. 5338.\n\n\n\nIl est souhaitable que, Ã  la demande de MaÃ®tre Roosalem,\n\n\n\nLa procuration de Yannick, pour ma signature, soit enregistrÃ©e au service notarial du Consulat de France Ã  Bangkok, puis envoyÃ©e Ã  Bangui,Â \n\n\n\nL&#39;original de la Copie du Titre, Ã  la Conservation de la PropriÃ©tÃ© FonciÃ¨re de la RCA, soit dÃ©posÃ©e Ã  l&#39;Etude de Maitre Roosalem.Â \n\n\n\nQuelle est la procÃ©dure envisagÃ©e par Marc.?.Â \n\n\n\nEn attendant, je vais faire scanner le Titre, et vous l&#39;envoyer par mail Ã  partir de\nmymmandaba@gmail.com.Â \n\n\n\nBonne journÃ©eÂ \nMaman"
}