{
  "year": 2024,
  "seq": 38,
  "meta": {
    "date": "2024-05-04",
    "from": "MYM MANDABA SCI <mymmandaba@gmail.com>",
    "to": "Yannick Mandaba <y.mandaba@gmail.com>, marcmandaba <marcmandaba@gmail.com>",
    "subject": "2 questions"
  },
  "proposals": [
    {
      "index": -38,
      "etiquette": "Appartement Pergol√®se (vente/location)",
      "category": "MIN",
      "duration": "LT",
      "source": "AI",
      "score": 1,
      "matched_from": [
        "ai_new"
      ]
    }
  ],
  "raw_excerpt": "üóï Date : 2024-05-04\nüë§ From : MYM MANDABA SCI <mymmandaba@gmail.com>\nüì® To   : Yannick Mandaba <y.mandaba@gmail.com>, marcmandaba <marcmandaba@gmail.com>\nüßï Subject : 2 questions\n---\nBonjour vous deux.\n\n√Ä Yannick, merci pour le dossier N√©pal. Mais, je ne peux rien t√©l√©charger\npour l'instant, car ma bo√Æte Google est pleine √† 91%. Je veux acheter de\nl'espace de stockage, mais ne sais lequel choisi, Google one, Google drive,\netc... Merci du conseil.\n\n√Ä Marc, l'appartement de Cergy n'est plus lou√© depuis janvier.\nLes diff√©rents personnels de l'agence Sergic Pontoise, 3 rue Thiers, m'ont\nsollicit√©e pour r√©gler les soucis un par un.\n- remise en √©tat, nettoyage, peintures, √©lectricit√©. C'est fait. Pour 3000\neuros.\n- d√©claration de vacances aux imp√¥ts, et obtention d'un num√©ro fiscal\nvalable, c'est en train de se faire, car il n'y a pas de titre foncier,\nmais seulement des parts sociales. Dossier en cours.\n- apr√®s ils me disent que ce n'est pas louable au prix demand√©, 980 euros\navec les charges. C'est eux qui ont fix√© le prix. C'est le loyer Pergolese,\npour une surface 2 fois moindre. Moi, j'ai une seule exigence, pas de\ncollocation √©tudiante, car il y en a d√©j√† beaucoup au 4 les ch√¢teaux saint\nsylvere, et cela occasionn√© des nuisances sonores nocturnes, et des proc√®s\naux propri√©taires, par les autres occupants propri√©taires exc√©d√©s.\n- maintenant, ils ont √† dire que les huisseries sont √† refaire, ne sont\nplus √©tanches, laissent entrer le froid.\n\nMa question √† Marc : viendrais tu, ce lundi, 6 mai, si ton travail te le\npermet, voir l'appartement, avec le chef d'agence. Si tu peux, et si tu es\nmotiv√©, dis-le moi, afin que je pr√©cise une demande du rendez-vous qui m'a\n√©t√© propos√©.\n\nMerci\nMaman\n\n0783359723\nTel et whatsapp"
}