{
  "year": 2024,
  "seq": 2,
  "meta": {
    "date": "2024-01-13",
    "from": "MYM MANDABA SCI <mymmandaba@gmail.com>",
    "to": "\"y.mandaba@gmail.com\" <y.mandaba@gmail.com>",
    "subject": "TrÂ : (23 photos) Marc (Themis)"
  },
  "proposals": [],
  "raw_excerpt": "ğŸ—• Date : 2024-01-13\nğŸ‘¤ From : MYM MANDABA SCI <mymmandaba@gmail.com>\nğŸ“¨ To   : \"y.mandaba@gmail.com\" <y.mandaba@gmail.com>\nğŸ§• Subject : TrÂ : (23 photos) Marc (Themis)\n---\nReÃ§u de Marc, Je ne suis pas concernÃ©e \n\nEnvoyÃ© depuis mon tÃ©lÃ©phone Huawei\n\n-------- Message original --------\nDeÂ : maryvonne masseron-mandaba &lt;maryvonnemm@hotmail.com&gt;\nDateÂ : sam. 13 janv. 2024 Ã  12:09\nÃ€Â : MYM MANDABA SCI &lt;mymmandaba@gmail.com&gt;\nObjetÂ : TR: (23 photos) Marc (Themis)\n\n\n\n\n\n\n\nDe : Marc &lt;colo3476@vwb.me&gt;\n\nEnvoyÃ© : jeudi 11 janvier 2024 19:57\n\nÃ€ : maryvonnemm@hotmail.com &lt;maryvonnemm@hotmail.com&gt;\n\nObjet : (23 photos) Marc (Themis)\nÂ \n\n\n\n\nOn Thursday, January 11, 2024 12:50 PM, Marc wrote:\n\nFrom the the first week of 2024 \nhttp://mhnyl.hudcmes.com/ \n\n\n\n\n\n\n\nSincerely Ã°Å¸ËœÅ "
}