{
  "year": 2024,
  "seq": 123,
  "meta": {
    "date": "2024-04-01",
    "from": "maryvonne masseron-mandaba <maryvonnemm@hotmail.com>",
    "to": "Office Notarial de Me Dominique CHAUDET <dch.35142@notaires.fr>",
    "subject": "proposition Ã  la vente de la parcelle 000 AC 01 214"
  },
  "proposals": [],
  "raw_excerpt": "ðŸ—• Date : 2024-04-01\nðŸ‘¤ From : maryvonne masseron-mandaba <maryvonnemm@hotmail.com>\nðŸ“¨ To   : Office Notarial de Me Dominique CHAUDET <dch.35142@notaires.fr>\nðŸ§• Subject : proposition Ã  la vente de la parcelle 000 AC 01 214\n---\nbonjour Matre,\nje suis passe , il y a deux mois, voir votre collaboratrice, pour proposer  la vente, le jardin, derrire le Montmorrency, parcelle AC 214, qui donne sur la rue Ducoudray,  Vitr.\nJe n'ai toujours pas de retour, ni positif, ni ngatif.\nLa personne  qui je souhaite vendre s'impatiente.\nMerci de me donner votre avis.\nVoulez-vous vous occuper de cette transaction, ou non.\nSi oui, je souhaite votre estimation du montant de la vente tous frais compris, et en faire une donation-partage  mes 2 fils.\nSi non, l'acqureur va faire intervenir son notaire.\nCordialement\nmaryvonne mandaba masseron"
}