{
  "year": 2024,
  "seq": 128,
  "meta": {
    "date": "2024-10-29",
    "from": "maryvonne masseron-mandaba <maryvonnemm@hotmail.com>",
    "to": "Christian NÃ´el yangue <cnyangue@hotmail.com>",
    "subject": "Le local Radiologie"
  },
  "proposals": [],
  "raw_excerpt": "ðŸ—• Date : 2024-10-29\nðŸ‘¤ From : maryvonne masseron-mandaba <maryvonnemm@hotmail.com>\nðŸ“¨ To   : Christian NÃ´el yangue <cnyangue@hotmail.com>\nðŸ§• Subject : Le local Radiologie \n---\nBonsoir,\n Christian,\nJe n'ai pas encore donn mon accord pour que tu occupes ce local, au Groupe Mdical Laennec.\nCeci tant donn ta faible capacit  entretenir, et  nettoyer.\nTu as laiss cet endroit que je t'avais confi en parfait tat,( puisque nous y faisions des cours de gymnastique rythmique) , dans un\ntat de salet imaginable...\nLes sanitaires sont bouchs, ainsi que le lavabo, et la douche.\nIl y a des fuites d'eau du toit, qui ne m'ont pas t signales, et, consquemment une dtrioration des plafonds, de l'accueil, du bureau,  refaire en totalit, et de la grande salle.\nJe note aussi qu'il faut rememttre les brasseurs d'air, au plafond, comme  l'origine.\nLes carrelages au sol sont trs abms, et des carreaux enlevs, et non remplacs  l'endroit des installations radiographies antrieures.\nDu matriel de radiographie, tables, ampoules, crans de contrle, encombrent les  3 pices principales, et comme je l'ai dj dit, mr Fijalkowski ne peut prendre la responsabilit d'vacuer ce matriel mdical.\nDans le local ddi au dveloppement des radios, beaucoup d'installations sont aussi  vacuer, une dveloppeuse particulirement, et une paillasse  nettoyer, et un lavabo  dboucher.\nDans le bureau, le plafond est totalement  refaire, la table d'examen  son revtement endommag, des dossiers mdicaux sont  trier et vacuer. galement du matriel d'chographie, 2 photocopieuses...\nDans les pices annexes, il y a encore du matriel radiologique, des crans, des dossiers.\n\nQuand je suis descendue cet aprs -midi, pour recevoir un autre entrepreneur, pour un autre devis, j'ai constat que, malgr les fuites d'eau du toit, le dlabrement des plafonds, l'absence de sanitaires fonctionnels, le carrelage  refaire, la salet et la poussire, la matriel neuf a t dball.\n\nPassage en force !!!\n\nInconscience !!!\n\nMpris du bailleur des lieux !!!\n\net du financeur du nouveau matriel.!!!\n\n\nAux autres destinataires,\nMerci de raisonner Yangu.\n\nIl faut rnover avant de recevoir du public.\n\nLes choses doivent tre claircies avant le 31 octobre 2024.\nPas de promesses...\nUn nettoyage complet du local donn  bail en 1993.\n\nMaryvonne MANDABA\n72303207\n\n\n\n\nEnvoy  partir de Outlook pour Android"
}