{
  "year": 2024,
  "seq": 45,
  "meta": {
    "date": "2024-06-22",
    "from": "MYM MANDABA SCI <mymmandaba@gmail.com>",
    "to": "Yannick Mandaba <y.mandaba@gmail.com>",
    "subject": "Bon anniversaire"
  },
  "proposals": [
    {
      "index": -45,
      "etiquette": "Dossier de bourse Tristan",
      "category": "MIN",
      "duration": "LT",
      "source": "AI",
      "score": 1,
      "matched_from": [
        "ai_new"
      ]
    }
  ],
  "raw_excerpt": "ğŸ—• Date : 2024-06-22\nğŸ‘¤ From : MYM MANDABA SCI <mymmandaba@gmail.com>\nğŸ“¨ To   : Yannick Mandaba <y.mandaba@gmail.com>\nğŸ§• Subject : Bon anniversaire\n---\nBonne ballade.\nDe ma part Marc va t'envoyer des sous.\nJe n'ai plus de liquiditÃ©s.\nLa bourse baisse +++\n\nJ'ai besoin du billet de Tristan.\nLa premiÃ¨re activitÃ© esr Dysbeyland, proche de Roissy, et sur notre trajet\nen train vers Rennes. L'hÃ´tel y est trÃ¨s cher. Or, pour profiter de la\njournÃ©e trÃ¨s chÃ¨re aussi, il faut hÃ´tel la veille et hÃ´tel le soir.\n\nSans billet, je vais Ãªtre obligÃ©e d'annuler toutes le rÃ©servations, une Ã \nune."
}