{
  "year": 2024,
  "seq": 18,
  "meta": {
    "date": "2024-03-04",
    "from": "MYM MANDABA SCI <mymmandaba@gmail.com>",
    "to": "Yannick Mandaba <y.mandaba@gmail.com>",
    "subject": "ReÂ :"
  },
  "proposals": [],
  "raw_excerpt": "ğŸ—• Date : 2024-03-04\nğŸ‘¤ From : MYM MANDABA SCI <mymmandaba@gmail.com>\nğŸ“¨ To   : Yannick Mandaba <y.mandaba@gmail.com>\nğŸ§• Subject : ReÂ : \n---\nJe t'ai dit, et Ã©crit, que je veux te payer l'assurance CFE, mÃªme si c'est cher, - pour assuarance maladie- et pour assurance retraiteTu ne lis pas \n\nEnvoyÃ© depuis mon tÃ©lÃ©phone Huawei\n\n-------- Message original --------\nDeÂ : Yannick Mandaba &lt;y.mandaba@gmail.com&gt;\nDateÂ : lun. 4 mars 2024 Ã  05:38\nÃ€Â : MYM MANDABA SCI &lt;mymmandaba@gmail.com&gt;\nObjetÂ : \nTu me dis de pas m&#39;inquiÃ©ter que j&#39;ai pas besoin de l&#39;argent de bille mais est-ce que tu sais que Ã§a fait maintenant un an que je suis pas assurÃ© quand je me suis fait mal au coude j&#39;ai dÃ» me soigner tout seul et je suis tombÃ© Ã  cochon et j&#39;arrive toujours pas Ã  me mettre en position pour faire des pompes les deux mains et je peux pas faire de test donc j&#39;espÃ¨re juste que c&#39;est un traumatisme avec des choses Ã  l&#39;intÃ©rieur qui va se rÃ©gler tout seul mais je me je vois pas comment tu peux dire que j&#39;ai pas besoin de l&#39;argent de vie alors que je peux mÃªme pas Ãªtre assurÃ©"
}