{
  "year": 2024,
  "seq": 33,
  "meta": {
    "date": "2024-04-08",
    "from": "MYM MANDABA SCI <mymmandaba@gmail.com>",
    "to": "Yannick Mandaba <y.mandaba@gmail.com>",
    "subject": "Re: vacances de Tristan"
  },
  "proposals": [
    {
      "index": -33,
      "etiquette": "Frais bus Tristan",
      "category": "MIN",
      "duration": "LT",
      "source": "AI",
      "score": 1,
      "matched_from": [
        "ai_new"
      ]
    }
  ],
  "raw_excerpt": "ðŸ—• Date : 2024-04-08\nðŸ‘¤ From : MYM MANDABA SCI <mymmandaba@gmail.com>\nðŸ“¨ To   : Yannick Mandaba <y.mandaba@gmail.com>\nðŸ§• Subject : Re: vacances de Tristan\n---\nmerci de me confirmer le numero de Tristan\nil ne rÃ©pond pas\n++ 66 63 241 2825\n\nLe lun. 8 avr. 2024 Ã  10:59, Yannick Mandaba  a Ã©crit :\n\n> Bonjour,\n>\n> Heu.. Il faut laisser Marc tranquille.\n> Tristan veut que je vienne mais il dira toujours Ã§a.\n> Tu lui demandes Ã  lui s'il est ok pour venir seul.\n> Nous on est ok.\n>\n> Si tu veux que je vienne et que tu as les moyens tu payes 2 billets.\n> Si tu veux juste Tristan c'est ok mais pas de voyage dans des bus au bord\n> de routes escarpÃ©es, ni rien de dangereux.\n>\n> LÃ  je dois bosser.\n> Je peux faire des devis si tu ne m'obliges pas Ã  cavaler partout et du\n> moment qu'il y a climatiseur et internet je suis ok.\n> Je ferai un effort et je paierai Waen pour 2 semaines pour me remplacer.\n>\n> Je t'avais dit que tu n'as pas besoin de l'avis de Bee, toi\n> personnellement.\n> Si j'ai dit oui c'est oui pour nous deux.\n>\n> Envoie le formulaire du billet d'avion elle va signer.\n> Il faut prendre Axa assurance voyage pour Tristan c'est Ã§a qu'elle a\n> demandÃ©, cela se fait en ligne facilement (axa voyage)\n> Pour lui ou lui et moi.\n>\n> Tu le fais si tu veux, on signera les papiers de la compagnie que tu\n> choisis.\n> Ne demande rien Ã  Marc, ni Ã  Bee, ni moi j'ai pas d'argent.\n>\n> Merci en tout cas pour le cadeau pour Tristan.\n>\n> Moi je tiens la barre tant que je peux et on s'organisera quand tout ira\n> mieux ici.\n> Si je reste on va retaper 2 chambres dans l'aile del a maison pour Tristan\n> Sa chambre, nous Ã  cÃ´tÃ©, notre grande chambre actuelle sera mon Ã©tude et\n> chambre d'amis/salle de jeux..\n>\n> Bee a beaucoup pleurÃ© aujourd'hui avant d'aller souhaiter bon anniversaire\n> Ã  sa mÃ¨re Ã  l'hÃ´pital oÃ¹ sa sÅ“ur l'emmÃ¨ne pour la visite.\n> Ne va pas l'emmerder avec tes trucs bizarres.\n> Merci\n>\n>\n> On Mon, Apr 8, 2024 at 2:23â€¯PM MYM MANDABA SCI \n> wrote:\n>\n>> bonjour,\n>>\n>> j'avais promis Ã  Tristan des vacances d'Avril au NEPAL.\n>>\n>> *Ses dates de vacances sont du 13 au 21 avril.*\n>>\n>> Initialement, j'avais rÃ©servÃ© pour lui, un vol BKK Ã  Katmandu, du 21 au\n>> 28, je faisais Paris -BKK, puis avec lui BKK Ã  KAT, puis retour avec lui Ã \n>> BKK, et retour vers Paris. J'ai annulÃ© ce voyage, en l'absence d'accord\n>> formel de Bee,et en avais averti Yannick, qui n'a pas lu le message..\n>>\n>> Finalement, Bee Ã©tant d'accord pour que Yannick accompagne Tristan, ils\n>> pourraient aller tous les deux de BKK Ã  Katmandu. Et selon les dates\n>> retenues, je les retrouverai. A la limite mÃªme, Tristan peut Ãªtre confiÃ© Ã \n>> une hÃ´tesse, s'il le veut bien. La Compagnie  THAI fait ce voyage en 3h30.\n>> Mais je trouve que ce serait une belle Ã©vasion pour Yannick.\n>>\n>> Les dates que je souhaite = 16 au 26 avril\n>> +/- 2 jours\n>> Est-ce possible que Marc paye les 2 billets, Tristan et Yannick avec la\n>> cagnotte de Bangui ?\n>> Pouvez-vous vous entendre pour cela ?\n>> je m'occuperai de mon billet et de l'hÃ©bergement et des activitÃ©s.\n>>\n>> Bonne journÃ©e\n>> M\n>> PS, je dois mettre en route un nouveau smartphone dans la semaine\n>> On peut me joindre par Zoom, ou Meet, ou WHATSAPP sur mon numÃ©ro de\n>> Bangui 236 72 30 32 07 ( rÃ©activÃ© jusqu'au 1 juillet)\n>>\n>> Merci pour Tristan\n>>\n>>\n>\n> --\n> Yannick Mandaba\n> Mobile: +66.8782.00.622\n>"
}