{
  "year": 2024,
  "seq": 83,
  "meta": {
    "date": "2024-10-17",
    "from": "MYM MANDABA SCI <mymmandaba@gmail.com>",
    "to": "Yannick Mandaba <y.mandaba@gmail.com>",
    "subject": "Re: STATUTS MYM MANDABA Lettre d'intention de vente"
  },
  "proposals": [
    {
      "index": -83,
      "etiquette": "Dossier de bourse Tristan",
      "category": "MIN",
      "duration": "LT",
      "source": "AI",
      "score": 1,
      "matched_from": [
        "ai_new"
      ]
    }
  ],
  "raw_excerpt": "ðŸ—• Date : 2024-10-17\nðŸ‘¤ From : MYM MANDABA SCI <mymmandaba@gmail.com>\nðŸ“¨ To   : Yannick Mandaba <y.mandaba@gmail.com>\nðŸ§• Subject : Re: STATUTS MYM MANDABA Lettre d'intention de vente\n---\nMon compte mymmandaba est compromis.\nLis mon dernier whatsapp et dis moi quoi faire.\n\nLe jeu. 17 oct. 2024, 05:28, Yannick Mandaba  a Ã©crit :\n\n> Bonjour,\n>\n>\n>\n> Je voudrais une copie des statuts de la SCI MYM MANDABA.\n>\n> Je vous fais part de mon intention de vendre mes actifs au plus offrant.\n> Jâ€™ai besoin de lâ€™argent pour payer Marc pour la moitiÃ© des rÃ©parations de\n> la propriÃ©tÃ© de Bangui.\n>\n> AprÃ¨s quoi je vais porter plainte pour le dÃ©labrement et mettre la maison\n> en location pour me rembourser.\n>\n>\n>\n> Marc STP prÃ©pare une reconnaissance de dette pour la valeur en question y\n> compris le forage pour lequel tu avais notre accord.\n>\n> Si Maman accepte ton cadeau, moi pas. Je veux payer ma part.\n> Je devrais en avoir les moyens sans le dommage causÃ© par maman.\n>\n> â€¦Au pro rata de la  nouvelle copro qui Ã©tait dÃ©jÃ  dans les tuyaux au\n> moment du forage, et ma maison nâ€™Ã©tant quâ€™une idÃ©e et pourrait ne jamais\n> profiter du forage tu conviendras sans doute de compter 2 propriÃ©tÃ©s et je\n> payerai ma part le jour oÃ¹/si je construis ma maison..\n>\n> Bon prÃ©paratifs pour les cÃ©rÃ©monies Marcus.\n>\n>\n>\n> Maman je crois que câ€™est toi qui gÃ¨res la SCI alors les statuts stp merci.\n> Dans ton dernier email tu me parlais de vouloir gÃ©rer mon assurance, mais\n> je te demandais surtout les statuts.\n> Essaye dÃ©jÃ  de gÃ©rer ton cabinet, la maison, tous tes nombreux avoirs\n> correctement â€¦et ensuite si tu as du temps tu pourras gÃ©rer mon assurance\n> si Ã§a te fait plaisir. Pas de soucis.\n>\n> ArrÃªtons dâ€™abord lâ€™hÃ©morragie en manque Ã  gagner et ensuite que chacun\n> fasse les investissements dont ses projets personnels ont besoin *selon\n> son propre jugement et en toute libertÃ©.*\n>\n> A bientÃ´t,\n>\n>\n>\n> Yannick MANDABA\n>\n> Mobile: +66 878200622\n>\n>\n>\n>\n>\n>\n> *(FR) Ce courriel (de mÃªme que les fichiers joints) est strictement\n> rÃ©servÃ© Ã  l'usage de la personne ou de l'entitÃ© Ã  qui il est adressÃ© et\n> peut contenir de l'information privilÃ©giÃ©e et confidentielle. Toute\n> divulgation, distribution ou copie de ce courriel est strictement prohibÃ©e.\n> Si vous avez reÃ§u ce courriel par erreur, veuillez nous en aviser\n> sur-le-champ, dÃ©truire toutes les copies et le supprimer de votre systÃ¨me\n> informatique.**(ENG) This communication (including any files transmitted\n> with it) is intended solely for the person or entity to whom it is\n> addressed, and may contain confidential or privileged information. The\n> disclosure, distribution or copying of this message is strictly forbidden.\n> Should you have received this communication in error, kindly contact the\n> sender promptly, destroy any copies and delete this message from your\n> computer system*\n>\n>\n>"
}