{
  "year": 2024,
  "seq": 44,
  "meta": {
    "date": "2024-06-11",
    "from": "MYM MANDABA SCI <mymmandaba@gmail.com>",
    "to": "Yannick Mandaba <y.mandaba@gmail.com>, BeeBaa <beebeau89@gmail.com>",
    "subject": "Tristan et son √©cole"
  },
  "proposals": [
    {
      "index": -44,
      "etiquette": "Frais d'√©cole / bus Tristan",
      "category": "MIN",
      "duration": "LT",
      "source": "AI",
      "score": 1,
      "matched_from": [
        "ai_new"
      ]
    }
  ],
  "raw_excerpt": "üóï Date : 2024-06-11\nüë§ From : MYM MANDABA SCI <mymmandaba@gmail.com>\nüì® To   : Yannick Mandaba <y.mandaba@gmail.com>, BeeBaa <beebeau89@gmail.com>\nüßï Subject : Tristan et son √©cole\n---\nBonjour,\nJ'√©tais surprise que, hier, vous me demandiez la pr√©paration de\nl'interrogation d'histoire...\nDepuis janvier, Tristan passe trop de temps aux jeux vid√©os, avec des\ncopains qui eux aussi s'ennuient... √ätre ensemble leur fait penser qu'ils\nne sont pas seul chacun dans sa maison.\nMais cela est au d√©triment de la lecture et de la concentration sur le\ntravail scolaire.\nDonc, depuis janvier, j'appelle √† 18h. Il r√©pond ou pas. Il laisse tra√Æner\njusqu'√† 18h30. Et l√† nous n'avons plus de temps pour revoir les le√ßons de\nl'√©cole.\nNous ne faisons que du fran√ßais, lecture et vocabulaire.\nAucune le√ßon histoire, g√©ographie, sciences, emc, depuis janvier.\nEt m√™me, parfois, il continue √† jouer pendant la lecture... Je le sais,\nmais ne le dis pas, car il n'aime pas avoir tort.\n\nPour le peu de temps qui reste, deux semaines de contr√¥le, veillez √† ce\nqu'il ne joue pas avant la le√ßon avec moi, qu'il relise ses cahiers\nd'√©cole, revoie ses √©valuations, qu'il pr√©pare cahier, crayon,\ndictionnaire, textes √† lire.\n\nDe 18h √† 19h, silence,\n les le√ßons, et contr√¥les (30mn),\npuis la lecture de Victor Hugo (30mn).\n\nConfisquez le t√©l√©phone √† 20h\nAmenez le marcher les samedi et dimanche."
}