{
  "year": 2024,
  "seq": 56,
  "meta": {
    "date": "2024-08-08",
    "from": "MYM MANDABA SCI <mymmandaba@gmail.com>",
    "to": "Yannick Mandaba <y.mandaba@gmail.com>",
    "subject": "Re:"
  },
  "proposals": [],
  "raw_excerpt": "ðŸ—• Date : 2024-08-08\nðŸ‘¤ From : MYM MANDABA SCI <mymmandaba@gmail.com>\nðŸ“¨ To   : Yannick Mandaba <y.mandaba@gmail.com>\nðŸ§• Subject : Re:\n---\nMerci\n\nLe jeu. 8 aoÃ»t 2024, 05:34, Yannick Mandaba  a Ã©crit :\n\n>\n> [8/8, 12:16 AM] Y Mum Freebox: Tu m'as mis dans le caca.\n> CÃ©cile voulait un dÃ©part le 8.\n> Toi le 9.\n> Moi Ã©gal .\n> Marc s'est Ã©nervÃ©.\n> Il ne veut pas pb avec CÃ©cile.\n> Total je perds bcp de sous dans le changement.\n> Hotel et billet de train.\n> La victime de vos manip c'est moi. N'interviens plus stp.\n>\n> [8/8, 12:18 AM] Y Mum Freebox: Marc amÃ¨ne Tristan tÃ´t le matin, demain le\n> 8, Ã  mon hÃ´tel Ã  Bergerac.\n>\n>\n> Non tu es allÃ©e parler Ã  tout le monde eux voulaient que Ã§a passe par moi\n> uniquement hors ils ne m'ont pas dit Ã§a.\n> Tu as obtenu ce que tu voulais j'espÃ¨re. Je suppose que oui, c'est rare\n> que ce ne soit pas le cas.\n>\n> Qu'est ce que tu avais besoin d'aller verrouiller cette partie du voyage\n> oÃ¹ il voit ses cousins?\n> Il fallait l'envoyer par TGV ou avion et le laisser lÃ -bas sans camper au\n> pied de la montagne ils l'auraient garder plus longtemps.\n>\n> Tu ne sais pas laisser faire.\n>"
}