{
  "year": 2024,
  "seq": 99,
  "meta": {
    "date": "2024-11-27",
    "from": "MYM MANDABA SCI <mymmandaba@gmail.com>",
    "to": "Marc Mandaba <marcmandaba@gmail.com>",
    "subject": "Re: Documents Ã  examiner"
  },
  "proposals": [
    {
      "index": -99,
      "etiquette": "Frais bus Tristan",
      "category": "MIN",
      "duration": "LT",
      "source": "AI",
      "score": 1,
      "matched_from": [
        "ai_new"
      ]
    }
  ],
  "raw_excerpt": "ðŸ—• Date : 2024-11-27\nðŸ‘¤ From : MYM MANDABA SCI <mymmandaba@gmail.com>\nðŸ“¨ To   : Marc Mandaba <marcmandaba@gmail.com>\nðŸ§• Subject : Re: Documents Ã  examiner\n---\nLe raisonner.\nIl ne peut abuser encore de ma bienveillance.\nAvec votre accord de surcroÃ®t.\n\nAucun loyer payÃ© depuis longtemps.\nUne dette non honorÃ©e.\nDes bricolages auprÃ¨s de l'Enerca, que j'ai fait rÃ©gulariser par mr Boiko.\nDes bricolages auprÃ¨s de L'OCSS.\nDes bricolages auprÃ¨s de la Mairie.\nDes super bricolages auprÃ¨s de la Sodeca, oÃ¹ il a un dossier YanguÃ© non\napurÃ©, et un dossier CERIM non apurÃ©.\nIl a mÃªme utilisÃ©, sans les rÃ©munÃ©rer sa femme, ses filles, sa niÃ¨ces\nClaudie...\n\nJe vous laisse juger qui il faut sauver, votre oncle, qui se laisse vivre,\nsans rien gÃ©rer vraiment d'autre que les relations, ou votre mÃ¨re, qui n'a\npas encore baissÃ© les bras malgrÃ© vos attaques.\n\nJugez\n\n\n\nLe mer. 27 nov. 2024, 12:35, Marc Mandaba  a Ã©crit :\n\n> En quoi tu as un avis Ã  donner sur ma relation avec  mon dernier dernier\n> oncle paternel ?\n>\n>\n> Sent from Outlook for Android \n> ------------------------------\n> *From:* MYM MANDABA SCI \n> *Sent:* Wednesday, November 27, 2024 12:32:49 PM\n> *To:* Marc Mandaba \n> *Cc:* Yannick Mandaba ; Yannick MANDABA  ymanda@gmail.com>\n> *Subject:* Re: Documents Ã  examiner\n>\n>\n> Il ne s'agit pas de la gestion du Groupe MÃ©dical LaÃ«nnec...\n> Il s'agit de savoir jusqu'Ã  quel point vous soutenez le Dr YanguÃ©.\n> Yannick l'a fÃ©licitÃ© pour nous escroquer un peu plus.\n> Toi, tu m'as dit de me laisser avoir des rapports personnels avec lui.\n> Vous ne voyez pas le conflit d'intÃ©rÃªts.???\n>\n> Donc, vous me laissez gÃ©rer Ã  ma faÃ§on. Je prends acte.\n>\n> Maryvonne MANDABA\n>\n> Le mer. 27 nov. 2024, 12:15, Marc Mandaba  a\n> Ã©crit :\n>\n> Bonjour\n> Pour la Ã©niÃ¨me fois, je ne suis pas impliquÃ© dans la gestion du cabinet.\n> J'ai dÃ©jÃ  prÃ©venu que j'allais bloquer le compte email si je continue Ã \n> recevoir ces spams.\n>\n>\n> Sent from Outlook for Android \n>\n> ------------------------------\n> *From:* MYM MANDABA SCI \n> *Sent:* Wednesday, November 27, 2024 12:10:43 PM\n> *To:* Yannick Mandaba ; Yannick MANDABA  ymanda@gmail.com>; marcmandaba \n> *Subject:* Documents Ã  examiner\n>\n> Bonjour,\n> Yannick et Marc.\n> Voulant connaÃ®tre l'Ã©tat rÃ©el des arriÃ©rÃ©s de Dr YanguÃ© aprÃ¨s du service\n> des EAUX, je lui ai demandÃ© un Ã©tat de sa situation, et un justificatif de\n> rÃ©gularisation.\n> Voici ce qu'il m'a envoyÃ©.\n> Je lui ai demandÃ© une photographie plus lisible des documents, oÃ¹ l'on\n> pourrait lire l'intitulÃ© du compte, et le numÃ©ro du compte, et le numÃ©ro du\n> compteur.\n> Il m'a promis un scan.\n> J'attends toujours.\n> (une bonne photo suffirait !)\n>\n> Si la facture remonte Ã  1996, date oÃ¹ le WC coulait en permanence...le\n> montant doit Ãªtre bien supÃ©rieur Ã  cela. Je crains le pire. La location,\n> avec tous les frais que j'ai engagÃ©s, doit repartir sur des bases saines.\n>\n> Merci de me donner votre avis.\n> MM\n>\n>"
}