{
  "year": 2024,
  "seq": 119,
  "meta": {
    "date": "2024-10-20",
    "from": "maryvonne.masseron@free.fr",
    "to": "Yannick Mandaba <y.mandaba@gmail.com>",
    "subject": "ReÂ : Re: la fiscalitÃ©"
  },
  "proposals": [],
  "raw_excerpt": "ğŸ—• Date : 2024-10-20\nğŸ‘¤ From : maryvonne.masseron@free.fr\nğŸ“¨ To   : Yannick Mandaba <y.mandaba@gmail.com>\nğŸ§• Subject : ReÂ : Re: la fiscalitÃ©\n---\nTu te trompes de cible. \nQui t'aide? Et t'Ã©coute, et aide ton fils ? \nQui t'enfonce par sa passivitÃ©? Sa gluance ( nouveau mot crÃ©Ã© par nÃ©cessitÃ©...) \nQui ne va pas inscrire Tristan dans un club de sport pour 2 semaines ? Qui va le laisser des heures sur son smartphone pour Ãªtre tranquille ? Qui se plaint que je fais trop des virements Ã  la prof de piano ? Qui te cherche querelle toute la journÃ©e? \nMoi je ne te demande rien. \nJ'envoie de l'argent. \nJe suis triste pour toi. \nJe constate ce qu'on te fait endurer. \n\nmaryvonne masseron - 41 rue du puits-mauger 35000 rennes 0299302000 0783359723"
}