{
  "year": 2024,
  "seq": 134,
  "meta": {
    "date": "2024-11-29",
    "from": "maryvonne masseron mandaba <maryvonnemm@hotmail.fr>",
    "to": "\"billing@montri.co.th\" <billing@montri.co.th>",
    "subject": "Transport MANDABA Tristan LFIB 6eme"
  },
  "proposals": [],
  "raw_excerpt": "ðŸ—• Date : 2024-11-29\nðŸ‘¤ From : maryvonne masseron mandaba <maryvonnemm@hotmail.fr>\nðŸ“¨ To   : \"billing@montri.co.th\" <billing@montri.co.th>\nðŸ§• Subject : Transport MANDABA Tristan LFIB 6eme \n---\nSociete Montri Transport,\n\nMadame, monsieur,\nVeuillez noter que le virement de 30 000 baths a bien t effectu, vers votre compte en Thalande, depuis mon compte en France. En date du 27 novembre 2024.\nVeuillez excuser le retard.\nMerci de m'accuser rception.\nLe prochain virement sera fait au 6 janvier.\n\nRfrence =\nMANDABA Tristan\nlve en 6eme au LFIB\nTransport porte  porte\n1er semestre.\nFrais  ma charge.\n\nMaryvonne Masseron MANDABA\nCompte bancaire Socit Gnrale Vitr\nGrand mre de Tristan MANDABA\nCordialement\n\n\n\nEnvoy  partir de Outlook pour Android"
}