{
  "year": 2024,
  "seq": 104,
  "meta": {
    "date": "2024-11-28",
    "from": "MYM MANDABA SCI <mymmandaba@gmail.com>",
    "to": "Yannick Mandaba <y.mandaba@gmail.com>",
    "subject": "Re: Documents Ã  examiner"
  },
  "proposals": [
    {
      "index": -104,
      "etiquette": "Frais bus Tristan",
      "category": "MIN",
      "duration": "LT",
      "source": "AI",
      "score": 1,
      "matched_from": [
        "ai_new"
      ]
    }
  ],
  "raw_excerpt": "ðŸ—• Date : 2024-11-28\nðŸ‘¤ From : MYM MANDABA SCI <mymmandaba@gmail.com>\nðŸ“¨ To   : Yannick Mandaba <y.mandaba@gmail.com>\nðŸ§• Subject : Re: Documents Ã  examiner\n---\nQue serait le groupe mÃ©dical sans YanguÃ© ?\nRÃ©ponse : beaucoup mieux.\n\nD'ailleurs cela me fait mal au cÅ“ur, je vais tout rÃ©nover, et je suis\ncertaine qu'au bout d'un an tout sera dÃ©tÃ©riorÃ©.\n\nSa constante : il ne surveille pas, il ne paye pas ses employÃ©s. Il\nn'Ã©change pas avec les autres collÃ¨gues. En fait, comme moi, ils en ont\nmarre, et maintenant, avec ses accointances, ils en ont peur...\n\nLe jeu. 28 nov. 2024, 07:24, Yannick Mandaba  a Ã©crit :\n\n> Maman tu n'est pas Dieu.\n> Tu ne dÃ©cides pas du mÃ©rite des gens.\n> Tu n'es pas Dieu pour dire celui-ci a eu assez d'aide lui-lÃ  non.\n> LEs voies du seigneur sont impÃ©nÃ©trable et es tiennes sont simplistes et t\n> ne fais aucun efforts alors ne joues pas au distributeur de bon points.\n>\n>\n> BiensÃ»r YanguÃ© est au-dessus des autres.\n> Tu devrais t'appuyer dessus au lieu de l'humilier.\n> La personne qui a abandonnÃ© ce lieu au dÃ©labrement c'est toi.\n> .Lui il baigne ans ton j'en foutre depuis 30 ans, avant le dÃ©cÃ¨s de Papa\n> en gros le ur oÃ¹ vous Ãªtes partism.\n>  et ce n'est pas Ã  lui.!\n> Si le proprio s'en fout les locataires aussi.\n>\n> C'est la famille. Soutien inconditionnel par dÃ©faut.\n> Nous ne sommes pas Jesus , tu n'es pas Jesus.\n> Au moins pour tes proches tu essaye de comprendre et si tu comprends pas\n> sache que personne ne se dÃ©truit volontairement.\n>\n> Tot ce que tu peux faire c'est accompagner tes proches dans leur chemin\n> vers a mort et les voies du seigneur sont imprnetrables Ã§a veut pas\n> expliquer la foudre.\n> Ca veut expliquer que tout le monde subit.\n>\n> MÃªme avec tout ton mÃ©rite et tout ton travail tout peut s'arrÃªter d'un\n> claquement doigt. S'arrÃªter ou foirer, ou rÃ©ussir.\n> Que serait ton Cabinet sans YanguÃ©?\n> Notre maison?\n>\n> Moi je t'ai dit je n'ai aucun problÃ¨me Ã  foutre tout le monde dehors, tout\n> retaper mais il faut garder un espace ajustÃ© pour YanguÃ©. Tu as bien laissÃ©\n> une piece vide tout ce temps et tu veins l'emmerder avec des loyer non\n> perÃ§us.\n>\n> Que vas-tu faire avec tout cet argent?\n> Seule?\n> C'est ce qu'il nous reste de plus proche de Papa.\n>\n> On Wed, Nov 27, 2024 at 7:54â€¯PM MYM MANDABA SCI \n> wrote:\n>\n>> Il faudrait que mr le Dr YanguÃ© s'accorde avec les autres. Il refuse de\n>> participer aux rÃ©unions, que je sois lÃ  ou non, il refuse de participer au,\n>> charges communes, il se met au-dessus des autres. Cela n'a jamais eu lieu\n>> dans ce groupe mÃ©dical.\n>> Il a toujours Ã©tÃ© aidÃ©, son matÃ©riel d'Ã©chographie lui a Ã©tÃ© donnÃ© par\n>> SantÃ© Sud. Son matÃ©riel de radiographie aussi. Ses ordinateurs, par\n>> handicap international, son dÃ©douanement  auto par moi, son crÃ©dit maison\n>> par la CFD, cautionne par nous, et jamais remboursÃ©.\n>> C'est bon. Pour les leÃ§ons, tu repasseras.\n>> Qui utilise ton tÃ©lÃ©phone en ce moment ? Je reconnais un verbiage\n>> anglophone nÃ©gatif...\n>>\n>> Le mer. 27 nov. 2024, 13:19, Yannick Mandaba  a\n>> Ã©crit :\n>>\n>>> Maman,\n>>> Tu te rends insupportable\n>>> Qui veut se retrouver Ã  discuter de problÃ¨mes et solutions avec toi?\n>>>\n>>> Quand il n'y a rien de rationnel.\n>>>\n>>> Marc, il voulait bien gÃ©rer la chose Ã   sa sauce. MÃªme si tu refuses les\n>>> projets de ses amis lÃ  vous pouviez quand il Ã©tait prÃªt Ã  le faire laisser\n>>> simplement la gestion toute simple de l'endroit.\n>>>\n>>> Il Ã©tait motivÃ©.\n>>> Tu veux contrÃ´ler ben vas-y contrÃ´le.\n>>> Nou te regardons.\n>>>\n>>> Personne ne refuse de t'aider c'est juste que on refuse de t'aider comme\n>>> toi tu veux Ãªtre aidÃ©e c'est-Ã -dire de continuer exactement les mÃªmes\n>>> mÃ©thodes lÃ  tu as sauter sur un pot de peinture et tu es contente.\n>>>\n>>> Moi je t'ai donnÃ© mes idÃ©es tu dois centraliser la caisse et le\n>>> nettoyage bon bah et vos histoires de mÃ©decins vous faites Ã§a Ã  cÃ´tÃ© mais\n>>> dans la rÃ©alitÃ© vu que les gens payent pas il y a amendement et donc qui\n>>> seront dÃ©duits Ã  certains nombre de frais d'entrÃ©e de jeu Ã  "
}