{
  "year": 2024,
  "seq": 78,
  "meta": {
    "date": "2024-09-25",
    "from": "MYM MANDABA SCI <mymmandaba@gmail.com>",
    "to": "Yannick Mandaba <y.mandaba@gmail.com>",
    "subject": "Re: Pas de faux"
  },
  "proposals": [
    {
      "index": -78,
      "etiquette": "Paiement salaires atelier",
      "category": "MIN",
      "duration": "LT",
      "source": "AI",
      "score": 1,
      "matched_from": [
        "ai_new"
      ]
    }
  ],
  "raw_excerpt": "ðŸ—• Date : 2024-09-25\nðŸ‘¤ From : MYM MANDABA SCI <mymmandaba@gmail.com>\nðŸ“¨ To   : Yannick Mandaba <y.mandaba@gmail.com>\nðŸ§• Subject : Re: Pas de faux\n---\nIl y a 4 ans, je t'ai dit que je veux payer le CFE pour toi, sous rÃ©serve\nde montrer un salaire, une fois pour toutes,\nPour l'assurance makadie\nPour l'assurance retraite.\nTu n'as pas donnÃ© suite.\nCela peut se faire Ã  titre retro-actif. Donne-moi ton dernier bilan\ncomptable pour lequel j'ai payÃ© une expert comptable. Je n'ai jamais reÃ§u\nce document.\n\nLe mar. 24 sept. 2024, 07:35, Yannick Mandaba  a\nÃ©crit :\n\n> Je ne vais pas faire des fiches de salaire qui correspondent Ã  des\n> salaires que je n'ai jamais touchÃ© donc je sais pas de quoi tu as besoin\n> pour m'assurer mais il faut que Ã§a passe par autre chose que de la\n> fabrication de faux documents.\n>"
}