{
  "year": 2024,
  "seq": 98,
  "meta": {
    "date": "2024-11-27",
    "from": "MYM MANDABA SCI <mymmandaba@gmail.com>",
    "to": "Marc Mandaba <marcmandaba@gmail.com>",
    "subject": "Re: Documents Ã  examiner"
  },
  "proposals": [],
  "raw_excerpt": "ðŸ—• Date : 2024-11-27\nðŸ‘¤ From : MYM MANDABA SCI <mymmandaba@gmail.com>\nðŸ“¨ To   : Marc Mandaba <marcmandaba@gmail.com>\nðŸ§• Subject : Re: Documents Ã  examiner\n---\nIl ne s'agit pas de la gestion du Groupe MÃ©dical LaÃ«nnec...\nIl s'agit de savoir jusqu'Ã  quel point vous soutenez le Dr YanguÃ©.\nYannick l'a fÃ©licitÃ© pour nous escroquer un peu plus.\nToi, tu m'as dit de me laisser avoir des rapports personnels avec lui.\nVous ne voyez pas le conflit d'intÃ©rÃªts.???\n\nDonc, vous me laissez gÃ©rer Ã  ma faÃ§on. Je prends acte.\n\nMaryvonne MANDABA\n\nLe mer. 27 nov. 2024, 12:15, Marc Mandaba  a Ã©crit :\n\n> Bonjour\n> Pour la Ã©niÃ¨me fois, je ne suis pas impliquÃ© dans la gestion du cabinet.\n> J'ai dÃ©jÃ  prÃ©venu que j'allais bloquer le compte email si je continue Ã \n> recevoir ces spams.\n>\n>\n> Sent from Outlook for Android \n>\n> ------------------------------\n> *From:* MYM MANDABA SCI \n> *Sent:* Wednesday, November 27, 2024 12:10:43 PM\n> *To:* Yannick Mandaba ; Yannick MANDABA  ymanda@gmail.com>; marcmandaba \n> *Subject:* Documents Ã  examiner\n>\n> Bonjour,\n> Yannick et Marc.\n> Voulant connaÃ®tre l'Ã©tat rÃ©el des arriÃ©rÃ©s de Dr YanguÃ© aprÃ¨s du service\n> des EAUX, je lui ai demandÃ© un Ã©tat de sa situation, et un justificatif de\n> rÃ©gularisation.\n> Voici ce qu'il m'a envoyÃ©.\n> Je lui ai demandÃ© une photographie plus lisible des documents, oÃ¹ l'on\n> pourrait lire l'intitulÃ© du compte, et le numÃ©ro du compte, et le numÃ©ro du\n> compteur.\n> Il m'a promis un scan.\n> J'attends toujours.\n> (une bonne photo suffirait !)\n>\n> Si la facture remonte Ã  1996, date oÃ¹ le WC coulait en permanence...le\n> montant doit Ãªtre bien supÃ©rieur Ã  cela. Je crains le pire. La location,\n> avec tous les frais que j'ai engagÃ©s, doit repartir sur des bases saines.\n>\n> Merci de me donner votre avis.\n> MM\n>\n>"
}