{
  "year": 2024,
  "seq": 122,
  "meta": {
    "date": "2024-03-30",
    "from": "maryvonne masseron-mandaba <maryvonnemm@hotmail.com>",
    "to": "\"trs.mandaba@gmail.com\" <trs.mandaba@gmail.com>",
    "subject": "ARTE"
  },
  "proposals": [],
  "raw_excerpt": "ðŸ—• Date : 2024-03-30\nðŸ‘¤ From : maryvonne masseron-mandaba <maryvonnemm@hotmail.com>\nðŸ“¨ To   : \"trs.mandaba@gmail.com\" <trs.mandaba@gmail.com>\nðŸ§• Subject : ARTE\n---\nbonjour, Tristan et Yannick,\nmon mobile est en rparation,\npouvez-vous essayer de lire cette belle mission du \"dessous des cartes\" ?\net me donner la rponse. Merci.\n\nhttps://www.arte.tv/fr/videos/114573-003-A/le-dessous-des-cartes/\n[https://www.bing.com/th?id=OVP.N1kL0T3yw3VWFl3nkOHBLQEsCo&pid=Api]\nLe dessous des cartes - Dsinformation : une guerre du XXIe sicle\nLa guerre en Ukraine se joue sur le champ de bataille, sur le plan conomique mais galement dans le domaine de linformation. \"Le dessous des cartes\" vous invite cette semaine  comprendre les ressorts de cette nouvelle guerre de la dsinformation.\nwww.arte.tv"
}