{
  "year": 2024,
  "seq": 67,
  "meta": {
    "date": "2024-09-22",
    "from": "MYM MANDABA SCI <mymmandaba@gmail.com>",
    "to": "Yannick Mandaba <y.mandaba@gmail.com>",
    "subject": "Re: Tristan te regarde, Marc te regarde, nous te regardons tous et tout est partagÃ©."
  },
  "proposals": [
    {
      "index": -67,
      "etiquette": "Dossier de bourse Tristan",
      "category": "MIN",
      "duration": "LT",
      "source": "AI",
      "score": 1,
      "matched_from": [
        "ai_new"
      ]
    }
  ],
  "raw_excerpt": "ðŸ—• Date : 2024-09-22\nðŸ‘¤ From : MYM MANDABA SCI <mymmandaba@gmail.com>\nðŸ“¨ To   : Yannick Mandaba <y.mandaba@gmail.com>\nðŸ§• Subject : Re: Tristan te regarde, Marc te regarde, nous te regardons tous et tout est partagÃ©.\n---\nEstcequetuasetetoucherton RIA : 330 euros\n\nLe ven. 20 sept. 2024, 06:59, Yannick Mandaba  a\nÃ©crit :\n\n> D'aprÃ¨s nos accords la suspension de l'accord de location Ã©tait\n> conditionnÃ©.\n> J j'avais prÃ©venu que si je te laisser me payer au lieu que ce soit marquÃ©\n> le fasse tu n'allais pas remplir ta partie du contrat et tu as les utiliser\n> un chantage avec Tristan ce que tu viens de faire.\n>\n> Merci beaucoup, donc finalement nous allons tout simplement appliquer les\n> accords dÃ©jÃ  fait un conseil de famille avant la construction de la maison\n> de Marc.\n>\n> Il y a des Ã©changes Ã©crits tu as donnÃ© ta parole marque alors c'est sa\n> maison et maintenant tu changes d'avis mais en fait on va quand mÃªme faire\n> comme c'Ã©tait prÃ©vu parce que les dÃ©penses ont Ã©tÃ© faites les dispositions\n> ont Ã©tÃ© prises et tu vas devoir maintenant subir l'accomplissement de la\n> partie du contrat oÃ¹ tu avais donnÃ© ta parole et tu vas devoir tenir parole\n> ce dont tu n'as pas l'habitude mais lÃ  on va te le faire faire.\n>\n> Continue Ã  brandir tes chantages avec Tristan tu ne fais que empirer parce\n> que je t'ai dit que je vais tout rendre public et je te c'est dans ton\n> intÃ©rÃªt de lire tout ce que j'ai mis sur WhatsApp je te prÃ©viens quand tu\n> fais comme tu veux.\n>\n> la comptabilitÃ© m'a contactÃ© Ã  l'ambassade pour demander l'annÃ©e 2023 en\n> complÃ©ment de l'annÃ©e 2024 et ce en rÃ©ponse Ã  mon email dans lequel je leur\n> disais ma situation et le jeu pervers auquel tu te livres Ã§a a l'air de les\n> avoir convaincu du coup ils me donnent plus de temps.\n>\n> Parce que quand je leur ai donnÃ© mon dossier, il manquait des choses que\n> j'ai fait parvenir le lundi d'aprÃ¨s et donc j'Ã©tais obligÃ© de faire un\n> email parce qu'ils sont pas obligÃ© de l'accepter.\n>\n> Et dans cet email comme j'Ã©tais au bout du rouleau je leur ai dit que je\n> m'en foutais complÃ¨tement qui me donne la bourse ou pas et je leur ai fait\n> une longue explication de tout Ã§a et comme quoi tu me pousses dans la\n> prÃ©caritÃ© pendant que tu entasse de l'argent et que les soldes donc que tu\n> nous fais c'est quand tu fais Ã©chapper Ã  l'ISF Ã§a n'a rien Ã  voir avec nous\n> et je leur ai dit voilÃ  j'ai un patrimoine mais ma mÃ¨re a bien fait en\n> sorte que je ne puisse rien toucher sans passer par elle parce que ce qui\n> l'intÃ©resse c'est le contrÃ´le parce qu'elle est malade dans sa tÃªte et donc\n> s'ils veulent pas me donner la bourre je m'en fous je garde mon fils chez\n> moi je leur ai tout dit\n>"
}