{
  "year": 2024,
  "seq": 84,
  "meta": {
    "date": "2024-10-17",
    "from": "MYM MANDABA SCI <mymmandaba@gmail.com>",
    "to": "Marc Mandaba <marcmandaba@gmail.com>",
    "subject": "Re: FW: doc april"
  },
  "proposals": [
    {
      "index": -84,
      "etiquette": "Dossier de bourse Tristan",
      "category": "MIN",
      "duration": "LT",
      "source": "AI",
      "score": 1,
      "matched_from": [
        "ai_new"
      ]
    },
    {
      "index": -84,
      "etiquette": "Appartement PergolÃ¨se (vente/location)",
      "category": "MIN",
      "duration": "LT",
      "source": "AI",
      "score": 1,
      "matched_from": [
        "ai_new"
      ]
    },
    {
      "index": -84,
      "etiquette": "Appartement PergolÃ¨se (vente/location)",
      "category": "MIN",
      "duration": "LT",
      "source": "AI",
      "score": 1,
      "matched_from": [
        "ai_new"
      ]
    },
    {
      "index": -84,
      "etiquette": "Frais bus Tristan",
      "category": "MIN",
      "duration": "LT",
      "source": "AI",
      "score": 1,
      "matched_from": [
        "ai_new"
      ]
    }
  ],
  "raw_excerpt": "ðŸ—• Date : 2024-10-17\nðŸ‘¤ From : MYM MANDABA SCI <mymmandaba@gmail.com>\nðŸ“¨ To   : Marc Mandaba <marcmandaba@gmail.com>\nðŸ§• Subject : Re: FW: doc april\n---\nJ'ai payÃ© l'assurance LUMA a chaque fois que tu m'as envoyÃ© le montant,\navec le RIB...\nAu dÃ©but de cette annÃ©e je t'ai dit que je voulais payer la CFE, tu m'as\nrÃ©pondu que j'ai tous les documents pour le faire.\nJe gÃ¨re dÃ©jÃ  ta banque, mais c'est difficile, car tu demandes les codes et\ntu ne les utilises pas pour avoir tes relevÃ©s mensuels. Moi je dois veiller\nÃ  faire la copie d'Ã©cran au 31 dÃ©cembre et au 30 juin, pour te l'envoyer\n(dossier de bourse).\nQuand le dossier de bourse est correct tu as 72% d'aide. Quand tu oublies,\ntu as 0% d'aide, et je paye la totalitÃ© de la scolaritÃ©, cantine,\ntransport.\nJe dois t'assister Ã  la dÃ©claration d'impÃ´ts, sinon elle n'est pas faite.\n\nTes gesticulations sont dÃ©placÃ©es, au regard de ta capacitÃ© de gestion.\n\nJe te propose 1000euros par mois, et 500euros pour Tristan.\nSans conditions.\nSachant que si tu m'amputes de quelque revenu que ce soit, je devrai encore\nassumer cela.\n\nJe vous rappelle, en outre, que quand je prenais le crÃ©dit pour Pergolese,\nje remboursais le crÃ©dit de l'Edhec, aidais Marc, te finanÃ§ais, et donc\nÃ©tais obligÃ©e de demander une diminution de mes cotisations de retraite, je\npayais 2 mois sur 3, ce qui me pÃ©nalisÃ© aujourd'hui, car la retraite est\ncalculÃ©e sur les derniÃ¨res annÃ©es d'exercice.\nMaitre Alix me l'a reprochÃ©, mais aussi a prÃ©vu de sanctuariser cette\nacquisition, au regard des efforts que j'ai faits.\n\nJe vais en parler Ã  BenoÃ®t Gicquel.\n\nLa rÃ©novation est terminÃ©e. 1000 euros chacun seront distribuÃ©s\nincessamment. Et si Marc est d'accord, nous pouvons demander Ã  Fidal qui\ngÃ¨re la dÃ©claration, si nous pouvons te laisser l'usufruit, pour quelques\nannÃ©es, 6000euros par an.\n\nJe regrette que des documents sensibles circulent dans cette boÃ®te, alors\nque WhatsApp est codÃ©.\n\nLe jeu. 17 oct. 2024, 19:37, MYM MANDABA SCI  a\nÃ©crit :\n\n> Je demandais les statuts de MANJA THAI\n> Les documents MYM, je les ai, mais pas encore fait le dernier changement\n> d'adresse de Marc, domiciliÃ© au Maroc\n>\n> Le jeu. 17 oct. 2024, 09:26, Marc Mandaba  a\n> Ã©crit :\n>\n>> Bonjour\n>>\n>> J'ai cherchÃ© dans mes dossiers Ã©lectroniques, mais je n'ai pas les\n>> statuts de PergolÃ¨se. A l'Ã©poque je ne scannais pas encore systÃ©matiquement\n>> tous mes documents. Et je ne me souviens pas avoir recu un exemplaire\n>> papier.\n>>\n>> Cependant j'ai fait une recherche sur le site officiel Infogreffe, et les\n>> statuts de crÃ©ation ainsi que la modification suite Ã  donation partage sont\n>> disponibles.\n>>\n>> Ci-joint les versions reÃ§ues enregistrÃ©es aux greffes.\n>>\n>> Merci\n>> Marc\n>>\n>> Sent from Outlook for Android \n>> ------------------------------\n>> *From:* Yannick Mandaba \n>> *Sent:* Thursday, October 17, 2024 7:10:36 AM\n>> *To:* MYM MANDABA SCI ; Marc Mandaba > marcmandaba@gmail.com>\n>> *Subject:* Re: FW: doc april\n>>\n>> Et nous notion encore une fois l'absence totale de bonne foi. Ici une\n>> rÃ©ponse Ã  une partie complÃ¨tement secondaire du message. Ne faisant nulle\n>> mention du sujet principal : Les statuts de MYM\n>>\n>> A noter dans la relation (la mauvaise foi d'un des actionnaires) entre\n>> les actionnaires et le comportement Ã©vasif de la personne en charge et qui\n>> justifie mon retrait.\n>>\n>>\n>> On Wed, Oct 16, 2024 at 4:32â€¯PM MYM MANDABA SCI \n>> wrote:\n>>\n>> Oui, je t'ai demandÃ© de remplir, et pour CFE, et pour April, et\n>> comparer...\n>> J'ai bien payÃ© LUMA. A chaque fois que tu m'as envoyÃ© la facture.\n>> Je suis encore plus inquiÃ¨te que toi, de vous savoir sans assurance\n>> santÃ©.\n>>\n>> Le mer. 16 oct. 2024, 05:36, Yannick Mandaba  a\n>> Ã©crit :\n>>\n>> Je cherchais les status de MYM et je  tombe sur Ã§a.... O si je commence Ã \n>> creuser... Non on est au delÃ  des mots. Et elle a l'indÃ©cence de continuer\n>> Ã  batailler avec moi encore aujourd'hui voyez l'email ci-dessous...\n>> PS : Je voudrais voir les status de MYM svp merci.\n>>\n>> ---------- Forwarded message"
}