{
  "year": 2024,
  "seq": 32,
  "meta": {
    "date": "2024-04-08",
    "from": "MYM MANDABA SCI <mymmandaba@gmail.com>",
    "to": "Yannick Mandaba <y.mandaba@gmail.com>, marcmandaba <marcmandaba@gmail.com>",
    "subject": "vacances de Tristan"
  },
  "proposals": [],
  "raw_excerpt": "ğŸ—• Date : 2024-04-08\nğŸ‘¤ From : MYM MANDABA SCI <mymmandaba@gmail.com>\nğŸ“¨ To   : Yannick Mandaba <y.mandaba@gmail.com>, marcmandaba <marcmandaba@gmail.com>\nğŸ§• Subject : vacances de Tristan\n---\nbonjour,\n\nj'avais promis Ã  Tristan des vacances d'Avril au NEPAL.\n\n*Ses dates de vacances sont du 13 au 21 avril.*\n\nInitialement, j'avais rÃ©servÃ© pour lui, un vol BKK Ã  Katmandu, du 21 au 28,\nje faisais Paris -BKK, puis avec lui BKK Ã  KAT, puis retour avec lui Ã  BKK,\net retour vers Paris. J'ai annulÃ© ce voyage, en l'absence d'accord formel\nde Bee,et en avais averti Yannick, qui n'a pas lu le message..\n\nFinalement, Bee Ã©tant d'accord pour que Yannick accompagne Tristan, ils\npourraient aller tous les deux de BKK Ã  Katmandu. Et selon les dates\nretenues, je les retrouverai. A la limite mÃªme, Tristan peut Ãªtre confiÃ© Ã \nune hÃ´tesse, s'il le veut bien. La Compagnie  THAI fait ce voyage en 3h30.\nMais je trouve que ce serait une belle Ã©vasion pour Yannick.\n\nLes dates que je souhaite = 16 au 26 avril\n+/- 2 jours\nEst-ce possible que Marc paye les 2 billets, Tristan et Yannick avec la\ncagnotte de Bangui ?\nPouvez-vous vous entendre pour cela ?\nje m'occuperai de mon billet et de l'hÃ©bergement et des activitÃ©s.\n\nBonne journÃ©e\nM\nPS, je dois mettre en route un nouveau smartphone dans la semaine\nOn peut me joindre par Zoom, ou Meet, ou WHATSAPP sur mon numÃ©ro de Bangui\n236 72 30 32 07 ( rÃ©activÃ© jusqu'au 1 juillet)\n\nMerci pour Tristan"
}