{
  "year": 2024,
  "seq": 41,
  "meta": {
    "date": "2024-05-19",
    "from": "MYM MANDABA SCI <mymmandaba@gmail.com>",
    "to": "Yannick Mandaba <y.mandaba@gmail.com>, marcmandaba <marcmandaba@gmail.com>,",
    "subject": "Les vacances, les anniversaires, les f√™tes religieuses"
  },
  "proposals": [
    {
      "index": -41,
      "etiquette": "Dossier de bourse Tristan",
      "category": "MIN",
      "duration": "LT",
      "source": "AI",
      "score": 1,
      "matched_from": [
        "ai_new"
      ]
    },
    {
      "index": -41,
      "etiquette": "Appartement Pergol√®se (vente/location)",
      "category": "MIN",
      "duration": "LT",
      "source": "AI",
      "score": 1,
      "matched_from": [
        "ai_new"
      ]
    },
    {
      "index": -41,
      "etiquette": "Frais d'√©cole / bus Tristan",
      "category": "MIN",
      "duration": "LT",
      "source": "AI",
      "score": 1,
      "matched_from": [
        "ai_new"
      ]
    }
  ],
  "raw_excerpt": "üóï Date : 2024-05-19\nüë§ From : MYM MANDABA SCI <mymmandaba@gmail.com>\nüì® To   : Yannick Mandaba <y.mandaba@gmail.com>, marcmandaba <marcmandaba@gmail.com>, \n\tMasseron <maryvonne.masseron@free.fr>\nüßï Subject : Les vacances, les anniversaires, les f√™tes religieuses\n---\nVacances scolaires 2024-2025. Le calendrier zone par zone, le petit\navantage de la zone B\nhttp://france3-regions.francetvinfo.fr/pays-de-la-loire/loire-atlantique/nantes/vacances-scolaires-2024-2025-le-calendrier-zone-par-zone-le-petit-avantage-de-la-zone-b-2967605.html\n\nBonjour,\n\nJe suis contente d'avoir partag√©, avec Yannick et Tristan, un tr√®s beau\ns√©jour au N√©pal.\n\nNotre guide, Chintan, avait propos√© √† Yannick un partenariat commercial...\nYannick devait lui peaufiner son site, Chintan proposait d'aller √† Bangkok,\npour partager la vente d'artisanat n√©palais.\nQu'en est-il ?\n\nTristan passe trop de temps sur les r√©seaux sociaux, et avec des jeux\nvid√©os, avec des vrais copains de l'√©cole, et d'autres qu'on ne conna√Æt pas.\nAussi je propose de recevoir Tristan aux vacances d'√©t√© pour\n. Aller √† l'√Æle de R√©, voir Carine, Joshua, Dani√®le, et la famille,\n. Passer, comme l'an dernier, un moment en tour de Bretagne, voir C√©line,\nNicou, Laurence, R√©mi...\n. Visiter 3 ch√¢teaux de la Loire\n. Faire un passage au nord de l'Italie, Turin, Milan, Venise, Florence,\nRome.\nBien s√ªr que L√©a et Maxime seraient invit√©s √† participer √† ce p√©riple,\nsans, ou avec l'un, l'autre, ou les 2 parents.\n\nMerci de propositions de dates.\n\nIl se peut que cela n'ait pas lieu, mais je croyais que cette ann√©e serait\nla Premi√®re Communion de Maxime.\n\nPour l'anniversaire de L√©a, j'ai d√©j√† propos√© deux fois, d'offrir un repas\nde famille, dans un restaurant, vers Levallois-Perret. Comme c'est peu\navant le Bepc, j'assouplis la proposition, soit le 14 juin au soir, soit le\n15 midi ou soir, soit le 16 midi ou soir. Je sais qu'il y a aussi la f√™te\ndes p√®res... Merci d'une r√©ponse.\n\nJe vous ai d√©j√† envoy√© le document Fidal pour les revenus fonciers\nPergolese.\nJe vais vous envoyer une copie d'√©cran d'Excel en 3 pages pour que vous\nsuiviez la vie de MYM-MANDABA.\nMa panique informatique continue, puisque, au N√©pal, nous n'avons pas\nexamin√© le probl√®me.\nCette ann√©e, en raison de la r√©fection cuisine et salle d'eau, et entr√©e,\nnous n'avons aucun b√©n√©fice.\nMais, comme les travaux ont √©t√© g√©r√©s, √† l'√©conomie, par Charbel, d√®s √†\npr√©sent je peux distribuer des dividendes, qui permettront surtout √†\nYannick, de provisionner la banque pour l'imp√¥t sur les revenus fonciers.\n\nCe seront donc 600 euros chacun qui seront vers√©s, en 1ere tranche des\ndividendes pour 2024.\n\nMerci √† Yannick de me proposer des dates\n. Pour le dossier de demande de bourse 2024-2025\n. Pour le dossier des imp√¥ts, urgent +++\n. Pour le calendrier des vacances de Tristan, √©t√© 2024\n et No√´l 2024/ ou f√©vrier 2025.\n\nNB je pr√©vois aussi un p√®lerinage de Compostelle, d√©part du Puy en Velay,\nsur 4 ans √† 5 ans, 10 √† 15 jours par an, et convie toute la famille √†\nm'accompagner.\n\nBon week-end de Pentec√¥te\nM"
}