{
  "year": 2024,
  "seq": 48,
  "meta": {
    "date": "2024-07-03",
    "from": "MYM MANDABA SCI <mymmandaba@gmail.com>",
    "to": "marcmandaba@hotmail.com",
    "subject": "Re: Plomberie Toa Ziki"
  },
  "proposals": [],
  "raw_excerpt": "ðŸ—• Date : 2024-07-03\nðŸ‘¤ From : MYM MANDABA SCI <mymmandaba@gmail.com>\nðŸ“¨ To   : marcmandaba@hotmail.com\nðŸ§• Subject : Re: Plomberie Toa Ziki\n---\nParfait, merci !\n\nLe mer. 3 juil. 2024, 09:41, Marc MANDABA  a\nÃ©crit :\n\n> Bonjour,\n> Fuite dans le mur de la cuisine. Les tuyaux galvanisÃ©s sont corrodÃ©s.\n> Je les avais remplacÃ© par du PPR dans les salles de bain mais pas dans la\n> cuisine car je ne l'ai pas encore refaite entiÃ¨rement\n>  J'ai dÃ©jÃ  changÃ© le faux plafond, l'Ã©lectricitÃ© et les placards sous la\n> paillasse.\n>  Je vais donc changer la plomberie, et les carreaux de la paillasse dans\n> la foulÃ©e. Autant le faire avec la plomberie. Je vais remettre un deuxiÃ¨me\n> robinet avec le nouveau filtre.\n> Et aprÃ¨s fini.\n>\n> Bonne journÃ©e\n>\n> Sent from Outlook for Android \n>"
}