{
  "year": 2024,
  "seq": 50,
  "meta": {
    "date": "2024-07-31",
    "from": "MYM MANDABA SCI <mymmandaba@gmail.com>",
    "to": "marcmandaba@gmail.com",
    "subject": "Re: Tristan"
  },
  "proposals": [],
  "raw_excerpt": "ðŸ—• Date : 2024-07-31\nðŸ‘¤ From : MYM MANDABA SCI <mymmandaba@gmail.com>\nðŸ“¨ To   : marcmandaba@gmail.com\nðŸ§• Subject : Re: Tristan\n---\nMerci, Marc.\n\nMais Tristan trouve que, encore aller seul en avion, c'est trop. Et 2 jours\nde voyage pour 2 jours avec ses cousins, ce n'est \"pas juste\"...\n\nPour ma part, le but n'est pas qu'il revienne Ã  Rennes, mais que, pendant\nson sÃ©jour avec ses cousins, j'avance ma voiture vers le lac Leman, et\nqu'il me retrouve, entre Lyon et GenÃ¨ve.\n\nJ'avais pensÃ©, nous allons au futuroscope de Poitiers, en voiture (300km)\nQuand tu veux le prendre, il y a des trains direct en 1h, de Poitiers Ã \nBordeaux St Jean ( limite je peux le faire avec lui en train et retourner Ã \nPoitiers). J'avance la voiture vers Lyon Grenoble Annecy ChambÃ©ry, GenÃ¨ve,\noÃ¹ c'est possible, et je vais le prendre en train lÃ  oÃ¹ Marc veut. MÃªme Ã \nCahors... Il y a de belles 4 voies maintenant, et des trains pas cher en\nsenior et enfant.\n\nNous prÃ©fÃ©rons avoir notre vÃ©hicule sur place, pour faire des sauts de puce\nen Suisse, et au Mont blanc mer de glace....\n\nMerci du retour\n\nLe mar. 30 juil. 2024, 15:01,  a Ã©crit :\n\n> Bonjour,\n>\n>\n>\n> Je pense que le plus indiquÃ© serait un sejour de Tristan du 5 au 8 aout.\n>\n> Ainsi Tristan et maman partirons pour le stage le 9 aout comme prÃ©vu. Au\n> besoin, on peut rallonger de 1 jour pour un retour le 9 aout.\n>\n>\n>\n> La meilleure option aprÃ¨s moultes comparaison est lâ€™avion,\n> Rennes-Bordeaux-renes par Air France. Lâ€™accompagnement UMest gratuit\n> (ci-dessous lâ€™extrait du rÃ¨glement). Par ailleurs, je dois aller Ã  Bordeaux\n> pour faire un point sur la maison dâ€™hÃ´tes, je vais synchroniser et\n> rÃ©cupÃ©rer Tristan Ã  lâ€™aÃ©roport.\n>\n>\n>\n> Merci de votre retour\n>\n> Marc\n>\n>\n>\n>\n>\n> *de 4 Ã  11 ans inclus*\n>\n> *Sur les vols en France mÃ©tropolitaine**, les enfants de 4 Ã  11 ans\n> inclus voyageant seuls doivent obligatoirement Ãªtre enregistrÃ©s en tant que\n> mineur non accompagnÃ© (UM - Unaccompanied Minor). Ils sont pris en charge\n> par le personnel Air France et bÃ©nÃ©ficient de Kids Solo. **Ce service est\n> inclus dans le prix du billet**. *\n>\n>\n>\n>\n>\n> Sent from Outlook for Android \n> ------------------------------\n>\n> *From:* MYM MANDABA SCI \n> *Sent:* Thursday, July 25, 2024 3:53:01 PM\n> *To:* marcmandaba \n> *Subject:* Tristan\n>\n>\n>\n> Bonjour Ã  tous,\n>\n> J'espÃ¨re que vos vacances sont reposantes.\n>\n> Tristan et moi sommes Ã  l'Ã®le de RÃ©. Les dates ont changÃ© Ã  cause de la\n> venue du papa de Joshua.\n>\n> Nous rentrons en Bretagne demain, sur 2 jours, Ã  cause de la chaleur.\n>\n> Le contrÃ´le technique est le 31.\n>\n> Le stage est le 12. Mais nous partirons avant, vers le 9.\n>\n> Le vol est le 20 ( train Rennes-Roissy rÃ©servÃ©.\n>\n> Bises\n>"
}