{
  "year": 2013,
  "seq": 49,
  "meta": {
    "date": "2013-08-08",
    "from": "maryvonne masseron-mandaba <maryvonnemm@hotmail.com>",
    "to": "\"y.mandaba@gmail.com\" <y.mandaba@gmail.com>",
    "subject": "bien reÃ§u video bb"
  },
  "proposals": [],
  "raw_excerpt": "ðŸ—• Date : 2013-08-08\nðŸ‘¤ From : maryvonne masseron-mandaba <maryvonnemm@hotmail.com>\nðŸ“¨ To   : \"y.mandaba@gmail.com\" <y.mandaba@gmail.com>\nðŸ§• Subject : bien reÃ§u video bb\n---\nmerci de vos messages,bien documents...flicitations !\nje ne les vois que ce matin, descendue  Rennes pour virement...\nVir les 1650 e prsents  ce moment, de socit gnrale YM ( banque de Rennes)  Mandja thai,  BKK, Mais comme ce sont des stagiaires pendant les vacances, cela risque de prendre du temps; je vois qu'ils ne comprennent pas !.Prvoir aussi qq 50 euros sur ton compte socit pour les frais.Me tenir au courant +++\nje vais donc virer cet aprs-midi , Loudeac, par fax  ma banque de Vitr, au compte perso de YM  Bkk, banque ayudhya....la somme de 1800 e ( c'est tout ce que j'ai car MAA est en vacances, et ne me paiera qu'aprs le 15 aout ).L c'est sr...par contre on a dj dpass ce qui tait prvu pour l'anne.\nPar scurit samedi, je te mail la photocopie des ordres de virement.\n\nbisousmaman"
}