{
  "year": 2013,
  "seq": 26,
  "meta": {
    "date": "2013-03-29",
    "from": "maryvonne masseron-mandaba <maryvonnemm@hotmail.com>",
    "to": "Marc Mandaba <marcmandaba@hotmail.com>, \"y.mandaba@gmail.com\"",
    "subject": "RE: news"
  },
  "proposals": [
    {
      "index": -26,
      "etiquette": "Frais bus Tristan",
      "category": "MIN",
      "duration": "LT",
      "source": "AI",
      "score": 1,
      "matched_from": [
        "ai_new"
      ]
    }
  ],
  "raw_excerpt": "ðŸ—• Date : 2013-03-29\nðŸ‘¤ From : maryvonne masseron-mandaba <maryvonnemm@hotmail.com>\nðŸ“¨ To   : Marc Mandaba <marcmandaba@hotmail.com>, \"y.mandaba@gmail.com\"\n\t<y.mandaba@gmail.com>\nðŸ§• Subject : RE: news\n---\nbonsoir,moi aussi je veux bien voir les petits dimanche, trouver leurs oeufs de Pques....serai  la maison demain soir, et tout le dimanche, et le lundi.BONNES FETES DE PAQUES  vous tousmaman\n\nCC: maryvonnemm@hotmail.com\nFrom: marcmandaba@hotmail.com\nSubject: Re: news\nDate: Thu, 28 Mar 2013 08:36:45 +0200\nTo: y.mandaba@gmail.com\n\nOk. Je suis a Istanbul et rentre demain pour le WE de Paques.Marc\n\nMarcSent from my iPhone\nOn 28 mars 2013, at 07:52, \"Yannick Mandaba \\(personal business\\)\"  wrote:\n\nBonjour a tous les 5, Je suis dsol pour le silence.Les vacances de Songkran arrivent. Nous avons plein plein de boulot.Gautier se dbrouille  merveille , il fait les devis plus vite que moi de vrifier et envoyer aux clients.Ca fait du bien davoir quelquun dintelligeant avec moi. On fait des sous ce mois-ci.Par contre on ne ferme que 5 jours pour Songkran et pas de vacances dans les iles cette anne.Peut tre Pattaya chez mon ami Geoffroy Patra mais cest tout. Jessae de voir les petits de Marc ce weekend sils sont dispos. Bisous  tous. Yannick Mandaba\nMobile : +66 8782 00 622Skype: yannick.mandaba"
}