{
  "year": 2013,
  "seq": 32,
  "meta": {
    "date": "2013-05-26",
    "from": "maryvonne masseron-mandaba <maryvonnemm@hotmail.com>",
    "to": "\"y.mandaba@gmail.com\" <y.mandaba@gmail.com>",
    "subject": "130526 (suite)"
  },
  "proposals": [],
  "raw_excerpt": "ðŸ—• Date : 2013-05-26\nðŸ‘¤ From : maryvonne masseron-mandaba <maryvonnemm@hotmail.com>\nðŸ“¨ To   : \"y.mandaba@gmail.com\" <y.mandaba@gmail.com>\nðŸ§• Subject : 130526 (suite)\n---\nj'ai oubli de rappeler , le plus important, c'est que je dsirais vous aider sur le plan immobilier, en thailande, et c'est pour cela que je suis passe la dernire fois, et que j'ai tenu  rencontrer la soeur de Bee; mais que AUCUNE PROPOSITION CONCRETE n'a jamais t faite, en terme de terrain, de plan dfinitif, de financement, de dpot d'argent chez un notaire ou avocat ... et cela m'a du, et j'en ai t trs choque...car, quand je parle ou promets quelquechose, je m'y tiens...comme quoi Bee ne m'aurait pas crue; ou bien, comme quoi elle prendrait, mais serait incapable d'offrir ...\nmaman"
}