{
  "year": 2013,
  "seq": 52,
  "meta": {
    "date": "2013-08-16",
    "from": "maryvonne masseron-mandaba <maryvonnemm@hotmail.com>",
    "to": "\"y.mandaba@gmail.com\" <y.mandaba@gmail.com>",
    "subject": "RE: virement sociÃ©tÃ© gÃ©nÃ©rale de rennesman"
  },
  "proposals": [],
  "raw_excerpt": "ðŸ—• Date : 2013-08-16\nðŸ‘¤ From : maryvonne masseron-mandaba <maryvonnemm@hotmail.com>\nðŸ“¨ To   : \"y.mandaba@gmail.com\" <y.mandaba@gmail.com>\nðŸ§• Subject : RE: virement sociÃ©tÃ© gÃ©nÃ©rale de rennesman\n---\nce qui me manque,et leur manque , c'est un mot de toi, et ton adresse;quand je suis alle j'tais trs en retard pour partir  Loudeac,et n'ai pas laiss mon n de portable;\nle 15 aout, tout est ferm; jour fri;envoie un fax, manuscrit, la socit gnrale, rue d'isly  rennes, agence du colombier,avec tes coordonnes: personnelles ( adresse)et de socit ( mme adresse)et redis que tu confirmes l'ordre de virementet la somme 1650 euros,et dis-leur que j'ai ta procuration, avec tl : 0680078113\n\nFrom: y.mandaba@gmail.com\nTo: maryvonnemm@hotmail.com\nSubject: RE: virement socit gnrale de rennesman\nDate: Thu, 15 Aug 2013 11:03:47 +0700\n\n\n\n\n\n\n\n\n\n\n\n\n\n\nBonour Maman,\n\n \n\nJe narrive pas  joindre la banque. Telephone occup,\nrepondeur, transfer au centre dappel qui na pas accs  mon\ncompte.fax occup\n\nJe reconfirme les coordonnes bancaires de la socit :\n\n \n\nNom du compte:              MANJA THAI CO., LTD.\n\n N de compte :                 118-5-11335-2\n\nBank (Branche):                Bangkok Bank PCL, Head Office\n\nBank Address:                   333, Silom Road, Bangkok 10500,\nThailand\n\nSWIFT Code (BIC):           BKKBTHBK\n\n \n\nJe joins un fax  imprimer et leur faxer de ma part.\n\nJE ressaye...\n\n \n\nTon autre transfert est pass, merci beaucoup..\n\n \n\n \n\n\n\nYannick Mandaba\n\n\n\nTel: +66 2635 0858\n\nFax: +66 2635 0859\n\nMobile: +66 8782 00 622\n\n\n\n \n\n\n\n\n\nFrom: maryvonne\nmasseron-mandaba [mailto:maryvonnemm@hotmail.com] \n\nSent: Wednesday, August 14, 2013 7:00 PM\n\nTo: y.mandaba@gmail.com\n\nSubject: virement socit gnrale de rennesman\n\n\n\n\n\n \n\n\n\nils n'ont\npas fait le virement de 1650 euro,\n\n\n\nde ta\nsogn de rue d'isly  Rennes,\n\n\n\n\n\n \n\n\n\n\n\nenvoie un fax\npour la confirmer\n\n\n\n\n\n \n\n\n\n\n\nde ton\ncompte courant\n\n\n\n\n\n mandja\nthai\n\n\n\n\n\n \n\n\n\n\n\nsoit les\ncoordonnes taient inexacte\n\n\n\n\n\n \n\n\n\n\n\nsoit ils ne\nsavaient pas faire\n\n\n\n\n\n \n\n\n\n\n\nje\ntravaille\n\n\n\n\n\npas le\ntemps\n\n\n\n\n\nm"
}