{
  "year": 2013,
  "seq": 75,
  "meta": {
    "date": "2013-12-29",
    "from": "maryvonne masseron-mandaba <maryvonnemm@hotmail.com>",
    "to": "\"y.mandaba@gmail.com\" <y.mandaba@gmail.com>, Marc Mandaba",
    "subject": "FW: pierre a partagÃ© un album avec vous."
  },
  "proposals": [],
  "raw_excerpt": "ðŸ—• Date : 2013-12-29\nðŸ‘¤ From : maryvonne masseron-mandaba <maryvonnemm@hotmail.com>\nðŸ“¨ To   : \"y.mandaba@gmail.com\" <y.mandaba@gmail.com>, Marc Mandaba\n\t<marcmandaba@hotmail.com>\nðŸ§• Subject : FW: pierre a partagÃ© un album avec vous. \n---\nDate: Sun, 29 Dec 2013 21:11:30 +0000\nSubject: pierre a partag un album avec vous.\nFrom: iemanja2@yahoo.com\nTo: maryvonnemm@hotmail.com\n\n\n\n\n\n\nVous tes invit  voir l'album photo de pierre intitul : 2013-Nol Vitr_2\n\n\n\n\n\n\n\n\n\n2013-Nol Vitr_2\n24 dc. 2013\n\nde pierre\n\n\n\nAfficher l'album\n\n\nVoir le diaporama\n\n\n\n\n\n\n\n\nMessage de pierre :\nNoel 2013 Merci a tous !\n\n\nSi cet e-mail ne saffiche pas correctement, copiez-collez le lien suivant dans votre navigateur :\n\nhttps://picasaweb.google.com/lh/sredir?uname=tranchevent&target=ALBUM&id=5962923543873499761&authkey=Gv1sRgCNfVx_649O2RFw&invite=CKaT3qsH&feat=email\n\nPour partager vos photos ou recevoir une notification lorsque vos amis partagent des photos, crez un compte Picasa Albums Web gratuit."
}