{
  "year": 2013,
  "seq": 9,
  "meta": {
    "date": "2013-12-16",
    "from": "maryvonne.masseron@free.fr",
    "to": "Yannick Mandaba <y.mandaba@gmail.com>",
    "subject": "ReÂ : Re: Re : Re: J.L. junior / merci pour les photos"
  },
  "proposals": [],
  "raw_excerpt": "ğŸ—• Date : 2013-12-16\nğŸ‘¤ From : maryvonne.masseron@free.fr\nğŸ“¨ To   : Yannick Mandaba <y.mandaba@gmail.com>\nğŸ§• Subject : ReÂ : Re: Re : Re: J.L. junior / merci pour les photos\n---\ntout cela est trÃ¨s \"africain\", on fait ce genre de maquillages au bÃ©bÃ©, pour Ã©viter les conjonctivites et le strabisme....\npour cela c'est \"foutu\", il y en a chez nous ( les mandaba ont un faux strabisme, car les yeux sont trÃ¨s Ã©cartÃ©s , comme Marc bÃ©bÃ© et LÃ©a bÃ©bÃ©, et chez Bee ( sa soeur et ses cousines ), mais pas le mÃªme genre... un petit charme. \nJe te scanne des photos ce week-end, sans faute\nbises,\net bon camping !\nmaman\n\n\nmaryvone masseron - 41 rue du puits-mauger  35000  rennes  0299302000  0680078113\n\n----- Mail d'origine -----\nDe: Yannick Mandaba \nÃ€: Y Mum \nEnvoyÃ©: Mon, 16 Dec 2013 18:08:05 +0100 (CET)\nObjet: Re: Re : Re: J.L. junior / merci pour les photos\n\nLe maquillage c'est un genre de violette dont la sÃ¨ve est sensÃ©e faire de beaux sourcils selon la tradition that.Bee de son cÃ´tÃ© Ã  des sÃ©ances de sauna avec bassine et tente dans le salon. Et des herbes sur le ventre avec application avec une brique chaude Ã  travers une serviette sensÃ© remettre en place so uterus...prescrit par le hÃ´pital... bref on est dans le folklore mais c'est marrant.Bisous.Yannick Mandaba\n\ntel : +66 878200622\n\nskype : Yannick.mandabaOn 16 Dec 2013 20:55,  wrote:\nexact !\nmerci pour les photos !\nhier je voulais vous parler, je t'ai vu connectÃ©,\nmais j'Ã©tais sur le canapÃ©, trop fatiguÃ©e mÃªme pour m'asseoir !\nLe maquillage c'est pour quelle fÃªte ?\nbisous\nmaman\n\nmaryvonne masseron - 41 rue du puits-mauger  35000  rennes  0299302000  0680078113\n\n----- Mail d'origine -----\n\nDe: Yannick Mandaba \nÃ€: Y Mum \nEnvoyÃ©: Mon, 16 Dec 2013 13:56:01 +0100 (CET)\n\nObjet: Re: J.L. junior\n\nSur la premiÃ¨re il ressemble Ã  papaYannick Mandaba\n\ntel : +66 878200622\n\nskype : Yannick.mandaba"
}