{
  "year": 2013,
  "seq": 27,
  "meta": {
    "date": "2013-04-05",
    "from": "maryvonne masseron-mandaba <maryvonnemm@hotmail.com>",
    "to": "\"charbel.braidy@hotmail.fr\" <charbel.braidy@hotmail.fr>",
    "subject": "dÃ©gat des eaux pergolÃ¨se"
  },
  "proposals": [],
  "raw_excerpt": "ðŸ—• Date : 2013-04-05\nðŸ‘¤ From : maryvonne masseron-mandaba <maryvonnemm@hotmail.com>\nðŸ“¨ To   : \"charbel.braidy@hotmail.fr\" <charbel.braidy@hotmail.fr>\nðŸ§• Subject : dÃ©gat des eaux pergolÃ¨se\n---\nbonjour Monsieur,\nje vous confirme ma prsence  l'expertise, ce lundi 8 avril  12h00.\nN'oubliez pas de me prvenir en cas de changement de l'horaire, je ne serai pas loin :  une confrence mdicale, au Palais des Congrs, Porte Maillot.\nVeuillez me rappeler le code, pour ouvrir la porte d'entre en bas.\nAssurez-vous de la prsence du technicien qui effectuera la rparation, plombier et/ou carreleur.\nMon assurance (axa), m'a confirm que vous avez fait la bonne dmarche, c'est au locataire de faire la dclaration du sinistre. Aprs l'expertise, les assurances dtermineront le montant rel du prjudice subi par mme Sanchez, pas forcment les 2000 euros demands. De la mme faon, vous n'aurez pas obligatoirement de franchise  payer, si la somme de est infrieure.\nPour ma part, je dois m'occuper de la rparation, et verserai des arrhes au technicien rparateur, afin qu'il effectue cette rparation au plus tt.\nA lundi, do,c, et merci.\nmaryvonne mandaba"
}