{
  "year": 2013,
  "seq": 81,
  "meta": {
    "date": "2013-01-26",
    "from": "maryvonne masseron-mandaba <maryvonnemm@hotmail.com>",
    "to": "\"y.mandaba@gmail.com\" <y.mandaba@gmail.com>",
    "subject": "RE: dimanche 130113"
  },
  "proposals": [
    {
      "index": -81,
      "etiquette": "Dossier de bourse Tristan",
      "category": "MIN",
      "duration": "LT",
      "source": "AI",
      "score": 1,
      "matched_from": [
        "ai_new"
      ]
    },
    {
      "index": -81,
      "etiquette": "Paiement salaires atelier",
      "category": "MIN",
      "duration": "LT",
      "source": "AI",
      "score": 1,
      "matched_from": [
        "ai_new"
      ]
    },
    {
      "index": -81,
      "etiquette": "ImpÃ´ts / fiscalitÃ©",
      "category": "MIN",
      "duration": "LT",
      "source": "AI",
      "score": 1,
      "matched_from": [
        "ai_new"
      ]
    }
  ],
  "raw_excerpt": "ðŸ—• Date : 2013-01-26\nðŸ‘¤ From : maryvonne masseron-mandaba <maryvonnemm@hotmail.com>\nðŸ“¨ To   : \"y.mandaba@gmail.com\" <y.mandaba@gmail.com>\nðŸ§• Subject : RE: dimanche 130113\n---\nJe viens de ta banque=tu dois faire une demande de \"leve de saisie\" sur ton comte , adresse  ta Socit Gnrale, qui transmettra aux impts; c'est--dire:- tu vas sur ton compte Soc Gn- tu vas dans messages- tu choisis ta conseillre- tu cris ton messageou bien, si tu as le nom BENSLIMA je crois de ta conseillre , tu lui envoies un mail ( urgent+++)\n>Ils vont rpercuter ta demande au TRESOR PUBLIC,  l'agent du fisc qui a fait la demande de saisie de ton compte et celui de Marc et toi.\nc'est horrible +++\nje ne vais mme pas rcuprer le trop vers , tant que tu ne fais pas cette dmarche, la feras -tu ?????\nj'en ai trop marre - ce temps perdu - cet argent perdu - par ngligence de ta part - et connerie d'une personne qui gaspille l'argent qu'elle n'a pas gagn.j'espre que tu as compris que l'on ne fait pas de projet d'enfant avec une personne qui n'est capable d'aucun sacrifice!!!\net c'est la honte, cette saisie sur compte ++++pour moi , et pour Marc, et salissure de notre nom.\n\nFrom: maryvonnemm@hotmail.com\nTo: y.mandaba@gmail.com\nSubject: RE: dimanche 130113\nDate: Thu, 24 Jan 2013 23:36:03 +0000\n\n\n\n\n1------- les impots =\n- chaque anne tu dois faire une dclaration pour dclarer tes impots en ligne = tu vas sur le site des impots.gouv.fr ( tu retrouves la boite e-mail avec laquelle tu as dclar la 1ere fois), tu l'as fait une fois, aprs nous avions RV sur skype pour les annes suivantes, et tu ratais les RV; aussi tu as pris l'habitude de me faxer au travail  Loudeac la fameuse dclaration, que je controlais, et compltais; cette anne nous l'avons faite ensemble  bkk- chaque anne, tu dois faire un courrier pour obtenir un dgrvement, cad expliquer que l'argent que tu reois est, d'une part des revenus de la SCI pergo ( aussitot reverss pour le remboursement de l'emprunt) et, d'autre part la pension alimentaire que je te verse (il n'y a pas de honte  cela, mais tu dois dclarer parce que je dclare aux impots cette pension); - chaque anne, tu dois payer les impots, la somme  payer est accessible pour toi sur ton site des impots; moi je les paye \"  l'aveuglette, car je sais que tu ne paies pas; et ce qui devait arriver, est arriv, pour paiement insuffisant+++ = le service des impots a saisi tout ce que tu possdes = vid ton compte, et le compte de Marc et toi, indivision pour la SCI de clerville...en attendant de mettre en vente notre appartement de la rue pergolse...aux enchres...ce qui ne me plait pas, ni  Marc!!!\ntu ne veux pas t'y intresser,tu t'en fous,pas nous,\ntu dois t'engager.......  ne pas tricher comme  bkk, c'est une mauvaise habitude, qui ne marche pas ici,-  dclarer des revenus sur 2012, ds que je te donne les chiffres,-  faire un courrier pour le dgrvement, chaque anne,-  payer si tu peux, sinon je veux bien payer, mais tu dois me donner les chiffres exacts.\nJE VIENS DE FAIRE LA DEMANDE DE DEGREVEMENT SUR 2010 et 2011,courrier du fisc franais que je t'avais amen  bkk, que tu as refus de lire....dont je t'avais dict le texte, et envoy en fichier WAV (effort inutile),....en 2 jours, j'ai eu la rponse ( favorable ), diminution de tes impots des 3/4....\n2----l'argent\nDE l'ARGENT VA REVENIR sur ton compte, en france, pour les 1950 euros que je viens de de verser aux impots, pour qu'ils cessent la chasse  tes biens ( merci de ne pas y toucher, que je les rcupre pour payer ma voiture...toujours au garage);DE l'argent va arriver de mamie (800 euros), mais je ne les mets pas encore, car ils vont les saisir, j'attends le OK de ta banque, pour voir s'ils ont arrt les poursuite  ton encontre; tu peux leur tlphoner, cela m'arrangerait;DE l'ARGENT a t vir comme promis , par moi-mme sur ton compte pargne  bkk= beaucoup = 4000 euros ( tu les as dj reus hier, et pas un merci ; est-ce que Bee vide ton compte  bkkk avant que tu le saches ???)....\n\n3----ma nouvelle voiture\nj'attends de pouv"
}