{
  "year": 2013,
  "seq": 54,
  "meta": {
    "date": "2013-08-16",
    "from": "maryvonne masseron-mandaba <maryvonnemm@hotmail.com>",
    "to": "\"y.mandaba@gmail.com\" <y.mandaba@gmail.com>",
    "subject": "RE: Piece jointe : PDF a imprimer et leur faxer."
  },
  "proposals": [],
  "raw_excerpt": "ðŸ—• Date : 2013-08-16\nðŸ‘¤ From : maryvonne masseron-mandaba <maryvonnemm@hotmail.com>\nðŸ“¨ To   : \"y.mandaba@gmail.com\" <y.mandaba@gmail.com>\nðŸ§• Subject : RE: Piece jointe : PDF a imprimer et leur faxer.\n---\nNONIL Y AVAIT ASSEZ SUR LE COMPTE POUR LE VIREMENT DE 1650\nJ AI DEPOSE UN AUTRE CHEQUECAR IL NE RESTAIT RIEN\nILS N ONT PAS FAIT LEUR BOULOT\n\nFrom: y.mandaba@gmail.com\nTo: maryvonnemm@hotmail.com\nSubject: RE: Piece jointe : PDF a imprimer et leur faxer.\nDate: Fri, 16 Aug 2013 20:47:21 +0700\n\n\n\n\n\n\n\n\n\n\n\n\n\n\n\n\n\n\nBonsoir,\n\n \n\nNe tinquiete pas, le virement est pass mais il y a 10 jours dattente\naprs le depot du cheque.\n\nBisous. Jappelle des que possible. En attendant fait u gros\nbisous  amie et  tout le monde pour moi.\n\n \n\n \n\n\n\nYannick Mandaba\n\n\n\nTel: +66 2635 0858\n\nFax: +66 2635 0859\n\nMobile: +66 8782 00 622\n\n\n\n \n\n\n\n\n\nFrom: maryvonne\nmasseron-mandaba\n[mailto:maryvonnemm@hotmail.com] \n\nSent: Friday, August 16, 2013 1:55 PM\n\nTo: y.mandaba@gmail.com\n\nSubject: RE: Piece jointe : PDF a imprimer et leur faxer.\n\n\n\n\n\n \n\n\n\nyannick,\n\n\n\nce Pdf est\ntrs bien\n\n\n\nc'est ce\nque tu aurais d faire en premier,\n\n\n\n\n\nmaintenant\nje suis au Pouliguen,\n\n\n\n\n\nje ne peux\nrien faire aujourd'hui\n\n\n\n\n\n \n\n\n\n\n\nESSAYE DE\nFAXER A NOUVEAU\n\n\n\n\n\n \n\n\n\n\n\naujourd'hui\nn'est pas fri\n\n\n\n\n\n \n\n\n\n\n\net\nsi tu peux tu leur laisses mon tl portable 0680078113\n\n\n\n\n\n\n\n\n\nFrom:\ny.mandaba@gmail.com\n\nTo: maryvonnemm@hotmail.com\n\nSubject: Piece jointe : PDF a imprimer et leur faxer.\n\nDate: Thu, 15 Aug 2013 12:09:54 +0700\n\n\n\nJe vais essayer de faxer a encore aujourdhui.\n\nSi tu peux essayer de ton ct, merci\n\nHier standard satur toute l aprs midi\n\n \n\nBisous\n\n \n\n\n\nYannick Mandaba\n\n\n\nTel: +66 2635 0858\n\nFax: +66 2635 0859\n\nMobile: +66 8782 00 622\n\n\n\n \n\n\n\n\n\nFrom: Yannick Mandaba\n(Personnal) [mailto:y.mandaba@gmail.com] \n\nSent: Thursday, August 15, 2013 11:04 AM\n\nTo: 'maryvonne masseron-mandaba'\n\nSubject: RE: virement socit gnrale de rennesman\n\n\n\n\n\n \n\nBonour Maman,\n\n \n\nJe narrive pas  joindre la banque. Telephone occup,\nrepondeur, transfer au centre dappel qui na pas accs  mon compte.fax\noccup\n\nJe reconfirme les coordonnes bancaires de la socit :\n\n \n\nNom du\ncompte:             \nMANJA THAI CO., LTD.\n\n N de compte :\n               \n118-5-11335-2\n\nBank (Branche):               \nBangkok Bank PCL, Head Office\n\nBank Address:  \n               \n333, Silom Road, Bangkok 10500, Thailand\n\nSWIFT Code\n(BIC):           BKKBTHBK\n\n \n\nJe joins un fax  imprimer et leur faxer de ma part.\n\nJE ressaye...\n\n \n\nTon autre transfert est pass, merci beaucoup..\n\n \n\n \n\n\n\nYannick Mandaba\n\n\n\nTel: +66 2635 0858\n\nFax: +66 2635 0859\n\nMobile: +66 8782 00 622\n\n\n\n \n\n\n\n\n\nFrom: maryvonne\nmasseron-mandaba [mailto:maryvonnemm@hotmail.com] \n\nSent: Wednesday, August 14, 2013 7:00 PM\n\nTo: y.mandaba@gmail.com\n\nSubject: virement socit gnrale de rennesman\n\n\n\n\n\n \n\n\n\nils n'ont\npas fait le virement de 1650 euro,\n\n\n\nde ta\nsogn de rue d'isly  Rennes,\n\n\n\n\n\n \n\n\n\n\n\nenvoie un\nfax pour la confirmer\n\n\n\n\n\n \n\n\n\n\n\nde ton\ncompte courant\n\n\n\n\n\n mandja\nthai\n\n\n\n\n\n \n\n\n\n\n\nsoit les\ncoordonnes taient inexacte\n\n\n\n\n\n \n\n\n\n\n\nsoit ils ne\nsavaient pas faire\n\n\n\n\n\n \n\n\n\n\n\nje\ntravaille\n\n\n\n\n\npas le\ntemps\n\n\n\n\n\nm"
}