{
  "year": 2013,
  "seq": 71,
  "meta": {
    "date": "2013-12-07",
    "from": "maryvonne masseron-mandaba <maryvonnemm@hotmail.com>",
    "to": "\"y.mandaba@gmail.com\" <y.mandaba@gmail.com>",
    "subject": "RE: Demande de renseignement"
  },
  "proposals": [],
  "raw_excerpt": "ðŸ—• Date : 2013-12-07\nðŸ‘¤ From : maryvonne masseron-mandaba <maryvonnemm@hotmail.com>\nðŸ“¨ To   : \"y.mandaba@gmail.com\" <y.mandaba@gmail.com>\nðŸ§• Subject : RE: Demande de renseignement\n---\nLe fils de ce monsieur, Jaffre Ren, est ton ami, de l'cole, et voisin de Cergy;de ta chambre, tu voyais leur balcon, 4 eme tage  droite (nous tions au 1er);\nils taient deux petits frres rouquins, ton ami tait l'ain;tu aimais beaucoup aller chez eux;un jour je te cherchais partout, tu tais assis devant leur porte, sans avoir os sonner !\nj'ai revu la maman, qui avait un magasin prs du centre culturel de Cergy,avec Marc, un jour que j'allais revoir mes collgues de l'hopital de Pontoise;elle tait sur le point d'ouvrir une boutique  Auray (bretagne);\nLe monsieur qui t'a mis le message est de papa,ingnieur en informatique, je crois...\nIl faut lui rpondre , et prvoir un RV en bretagne en juin !\nvous tiez trs proches\nmaman\n\nDate: Sat, 7 Dec 2013 00:00:31 +0700\nSubject: Fwd: Demande de renseignement\nFrom: y.mandaba@gmail.com\nTo: maryvonnemm@hotmail.com\n\n---------- Forwarded message ----------\nFrom: \"Ren Jaffre\" \nDate: 6 Dec 2013 15:19\nSubject: Demande de renseignement\n\nTo:  \nCc: \n\nBonjour,\nNe seriez-vous pas, par hasard, Yannick Mandaba, fils de Jean-Luc et Maryvonne Mandaba?\nN'auriez-vous pas t  la maternelle  l'cole des Chteaux St Sylvre,  CERGY PONTOISE de 1977  1979?\nMeilleures salutations.\nRen JAFFRE"
}