{
  "year": 2013,
  "seq": 61,
  "meta": {
    "date": "2013-10-24",
    "from": "maryvonne masseron-mandaba <maryvonnemm@hotmail.com>",
    "to": "\"y.mandaba@gmail.com\" <y.mandaba@gmail.com>",
    "subject": "RE: voyage Ã  Bangkok"
  },
  "proposals": [],
  "raw_excerpt": "ðŸ—• Date : 2013-10-24\nðŸ‘¤ From : maryvonne masseron-mandaba <maryvonnemm@hotmail.com>\nðŸ“¨ To   : \"y.mandaba@gmail.com\" <y.mandaba@gmail.com>\nðŸ§• Subject : RE: voyage Ã  Bangkok \n---\nje ne sais pas si tu es d'accord ?pour que je vienne ce lundi ? pour 7 jours ?je suis dans une boutique orange, pour ma cl 3G,la connection est mauvaise. Rponse s'il te plait.maman\n\nFrom: maryvonnemm@hotmail.com\nTo: y.mandaba@gmail.com\nSubject: RE: voyage  Bangkok \nDate: Thu, 24 Oct 2013 08:44:59 +0000\n\n\n\n\nje ne sais pas si mon message est pass...tu n'es pas contant ?\n\nFrom: maryvonnemm@hotmail.com\nTo: y.mandaba@gmail.com\nSubject: RE: voyage  Bangkok \nDate: Thu, 24 Oct 2013 08:35:15 +0000\n\n\n\n\nnon je voudrais venir l, ce dimanche, pour organiser, apporter des choses, dire ce qui est utile, ou non...et revenir aprs !j'ai des prix intressants  cette priode-ci = exemple Qatar airways 576 euros, pour venir maintenant, 28oct-4novembre.Je suis en congs, car j'aurais d tre  Bangui. Comme TJ et MAMIE sont +/- bien, je profite pour venir vous voir...c'est nul ?aprs je verrai comment m'organiser pour mon travail !!!Bisous, j'ai hte de vous voir.maman\n\nFrom: y.mandaba@gmail.com\nTo: maryvonnemm@hotmail.com\nSubject: RE: voyage  Bangkok\nDate: Thu, 24 Oct 2013 15:13:11 +0700\n\n\n\n\n\n\n\n\n\n\n\n\n\n\nTu veux dire 28 Novembre au 4 Decembre.\n\nTu ne peux pas rester plus que a ?\n\n \n\nTu timpose chez ceux qui ne veulent pas de toi et l tu\nes la bien venue tu ne veux pas rester plus de 6 jour.\n\n2 jours de voyage pour rester si peu\n\nTu ne verras probablement pas le bb donc mais peut etre que si.\n\nNous saurons samedi la date de la naissance.\n\n \n\nFais comme tu veux.\n\n \n\n \n\n\n\nYannick Mandaba\n\n\n\nTel: +66 2635 0858\n\nFax: +66 2635 0859\n\nMobile: +66 8782 00 622\n\n\n\n \n\n\n\n\n\nFrom: maryvonne\nmasseron-mandaba [mailto:maryvonnemm@hotmail.com] \n\nSent: Thursday, October 24, 2013 3:00 PM\n\nTo: y.mandaba@gmail.com\n\nSubject: voyage  Bangkok\n\n\n\n\n\n \n\n\n\nbonjour\nYannick,\n\n\n\n \n\n\n\nje viendrai\n Bangkok avant la naissance,\n\n\n\n\n\nprobablement\npour une semaine ,\n\n\n\n\n\ndu lundi 28\noctobre, au lundi 4 novembre,\n\n\n\n\n\nsi vous en\ntes d'accord.\n\n\n\n\n\n \n\n\n\n\n\nAinsi,\nj'amnerai tout ce que j'ai achet, et amen d'Istanbul,\n\n\n\n\n\net nous\nferons le point sur ce qui est utile d'avoir en plus.\n\n\n\n\n\n \n\n\n\n\n\nbisous\n\n\n\n\n\nmaman"
}