{
  "year": 2013,
  "seq": 70,
  "meta": {
    "date": "2013-11-27",
    "from": "maryvonne masseron-mandaba <maryvonnemm@hotmail.com>",
    "to": "\"y.mandaba@gmail.com\" <y.mandaba@gmail.com>",
    "subject": "RE: bonjour ! pas de nouvelles de Tristan !"
  },
  "proposals": [],
  "raw_excerpt": "ðŸ—• Date : 2013-11-27\nðŸ‘¤ From : maryvonne masseron-mandaba <maryvonnemm@hotmail.com>\nðŸ“¨ To   : \"y.mandaba@gmail.com\" <y.mandaba@gmail.com>\nðŸ§• Subject : RE: bonjour ! pas de nouvelles de Tristan !\n---\nmerci des nouvelles,dans la malette du tire-lait, il y avait une \"prothse de bout de sein\" en silicone,  appliquer sur le bout de sein , pour le rduire; je te l'ai dit plusieurs fois.... strilisez-le , et utilisez-le pour le sein droit.je vais ouvrir une nouvelle adresse gmail  mon nom , diffrente de celle de la sci, pour partager des photos en \"dropbox\".bonne journemaman\n\nDate: Wed, 27 Nov 2013 12:54:21 +0700\nSubject: Re: bonjour ! pas de nouvelles de Tristan !\nFrom: y.mandaba@gmail.com\nTo: maryvonnemm@hotmail.com\n\nBonjour maman.\nTristan va bien. \n\nLe cordon se dcolle . \n\nIl est remont  2835 g.\n\nIl tete mieux car le docteur  montr  Bee comment faire. En effet ct droit le mamelon est trop gros alors Tristan pince sa lvre infrieure et ne prend rien.\nIl prend des supplments de 60 ml voire 80 ml avec la dozette. a march trs bien mais il prend le l air donc faire roter trs souvent et continuer.\nHier la grand mre a pass l aprs midi ici. On a reu la famille.\nDesol mon travail est trs en retard. Pas trop de temps. a ira mieux dans 10 jours.\nBisous.\n\n\nYannick Mandaba\n\ntel : +66 878200622\n\nskype : Yannick.mandaba\nOn 27 Nov 2013 01:37, \"maryvonne masseron-mandaba\"  wrote:\n\n\n\n\nbonjour,je pensais que vous m'enverriez des nouvelles du petit, aprs la consultation de la pdiatre.Quel est son poids ?J'espre que tout va bien pour vous 3.\nM."
}