{
  "year": 2013,
  "seq": 48,
  "meta": {
    "date": "2013-07-28",
    "from": "maryvonne masseron-mandaba <maryvonnemm@hotmail.com>",
    "to": "\"y.mandaba@gmail.com\" <y.mandaba@gmail.com>",
    "subject": "28 juillet 2013"
  },
  "proposals": [
    {
      "index": -48,
      "etiquette": "ImpÃ´ts / fiscalitÃ©",
      "category": "MIN",
      "duration": "LT",
      "source": "AI",
      "score": 1,
      "matched_from": [
        "ai_new"
      ]
    }
  ],
  "raw_excerpt": "ðŸ—• Date : 2013-07-28\nðŸ‘¤ From : maryvonne masseron-mandaba <maryvonnemm@hotmail.com>\nðŸ“¨ To   : \"y.mandaba@gmail.com\" <y.mandaba@gmail.com>\nðŸ§• Subject : 28 juillet 2013\n---\nyannick,quand tu contactes free, prviens-moi,car c'est la ligne de la maison,il y a beaucoup de renseignements sur moi chez free, et cela m'inquite.... jusqu' ce que tu me dises que c'est toi.\nmerci de vos nouvelles.\nJ'ai achet beaucoup de \"bodies\", 3 mois, 6 mois, 9 mois, 12 mois, et des tenues \"mixtes\".Ccile a aussi donn des choses de naissance, de La ou Maxime,comme deux turbulettes,et autres, pour que je les amne. Quand j'aurai du temps, je ferai des photos de tout cela.\nJe suis trs fatigue, car je suis seule au cabinet de Loudac, depuis le 10 juillet, et jusqu'au 14 aout... d'habitude, je supporte mieux cette surcharge de travail. Ds les consultations finies, je dors, sans mme manger.\nDs que j'y vois plus clair pour les factures de Pergolse, je ferai le ncssaire pour te donner le trop-peru des impots. En attendant ce ne serait pas prudent, car il y a eu des frais imprvus.\nje vous embrassemaman"
}