{
  "year": 2013,
  "seq": 2,
  "meta": {
    "date": "2013-10-02",
    "from": "maryvonne.masseron@free.fr",
    "to": "\"Yannick Mandaba (Personnal)\" <y.mandaba@gmail.com>",
    "subject": "ReÂ : Bee un peu malade"
  },
  "proposals": [],
  "raw_excerpt": "ğŸ—• Date : 2013-10-02\nğŸ‘¤ From : maryvonne.masseron@free.fr\nğŸ“¨ To   : \"Yannick Mandaba (Personnal)\" <y.mandaba@gmail.com>\nğŸ§• Subject : ReÂ : Bee un peu malade\n---\nen France on utilise paracetamol contre la fievre et les douleurs , chez la f enceinte  et les bb;\npas d'antiviraux chez la f enceinte;\ndes antibiotiques sont utiles pour empÃªcher la listeriose ( amoxicilline Ã  trÃ¨s bonne dose) qui est une bactÃ©rie mais donne un syndrome viral chez la f enceinte; aller voir le spÃ©cialiste gynÃ©co, mais pas le mÃ©decin du coin; c'est urgent;\nm\n \n\n\nmaryvonne masseron - 41 rue du puits-mauger  35000  rennes  0299302000  0680078113\n\n----- Mail d'origine -----\nDe: Yannick Mandaba (Personnal) \nÃ€: maryvonne masseron \nEnvoyÃ©: Wed, 02 Oct 2013 19:47:10 +0200 (CEST)\nObjet: Bee un peu malade\n\nSi Bee a de la fievre est-ce que Acetaminophen est conseillÃ©?Doit-on se faire du soucis avec cette grippe?Demain elle va chez le medecin pour la visite mensuelle (enfin\ndepuis le mois dernier c'est tous les 15 jours).S'il prescit un anti-viral je te donnerai le nom juste pour\nconfirmer que c'est ok.\n\nPour le moment :\n\n- pas de mal de gorge\n\n- Voix un peu cassÃ©e\n\n- Toux juste une journÃ©e, glaires normales\n\n- Pas de fievre Ã  priori\n\n- le nez un peu encombrÃ©  Bon on verra demain chez le medecin.Bisous Yannick Mandaba\nTel: +66 2635 0858\n\nFax: +66 2635 0859\n\nMobile: +66 8782 00 622 From:\nmaryvonne.masseron@free.fr [mailto:maryvonne.masseron@free.fr] \nSent: Wednesday, October 02, 2013 3:13 PM\nTo: Yannick Mandaba; marcmandaba@hotmail.com\nSubject: TR : Touche pas Ã  nos fÃªtes chrÃ©tiennes! A mÃ©diter !!!\n\nn'oubliez-pas de m'appeler le dimanche...\n\nne serait-ce qu'au tÃ©lÃ©phone...\n\nmaman\n\n\nmaryvonne masseron mandaba - 41 rue du puits-mauger  35000 \nrennes  0299302000  0680078113"
}