{
  "year": 2013,
  "seq": 84,
  "meta": {
    "date": "2013-01-28",
    "from": "\"Yannick Mandaba \\(personal business\\)\" <y.mandaba@gmail.com>",
    "to": "<sip.nonresidents@dgfip.finances.gouv.fr>",
    "subject": "LevÃ©e de saisie sur compte aprÃ¨s avis Ã  tiers dÃ©tenteur. Ref# 105 887 527 5493"
  },
  "proposals": [
    {
      "index": -84,
      "etiquette": "Paiement salaires atelier",
      "category": "MIN",
      "duration": "LT",
      "source": "AI",
      "score": 1,
      "matched_from": [
        "ai_new"
      ]
    }
  ],
  "raw_excerpt": "ðŸ—• Date : 2013-01-28\nðŸ‘¤ From : \"Yannick Mandaba \\(personal business\\)\" <y.mandaba@gmail.com>\nðŸ“¨ To   : <sip.nonresidents@dgfip.finances.gouv.fr>\nðŸ§• Subject : LevÃ©e de saisie sur compte aprÃ¨s avis Ã  tiers dÃ©tenteur. Ref# 105 887 527 5493\n---\nMr Yannick Mandaba\nMonday, January 28, 2013\n\n50/31 Pan Road, \n\nSilom, Bangrak,\n\nBangkok 10500, Thailand\n\nTel: +66 2635 0858\n\nFax: +66 2635 0859\nMobile : +66 878200622\n\n\n\n\n\nATTN :  Mr Thi Julian, inspecteur des impts, au SIP NON RESIDENTS\n\n\n\nRfrence du dossier: 105 887 527 5493\n\n\nObjet : Leve de saisie sur compte aprs avis  tiers dtenteur.\n\n \n\n\nBonjour Monsieur,\n\n \n\nJe vous demande par ce courrier de bien vouloir faire annuler lavis  tiers\ndtenteur ainsi que de bien vouloir ordonner la leve dune saisie bancaire\neffectues  sur 2 comptes (mon compte personnel  01713-00050105599 et le\ncompte joint avec mon frre Marc Mandaba 01713-000500039756),  lagence\nSocit Gnrale de Rennes, 14 rue d'Isly, 35000 RENNES.\n\n \n\nMa mre Maryvonne Mandaba-Masseron a envoy au trsor public  Centre des\nImpts de Rennes Sud ,  un chque du montant des sommes dues.\n\n\nPS : Je ne rside pas en France - par consquent il ne peut tre saisi ni\nmon salaire, ni mes prestations sociales.\n\n \n\nEn vous demandant de bien vouloir accuser bonne rception de ce courrier,\n\nTrs cordialement,\n\n \n\nMr Yannick Mandaba"
}