{
  "year": 2013,
  "seq": 43,
  "meta": {
    "date": "2013-07-19",
    "from": "maryvonne masseron-mandaba <maryvonnemm@hotmail.com>",
    "to": "syndic pergolese <ceca-immobilier@noos.fr>",
    "subject": "RE:"
  },
  "proposals": [],
  "raw_excerpt": "ðŸ—• Date : 2013-07-19\nðŸ‘¤ From : maryvonne masseron-mandaba <maryvonnemm@hotmail.com>\nðŸ“¨ To   : syndic pergolese <ceca-immobilier@noos.fr>\nðŸ§• Subject : RE:\n---\nau Directoire de C.E.C.A.Monsieur Drouault, Monsieur Gorin, Madame Toubi,veuillez prendre connaissance du courrier reu de votre secrtariat,en date du 16juillet2013, sans objet, sans signature.\nFrom: secretariat@ceca-immobilier.fr\nTo: maryvonnemm@hotmail.com\nSubject: \nDate: Tue, 16 Jul 2013 16:31:54 +0200\n\nChre Madame, En rponse  vos diffrents courriers recommands et appels tlphonique concernant le changement de tuyau de plomb, Monsieur Sanchez, que nous avons contact par tlphone aujourdhui, ne veut pas vous laisser accs  son appartement.  En effet, Monsieur SANCHEZ, vient de terminer des travaux dembellissement de son appartement et ne souhaite pas tout  recasser  pour le changement de ce tuyau. De plus, il apparait que Monsieur SANCHEZ ne subit plus de fuite depuis que vous avez entrepris les travaux de rfection de votre salle de bain. La cause de la fuite chez Monsieur Sanchez nest donc pas li avec le tuyau de plomb. Cependant, si vous souhaitez faire changer ce tuyau de plomb (sans passer par lappartement de Monsieur Sanchez), la coproprit vous donne son accord de le faire  votre charge exclusive. De plus, Monsieur Sanchez ma indiqu que lorsquil a effectu le changement du tuyau de plomb dans son appartement, il vous avait proposer de le changer en mme temps chez vous mais vous lui avez refus laccs de votre studio. Cordialement,  CABINET C.E.C.Atel:01.53.70.50.50fax:01.53.70.50.60http://ceca-immobilier.fr  Un geste simple pour lenvironnement, nimprimez ce message que si vous en avez lutilit"
}