{
  "year": 2013,
  "seq": 55,
  "meta": {
    "date": "2013-09-09",
    "from": "maryvonne masseron-mandaba <maryvonnemm@hotmail.com>",
    "to": "\"y.mandaba@gmail.com\" <y.mandaba@gmail.com>",
    "subject": "santÃ© de Bee...rien de grave ! des efforts Ã  faire !"
  },
  "proposals": [],
  "raw_excerpt": "ðŸ—• Date : 2013-09-09\nðŸ‘¤ From : maryvonne masseron-mandaba <maryvonnemm@hotmail.com>\nðŸ“¨ To   : \"y.mandaba@gmail.com\" <y.mandaba@gmail.com>\nðŸ§• Subject : santÃ© de Bee...rien de grave ! des efforts Ã  faire !\n---\nbonjour,\nles examens de Bee sont dans les limites de la normale !elle doit prendre sur elle pour devenir adulte, et s'assumer.Sinon quelle mre hyper-anxieuse , et inefficace sera-t'elle !\nLes rgles dittiques que tu connais, elle doit les suivre ...si elle veut un rappel, je le ferai volontiers.\nL j'ai peu de temps:tante jeannette sort de l'hopital et ne peut plus rester seule chez elle ;sa soeur n'en veut pas bd des rochers !Maman est victime d'une employe indlicate, dont le copain devient notre maitre-chanteur !Je dois dbrouiller tout cela dans les 48 h qui viennent...\nCette nuit peut-tre je peux conseiller,mais seulement si Bee le souhaite rellement.\nmaman"
}