{
  "year": 2013,
  "seq": 41,
  "meta": {
    "date": "2013-06-20",
    "from": "maryvonne masseron-mandaba <maryvonnemm@hotmail.com>",
    "to": "Marc Mandaba <marcmandaba@gmail.com>, \"y.mandaba@gmail.com\"",
    "subject": "RE: THONGLO 17 FLOOR PLAN"
  },
  "proposals": [
    {
      "index": -41,
      "etiquette": "Dossier de bourse Tristan",
      "category": "MIN",
      "duration": "LT",
      "source": "AI",
      "score": 1,
      "matched_from": [
        "ai_new"
      ]
    },
    {
      "index": -41,
      "etiquette": "Appartement PergolÃ¨se (vente/location)",
      "category": "MIN",
      "duration": "LT",
      "source": "AI",
      "score": 1,
      "matched_from": [
        "ai_new"
      ]
    },
    {
      "index": -41,
      "etiquette": "Frais bus Tristan",
      "category": "MIN",
      "duration": "LT",
      "source": "AI",
      "score": 1,
      "matched_from": [
        "ai_new"
      ]
    }
  ],
  "raw_excerpt": "ðŸ—• Date : 2013-06-20\nðŸ‘¤ From : maryvonne masseron-mandaba <maryvonnemm@hotmail.com>\nðŸ“¨ To   : Marc Mandaba <marcmandaba@gmail.com>, \"y.mandaba@gmail.com\"\n\t<y.mandaba@gmail.com>\nðŸ§• Subject : RE: THONGLO 17 FLOOR PLAN\n---\nbonjour vous deux !je n'ai pas reu ce courrier de yannick;il savait que j'tais  Tunis, non ? puisque j'ai rpondu au sms de Bee le 17 juin  7h avec mon tl de Tunis !\nje reconnais l'ternel plan;il se situe sur lequel de tous les terrains et proprits que j'ai visit ?\nEst-ce que yannick peut tre propritaire de quelquechose en thailande ?\n- d'une partie d'un bien immobilier ?\n- pouvons-nous avoir avoir une traduction en anglais des textes qui rgissent la proprit foncire, et la proprit immobilire,- et des textes qui rgissent les socits civiles immobilires en Thailande, si cela existe; ou encore qui rgissent les coproprits foncires et immobilires; autrement dit combien de % un tranger peut avoir dans une coproprit;\nComment fonctionne la protection de la proprit dans les pays anglo-saxons, puisqu'il n'y a pas de notaires, comme dans le code napolon ? Les Etats sont garants ? les avocats rdigent les actes de proprit ? qui les conserve ?\nEst-ce que Bee peut porter  la connaissance d' un quelconque homme de loi, service notarial du consulat, ou notre notaire, la traduction du document attestant sa proprit  d'une partie ou de la totalit d'un terrain ? la dlimitation du terrain, le plan cadastral du quartier ?\nCe plan ne montre pas l'implantation de l'immeuble sur un terrain, ni l'accs, ni les garages.\nTout cela reste flou pour moi.A chaque fois que l'on parle de ce projet immobilier, je ne vois pas de progrs concret.Pour avancer, Il faut des documents de cadastre, un projet d'architecte, et des titres de proprit du terrain. Ensuite les textes de loi qui rgiront la coproprit/ ou la socit civile immobilire, avec le nom des personnes, et le pourcentage de leur participation, en apport de terrain, ou apport en argent.L'argent, vous le savez bien, sort de la sueur du front ou des mninges, ne tombe pas du ciel !\nPS, pour pergolse, nous avons un gros problme avec la mafia portugaise=\nen janvier : dgat des eaux , avec fuite  l'tage au dessous, mr Sanchez, qui veut mettre son 2 pices en location, mais ne peut en raison d'infiltrations ( mme pb que nous avons eu ).en fvrier:  expertise par l'assurance AXA , qui relve une infiltration minime, comme il peut en avoir dans de vieux immeubles;en mars, Charbel Braidy se fait convaincre de faire faire un devis par mr Marquez, recommand par mr dos santos le concierge,en avril je demande un autre devis car je trouve ce dernier curieux dans sa rdaction;en mai je vais  Paris et vois avec Charbel Braidy qu'il faut aussi faire refaire les vitrages, il n' a pas le temps de trouver une autre socit;Le 12 juin, je vais exprs  Paris pour voir l'entreprise de mr Marquez, avec le chquier de la SCI pour discuter du devis, et verser des arrhes;La socit n'existe pas  l'adresse porte sur le devis, il s'agit d'une petite pice qui sert  la domiciliation d'entreprises;De toute la journe je ne peux rencontrer mr Marquez,Dans la rue Nollet en question, rue de la socit de domiciliation d'entreprises, je trouve une socit de plomberie et carrelages rfection salles de bain etc...qui prsente bien, et je suis reue dans les 2 heures par l'artisan lui-mme;le devis est en cours;Presque chaque jour mr Sanchez me tlphone pour savoir si j'ai pris une dcision quant-au choix de la socit; Finalement, vu les changes trs professionnel avec la 2eme socit, j'opte pour celle-ci, et informe mr Marquez que je ne ferai pas affaire avec lui;le 18 juin M Sanchez le propritaire du dessous me tlphone en me menaant de prendre un avocat si les travaux ne sont pas faits de suite; je lui redis que cela ne va pas rsoudre tout son problme puisque nous mmes avons , depuis l'acquisition, un soucis d'humidit chronique, sur le mur de la cuisine; et que cette 2eme socit accepte de faire la recherche (payante), quand ils seront sur le chantier; et qu'il"
}