{
  "year": 2013,
  "seq": 7,
  "meta": {
    "date": "2013-12-04",
    "from": "maryvonne.masseron@free.fr",
    "to": "Yannick Mandaba <y.mandaba@gmail.com>",
    "subject": "ReÂ : Traitement incitation secretion lait maternel"
  },
  "proposals": [],
  "raw_excerpt": "ğŸ—• Date : 2013-12-04\nğŸ‘¤ From : maryvonne.masseron@free.fr\nğŸ“¨ To   : Yannick Mandaba <y.mandaba@gmail.com>\nğŸ§• Subject : ReÂ : Traitement incitation secretion lait maternel\n---\nbonjour,\n \nj'ai dÃ©jÃ  dit Ã  Bee que nous ne l'utilisons pas en France, dans cette indication.\n\nPour faire monter le lait, nous utilisons GALACTOGIL, en granulÃ©s : 3 grandes cuillÃ¨res chaque jour, jusqu'Ã  terminer une ou deux boites, avec 1 litre et demi d'eau , par, jour, en plus des repas.\n\nSi tu as des personnes qui viennent de France, elles peuvent l'apporter. Mais c'est un peu tard !, la lactation s'installant dans mes 10 premiers jours. Les acinis non fonctionnels, c'est-Ã -dire qui ne produisent plus de lait, ne sont pas capables de reprendre cette fonction, qu'Ã  un autre grossesse Quand je voyais Bee tÃ©lÃ©phoner ou taper Ã  l'ordinateur, avec Tristan au sein,  au lieu de s'enfermer dans un tÃªte-Ã -tÃªte avec son bÃ©bÃ©, je voyais le temps qui passait ! \n\nVous devriez lire les livres, au lieu de vous bloquer sur cette problÃ©matique, lui donner des complÃ©ments, et passer Ã  autre chose.\n\nA voir\nmaman\n \n \n\nmaryvone masseron - 41 rue du puits-mauger  35000  rennes  0299302000  0680078113\n\n----- Mail d'origine -----\nDe: Yannick Mandaba \nÃ€: maryvonne masseron \nEnvoyÃ©: Tue, 03 Dec 2013 19:27:04 +0100 (CET)\nObjet: Traitement incitation secretion lait maternel\n\nhttp://en.m.wikipedia.org/wiki/DomperidoneYannick Mandaba\n\ntel : +66 878200622\n\nskype : Yannick.mandaba"
}