{
  "year": 2013,
  "seq": 6,
  "meta": {
    "date": "2013-10-15",
    "from": "maryvonne.masseron@free.fr",
    "to": "\"Yannick Mandaba (Personnal)\" <y.mandaba@gmail.com>",
    "subject": "ReÂ : voyage"
  },
  "proposals": [],
  "raw_excerpt": "ğŸ—• Date : 2013-10-15\nğŸ‘¤ From : maryvonne.masseron@free.fr\nğŸ“¨ To   : \"Yannick Mandaba (Personnal)\" <y.mandaba@gmail.com>\nğŸ§• Subject : ReÂ : voyage\n---\nyannick,\nmerci de ton message,\n\n- je n'irai pas Ã  Bangui, pour l'instant, car tout le monde me le dÃ©conseille; la maison est bien sÃ©curisÃ©e, car il y a l'armÃ©e en bas de la colline; jef me dit que je peux rester Ã  la maison sans pb; mais il y a tout le reste  ! les avions comme tu le dis , quoique maintenant je voyage toujours avec royal air maroc !\n\n- je suis dans le train pour roissy et istanbul; j'y vais 5 jours; car le 19 octobre c'est l'anniversaire de Marc, et sauf en 2010, nous ne lui avons pas fÃªtÃ© ! donc, n'oublie pas le 19 +++un petit skype en famille !\n\n- aprÃ¨s je retourne Ã  Rennes, pour maman et TJ, qui vont Ã  peu prÃ¨s bien en ce moment, c'est pourquoi je peux m'absenter, et aussi parce que ce sont les vacances de LÃ©a et Max.\n\n- en France, ce ne sont pas encore les vacances de toussaints, ce sera la semaine prochaine et la suivante; \n\n- si je peux, j'irai Ã  bkk avant la naissance, amener des choses, et vous donner des conseils, comme j'ai fait pour CÃ©cile; cela lui a Ã©tÃ© trÃ¨s prÃ©cieux. Mais , si la cÃ©sarienne est programmÃ©e, c'est-Ã -dire Ã  peu prÃ¨s certaine, je peux mieux m'arranger par rapport Ã  mon travail, si tu me donnes une date approximative pour la naissance; me redonner la date du terme prÃ©vu ( comme les anglo-saxons ne comptent pas comme nous, me donner la date des derniÃ¨res rÃ¨gles ); et si c'est une cÃ©sarienne , ce sera 15 jours avant les 42 semaines pour nous, les 40 semaines pour vous dans le systÃ¨me anglo-saxon. Ou bien me mailer une PHOTO de la derniÃ¨re Ã©cho, tous ces renseignements sont dessus.\n\n- j'ai dÃ©jÃ  mis de cÃ´tÃ© les produits dont tu me parles.\n- avez-vous choisi un pÃ©diatre de proximitÃ© pour les visites et les vaccins ?\n- avez-vous un systÃ¨me de carnet de santÃ© ? sinon j'en amÃ¨ne un.\n- as-tu connaissance du calendrier vaccinal en cours actuellement ? les vaccins sont faits Ã  l'hopital ? \n\nTu sais que cette boite est ma boite professionnelle; et je n'y vais pas souvent; j'ai failli rater ton message ! Mais c'est bien car , de cette boite je peux t'envoyer des artcles mÃ©dicaux sur des sujets qui te posent soucis.\n\nBonne journÃ©e\nmaman \n\n\nmaryvonne masseron - 41 rue du puits-mauger  35000  rennes  0299302000  0680078113\n\n----- Mail d'origine -----\nDe: Yannick Mandaba (Personnal) \nÃ€: maryvonne masseron \nEnvoyÃ©: Mon, 14 Oct 2013 08:59:11 +0200 (CEST)\nObjet: voyage\n\nBonjour Maman, Liste de choses Ã  apporter si possible: Bee :Demande lotions ou toute autres choses pour\nmaman et bÃ©bÃ© si tu as des idÃ©es pour traitements/entretien santÃ© maman et\nbÃ©bÃ©.Traitements pour les petits soucis que tous\nles bÃ©bÃ© ont, bronchites, inhalateurs et autres que je tâ€™ai souvent entendu\nrecommander aux maman pour nettoyer le nez du bÃ©bÃ© etc.Ou faire une petite liste pour quâ€™elle ait les\nbons rÃ©flexes en cas de fiÃ¨vre bÃ©bÃ© tremblote ne pas couvrir, etc. On fera Ã§a\nici câ€™est possible aussi. Yannick :\n\nBiceptine  2 ou 3  grandes bouteilles\n\nTraitement comprimÃ©s et lotion perte de cheveux (ralentir, limiter les dÃ©gats). \nJe vais retrouver le nom sinon tu demande au pharmacien. Maman : Ne pas rÃ©server dâ€™hotel. Nous emmÃ©nageons\ndemain dans nouvel appart. Pas trÃ¨s grand mais trÃ¨s bien, tout confort tu as ta\nchambre et ta salle de bain.Trier les choses de CÃ©cile, ne pas te charger\nde trop, ne pas â€˜encombre avec des choses trop encombrantes, la sÅ“ur de Bee\nfait des dons aussi, et des amis. Aussi tu as dis que tu as achetÃ© pleins de\nbodies, etc. Ne traine pas trop de poids câ€™est dÃ©jÃ  un long voyage pour toi. Me donner les dates de tes voyages (liste\nsimple).Peut-Ãªtre devrais-tu remettre Ã  plus tard le\nvoyage Ã  Bangui, attendre lâ€™arrivÃ©e des casques bleus en Novembre.Câ€™est trÃ¨s instable et lâ€™annonce de lâ€™arrivÃ©e\ndes casques bleus pourrait augmenter le risque dâ€™attenta notamment les avions,\ncar on pense que les terroristes du soudan/somalie liÃ©s Ã  Al Qâ€¦ ont infiltrÃ©\nSeleka et planifiaient de "
}