{
  "year": 2013,
  "seq": 53,
  "meta": {
    "date": "2013-08-16",
    "from": "maryvonne masseron-mandaba <maryvonnemm@hotmail.com>",
    "to": "\"y.mandaba@gmail.com\" <y.mandaba@gmail.com>",
    "subject": "RE: Piece jointe : PDF a imprimer et leur faxer."
  },
  "proposals": [],
  "raw_excerpt": "ðŸ—• Date : 2013-08-16\nðŸ‘¤ From : maryvonne masseron-mandaba <maryvonnemm@hotmail.com>\nðŸ“¨ To   : \"y.mandaba@gmail.com\" <y.mandaba@gmail.com>\nðŸ§• Subject : RE: Piece jointe : PDF a imprimer et leur faxer.\n---\nyannick,ce Pdf est trs bien\nc'est ce que tu aurais d faire en premier,maintenant je suis au Pouliguen,je ne peux rien faire aujourd'hui\nESSAYE DE FAXER A NOUVEAU\naujourd'hui n'est pas fri\net si tu peux tu leur laisses mon tl portable 0680078113\n\nFrom: y.mandaba@gmail.com\nTo: maryvonnemm@hotmail.com\nSubject: Piece jointe : PDF a imprimer et leur faxer.\nDate: Thu, 15 Aug 2013 12:09:54 +0700\n\n\n\n\n\n\n\n\n\n\n\n\n\n\n\nJe vais essayer de faxer a encore aujourdhui.\n\nSi tu peux essayer de ton ct, merci\n\nHier standard satur toute l aprs midi\n\n \n\nBisous\n\n \n\n\n\nYannick Mandaba\n\n\n\nTel: +66 2635 0858\n\nFax: +66 2635 0859\n\nMobile: +66 8782 00 622\n\n\n\n \n\n\n\n\n\nFrom: Yannick Mandaba\n(Personnal) [mailto:y.mandaba@gmail.com] \n\nSent: Thursday, August 15, 2013 11:04 AM\n\nTo: 'maryvonne masseron-mandaba'\n\nSubject: RE: virement socit gnrale de rennesman\n\n\n\n\n\n \n\nBonour Maman,\n\n \n\nJe narrive pas  joindre la banque. Telephone occup,\nrepondeur, transfer au centre dappel qui na pas accs  mon compte.fax\noccup\n\nJe reconfirme les coordonnes bancaires de la socit :\n\n \n\nNom du\ncompte:             \nMANJA THAI CO., LTD.\n\n N de compte :\n               \n118-5-11335-2\n\nBank\n(Branche):               \nBangkok Bank PCL, Head Office\n\nBank Address:  \n               \n333, Silom Road, Bangkok 10500, Thailand\n\nSWIFT Code\n(BIC):           BKKBTHBK\n\n \n\nJe joins un fax  imprimer et leur faxer de ma part.\n\nJE ressaye...\n\n \n\nTon autre transfert est pass, merci beaucoup..\n\n \n\n \n\n\n\nYannick Mandaba\n\n\n\nTel: +66 2635 0858\n\nFax: +66 2635 0859\n\nMobile: +66 8782 00 622\n\n\n\n \n\n\n\n\n\nFrom: maryvonne\nmasseron-mandaba [mailto:maryvonnemm@hotmail.com] \n\nSent: Wednesday, August 14, 2013 7:00 PM\n\nTo: y.mandaba@gmail.com\n\nSubject: virement socit gnrale de rennesman\n\n\n\n\n\n \n\n\n\nils n'ont\npas fait le virement de 1650 euro,\n\n\n\nde ta\nsogn de rue d'isly  Rennes,\n\n\n\n\n\n \n\n\n\n\n\nenvoie un\nfax pour la confirmer\n\n\n\n\n\n \n\n\n\n\n\nde ton\ncompte courant\n\n\n\n\n\n mandja\nthai\n\n\n\n\n\n \n\n\n\n\n\nsoit les\ncoordonnes taient inexacte\n\n\n\n\n\n \n\n\n\n\n\nsoit ils ne\nsavaient pas faire\n\n\n\n\n\n \n\n\n\n\n\nje\ntravaille\n\n\n\n\n\npas le\ntemps\n\n\n\n\n\nm"
}