{
  "year": 2013,
  "seq": 82,
  "meta": {
    "date": "2013-01-26",
    "from": "maryvonne masseron-mandaba <maryvonnemm@hotmail.com>",
    "to": "\"y.mandaba@gmail.com\" <y.mandaba@gmail.com>",
    "subject": "RE: RIB YANNICK THAILANDE"
  },
  "proposals": [],
  "raw_excerpt": "ðŸ—• Date : 2013-01-26\nðŸ‘¤ From : maryvonne masseron-mandaba <maryvonnemm@hotmail.com>\nðŸ“¨ To   : \"y.mandaba@gmail.com\" <y.mandaba@gmail.com>\nðŸ§• Subject : RE: RIB YANNICK THAILANDE\n---\n???\n\nFrom: y.mandaba@gmail.com\nTo: maryvonnemm@hotmail.com\nSubject: RIB YANNICK THAILANDE\nDate: Sat, 26 Jan 2013 20:09:26 +0700\n\nLes 2 sont des comptes personnels, de prfrence envoyer sur le premier car moi seul y est accs. Mr. Yannick, Yves, Sala-kosso MandabaAccount#: 007-1-633838\nBank of Ayudhya, (007) Silom318,Silom Road, Suriyawong, Bangrak,Bangkok 10500, Thailand\nSWIFT: AYUDTHBKIBAN Code: AYUDTHBK 007-1633838    Mr. Yannick, Yves, Sala-kosso MandabaAccount#: 118-5-127121 Bangkok Bank PCL, Head Office333, Silom Road, Bangkok 10500, Thailand\nSWIFT Code (BIC): BKKBTHBKIBAN Code: BKKBTHBK118-5127121Ce compte Bee aussi y accde pour payer mon tlphone, internet,  manger et autres dpenses personnellesJai aussi accs  ses comptes, et je lui fais confiance.  Yannick Mandaba Tel: +66 2635 0858Fax: +66 2635 0859Mobile: +66 8782 00622"
}