{
  "year": 2013,
  "seq": 14,
  "meta": {
    "date": "2013-01-28",
    "from": "maryvonne masseron-mandaba <maryvonnemm@hotmail.com>",
    "to": "\"y.mandaba@gmail.com\" <y.mandaba@gmail.com>",
    "subject": "RE: 4 courriers pour rÃ©cupÃ©rer la situation fiscale"
  },
  "proposals": [
    {
      "index": -14,
      "etiquette": "ImpÃ´ts / fiscalitÃ©",
      "category": "MIN",
      "duration": "LT",
      "source": "AI",
      "score": 1,
      "matched_from": [
        "ai_new"
      ]
    }
  ],
  "raw_excerpt": "ğŸ—• Date : 2013-01-28\nğŸ‘¤ From : maryvonne masseron-mandaba <maryvonnemm@hotmail.com>\nğŸ“¨ To   : \"y.mandaba@gmail.com\" <y.mandaba@gmail.com>\nğŸ§• Subject : RE: 4 courriers pour rÃ©cupÃ©rer la situation fiscale\n---\ntoujours la mme adresse e-mail que Julian: sip.....\n\n> From: y.mandaba@gmail.com\n> To: maryvonnemm@hotmail.com\n> Subject: RE: 4 courriers pour rcuprer la situation fiscale\n> Date: Mon, 28 Jan 2013 19:57:05 +0700\n> \n> Aurais-tu le courriel de mr Sylvestre FIFOWSKI s'il te plait.\n> \n> \n> Yannick Mandaba\n> \n> Tel: +66 2635 0858\n> Fax: +66 2635 0859\n> Mobile: +66 8782 00622\n> \n> \n> -----Original Message-----\n> From: maryvonne masseron-mandaba [mailto:maryvonnemm@hotmail.com] \n> Sent: Monday, January 28, 2013 5:01 AM\n> To: y.mandaba@gmail.com\n> Subject: 4 courriers pour rcuprer la situation fiscale\n> \n> bonsoir, ne pas oublier:\n> \n> 1- le fax  la Socit Gnrale, que nous avons vu ensemble,\n> \n> \n> 2- un message  ta conseillire de la socit gbrale 14, rue d'Isly \n> Rennes (le mme texte, avec rf ,qui est en fait ton numero fiscal , donc \n> mettre en haut et  gauche pour tout courrier )\n> \n> et N des deux comptes:\n> \n> le tien\n> \n> et le compte Mr M.Mandaba ou MR Y.Mandaba n 30003 01713 00050039756 25\n> \n> 3- un courriel  Mr THI JULIAN: ( inspecteur des finances )\n> \n> sip.nonresidents@dgfip.finances.gouv.fr\n> \n> avec la rf = 105 887 527 5493\n> \n> POUR DEMANDER LA LEVEE DE LA SAISIE SUR COMPTE, et d'annuler l' avis  tiers\n> dtenteur, car les sommes dues ont t verses par MMM au CENTRE DES IMPOTS\n> DE RENNES\n> \n> 4 - un courriel  Mr Sylvestre FIFOWSKI, (contleur des impots ), pour le\n> prier de t'excuser d'avoir fait parvenir ta dclaration avec retard, car tu\n> avait remis ta dclaration  ta mre, qui l'a remise avec retard, et que tu\n> demandes justement que ton dossier de dclaration internet soit activ, car\n> tu n'as pu faire ta dclaration , en ligne, et que tu tiens  le faire\n> dornavant. Et tu le pries de bien vouloir ne pas te mettre de pnalits \n> cause de ce retard.\n> \n> N'oublies rien , je dois rcuprer le trop vers aux impots pour rcuprer\n> ma voiture, encore au garage; sinon je peux aussi bloquer le virement, si tu\n> en es d'accord ? ( car j'aurais pu tre heureuse d'avoir ma nouvelle\n> voiture, non ? ). Trop d'esprit de sacrifice tue, et aussi le got amer\n> d'avoir l'impression que l'on se moque de moi....\n> =\n>"
}