{
  "year": 2013,
  "seq": 62,
  "meta": {
    "date": "2013-10-25",
    "from": "maryvonne masseron-mandaba <maryvonnemm@hotmail.com>",
    "to": "\"y.mandaba@gmail.com\" <y.mandaba@gmail.com>",
    "subject": "RE: voyage Ã  Bangkok"
  },
  "proposals": [],
  "raw_excerpt": "ðŸ—• Date : 2013-10-25\nðŸ‘¤ From : maryvonne masseron-mandaba <maryvonnemm@hotmail.com>\nðŸ“¨ To   : \"y.mandaba@gmail.com\" <y.mandaba@gmail.com>\nðŸ§• Subject : RE: voyage Ã  Bangkok \n---\n- arrive  Bangkok le mardi 29 octobre  0H10 ( dsole...) Vol Qatar AIrways n QR836- dpart de Bangkok le lundi 4 novembre  8h35 ( dsole, il faudra y tre  7h ) vol QR823ma valise est prte, il faut encore un petit tour  Vitr !maman\n\nFrom: y.mandaba@gmail.com\nTo: maryvonnemm@hotmail.com\nSubject: RE: voyage  Bangkok\nDate: Fri, 25 Oct 2013 12:31:24 +0700\n\n\n\n\n\n\n\n\n\n\n\n\n\n\n\n\n\n\nOui Maman,\n\n \n\nBien sr tu peux venir. Bisous\n\n \n\n\n\nYannick Mandaba\n\n\n\nTel: +66 2635 0858\n\nFax: +66 2635 0859\n\nMobile: +66 8782 00 622\n\n\n\n \n\n\n\n\n\nFrom: maryvonne\nmasseron-mandaba [mailto:maryvonnemm@hotmail.com] \n\nSent: Thursday, October 24, 2013 5:24 PM\n\nTo: y.mandaba@gmail.com\n\nSubject: RE: voyage  Bangkok\n\n\n\n\n\n \n\n\n\nje ne sais\npas si tu es d'accord ?\n\n\n\npour que je\nvienne ce lundi ? pour 7 jours ?\n\n\n\n\n\nje suis\ndans une boutique orange, pour ma cl 3G,\n\n\n\n\n\nla\nconnection est mauvaise. Rponse s'il te plait.\n\n\n\n\n\nmaman\n\n\n\n\n\n\n\n\n\nFrom:\nmaryvonnemm@hotmail.com\n\nTo: y.mandaba@gmail.com\n\nSubject: RE: voyage  Bangkok \n\nDate: Thu, 24 Oct 2013 08:44:59 +0000\n\n\n\nje ne sais\npas si mon message est pass...\n\n\n\ntu\nn'es pas contant ?\n\n\n\n\n\n\n\n\n\nFrom:\nmaryvonnemm@hotmail.com\n\nTo: y.mandaba@gmail.com\n\nSubject: RE: voyage  Bangkok \n\nDate: Thu, 24 Oct 2013 08:35:15 +0000\n\n\n\nnon je\nvoudrais venir l, ce dimanche, pour organiser, apporter des choses, dire ce\nqui est utile, ou non...et revenir aprs !\n\n\n\nj'ai des\nprix intressants  cette priode-ci = exemple Qatar airways 576 euros, pour\nvenir maintenant, 28oct-4novembre.\n\n\n\n\n\nJe suis en\ncongs, car j'aurais d tre  Bangui. Comme TJ et MAMIE sont +/- bien, je\nprofite pour venir vous voir...c'est nul ?\n\n\n\n\n\naprs je\nverrai comment m'organiser pour mon travail !!!\n\n\n\n\n\nBisous,\nj'ai hte de vous voir.\n\n\n\n\n\nmaman\n\n\n\n\n\n\n\n\n\nFrom:\ny.mandaba@gmail.com\n\nTo: maryvonnemm@hotmail.com\n\nSubject: RE: voyage  Bangkok\n\nDate: Thu, 24 Oct 2013 15:13:11 +0700\n\n\n\nTu veux dire 28 Novembre au 4 Decembre.\n\nTu ne peux pas rester plus que a ?\n\n \n\nTu timpose chez ceux qui ne veulent pas de toi et l tu es la\nbien venue tu ne veux pas rester plus de 6 jour.\n\n2 jours de voyage pour rester si peu\n\nTu ne verras probablement pas le bb donc mais peut etre que\nsi.\n\nNous saurons samedi la date de la naissance.\n\n \n\nFais comme tu veux.\n\n \n\n \n\n\n\nYannick Mandaba\n\n\n\nTel: +66 2635 0858\n\nFax: +66 2635 0859\n\nMobile: +66 8782 00 622\n\n\n\n \n\n\n\n\n\nFrom: maryvonne masseron-mandaba\n[mailto:maryvonnemm@hotmail.com] \n\nSent: Thursday, October 24, 2013 3:00 PM\n\nTo: y.mandaba@gmail.com\n\nSubject: voyage  Bangkok\n\n\n\n\n\n \n\n\n\nbonjour\nYannick,\n\n\n\n \n\n\n\nje viendrai\n Bangkok avant la naissance,\n\n\n\n\n\nprobablement\npour une semaine ,\n\n\n\n\n\ndu lundi 28\noctobre, au lundi 4 novembre,\n\n\n\n\n\nsi vous en\ntes d'accord.\n\n\n\n\n\n \n\n\n\n\n\nAinsi,\nj'amnerai tout ce que j'ai achet, et amen d'Istanbul,\n\n\n\n\n\net nous\nferons le point sur ce qui est utile d'avoir en plus.\n\n\n\n\n\n \n\n\n\n\n\nbisous\n\n\n\n\n\nmaman"
}