{
  "year": 2013,
  "seq": 11,
  "meta": {
    "date": "2013-12-25",
    "from": "maryvonne.masseron@free.fr",
    "to": "Yannick Mandaba <y.mandaba@gmail.com>, marcmandaba@hotmail.com",
    "subject": "NOEL 2013"
  },
  "proposals": [],
  "raw_excerpt": "ğŸ—• Date : 2013-12-25\nğŸ‘¤ From : maryvonne.masseron@free.fr\nğŸ“¨ To   : Yannick Mandaba <y.mandaba@gmail.com>, marcmandaba@hotmail.com\nğŸ§• Subject : NOEL 2013\n---\nchers Yannick et Marc,\n\nj'espÃ¨re que , comme nous ici Ã  VitrÃ©, vous avez passÃ© une belle fÃªte de NoÃ«l.\nToutes les familles Ã©taient largement reprÃ©sentÃ©es, sauf nous.\nGrand mamie Ã©tait en forme , et tout le monde trÃ¨s tranquille.\nIls ont tous pensÃ© Ã  vous, et regrettÃ© que je n'aie pas pu faire de connexion internet.\n\nJ'ai vu vers 22h le sms de Marc, mais mon appel video skype n'a pas abouti.\n\nAvant, et aprÃ¨s, j'ai eu beaucoup Ã  faire avec grand mamie et tante jeannette.\nElles sont toutes les deux trÃ¨s dÃ©pendantes: maman qui n'arrive plus Ã  marcher, et tante jeannette qui ne voit plus; il faut les aider en permanence; en plus j'ai beaucoup aidÃ© Marie-Annick, car les jeunes avaient des soucis: MÃ©lissa a Ã©tÃ© rÃ©-hospitalisÃ©e, et sortie pour une permission de 2 heures, et Solenn trÃ¨s enceinte, Nathalie travaillait Ã  Dijon, Maud de garde Ã  Carhaix arrivÃ©e trÃ¨s tard etc...\n\ntout le monde vous embrasse, et souhaite vous voir le 8 juin Ã  la PeiniÃ¨re;\n\nJ'espÃ¨re avoir des photos demain matin, de vos NoÃ«ls respectifs.\n\nJe m'occupe de mamie de son rÃ©veil Ã  8h ( l'appel du ventre ), Ã  10H.\n\nje vous embrasse, et essaie de vous voir demain;\nskype ne fonctionne pas ce soir;\ndÃ©bit trop lent;\nj'envoie aussi des photos demain;\nPlein de bisous aux petits.\nM"
}