{
  "year": 2013,
  "seq": 76,
  "meta": {
    "date": "2013-01-06",
    "from": "maryvonne masseron-mandaba <maryvonnemm@hotmail.com>",
    "to": "\"y.mandaba@gmail.com\" <y.mandaba@gmail.com>",
    "subject": "---"
  },
  "proposals": [
    {
      "index": -76,
      "etiquette": "ImpÃ´ts / fiscalitÃ©",
      "category": "MIN",
      "duration": "LT",
      "source": "AI",
      "score": 1,
      "matched_from": [
        "ai_new"
      ]
    }
  ],
  "raw_excerpt": "ðŸ—• Date : 2013-01-06\nðŸ‘¤ From : maryvonne masseron-mandaba <maryvonnemm@hotmail.com>\nðŸ“¨ To   : \"y.mandaba@gmail.com\" <y.mandaba@gmail.com>\nðŸ§• Subject : \n---\nbonne anne !!!\nsi tu appelles demain, cela me ferait plaisir...\nMamie a laiss un chque pour toi,\non va attendre un peu pour le dposer, car ton compte est saisi,\npar l'huissier des impots,\nil faut qu'ils aient touch mon chque,\net que je fasse un courrier pour dire que j'avais dj pay en partie,\navec scan de la photocopie des chques dj envoys,\net qu'ils n'auraient pas reus,\nje n'aime pas faire ce genre de courrier, car j'ai toujours t en rgle.\nmaman"
}