{
  "year": 2013,
  "seq": 42,
  "meta": {
    "date": "2013-06-22",
    "from": "maryvonne masseron-mandaba <maryvonnemm@hotmail.com>",
    "to": "\"y.mandaba@gmail.com\" <y.mandaba@gmail.com>, Marc Mandaba",
    "subject": "des soucis, des soucis, encore des soucis...."
  },
  "proposals": [],
  "raw_excerpt": "ðŸ—• Date : 2013-06-22\nðŸ‘¤ From : maryvonne masseron-mandaba <maryvonnemm@hotmail.com>\nðŸ“¨ To   : \"y.mandaba@gmail.com\" <y.mandaba@gmail.com>, Marc Mandaba\n\t<marcmandaba@gmail.com>\nðŸ§• Subject : des soucis, des soucis, encore des soucis....\n---\nbonjour vous deux !\n \nBON ANNIVERSAIRE YANNICK, c'est dans qq heures !  7h !\nje vais essayer de faire skype, demain vers 11h, 17h pour bkk, et si on le fait  3 c'est encore mieux.\nMamie veut te tlphoner demain, sa dame de compagnie a demand ton N de tlphone.\n \npour Pergolse, Mr Sanchez nous fait un procs,\npour Marc, je demande un avocat concern par le droit dans les coproprits. sur Paris.\nAussi de regarder le devis ci-joint, bien dans les dtails, mais faux sur le total.\nIl faut recontrler l'addition,  moins que je ne me trompe.\nJe vais accepter, il faut faire vite, Mr Charbel Braidy est OK pour faire vite;\non verra aussi le pb de la fuite de gaz, sur laquelle il ne m'a pas dit sa version;\nmais je ne veux pas le tracasser davantage.\n \nmaman"
}