{
  "year": 2013,
  "seq": 56,
  "meta": {
    "date": "2013-09-22",
    "from": "maryvonne masseron-mandaba <maryvonnemm@hotmail.com>",
    "to": "\"y.mandaba@gmail.com\" <y.mandaba@gmail.com>, Marc Mandaba",
    "subject": "130922"
  },
  "proposals": [],
  "raw_excerpt": "ðŸ—• Date : 2013-09-22\nðŸ‘¤ From : maryvonne masseron-mandaba <maryvonnemm@hotmail.com>\nðŸ“¨ To   : \"y.mandaba@gmail.com\" <y.mandaba@gmail.com>, Marc Mandaba\n\t<marcmandaba@hotmail.com>\nðŸ§• Subject : 130922\n---\nbonjour,\nj'ai peu de temps pour vous expliquer:- tante Jeannette est trs fatigue, ne veut pas s'alimenter, a t trs afaiblie aprs un passage  l'hopital pour bilan cardiaque ( manque de personnel, bloque dans un lit avec barrire, couche-culotte, pas leve pour les repas...)Acuellement elle est rentre  domicile, mais je ne suis pas aide, car l'auxilliaire de vie qu'elle avait, est celle dont maman ne veut plus, donc arrts de maladie  rptition, elle ne travaille plus depuis le 5 aout. Je suis oblige de passer souvent pour la faire manger, et dors  Vitr presque tous les soirs.- maman va bien, elle a des personnes tout le temps, mais remplacer celle qui est absente est un gros problme; les autres en ont assez de dpasser leurs horaires; je campe  Vitr pour 4 jours, aprs quoi je retournerai me reposer  Loudac.\nJ'aimerai raliser ensuite mes projets tout simples:- vous voir le dimanche sur skype- aller  Bangui qq jours- aller faire un coucou  bkk- aller faire un coucou  Constantinople/bizance/istanbul\nMerci de photos de vous,d'un petit motmaman"
}