{
  "year": 2013,
  "seq": 51,
  "meta": {
    "date": "2013-08-16",
    "from": "maryvonne masseron-mandaba <maryvonnemm@hotmail.com>",
    "to": "\"y.mandaba@gmail.com\" <y.mandaba@gmail.com>",
    "subject": "RE: Bonne FÃªte"
  },
  "proposals": [],
  "raw_excerpt": "ðŸ—• Date : 2013-08-16\nðŸ‘¤ From : maryvonne masseron-mandaba <maryvonnemm@hotmail.com>\nðŸ“¨ To   : \"y.mandaba@gmail.com\" <y.mandaba@gmail.com>\nðŸ§• Subject : RE: Bonne FÃªte\n---\nyannick, nous sommes tous au Pouliguen;nous avons ft les \"Marie\" hier 15 aout, comme d'habitude au Pouliguen.Tu peux tlphoner  Mamie au 00 33 2 40424120,vers 12h30 ( l il est 8h30 )\nmerci pour tes voeux\nmaman\n\nFrom: y.mandaba@gmail.com\nTo: maryvonnemm@hotmail.com\nSubject: Bonne Fte\nDate: Thu, 15 Aug 2013 12:17:15 +0700\n\n\n\n\n\n\n\n\n\n\n\n\n\n\nJe te souhaite un bonne fte ma petite maman\nchrie.\n\nSeras-tu avec Mamie ?\n\n \n\nNouvelles :\n\nCe weekend nous recevons les rsultat de lamniocentse.\n\nLe bb bouge de plus en plus et il a grandi normment cette semaine.\n\n\n\nJe trouve que est trs tardif de faire les test en semaine 24 alors quon\npeut le faire en semaine 16, mais il ny avais as assez de liquide\namniotique avant soit disant et le bb bougeait trop.\n\nNormalement a devrait aller il semble en\nbonne sant. As-tu un avis en voyant les potos et films ultra-son ?\n\n \n\nMaintenant on se concentre sur lalimentation\ncar maman obse. On regarde le taux de protines dans les urines."
}