{
  "year": 2013,
  "seq": 72,
  "meta": {
    "date": "2013-12-11",
    "from": "maryvonne masseron-mandaba <maryvonnemm@hotmail.com>",
    "to": "\"y.mandaba@gmail.com\" <y.mandaba@gmail.com>",
    "subject": "bon mensiversaire Ã  Tristan !!!"
  },
  "proposals": [],
  "raw_excerpt": "ğŸ—• Date : 2013-12-11\nğŸ‘¤ From : maryvonne masseron-mandaba <maryvonnemm@hotmail.com>\nğŸ“¨ To   : \"y.mandaba@gmail.com\" <y.mandaba@gmail.com>\nğŸ§• Subject : bon mensiversaire Ã  Tristan !!!\n---\nmerci pour les photos de 1 MOIS !\nfaites attention = Tristan a toujours la tte tourne vers sa droite ( il se peut qu'il s'installe dans cette postion, plus confortable, mais ... applatisse un peu trop ses os craniens en arrire droite... ce qui n'est pas grave, mais dysgracieux  ). Obligez-le un peu dans la journe  poser la tte ct gauche ! Il ne peut rester au milieu car la tte mandaba est toute en longueur!!! un petit anneau pour la nuit serait bien.\nJ'ai dialogu avec les parents de Gal Jaffre, ton grand petit copain de Cergy !\nAussi j'ai pass un bel aprs-midi avec Corrine et ses 2 petits .\nBisous"
}