{
  "year": 2021,
  "seq": 131,
  "meta": {
    "date": "2021-11-29",
    "from": "maryvonne masseron-mandaba <maryvonnemm@hotmail.com>",
    "to": "Sylvie MARY - Office Notarial de Me CHAUDET",
    "subject": "Re: DONATION MANDABA"
  },
  "proposals": [],
  "raw_excerpt": "ðŸ—• Date : 2021-11-29\nðŸ‘¤ From : maryvonne masseron-mandaba <maryvonnemm@hotmail.com>\nðŸ“¨ To   : Sylvie MARY - Office Notarial de Me CHAUDET\n\t<sylvie.mary.35142@notaires.fr>\nðŸ§• Subject : Re: DONATION MANDABA\n---\nMadame Mary,\nJe suis dsole de constater que le document de Donation-partage ne peut encore pas tre sign cette semaine.\nVous m'aviez bien dit que tout serait prt pour le dbut Octobre, quand je vous ai renvoy tous les changes de courrier et documents avec Matre Chaudet.\nJe suis  30mn en train de votre Etude, je peux  me librer facilement. D'ailleurs je me rends souvent  Vitr.\n\nLe problme est autre. Vous semblez hsiter entre Procuration, et Signature Electronique. Que Matre Chaudet tranche rapidement.\n\nJe me rendrai  votre rendez-vous le mercredi 8 dcembre  15 heures.\n\nCordialement\nMaryvonne Mandaba\n0783359723\n\nTlcharger Outlook pour Android\n________________________________\nFrom: Sylvie MARY - Office Notarial de Me CHAUDET \nSent: Monday, November 29, 2021 10:03:58 AM\nTo: 'maryvonne masseron-mandaba' \nCc: marcmandaba@hotmail.com ; y.mandaba@gmail.com \nSubject: RE: DONATION MANDABA\n\n\nMadame,\n\n\n\nJe vous remercie pour votre retour.\n\nAfin que nous puissions faire le ncessaire avec vos fils pour les procurations, un rendez-vous cette semaine ne pourra tre honor car les dlais vont tre un peu courts.\n\nAvez-vous des disponibilits la semaine du 13 dcembre ?\n\n\n\nJe vous prie dagrer, Madame, lexpression de mes salutations distingues.\n\n\n\n[Notaires Office]\n\nSylvie MARY\n\nAssistante de Me CHAUDET\nSuccession - Droit de la famille\n\n02 99 75 01 34\n\n7, boulevard Pierre Landais - BP 30204\n\n35502 VITR\n\n[Prenez RDV]\n\n[Logo LD]\n\n[Youtube]\n\n[Linkedin]\n\n[Twitter]\n\n[Facebook]\n\n\n\n[cid:image010.gif@01D7E508.6D255060]\n\n\n\nDe : maryvonne masseron-mandaba \nEnvoy : samedi 27 novembre 2021 00:02\n : Sylvie MARY - Office Notarial de Me CHAUDET \nCc : marcmandaba@hotmail.com; y.mandaba@gmail.com\nObjet : Re: DONATION MANDABA\n\n\n\nMadame,\n\nMerci de votre courriel.\n\nJe suis disponible ce lundi, mardi, mercredi, de 13h  17h.\n\nPour mes fils, Matre Chaudet avait propos la signature lectronique.\n\nTenez moi informe au 0783359723.\n\nCordialement\n\nMaryvonne Mandaba\n\n\n\nTlcharger Outlook pour Android\n\n________________________________\n\nFrom: Sylvie MARY - Office Notarial de Me CHAUDET >\nSent: Friday, November 26, 2021 4:44:04 PM\nTo: maryvonnemm@hotmail.com >\nCc: marcmandaba@hotmail.com >; y.mandaba@gmail.com >\nSubject: DONATION MANDABA\n\n\n\nMadame,\n\n\n\nJe me permets de revenir vers vous concernant la donation.\n\nPouvez-vous mindiquer plusieurs disponibilits afin que nous fixions un rendez-vous de signature de lacte ; ainsi que si vos fils ont besoin ou non dune procuration ?\n\n\n\nVous remerciant par avance,\n\n\n\nJe vous prie dagrer, Madame, lexpression de mes salutations distingues.\n\n\n\n\n\n[Notaires Office]\n\nSylvie MARY\n\nAssistante de Me CHAUDET\nSuccession - Droit de la famille\n\n02 99 75 01 34\n\n7, boulevard Pierre Landais - BP 30204\n\n35502 VITR\n\n[Prenez RDV]\n\n[Logo LD]\n\n[Youtube]\n\n[Linkedin]\n\n[Twitter]\n\n[Facebook]\n\n\n\n[cid:image010.gif@01D7E508.6D255060]"
}