{
  "year": 2021,
  "seq": 132,
  "meta": {
    "date": "2021-12-05",
    "from": "maryvonne masseron-mandaba <maryvonnemm@hotmail.com>",
    "to": "D.CHAUDET OfficeNot <dc.chaudet.35142@notaires.fr>, Office CHAUDET Accueil",
    "subject": "RÃ©gularisation DONATION PARTAGE Ã  mes fils"
  },
  "proposals": [],
  "raw_excerpt": "ðŸ—• Date : 2021-12-05\nðŸ‘¤ From : maryvonne masseron-mandaba <maryvonnemm@hotmail.com>\nðŸ“¨ To   : D.CHAUDET OfficeNot <dc.chaudet.35142@notaires.fr>, Office CHAUDET Accueil\n\t<accueil.35142@notaires.fr>\nðŸ§• Subject : RÃ©gularisation DONATION PARTAGE Ã  mes fils\n---\nMatre Chaudet,\nMadame Mary,\nJe vous rappelle que jai rendez-vous ce mercredi 8 dcembre , en votre Etude pour signer le document.\nEst-ce que la procdure sera dfinitivement arrte ?\nJe vous rappelle votre courriel du 30 Mars 2021.\nCordialement\nMaryvonne Mandaba\n0783359723\n\n\nEnvoy  partir de Courrier pour Windows\n\n\nFrom: Me CHAUDET >\nSent: Tuesday, March 30, 2021 6:25:58 PM\nTo: 'maryvonne masseron-mandaba' >; ALLAIN David (BPGO) >\nSubject: RE: Donation de 70 actions L'Oreal  mes fils\n\n\n\nBonjour,\n\n\n\nJai pris connaissances de vos mails et de votre appel daujourdhui.\n\nLe transfert de vos actions peut soprer sans acte qui peut trs bien se signer plus tard.\n\n\n\nEn ce qui concerne lacte lui-mme, je dois collationner diverses information  commencer par me faire confirmer les lments relatifs  vos fils et ci-joints.\n\nPar chance, le droit vient seulement dvoluer et permet une procuration authentique  distance ; ce qui tait jusqu prsent impossible, or la procuration authentique est obligatoire en matire de donation.\n\n\n\nBien cordialement.\n\n\n\n\n\n\n\nDominique CHAUDET\n\n[cid:image002.png@01D7E9CE.B585D260]"
}