{
  "year": 2021,
  "seq": 7,
  "meta": {
    "date": "2021-12-13",
    "from": "Yannick Mandaba <y.mandaba@gmail.com>",
    "to": "maryvonne masseron-mandaba <maryvonnemm@hotmail.com>",
    "subject": "Re: Patrimoine"
  },
  "proposals": [
    {
      "index": -7,
      "etiquette": "Appartement PergolÃ¨se (vente/location)",
      "category": "MIN",
      "duration": "LT",
      "source": "AI",
      "score": 1,
      "matched_from": [
        "ai_new"
      ]
    }
  ],
  "raw_excerpt": "ðŸ—• Date : 2021-12-13\nðŸ‘¤ From : Yannick Mandaba <y.mandaba@gmail.com>\nðŸ“¨ To   : maryvonne masseron-mandaba <maryvonnemm@hotmail.com>\nðŸ§• Subject : Re: Patrimoine\n---\nEffectivement mon email Ã  Ã©chouÃ© dans son but d'obtenir une rÃ©ponse claire\nÃ  la question posÃ©e (meubles?)  tout en rappelant \"d'oÃ¹ on parle\" pour\nÃ©viter des retours en arriÃ¨re.\n\nDonc pas trÃ¨s contributif mais j'ai essayÃ©.\n\nOn Mon, Dec 13, 2021, 12:33 PM maryvonne masseron-mandaba  wrote:\n\n> Je ne vois rien de contributif au courriel de Yannick.\n>\n> Clairement : je refuse de quitter ma chambre dans ma maison, jusqu'Ã \n> dÃ©mÃ©nagement dÃ©finitif dans une chambre chez Marc. Je refuse un transfert\n> de chambre en chambre dans Toa Ziki. J'ai un gros volume d'affaires\n> personnelles. Je n'entends pas perdre de temps, ni d'Ã©nergie en discussions.\n> Je suis occupÃ©e Ã  finir l'entretien de mes biens en France. C'est autant\n> pour moi que pour vous.\n> Quand la pandÃ©mie sera maÃ®trisÃ©e, je me rendrai Ã  Bangui.\n>\n> Selon l'OMS, seulement 6% de la population est vaccinÃ©e en RCA, comme dans\n> toute l'afrique subsahelienne. Les hypothÃ¨ses complotistes dominent. Les\n> gens mal informÃ©s pensent que la pandÃ©mie a Ã©tÃ© inventÃ©e par les fabricants\n> de vaccins. Tous les vaccins sont disponibles Ã  Bangui dans le public et le\n> privÃ©. Des doses de vaccins, non injectÃ©es, seront dÃ©truites les jours\n> prochains. MÃªme Christian n'a pas pu convaincre sa femme et sa fille Fanny,\n> de se faire vacciner.\n> Dans ce monde dÃ©raisonnable, il faudrait que je me plie Ã  ce Ã  quoi la loi\n> ne m'oblige pas.\n>\n> Si Yannick manque d'argent, je peux lui payer un loyer pour rester dans ma\n> chambre.\n> Si Marc veut une aide pour accÃ©lÃ©rer les travaux de sa maison, il n'a qu'Ã \n> rÃ©cupÃ©rer les loyers du Groupe Medical, puisque les transferts hors de la\n> RCA, par western union ou autre sont encadrÃ©s et limitÃ©s.\n> D'ailleurs, c'est un non-sens que dans la mÃªme famille, l'un apporte des\n> euros Ã  Bangui, pendant que l'autre ne peut pas les rÃ©cupÃ©rer. On pourrait\n> peut-Ãªtre s'arranger, de faÃ§on Ã  ce que cela diminue la dette de Yannick\n> envers Marc.\n> Quand je vois comment Jean-Paul se comporte vis-Ã -vis de ses soeurs et\n> neveux, cela laisse Ã  rÃ©flÃ©chir.\n>\n> Un peu de gentillesse et de comprÃ©hension, moins de naÃ¯vetÃ© et plus\n> d'objectivitÃ©, seraient bienvenues Ã  l'approche de NoÃ«l.\n>\n> Maman.\n>\n> Lectures souhaitables, en lieu et place des reseaux sociaux =\n> MinistÃ¨re des affaires sociales et de la santÃ©\n> Haute AutoritÃ© de la SantÃ©\n> Organisation Mondiale de la SantÃ©\n> UNICEF\n> Association Francaise de Pediatrie (car on veut vacciner les enfants, pour\n> atteindre plus de 80% d'infectÃ©s/vaccinÃ©s, alors que 10 millions d'adultes\n> refusent de se faire vacciner, et 80 000 faux pass sanitaires circulent...)\n> TÃ©lÃ©charger Outlook pour Android \n> ------------------------------\n> *From:* Yannick Mandaba \n> *Sent:* Monday, December 13, 2021 5:42:37 AM\n> *To:* Marc Mandaba \n> *Cc:* maryvonne masseron-mandaba \n> *Subject:* Re: Patrimoine\n>\n> Super Marc, ce que tu fais pour le patrimoine.\n>\n> J'espÃ¨re que Maman va supporter le projet et rÃ©aliser les annÃ©es de\n> stress, les possibilitÃ©s pour moi petit entrepreneur, et le manque Ã  gagner\n> global qui auraient Ã©tÃ© Ã©vitÃ©s si on avait fait tout cela 15 ans plus tÃ´t.\n>\n> Manque Ã  gagner en qualitÃ© de vie, paix familiale, opportunitÃ©s, temps de\n> vie gaspillÃ©, car c'est du gaspillage.\n>\n> J'espÃ¨re que cet email de Marc ne sera pas un prÃ©texte pour faire couler\n> de l'encre.\n>\n> Laissons lÃ  les responsabilitÃ©s, nous les reconnaissons tous, puisque ce\n> chantier est finalement ouvert...\n>\n> Sans rÃ©ponse simple, logique et claire de Maman, Marc, tu as mon\n> accord/vote pour faire selon tes moyens, ton temps et au plus facile.\n>\n> Je maintiens ma position comme quoi Maman, aura sa chambre toujours\n> disponible, dans la copropriÃ©tÃ©, avec interruption minimale de sa fenÃªtre\n> de visite dans la transition.\n> Nous devons prendre en compte ces avis sauf s'ils gÃ©nÃ¨rent des voyages,\n> trop de tr"
}