{
  "year": 2021,
  "seq": 3,
  "meta": {
    "date": "2021-05-14",
    "from": "\"Yannick Mandaba \\(personal\\)\" <y.mandaba@gmail.com>",
    "to": "\"'maryvonne masseron-mandaba'\" <maryvonnemm@hotmail.com>,",
    "subject": "RE: 1Ã¨re page. DÃ©solÃ©e. Pas le temps."
  },
  "proposals": [
    {
      "index": -3,
      "etiquette": "Frais bus Tristan",
      "category": "MIN",
      "duration": "LT",
      "source": "AI",
      "score": 1,
      "matched_from": [
        "ai_new"
      ]
    }
  ],
  "raw_excerpt": "ðŸ—• Date : 2021-05-14\nðŸ‘¤ From : \"Yannick Mandaba \\(personal\\)\" <y.mandaba@gmail.com>\nðŸ“¨ To   : \"'maryvonne masseron-mandaba'\" <maryvonnemm@hotmail.com>,\n\t\"'Yannick Mandaba'\" <ymandaba@gmail.com>,\n\t\"'Marc MANDABA'\" <marcmandaba@hotmail.com>,\n\t\"'MYM MANDABA SCI'\" <mymmandaba@gmail.com>\nðŸ§• Subject : RE: 1Ã¨re page. DÃ©solÃ©e. Pas le temps. \n---\nMerci pour le devis Maman,\n\nOK ce nest pas juste la peinture.\n\nJe suppose que cest assez standard.\n\n \n\nTrs bon travail Maman, merci. \n\nJai vu juste  peinture 3,200 Euro .\n\nQuelque part je savais que tu nallais pas te faire avoir non plus.\n\nJe te fais confiance et puis cest ton argent quelque part.\n\n \n\n \n\n \n\n= = = = = = \n\n \n\nCest juste que pour 4 fois la somme vous et moi avons refait mon btiment\navec \n\n-        les murs, destruction, ajout de cloisons, \n\n-        Peintures dedans et dehors.\n\n-        le sol ciment arm lvation 10cm, \n\n-        toiture 30m2, \n\n-        Toilettes douche complte et carrelage\n\n-        lectricit lignes et boitier + 30m ligne haute tension  la rue, \n\n-        pose climatiseurs, luminaires\n\n-        vitres \n\n-        sur 88 m2\n\n \n\nDailleurs je vous remercie encore tous les 2 pour mavoir install.\n\nJe ne sais pas comment jaurais fait sinon avec des loyers en centre-ville,\nni ma vie quotidienne si je devais aller en zone industrielle tous les\njours.\n\n\n\n*** Je viens de payer la dernire tranche donc ce prix tait aussi avec un\ncrdit pour 30% du travail \nCrdit forc, 1 an,  le pauvre monsieur Tawan.\nIl a perdu tout son business dans les condominiums car les gens ne veulent\npas douvriers dans les immeubles avec le COVID, mine de rien mes petits\npaiements lu ont fait un revenu diffr quil aurait sans doute cram avant\nla COVID).\n\n \n\nBon ce nest pas le mme travail non plus, cest du prfab... et cest la\nThailande\n\nCe que jai vu de la chambre est trs bien fait en tout cas.\n\nEsprons que les histoires de fuites ne continuent pas.\n\n \n\nBise  tous les 2\n\n \n\n \n\nFrom: maryvonne masseron-mandaba [mailto:maryvonnemm@hotmail.com] \nSent: Thursday, 13 May, 2021 10:02 PM\nTo: Yannick Mandaba ; Marc MANDABA\n; maryvonne masseron-mandaba\n; MYM MANDABA SCI \nSubject: 1re page. Dsole. Pas le temps. \n\n \n\n\n\n\n \n\n \n\nTlcharger Outlook pour Android"
}