{
  "year": 2021,
  "seq": 67,
  "meta": {
    "date": "2021-04-27",
    "from": "maryvonne masseron-mandaba <maryvonnemm@hotmail.com>",
    "to": "\"Yannick Mandaba (personal)\" <y.mandaba@gmail.com>",
    "subject": "Re: Cela prend de l'allure..."
  },
  "proposals": [],
  "raw_excerpt": "ðŸ—• Date : 2021-04-27\nðŸ‘¤ From : maryvonne masseron-mandaba <maryvonnemm@hotmail.com>\nðŸ“¨ To   : \"Yannick Mandaba (personal)\" <y.mandaba@gmail.com>\nðŸ§• Subject : Re: Cela prend de l'allure... \n---\nSous la bande : lave vaisselle, et gazinire. Hotte prvue.\n\nTlcharger Outlook pour Android\n\n________________________________\nFrom: Yannick Mandaba (personal) \nSent: Tuesday, April 27, 2021 11:16:30 AM\nTo: 'maryvonne masseron-mandaba' \nSubject: RE: Cela prend de l'allure...\n\n\nSi tu refais les paroies Salle de bain et/ou cuisine il faudrait moderniser.\n\nIkea ou des magasins comme a vendent des ensembles SDB et souvent avec ils proposent un service de pose des carrelages.\n\n\n\nMarc expliquait que pour louer facile il faut sduire la maitresse de maison avec Cuisine et SDB.\n\n\n\nCuisine :\n\nCest quoi cette bande de carrelage qui flotte au milieu du mur ?\n\nIl doit y avoir une tablette peu profonde devant pour poser de la vaisselle cest a ?\n\nCest assez moche.\n\nUn simple coffrage avec une plache de 30 cm ferait un bon cache misre et pose-plat.\n\n\n\nSinon les sols cest bien, cest propre.\n\n\n\nBisous\n\n\n\n\n\nFrom: maryvonne masseron-mandaba [mailto:maryvonnemm@hotmail.com]\nSent: Tuesday, 27 April, 2021 12:31 AM\nTo: Yannick Mandaba ; Marc MANDABA \nSubject: Cela prend de l'allure...\n\n\n\nLe parquet rabot et vernis, est parfait.\n\nLa veranda est ferme\n\nlectricit et peintures faites\n\nReste la douche, rupture approvisionnement materiaux paroi salle d'eau.\n[Image]\n\n\n\n[Image]\n\n\n\n[Image]\n\n\n\n[Image]\n\n\n\n[Image]\n\n\n\n\n\nTlcharger Outlook pour Android"
}