{
  "year": 2021,
  "seq": 103,
  "meta": {
    "date": "2021-09-08",
    "from": "maryvonne masseron-mandaba <maryvonnemm@hotmail.com>",
    "to": "\"y.mandaba@gmail.com\" <y.mandaba@gmail.com>, BeeBaa <beebeau89@gmail.com>,",
    "subject": "Tristan, sur le film du poÃ¨me des crayons, on voit bien le NYSTAGMUS"
  },
  "proposals": [],
  "raw_excerpt": "ðŸ—• Date : 2021-09-08\nðŸ‘¤ From : maryvonne masseron-mandaba <maryvonnemm@hotmail.com>\nðŸ“¨ To   : \"y.mandaba@gmail.com\" <y.mandaba@gmail.com>, BeeBaa <beebeau89@gmail.com>,\n\tmaryvonne masseron mandaba <maryvonnemm@hotmail.fr>,\n\t\"maryvonne.masseron@free.fr\" <maryvonne.masseron@free.fr>\nðŸ§• Subject : Tristan, sur le film du poÃ¨me des crayons, on voit bien le NYSTAGMUS\n---\nVoici un article de neurologie\nNe pas paniquer\nTristan a\n-soit un nystagmus du regard excentr\n-soit un nystagmus vestibulaire priphrique\n-soit un nystagmus retractorius\nCe nest pas un nystagmus dorigine centrale a priori\n(sauf si trop de vitamine D)\n\nCe nest pas grave\nMais il faut tre sr quil ny ait pas autre chose\n\nPas de traitement, le repos des yeux = arrter les crans rcratifs TOTALEMENT\nEt contrler la nourriture = pas de saumon, ni maquereaux,\nmais des fruits et lgumes, du poulet ou du buf,\nQue des aliments frais et sans conservateurs\nVrifier les doses de vitamine D quil reoit chaque jour,\n800 Units Internationales est un maximum par jour\n(sinon il y a risque dhypertension intracranienne, qui peut donner un nystagmus)\n\nMontrer la video  P.A\nPour quelle trouve un neurologue pdiatrique,  qui faire visionner le film =\nCe film est trs instructif pour caractriser le trouble =\non note un nystagmus, de lil droit, horizontal,  ressort, non ressenti,\nNon gnant, et aucune autre anomalie\nMontrer ce film, et , si besoin, obtenir un rendez-vous sans risque de la Covid.\nPoser la question de loxygne dans lappartement. Toxique pour lil de lenfant.\n\nMerci de ne pas inquiter Tristan avec cela.\n\n\n\nEnvoy  partir de Courrier pour Windows"
}