{
  "year": 2021,
  "seq": 96,
  "meta": {
    "date": "2021-08-27",
    "from": "maryvonne masseron-mandaba <maryvonnemm@hotmail.com>",
    "to": "\"y.mandaba@gmail.com\" <y.mandaba@gmail.com>",
    "subject": "Yourcenar"
  },
  "proposals": [],
  "raw_excerpt": "ğŸ—• Date : 2021-08-27\nğŸ‘¤ From : maryvonne masseron-mandaba <maryvonnemm@hotmail.com>\nğŸ“¨ To   : \"y.mandaba@gmail.com\" <y.mandaba@gmail.com>\nğŸ§• Subject : Yourcenar\n---\nCe texte datant de 1980 Ã©crit par Marguerite Yourcenar n'a pas pris une ride. HÃ©las.\n\nÂ« Je condamne lâ€™ignorance qui reÌ€gne en ce moment dans les deÌmocraties aussi bien que dans les reÌgimes totalitaires. Cette ignorance est si forte, souvent si totale, quâ€™on la dirait voulue par le systeÌ€me, sinon par le reÌgime. Jâ€™ai souvent reÌfleÌchi aÌ€ ce que pourrait eÌ‚tre lâ€™eÌducation de lâ€™enfant.\nJe pense quâ€™il faudrait des eÌtudes de base, treÌ€s simples, ouÌ€ lâ€™enfant apprendrait quâ€™il existe au sein de lâ€™univers, sur une planeÌ€te dont il devra plus tard meÌnager les ressources, quâ€™il deÌpend de lâ€™air, de lâ€™eau, de tous les eÌ‚tres vivants, et que la moindre erreur ou la moindre violence risque de tout deÌtruire.\nIl apprendrait que les hommes se sont entretueÌs dans des guerres qui nâ€™ont jamais fait que produire dâ€™autres guerres, et que chaque pays arrange son histoire, mensongeÌ€rement, de facÌ§on aÌ€ flatter son orgueil.\nOn lui apprendrait assez du passeÌ pour quâ€™il se sente relieÌ aux hommes qui lâ€™ont preÌceÌdeÌ, pour quâ€™il les admire laÌ€ ouÌ€ ils meÌritent de lâ€™eÌ‚tre, sans sâ€™en faire des idoles, non plus que du preÌsent ou dâ€™un hypotheÌtique avenir.\nOn essaierait de le familiariser aÌ€ la fois avec les livres et les choses ; il saurait le nom des plantes, il connaiÌ‚trait les animaux sans se livrer aux hideuses vivisections imposeÌes aux enfants et aux treÌ€s jeunes adolescents sous preÌtexte de biologie. ; il apprendrait aÌ€ donner les premiers soins aux blesseÌs ; son eÌducation sexuelle comprendrait la preÌsence aÌ€ un accouchement, son eÌducation mentale la vue des grands malades et des morts.\nOn lui donnerait aussi les simples notions de morale sans laquelle la vie en socieÌteÌ est impossible, instruction que les eÌcoles eÌleÌmentaires et moyennes nâ€™osent plus donner dans ce pays.\nEn matieÌ€re de religion, on ne lui imposerait aucune pratique ou aucun dogme, mais on lui dirait quelque chose de toutes les grandes religions du monde, et surtout de celle du pays ouÌ€ il se trouve, pour eÌveiller en lui le respect et deÌtruire dâ€™avance certains odieux preÌjugeÌs.\nOn lui apprendrait aÌ€ aimer le travail quand le travail est utile, et aÌ€ ne pas se laisser prendre aÌ€ lâ€™imposture publicitaire, en commencÌ§ant par celle qui lui vante des friandises plus ou moins frelateÌes, en lui preÌparant des caries et des diabeÌ€tes futurs.\nIl y a certainement un moyen de parler aux enfants de choses veÌritablement importantes plus toÌ‚t quâ€™on ne le fait. Â»\n\nMarguerite Yourcenar, \"Les yeux ouverts.\"\nhttps://www.facebook.com/groups/1016065625806556/\n\nTÃ©lÃ©charger Outlook pour Android"
}