{
  "year": 2021,
  "seq": 68,
  "meta": {
    "date": "2021-04-29",
    "from": "maryvonne masseron-mandaba <maryvonnemm@hotmail.com>",
    "to": "Yannick Mandaba <y.mandaba@gmail.com>, Wadeekanya Soonthornsingha",
    "subject": "REÂ : CE1 EMILE Science lessons"
  },
  "proposals": [],
  "raw_excerpt": "ðŸ—• Date : 2021-04-29\nðŸ‘¤ From : maryvonne masseron-mandaba <maryvonnemm@hotmail.com>\nðŸ“¨ To   : Yannick Mandaba <y.mandaba@gmail.com>, Wadeekanya Soonthornsingha\n\t<beebeau89@gmail.com>\nðŸ§• Subject : REÂ : CE1 EMILE Science lessons\n---\nBien reu\n\nLE JEUDI JAI DANSE de 10  12 = 15-17h de BKK ( en prsentiel ou en zoom depuis 5 ans )\nDit de nombreuses fois.\nPauvre Tristan\n\nProvenance : Courrier pour Windows 10\n\nDe : Yannick Mandaba\nEnvoy le :jeudi 29 avril 2021 01:49\n : Wadeekanya Soonthornsingha; maryvonne masseron-mandaba\nObjet :Fwd: CE1 EMILE Science lessons\n\n\n---------- Forwarded message ---------\nFrom: Christopher ISAAC >\nDate: Wed, Apr 28, 2021, 2:32 PM\nSubject: CE1 EMILE Science lessons\nTo:\nCc: James LONGO >\n\nGood afternoon,\n\nPlease find attached a letter from Mr. James and myself regarding our Science topic during distance learning.\n\nKind regards,\n\nChris Isaac\n\n--\nMr. Christopher Isaac\nSection Internationale CE1\nLyce Franais International de Bangkok"
}