{
  "year": 2021,
  "seq": 93,
  "meta": {
    "date": "2021-08-23",
    "from": "maryvonne masseron-mandaba <maryvonnemm@hotmail.com>",
    "to": "\"y.mandaba@gmail.com\" <y.mandaba@gmail.com>",
    "subject": "Pour Tristan, merci d'imprimer le texte"
  },
  "proposals": [],
  "raw_excerpt": "ðŸ—• Date : 2021-08-23\nðŸ‘¤ From : maryvonne masseron-mandaba <maryvonnemm@hotmail.com>\nðŸ“¨ To   : \"y.mandaba@gmail.com\" <y.mandaba@gmail.com>\nðŸ§• Subject : Pour Tristan, merci d'imprimer le texte\n---\nIls quittent un  un le pays\nPour s'en aller gagner leur vie, loin de la terre o ils sont ns\nDepuis longtemps ils en rvaient\nDe la ville et de ses secrets, du formica et du cin\nLes vieux, a n'tait pas original\nQuand ils s'essuyaient machinal, d'un revers de manche les lvres\nMais ils savaient tous  propos\nTuer la caille ou le perdreau et manger la tomme de chvre\nPourtant, que la montagne est belle, comment peut-on s'imaginer\nEn voyant un vol d'hirondelles, que l'automne vient d'arriver ?\nAvec leurs mains dessus leurs ttes\nIls avaient mont des murettes jusqu'au sommet de la colline\nQu'importent les jours, les annes\nIls avaient tous l'me bien ne, noueuse comme un pied de vigne\nLes vignes, elles courent dans la fort\nLe vin ne sera plus tir, c'tait une horrible piquette\nMais il faisait des centenaires\n ne plus savoir qu'en faire, s'il ne vous tournait pas la tte\nPourtant, que la montagne est belle, comment peut-on s'imaginer\nEn voyant un vol d'hirondelles, que l'automne vient d'arriver ?\nDeux chvres et puis quelques moutons\nUne anne bonne et l'autre non, et sans vacances, et sans sorties\nLes filles veulent aller au bal\nIl n'y a rien de plus normal que de vouloir vivre sa vie\nLeur vie, ils seront flics ou fonctionnaires\nDe quoi attendre sans s'en faire que l'heure de la retraite sonne\nIl faut savoir ce que l'on aime\nEt rentrer dans son HLM, manger du poulet aux hormones\nPourtant, que la montagne est belle, comment peut-on s'imaginer\nEn voyant un vol d'hirondelles, que l'automne vient d'arriver ?\n\nTlcharger Outlook pour Android"
}