{
  "year": 2021,
  "seq": 16,
  "meta": {
    "date": "2021-02-02",
    "from": "\"Yannick Mandaba\" <y.mandaba@gmail.com>",
    "to": "\"'Marc MANDABA'\" <marcmandaba@hotmail.com>,",
    "subject": "RE: Recap Clerville et Bangui (31/01/2021)"
  },
  "proposals": [
    {
      "index": -16,
      "etiquette": "Dossier de bourse Tristan",
      "category": "MIN",
      "duration": "LT",
      "source": "AI",
      "score": 1,
      "matched_from": [
        "ai_new"
      ]
    }
  ],
  "raw_excerpt": "ğŸ—• Date : 2021-02-02\nğŸ‘¤ From : \"Yannick Mandaba\" <y.mandaba@gmail.com>\nğŸ“¨ To   : \"'Marc MANDABA'\" <marcmandaba@hotmail.com>,\n\t\"'docteur maryvonne masseron-mandaba mandaba mandaba'\" <maryvonnemm@hotmail.com>\nğŸ§• Subject : RE: Recap Clerville et Bangui (31/01/2021)\n---\nMerci Marc pour le travail.\n \nLe plan de masse devra vÃ©rifier quâ€™une 3eme maison est constructible (pas Â«Ã©ventuellement Â»), et bien vÃ©rifier la surface disponible pour chaque maison et terrain environnant.\n \nPleine propriÃ©tÃ© de ta maison oui bien sÃ»r frÃ©rot, ce serait le comble que tu avances tout sans avoir ta maison :)\n \nVeux-tu aussi dÃ©terminer les lignes pour une dÃ©limitation future des terrains ? \nDans un accord, mÃªme si pour le moment on ne parle que de ta maison et pas de la propriÃ©tÃ©?\nOn pourrait intÃ©grer cela dans une convention pour la postÃ©ritÃ©, comme base mÃªme informelle pour Ã©viter des chamailleries plus tard ?\nPour la cohÃ©rence.\nPour le moment je prÃ©fÃ¨re que la Â« terre Â» reste en indivision pour simplifier les dÃ©marches, donc tu auras la propriÃ©tÃ© de ta maison construite sur un terrain familial.\nMais je ne mâ€™oppose pas Ã  ce que lâ€™on garde la grande maison en indivision et si tu veux changer au cadastre en lots, une fois le plan de masse acceptÃ© et le clÃ´turage fait, moi je suis ok.\nOn peut faire les dÃ©marches aprÃ¨s les constructions ou dans 20 ans, mais je pense que nous devrions sans doute en parler avec ton plan de masse.\nPour la cohÃ©rence future et la paix des esprits, les autres un peu mais surtout nos enfants.\n\nA propos de la clÃ´ture mur de 3m :\nSi possible en bas de la forÃªt de Teks / Tecks mesurer les 3m depuis lâ€™EXTERIEUR afin de prÃ©server la vue.\nDonc Ã  la sortie du caniveau, sous le manguier, Ã  gauche le mur est sur du plat (3m ok), par contre Ã  droite on descend en biais et devant la foret de Teck le mur ne ferais que 1m20 ou 1m50 de lâ€™intÃ©rieur.\nUn peu comme le mur dâ€™enceinte de vitrÃ© sur la rue (3m de dehors mais simple balustrade de lâ€™intÃ©rieur).\nJusquâ€™Ã  1.5m câ€™est ok, on peut faire un planchÃ© surÃ©levÃ©, poser une table et des chaises, pour faire une terrasse en jardin.\nOui Maman, je rÃªve, mais donc en cas de petite maison simple sans Ã©tage de lâ€™autre cÃ´tÃ© de la forÃªt, je peux prÃ©voir u chemin de pierres plates qui mÃ¨ne Ã  un espace terrasse avec vue.\nDâ€™ailleurs en attendant, mÃªme pour ceux qui vont dans la maison de Marc, je trouve que ce sera une maniÃ¨re de garder une vue et terrasse si on loue la grandeâ€¦.\n \nJe te le dis avant dâ€™oublier. Que tu aies cette problÃ©matique en tÃªte le moment venu.\n \nPS : \nLe seul email Ã  utiliser pour moi câ€™est y.mandaba@gmail.com  \nJe ne sais mÃªme pas comment tes emails arrivent. \nJâ€™ai dÃ» un jour enregistrer ymandaba@gmail.com   pour les erreurs, mais je prÃ©fÃ¨re que tu utilises mon adresse principale correcte.\nCette autre pouvant Ã  tout moment Ãªtre supprimÃ©e puisque je nâ€™y vais jamais.\n \nMerci Marc.\n \n \nFrom: Marc MANDABA [mailto:marcmandaba@hotmail.com] \nSent: Tuesday, February 2, 2021 02:13\nTo: 'docteur maryvonne masseron-mandaba mandaba mandaba (maryvonnemm@hotmail.com)' ; maryvonne.masseron@free.fr; Yannick Mandaba ; Yannick Mandaba \nSubject: Recap Clerville et Bangui (31/01/2021)\n \nBonsoir,\n \nJe voulais faire un recap de notre discussion dâ€™hier, et fournir les Ã©lÃ©ments chiffrÃ©s promis sur Clerville.\n \n1)     Clerville\n \n-        DÃ©cision de cesser lâ€™indivision Yannick/Marc\n-        Lâ€™achat de Yannick sera financÃ© par une donation-partage de maman (montant 17 328 EUR, frais compris)\n*  Maman se rapproche de Me Chaudet pour ces deux procÃ©dures\n-        Concernant le bail rural Ã  CÃ©line, il sâ€™agirait de bail sur 9 ans Ã  mettre Ã  jour\n-        La vente sera programmÃ©e pour fin mars 2021\n \nCi-dessous les dÃ©tails de la transaction. En jaune les montants pour Yannick et Marc.\n \n \n\nSCI Clerville\n \n \n\t\t\t\t\t\n\nTerrain\n20.3703\nha\n\t\t\t\t\t\n\nNombre total de parts\n30555\nparts total\n\t\t\t\t\t\n\nLot par vendeur\n6111\nparts\n\t\t\t\t\t\n\nTotal en vente\n18333\nsoit 60% des parts\n\t\t\t\t\t\n\t\t\t\t\t\t\t\t\n\t\t\t\t\t\t\t\t\n\nPrix de Vente\nOffre Vendeur\nEvaluation A"
}