{
  "year": 2021,
  "seq": 135,
  "meta": {
    "date": "2021-12-13",
    "from": "maryvonne masseron-mandaba <maryvonnemm@hotmail.com>",
    "to": "Yannick Mandaba <y.mandaba@gmail.com>, Marc Mandaba",
    "subject": "Re: Patrimoine"
  },
  "proposals": [
    {
      "index": -135,
      "etiquette": "Appartement PergolÃ¨se (vente/location)",
      "category": "MIN",
      "duration": "LT",
      "source": "AI",
      "score": 1,
      "matched_from": [
        "ai_new"
      ]
    }
  ],
  "raw_excerpt": "ğŸ—• Date : 2021-12-13\nğŸ‘¤ From : maryvonne masseron-mandaba <maryvonnemm@hotmail.com>\nğŸ“¨ To   : Yannick Mandaba <y.mandaba@gmail.com>, Marc Mandaba\n\t<marcmandaba@gmail.com>\nğŸ§• Subject : Re: Patrimoine\n---\nJe ne vois rien de contributif au courriel de Yannick.\n\nClairement : je refuse de quitter ma chambre dans ma maison, jusqu'Ã  dÃ©mÃ©nagement dÃ©finitif dans une chambre chez Marc. Je refuse un transfert de chambre en chambre dans Toa Ziki. J'ai un gros volume d'affaires personnelles. Je n'entends pas perdre de temps, ni d'Ã©nergie en discussions.\nJe suis occupÃ©e Ã  finir l'entretien de mes biens en France. C'est autant pour moi que pour vous.\nQuand la pandÃ©mie sera maÃ®trisÃ©e, je me rendrai Ã  Bangui.\n\nSelon l'OMS, seulement 6% de la population est vaccinÃ©e en RCA, comme dans toute l'afrique subsahelienne. Les hypothÃ¨ses complotistes dominent. Les gens mal informÃ©s pensent que la pandÃ©mie a Ã©tÃ© inventÃ©e par les fabricants de vaccins. Tous les vaccins sont disponibles Ã  Bangui dans le public et le privÃ©. Des doses de vaccins, non injectÃ©es, seront dÃ©truites les jours prochains. MÃªme Christian n'a pas pu convaincre sa femme et sa fille Fanny, de se faire vacciner.\nDans ce monde dÃ©raisonnable, il faudrait que je me plie Ã  ce Ã  quoi la loi ne m'oblige pas.\n\nSi Yannick manque d'argent, je peux lui payer un loyer pour rester dans ma chambre.\nSi Marc veut une aide pour accÃ©lÃ©rer les travaux de sa maison, il n'a qu'Ã  rÃ©cupÃ©rer les loyers du Groupe Medical, puisque les transferts hors de la RCA, par western union ou autre sont encadrÃ©s et limitÃ©s.\nD'ailleurs, c'est un non-sens que dans la mÃªme famille, l'un apporte des euros Ã  Bangui, pendant que l'autre ne peut pas les rÃ©cupÃ©rer. On pourrait peut-Ãªtre s'arranger, de faÃ§on Ã  ce que cela diminue la dette de Yannick envers Marc.\nQuand je vois comment Jean-Paul se comporte vis-Ã -vis de ses soeurs et neveux, cela laisse Ã  rÃ©flÃ©chir.\n\nUn peu de gentillesse et de comprÃ©hension, moins de naÃ¯vetÃ© et plus d'objectivitÃ©, seraient bienvenues Ã  l'approche de NoÃ«l.\n\nMaman.\n\nLectures souhaitables, en lieu et place des reseaux sociaux =\nMinistÃ¨re des affaires sociales et de la santÃ©\nHaute AutoritÃ© de la SantÃ©\nOrganisation Mondiale de la SantÃ©\nUNICEF\nAssociation Francaise de Pediatrie (car on veut vacciner les enfants, pour atteindre plus de 80% d'infectÃ©s/vaccinÃ©s, alors que 10 millions d'adultes refusent de se faire vacciner, et 80 000 faux pass sanitaires circulent...)\nTÃ©lÃ©charger Outlook pour Android\n________________________________\nFrom: Yannick Mandaba \nSent: Monday, December 13, 2021 5:42:37 AM\nTo: Marc Mandaba \nCc: maryvonne masseron-mandaba \nSubject: Re: Patrimoine\n\nSuper Marc, ce que tu fais pour le patrimoine.\n\nJ'espÃ¨re que Maman va supporter le projet et rÃ©aliser les annÃ©es de stress, les possibilitÃ©s pour moi petit entrepreneur, et le manque Ã  gagner global qui auraient Ã©tÃ© Ã©vitÃ©s si on avait fait tout cela 15 ans plus tÃ´t.\n\nManque Ã  gagner en qualitÃ© de vie, paix familiale, opportunitÃ©s, temps de vie gaspillÃ©, car c'est du gaspillage.\n\nJ'espÃ¨re que cet email de Marc ne sera pas un prÃ©texte pour faire couler de l'encre.\n\nLaissons lÃ  les responsabilitÃ©s, nous les reconnaissons tous, puisque ce chantier est finalement ouvert...\n\nSans rÃ©ponse simple, logique et claire de Maman, Marc, tu as mon accord/vote pour faire selon tes moyens, ton temps et au plus facile.\n\nJe maintiens ma position comme quoi Maman, aura sa chambre toujours disponible, dans la copropriÃ©tÃ©, avec interruption minimale de sa fenÃªtre de visite dans la transition.\nNous devons prendre en compte ces avis sauf s'ils gÃ©nÃ¨rent des voyages, trop de travail, ou dÃ©penses, ou de perte de temps.\n\nBisous,\nYannick\n\nOn Mon, Dec 13, 2021, 8:54 AM > wrote:\n\nBonjour,\n\n\n\nMerci pour les nouvelles de PergolÃ¨se et Cergy. Je ne rÃ©agirai que sur Bangui qui est le dossier sur lequel je suis moteur.\n\n\n\nLâ€™intention est de rendre ce changement le plus acceptable pour tout le monde. Et autant que possible, jâ€™intÃ¨grerai les remarques de Maman. Mais il ne faut pas "
}