{
  "year": 2021,
  "seq": 34,
  "meta": {
    "date": "2021-03-05",
    "from": "maryvonne masseron-mandaba <maryvonnemm@hotmail.com>",
    "to": "\"david.allain@bpgo.fr\" <david.allain@bpgo.fr>",
    "subject": "Acte notariÃ© en faveur de mes 2 fils"
  },
  "proposals": [],
  "raw_excerpt": "ðŸ—• Date : 2021-03-05\nðŸ‘¤ From : maryvonne masseron-mandaba <maryvonnemm@hotmail.com>\nðŸ“¨ To   : \"david.allain@bpgo.fr\" <david.allain@bpgo.fr>\nðŸ§• Subject : Acte notariÃ© en faveur de mes 2 fils \n---\nMaryvonne Mandaba Masseron\n41 rue du puits mauger 35000 Rennes\n0680078113\n0783359723\n0299302000\n\nMonsieur,\nJe vous contacte de la part de Jean-Baptiste Crozon, qui nous avait assist en 2018, aprs le dcs de notre maman, pour la vente d'actions de son portefeuille. Vous avez pris sa suite.\nNotre agence de Vitr n'est pas toujours  la hauteur de nos attentes.\nDepuis plus d'un mois, je laisse des messages  ma conseillre de la BPGO Vitr, la messagerie automatique m'accuse rception, et me fait savoir qu'elle va me rappeler.\nOn n'a pas encore appris  se mfier...\nElle serait en congs de maternit !\nSa remplaante ne reoit que 3j par semaine.\nEt  17h00 pour le moment.\nJ'habite Rennes, et le couvre-feu ne me permet pas cet horaire.\nAuriez-vous un crneau pour me recevoir sur Rennes, de prfrence au centre-ville, mais je peux aller  st Grgoire si besoin.\n\nMon compte 10719421825\nCTO\nJe dsire donner 60 actions\nL'OREAL\nFR0000120321\nValeur +/- 18000 euros\nOu plus selon mon quota restant, hors droits de succession (avis du notaire).\n\nJe souhaite faire une donation-partage,  mes 2 fils\n\nYannick, yves, saka-kosso MANDABA\nn le 13 06 1974,  Pontoise\n+668782006022\ny.mandaba@gmail.com\n\nMarc Olona MANDABA\nn le 19 10 1978,  Pontoise\n+33611193955\nmarcmandaba@gmail.com\n\nPar leur compte d'indivision\nSociete Gnrale\nAgence Rennes Le Colombier\n14, Rue d'Isly 35000 Rennes\nIBAN FR76 3000 3017 1300 0500 3975 625\n\nMR M. MANDABA OU MR Y. MANDABA\n104 RUE JULES GUESDE 92300 LEVALLOIS-PERRET. ou :\n41 RUE DU PUITS MAUGER 35000 RENNES\n\nNotre Notaire, Matre Chaudet, recevra les documents, pour authentification, actes, et dclarations.\nMatre Dominique Chaudet\nVitr\ndc.chaudet.35142@notaires.fr\n\nJe vous remercie\nCordialement\nMaryvonne Mandaba Masseron\n\n\n\n\nTlcharger Outlook pour Android"
}