{
  "year": 2021,
  "seq": 28,
  "meta": {
    "date": "2021-02-24",
    "from": "maryvonne masseron-mandaba <maryvonnemm@hotmail.com>",
    "to": "D.CHAUDET OfficeNot <dc.chaudet.35142@notaires.fr>",
    "subject": "Donation-partage Ã  Y et M Mandaba/Clerville"
  },
  "proposals": [],
  "raw_excerpt": "ðŸ—• Date : 2021-02-24\nðŸ‘¤ From : maryvonne masseron-mandaba <maryvonnemm@hotmail.com>\nðŸ“¨ To   : D.CHAUDET OfficeNot <dc.chaudet.35142@notaires.fr>\nðŸ§• Subject : Donation-partage Ã  Y et M Mandaba/Clerville\n---\nMatre\nJe reviens vers vous pour le projet de mes enfants de racheter des parts de SCI Clerville,  leurs tantes ( Pommerolle, et Tranchevent) et cousins (enfants de Gilbert, reprsents par Remi Masseron) .\n\nIl me parait plus simple de faire une donation-partage  mes 2 enfants, dans leur indivision, cre lors de ma prcdente donation en 2008.\n\nIls en sont d'accord.\n\nEt Marc apportera ce qui manque  leur projet, pour sa part, et aussi pour son frre. Toujours au sein de leur indivision.\n\nIls en sont aussi d'accord.\n\nDonc, il n'est plus question de cesser leur indivision. Marc tant maintenant fix en France, et son frre Yannick en Thalande, Marc continuera  grer l'individion.\n\nIls sont d'accord pour cela aussi.\n\nDans la pratique,\n- veuillez me rappeler la quotit disponible restante, pour donation hors droits de succession,\n- veuillez me dire si les droits et honoraires peuvent tre inclus dans la donation,\n- et aussi, puisque je dois vendre des actions pour faire cette donation, veuillez me dire si je peux directement faire don de ces actions,  l'indivision de Yannick et Marc, et que eux, dans le cadre de leur indivision, les vendent, aprs la donation, en effaant ainsi la plus-value.\n\nJe vous remercie, en vous priant d'excuser notre petit changement de stratgie.\nCordialement\nMaryvonne Mandaba Masseron\n0783359723\n\n\n\n\n\n\n\nTlcharger Outlook pour Android"
}