{
  "year": 2021,
  "seq": 8,
  "meta": {
    "date": "2021-12-13",
    "from": "Yannick Mandaba <y.mandaba@gmail.com>",
    "to": "Marc Mandaba <marcmandaba@gmail.com>",
    "subject": "Re: Patrimoine"
  },
  "proposals": [
    {
      "index": -8,
      "etiquette": "Appartement PergolÃ¨se (vente/location)",
      "category": "MIN",
      "duration": "LT",
      "source": "AI",
      "score": 1,
      "matched_from": [
        "ai_new"
      ]
    }
  ],
  "raw_excerpt": "ðŸ—• Date : 2021-12-13\nðŸ‘¤ From : Yannick Mandaba <y.mandaba@gmail.com>\nðŸ“¨ To   : Marc Mandaba <marcmandaba@gmail.com>\nðŸ§• Subject : Re: Patrimoine\n---\nChacun retiendra l'absence de rÃ©ponse sur la question principale et\nurgente, Marc Ã©tant en Turquie, de savoir s'il fallait des meubles nouveaux\nou pas.\n\nAu lieu de cela, on a une absence de reconnaissance du gaspillage et de la\nmise en friche de la maison.\n\nDes considÃ©rations uniquement vis-Ã -vis des craintes d'une personne tandis\nque Marc met l'Ã©nergie, le temps et la prise de risque COVID Ã©voquÃ©s au\nservice de tous.\n\nMarc a donc mon soutien pour les dÃ©cisions par rapport Ã  ses contraintes\npersonnelles.\n\n\nPS:\nMarc n'est pas JP.\nNous essayons d'affronter notre histoire et de ne pas garder trop de\nrancÅ“urs ou de non dits. Nous essayons d'Ãªtre dans un esprit de mise en\nvaleur d'un hÃ©ritage commun et de solidaritÃ© dans la limite d'une justice\nau mÃ©rite et Ã  l'investissement.\nNous ne sommes que 2 dans la meute, ce qui simplifie les choses par rapport\nau phÃ©nomÃ¨ne Masseron.\nEssayons de ne pas agir sous la peur paralysante qui a fait de Toa-Ziki ce\nmusÃ©e en dÃ©crÃ©pitude.\n\nLa vie n'est pas si longue donc raisonnons dans le court terme avec la\nsituation prÃ©sente. Covid, crise de l'Ã©nergie et du climat, rien ne\ns'arrangera, au contraire. Faut faire avec pour se donner une chance de\nmieux gÃ©rer nos avoirs en zone CFA et surtout d'en profiter soit\nfinanciÃ¨rement soit en nature.\n\nBise.\n\nOn Mon, Dec 13, 2021, 1:07 PM Marc Mandaba  wrote:\n\n> Merci des rÃ©ponses rapides. Je retiens :\n> - pas besoin de meuble pour maman\n> - souhait d'attendre la \"maÃ®trise de la pandÃ©mie\": Clairement je\n> n'attendrai pas cet Ã©vÃ©nement chimÃ©rique. La fin des travaux sera\n> certainement en 2022.\n> - loyers du cabinet: comme deja expliquÃ©, je ne suis pas fermÃ© mais je ne\n> m'impliquerai qu'avec un mandat de gestion total. L'expÃ©rience de quelques\n> jours sur PergolÃ¨se m'a suffit.\n>\n> Je le rendrai Ã  nouveau Ã  Bangui probablement en fÃ©vrier. Je compte\n> maintenir le rythme actuel de 2 Ã  3 voyages par an.\n>\n> Merci\n>\n> Marc Mandaba\n> France +33 611193955 (WhatsApp)\n>\n> ------------------------------\n> *De :* maryvonne masseron-mandaba \n> *EnvoyÃ© :* lundi 13 dÃ©cembre 2021 Ã  8:33 AM\n> *Ã€ :* Yannick Mandaba; Marc Mandaba\n> *Objet :* Re: Patrimoine\n>\n> Je ne vois rien de contributif au courriel de Yannick.\n>\n> Clairement : je refuse de quitter ma chambre dans ma maison, jusqu'Ã \n> dÃ©mÃ©nagement dÃ©finitif dans une chambre chez Marc. Je refuse un transfert\n> de chambre en chambre dans Toa Ziki. J'ai un gros volume d'affaires\n> personnelles. Je n'entends pas perdre de temps, ni d'Ã©nergie en discussions.\n> Je suis occupÃ©e Ã  finir l'entretien de mes biens en France. C'est autant\n> pour moi que pour vous.\n> Quand la pandÃ©mie sera maÃ®trisÃ©e, je me rendrai Ã  Bangui.\n>\n> Selon l'OMS, seulement 6% de la population est vaccinÃ©e en RCA, comme dans\n> toute l'afrique subsahelienne. Les hypothÃ¨ses complotistes dominent. Les\n> gens mal informÃ©s pensent que la pandÃ©mie a Ã©tÃ© inventÃ©e par les fabricants\n> de vaccins. Tous les vaccins sont disponibles Ã  Bangui dans le public et le\n> privÃ©. Des doses de vaccins, non injectÃ©es, seront dÃ©truites les jours\n> prochains. MÃªme Christian n'a pas pu convaincre sa femme et sa fille Fanny,\n> de se faire vacciner.\n> Dans ce monde dÃ©raisonnable, il faudrait que je me plie Ã  ce Ã  quoi la loi\n> ne m'oblige pas.\n>\n> Si Yannick manque d'argent, je peux lui payer un loyer pour rester dans ma\n> chambre.\n> Si Marc veut une aide pour accÃ©lÃ©rer les travaux de sa maison, il n'a qu'Ã \n> rÃ©cupÃ©rer les loyers du Groupe Medical, puisque les transferts hors de la\n> RCA, par western union ou autre sont encadrÃ©s et limitÃ©s.\n> D'ailleurs, c'est un non-sens que dans la mÃªme famille, l'un apporte des\n> euros Ã  Bangui, pendant que l'autre ne peut pas les rÃ©cupÃ©rer. On pourrait\n> peut-Ãªtre s'arranger, de faÃ§on Ã  ce que cela diminue la dette de Yannick\n> envers Marc.\n> Quand je vois comment Jean-Paul se comporte vis-Ã -vis de ses soeurs "
}