{
  "year": 2021,
  "seq": 39,
  "meta": {
    "date": "2021-03-11",
    "from": "maryvonne masseron-mandaba <maryvonnemm@hotmail.com>",
    "to": "D.CHAUDET OfficeNot <dc.chaudet.35142@notaires.fr>, Office CHAUDET Accueil",
    "subject": "Re: Acte notariÃ© en faveur de mes 2 fils"
  },
  "proposals": [],
  "raw_excerpt": "ðŸ—• Date : 2021-03-11\nðŸ‘¤ From : maryvonne masseron-mandaba <maryvonnemm@hotmail.com>\nðŸ“¨ To   : D.CHAUDET OfficeNot <dc.chaudet.35142@notaires.fr>, Office CHAUDET Accueil\n\t<accueil.35142@notaires.fr>, Officenot CHAUDET REDACTION 1\n\t<redaction.35142@notaires.fr>\nðŸ§• Subject : Re: Acte notariÃ© en faveur de mes 2 fils \n---\nMaitre Chaudet,\nJe suis  la BPO de Vitr,\nDevant dcider du nombre d'actions concernes par ma Donation-partage  mes 2 fils yannick et Marc Mandaba, merci de me communiquer le montant de la quotit disponible restante, hors droits de succession.\nMonsieur Allain attend quant- lui, le numero du Compte Titre Ordinaire qui recevra la donation en actions, compte arrach au compte bancaire que leur indivision possde  la bansue Societe Generale. Marc doit s'en charger.\nAvec mes remerciements\nMaryvonne Mandaba Masseron\n0783359723\n\nTlcharger Outlook pour Android\n\n________________________________\nFrom: maryvonne masseron-mandaba \nSent: Thursday, March 11, 2021 4:38:33 PM\nTo: D.CHAUDET OfficeNot ; Office CHAUDET Accueil ; Officenot CHAUDET REDACTION 1 \nCc: david.allain@bpgo.fr ; y.mandaba@gmail.com ; marcmandaba ; maryvonne masseron-mandaba \nSubject: Re: Acte notari en faveur de mes 2 fils\n\nMaitre Chaudet,\nVeuillez prendre connaissance des 2 courriels ci-dessous\n\n________________________________\nFrom: maryvonne masseron-mandaba\nSent: Friday, March 5, 2021 4:50:23 PM\nTo: david.allain@bpgo.fr \nCc: D.CHAUDET OfficeNot ; y.mandaba@gmail.com ; marcmandaba \nSubject: Acte notari en faveur de mes 2 fils\n\nMaryvonne Mandaba Masseron\n41 rue du puits mauger 35000 Rennes\n0680078113\n0783359723\n0299302000\n\nMonsieur,\nJe vous contacte de la part de Jean-Baptiste Crozon, qui nous avait assist en 2018, aprs le dcs de notre maman, pour la vente d'actions de son portefeuille. Vous avez pris sa suite.\nNotre agence de Vitr n'est pas toujours  la hauteur de nos attentes.\nDepuis plus d'un mois, je laisse des messages  ma conseillre de la BPGO Vitr, la messagerie automatique m'accuse rception, et me fait savoir qu'elle va me rappeler.\nOn n'a pas encore appris  se mfier...\nElle serait en congs de maternit !\nSa remplaante ne reoit que 3j par semaine.\nEt  17h00 pour le moment.\nJ'habite Rennes, et le couvre-feu ne me permet pas cet horaire.\nAuriez-vous un crneau pour me recevoir sur Rennes, de prfrence au centre-ville, mais je peux aller  st Grgoire si besoin.\n\nMon compte 10719421825\nCTO\nJe dsire donner 60 actions\nL'OREAL\nFR0000120321\nValeur +/- 18000 euros\nOu plus selon mon quota restant, hors droits de succession (avis du notaire).\n\nJe souhaite faire une donation-partage,  mes 2 fils\n\nYannick, yves, saka-kosso MANDABA\nn le 13 06 1974,  Pontoise\n+668782006022\ny.mandaba@gmail.com\n\nMarc Olona MANDABA\nn le 19 10 1978,  Pontoise\n+33611193955\nmarcmandaba@gmail.com\n\nPar leur compte d'indivision\nSociete Gnrale\nAgence Rennes Le Colombier\n14, Rue d'Isly 35000 Rennes\nIBAN FR76 3000 3017 1300 0500 3975 625\n\nMR M. MANDABA OU MR Y. MANDABA\n104 RUE JULES GUESDE 92300 LEVALLOIS-PERRET. ou :\n41 RUE DU PUITS MAUGER 35000 RENNES\n\nNotre Notaire, Matre Chaudet, recevra les documents, pour authentification, actes, et dclarations.\nMatre Dominique Chaudet\nVitr\ndc.chaudet.35142@notaires.fr\n\nJe vous remercie\nCordialement\nMaryvonne Mandaba Masseron\n\nVitr,\nle11 mars 2021\nA Matre Chaudet\nNotaire  Vitr\nMaitre,\nMerci de vous souvenir de cette demande, qui devient urgente.\nJe suis  la BPO Vitr.\nMonsieur Allain de la BPO Rennes, service de gestion des patrimoines, a reu les documents utiles,\nIl lui manque juste le numero du compte-titre ordinaire, qui sera rcipiendaire de la donation-partage pour le compte de l'indivision Mandaba M et Mandaba Y.\nVeuillez me communiquer le quota restant disponible pour ma donation hors droits de succession.\nJe suis dans l'attente, pour dposer ce jour  la banque, le nombre des actions qui correspondent.\nAvec mes remerciements.\nMaryvonne Mandaba Masseron\n0783359723\n\n\nTlcharger Outlook pour Android"
}