{
  "year": 2021,
  "seq": 49,
  "meta": {
    "date": "2021-03-31",
    "from": "maryvonne masseron-mandaba <maryvonnemm@hotmail.com>",
    "to": "\"Yannick Mandaba (personal)\" <y.mandaba@gmail.com>",
    "subject": "Re: Notice Ã©tat civil ( paysage).pdf"
  },
  "proposals": [],
  "raw_excerpt": "ðŸ—• Date : 2021-03-31\nðŸ‘¤ From : maryvonne masseron-mandaba <maryvonnemm@hotmail.com>\nðŸ“¨ To   : \"Yannick Mandaba (personal)\" <y.mandaba@gmail.com>\nðŸ§• Subject : Re: Notice Ã©tat civil ( paysage).pdf\n---\nC'est juste pour le Notaire.\nPour l'acte qu'il doit regulariser.\nLa BPGO est OK car votre convention de banque SG est correcte et signe e-.\nJ'ai d refaire un dossier pour ma banque, car Chaudet n'avait rien transmis.\nC'est ok.\nLes titres seront transfr ce jour ou demain.\nLe cours tient bon. Allocution du pdt  20h.\n\nTlcharger Outlook pour Android\n\n________________________________\nFrom: Yannick Mandaba (personal) \nSent: Wednesday, March 31, 2021 3:48:33 PM\nTo: 'maryvonne masseron-mandaba' \nCc: 'Marc MANDABA' \nSubject: RE: Notice tat civil ( paysage).pdf\n\n\nJai renvoy  BPGO et  Chaudet:\n\n-        Passeports,\n\n-        livret de famille,\n\n-        formulaire rempli.\n\n\n\nCest bon. Que chacun fasse sa part et pas besoin de  tout organiser  pour renvoyer un formulaire.\n\n\n\nPar contre est-ce  Marc de pousser TON notaire ?\n\nIl tas dit quil ne souhaite pas intervenir avec ton notaire.\n\nL cela le concerne, oui mais bon Recevoir un don et pousser le notaire cest un peuhein ?!?\n\n\n\nBon,\n\nEnvoyons son formulaire et puis Marc ou moi on appelle pour leur dire de faire vite car les actions pourraient bouger cest tout.\n\nJe nai rien crit de spcial dans mon courrier.\n\nMarc peut glisser un mot dans ce sens sil veut.\n\n\n\nBise\n\nFrom: maryvonne masseron-mandaba [mailto:maryvonnemm@hotmail.com]\nSent: Wednesday, 31 March, 2021 2:35 PM\nTo: y.mandaba@gmail.com; Marc MANDABA \nSubject: Notice tat civil ( paysage).pdf\n\n\n\nBonjour,\n\n\n\nLe Notaire Chaudet, qui n'a pas encore rdig l'acte de donation partage, demande de nouvelles dmarches :\n\nRemplir ce document.\n\nFaire un signature lectronique.\n\nA noter qu'il ne m'a accord aucun RV depuis dcembre.\n\n\n\nCe Notaire a accord, hier soir, par mail , de procder au transfert, et qu'il rgularisera ensuite. Je contacte mr Allain de la BPGO, pour ce faire. Aujourd'hui, la valeur de la donation est de 22 890 e.\n\n\n\nMarc, auras-tu la gentillesse de tout organiser pour vous deux. Pour joindre l'Etude, tu as le choix entre le tlphone, ou les 4 adresses mail ( notaire, collaborateur, clerc, secretariat).\n\nMMM\n\n\n\nTlcharger Outlook pour Android"
}