{
  "year": 2021,
  "seq": 15,
  "meta": {
    "date": "2021-01-17",
    "from": "maryvonne masseron-mandaba <maryvonnemm@hotmail.com>",
    "to": "'BeeBaa' <beebeau89@gmail.com>, Yannick Mandaba <y.mandaba@gmail.com>",
    "subject": "Re: LeÃ§ons de Tristan"
  },
  "proposals": [
    {
      "index": -15,
      "etiquette": "Frais bus Tristan",
      "category": "MIN",
      "duration": "LT",
      "source": "AI",
      "score": 1,
      "matched_from": [
        "ai_new"
      ]
    }
  ],
  "raw_excerpt": "ðŸ—• Date : 2021-01-17\nðŸ‘¤ From : maryvonne masseron-mandaba <maryvonnemm@hotmail.com>\nðŸ“¨ To   : 'BeeBaa' <beebeau89@gmail.com>, Yannick Mandaba <y.mandaba@gmail.com>\nðŸ§• Subject : Re: LeÃ§ons de Tristan\n---\nElle pouvait faire 2 phrases\n1 j'utilise le tel de Tristan\n2 ma mre a un probleme de sant\n\nTlcharger Outlook pour Android\n\n________________________________\nFrom: Yannick Mandaba \nSent: Sunday, January 17, 2021 12:43:46 PM\nTo: 'maryvonne masseron-mandaba' ; 'BeeBaa' \nCc: 'Yannick Mandaba' ; maryvonne.masseron@free.fr \nSubject: RE: Leons de Tristan\n\n\nBees phone was broken (Bad update).\n\nShe used Tristan phone and she had to put her chipset (her phone number) inside Tristans phone.\n\nHer phone was fixed today.\n\n\n\nNo need for fast judgement and sarcasm.\n\n\n\n\n\nFrom: maryvonne masseron-mandaba [mailto:maryvonnemm@hotmail.com]\nSent: Sunday, January 17, 2021 17:09\nTo: BeeBaa \nCc: Yannick Mandaba ; maryvonne.masseron@free.fr\nSubject: Leons de Tristan\n\n\n\nHi, Bee. You need a computer, a tablet and 2 phones.  What a business woman.  You may be able to provide for your family ... As I do ... I am reassured.  So now give my grandson his phone for his French lessons\n\n\n\nTlcharger Outlook pour Android"
}