{
  "year": 2021,
  "seq": 136,
  "meta": {
    "date": "2021-12-13",
    "from": "maryvonne masseron-mandaba <maryvonnemm@hotmail.com>",
    "to": "Yannick Mandaba <y.mandaba@gmail.com>",
    "subject": "Re: Patrimoine"
  },
  "proposals": [
    {
      "index": -136,
      "etiquette": "Appartement Pergol√®se (vente/location)",
      "category": "MIN",
      "duration": "LT",
      "source": "AI",
      "score": 1,
      "matched_from": [
        "ai_new"
      ]
    }
  ],
  "raw_excerpt": "üóï Date : 2021-12-13\nüë§ From : maryvonne masseron-mandaba <maryvonnemm@hotmail.com>\nüì® To   : Yannick Mandaba <y.mandaba@gmail.com>\nüßï Subject : Re: Patrimoine\n---\nUn mail m'a √©chapp√©.\nO√π etait-il question de meubles ?\nSi vous parlez entre vous, n'oubliez pas de partager.\n\nT√©l√©charger Outlook pour Android\n________________________________\nFrom: Yannick Mandaba \nSent: Monday, December 13, 2021 9:12:33 AM\nTo: maryvonne masseron-mandaba \nCc: Marc Mandaba \nSubject: Re: Patrimoine\n\nEffectivement mon email √† √©chou√© dans son but d'obtenir une r√©ponse claire √† la question pos√©e (meubles?)  tout en rappelant \"d'o√π on parle\" pour √©viter des retours en arri√®re.\n\nDonc pas tr√®s contributif mais j'ai essay√©.\n\nOn Mon, Dec 13, 2021, 12:33 PM maryvonne masseron-mandaba > wrote:\nJe ne vois rien de contributif au courriel de Yannick.\n\nClairement : je refuse de quitter ma chambre dans ma maison, jusqu'√† d√©m√©nagement d√©finitif dans une chambre chez Marc. Je refuse un transfert de chambre en chambre dans Toa Ziki. J'ai un gros volume d'affaires personnelles. Je n'entends pas perdre de temps, ni d'√©nergie en discussions.\nJe suis occup√©e √† finir l'entretien de mes biens en France. C'est autant pour moi que pour vous.\nQuand la pand√©mie sera ma√Ætris√©e, je me rendrai √† Bangui.\n\nSelon l'OMS, seulement 6% de la population est vaccin√©e en RCA, comme dans toute l'afrique subsahelienne. Les hypoth√®ses complotistes dominent. Les gens mal inform√©s pensent que la pand√©mie a √©t√© invent√©e par les fabricants de vaccins. Tous les vaccins sont disponibles √† Bangui dans le public et le priv√©. Des doses de vaccins, non inject√©es, seront d√©truites les jours prochains. M√™me Christian n'a pas pu convaincre sa femme et sa fille Fanny, de se faire vacciner.\nDans ce monde d√©raisonnable, il faudrait que je me plie √† ce √† quoi la loi ne m'oblige pas.\n\nSi Yannick manque d'argent, je peux lui payer un loyer pour rester dans ma chambre.\nSi Marc veut une aide pour acc√©l√©rer les travaux de sa maison, il n'a qu'√† r√©cup√©rer les loyers du Groupe Medical, puisque les transferts hors de la RCA, par western union ou autre sont encadr√©s et limit√©s.\nD'ailleurs, c'est un non-sens que dans la m√™me famille, l'un apporte des euros √† Bangui, pendant que l'autre ne peut pas les r√©cup√©rer. On pourrait peut-√™tre s'arranger, de fa√ßon √† ce que cela diminue la dette de Yannick envers Marc.\nQuand je vois comment Jean-Paul se comporte vis-√†-vis de ses soeurs et neveux, cela laisse √† r√©fl√©chir.\n\nUn peu de gentillesse et de compr√©hension, moins de na√Øvet√© et plus d'objectivit√©, seraient bienvenues √† l'approche de No√´l.\n\nMaman.\n\nLectures souhaitables, en lieu et place des reseaux sociaux =\nMinist√®re des affaires sociales et de la sant√©\nHaute Autorit√© de la Sant√©\nOrganisation Mondiale de la Sant√©\nUNICEF\nAssociation Francaise de Pediatrie (car on veut vacciner les enfants, pour atteindre plus de 80% d'infect√©s/vaccin√©s, alors que 10 millions d'adultes refusent de se faire vacciner, et 80 000 faux pass sanitaires circulent...)\nT√©l√©charger Outlook pour Android\n________________________________\nFrom: Yannick Mandaba >\nSent: Monday, December 13, 2021 5:42:37 AM\nTo: Marc Mandaba >\nCc: maryvonne masseron-mandaba >\nSubject: Re: Patrimoine\n\nSuper Marc, ce que tu fais pour le patrimoine.\n\nJ'esp√®re que Maman va supporter le projet et r√©aliser les ann√©es de stress, les possibilit√©s pour moi petit entrepreneur, et le manque √† gagner global qui auraient √©t√© √©vit√©s si on avait fait tout cela 15 ans plus t√¥t.\n\nManque √† gagner en qualit√© de vie, paix familiale, opportunit√©s, temps de vie gaspill√©, car c'est du gaspillage.\n\nJ'esp√®re que cet email de Marc ne sera pas un pr√©texte pour faire couler de l'encre.\n\nLaissons l√† les responsabilit√©s, nous les reconnaissons tous, puisque ce chantier est finalement ouvert...\n\nSans r√©ponse simple, logique et claire de Maman, Marc, tu as mon accord/vote pour faire selon tes moyens, ton temps et au plus facile.\n\nJe maintiens ma position comme quoi Maman, aura sa chambre toujours disponible, da"
}