{
  "year": 2021,
  "seq": 104,
  "meta": {
    "date": "2021-09-10",
    "from": "maryvonne masseron-mandaba <maryvonnemm@hotmail.com>",
    "to": "\"y.mandaba@gmail.com\" <y.mandaba@gmail.com>",
    "subject": "d'autres paroles, selon les concerts..."
  },
  "proposals": [],
  "raw_excerpt": "ðŸ—• Date : 2021-09-10\nðŸ‘¤ From : maryvonne masseron-mandaba <maryvonnemm@hotmail.com>\nðŸ“¨ To   : \"y.mandaba@gmail.com\" <y.mandaba@gmail.com>\nðŸ§• Subject : d'autres paroles, selon les concerts...\n---\nC'est  l'cole, tagadagada Qu'on apprend les btises Qu'on apprend les btises\n\nLe grand Dd, poil poil au nez Devant toute la classe\nMonte au tableau, poil poil au dos Pour faire des grimaces\nZoum zoum zoum-zoum-zoum Zoum zouzoum zoum-zoum\nC'est  l'cole, tagadagada Qu'on apprend les btises Qu'on apprend les btises\n\nQuand le Julien, poil poil aux mains Raconte ses histoires\nElles sont si btes, poil aux chaussettes Qu'on pleure dans nos mouchoirs\nZoum zoum zoum-zoum-zoum Zoum zouzoum zoum-zoum\nC'est  l'cole, tagadagada Qu'on apprend les btises Qu'on apprend les btises\n\nEt la matresse, poil poil aux tresses Qui pousse des soupirs\nQuand Marion, poil au menton Attrape le fou rire\nZoum zoum zoum-zoum-zoum Zoum zouzoum zoum-zoum\nC'est  l'cole, tagadagada Qu'on apprend les btises Qu'on apprend les btises\n\nEt puis y a moi, poil poil au doigt Qui marche  quatre pattes\nPour chatouiller, poil au mollet Ma voisine de droite\nZoum zoum zoum-zoum-zoum Zoum zouzoum zoum-zoum\nC'est  l'cole, tagadagada Qu'on apprend les btises Qu'on apprend les btises\n\nY a la Thrse, poil  la chaise C'est la plus rigolote\nQuand elle s'asseye, poil aux orteils On lui voit sa culotte\nZoum zoum zoum-zoum-zoum Zoum zouzoum zoum-zoum\nC'est  l'cole, tagadagada Qu'on apprend les btises Qu'on apprend les btises\n\nHeureusement, poil poil aux dents Quand vient la sonnerie\nTout le monde s'arrte, poil aux baskets Par ici la sortie\nZoum zoum zoum-zoum-zoum Zoum zouzoum zoum-zoum\nC'est  l'cole, tagadagada Qu'on apprend les btises Qu'on apprend les btises\nZoum zoum zoum-zoum-zoum Zoum zouzoum zoum-zoum, ouais!\n\nHenri Ds"
}