{
  "year": 2021,
  "seq": 2,
  "meta": {
    "date": "2021-05-13",
    "from": "\"Yannick Mandaba \\(personal\\)\" <y.mandaba@gmail.com>",
    "to": "\"'maryvonne masseron-mandaba'\" <maryvonnemm@hotmail.com>",
    "subject": "RE: Acceptation rÃ©novation SÃ©jour PergolÃ¨se 2021"
  },
  "proposals": [
    {
      "index": -2,
      "etiquette": "Paiement salaires atelier",
      "category": "MIN",
      "duration": "LT",
      "source": "AI",
      "score": 1,
      "matched_from": [
        "ai_new"
      ]
    }
  ],
  "raw_excerpt": "ðŸ—• Date : 2021-05-13\nðŸ‘¤ From : \"Yannick Mandaba \\(personal\\)\" <y.mandaba@gmail.com>\nðŸ“¨ To   : \"'maryvonne masseron-mandaba'\" <maryvonnemm@hotmail.com>\nðŸ§• Subject : RE: Acceptation rÃ©novation SÃ©jour PergolÃ¨se 2021 \n---\n3300 EUROS UN COUP DE PEINTURE ????????????\n\nIl lui faut combien de mois pour peindre a au mec ?\n\n9 mois de salaire Thai\n\n \n\n \n\nFrom: maryvonne masseron-mandaba [mailto:maryvonnemm@hotmail.com] \nSent: Thursday, 13 May, 2021 9:33 PM\nTo: Abrassartgreg@gmail.com\nCc: maryvonne masseron-mandaba ; Yannick Mandaba\n; Marc MANDABA ; MYM MANDABA\nSCI \nSubject: Acceptation rnovation Sjour Pergolse 2021 \n\n \n\n\n\n\n \n\n \n\nTlcharger Outlook pour Android"
}