{
  "year": 2021,
  "seq": 140,
  "meta": {
    "date": "2021-07-06",
    "from": "maryvonne masseron mandaba <maryvonnemm@hotmail.fr>",
    "to": "\"Yannick Mandaba (personal)\" <y.mandaba@gmail.com>",
    "subject": "Re: 28FDEA59-BCB2-47D3-9096-AC4F2CE89DB5.pdf"
  },
  "proposals": [],
  "raw_excerpt": "ðŸ—• Date : 2021-07-06\nðŸ‘¤ From : maryvonne masseron mandaba <maryvonnemm@hotmail.fr>\nðŸ“¨ To   : \"Yannick Mandaba (personal)\" <y.mandaba@gmail.com>\nðŸ§• Subject : Re: 28FDEA59-BCB2-47D3-9096-AC4F2CE89DB5.pdf\n---\nJe la tolre, elle croit que je l'approuve... 13h d'cran dans la journe d'hier.\n\nTlcharger Outlook pour Android\n\n________________________________\nFrom: Yannick Mandaba (personal) \nSent: Thursday, May 20, 2021 2:56:59 PM\nTo: 'maryvonne masseron mandaba' \nSubject: RE: 28FDEA59-BCB2-47D3-9096-AC4F2CE89DB5.pdf\n\n\nImprim dis lui de faire la deuxime. La premire est trop facile.\n\nIl doit venir voir son papa.\n\n\n\nIl avais les yeux noirs du jouer trop aux jeux aujourdhui.\n\nTu congdies sa mre et cest le rsultat.\n\nTolre l et ce sera mieux.\n\n\n\nSinon il doit venir avec moi.\n\nSa mre et toi ntes pas capable de sacrifier vos diffrents pour lui.\n\n\n\nFrom: maryvonne masseron mandaba [mailto:maryvonnemm@hotmail.fr]\nSent: Thursday, 20 May, 2021 6:40 PM\nTo: Yannick Mandaba ; BeeBaa \nSubject: 28FDEA59-BCB2-47D3-9096-AC4F2CE89DB5.pdf\n\n\n\nPersonne ne peut l'aider\n\nPauvre Tristan\n\n\n\nTlcharger Outlook pour Android"
}