{
  "year": 2021,
  "seq": 85,
  "meta": {
    "date": "2021-05-31",
    "from": "maryvonne masseron-mandaba <maryvonnemm@hotmail.com>",
    "to": "Yannick Mandaba <y.mandaba@gmail.com>",
    "subject": "Re: LFIB / Avance - Relance"
  },
  "proposals": [
    {
      "index": -85,
      "etiquette": "Dossier de bourse Tristan",
      "category": "MIN",
      "duration": "LT",
      "source": "AI",
      "score": 1,
      "matched_from": [
        "ai_new"
      ]
    }
  ],
  "raw_excerpt": "ðŸ—• Date : 2021-05-31\nðŸ‘¤ From : maryvonne masseron-mandaba <maryvonnemm@hotmail.com>\nðŸ“¨ To   : Yannick Mandaba <y.mandaba@gmail.com>\nðŸ§• Subject : Re: LFIB / Avance - Relance\n---\nJe ne comprends pas ...\nFais le compte de ce que tu as pay au lycee, pour l'anne 2020 - 2021.\n(copie de l'ordre de virement)\nDe mon ct, je regarde.\n\nDemain, classe  ton bureau,  15h30\nMercredi aussi  15h30\nJeudi est fri\nVendredi je ne sais pas\n\nN'en veut pas  Tristan , il a du mal  grer sa mre, il la protge. Il t'aime beaucoup, mais comme avec moi, il commence par s'opposer, par pudeur des sentiments.\n\nMaman\n\nTlcharger Outlook pour Android\n\n________________________________\nFrom: Yannick Mandaba \nSent: Monday, May 31, 2021 9:07:59 PM\nTo: maryvonne masseron-mandaba \nSubject: Fwd: LFIB / Avance - Relance\n\nOh oh... Pure je sors  peine vdu cambouis. On en parle ce weekend.\nBude\n\n---------- Forwarded message ---------\nFrom: LFIB Comptabilit >\nDate: Mon, May 31, 2021, 3:32 PM\nSubject: LFIB / Avance - Relance\nTo: >\n\n\n\nMadame,\n\nMonsieur,\n\nChers parents,\n\nNous souhaitons avant tout, vous informer que nous attendons la confirmation de la fin de l'Enseignement A Distance pour calculer de manire dfinitive les remboursements de la cantine. Les avoirs pour les AES et preuves Cambridge sont dj connus.\n\nDs que le montant de la cantine  rembourser sera connu et dfini, nous effectuerons un unique virement sur votre compte bancaire d'ici fin juin/dbut juillet au plus tard reprenant l'ensemble des avoirs que nous vous devons.\n\nCependant, nous souhaitons porter  votre connaissance qu' la lecture de nos livres, il apparat que les sommes suivantes reste (nt) due(s) :\n\n-FS                        75210.74\n\n-DPI                    0\n\n-Orthophonie    0\n\n-AES                    0\n\n-AS         0\n\n-Aide aux devoirs             0\n\nTotal                     75210.74\n\nAussi nous vous serions gr de bien vouloir nous rgler cette somme dans les plus brefs dlais.\n\nDans le cas o vous auriez dj rgl la (les) facture (s), nous vous remercions de nous faire parvenir le justificatif  comptabilite@lfib.ac.th.\n\nA dfaut, votre rglement ne pourra tre identifi et enregistr correctement.\n\n\n\nEnfin si vous rencontriez des difficults, nous sommes disposs  tablir des modalits de paiement correspondant  votre situation.\n\nMerci de nous contacter galement, dans ce cas,  comptabilite@lfib.ac.th.\n\n\n\nCordialement,\n\n\n\n\n\n\n\nBien cordialement,"
}