{
  "year": 2021,
  "seq": 66,
  "meta": {
    "date": "2021-04-14",
    "from": "maryvonne masseron-mandaba <maryvonnemm@hotmail.com>",
    "to": "\"Yannick Mandaba (personal)\" <y.mandaba@gmail.com>",
    "subject": "Re: TRISTAN-Fiches-Test-PDF"
  },
  "proposals": [],
  "raw_excerpt": "ðŸ—• Date : 2021-04-14\nðŸ‘¤ From : maryvonne masseron-mandaba <maryvonnemm@hotmail.com>\nðŸ“¨ To   : \"Yannick Mandaba (personal)\" <y.mandaba@gmail.com>\nðŸ§• Subject : Re: TRISTAN-Fiches-Test-PDF\n---\nNous avons bien travaill ce matin, 20mn orthographe, 20mn quizz, 20mn lecture anglais, puis des jeux. Il est tres mthodique et content. Je vais regarder les fiches. Je dors un peu avant la marche car mes voisins au dessus 3 garnements japonais, sont bruyants ds 6h du matin...\n\nTlcharger Outlook pour Android\n\n________________________________\nFrom: Yannick Mandaba (personal) \nSent: Wednesday, April 14, 2021 1:33:55 PM\nTo: maryvonnemm@hotmail.com \nSubject: TRISTAN-Fiches-Test-PDF\n\n\nBonjour Maman,\n\n\n\nVoici des fiches de test (pas des leons), pour illustrer et faire u peu plus dexercices avec vos leons.\n\nA prsenter  Tristan non pas comme des leons mais comme des TEST de VALIDATION.\n\n\n\nDonc sil russit cela on considre le niveau acquis.\n\nBien lui dire que cest niveau CE2 CM1 CM2\n\nDonc tout ici est au-dessus du niveau de sa classe.\n\n\n\nJe peux imprimer, toi aussi.\n\nJai tout mis en PDF pour faciliter limpression rapide.\n\nJe vais faire un classeur et sparer les blocs pour quil trouve facilement\n\n\n\nCertaines leon sont trop faciles pour lui, ne pas lui imposer de tout refaire.\n\nOTHORGRAPHE  Autodidacte CE2 CM1 CM2 sont tous de la mme forme\n\nA faire  loral, ou crit comme il veut.\n\n\n\nBisous"
}