{
  "year": 2021,
  "seq": 75,
  "meta": {
    "date": "2021-05-11",
    "from": "maryvonne masseron-mandaba <maryvonnemm@hotmail.com>",
    "to": "'Wadeekanya Soonthornsingha' <beebeau89@gmail.com>, \"Yannick Mandaba",
    "subject": "Re: Tristan M. Evaluation de Vocabulaire"
  },
  "proposals": [],
  "raw_excerpt": "ðŸ—• Date : 2021-05-11\nðŸ‘¤ From : maryvonne masseron-mandaba <maryvonnemm@hotmail.com>\nðŸ“¨ To   : 'Wadeekanya Soonthornsingha' <beebeau89@gmail.com>, \"Yannick Mandaba\n (personal)\" <y.mandaba@gmail.com>\nðŸ§• Subject : Re: Tristan M. Evaluation de Vocabulaire\n---\nSi on m'avait laissÃ© prÃ©parer les exercices Ã  l'oral, avec lui, il n'aurait pas eu ce sentiment d'injustice.... S'il se trompe alors qu'il a Ã©tudiÃ©, il l'admet. Sinon il ne comprend rien car il ne parle plus le franÃ§ais.\n\nTÃ©lÃ©charger Outlook pour Android\n\n________________________________\nFrom: Yannick Mandaba (personal) \nSent: Tuesday, May 11, 2021 6:27:21 AM\nTo: 'Wadeekanya Soonthornsingha' ; maryvonne masseron-mandaba \nSubject: FW: Tristan M. Evaluation de Vocabulaire\n\n\n\n\n\n\nFrom: Vannessa VANNEAU [mailto:v.vanneau@lfib.ac.th]\nSent: Tuesday, 11 May, 2021 10:49 AM\nTo: Yannick Mandaba (personal) \nSubject: Re: Tristan M. Evaluation de Vocabulaire\n\n\n\nBonjour,\n\n\n\nOui vous avez raison, je me suis trompÃ©e de cible.\n\nLe rÃ©sultat ne change pas pour Tristan car je lui ai mis A dans la note finale.\n\n\n\nMerci Ã  vous et bonne journÃ©e.\n\nVannessa\n\n\n\nLe mar. 11 mai 2021 Ã  09:12, Yannick Mandaba (personal) > a Ã©crit :\n\nBonjour,\n\n\n\nDans lâ€™exercice 5) il fallait le synonyme de COPAIN et non pas du verbe.\n\nMerci de confirmer.\n\nTristan ne comprends pas pourquoi il est corrigÃ©.\n\n\n\n[cid:17959883dff4cd34f0f1]\n\n\n\nBonne journÃ©e Ã  vous.\n\n\n\n\n\nCorrection synonymes :\n\n=================\n\n\n\nTristan,\n\nLe foyer c'est le feu.\n\nDans l'ancien temps il n'y avait pas d'Ã©lectricitÃ©.\n\nChaque maison avais une cheminÃ©e avec du feu pour faire la cuisine et pour se rÃ©chauffer.\n\n\n\nSur ce feu. Y avait une marmite. Et dans la marmite le fermier j'Ã©tais des lÃ©gumes, de la viande de temps en temps... Et Ã§a cuisait toute la journÃ©e.\n\nC'est la soupe, et le soir on mangeait cette soupe.\n\nLe souper.\n\n\n\nDans le village, le nombre de feu = le nombre de maisons = notre de familles\n\nC'est pour Ã§a que\n\nMaison = Foyer\n\n\n\n\n\nYannick Mandaba\n\n\n\nFrom: Wadeekanya Soonthornsingha (Bee) [mailto:beebeau89@gmail.com]\nSent: Tuesday, 11 May, 2021 8:40 AM\nTo: Yannick >\nSubject: Fwd: Tristan M. Evaluation de Vocabulaire\n\n\n\n\n\nBest Regards,\n\n\n\nWadeekanya S. (Bee)\n\nBegin forwarded message:\n\nFrom: Vannessa VANNEAU >\nDate: 11 May BE 2564 00:52:39 GMT+7\nTo: \"Wadeekanya Soonthornsingha (Bee)\" >\nSubject: Re: Tristan M. Evaluation de Vocabulaire\n\nï»¿\n\nTrÃ¨s bon travail Tristan !\n\nVoici la correction de ton Ã©valuation.\n\n\n\nA demain.\n\nVannessa.\n\n\n\n\n\nLe lun. 10 mai 2021 Ã  15:59, Wadeekanya Soonthornsingha (Bee) > a Ã©crit :\n\nDear Mrs. VANNEAU,\n\nGood afternoon. Tristan has done it at 15:20-15:45. I hope itâ€™s ok for the time wise.\n\n\n\n\n\n\nBest Regards,\n\nWadeekanya S. (Bee)\n\n--\n\nVannessa Vanneau\nLFIB - Cycle 2 - CE1 D\nv.vanneau@lfib.ac.th\n\n[cid:17959883dff4cd34f0f1][cid:17959883dffb11963102]\n\n--\n\nVannessa Vanneau\nLFIB - Cycle 2 - CE1 D\nv.vanneau@lfib.ac.th"
}