{
  "year": 2021,
  "seq": 9,
  "meta": {
    "date": "2021-12-13",
    "from": "Yannick Mandaba <y.mandaba@gmail.com>",
    "to": "Marc Mandaba <marcmandaba@gmail.com>",
    "subject": "Re: Patrimoine"
  },
  "proposals": [
    {
      "index": -9,
      "etiquette": "Appartement PergolÃ¨se (vente/location)",
      "category": "MIN",
      "duration": "LT",
      "source": "AI",
      "score": 1,
      "matched_from": [
        "ai_new"
      ]
    }
  ],
  "raw_excerpt": "ðŸ—• Date : 2021-12-13\nðŸ‘¤ From : Yannick Mandaba <y.mandaba@gmail.com>\nðŸ“¨ To   : Marc Mandaba <marcmandaba@gmail.com>\nðŸ§• Subject : Re: Patrimoine\n---\nSuper Marc, ce que tu fais pour le patrimoine.\n\nJ'espÃ¨re que Maman va supporter le projet et rÃ©aliser les annÃ©es de stress,\nles possibilitÃ©s pour moi petit entrepreneur, et le manque Ã  gagner global\nqui auraient Ã©tÃ© Ã©vitÃ©s si on avait fait tout cela 15 ans plus tÃ´t.\n\nManque Ã  gagner en qualitÃ© de vie, paix familiale, opportunitÃ©s, temps de\nvie gaspillÃ©, car c'est du gaspillage.\n\nJ'espÃ¨re que cet email de Marc ne sera pas un prÃ©texte pour faire couler de\nl'encre.\n\nLaissons lÃ  les responsabilitÃ©s, nous les reconnaissons tous, puisque ce\nchantier est finalement ouvert...\n\nSans rÃ©ponse simple, logique et claire de Maman, Marc, tu as mon\naccord/vote pour faire selon tes moyens, ton temps et au plus facile.\n\nJe maintiens ma position comme quoi Maman, aura sa chambre toujours\ndisponible, dans la copropriÃ©tÃ©, avec interruption minimale de sa fenÃªtre\nde visite dans la transition.\nNous devons prendre en compte ces avis sauf s'ils gÃ©nÃ¨rent des voyages,\ntrop de travail, ou dÃ©penses, ou de perte de temps.\n\nBisous,\nYannick\n\nOn Mon, Dec 13, 2021, 8:54 AM  wrote:\n\n> Bonjour,\n>\n>\n>\n> Merci pour les nouvelles de PergolÃ¨se et Cergy. Je ne rÃ©agirai que sur\n> Bangui qui est le dossier sur lequel je suis moteur.\n>\n>\n>\n> Lâ€™intention est de rendre ce changement le plus acceptable pour tout le\n> monde. Et autant que possible, jâ€™intÃ¨grerai les remarques de Maman. Mais il\n> ne faut pas confondre droit et caprice ; et il nâ€™y a pas de droit sans\n> devoir.\n>\n>\n>\n> Concernant la transition de la chambre actuelle de maman vers sa nouvelle\n> chambre dans la nouvelle maison, cela devra se faire en cohÃ©rence avec le\n> planning travaux. Il ne me semble pas dÃ©raisonnable de demander un effort\n> de transition alors que maman ne sâ€™est pas rendue Ã  Bangui depuis 2 ans et\n> quâ€™il sâ€™agit des premiers travaux de rÃ©fection en 40 ans. Il faut\n> diffÃ©rencier droit et caprice.\n>\n>\n>\n> Concernant le paiement des factures, la proposition de maman est\n> littÃ©ralement irresponsable, puisquâ€™il sâ€™agit de rejeter la responsabilitÃ©\n> sur autrui. Les personnes responsables et propriÃ©taires de ce bien sont\n> dans cet email. Il nâ€™est pas admissible dâ€™avoir lâ€™Ã©lectricitÃ© coupÃ©e, ou le\n> gardien non payÃ©, car Yangue ne paie pas. 3 ans de retard de paiement, la\n> messe est dite. Il nâ€™y a pas de droit sans devoir, et le devoir ne se dilue\n> pas. Yangue nâ€™a rien Ã  faire dans la gestion de notre maison.\n>\n>\n>\n> Sujet accessoire : je suis Ã  Istanbul pour lâ€™achat de fournitures et\n> Ã©quipements nÃ©cessaires. Je me suis dit que maman voudrait garder tous les\n> meubles de sa chambre. Merci de mâ€™indiquer si je dois au contraire prÃ©voir\n> lâ€™achat dâ€™un nouveau lit, tables de chevets, etc... En clair, est-ce que\n> maman veut une nouvelle chambre, ou recycler les meubles de sa chambre ?\n> DÃ©cision trÃ¨s rapide demandÃ©e, dâ€™ici mardi car je confirme ma commande\n> avant de partir. (NB : je prÃ©vois a minima un placard intÃ©grÃ© pour la\n> chambre de maman).\n>\n>\n>\n> Merci\n>\n> Marc\n>\n>\n>\n> Marc Mandaba\n> France +33 611193955 (WhatsApp)\n>\n>\n> ------------------------------\n>\n> *De :* maryvonne masseron-mandaba \n> *EnvoyÃ© :* dimanche 5 dÃ©cembre 2021 Ã  2:12 PM\n> *Ã€ :* y.mandaba@gmail.com; marcmandaba\n> *Objet :* Patrimoine\n>\n>\n>\n> Bonjour,\n>\n>\n>\n> 1. La donation Partage\n>\n> Concernant la donation des actions l'oreal, Ã  l'indivision Yannick-Marc,\n>\n> Pour racheter des parts de Clerville Ã  Laval\n>\n> Je relance Maitre Chaudet et sa collaboratrice, madame Mary, pour acter\n> cette donation, datant de fevrier et mars 2021.\n>\n> J'ai Rdv ce mercredi 8 dÃ©cembre.\n>\n> Pour rÃ©gularisation...\n>\n>\n>\n> 2. Pour l'appartement de Cergy,\n>\n> J'etais Ã  Pontoise ce jeudi 2 et vendredi 3 dÃ©cembre.\n>\n> Concernant le syndic, il s'agit de s'opposer au rachat, par la\n> collectivitÃ© de commune, d'une partie du bois, pour faire des parking.\n>\n> Concernant la gestion, il fallait que je reprenne les "
}