{
  "year": 2021,
  "seq": 17,
  "meta": {
    "date": "2021-02-05",
    "from": "\"Yannick Mandaba\" <y.mandaba@gmail.com>",
    "to": "\"'Marc MANDABA'\" <marcmandaba@hotmail.com>,",
    "subject": "RE: Recap Clerville et Bangui (31/01/2021)"
  },
  "proposals": [
    {
      "index": -17,
      "etiquette": "Dossier de bourse Tristan",
      "category": "MIN",
      "duration": "LT",
      "source": "AI",
      "score": 1,
      "matched_from": [
        "ai_new"
      ]
    }
  ],
  "raw_excerpt": "ðŸ—• Date : 2021-02-05\nðŸ‘¤ From : \"Yannick Mandaba\" <y.mandaba@gmail.com>\nðŸ“¨ To   : \"'Marc MANDABA'\" <marcmandaba@hotmail.com>,\n\t\"'docteur maryvonne masseron-mandaba mandaba mandaba'\" <maryvonnemm@hotmail.com>\nðŸ§• Subject : RE: Recap Clerville et Bangui (31/01/2021)\n---\nSalut,\n \nSuper tes plans et les accÃ¨s discrets Ã  la terrasse puis par lâ€™arriÃ¨re le long du mur dâ€™enceinte. Tip top.\n \nQuand tu y seras ma remarque es toujours la mÃªme : juste voir pour plus tard comment rendre plus attrayant la Â« forÃªt Â».\nJe sais que ce nâ€™est pas ta prioritÃ© mais ce cÃ´tÃ© me choque un peu beautÃ©/sÃ©curitÃ©.\n \nLe mur de soutient en pierres câ€™est un bon dÃ©but. \nPar contre il faudrait quâ€™il soit vertical pour la sÃ©curitÃ©.\nSi, pour la fonctionnalitÃ© de soutien, il doit Ãªtre en escalier, alors prÃ©voir de planter/couler des poteaux en retrait.\nEn aval y arrimer un mur en brique classique  vertical, avec peut-Ãªtre une armature (quadrillage en bÃ©ton armÃ©) de maniÃ¨re Ã  pourvoir remplir/combler avec de la terre sans lâ€™Ã©ventrer.\nAu final obtenir un mur vertical de 3m rÃ¨glementaire ONU vu du bas de la pente extÃ©rieur, et cÃ´tÃ© intÃ©rieur juste 1.2m/1.5m, si barbelÃ©s obligatoire ils seront cÃ´tÃ© extÃ©rieur.\nLâ€™idÃ©e est dâ€™obtenir un Â« point vue Â» avec un sol pour rendre cette partie agrÃ©able qui ajoute du charme global Ã  la propriÃ©tÃ©.\nPour lâ€™instant câ€™est un chancre ce coin lÃ .\n \nTu as dit pas de dÃ©tails mais le plan de ce mur doit quand mÃªme Ãªtre pensÃ© en vue du rÃ©sultat final.\nSi ce nâ€™est pas clair je ferai un dessin.\nSi ce nâ€™est pas techniquement valable tu me diras ce qui est possible.\n \n \nLe reste est parfait, ta maison sera trÃ¨s belle.\nJe nâ€™ai rien Ã  dire de plus.\n \nBise Yannick.\n \nFrom: Marc MANDABA [mailto:marcmandaba@hotmail.com] \nSent: Thursday, February 4, 2021 20:06\nTo: Yannick Mandaba ; 'docteur maryvonne masseron-mandaba mandaba mandaba' \nSubject: RE: Recap Clerville et Bangui (31/01/2021)\n \nBonjour,\n \nPour information et commentaires, ci-joint un document de cadrage qui sert de base Ã  mes discussions avec lâ€™archi et Leprevost.\n \nToute suggestion est bienvenue. Nous ne sommes pas encore au niveau des dÃ©tails mais des considÃ©rations gÃ©nÃ©rales. \nEtant donnÃ© le phasage, nous aurons largement le temps de dÃ©finir les prestations de rÃ©novation de TOA ZIKI durant les mois qui viennent.\n \nMerci\nMarc \nPS : Les petits travaux de rafraichissement extÃ©rieur reprendront lundi aprÃ¨s un mois dâ€™arrÃªt Ã  cause des Ã©vÃ¨nements. \n \nMarc Mandaba\nMobile France  +33 6 1119 3955 (WhatApp)\n \nFrom: Yannick Mandaba  > \nSent: 02 February 2021 13:57\nTo: 'Marc MANDABA'  >; 'docteur maryvonne masseron-mandaba mandaba mandaba'  >\nSubject: RE: Recap Clerville et Bangui (31/01/2021)\n \nOK,compris, dâ€™accord.\n \nFrom: Marc MANDABA [mailto:marcmandaba@hotmail.com] \nSent: Tuesday, February 2, 2021 19:26\nTo: Yannick Mandaba  >; 'docteur maryvonne masseron-mandaba mandaba mandaba'  >\nCc: y.mandaba@gmail.com  \nSubject: Re: Recap Clerville et Bangui (31/01/2021)\n \nEntendu. \n \nLe \"Ã©ventuellement\" se rapporte Ã  l'Ã©ventualitÃ© de l'extension. Le plan de masse comprendra bien l'implantation de la 3eme maison.\n \nConcernant le statut du terrain et des bÃ¢tis, je pense  que l'on se dirige vers un rÃ©gime de copropriÃ©tÃ© qui permet de gÃ©rer des bien particulier et des parties communes en crÃ©ant des lots sans trop toucher (je pense) au cadastre. Il faut faire attention Ã  ne pas trop jouer avec le cadastre centrafricain, c'est lorsque qu'il y a ce type de modifications que les magouilles arrivent. Par ailleurs, le rÃ¨glement de copro et rÃ¨glement intÃ©rieur permettront de mieux gÃ©rer les locataires et les charges communes. \nJe regarde cela. Il faudra un notaire ou avocat compÃ©tent comme discutÃ© hier. \n \nPour le reste, on pourra parler des details d'implantation aprÃ¨s plan de masse et mÃ©trÃ©s/topo. \n \nMerci.\n \nMarc Mandaba\nFrance +33 611193955\nTurkey +90 5432459527\n \n  _____  \n\nDe : Yannick Mandaba  >\nEnvoyÃ© : mardi 2 fÃ©vrier 2021 Ã  10:37 AM\nÃ€ : 'Marc MANDABA'; 'docteur maryvonne masseron-mandaba mandaba mandaba'\nCc : y.m"
}