{
  "year": 2021,
  "seq": 5,
  "meta": {
    "date": "2021-11-03",
    "from": "maryvonne.masseron@free.fr",
    "to": "Yannick Mandaba <y.mandaba@gmail.com>",
    "subject": "Ã  imprimer \"paroles \"si j'Ã©tais PrÃ©sident \""
  },
  "proposals": [],
  "raw_excerpt": "ğŸ—• Date : 2021-11-03\nğŸ‘¤ From : maryvonne.masseron@free.fr\nğŸ“¨ To   : Yannick Mandaba <y.mandaba@gmail.com>\nğŸ§• Subject : Ã  imprimer \"paroles \"si j'Ã©tais PrÃ©sident \" \n---\nSi j'Ã©tais prÃ©sident\nGÃ©rard Lenorman\n\nIl Ã©tait une fois, Ã  l'entrÃ©e des artistes\nUn petit garÃ§on blond au regard un peu triste\nIl attendait de moi, une phrase magique\nJe lui dis simplement, si j'Ã©tais PrÃ©sident\nSi j'Ã©tais PrÃ©sident de la RÃ©publique\nJamais plus un enfant n'aurait de pensÃ©e triste\nJe nommerais, bien sur, Mickey premier ministre\nDe mon gouvernement, si j'Ã©tais prÃ©sident\nSimplet Ã  la culture me semble une Ã©vidence\nTintin Ã  la police et Picsou aux finances\nZorro Ã  la justice et Minnie Ã  la danse\nEst c'que tu serais content, si j'Ã©tais prÃ©sident?\nTarzan serait ministre de l'Ã©cologie\nBÃ©cassine au commerce, Maya Ã  l'industrie\nJe dÃ©clarerais publiques toutes les patisseries\nOpposition nÃ©ant, si j'Ã©tais PrÃ©sident\nSi j'Ã©tais PrÃ©sident de la RÃ©publique\nJ'Ã©crirais mes discours en vers et en musique\nEt les jours de conseil, on irait en pique-nique\nOn f'rait des trucs marrants, si j'Ã©tais PrÃ©sident\nJe recevrais, la nuit, le corps diplomatique\nDans une super disco Ã  l'ambiance atomique\nOn se ferait la guerre Ã  grands coups de rythmique\nRien ne serait comme avant, si j'Ã©tais prÃ©sident\nAu bord des fontaines, coulerait de l'orangeade\nColuche notre ministre de la rigolade\nImposerait des manÃ¨ges sur toutes les esplanades\nOn s'Ã©claterait vraiment, si j'Ã©tais prÃ©sident\nSi t'Ã©tais PrÃ©sident de la RÃ©publique\nPour nous, tes p'tits copains, Ã§a s'rait super pratique\nOn pourrait rigoler et chahuter sans risques\nCe serait le beau temps, si t'Ã©tais PrÃ©sident\nJe s'rais jamais PrÃ©sident de la RÃ©publique\nVous les petits malins vous Ãªtes bien sympathiques\nMais ne comptez pas sur moi pour faire de la politique\nPas besoin d'Ãªtre PrÃ©sident, pour aimer les enfants\nLa la la la la\nLa la la la la\n\nmaryvonne masseron - 41 rue du puits-mauger  35000  rennes  0299302000  0680078113"
}