{
  "year": 2021,
  "seq": 71,
  "meta": {
    "date": "2021-05-03",
    "from": "maryvonne masseron-mandaba <maryvonnemm@hotmail.com>",
    "to": "\"Yannick Mandaba (personal)\" <y.mandaba@gmail.com>",
    "subject": "Re: Devoirs Tristan"
  },
  "proposals": [],
  "raw_excerpt": "ðŸ—• Date : 2021-05-03\nðŸ‘¤ From : maryvonne masseron-mandaba <maryvonnemm@hotmail.com>\nðŸ“¨ To   : \"Yannick Mandaba (personal)\" <y.mandaba@gmail.com>\nðŸ§• Subject : Re: Devoirs Tristan\n---\nElle veut rendre son fils bte.\nElle refuse de lui donner son cahier pour la classe. Il doit prparer le franais dessus. Et pour demain les maths dessus.\n\nElle refuse de lui donner son tlphone. Ainsi, il joue sur I pad. J'ai d jouer 1 heure avec lui. Mais je ne suis pas Wain.\n\nEt ensuite, elle lui a fait faire ses devoirs, errons. Et elle met mon nom dessus.\nC'est honteux, pour toi et moi.\n\nElle est sotte, et haineuse, et se croit intelligente.\n\nMoi, c'est bon. Demain, je prends\nTristan 1 h, et que pour des devoirs, elle n'a qu' jouer avec lui.\n\nTlcharger Outlook pour Android\n\n________________________________\nFrom: maryvonne masseron-mandaba \nSent: Saturday, May 1, 2021 10:22:19 PM\nTo: Yannick Mandaba (personal) \nSubject: Re: Devoirs Tristan\n\nOn passe tout notre temps  rpondre aux arguments de Bee, arrivs dans ta bouche, il faut ignorer la btise, et ne pas se laisser engluer dedans.\nIl y a des expressions, tournures de phrases et des mots, que je connais venir d'elle... Moi je suis docteur en mdecine, et pdiatre, anesthsiste-reanimateur, et nutritioniste. Pas psychologue ni psychiatre.\nJe ne peux pas, pour l'affection  Tristan, me laisser engluer par une toute petite fillle gte et tyranique, qui dcouvre la vraie vie, o elle n'est plus enfant, mais parent, qu'un enfant n'est pas un animal de compagnie, ni un faire-valoir, mais une grosse responsabilit.\n\nTlcharger Outlook pour Android\n\n________________________________\nFrom: maryvonne masseron-mandaba \nSent: Saturday, May 1, 2021 10:11:43 PM\nTo: Yannick Mandaba (personal) \nSubject: Re: Devoirs Tristan\n\nOn n'a fait aucune page du bled depuis qu'on le lui a apport  l'hpital. Il a oubli la routine. Checher la faute des autres... Si je raisonnais  ainsi, je ne ferais jamais rien. Je passe mon temps  pardonner les manquements de rigueur, de mthode , de systme...\n\nTlcharger Outlook pour Android\n\n________________________________\nFrom: Yannick Mandaba (personal) \nSent: Saturday, May 1, 2021 9:05:36 PM\nTo: 'maryvonne masseron-mandaba' \nSubject: RE: Devoirs Tristan\n\n\nCest toi qui le dgoute du Bled.\n\nCest de toi quil ne veut plus.\n\n\n\nTu nas aucune phycologie, tu ne te remets jamais en question.\n\nCest toujours la faute des autres\n\n\n\n\n\nFrom: maryvonne masseron-mandaba [mailto:maryvonnemm@hotmail.com]\nSent: Saturday, 1 May, 2021 7:04 PM\nTo: Yannick Mandaba ; BeeBaa \nSubject: Devoirs Tristan\n\n\n\nTristan est fatigu. Dort peu. Baille.\n\nIl ne va pas marcher dehors.\n\nIl ne fait que jouer sur la tablette.\n\nIl s'ennuie. Il est malheureux.\n\n\n\n11h-14h\n\nLa Grenouille\n\nEsope, le chien et le loup\n\nLe chant\n\nLa G E lesson\n\nLe Bled il n'en veut plus... Merci pour ne pas le lui avoir donn aussitt.\n\nLes mots invariables,  l'oral\n\n\n\nLui mettre  disposition les 8 pdf, avant 14h de bkk, demain dimanche,\n\nLui montrer les devoirs des autres, les corrections, qui sont faites proprement, sur des feuilles avec des lignes.\n\n\n\n\n\n\n\nTlcharger Outlook pour Android"
}