{
  "year": 2021,
  "seq": 69,
  "meta": {
    "date": "2021-05-01",
    "from": "maryvonne masseron-mandaba <maryvonnemm@hotmail.com>",
    "to": "\"Yannick Mandaba (personal)\" <y.mandaba@gmail.com>",
    "subject": "Re: Devoirs Tristan"
  },
  "proposals": [],
  "raw_excerpt": "ðŸ—• Date : 2021-05-01\nðŸ‘¤ From : maryvonne masseron-mandaba <maryvonnemm@hotmail.com>\nðŸ“¨ To   : \"Yannick Mandaba (personal)\" <y.mandaba@gmail.com>\nðŸ§• Subject : Re: Devoirs Tristan\n---\nOn n'a fait aucune page du bled depuis qu'on le lui a apport  l'hpital. Il a oubli la routine. Checher la faute des autres... Si je raisonnais  ainsi, je ne ferais jamais rien. Je passe mon temps  pardonner les manquements de rigueur, de mthode , de systme...\n\nTlcharger Outlook pour Android\n\n________________________________\nFrom: Yannick Mandaba (personal) \nSent: Saturday, May 1, 2021 9:05:36 PM\nTo: 'maryvonne masseron-mandaba' \nSubject: RE: Devoirs Tristan\n\n\nCest toi qui le dgoute du Bled.\n\nCest de toi quil ne veut plus.\n\n\n\nTu nas aucune phycologie, tu ne te remets jamais en question.\n\nCest toujours la faute des autres\n\n\n\n\n\nFrom: maryvonne masseron-mandaba [mailto:maryvonnemm@hotmail.com]\nSent: Saturday, 1 May, 2021 7:04 PM\nTo: Yannick Mandaba ; BeeBaa \nSubject: Devoirs Tristan\n\n\n\nTristan est fatigu. Dort peu. Baille.\n\nIl ne va pas marcher dehors.\n\nIl ne fait que jouer sur la tablette.\n\nIl s'ennuie. Il est malheureux.\n\n\n\n11h-14h\n\nLa Grenouille\n\nEsope, le chien et le loup\n\nLe chant\n\nLa G E lesson\n\nLe Bled il n'en veut plus... Merci pour ne pas le lui avoir donn aussitt.\n\nLes mots invariables,  l'oral\n\n\n\nLui mettre  disposition les 8 pdf, avant 14h de bkk, demain dimanche,\n\nLui montrer les devoirs des autres, les corrections, qui sont faites proprement, sur des feuilles avec des lignes.\n\n\n\n\n\n\n\nTlcharger Outlook pour Android"
}