{
  "year": 2021,
  "seq": 36,
  "meta": {
    "date": "2021-03-09",
    "from": "maryvonne masseron-mandaba <maryvonnemm@hotmail.com>",
    "to": "D.CHAUDET OfficeNot <dc.chaudet.35142@notaires.fr>",
    "subject": "Donation-partage Ã  y et m Mandaba"
  },
  "proposals": [],
  "raw_excerpt": "ðŸ—• Date : 2021-03-09\nðŸ‘¤ From : maryvonne masseron-mandaba <maryvonnemm@hotmail.com>\nðŸ“¨ To   : D.CHAUDET OfficeNot <dc.chaudet.35142@notaires.fr>\nðŸ§• Subject : Donation-partage Ã  y et m Mandaba \n---\nMatre,\nLe conseiller en patrimoine de la BPGO,  St Grgoire me fait savoir que je dois faire rdiger en votre Etude le document de Donation Partage, avant de le lui communiquer.\nPouvez-vous me donner le montant du restant disponible en Donation, en rpartition gale, entre Yannick et Marc, hors droits de succession.\nJe calculerai ( large) le nombre d'action \" L OREAL\" pour la donation.\nIls devront ouvrir un compte titre ordinaire, sur leur compte d'indivision, qu'ils ont dj, depuis la donation partge des SCI MYM MANDABA, et SCI CLERVILLE. Acte du 19 septembre 2008.\nEt ils vendront ces actions quand ils voudront. La personne, qui est responsable de la signature est Marc Mandaba. L'acte devra peut-tre le repreciser, car Yannick rside en Thailande.\nJe vous ai dj port en ampliation du dossier bancaire, dans mon derniet courriel.\nIl m'est possible d'aller  Vitr ds que vous pourrez me recevoir.\nEn vous remerciant.\nMaryvonne Mandaba Masseron\n0783359723\n\nTlcharger Outlook pour Android"
}