{
  "year": 2021,
  "seq": 46,
  "meta": {
    "date": "2021-03-16",
    "from": "maryvonne masseron-mandaba <maryvonnemm@hotmail.com>",
    "to": "\"y.mandaba@gmail.com\" <y.mandaba@gmail.com>, Marc MANDABA",
    "subject": "DerniÃ¨re explication"
  },
  "proposals": [],
  "raw_excerpt": "ðŸ—• Date : 2021-03-16\nðŸ‘¤ From : maryvonne masseron-mandaba <maryvonnemm@hotmail.com>\nðŸ“¨ To   : \"y.mandaba@gmail.com\" <y.mandaba@gmail.com>, Marc MANDABA\n\t<marcmandaba@hotmail.com>\nðŸ§• Subject : DerniÃ¨re explication\n---\nVous avez un compte indivision  la societe generale, rue d'Isly  Rennes.\nVous devez demander un NUMERO de Comote Titre Ordinaire,\nPour dposer les 70 actions L'OREAL que je vous DONNE.\nLa valeur est 22500, ce qu'il me reste  vous donner, hors droits de succession.\nCela ne figurera pas sur les impts , sauf revenus de votre SCI.\nSi les actions montent encore, tant mieux pour vous, si elles baissent, tanpis.\nLa valeur retenue sera celle  la date de l'acte du notaire.\nAvec votre NUMERO, je fais une lettre officielle  ma banque BPO, maintenant BPGO, de Vitr, qui transmet au sige  Rennes, qui transmet au Notaire, qui rdige l'acte de donation, et transmet  votre banque.\nTrs simple.\n\nSauf que je paye des frais, et que j'aimerais que vous vendiez  la hausse et non  la baisse, pour raliser votre projet.\n\nM\nTlcharger Outlook pour Android"
}