{
  "year": 2021,
  "seq": 125,
  "meta": {
    "date": "2021-11-03",
    "from": "maryvonne masseron-mandaba <maryvonnemm@hotmail.com>",
    "to": "Marc MANDABA <marcmandaba@hotmail.com>, \"y.mandaba@gmail.com\"",
    "subject": "REÂ : La Vie est Belle"
  },
  "proposals": [],
  "raw_excerpt": "ðŸ—• Date : 2021-11-03\nðŸ‘¤ From : maryvonne masseron-mandaba <maryvonnemm@hotmail.com>\nðŸ“¨ To   : Marc MANDABA <marcmandaba@hotmail.com>, \"y.mandaba@gmail.com\"\n\t<y.mandaba@gmail.com>\nðŸ§• Subject : REÂ : La Vie est Belle \n---\nPas de message cach \nCest que je ne peux sortir avec mon vlo ! Cette tente est devant la porte.\nEt que tous les autres qui sont dans le passage du Puits-Mauger sont agressifs  partir de 18H\nQuand je rentrais  vlo, ils taient dans tous les recoins.\nQuand je rentre en voiture, le soir, je dois attendre quils se rveillent pour ouvrir le portail.\nAprs, il faut surveiller jusqu ce que le portail se ferme.\nIl y a 15j ils ont mis le feu dans lentre du garage  cot.\nCest pas trop bien pour une dame seule. Il y a du stress. Et un autre confinement.\nPas grave, donc. Daprs toi, cest banal. Bien.\n\n\nEnvoy  partir de Courrier pour Windows\n\nDe : Marc MANDABA\nEnvoy le :mercredi 3 novembre 2021 21:36\n : maryvonne masseron-mandaba; y.mandaba@gmail.com\nObjet :Re: La Vie est Belle\n\nMalheureusement c'est le cas  tous les coins de rue. Et ce n'est pas nouveau.\nY avait-il un message cach ?\n\nMarc Mandaba\nFrance +33 611193955 (WhatsApp)\n\n\nDe : maryvonne masseron-mandaba \nEnvoy : mercredi 3 novembre 2021  9:08 PM\n : y.mandaba@gmail.com; Marc MANDABA\nObjet : La Vie est Belle\n\n\n\nTlcharger Outlook pour Android"
}