{
  "year": 2019,
  "seq": 70,
  "meta": {
    "date": "2019-12-08",
    "from": "maryvonne masseron-mandaba <maryvonnemm@hotmail.com>",
    "to": "Yannick Mandaba <y.mandaba@gmail.com>",
    "subject": "Re: Tristan"
  },
  "proposals": [],
  "raw_excerpt": "ðŸ—• Date : 2019-12-08\nðŸ‘¤ From : maryvonne masseron-mandaba <maryvonnemm@hotmail.com>\nðŸ“¨ To   : Yannick Mandaba <y.mandaba@gmail.com>\nðŸ§• Subject : Re: Tristan\n---\nC'est bien, un chien. Mais qui l'achte, qui paye le vtrinaire, qui va le promener dans le quartier...\nJe suis sre que c'est bien que Tristan ait un jardin. Envoie-moi une photo du jardin.\nAvec les grves, je n'arrive pas  grer mon compte bancaire. Mardi je dois aller  ma banque  Vitr pour rinitialiser mes codes de scurit, ce qui ne se fait que par courrier (grve de la poste), ou en agence.\nC'est Bee ou sa sur qui demande une cotisation aux dpenses du papa ?  une cagnotte familiale ? Le montant est de... 800e/mois?\nJe t'appelle  9h30, quand serai prte  partir.\nMaman\n\nTlcharger Outlook pour Android\n\n________________________________\nFrom: Yannick Mandaba \nSent: Sunday, December 8, 2019 8:24:50 AM\nTo: maryvonne masseron-mandaba \nSubject: Re: Tristan\n\nTristan lit beaucoup pour son age.\nIl commence a construire un barrage dans le jardin.\nC'est le jeu dans la nature qui lui manque et a changer avec les jeux ipad etc.\n\nAussi fans nos sorties d adulte il n'a rien d autre a faire.\n\nMais ok.\n\nPS: on pense  avoir un chien. Labradore semble le bon choix:\nIntelligent\nJoueur et non agressif.\nPoil court auto nettoyant 1 bain par semaine.\n\nPeu de maladies gntiques  part le surpoids et malformation du genou  vrifier. Surpoids il faut un jardin et des ballades.\n\nC'est bon pour les dfenses gntiques et asme mais c'tait avant 5 ans pour a...\n\nOn Sun, 8 Dec 2019, 03:52 maryvonne masseron-mandaba, > wrote:\n\n[Image]\n\nTlcharger Outlook pour Android"
}