{
  "year": 2019,
  "seq": 48,
  "meta": {
    "date": "2019-09-12",
    "from": "maryvonne masseron-mandaba <maryvonnemm@hotmail.com>",
    "to": "\"y.mandaba@gmail.com\" <y.mandaba@gmail.com>",
    "subject": "Les virements pour dÃ©mÃ©nagement Manja"
  },
  "proposals": [],
  "raw_excerpt": "ğŸ—• Date : 2019-09-12\nğŸ‘¤ From : maryvonne masseron-mandaba <maryvonnemm@hotmail.com>\nğŸ“¨ To   : \"y.mandaba@gmail.com\" <y.mandaba@gmail.com>\nğŸ§• Subject : Les virements pour dÃ©mÃ©nagement Manja\n---\nBonjour,\nVoici le dcompte de mes virements  ce jour,\nLes 2500 euros promis, virs sur le compte  personnel Y M.\nPuis les 1500 euros que je voulais virer directement au constructeur, mais que j'ai d virer sur le compte personnel Y M .Faute de l'adresse du dit constructeur, la banque n'avait pu effectuer l'opration.\nA noter que dsormais je ne ferai de versements qu'aux fournisseurs directement.\nDs que possible, la SCI distribuera  chacun un dividende de 1500 e, ce qui permettra de payer les impts.\nMaman\n\nTlcharger Outlook pour Android"
}