{
  "year": 2019,
  "seq": 30,
  "meta": {
    "date": "2019-05-21",
    "from": "maryvonne masseron-mandaba <maryvonnemm@hotmail.com>",
    "to": "\"y.mandaba@gmail.com\" <y.mandaba@gmail.com>",
    "subject": "DÃ©claration impÃ´t = Ce Jour...."
  },
  "proposals": [],
  "raw_excerpt": "ðŸ—• Date : 2019-05-21\nðŸ‘¤ From : maryvonne masseron-mandaba <maryvonnemm@hotmail.com>\nðŸ“¨ To   : \"y.mandaba@gmail.com\" <y.mandaba@gmail.com>\nðŸ§• Subject : DÃ©claration impÃ´t = Ce Jour.... \n---\nPour SCI CLERVILLE,\nTu as vu avec Marc, je crois.\nLes chiffres diviss par 2\n\nPour SCI MYM mandaba,\nJe t'envoie le doc de Fidal,\nMais tu vois avec Marc,\nCar stress +++ l-bas, puisque c'est le dernier jour pour dclarer... , je suis rentre de Casablanca cette nuit, et ai rcupr les docs ce matin au secrtariat Fidal. Mais cette nuit, ils ont dcid de dclarer selon 2016, car je n'avais pas encore donn les chiffres.\nTu me diras ce qu'ils ont dcid. Pour moi la dclaration est semaine prochaine.\n\nBisous\nMaman\n[Image]\n\n\n\n\n\nTlcharger Outlook pour Android"
}