{
  "year": 2019,
  "seq": 60,
  "meta": {
    "date": "2019-10-13",
    "from": "maryvonne masseron-mandaba <maryvonnemm@hotmail.com>",
    "to": "\"y.mandaba@gmail.com\" <y.mandaba@gmail.com>, Marc MANDABA",
    "subject": "Bangui 2019"
  },
  "proposals": [],
  "raw_excerpt": "ðŸ—• Date : 2019-10-13\nðŸ‘¤ From : maryvonne masseron-mandaba <maryvonnemm@hotmail.com>\nðŸ“¨ To   : \"y.mandaba@gmail.com\" <y.mandaba@gmail.com>, Marc MANDABA\n\t<marcmandaba@hotmail.com>\nðŸ§• Subject : Bangui 2019\n---\nBonsoir vous 2\n4\n7,\nFinalement jai conserv mon projet daller sur la tombe de Papa pour le 22 octobre,\nEn fait Christian a organis une messe  Notre-Dame dAfrique pour le 22, puis rafraichissements chez lui,\nLa messe  Damara sera le dimanche suivant, le 27.\n\nJean-Paul na pas encore t convoqu par le service de Chirurgie thoracique.\nEt comme leur runion de Programmation du Bloc nest que le mardi, quil ne sera averti que le jeudi, quil faut 10 jours pour la prparation, quil y a le Week-End du 1 2 3 novembre, au cours duquel il ne peut y avoir de surveillance lourde, je pense avoir le temps daller avant.\n\nPeut-tre, pourrai-je voir 2 de mes  trsors   mon retour, le dimanche 3 novembre,  Casablanca. ? .\n\nJe vous espre en bonne forme,\nPour moi ce nest pas formidable, fatigue psychique accumule, et syndrome grippal qui trane depuis 5 jours.\nBisous de loin.\nmaman\n\n\n\nProvenance : Courrier pour Windows 10"
}