{
  "year": 2019,
  "seq": 4,
  "meta": {
    "date": "2019-01-13",
    "from": "maryvonne masseron-mandaba <maryvonnemm@hotmail.com>",
    "to": "\"y.mandaba@gmail.com\" <y.mandaba@gmail.com>",
    "subject": "Tweet de maya (@maya47000)"
  },
  "proposals": [],
  "raw_excerpt": "ğŸ—• Date : 2019-01-13\nğŸ‘¤ From : maryvonne masseron-mandaba <maryvonnemm@hotmail.com>\nğŸ“¨ To   : \"y.mandaba@gmail.com\" <y.mandaba@gmail.com>\nğŸ§• Subject : Tweet de maya (@maya47000)\n---\nmaya (@maya47000) a tweetÃ© Ã  4:18 AM on dim., janv. 13, 2019 :\n\" TrÃ¨s peu de personnes sont capables de me dompter , car trÃ¨s peu de personnes me connaissent avec un coeur aimant. Je possÃ¨de viscÃ©ralement un cÃ´tÃ© sauvage qui se prÃ©nomme libertÃ©. \"\n\nChris Bauberger\n\nNew Delhi , India - ğŸ“¹ @igworldclub_sunset ğŸ¶\n\nBeau #DimancheEvasion ğŸ™‚ ğŸ™ https://t.co/6GjJXJ3woI\n(https://twitter.com/maya47000/status/1084288576068694017?s=09)\n\nTÃ©lÃ©chargez l'application officielle Twitter sur https://twitter.com/download?s=13\n\nTÃ©lÃ©charger Outlook pour Android"
}