{
  "year": 2019,
  "seq": 1,
  "meta": {
    "date": "2019-01-02",
    "from": "\"Yannick Mandaba \\(pro\\) \" <y.mandaba@gmail.com>",
    "to": "\"'maryvonne masseron-mandaba'\" <maryvonnemm@hotmail.com>",
    "subject": "FW: Scolarit√© Tristan MANDABA 150000 tbaths"
  },
  "proposals": [
    {
      "index": -1,
      "etiquette": "Frais d'√©cole / bus Tristan",
      "category": "MIN",
      "duration": "LT",
      "source": "AI",
      "score": 1,
      "matched_from": [
        "ai_new"
      ]
    }
  ],
  "raw_excerpt": "üóï Date : 2019-01-02\nüë§ From : \"Yannick Mandaba \\(pro\\) \" <y.mandaba@gmail.com>\nüì® To   : \"'maryvonne masseron-mandaba'\" <maryvonnemm@hotmail.com>\nüßï Subject : FW: Scolarit√© Tristan MANDABA 150000 tbaths\n---\nBonjour Maman,\n\n \n\nJ‚Äôai compl√®tement oubli√© de te faire parvenir la seconde facture de l‚Äô√©cole.\n\n \n\nSinon je joins aussi les remarques de la maitresse, qui contrairement aux remarques d‚Äôune assistante, trouve que Tristan √©volue tr√®s bien et commence √† s‚Äôimpliquer. L‚Äôassistante disait qu‚Äôil ne faisait rien et parlait mieux Tha√Ø que Fran√ßais.\n\nElle se f√©licite de notre choix de le ramener dans cette classe pour se structurer.\n\nSinon je lui ai fait passer un test CM1  en maths il r√©sout tous les probl√®mes  sauf les mises en √©quations 10/20.\n\nEn Fran√ßais il connait l‚Äôindicatif, le subjonctif (2 temps), l‚Äôimp√©ratif et le conditionnel et on commence la concordance car cela le g√®ne pour parler de ne pas savoir conjuguer.\nEn parall√®le on commence les subordonn√©es.\n\n \n\nFranchement ne regrette pas ce choix. Il est bon. Tristan et heureux et change beaucoup depuis qu‚Äôil est en GS. On refera bataille plus tard, je pense sauter plut√¥t CP ou CE1, voire CE1 et CE1 mais je dois lui faire faire tout le programme √† la maison pour √©viter des lacunes.\n\nSinon il y a le CNED pour lui faire passer les examens en avance.\n\n \n\nOn en reparle. Dis-moi quand tu peux payer que je leur fasse savoir.\n\nMerci beaucoup d‚Äôavance\n\nPS : moticit√© fine : JE le met a faire de l‚Äôorigami grace √† ce site\n\n       http://en.origami-club.com/traditional/index.html\n\n \n\nTristan est rest√©  chez sa tante pendant que papa et maman travaillent. C‚Äôest bien aussi de le s√©parer un peu du cocon‚Ä¶Bise\n\n \n\nFrom: Kingkan [mailto:kingkan.k@lfib.ac.th] \nSent: Tuesday, November 20, 2018 14:46\nTo: MYM MANDABA SCI \nCc: Yannick Mandaba ; maryvonne Masseron-Mandaba \nSubject: Re: Scolarit√© Tristan MANDABA 150000 tbaths\n\n \n\nMadame, Monsieur,\n\nNous gardons toujours une avance de 4900 THB relative au r√®glement de la pr√©inscription fait le 15/02/2018. Afin d'actualiser notre compte, la somme doit √™tre appliqu√©e contre le solde du 1er trimestre de 2287.16 THB et appliqu√©e contre la facture du 2√®me trimestre qui s'√©l√®ve √† 73194.49 THB.\n\nAlors, le montant √† r√©gler avant le 15/12/2018 est de 70 581.65 THB au lieu de 73194.49 THB.\n\n\nBien cordialement,\n\n \n\n \n\n \n\n \n\n \n\n \n\nLyc√©e Fran√ßais International\nBangkok, Tha√Ølande\n\nKingkan KONG-IN\n\nService Comptabilit√©\n\n \n\n498, Soi Ramkhamhaeng 39 (Thep Leela 1), Wangthonglang, Bangkok, 10310\nT√©l :  66 (0) 29 34 80 08\nemail : kingkan.k@lfib.ac.th  \n\n\n  www.lfib.ac.th |   LinkedIn |   Facebook\n\n \n\n\n\n \n\nCe courriel (de m√™me que les fichiers joints) est strictement r√©serv√© √† l'usage de la personne ou de l'entit√© √† qui il est adress√© et peut contenir de l'information privil√©gi√©e et confidentielle. Toute divulgation, distribution ou copie de ce courriel est strictement prohib√©e. Si vous avez re√ßu ce courriel par erreur, veuillez nous en aviser sur-le-champ, d√©truire toutes les copies et le supprimer de votre syst√®me informatique.\nThis communication (including any files transmitted with it) is intended solely for the person or entity to whom it is addressed, and may contain confidential or privileged information. The disclosure, distribution or copying of this message is strictly forbidden. Should you have received this communication in error, kindly contact the sender promptly, destroy any copies and delete this message from your computer system.\n\nOn 02/05/2018 17:02, Kingkan wrote:\n\nBonjour,\n\nNous avons bien re√ßu votre virement cr√©dit√© sur le compte du LFIB ce jour avec la somme de 149 900 bahts. Alors, vous avez trop pay√© les 4900 bahts. La somme sera d√©duite de la facture des frais scolarit√© de votre enfant.\n\n \n\nBien cordialement,\n\n\n\nLyc√©e Fran√ßais International\nBangkok, Tha√Ølande\n\nKingkan KONG-IN\nService Comptabilit√©\n\n\n\n 498, Soi Ramkhamhaeng 39 (Thep Leela 1)\nWangthonglang Bangkok 10310\n\nT√©l :  66 (0) 29 34 80 08\ncomptabilite@lfib.ac.th  \n  www.lfib.ac.th |   LinkedI"
}