{
  "year": 2019,
  "seq": 63,
  "meta": {
    "date": "2019-10-24",
    "from": "maryvonne masseron-mandaba <maryvonnemm@hotmail.com>",
    "to": "\"y.mandaba@gmail.com\" <y.mandaba@gmail.com>, Marc MANDABA",
    "subject": "La messe pour papa"
  },
  "proposals": [],
  "raw_excerpt": "ðŸ—• Date : 2019-10-24\nðŸ‘¤ From : maryvonne masseron-mandaba <maryvonnemm@hotmail.com>\nðŸ“¨ To   : \"y.mandaba@gmail.com\" <y.mandaba@gmail.com>, Marc MANDABA\n\t<marcmandaba@hotmail.com>, claudie mandaba <g.gazambert@hotmail.fr>\nðŸ§• Subject : La messe pour papa\n---\nChers enfants,\nLa messe pour papa s'est bien droule.\nLe pre Patrick Mbea a choisi des textes de lectures appropris.\nSon omlie tait interessante.\nMais j'ai compris qu'il a dplor de ne pas avoir vu la famille pour la prparation.\nPourtant Christian m'avait dit avoir fait la prparation, et contact une chorale.\nIl n'y avait pas de lecteurs de la famille. Ni de chorale. C'tait quand mme bien, et dpouill.\nNoella et Jef ont fait comme d'habitude, prvu le portrait, et la procession des fleurs.\nJe les avais placs devant,  droite et  gauche, avec les corbeilles de fleurs.\nC'est Noella qui a fait la qute.\nEux deux ont distribu les bouquets  l'assistance pour dpt devant le portrait, aprs la communion.\nL'assistance, la famille, et beaucoup d'amis de papa, a dpos les fleurs, et s'est recueillie devant le portrait.\nDans mes remerciements, j'ai redit que ce dpt de fleurs tait un symbole, pour accompagner ceux qui ne pourront venir le dimanche pour le dpt de gerbes sur la tombe,  Damara.\nNB Yangue ne voulait pas des fleurs, aprs il s'est excus.\nAprs la crmonie, nous sommes alls en ville pour rafrachissements et snacks.\nComme autrefois, avec Perriere, chez Mme tournade. Et c'tait  la terrasse de son restau. Face au GML.\nAvons bavard jusqu' 22h.\nMerci  Noella et Jef.\n\n\nTlcharger Outlook pour Android"
}