{
  "year": 2019,
  "seq": 7,
  "meta": {
    "date": "2019-01-30",
    "from": "\"Yannick Mandaba \\(pro\\) \" <y.mandaba@gmail.com>",
    "to": "\"'maryvonne masseron-mandaba'\" <maryvonnemm@hotmail.com>",
    "subject": "R.I.B. L.F.I.B.  RIB LFIB"
  },
  "proposals": [],
  "raw_excerpt": "ðŸ—• Date : 2019-01-30\nðŸ‘¤ From : \"Yannick Mandaba \\(pro\\) \" <y.mandaba@gmail.com>\nðŸ“¨ To   : \"'maryvonne masseron-mandaba'\" <maryvonnemm@hotmail.com>\nðŸ§• Subject : R.I.B. L.F.I.B.  RIB LFIB\n---\nBonjour Maman, \n\n \n\n \n\nNom de la Banque : United Overseas Bank (Thai) Public Company Limited \n\nAdresse de la succursale centrale : 191 South Sathon Road, Bangkok 10120 \n\nNom du compte : Lycee Francais International de Bangkok \n\nNumro du compte : 7943190953\n\nSWIFT BIC CODE : UOVBTHBK\n\n \n\n(ne surtout pas utiliser le code IBAN. Votre virement ne serait pas\nidentifi)\n\n \n\nMerci,\n\n \n\ncole ferme pour pollution sur ordre du ministre de lducation nationale\nTha demain et vendredi jusqu lundi donc... \n\n \n\nPlaintes contre le premier ministre pour ngligence, mesures drastiques\nmises en place : circulation alterne, vhicule pour 1 personne interdit (il\nfaudrait aussi 2 personnes pour madame et son chauffeur). \n\nFermetures dusines. Interdiction pure et simple du Diesel dans les centres\nvilles pour 4 ou 5 capitales de provinces  .\n\n \n\nBise\n\n \n\n \n\nFrom: maryvonne masseron-mandaba [mailto:maryvonnemm@hotmail.com] \nSent: Wednesday, January 30, 2019 16:58\nTo: y.mandaba@gmail.com\nSubject: Urgent\n\n \n\n \n\nM'envoyer le RIB du lyce franais de Bangkok, pour payer ce qui reste, le\n3eme trimestre. \n\nPas de bonne connection ce jour. \n\nTlcharger Outlook pour Android"
}