{
  "year": 2019,
  "seq": 66,
  "meta": {
    "date": "2019-11-26",
    "from": "maryvonne masseron-mandaba <maryvonnemm@hotmail.com>",
    "to": "Yannick Mandaba <y.mandaba@gmail.com>",
    "subject": "Re: RelevÃ© d'identitÃ© bancaire"
  },
  "proposals": [
    {
      "index": -66,
      "etiquette": "Paiement salaires atelier",
      "category": "MIN",
      "duration": "LT",
      "source": "AI",
      "score": 1,
      "matched_from": [
        "ai_new"
      ]
    }
  ],
  "raw_excerpt": "ðŸ—• Date : 2019-11-26\nðŸ‘¤ From : maryvonne masseron-mandaba <maryvonnemm@hotmail.com>\nðŸ“¨ To   : Yannick Mandaba <y.mandaba@gmail.com>\nðŸ§• Subject : Re: RelevÃ© d'identitÃ© bancaire\n---\nC'est la boulimique qui devrait traduire pour moi, si elle veut que je remette ses biens en valeur.\n\nTlcharger Outlook pour Android\n\n________________________________\nFrom: Yannick Mandaba \nSent: Tuesday, November 26, 2019 10:12:33 AM\nTo: 'maryvonne masseron-mandaba' \nSubject: RE: Relev d'identit bancaire\n\n\nCest le devis du charpentier. Tu crois quils crivent en anglais ?\n\nSi tu installes GOOGLE TRANSLATE sur ton tlphone, il y a une icone  appareil photo  qui traduit en temps rel, les tiquettes de supermarch et tout ce que tu veux.\n\nToutes les langues.\n\n\n\nPar contre du manuscrit je ne sais pas trop.\n\n\n\nDepuis quand jai dj fait des faux ou racont des histoires?\n\nSi cest trop tu dis   Cest trop  et tu envoies ce que tu peux.\n\nInutile de me traiter de faussaire.\n\n\n\nY\n\n\n\nFrom: maryvonne masseron-mandaba [mailto:maryvonnemm@hotmail.com]\nSent: Tuesday, November 26, 2019 15:33\nTo: Yannick Mandaba \nSubject: Re: Relev d'identit bancaire\n\n\n\nEncore une fois, tu me prends pour une gogol !\n\n- devis en Tha, par une personne \"de confiance\" ?\n\n- les frais de transfert, je les connais, est-ce que je te les ai fait payer une seule fois ?\n\n- fais le total de ce que je t'ai envoy en 2019, et considre ce qui me reste.\n\nJ'attends\n\nTlcharger Outlook pour Android\n\n\n\n________________________________\n\nFrom: Yannick Mandaba >\nSent: Tuesday, November 26, 2019 8:39:35 AM\nTo: maryvonne masseron-mandaba >\nSubject: FW: Relev d'identit bancaire\n\n\n\n\n\nIl y a son salaire 1,000 Euros, et quelques travaux de la chambre (murs contreplaqu, porte qui tombe en lambeaux, rambarde terrasse, lectricit).\n\nEn tout 1,500 Euros minimum.\n\nJai besoin de plus mais cest dj beaucoup pour toi.\n\nUne fois installs, on va conomiser beaucoup dargent (zero loyer).\n\nJai dpens beaucoup trop pour bouger le bureau ; et perdu quelques clients sacrifis avec les retards.\n\n\n\nPS :\n- Total travaux cest 38,000THB, mais Bee paye une partie (il y a meuble bois cuisine, porte salle de bain salle de bain aussi mlang).\n\n- En plus de ca on a achet 1 clim et 1 machine a laver\n\n\n\nJai pris sur largent destin aux salaires. Cela ne pouvait pas attendre. Ni la clim, ni les murs, ni la machine, et le pre de Bee se plaignait de ne pas oser aller aux toilettes car la porte ne ferme pas depuis 20 ans.\n\n\n\nDonc tu peux envoyer  Gautier en France mais Gautier a un plafond de retrait de 7 jours glissants. il va falloir 3 semaines pour retirer le tout en espce.\n\nMais visiblement le guichet de change de Bangkok Bank prennent les carte bleues (considre comme un paiement par carte et l il a 4,000 Euros de plafond).\n\nIl peut aussi faire le Western Union en ligne avec sa carte, cest bon.\n\nOk via Gautier.\n\n\n\n---- pur une autre fois regarde ces options ----\n\nWestern Union sur internet sinon ils prennent carte bleue sur leur site et cest pas larnaque de Bangui\nIls prennent 40 Euros pour 2,000 Euros envoys par carte livrs en espce :\n\nIls prennent 20 Euros pour 2,000 Euros envoys par carte, livr2 sur compte bancaire.\n\nTu peux faire au nom de Gautier sur son compte Thai aussi.\n\n\n\nSinon il y a TranferWise utilis par beaucoup de nos clients, trs rapide, peu de frais, cest comme Whatsapp par rapport au tlphone ils utilisent carte bleue via des banques locales.\n\n\n\n\n\n\n\n\n\nAttention ce mail est  caractre priv !\n\n\n\n[Crdit agricole]\n\nRelev d'identit bancaire\n\npour information\n\n[https://www.credit-agricole.fr/etc/designs/ca/npc/clientlib-resources/images/email/info.jpg]\n\n\n\n[https://www.credit-agricole.fr/etc/designs/ca/npc/clientlib-resources/images/commun/mail-casa/conseiller.png]\n\n\n\n\n\nVoici le rcapitulatif de votre opration\n\n\n\n\n\n\n\n\n\n\n\nBonjour,\n\nM. KUSNIEREK GAUTIER a souhait vous faire parvenir son Relev d'Identit Bancaire :\n\nCR LOIRE HAUTE LOIRE\nCITE DU DESIGN\nCoordonnes de l'agence :\n    Tl. 0477740083\n    Fax. 0477749141\n\nTitulaire : M. KUSNIEREK GAUTIER\n    Ad"
}