{
  "year": 2019,
  "seq": 50,
  "meta": {
    "date": "2019-09-16",
    "from": "maryvonne masseron-mandaba <maryvonnemm@hotmail.com>",
    "to": "\"y.mandaba@gmail.com\" <y.mandaba@gmail.com>",
    "subject": "impots sur 2018, payÃ©s le 16/09/2019"
  },
  "proposals": [],
  "raw_excerpt": "ðŸ—• Date : 2019-09-16\nðŸ‘¤ From : maryvonne masseron-mandaba <maryvonnemm@hotmail.com>\nðŸ“¨ To   : \"y.mandaba@gmail.com\" <y.mandaba@gmail.com>\nðŸ§• Subject : impots sur 2018, payÃ©s le 16/09/2019\n---\nQuestions frquentes\n[Changer le contraste de l'affichage]\nAffichage contrast\n[cid:image002.gif@01D56C7D.D66235D0]\nPAIEMENT DE L'IMPT - PARTICULIERS\n[cid:image003.gif@01D56C7D.D66235D0]\n[cid:image004.gif@01D56C7D.D66235D0]PAIEMENT EN LIGNE\n[cid:image004.gif@01D56C7D.D66235D0]PRLVEMENT MENSUEL\n[cid:image004.gif@01D56C7D.D66235D0]PRLVEMENT  L'CHANCE\n[cid:image005.gif@01D56C7D.D66235D0]\n\n[Fermer la fentre]\n[cid:image007.gif@01D56C7D.D66235D0]\nCARACTERISTIQUES DE L'AVIS D'IMPOSITION\n[cid:image008.gif@01D56C7D.D66235D0]\n\nNom\nRfrence de l'avis d'imposition\nType d'impt\nDate limite de paiement\nMontant de l'avis d'imposition\nCumul des ordres de paiement dj donns\nMontant restant  payer\nMontant du paiement\n1 109,00 \nM MANDABA YANNICK YVES\nSALA-KOSSO\n1998002789003\nImpt sur le revenu - Prlvements sociaux\n16/09/2019\n1 109,00 \n0,00 \n1 109,00 \n\n[cid:image007.gif@01D56C7D.D66235D0]\nCARACTERISTIQUES DE L'ORDRE DE PAIEMENT\n[cid:image008.gif@01D56C7D.D66235D0]\n\nIBAN\nBIC\nEtablissement\nTitulaire du compte\nMontant  prlever\nFR7630003017130XXXXXXXX9985\nSOGEFRPP\nSG RENNES LE COLOMBIER\nMR YANNICK MANDABA\n1 109,00 \n\n[cid:image009.gif@01D56C7D.D66235D0]\n\n\n\n\n\nVotre ordre de paiement a bien t enregistr le 16/09/2019  10:55 sous le numro 600120689308 pour un montant de 1 109,00 \nsur le compte bancaire FR7630003017130XXXXXXXX9985 (tablissement teneur du compte : SG RENNES LE COLOMBIER).\n\nCe numro (Certificat de Prise en compte de l'Ordre de Paiement) vous sera rclam en cas de contestation.\n\nLe prlvement interviendra  compter du 26/09/2019 sous la Rfrence Unique de Mandat (RUM) n NNFR46ZZZ0050021998002789003R689308\n\n\nNous vous conseillons de noter ces informations ou de les enregistrer au format pdf en cliquant sur le bouton suivant :\n[Enregistrer le fichier au format pdf (nouvelle fentre)]    Enregistrer\n\n\n[Retour menu]    Retour menu   \n\nProvenance : Courrier pour Windows 10"
}