{
  "year": 2019,
  "seq": 53,
  "meta": {
    "date": "2019-09-21",
    "from": "maryvonne masseron-mandaba <maryvonnemm@hotmail.com>",
    "to": "\"y.mandaba@gmail.com\" <y.mandaba@gmail.com>, Marc MANDABA",
    "subject": "Jean-Paul"
  },
  "proposals": [],
  "raw_excerpt": "ðŸ—• Date : 2019-09-21\nðŸ‘¤ From : maryvonne masseron-mandaba <maryvonnemm@hotmail.com>\nðŸ“¨ To   : \"y.mandaba@gmail.com\" <y.mandaba@gmail.com>, Marc MANDABA\n\t<marcmandaba@hotmail.com>\nðŸ§• Subject : Jean-Paul \n---\nBonjour,\nVous avez peut-tre, ou peut-tre pas, appris, par vos cousines, que Jean-Paul va subir une intervention chirurgicale. Il me l'a appris  mon retour de Bangkok. Il s'agit d'une insuffisance aortique ( voir doctissimo.fr) qui est assez srieuse pour devoir tre opre. Une valvule artificielle doit tre place, sous circulation extra corporelle, pour remplacer la valve malade, qui actuellement laisse refluer une partie de l'jectat aprs chaque systole. D'o une insuffisance cardiaque.\nIl doit tre opr dans les 15 jours qui viennent.\nPour votre information, ce genre d'insuffisance aortique provient d'une infection, ancienne ou rcente, en gnral ORL ( angines  rptition, ou encore abcs dentaires) dont les bactries ou les toxines bactriennes abment les valves du cur, causant des dformations cicatricielles, et elles ne sont plus tanches.\nJean-Paul me tient au courant. Actuellement il a une otite  soigner avant de programmer l'intervention.\nM\n\nTlcharger Outlook pour Android"
}