{
  "year": 2019,
  "seq": 19,
  "meta": {
    "date": "2019-03-29",
    "from": "maryvonne masseron-mandaba <maryvonnemm@hotmail.com>",
    "to": "Yannick Mandaba <y.mandaba@gmail.com>",
    "subject": "Re: ScolaritÃ© 3eme trimestre Tristan Mandaba"
  },
  "proposals": [
    {
      "index": -19,
      "etiquette": "Dossier de bourse Tristan",
      "category": "MIN",
      "duration": "LT",
      "source": "AI",
      "score": 1,
      "matched_from": [
        "ai_new"
      ]
    },
    {
      "index": -19,
      "etiquette": "Paiement salaires atelier",
      "category": "MIN",
      "duration": "LT",
      "source": "AI",
      "score": 1,
      "matched_from": [
        "ai_new"
      ]
    },
    {
      "index": -19,
      "etiquette": "Visa / immigration",
      "category": "MIN",
      "duration": "LT",
      "source": "AI",
      "score": 1,
      "matched_from": [
        "ai_new"
      ]
    }
  ],
  "raw_excerpt": "ðŸ—• Date : 2019-03-29\nðŸ‘¤ From : maryvonne masseron-mandaba <maryvonnemm@hotmail.com>\nðŸ“¨ To   : Yannick Mandaba <y.mandaba@gmail.com>\nðŸ§• Subject : Re: ScolaritÃ© 3eme trimestre Tristan Mandaba\n---\nBien compris. Concentre- toi sur ton dossier administratif. La demande de bourse est primordiale, car mes revenus ont beaucoup baiss depuis que je suis  la retraite.\nN'oublie pas de cotiser  une caisse de retraite, ex les franais  l'tranger, car la retraite c'est un salaire que l'on reoit depuis son arrt d'activit et jusqu' son dcs. Moi-mme je n'ai pas cotis assez, car pour t'aider, je ne payais que 2/3 des cotisations. Rsultat :2/3 de la retraite. Oui tu appelles\n\nTlcharger Outlook pour Android\n\n________________________________\nFrom: Yannick Mandaba \nSent: Friday, March 29, 2019 11:21:10 AM\nTo: maryvonne masseron-mandaba\nSubject: Re: Scolarit 3eme trimestre Tristan Mandaba\n\nMerci maman je demande au monsieur de revoir le dossier.\n\nEn ce moment je rgularise les taxes et la compta (j adore) de la boite pour mon permis de travail, qui me permettra de recommencer a payer de faibles impts et de dclarer des revenus sans signifier a la ambassade que je travaille illgalement.\n\nCela concerne la Thalande et non la France mais on peut m'estamper de \"tricheur\" en France quand mme.\n\nBref. D'ici 3 mois j'aurais le visa de travail pour 1 an, le permit de travail et ma carte pour les impts qui est la pice matresse pour la preuve de mes revenus en Thalande.\n\nDans la foule avant de messoufler je ferai le dossier de bourse.\n\nSongkran du 12 au 18 ensuite 2 jour de travail et long weekend. On n'a rien prvu. HuaHin si c'est libre. Songkran : weekend meurtrier dans le pays ayant le plus de accidents mortels au monde /Pop devant le Nigeria et la Centrafrique...\n\nBisous\n\nOn Fri, 29 Mar 2019, 17:02 Yannick Mandaba, > wrote:\nHello, please find attached the receipt of payment made from Africa in CFA. Please recheck our account.\n\n---------- Forwarded message ---------\nFrom: maryvonne masseron-mandaba >\nDate: Fri, 29 Mar 2019, 00:07\nSubject: Scolarit 3eme trimestre Tristan Mandaba\nTo: y.mandaba@gmail.com >\n\n\n\n\nTlcharger Outlook pour Android"
}