{
  "year": 2023,
  "seq": 3,
  "meta": {
    "date": "2023-01-13",
    "from": "MYM MANDABA SCI <mymmandaba@gmail.com>",
    "to": "Yannick Mandaba <y.mandaba@gmail.com>",
    "subject": "ReÂ : Extraits d'articles Ã  traduire. PrÃ©voir une consultation familiale auprÃ¨s d'un pedopsychiatre ou un pÃ©diatre"
  },
  "proposals": [],
  "raw_excerpt": "ğŸ—• Date : 2023-01-13\nğŸ‘¤ From : MYM MANDABA SCI <mymmandaba@gmail.com>\nğŸ“¨ To   : Yannick Mandaba <y.mandaba@gmail.com>\nğŸ§• Subject : ReÂ : Extraits d'articles Ã  traduire. PrÃ©voir une consultation familiale auprÃ¨s d'un pedopsychiatre ou un pÃ©diatre\n---\nEnvoyÃ© depuis mon tÃ©lÃ©phone Huawei\n\n-------- Message original --------\nDeÂ : Yannick Mandaba &lt;y.mandaba@gmail.com&gt;\nDateÂ : ven. 13 janv. 2023 Ã  14:29\nÃ€Â : MYM MANDABA SCI &lt;mymmandaba@gmail.com&gt;, Marc Mandaba &lt;marcmandaba@gmail.com&gt;\nObjetÂ : Re: Extraits d'articles Ã  traduire. PrÃ©voir une consultation familiale auprÃ¨s d'un pedopsychiatre ou un pÃ©diatre\nEtÂ  le bonjour des Russes on fait quoi avec?\nEt moi qui fais la bise sur la joue avec mais amis hommes? \nA l&#39;Ã©poque de ton pÃ¨reÂ cela ne se faisait pas non plus et c&#39;est pratique courante en France maintenant.\nArrÃªte de nous gonfler avec tes idÃ©esÂ rÃ©trogrades.\nTristan n&#39;est pas confus;Â ,merci. C&#39;est notre enfant pas le tien.\nArrÃªte de crÃ©er des soucis lÃ  ou il n&#39;y en a pas.\n\nEssaye de restreindreÂ ton intrusion permanente dansÂ notre nucleon familial.\nDÃ¨s que l&#39;on entrouvre une porte, tu scrutes et tu nous fais chier avec des details a al con.\nOn donne le baton pour se faire battre Ã Â chaque que l&#39;on te laisse voir notre intimitÃ©.Â \nJe n&#39;accepte pas ton chantage.\nTu peux garder ton Western Union que tu as brandi en me forÃ§ant Ã  lire tes articles destinÃ©s Ã  la civilisation occidentale dÃ©cadente.\n\nOn ne choici pas son sexe.\nUn archÃ©ologue ne se trompera pas quoi qu&#39;en disent les gens.\nUne homme ne peut pas me forcer Ã  l&#39;appeler madame.Â \n\nNon Ã  la dictature des gens Ã  problÃ¨mes:\n- les fÃ©ministes, je ne leur demande pas de dÃ©fendre la cause des hommes, je n&#39;ai pas Ã  dÃ©fendre la cause des femmes.\n- Les LGBT pour moiÂ uneÂ dÃ©viance stÃ©rile, donnez leur des petit enfant Ã  adopter si vous voulez.\n- Si la tradition de la famille c&#39;est un bisous sur la bouche de sa maman JE suis ok. Ca te derange tanpis.\n\nTrouve autre chose Ã  faire.\n\nTout tes trusÂ tournent autour du sexe.\nAccusation chez MArc dedja, maintenant c&#39;est nous?\nTu nous emmerdes avec tes idÃ©esÂ dÃ©gueulasses.\n\nJe te l&#39;ai dit c&#39;est toi qui gÃ©nÃ©re de la saletÃ©,Â c&#39;est une maladie et la saletÃ© est dans ta tÃªte et uniquement dans ta tÃªte.\n\nDÃ©solÃ©Â Marc je dois te CC car je ne peux pas encaisser seul ces chantages. Je me fous bien des derniers dogmes de je ne sais quel psychologue Ã  laÂ noix.\nFreud est dÃ©construit depuis dÃ©jÃ Â au moins 15 ou 20 ans et tout un courant de psychiatrie Freudienne est remise en question aujourd&#39;hui.\nIl y a des peuples et des traditions diffÃ©rentes, on ne peut pas dÃ©crypter le monde avec un regard franco-franÃ§ais et en plus de gens d&#39;un certainÂ courant dans une science qui n&#39;en est pas uneÂ : LaÂ psychiatrie.\n\nIl n&#39;y a que des thÃ¨se en psychiatrie, c&#39;est vraiment border line, donc arrÃªte de m&#39;envoyer Ã§a comme une vÃ©ritÃ© absolue.\nDe grands psychiatres, universitaires, professeurs, etc, se regroupent en association pour dÃ©construireÂ ces vieux courants.\nSTOP Ã  la dictature de tes visions Ã©troites.\n\nY a t-il un comitÃ© de lecture Ã  cet article?\n\n&#61;&#61;&#61;&#61;&#61; CHAT GPT resume ma pensee comme suit &#61;&#61;&#61;&#61;&#61;&#61;&#61;&#61;&#61;\n\n Il est important de respecter les diffÃ©rences culturelles et les choix de chacun, y compris en matiÃ¨re de salutations et de relations familiales. Il est Ã©galement important de rappeler que la psychologie et la psychiatrie sont des sciences qui Ã©voluent en fonction des dÃ©couvertes et des recherches les plus rÃ©centes. Il est important de rester ouvert d&#39;esprit et de ne pas rejeter toutes les idÃ©es qui ne correspondent pas Ã  notre vision personnelle.\n\nOn Fri, Jan 13, 2023 at 5:28 AM MYM MANDABA SCI &lt;mymmandaba@gmail.com&gt; wrote:\n\n\n-- \nYannick Mandaba\nMobile: &#43;66.8782.00.622"
}