{
  "year": 2023,
  "seq": 55,
  "meta": {
    "date": "2023-09-15",
    "from": "MYM MANDABA SCI <mymmandaba@gmail.com>",
    "to": "\"y.mandaba@gmail.com\" <y.mandaba@gmail.com>",
    "subject": "Tristan"
  },
  "proposals": [
    {
      "index": -55,
      "etiquette": "Dossier de bourse Tristan",
      "category": "MIN",
      "duration": "LT",
      "source": "AI",
      "score": 1,
      "matched_from": [
        "ai_new"
      ]
    }
  ],
  "raw_excerpt": "ğŸ—• Date : 2023-09-15\nğŸ‘¤ From : MYM MANDABA SCI <mymmandaba@gmail.com>\nğŸ“¨ To   : \"y.mandaba@gmail.com\" <y.mandaba@gmail.com>\nğŸ§• Subject : Tristan\n---\nYannick, \nVeux-tu bien finir ton dossier de de mande de bourse. \nFaire ce que l&#39;on te demande. Sinon, je devrai payer la scolaritÃ©. 10 000 euros cette annÃ©e. Plus le reste. \nOn te demande &#61;Comment tes clients te payentSi le compte en rÃ©fÃ©rence t&#39;appartientDe donner le relevÃ© du compte Bee pr 2022L&#39;aide familiale pour 2022Je t&#39;envoie le doc Ã  18h30 (Ecolage 7000e)Et si Marc a aidÃ©, il le fait aussi \nJe rÃ©pÃ¨te - J&#39;aide pour 3 ans, de tout ce qui est utile. - AprÃ¨s, Tristan peut avoir une bourse au mÃ©rite, si on lui laisse la paix. (3e Ã  terminale) - Puis, en France, pour l&#39;instant, l&#39;universitÃ© est entiÃ¨rement gratuite. \nNe te laisse pas envahir par les angoisses de Bee. Elle ne connaÃ®t rien. Elle doit juste trouver un job pour nourrir son fils. Ensuite, tu pourras l&#39;Ã©couter se plaindre. Tu parles de Paul, sa femme a un job, ils peuvent tout justifier. \nCommence dÃ¨s ce jour Ã  constituer le reste du dossier de demande de bourse. Si Bee ne donne pas ses relevÃ©s, j&#39;en parle Ã  sa sÅ“ur. \nDÃ©pÃªche toi. C&#39;est encore le week-end. Tu dois tout rendre le 19 ( et non le 20, Ã  l&#39;arrache). Bee doit aller Ã  sa banque aujourd&#39;hui. Sois ferme. Pas de jÃ©rÃ©miades. \n\nEnvoyÃ© depuis mon tÃ©lÃ©phone Huawei"
}