{
  "year": 2023,
  "seq": 70,
  "meta": {
    "date": "2023-04-16",
    "from": "MYM MANDABA SCI <mymmandaba@gmail.com>",
    "to": "Marc MANDABA <marcmandaba@hotmail.com>",
    "subject": "Re: DÃ©part Oman Air"
  },
  "proposals": [],
  "raw_excerpt": "ðŸ—• Date : 2023-04-16\nðŸ‘¤ From : MYM MANDABA SCI <mymmandaba@gmail.com>\nðŸ“¨ To   : Marc MANDABA <marcmandaba@hotmail.com>\nðŸ§• Subject : Re: DÃ©part Oman Air\n---\nBonjour,\nYannick m'a transfÃ©rÃ© les 2 vidÃ©os concernant le surpresseur. Excellent.\nBon courage pour la suite, salle de bain, et cuisine, et portes cuisine et\noffice. Le climat est plus pÃ©nible ici qu'Ã  Bangui, paraÃ®t plus humide. Et\nl'excÃ¨s de climatisation fragilise les muqueuses... FÃ©licitations pour les\ntravaux, et bon retour.\nMaman\n\nLe sam. 8 avr. 2023 Ã  02:10, Marc MANDABA  a\nÃ©crit :\n\n> Bon voyage.\n> Entendu pour le couloir. Je risque de retourner Ã  Bangui dabs les 2\n> semaines qui viennent.\n> Marc\n>\n> Marc Mandaba\n> France +33 611193955 (WhatsApp)\n> ------------------------------\n> *From:* MYM MANDABA SCI \n> *Sent:* Friday, April 7, 2023 9:02:28 PM\n> *To:* y.mandaba@gmail.com ; marcmandaba@hotmail.com  marcmandaba@hotmail.com>\n> *Subject:* DÃ©part Oman Air\n>\n> L'avion va partir Ã  l'heure.\n> Cela fait dÃ©jÃ  12h que j'ai quittÃ© Rennes !\n> C'est le vendredi saint.\n> Dans 24h je serai Ã  Bangkok, si Dieu le veut.\n>\n> Pour Marc: demander Ã  Jo de recouvrir la bibliothÃ¨que du couloir avec le\n> drap blanc mis Ã  sÃ©cher Ã  l'office. A cause des poussiÃ¨res merci. Bonnes\n> FÃªtes de PÃ¢ques.\n>\n> Maman\n>\n> EnvoyÃ© depuis mon tÃ©lÃ©phone Huawei\n>"
}