{
  "year": 2023,
  "seq": 76,
  "meta": {
    "date": "2023-11-26",
    "from": "MYM MANDABA SCI <mymmandaba@gmail.com>",
    "to": "\"y.mandaba@gmail.com\" <y.mandaba@gmail.com>, BeeBaa",
    "subject": "Tristan, et son NoÃ«l"
  },
  "proposals": [],
  "raw_excerpt": "ğŸ—• Date : 2023-11-26\nğŸ‘¤ From : MYM MANDABA SCI <mymmandaba@gmail.com>\nğŸ“¨ To   : \"y.mandaba@gmail.com\" <y.mandaba@gmail.com>, BeeBaa\n <beebeau89@gmail.com>, Tristan Mandaba <trs.mandaba@gmail.com>\nğŸ§• Subject : Tristan, et son NoÃ«l \n---\nYannick, Bee, Tristan, \nIl faudrait que Tristan reprenne son Ã©tude du franÃ§ais, de la gÃ©ographie, de l&#39;histoire, et des Sciences. \nIl ne suffit pas d&#39;Ãªtre intelligent, d&#39;Ãªtre aimÃ©, pour rÃ©ussir sa scolaritÃ©, et, ensuite obtenir un bon travail. \nIL faut acquÃ©rir des connaissances, beaucoup de connaissances, et dans tous les domaines. Il est czpable de grandes choses. Il doit Ãªtre guidÃ©, et soutenu. \nIl se prÃ©pare Ã  entrer en 6eme. C&#39;est une Ã©tape importante pour lui. Il faut Ã´ter tout ce qui n&#39;est pas nÃ©cessaire, et risque de perdre son temps de concentration. Je pense aux jeux sur tÃ©lÃ©phone, et aux palabres. \nPour les congÃ©s de NoÃ«l, c&#39;Ã©tait un projet de Carine. Elle a pris nos billets. Elle a souhaitÃ© une adhÃ©sion de votre part sur les Ã©tapes. Je vais les rÃ©diger Ã  nouveau. Elle souhaite que Joshua et Tristan passent le plus de temps possible ensemble. Elle souhaite un sÃ©jour dans les Ã®les, et aussi la dÃ©couverte d&#39;Angkor. Elle a aussi souhaitÃ© des jours seule avec son fils, en dÃ©but de sÃ©jour. \nJ&#39;attends Tristan chaque jour Ã  18h \n\n\nEnvoyÃ© depuis mon tÃ©lÃ©phone Huawei"
}