{
  "year": 2023,
  "seq": 82,
  "meta": {
    "date": "2023-12-02",
    "from": "MYM MANDABA SCI <mymmandaba@gmail.com>",
    "to": "Yannick Mandaba <y.mandaba@gmail.com>, \"Wadeekanya Soonthornsingha",
    "subject": "ReÂ : Ile de Koh Chang. Lieu choix hÃ´tel. ActivitÃ©s"
  },
  "proposals": [],
  "raw_excerpt": "ğŸ—• Date : 2023-12-02\nğŸ‘¤ From : MYM MANDABA SCI <mymmandaba@gmail.com>\nğŸ“¨ To   : Yannick Mandaba <y.mandaba@gmail.com>, \"Wadeekanya Soonthornsingha\n (Bee)\" <beebeau89@gmail.com>\nğŸ§• Subject : ReÂ : Ile de Koh Chang. Lieu choix hÃ´tel. ActivitÃ©s\n---\nPOUR ANGKOR &#61; SIEM REAP \nBonjour,\nNous vous enverrons un guide de check-in comme nous l&#39;avons confirmÃ©. Veuillez confirmer.\n\nAdresseÂ : Wat Bor Village, Salakomreuk Commune, ville de Siem Reap\n\nCarte GoogleÂ :\nhttps://maps.app.goo.gl/Y5FmAG9dM65tugVk6?g_st&#61;ic\n\nNom de l&#39;Ã©tablissementÂ :\nAmaterasu Angkor\n\nVotre chambre\n2F No.2\n\nClÃ© de la chambre\nDans la boÃ®te Ã  clÃ©s n Â° 3\nMot de passeÂ :4272\n\nArrivÃ©eÂ : 15h 00Ã  22h 00\nDÃ©part Ã  11h\n\nContact de conciergerie hÃ´telierÂ :\n017 657 411\n\nConcierge NomÂ :\nPunlork\n\nET L&#39;AUTRE HOTEL, Ã€ CÃ”TÃ‰, je vais envoyer la photo sur whatsapp, avec l&#39;adresse. \n\nPOUR KOH CHANG, J&#39;AI ENVOYÃ‰ UNE PHOTO DE LA RESA AVEC ADRESSE au WhatsApp de Yannick\n\n\n\n\n\n\nEnvoyÃ© depuis mon tÃ©lÃ©phone Huawei"
}