{
  "year": 2023,
  "seq": 114,
  "meta": {
    "date": "2023-06-14",
    "from": "\"Yannick Mandaba\" <y.mandaba@gmail.com>",
    "to": "<maryvonne.masseron@free.fr>,",
    "subject": "RE: Re: ReÂ : Toa Ziki Copropriete"
  },
  "proposals": [
    {
      "index": -114,
      "etiquette": "Maison Toaziki (usage/location)",
      "category": "MIN",
      "duration": "LT",
      "source": "AI",
      "score": 1,
      "matched_from": [
        "ai_new"
      ]
    }
  ],
  "raw_excerpt": "ğŸ—• Date : 2023-06-14\nğŸ‘¤ From : \"Yannick Mandaba\" <y.mandaba@gmail.com>\nğŸ“¨ To   : <maryvonne.masseron@free.fr>,\n\t\"'Marc MANDABA'\" <marcmandaba@hotmail.com>\nğŸ§• Subject : RE: Re: ReÂ : Toa Ziki Copropriete\n---\nBonjour,\n\nOui effectivement, tant qu'on a pas vraiment un plan final d'ensemble et de finalitÃ© pour Toaziki il faut mieux maintenir les espaces privatif au minimum pour rester flexibles sur l'amÃ©nagement du \"campus\" mais je crois qu'on avait dÃ©jÃ  couvert avec Marc que son espace s'Ã©tende plutÃ´t vers la droite, vers le portail, afin de me laisser un jour qui ne viendra peut-Ãªtre jamais la possibilitÃ© de me mettre plus prÃ¨s ou plus loin de la foret, sachant que ma vision serait d'etre Ã  cheval sur le caniveau Ã  l'image de Toaziki avec un terrasse venant au-dessus du chemin dÃ©sormais coupÃ©.\n\nLa question de surface c'est pour les impÃ´ts? Oui c'est un peu Ã  vous de voir pour l'instant. Je ne sais pas comment Ã§a marche mais s'il y a des paliers en rapport Ã  la surface autant Ãªtre intelligents avec Ã§a. \n\nAprÃ¨s, la symbolique et le statut:\n Maman considÃ¨re notre arrangement comme du chantage de ma part.\nParfois moi-mÃªme je le vois comme Ã§a aussi, parfois non pas du tout.\nCe document vient renforcer un Ã©tat de fait et peut Ãªtre utilisÃ© contre nos arrangements prÃ©alables par Maman, mais quelque part il faut bien faire avec son assentiment donc vaille que vaille.\n\n\nAutre :\n\nCette annÃ©e pour la premiÃ¨re fois le soleil me brule les avant-bras en moto d'une maniÃ¨re nouvelle ainsi que des \"nuÃ©es brulantes\", donc tu roules et d'un coup l'air te brule littÃ©ralement pendant quelques secondes.\nC'est sans doute normal Ã  Ndjamena mais pas normal Ã  Bangkok. Je me pose des questions sur l'Ã©ducation en France et ce qui va arriver pour les gens de couleur en Europe si le conflit se mondialise. Sachez que les Thai sont avec la Chine qui est avec la Russie.\nIls veulent aussi supprimer le rapprochement familial, autoriser la reconnaissance faciale en France... Bee n'est pas FranÃ§aise... ils sont tout stressÃ©s et l'appauvrissement de l'Europe peut dÃ©boucher sur du fascisme en tout cas c'est la direction dÃ©jÃ  autoritaire, sÃ©curitaire, propagande d'Ã©tat, etc..\n\nEn bref je pense que mes vieux jours seront Ã  Bangui si je peux me me le permettre, pour casser les pieds Ã  de Marc comme au premiers jours et jusqu'au bout, \nque Tristan dans 7 ans devra Ã©tudier en France, \nque nous devrons, les parents, etre dans un pays fiscalement et cout de la vie sympa,\net comme j'ai du mal Ã  etre constent pour structurer/pÃ©rÃ©niser dans mon travail, eh bien si je ne fais pas bien il me faudra compter sur l'hÃ©ritage foncier Thai et Bangui pour payer ses Ã©tudes, les biens en France pouvant l'aider pour se loger directement ou indirectement.\nC'est pour Ã§a que je vous embete avec ce terrain soi 25 Ã  Bangkok.\n\nAvec le prix de l'Ã©nergie les logements dans les grandes villes vont monter encore 15 ans et aprÃ¨s plus personne ne pourra se l'offrir et je prÃ©vois une fuite massive vers les campagnes dans toutes les grandes capitales du monde.\nDes villes usines s'organiserons autours des zones aggraires pour se stabiliser vers 500,000 personnes max pour optimiser les transport de personnes et de nourriture. Donc quand Tristan aura mon age les propriÃ©tÃ©s dans Bangkok centre ne vaudront plus rien je pense avec en plus la montÃ©e des eaux et la chaleur. A moins de se tranformer en citÃ© vacance pour la Chine...\nThong Lo ne vallait rien il y a 40 ans et cela va se retourner en 40 ans pareil approx. Le miracle aura durÃ© 80 ans puis le soufflÃ© va retomber.\n\nVous n'etes pas obligÃ©s d'adhhÃ©rer sur le catastrophisme Ã©nergie climat.\nJe vous explique juste que dans 7 ans je risque d'avoir beson de louer ce que je peux Ã  Bangui aussi.\nDonc au lieu de  construire Ã  Bangkok avec les sous de la donation eventuelle de VitrÃ© je peux aussi construire Ã  Bangui... mais franchement ce terrain en centre ville de BKK c'est notre meilleurs plan Ã  court/moyen terme je pense pour louer surement, dans une monaie qui est "
}