{
  "year": 2023,
  "seq": 25,
  "meta": {
    "date": "2023-05-31",
    "from": "MYM MANDABA SCI <mymmandaba@gmail.com>",
    "to": "\"y.mandaba@gmail.com\" <y.mandaba@gmail.com>, \"marcmandaba@hotmail.com\"",
    "subject": "DÃ©claration d'occupation des biens immobiliers"
  },
  "proposals": [],
  "raw_excerpt": "ğŸ—• Date : 2023-05-31\nğŸ‘¤ From : MYM MANDABA SCI <mymmandaba@gmail.com>\nğŸ“¨ To   : \"y.mandaba@gmail.com\" <y.mandaba@gmail.com>, \"marcmandaba@hotmail.com\"\n <marcmandaba@hotmail.com>\nğŸ§• Subject : DÃ©claration d'occupation des biens immobiliers\n---\nBonjour, Yannick et Marc, Je vais effectuer cette dÃ©claration pour la SCI MYM MANDABA. Yannick n&#39;est peut-Ãªtre pas informÃ© de cette nouvelle obligation. C&#39;est une suite de la disparition de la taxe d&#39;habitation du logement principal. ( traduire, recoupement des informations pour traquer les fraudeurs Ã  la dÃ©claration sur la fortune immobiliÃ¨re). Pour les SCI, une seule personne dÃ©clare pour renseigner la situation du bien, habitation principale, ou secondaire, ou bien louÃ©, ou bien vide. Je fais cette dÃ©claration. Avec le nom du locataire. Nous pourrons convenir que celui qui est gÃ©rant fera cette dÃ©claration. Bonne journÃ©e Ã  vous. M\n\nEnvoyÃ© depuis mon tÃ©lÃ©phone Huawei"
}