{
  "year": 2023,
  "seq": 79,
  "meta": {
    "date": "2023-11-29",
    "from": "MYM MANDABA SCI <mymmandaba@gmail.com>",
    "to": "carine mokofio <mokofio@gmail.com>, BeeBaa <beebeau89@gmail.com>,",
    "subject": "Fwd: Ile de Koh Chang. Lieu choix h√¥tel. Activit√©s"
  },
  "proposals": [],
  "raw_excerpt": "üóï Date : 2023-11-29\nüë§ From : MYM MANDABA SCI <mymmandaba@gmail.com>\nüì® To   : carine mokofio <mokofio@gmail.com>, BeeBaa <beebeau89@gmail.com>, \n\tYannick Mandaba <y.mandaba@gmail.com>\nüßï Subject : Fwd: Ile de Koh Chang. Lieu choix h√¥tel. Activit√©s\n---\n---------- Forwarded message ---------\nDe : MYM MANDABA SCI \nDate: mer. 29 nov. 2023 √† 11:22\nSubject: Ile de Koh Chang. Lieu choix h√¥tel. Activit√©s\nTo: MYM MANDABA SCI \n\n\nhttps://voyagesautenteo.com/thailande/conseils/plages-sud/kohchang/#:~:text=Pour%20aller%20%C3%A0%20Koh%20Chang,Chang%20rendre%20depuis%20la%20Capitale\n.\n\n\nmerci de me donner votre avis, chacun de vous,\n\n( Yannick serait d'accord pour un s√©jour de tous, √† Angkor, puis √† Koh\nChang )\n\npour l'h√©bergement , qui serait au nord ouest de l'ile de Koh Chang,\npr√®s de la plage Sable Blanc\n\npour le transport, on peut pr√©voir car c'est peu charg√©,\n= le retour du 1 er janvier en avion depuis l'aeroport de Trat, et jusqu'√†\nl'aeroport de BKK, o√π nous avons r√©serv√© une chambre, le 1 er au soir. (\npour tous ceux qui veulent rentrer ce jour-l√† ), p√©riode creuse.\n\nVoir le document joint, qui n'est pas un site publicitaire, mais un site de\nvoyageurs.\n\nBonne journ√©e √† tous.\n\nEnvoy√© depuis mon t√©l√©phone Huawei"
}