{
  "year": 2023,
  "seq": 38,
  "meta": {
    "date": "2023-08-11",
    "from": "MYM MANDABA SCI <mymmandaba@gmail.com>",
    "to": "Yannick Mandaba <y.mandaba@gmail.com>",
    "subject": "ReÂ : Coude"
  },
  "proposals": [
    {
      "index": -38,
      "etiquette": "Paiements via Western Union",
      "category": "MIN",
      "duration": "LT",
      "source": "AI",
      "score": 1,
      "matched_from": [
        "ai_new"
      ]
    }
  ],
  "raw_excerpt": "ğŸ—• Date : 2023-08-11\nğŸ‘¤ From : MYM MANDABA SCI <mymmandaba@gmail.com>\nğŸ“¨ To   : Yannick Mandaba <y.mandaba@gmail.com>\nğŸ§• Subject : ReÂ : Coude\n---\nBien reÃ§u, Yannick. Mais que puis-je faire ? Tu as donnÃ© trop d'info sur ton problÃ¨me de coude Ã  l'assurance... As-tu reÃ§u un devis finalement ? \nPour la comptable les rÃ©fÃ©rences bancaires ne collent pas. Puis-je lui faire un WhatsApp ?. Sinon j'irai Ã  la banque Ã  VitrÃ©. \nLe WU je le ferai aussi demain. \nJe dois virer de l'argent sur ton compte SG car les impÃ´ts vont prÃ©lever un peu plus en mensuel. \nJe ne t'oublie pas. \nTristan me prend beaucoup de temps, bien qu'il soit trÃ¨s gentil\nBisous\n\nEnvoyÃ© depuis mon tÃ©lÃ©phone Huawei\n\n-------- Message original --------\nDeÂ : Yannick Mandaba &lt;y.mandaba@gmail.com&gt;\nDateÂ : ven. 11 aoÃ»t 2023 Ã  03:14\nÃ€Â : MYM MANDABA SCI &lt;mymmandaba@gmail.com&gt;\nObjetÂ : Coude\nÂ Il y a encore 1 semaine de Ã§a ,les pompes je sentais une lÃ©gÃ¨re douleur de tension dansÂ  l&#39;articulation maintenant c&#39;est plus prononcÃ© donc j arrÃªte les efforts dessus.\nProgression negative 1 mois aprÃ¨s la blessure. Donc Ã§a ne va pas.\nLe tendon peut-Ãªtre un peu touchÃ© demande Ã  Ãªtre laissÃ© tranquille?\nPas de douleur aiguÃ« je peux faire mes pompes si je veux . La boule va gonfler puis se rÃ©sorber un peu aprÃ¨s l&#39;effort. Ã‡a va va dans le sens inflammation bursae.La douleur j&#39;ai l&#39;impression cela s&#39;empire au lieu de s&#39;amÃ©liorer par contre.\nEt oui j&#39;ai vu un truc horrible de bactÃ©ries mangeuses d dos d&#39;une infection aprÃ¨s bain de pieds avec poisson mangeurs de champignons. La fille a Ã©tÃ© imputÃ©e donc Ã§a fait flipper."
}