{
  "year": 2023,
  "seq": 107,
  "meta": {
    "date": "2023-03-05",
    "from": "maryvonne masseron-mandaba <maryvonnemm@hotmail.com>",
    "to": "BeeBaa <beebeau89@gmail.com>",
    "subject": "reÃ§u"
  },
  "proposals": [],
  "raw_excerpt": "ðŸ—• Date : 2023-03-05\nðŸ‘¤ From : maryvonne masseron-mandaba <maryvonnemm@hotmail.com>\nðŸ“¨ To   : BeeBaa <beebeau89@gmail.com>\nðŸ§• Subject : reÃ§u\n---\nMadame,\nVeuillez menvoyer le reu des 300 euros que je vous ai envoys, hier.\nIl sagit du reu de lenvoi par western union.\nCette somme tait destine  payer les leons de piano de Tristan, et aussi lui acheter un cahier de vocabulaire, pour remplacer celui que je lui avais envoy. Ctait un cahier  spirale,  couverture plastifie jaune. Jy avais crit des devinettes, et des charades. Vous avez arrach ces pages, et avez utilis ce cahier pour vous-mme , car vous disiez que vous le trouviez beau, que vous navez pas lu son nom sur la couverture, ni reconnu mon criture.\nAu lieu dacheter  Tristan des boissons sucres, et envoyer des photos pour me narguer, sil vous plait, achetez un cahier de vocabulaire. Depuis un an il crit son vocabulaire franais sur des feuilles volantes, et ne peut tudier.\nJe vous rappelle que je tiens  sa bonne ducation, et que je lui donne depuis son CP, et surtout en confinement, au moins une heure de culture gnrale, en langue franaise, chaque jour, et ce, au milieu de vos cris, rires, et ricanements .\nUtilisez un traducteur, si besoin.\nDepuis ces annes, pendant lesquelles vous frquentez assidument le milieu franais de Bangkok, vous devriez utiliser facilement leur langue.\nMerci de conduire chaque dimanche, mon petit-fils, Tristan au cours de piano.\nMerci de ne pas utiliser WhatsApp, car jy reois de votre part des photos choquantes.\nA vous lire sur courriels.\nMaryvonne mandaba\n\n\nEnvoy  partir de Courrier pour Windows"
}