{
  "year": 2023,
  "seq": 50,
  "meta": {
    "date": "2023-08-17",
    "from": "MYM MANDABA SCI <mymmandaba@gmail.com>",
    "to": "\"y.mandaba@gmail.com\" <y.mandaba@gmail.com>, BeeBaa",
    "subject": "M√©chancet√© ??? Perversit√© ???"
  },
  "proposals": [
    {
      "index": -50,
      "etiquette": "Visa / immigration",
      "category": "MIN",
      "duration": "LT",
      "source": "AI",
      "score": 1,
      "matched_from": [
        "ai_new"
      ]
    }
  ],
  "raw_excerpt": "üóï Date : 2023-08-17\nüë§ From : MYM MANDABA SCI <mymmandaba@gmail.com>\nüì® To   : \"y.mandaba@gmail.com\" <y.mandaba@gmail.com>, BeeBaa\n <beebeau89@gmail.com>\nüßï Subject : M√©chancet√© ??? Perversit√© ??? \n---\nYannick. Bee, Merci de me tenir inform√©e de la fa√ßon dont vous allez vous excuser, aupr√®s de Tristan, et de moi, Pour la vid√©o pornographique qui est pass√©e, le 28 au soir, √† 21 heures 30, heure de France, Quand nous faisions une partie de Monopoly, Et que la m√®re de Tristan avait demand√© √† regarder la partie jusqu&#39;√† la fin. J&#39;avais dirig√© la cam√©ra de mon smartphone sur Tristan, afin que sa m√®re puisse le voir, et, tout-√†-coup le visage de Tristan s&#39;est fig√©. Je n&#39;ai pas eu le temps de bien voir, car Tristan a √©teint le t√©l√©phone. (mais il me semble que c&#39;√©tait Bee plus jeune, qui faisait une vid√©o de drague avec la langue). Tristan m&#39;a dit que sa maman faisait des mouvements de langue, d&#39;abord comme on l√©che, puis ensuite avec la langue en forme de U. Et pendant 10 jours, il s&#39;exer√ßant √† cela devant le miroir. Et me demandait √† quoi cela pouvait servir. Je ne connais rien √† cela, mais Tristan est tout rouge quand il en parle, comme honteux. Que Madame WS montre cette vid√©o √† Yannick, et que Yannick m&#39;explique le but de cette vid√©o choquante pour un enfant de 10 ans. (suite au WhatsApp, on ne peut pas comparer C√©cile √† Bee, ni imaginer qu&#39;elle fasse des saloperies pareilles, ni qu&#39;elle manque autant de retenue ni de d√©licatesse) J&#39;ajouterai que Tristan souffre de d√©consid√©ration, de toute la famille, √† cause de la mauvaise conduite de sa m√®re. Personne n&#39;est dupe. \n\nEnvoy√© depuis mon t√©l√©phone Huawei"
}