{
  "year": 2023,
  "seq": 101,
  "meta": {
    "date": "2023-02-10",
    "from": "maryvonne masseron-mandaba <maryvonnemm@hotmail.com>",
    "to": "marcmandaba <marcmandaba@gmail.com>, \"y.mandaba@gmail.com\"",
    "subject": "voyage Ã  Bangui FÃ©vrier 2023"
  },
  "proposals": [],
  "raw_excerpt": "ðŸ—• Date : 2023-02-10\nðŸ‘¤ From : maryvonne masseron-mandaba <maryvonnemm@hotmail.com>\nðŸ“¨ To   : marcmandaba <marcmandaba@gmail.com>, \"y.mandaba@gmail.com\"\n\t<y.mandaba@gmail.com>\nðŸ§• Subject : voyage Ã  Bangui FÃ©vrier 2023\n---\nMarc,\nYannick,\n\nMon tat de sant ne me permet pas de me rendre  Bangui demain.\nMarc peut-il me proposer une autre date ?\nJe nautorise aucune intrusion dans ma Salle de Bains et ma Chambre en mon absence.\n\nLundi, le RV  Pergolse avec le locataire et le mtreur des Ets Alone a encore chou.\nCette fois le prtexte tait un contact Covid de Monsieur David.\nDepuis 9h du matin, jai dit et redit que cela nest plus un motif disolement, ils communiquaient tous les deux cependant, et je suis arriv  11h pour rien. Retour  Rennes  12h45.\n\nNous devons protger Tristan. Ce ne sont pas des hallucinations. Avis de professionnels.\nJattends une invitation  voir mes petits-enfants, o que ce soit.\n\n\nEnvoy  partir de Courrier pour Windows"
}