{
  "year": 2023,
  "seq": 71,
  "meta": {
    "date": "2023-11-11",
    "from": "MYM MANDABA SCI <mymmandaba@gmail.com>",
    "to": "marcmandaba <marcmandaba@gmail.com>",
    "subject": "Heureusement que j'Ã©tais lÃ "
  },
  "proposals": [],
  "raw_excerpt": "ğŸ—• Date : 2023-11-11\nğŸ‘¤ From : MYM MANDABA SCI <mymmandaba@gmail.com>\nğŸ“¨ To   : marcmandaba <marcmandaba@gmail.com>\nğŸ§• Subject : Heureusement que j'Ã©tais lÃ \n---\nIci, il faut tous les jours quelqu'un de vigilant...et Ã©duquÃ©...\n\nCe midi, Juliana met la machine en route, et s'en va.\nAu bout de 30 mn  je n'entends pas de remplissage de la machine.\n\nL'arrivÃ©e d'eau Ã  Ã©tÃ© fermÃ©e ( par les gens qui ont mis le filtre hier ?\nMais rien Ã  voir avec l'arrivÃ©e d'eau au filtre...)\n.\nJ'ouvre le robinet, la machine fonctionne, mais le robinet a l'extÃ©rieur\nfuit +++\nPhilippe qui Ã©tait prÃ©sent ne voit rien. Il dit que ce robinet fuit pour la\n1Ã¨re fois ...\n\n\nJe vais fermer l'eau quand la lessive sera finie.\n\nMerci Ã  Marc de prÃ©venir Jonhattan.\n\nMoi, je revis le passÃ©, entourÃ©e de gens idiots, et surtout pas Ã©duquÃ©s, et\nqui ont toujours raison, c'est comme Ã  Bangkok."
}