{
  "year": 2023,
  "seq": 77,
  "meta": {
    "date": "2023-11-26",
    "from": "MYM MANDABA SCI <mymmandaba@gmail.com>",
    "to": "carine mokofio <mokofio@gmail.com>, \"y.mandaba@gmail.com\"",
    "subject": "No√´l 2024 de Joshua et Tristan"
  },
  "proposals": [],
  "raw_excerpt": "üóï Date : 2023-11-26\nüë§ From : MYM MANDABA SCI <mymmandaba@gmail.com>\nüì® To   : carine mokofio <mokofio@gmail.com>, \"y.mandaba@gmail.com\"\n <y.mandaba@gmail.com>, BeeBaa <beebeau89@gmail.com>\nüßï Subject : No√´l 2024 de Joshua et Tristan \n---\n13 d√©cembre Vol G7KCA2 emirate EK76Paris Duba√Ø, puis Duba√Ø Bkk\n14 d√©cembre Arriv√©e du vol EK 370 vers 18hTaxi vers le condo r√©serv√© du 14 au 25 decembre\n15 decembreVendredi, Tristan est libre √† 15h, bureau √† 16h, Son papa peut l&#39;amener au condo ? \nPr√©voir une activit√© le samedi 16 et dimanche 17 d√©cembre, par exemple Ayuttaya. Et/ou wat Prao, Et/ou grand palais\nDu lundi 18 d√©cembre au 22 d√©cembre, Carine pr√©voit un voyage avec Joshua. \nLe samedi 23 et dimanche 24, nous pr√©parons et f√™tons No√´l au Condo, (ou bien chez le papa de Bee s&#39;il pr√©f√®re). Pat et ses parents seront les bienvenus. Pr√©voir par Bee d&#39;amener notre cr√®che, nos boules, nos guirlandes. Une seule soir√©e au restaurant sur les 2 jours. \nLe 25 d√©cembre au matin, van pour le Cambodge, logement √† Siem Reap, tout pr√®s d&#39;Angkor Vat. Appartement avec 2 chambres, s√©jour, piscine. Le proprio est japonais. Visites le 26 et le 27: Angkor Vat, puis tout le site avec le Bayoun. Peut se faire en taxi ou √† velo. Le 26 au soir pr√©voir un d√Æner avec spectacle de danses et musique khmer Apsara. \nRetour le 28 ou le 29, par la m√™me voie, ou directement par le sud Cambodge. Si possible, directement van pour le port o√π nous allons embarquer, ce qui √©vite de retourner en ville. Pr√©voir un h√¥tel √† l&#39;embarcad√®re pour RV avec Bee. Si cela convient. \nLe 29 30 31 et 1 &#61; 4 nuits √† Koh Chang ou autre... \nUn van nous ram√®nera directement du port √† l&#39;h√¥tel, r√©serv√©, √† l&#39;a√©roport de Bkk. Pour la derni√®re nuit, du 1 au 2. \nLe 2 janvier, √† 9h30, vol Bkk Duba√Ø 13h15, 14h50 Paris, R√©f G7KCA2, Emirates EK 375 Puis EK 75.Arriv√©e √† Paris vers 19h30\n\nCeci est la copie du projet, oral du mois d&#39;avril, √©crit du mois de juin. \nChacun doit contribuer, par des remarques, des id√©es, des rajouts. Qui ne dit mot, consent. (proverbe bien connu). Enjoy :)Maryvonne \n\nEnvoy√© depuis mon t√©l√©phone Huawei"
}