{
  "year": 2023,
  "seq": 87,
  "meta": {
    "date": "2023-06-12",
    "from": "maryvonne.masseron@free.fr",
    "to": "Marc MANDABA <marcmandaba@hotmail.com>",
    "subject": "ReÂ : Re: ReÂ : Toa Ziki Copropriete"
  },
  "proposals": [],
  "raw_excerpt": "ğŸ—• Date : 2023-06-12\nğŸ‘¤ From : maryvonne.masseron@free.fr\nğŸ“¨ To   : Marc MANDABA <marcmandaba@hotmail.com>\nğŸ§• Subject : ReÂ : Re: ReÂ : Toa Ziki Copropriete\n---\nBonjour, \nPour vous 2, je suis OK pour le document Toa-Ziki, aprÃ¨s corrections =\n\n- sur la page 1, Ã©tat civil\nC'est Yannick, Yves, Sala-Kosso MANDABA, Ã  rappeler dans le texte sous la forme Yannick MANDABA\n(et corriger l'adresse, c'est 64 soÃ¯ Barbot 2, etc...) \nC'est Marc Olona MANDABA (sans virgule), Ã  rappeler dans le texte sou\ns la forme Marc MANDABA. \n\nIL FAUT REVOIR LES SURFACES. \nA mon avis Toa-Ziki fait 350 m2, \nOlona 250 m2, \nSala-Kosso donc 250 m2, \nPour Ãªtre juste. \nMais je respecte d'autres choix dÃ©claratifs pour l'imposition. \n\nEt revoir l'article 2 avec maÃ®tre Roosalem\nConfusion entre\n \"l'immeuble\" et la \"copropriÃ©tÃ©\" \nL'immeuble en copropriÃ©tÃ© est situÃ©... sur un terrain d'une superficie de 4012 m2,\nEt restituer les parties en rouge, il me semble, pour la comprÃ©hension de l'ensemble du texte...non ? \n\nRemplacer une Cour , par un Jardin ? \n\nA discuter\n\nMerci pour vendredi, un basket au jardin de la Planchette, 15mn, puis le goÃ»ter. \n\nBonne journÃ©e \n\n\n\n\n\n\n\n\nmaryvonne masseron - 41 rue du puits-mauger 35000 rennes 0299302000 0680078113"
}