{
  "year": 2023,
  "seq": 8,
  "meta": {
    "date": "2023-03-03",
    "from": "maryvonne masseron-mandaba <mymmandaba@gmail.com>",
    "to": "Yannick Mandaba <y.mandaba@gmail.com>",
    "subject": "REÂ : Photo qui circule sur le net !!!"
  },
  "proposals": [
    {
      "index": -8,
      "etiquette": "Frais d'Ã©cole / bus Tristan",
      "category": "MIN",
      "duration": "LT",
      "source": "AI",
      "score": 1,
      "matched_from": [
        "ai_new"
      ]
    },
    {
      "index": -8,
      "etiquette": "Frais bus Tristan",
      "category": "MIN",
      "duration": "LT",
      "source": "AI",
      "score": 1,
      "matched_from": [
        "ai_new"
      ]
    }
  ],
  "raw_excerpt": "ğŸ—• Date : 2023-03-03\nğŸ‘¤ From : maryvonne masseron-mandaba <mymmandaba@gmail.com>\nğŸ“¨ To   : Yannick Mandaba <y.mandaba@gmail.com>\nğŸ§• Subject : REÂ : Photo qui circule sur le net !!!\n---\nDes avis, trÃ¨s gÃªnÃ©s, sont revenus des psychiatres&nbsp;:Â«&nbsp; câ€™est une photo sensuelleÂ«&nbsp;elle ne donne pas un baiser Ã  son enfant, elle le prendÂ«&nbsp;elle Ã©veille un enfant Ã  lâ€™Ã©rotismeÂ«&nbsp;elle prend du plaisir pour elle-mÃªme dans ce baiserÂ«&nbsp;elle abuse du corps de lâ€™enfantÂ«&nbsp;la maman Ã©tant a priori protectrice, il ne sait pas quâ€™il peut refuserÂ«&nbsp;a tâ€™elle lâ€™intention de diffuser cette photo&nbsp;?Â«&nbsp;dans quel but cette photo a tâ€™elle Ã©tÃ© rÃ©alisÃ©e&nbsp;?Â«&nbsp;Tristan a tâ€™il vu cette photo&nbsp;?Â«&nbsp;si, oui, quelle a Ã©tÃ© sa rÃ©action&nbsp;?&nbsp;Câ€™est trÃ¨s grave pour les trois psychiatres.&nbsp;Bee doit parler de tout cela avec un psychiatre.Si elle ne le souhaite pas, Yannick peut le faireTristan peut en parler au pÃ©diatre Ã  sa visite de 9 ans&nbsp;&nbsp;EnvoyÃ© Ã  partir de Courrier pour Windows&nbsp;De&nbsp;: Yannick Mandaba\nEnvoyÃ© le&nbsp;:samedi 7 janvier 2023 08:21\nÃ€&nbsp;: MYM MANDABA SCI\nCc&nbsp;: Masseron; marcmandaba; Cecile M\nObjet&nbsp;:Re: Photo qui circule sur le net !!!&nbsp;Quand je t'ai donnÃ© accÃ¨s Ã  Facebook je t'avais demandÃ© de ne rien commenter...Je n'ai pas le temps de poster des photos donc Bee le fait sur son compte et elle me 'tag' pour que mes amis voient nos photos.&nbsp;No amis, pas 'tout le net'.&nbsp;Aussi quand on prend les gens en mouvement cela crÃ©e des effets. J'Ã©tais lÃ , c'est juste un bisous.&nbsp;Les gens ne sont pas si mauvais.&nbsp;C'est toi mÃªme qui gÃ©nÃ¨re de la mochetÃ© lÃ  oÃ¹ il n'y en a pas.&nbsp;Pourquoi CÃ©cile est dans ton email et pas Bee?&nbsp;Bon je savais que je prenais un risque avec FB.&nbsp;&nbsp;et je te connais donc quand j'ai vu la photo dans mon tÃ©lÃ©phone j'ai dit Ã  Bee de ne pas poster celle-ci, car il y en avait d'autres du mÃªme moment,50 millisecondes avant et aprÃ¨s, mais trop tard.&nbsp;Elle a demandÃ© aux amis si la photo choque, don't une psychologue et les gens la trouvent touchante.&nbsp;Moi, contaminÃ© par ton excessive sensiblerie, j'ai tout de suite pensÃ© que ce n'est pas appropriÃ© Ã  partager. Mais pas pour des histoires dÃ©gueulasses freudiennes. Juste que c'est trop intime.&nbsp;Mais chacun est libre de s'exposer avec plus ou moins d'obscÃ©nitÃ© (comme tu le fais ici mÃªme vav Marc et CÃ©cile).&nbsp;Ceux que cela intÃ©resse retardent et les autres cliquent sur 'voir moins de trucs de Yannick' et basta.&nbsp;RÃ©f: 'Ames sensibles s'abstenir.'&nbsp;Nous postons sans trop trier et ceux qui pensent mal de nous trouverons sÃ»rement des filons Ã  exploiter.&nbsp;&nbsp;C'est dommage que tu n'aies pas pu te retenir de critiquer, de respecter le partage...&nbsp;&nbsp;On Thu, Jan 5, 2023, 11:47 PM MYM MANDABA SCI &lt;mymmandaba@gmailcom&gt; wrote:Conseil de famille nÂ°2.Je suis heurtÃ©e, moi la grand mÃ¨re de Tristan, par cette photo, qui est accessible aux contacts de Yannick, sa famille, ses amis, et aux contacts de Bee, sa famille, et ses amis lgbtq+.&nbsp;&nbsp;Qu'en pensez vous ?&nbsp;&nbsp;Si cette photo, et ce qu'elle reprÃ©sente d'abus du corps de l'enfant, Ã©tait arrivÃ©e Ã  la connaissance d'un professionnel de SantÃ©, en France,&nbsp;Il y auraitSignalement Ã  la psychologue de l'Ã©cole&nbsp;Signalement aux Services SociauxSignalement au Procureur de la RÃ©publique.&nbsp;&nbsp;Tristan a 9 ans.&nbsp;Il n'a pas de chambreIl n'a pas vraiment de litSon lit est collÃ© Ã  celui de sa mÃ¨re...&nbsp;&nbsp;Dans ma pratique de PÃ©diatre FranÃ§ais, je pourrais Ãªtre mise en accusation par le Conseil de l'ordre des MÃ©decins pour non dÃ©nonciation de suspicion d'abus sur un mineur, et Ã©ventuellement mise en accusation en Justice.&nbsp;&nbsp;Je rappelle que 80% des abus ont lieu dans le contexte familial.&nbsp;&nbsp;Je vais en parler Ã  3 consÅ“urs Pedopsychiatres pour recevoir leur avis&nbsp;Dr M Delisle.&nbsp;Dr N Coulon.&nbsp;Dr J Duval.&nbsp;&nbsp;\nSans virus.www.avg.com"
}