{
  "year": 2023,
  "seq": 80,
  "meta": {
    "date": "2023-11-30",
    "from": "MYM MANDABA SCI <mymmandaba@gmail.com>",
    "to": "\"Wadeekanya Soonthornsingha (Bee)\" <beebeau89@gmail.com>",
    "subject": "Re¬†: Ile de Koh Chang. Lieu choix h√¥tel. Activit√©s"
  },
  "proposals": [],
  "raw_excerpt": "üóï Date : 2023-11-30\nüë§ From : MYM MANDABA SCI <mymmandaba@gmail.com>\nüì® To   : \"Wadeekanya Soonthornsingha (Bee)\" <beebeau89@gmail.com>\nüßï Subject : Re¬†: Ile de Koh Chang. Lieu choix h√¥tel. Activit√©s\n---\nBonjour, je pr√©cise √† nouveau, qu'il n'y a pas de changement de programme. \nD√©part le 25 d√©cembre au matin, en van, de Bkk √† Siem Reap. ( 5h30 de route) \nRetour le 28, de Siem Reap √† Trat, en van, (5h30 de route), avec 3 alternatives selon les disponibilit√©s du transporteur, et les heures du ferry, pour la nuit de 28 au 29,- soit une nuit de plus √† Angkor - soit une nuit au port de Trat- soit une nuit en plus √† l'h√©bergement de Koh Chang. ( vous me dites et je m'occupe de l'h√¥tel). \nRetour le 1er janvier, en van, de Trat √† l'a√©roport de Bkk, mais Carine Joshua et moi pouvons le faire en avion, si vous pr√©f√©rez ne pas √™tre stress√©s, car nous avons une nuit r√©serv√©e √† l'a√©roport. Si Bee trouve un van pour nous tous, c'est encore mieux, mais il faut pr√©ciser, √† la r√©servation, que la 1ere √©tape sera l'a√©roport, avant de vous amener en ville. \nMerci √† Bee de chiffrer, afin que je vous avance la somme, par western union. \nJ'avais juste une question, est-ce que le ferry prend des voyageurs sans v√©hicule ? Ou faut-il prendre un taxi √† Trat Port qui nous am√®ne ensuite √† l'h√¥tel ? \nBonne journ√©e \n\n\n\nEnvoy√© depuis mon t√©l√©phone Huawei\n\n-------- Message original --------\nDe¬†: \"Wadeekanya Soonthornsingha (Bee)\" &lt;beebeau89@gmail.com&gt;\nDate¬†: mer. 29 nov. 2023 √† 15:50\n√Ä¬†: MYM MANDABA SCI &lt;mymmandaba@gmail.com&gt;\nCc¬†: carine mokofio &lt;mokofio@gmail.com&gt;, Yannick Mandaba &lt;y.mandaba@gmail.com&gt;\nObjet¬†: Re: Ile de Koh Chang. Lieu choix h√¥tel. Activit√©s\nHello all,\nAll the plans are fine by me &amp; Yannick. We just concerned about the transports;- Van to Cambodia from Bkk- Van from Cambodia to Trat- Plane from Trat (Kho Chang) to Bkk on the 1st January.\n\n\nBest Regards,\nWadeekanya S. (Bee)\nOn 29 Nov 2023, at 19:36, MYM MANDABA SCI &lt;mymmandaba@gmail.com&gt; wrote:\n\n&#xfeff;\n\n---------- Forwarded message ---------\nDe¬†: MYM MANDABA SCI &lt;mymmandaba@gmail.com&gt;\nDate: mer. 29 nov. 2023 √†¬†11:22\nSubject: Ile de Koh Chang. Lieu choix h√¥tel. Activit√©s \nTo: MYM MANDABA SCI &lt;mymmandaba@gmail.com&gt;\n\n\nhttps://voyagesautenteo.com/thailande/conseils/plages-sud/kohchang/#:~:text&#61;Pour%20aller%20%C3%A0%20Koh%20Chang,Chang%20rendre%20depuis%20la%20Capitale.\n\n\nmerci de me donner votre avis, chacun de vous,\n( Yannick serait d&#39;accord pour un s√©jour de tous, √† Angkor, puis √† Koh Chang )\npour l&#39;h√©bergement , qui serait au nord ouest de l&#39;ile de Koh Chang,pr√®s de la plage Sable Blanc\npour le transport, on peut pr√©voir car c&#39;est peu charg√©,&#61; le retour du 1 er janvier en avion depuis l&#39;aeroport de Trat, et jusqu&#39;√† l&#39;aeroport de BKK, o√π nous avons r√©serv√© une chambre, le 1 er au soir. ( pour tous ceux qui veulent rentrer ce jour-l√† ), p√©riode creuse.\nVoir le document joint, qui n&#39;est pas un site publicitaire, mais un site de voyageurs.\nBonne journ√©e √† tous.\nEnvoy√© depuis mon t√©l√©phone Huawei"
}