{
  "year": 2023,
  "seq": 57,
  "meta": {
    "date": "2023-09-16",
    "from": "MYM MANDABA SCI <mymmandaba@gmail.com>",
    "to": "\"y.mandaba@gmail.com\" <y.mandaba@gmail.com>, \"marcmandaba@hotmail.com\"",
    "subject": "Travaux Pergolese"
  },
  "proposals": [],
  "raw_excerpt": "ğŸ—• Date : 2023-09-16\nğŸ‘¤ From : MYM MANDABA SCI <mymmandaba@gmail.com>\nğŸ“¨ To   : \"y.mandaba@gmail.com\" <y.mandaba@gmail.com>, \"marcmandaba@hotmail.com\"\n <marcmandaba@hotmail.com>\nğŸ§• Subject : Travaux Pergolese \n---\nBonjour, Nous avons RV, Charbel Braidy et moi, avec un nouvel entrepreneur en rÃ©novation dans l&#39;ancien. Il s&#39;agit de refaire, entrÃ©e, salle d&#39;eau, cuisine. Le RV est le 20 septembre Ã  14h, retour dans la journÃ©e. S&#39;il y a des points dÃ©licats, je vous en parlerai. Mais il doit y avoir d&#39;abord l&#39;Ã©tablissement du devis. L&#39;argent disponible n&#39;Ã©volue pas, car il y a eu des dÃ©penses, Fidal, 2 factures, dÃ©claration &#43;dÃ©claration occupation, et taxe fonciÃ¨re qui a augmentÃ© de 30%., et je dois faire un virement bancaire Ã  chacun de nous pour que Yannick puisse payer ses impÃ´ts prÃ©levÃ©s sur son compte. Je vous tiens informÃ©s. M\n\nEnvoyÃ© depuis mon tÃ©lÃ©phone Huawei"
}