{
  "year": 2023,
  "seq": 21,
  "meta": {
    "date": "2023-05-07",
    "from": "MYM MANDABA SCI <mymmandaba@gmail.com>",
    "to": "\"y.mandaba@gmail.com\" <y.mandaba@gmail.com>, \"marcmandaba@hotmail.com\"",
    "subject": "Rappel"
  },
  "proposals": [],
  "raw_excerpt": "ğŸ—• Date : 2023-05-07\nğŸ‘¤ From : MYM MANDABA SCI <mymmandaba@gmail.com>\nğŸ“¨ To   : \"y.mandaba@gmail.com\" <y.mandaba@gmail.com>, \"marcmandaba@hotmail.com\"\n <marcmandaba@hotmail.com>\nğŸ§• Subject : Rappel\n---\nBonsoir, Je n&#39;ai pas de nouvelles depuis longtemps. Je vous rappelle que ma boÃ®te mail  &#34;&#34; &#34;maryvonnemm&#64;hotmail.com&#34; &#34;&#34; ne peut ni recevoir, ni envoyer de messages. Car elle est saturÃ©e, 8Go pour 5Go possibles. Yannick n&#39;a pu m&#39;aider Ã  rÃ©gler ce problÃ¨me. On me propose des choix pour Microsoft ou 365 ou famille ou autres, mais c&#39;est en langue anglaise. J&#39;ai peur de faire des erreurs. J&#39;ai supprimÃ© dÃ©jÃ  beaucoup de courriels, mais cela ne libÃ¨re pas d&#39;espace. Merci de m&#39;Ã©crire sur mymmandaba&#64;gmail.com ou sur maryvonne.masseron&#64;free.frJ&#39;espere que vous Ãªtes en paix. Merci Ã  Marc de donner 250e sur mes fonds Ã  Maxime pour sa fÃªte , 250e Ã  LÃ©a pour son anniversaire, et 250e Ã  Tristan pour ses cours de jiu-jitsu. Maman\n\nEnvoyÃ© depuis mon tÃ©lÃ©phone Huawei"
}