{
  "year": 2023,
  "seq": 65,
  "meta": {
    "date": "2023-10-22",
    "from": "MYM MANDABA SCI <mymmandaba@gmail.com>",
    "to": "Yannick Mandaba <y.mandaba@gmail.com>",
    "subject": "L' attitude de W. S. est inacceptable."
  },
  "proposals": [],
  "raw_excerpt": "ğŸ—• Date : 2023-10-22\nğŸ‘¤ From : MYM MANDABA SCI <mymmandaba@gmail.com>\nğŸ“¨ To   : Yannick Mandaba <y.mandaba@gmail.com>\nğŸ§• Subject : L' attitude de W. S. est inacceptable.\n---\nYannick,\nVoilÃ  le dernier essai de salir notre famille, reÃ§u ce 22 octobre 2023...\n\n- le compte whatsapp prÃ©cÃ©dent de Tristan, oÃ¹ j'ai des leÃ§ons et des cartes\nque nous utilisons encore, porte maintenant la photo d'une femme nue... Ce\ncompte est bien intitulÃ© \"Tristan Mandaba\". Toute la famille Mandaba peut\nÃªtre incriminÃ©e pour pornographie, voire pedo pornographie puisque le\ncompte est celui d'un mineur.\nEt toutes les personnes qui utilisaient ce compte, moi, le groupe\" family\",\n( famille franÃ§aise), le groupe\" stupids\"(  la famille ThaÃ¯ et ses amis\nThaÃ¯), ont maintenant cette PHOTO DE Profil, d'une femme nue dans une\nriviÃ¨re .\n\n- Le site de jeu, avec les mentions en ThaÃ¯, sur la lettre Y, a Ã©tÃ© visitÃ©\npar mes amies qui sont prof de danse, et directrices de conservatoires en\nrÃ©gion Aquitaine et Paca.\n\n- Elle utilise maintenant, pour son profil sur les rÃ©seaux sociaux, des\nphotos de ses niÃ¨ces, les filles de P pom.\n\n- la photo du baiser sur la bouche circule encore auprÃ¨s de 47 followers.\nTu peux demander Ã  David Monceau ce qu'il en pense...\n\nCela doit s'arrÃªter.\nPour moi, c'est une forme de chantage, ou mÃªme de harcellement en ce jour\ndu 22 octobre, jour de deuil, anniversaire du dÃ©cÃ¨s de votre papa.\nJe lui ai pourtant dit que je vais assurer toute la scolaritÃ© et les Ã©tudes\nsupÃ©rieures de Tristan.\nPour le reste elle doit se trouver un travail.\nJ'ai travaillÃ© jusqu'Ã  70 ans, pourquoi pas elle ?\n\nRemettre les sites en ordre, nettoyer ce qui peut nous salir, c'est ma\ndemande. C'est le dernier avertissement, avant le dÃ©pÃ´t de plainte. Je\nserai Ã  Bangkok du 15 au 31 dÃ©cembre.\n\nMaryvonne Mandaba Masseron"
}