{
  "year": 2023,
  "seq": 81,
  "meta": {
    "date": "2023-12-02",
    "from": "MYM MANDABA SCI <mymmandaba@gmail.com>",
    "to": "\"Wadeekanya Soonthornsingha (Bee)\" <beebeau89@gmail.com>",
    "subject": "Re¬†: Ile de Koh Chang. Lieu choix h√¥tel. Activit√©s"
  },
  "proposals": [
    {
      "index": -81,
      "etiquette": "Visa / immigration",
      "category": "MIN",
      "duration": "LT",
      "source": "AI",
      "score": 1,
      "matched_from": [
        "ai_new"
      ]
    },
    {
      "index": -81,
      "etiquette": "Frais bus Tristan",
      "category": "MIN",
      "duration": "LT",
      "source": "AI",
      "score": 1,
      "matched_from": [
        "ai_new"
      ]
    }
  ],
  "raw_excerpt": "üóï Date : 2023-12-02\nüë§ From : MYM MANDABA SCI <mymmandaba@gmail.com>\nüì® To   : \"Wadeekanya Soonthornsingha (Bee)\" <beebeau89@gmail.com>\nüßï Subject : Re¬†: Ile de Koh Chang. Lieu choix h√¥tel. Activit√©s\n---\nMerci Bee, \nC'est ok\nMais est-ce-que le minibus peut nous prendre √† notre r√©sidence le 25 d√©cembre au matin, √† notre checking out??? . En effet nous devons prendre nos 3 valises et nos petits sacs √† dos, car nous ne revenons plus √† Bangkok city. \nJ'ai chang√© notre r√©sidence, du 14 au 25 d√©cembre, pour avoir une pi√®ce de plus, un salon pour les week-end, et la f√™te de No√´l le 24 au soir. La nouvelle adresse est Ekama√Ø Soi 19N¬∞ 459.\nA Angkor, j'ai ajout√© une autre chambre, pas loin. Car c'est une s√©curit√© pour les visas. Notre h√¥te japonais a reconduit la 1ere r√©servation, pour 5 personnes, pas plus, et va nous envoyer un document officiel avec les noms  figurant sur les passeports. Je mettrai donc le nom de Yannick, puisque c'est aussi le mien, sur la chambre suppl√©mentaire, dans un h√¥tel. Apr√®s nous nous r√©partirons comme vous voulez.\nJe t'envoie ce matin, pour r√©server les taxis, par Western Union, 250 euros (frais inclus), et tu me garderas les re√ßus pour ajustement √©ventuel, avec d√©tour par notre hotel, et avec le ferry. \n\nMerci encireBonne journ√©e √† tousMaryvonne \n\nEnvoy√© depuis mon t√©l√©phone Huawei\n\n-------- Message original --------\nDe¬†: \"Wadeekanya Soonthornsingha (Bee)\" &lt;beebeau89@gmail.com&gt;\nDate¬†: sam. 2 d√©c. 2023 √† 04:07\n√Ä¬†: MYM MANDABA SCI &lt;mymmandaba@gmail.com&gt;\nCc¬†: carine mokofio &lt;mokofio@gmail.com&gt;, Yannick Mandaba &lt;y.mandaba@gmail.com&gt;\nObjet¬†: Re: Ile de Koh Chang. Lieu choix h√¥tel. Activit√©s\nHello all,¬†\nHere are the prices for van &amp; ferry.\nAngor Wat/Kho Chang 2023\nVan prices:\n25 DecBangkok - In front of Aran checkpoint &#61; 4,000 bahtAran checkpoint - Siem Reap (Angkor Wat) &#61; 3500 baht\n28 DecSiem Reap - in front of Aran checkpoint &#61; 3500 baht¬†In front of Aran checkpoint - Ao Thammachat pier &#61; 3,800 baht\nFerry prices¬† Adults 80baht/tripChildren (not more than 150cm) 30baht/trip\nPS: Please confirm as soon as possible. Almost fully booked. Thank you &#x1f64f;&#x1f3fc;¬†\n\nBest Regards,\nWadeekanya S. (Bee)\nOn 29 Nov 2023, at 21:50, Wadeekanya Soonthornsingha (Bee) &lt;beebeau89@gmail.com&gt; wrote:\n\n&#xfeff;Hello all,\nAll the plans are fine by me &amp; Yannick. We just concerned about the transports;- Van to Cambodia from Bkk- Van from Cambodia to Trat- Plane from Trat (Kho Chang) to Bkk on the 1st January.\n\n\nBest Regards,\nWadeekanya S. (Bee)\nOn 29 Nov 2023, at 19:36, MYM MANDABA SCI &lt;mymmandaba@gmail.com&gt; wrote:\n\n&#xfeff;\n\n---------- Forwarded message ---------\nDe¬†: MYM MANDABA SCI &lt;mymmandaba@gmail.com&gt;\nDate: mer. 29 nov. 2023 √†¬†11:22\nSubject: Ile de Koh Chang. Lieu choix h√¥tel. Activit√©s \nTo: MYM MANDABA SCI &lt;mymmandaba@gmail.com&gt;\n\n\nhttps://voyagesautenteo.com/thailande/conseils/plages-sud/kohchang/#:~:text&#61;Pour%20aller%20%C3%A0%20Koh%20Chang,Chang%20rendre%20depuis%20la%20Capitale.\n\n\nmerci de me donner votre avis, chacun de vous,\n( Yannick serait d&#39;accord pour un s√©jour de tous, √† Angkor, puis √† Koh Chang )\npour l&#39;h√©bergement , qui serait au nord ouest de l&#39;ile de Koh Chang,pr√®s de la plage Sable Blanc\npour le transport, on peut pr√©voir car c&#39;est peu charg√©,&#61; le retour du 1 er janvier en avion depuis l&#39;aeroport de Trat, et jusqu&#39;√† l&#39;aeroport de BKK, o√π nous avons r√©serv√© une chambre, le 1 er au soir. ( pour tous ceux qui veulent rentrer ce jour-l√† ), p√©riode creuse.\nVoir le document joint, qui n&#39;est pas un site publicitaire, mais un site de voyageurs.\nBonne journ√©e √† tous.\nEnvoy√© depuis mon t√©l√©phone Huawei"
}