{
  "year": 2025,
  "seq": 27,
  "meta": {
    "date": "2025-02-23",
    "from": "MYM MANDABA SCI <mymmandaba@gmail.com>",
    "to": "Yannick Mandaba <y.mandaba@gmail.com>, marcmandaba <marcmandaba@gmail.com>",
    "subject": "THEME 1 = suite = les honoraires du Notaire"
  },
  "proposals": [],
  "raw_excerpt": "ğŸ—• Date : 2025-02-23\nğŸ‘¤ From : MYM MANDABA SCI <mymmandaba@gmail.com>\nğŸ“¨ To   : Yannick Mandaba <y.mandaba@gmail.com>, marcmandaba <marcmandaba@gmail.com>\nğŸ§• Subject : THEME 1 = suite = les honoraires du Notaire\n---\nBonjour,\n\nMerci, Marc, de ton retour.\n\nJe n'avais pas anticipÃ© une limitation non modifiable de la hauteur de mes\ntransferts depuis ma banque SG...\nDonc, je vais procÃ©der ainsi :\n\n- virement immÃ©diat de 1573 euros, au titre d'un don manuel, amputÃ© de 427\neuros, qui reprÃ©sentent la moitiÃ© des frais de Notaire. Yannick recevra de\nma part 427 euros thÃ©oriques sur notre compte de ce qu'il estime que je lui\ndois, et dont je n'avais pas connaissance le 7 fÃ©vrier quand j'ai\nprovisionnÃ© WISE de 14000 euros ( 12 000 de donation plus 2000 de Don\nmanuel)\n- dÃ¨s mardi, Ã  l'ouverture, je vais Ã  ma banque SG, avec mes justificatifs,\npour relever le plafond ponctuellement, et virer les 12 000 euros de la\ndonation partage sur le compte de Marc.\n\nJ'attends, de chacun de vous 2, les justificatifs bancaires, car maÃ®tre\nChaudet m'a fait confiance pour les lui faire parvenir. Il a fait l'acte en\nexternalisant la comptabilitÃ© de celui-ci.\n\nEn attendant les documents bancaires que vous m'enverrez, je suis prÃªte Ã \nclore ce dossier.\n\nMaryvonne MANDABA Masseron"
}