{
  "year": 2025,
  "seq": 75,
  "meta": {
    "date": "2025-05-19",
    "from": "MYM MANDABA SCI <mymmandaba@gmail.com>",
    "to": "Yannick Mandaba <y.mandaba@gmail.com>",
    "subject": "Re: Nouvelle trouvaille obsessionnelle malhonnÃªte"
  },
  "proposals": [
    {
      "index": -75,
      "etiquette": "Frais d'Ã©cole / bus Tristan",
      "category": "MIN",
      "duration": "LT",
      "source": "AI",
      "score": 1,
      "matched_from": [
        "ai_new"
      ]
    },
    {
      "index": -75,
      "etiquette": "Frais bus Tristan",
      "category": "MIN",
      "duration": "LT",
      "source": "AI",
      "score": 1,
      "matched_from": [
        "ai_new"
      ]
    }
  ],
  "raw_excerpt": "ðŸ—• Date : 2025-05-19\nðŸ‘¤ From : MYM MANDABA SCI <mymmandaba@gmail.com>\nðŸ“¨ To   : Yannick Mandaba <y.mandaba@gmail.com>\nðŸ§• Subject : Re: Nouvelle trouvaille obsessionnelle malhonnÃªte\n---\nRecherche tous les courriel de ma part, et surtout les fiches de dÃ©compte,\nmÃªme si tu ne aimes pas...\n\nJe paye dÃ©jÃ  le restant dÃ» de la scolaritÃ©, avec le supplÃ©ment section\nbritannique, avec la cantine, et l'association sportive.\n4 860 â‚¬ dÃ©jÃ  payÃ©s par moi.\nIl reste 750 â‚¬ que je dois fin mai.\nQuand je t'avais promis 500â‚¬/mois, c'est dÃ©passÃ© de 80%.\n\nLe transport Montri est Ã  part.\nAvec mon compte j'ai payÃ© 850 euros 2 fois et 30 euros de frais Ã  chaque\nfois, car ils refusent les frais de transfert bancaire partagÃ©s. Donc 1760\nâ‚¬. Et je me suis remboursÃ©e sur ton compte, je te l'ai Ã©crit plusieurs\nfois. Et tu pourras retrouver cela sur ton relever 1er semestre 2025.\n\nCela fait plus de 10 fois que je te demande la facture acquittÃ©e de Montri,\nc'est que j'ai payÃ© au pif, selon l'autre sociÃ©tÃ© ECCE, de l'an dernier.\nL'annÃ©e va finir, et il peut y avoir des pÃ©nalitÃ©s de retard.\n\nJ'espÃ¨re que Marc va s'occuper de cela, Ã  dÃ©faut, il a raison, tu n'es pas\nclair, tu Ã©cris beaucoup, mais tu ne lis pas les courriers, ou trop\nrapidement.\n\n\nLe lun. 19 mai 2025, 19:40, Yannick Mandaba  a Ã©crit :\n\n> Et d'ailleurs si nous sommes ici en train de discuter et de remettre en\n> question maintenant le bus...\n>\n>\n> C'est parce que j'ai fait l'erreur de recommencer Ã  parler avec toi et en\n> trois Ã©changes tu as rÃ©ussi Ã  revenir encore sur ta parole donc je dois\n> arrÃªter de te parler.\n>\n> Quel autre conclusion dois-je en tirer?\n>\n>\n> Yannick Mandaba\n> Mobile: +66.8782.00.622\n>\n> On Tue, May 20, 2025, 12:37â€¯AM Yannick Mandaba \n> wrote:\n>\n>> Je suis dÃ©solÃ© mais cet endroit que tu avais choisi etait mauvais.\n>> Et depuis on a eu notre propre terrain on pouvait construire pourquoi on\n>> va aller acheter sur les terrains qui sont mÃªme pas Ã  nous?\n>>\n>> Sur le 25 on est Ã  20 minutes de l'Ã©cole.\n>> C'est direct et ils n'ont pas besoin de traverser Sukhumvit.\n>>\n>> C'Ã©tait parfait il avait sa maison un grand terrain des arbres sa voisine\n>> milliardaire Ã  cÃ´tÃ©, son cousin ... mais tu racontes n'importe quoi.\n>>\n>> Tu ne vis pas ici.\n>> Si tu ne considÃ¨res pas mon avis alors que je visite depuis 17 ans moi\n>> aussi je ne veux pas considÃ©rer ton avis et tout tes inventions au fur et Ã \n>> mesure tes salades\n>>\n>>\n>> Tu tiens ta parole ou ce n'est plus la peine de me parler.\n>>\n>>\n>>\n>>\n>> Yannick Mandaba\n>> Mobile: +66.8782.00.622\n>>\n>"
}