{
  "year": 2025,
  "seq": 26,
  "meta": {
    "date": "2025-02-22",
    "from": "MYM MANDABA SCI <mymmandaba@gmail.com>",
    "to": "Yannick Mandaba <y.mandaba@gmail.com>, marcmandaba <marcmandaba@gmail.com>",
    "subject": "THEME 1 = la donation-partage"
  },
  "proposals": [],
  "raw_excerpt": "üóï Date : 2025-02-22\nüë§ From : MYM MANDABA SCI <mymmandaba@gmail.com>\nüì® To   : Yannick Mandaba <y.mandaba@gmail.com>, marcmandaba <marcmandaba@gmail.com>\nüßï Subject : THEME 1 = la donation-partage\n---\n1 GENESE\n\nYannick me fait un chantage de derni√®re minute me disant qu'il faut\nmaintenant d√©poser une caution, pour son permis de s√©jour, m√™me s'il est\np√®re, vivant en Thailande d'un enfant tha√Ølandais. Date limite 1er f√©vrier\n2025.\n\nJe n'ai pas encore v√©rifi√© l'exactitude de cela.\n\nJusqu'√† pr√©sent, il lui suffisait de son certificat de paternit√©, et de\nsortir et rentrer du territoire, de fa√ßon p√©riodique.\n\nJe n'avais pas v√©rifi√© non plus.\n\nMa r√©action : \"je te donne beaucoup plus qu'√† ton fr√®re, de fa√ßon\nr√©guli√®re, pour les √©tudes de Tristan, et tes besoins personnels\", \" je\nt'ai dit plusieurs fois que ce que je te donne, je le dois de fa√ßon\n√©quivalente √† ton fr√®re\".\nAussi ,\"je vais faire une donation-partage pour que ce soit attest√© par le\nnotaire.\n\nLa r√©gularisation de cette donation, √† hauteur de 12 000 euros officiels,\net 14 000 euros, dans les faits, car le notaire a estim√© que j'ai le droit\nde donner 2000 euros √† titre de cadeau de nouvel an, est sans droits de\nsuccession, avant mes 80 ans.\n\nPar contre les frais notari√©s sont de 855 euros,\nalors que je me suis occup√©e de tout,\net que je dois lui renvoyer les documents officiels.\n\n2 CONCLUSION\n\nYannick,\nmerci de m'envoyer le relev√© bancaire du compte qui a √©t√© cr√©dit√© de 14 000\neuros,( moins 90 euros de transaction par WISE, long mais cheap), soient =\n492 000 tha√Øbaths.\n\nMarc,\nmerci de me donner le RIB du compte sur lequel je dois virer les 14 000\neuros, et ensuite de m'adresser le document bancaire confirmant ce virement.\n\nPour les deux, me dire si je puis r√©cup√©rer les frais notariaux, et de\nquelle fa√ßon, car je m'efforce de r√©pondre √† vos demandes, et cela a un\nco√ªt financier."
}