{
  "year": 2025,
  "seq": 86,
  "meta": {
    "date": "2025-06-08",
    "from": "MYM MANDABA SCI <mymmandaba@gmail.com>",
    "to": "Yannick Mandaba <y.mandaba@gmail.com>",
    "subject": "Re:"
  },
  "proposals": [],
  "raw_excerpt": "ðŸ—• Date : 2025-06-08\nðŸ‘¤ From : MYM MANDABA SCI <mymmandaba@gmail.com>\nðŸ“¨ To   : Yannick Mandaba <y.mandaba@gmail.com>\nðŸ§• Subject : Re:\n---\nLes meilleures vacances de Tristan seront avec moi, en France, oÃ¹ il fera\nles mÃªmes activitÃ©s que l'an dernier, avec les mÃªmes personnes, avec qui il\na tissÃ© des liens.\nIl reverra ses cousins et cousines, ses amis, l'Ã®le de RÃ©, le club de\nvoile,( vu son Ã¢ge et ses mensurations, il sera en catamaran ado, Ã  deux,\nje l'ai inscrit aujourd'hui,)\nIl refera le stage Ã  Evian, et nous ferons la visite des abayes\ncisterciennes de Bourgogne, et la visite des lacs du nord de l'Italie que\nnous n'avons pas eu le temps de faire l'an dernier.\nIl faut lui donner des racines, et pas l'emmener encore dans un nouveau\ncontinent. C'est question de symbole, et de culture.\nAllez dans une agence et je paye son billet.\nCette annÃ©e Ã  dÃ» Ãªtre dure pour lui, sans soutien scolaire, sans les\nlectures quotidiennes avec sa mamie. Vous faites une erreur, en cassant des\nbons liens, et des belles aventures.\nUne erreur irrattrapable.\n\nJe vous attends pour une conversation, et vais payer son billet, pour la\nFrance, pour Ã  compter du 7 juillet, ou plus, jusqu'au 20 aoÃ»t.\n\nJe lui ai dÃ©jÃ  achetÃ© ses habits, et l'ai inscrit Ã  ses activitÃ©s.\nAvec mon argent, et non celui de votre pÃ¨re, qui aurait Ã©tÃ© divisÃ© en 10,\ns'il y en avait eu...\n\nLe ven. 6 juin 2025, 17:09, Yannick Mandaba  a Ã©crit :\n\n> Ã‡a sert Ã  rien que je te parle je vois bien Ã§a sert Ã  rien je te dis tout\n> je te prÃ©viens de tout j'explique tout mais tu as dÃ©cidÃ© d'entrer Dieu que\n> tout ce que je dis Ã§a vaut rien donc ne me demande pas ce qu'on va faire\n> pendant les vacances juste s'il te plaÃ®t paye Ã§a Ã  quoi tu t'engages sinon\n> je te dis tu es en train de foutre en l'air les vacances de Tristan voilÃ \n>\n> Yannick Mandaba\n> Mobile: +66.8782.00.622\n>"
}