{
  "year": 2025,
  "seq": 64,
  "meta": {
    "date": "2025-05-13",
    "from": "MYM MANDABA SCI <mymmandaba@gmail.com>",
    "to": "Yannick Mandaba <y.mandaba@gmail.com>",
    "subject": "Re: Pour Yannick, urgent"
  },
  "proposals": [
    {
      "index": -64,
      "etiquette": "Dossier de bourse Tristan",
      "category": "MIN",
      "duration": "LT",
      "source": "AI",
      "score": 1,
      "matched_from": [
        "ai_new"
      ]
    },
    {
      "index": -64,
      "etiquette": "Appartement PergolÃ¨se (vente/location)",
      "category": "MIN",
      "duration": "LT",
      "source": "AI",
      "score": 1,
      "matched_from": [
        "ai_new"
      ]
    },
    {
      "index": -64,
      "etiquette": "Frais d'Ã©cole / bus Tristan",
      "category": "MIN",
      "duration": "LT",
      "source": "AI",
      "score": 1,
      "matched_from": [
        "ai_new"
      ]
    }
  ],
  "raw_excerpt": "ðŸ—• Date : 2025-05-13\nðŸ‘¤ From : MYM MANDABA SCI <mymmandaba@gmail.com>\nðŸ“¨ To   : Yannick Mandaba <y.mandaba@gmail.com>\nðŸ§• Subject : Re: Pour Yannick, urgent\n---\nHonte Ã  toi.\nTu ne peux pas travailler 1h par jour pour payer les leÃ§ons de piano Ã  ton\nfils... Mais tu demandes, fÃ©ministe !!!, Ã  une autre femme de la faire, et\nde payer aussi sa scolaritÃ©. Ce n'est pas cela assumer ses responsabilitÃ©s\nde fÃ©ministe : Ã©galitÃ© des hommes et des femmes, dans les droits, ET LES\nDEVOIRS.\nmadame, vous ne mÃ©ritez aucune considÃ©ration, ni aucun respect.\n\nLe mar. 13 mai 2025, 14:58, Yannick Mandaba  a Ã©crit :\n\n>\n>\n> Yannick Mandaba\n> Mobile: +66.8782.00.622\n>\n> ---------- Forwarded message ---------\n> From: Wadeekanya Soonthornsingha (Bee) \n> Date: Tue, May 13, 2025, 3:12â€¯PM\n> Subject: Fwd: Pour Yannick, urgent\n> To: Yannick \n>\n>\n>\n> Best Regards,\n>\n> Wadeekanya S. (Bee)\n>\n> Begin forwarded message:\n>\n> *From:* \"Wadeekanya Soonthornsingha (Bee)\" \n> *Date:* 13 May AD 2025 at 13:49:55 GMT+7\n> *To:* MYM MANDABA SCI \n> *Cc:* Wadeekanya Soonthornsingha \n> *Subject:* *Re: Pour Yannick, urgent*\n>\n> ï»¿Hello,\n> This is Tristanâ€™s piano book.\n> [image: image0.jpeg]\n> Best Regards,\n>\n> Wadeekanya S. (Bee)\n>\n> On 12 May 2025, at 14:42, MYM MANDABA SCI  wrote:\n>\n> ï»¿\n>\n> ---------- Forwarded message ---------\n> De : MYM MANDABA SCI \n> Date: dim. 11 mai 2025, 20:40\n> Subject: Pour Yannick, urgent\n> To: Yannick Mandaba \n> Cc: BeeBaa , marcmandaba \n>\n>\n> Restaurer le dossier impÃ´ts sur les Revenus en France.\n> Faire la dÃ©claration des impÃ´ts sur les revenus perÃ§us en 2024, date\n> butoir le 20 mai 2025.\n> Restaurer le compte bancaire SG, sur lequel sont virÃ©s les dividendes de\n> PergolÃ¨se.\n> Je vais t'envoyer les relevÃ©s que j'ai mis de cÃ´tÃ©, au 30 juin, et au 31\n> dÃ©cembre.\n> NÃ©gliger tout cela compromet La rÃ©daction du dossier de bourse de Tristan.\n> Me donner le bilan Montri Transport scolaire. Factures. Reste Ã  payer.\n> Me donner le code pour Eduka, afin que je suive le service facturation de\n> l'Ã©cole de Tristan. J'ai payÃ© plus de 5000â‚¬. Je ne connais pas le reste Ã \n> payer.\n> Me donner copie du carnet de piano, pour que je puisse voir ce que je\n> dois.\n> On me demande des conseils pour les vaccinations de Tristan, or je n'ai\n> pas de document, pas plus que l'Ã©cole, depuis ses 6 ans.\n>\n> Cette note est la 10eme sur le sujet gestion. J'aimerais avoir une suite.\n> Merci\n>\n>"
}