{
  "year": 2025,
  "seq": 13,
  "meta": {
    "date": "2025-02-11",
    "from": "MYM MANDABA SCI <mymmandaba@gmail.com>",
    "to": "Yannick Mandaba <y.mandaba@gmail.com>",
    "subject": "Re: Bulletin Tristan et rdv Marc"
  },
  "proposals": [],
  "raw_excerpt": "ðŸ—• Date : 2025-02-11\nðŸ‘¤ From : MYM MANDABA SCI <mymmandaba@gmail.com>\nðŸ“¨ To   : Yannick Mandaba <y.mandaba@gmail.com>\nðŸ§• Subject : Re: Bulletin Tristan et rdv Marc\n---\nMerci de m'expliquer, au mieux\n.\n\nLe mar. 11 fÃ©vr. 2025, 18:31, Yannick Mandaba  a\nÃ©crit :\n\n> Bonjour Maman,\n>\n> Marc a un changement de vol. Il arrive le 16 Ã  Roissy.\n> Il peut venir Ã  Rennes pour AGE. Ou tu montes Ã  Paris 1 jour avant ton\n> dÃ©part?\n> Acceptes tu de le voir?\n>\n>\n> Si tu prÃ©pares autre chose Ã   proposer/imposer il faudrait parler Ã  Marc.\n>\n> Mais Pergo c'est un caprice. Et louer Ã  Bangkok pour la somme notre\n> surface de 150m2vpaieta une belle rÃ©sidence pour Tristan au besoin.\n> Aussi Bee peut lui acheter quelque chose il n'y a pas que moi.\n>"
}