{
  "year": 2025,
  "seq": 76,
  "meta": {
    "date": "2025-05-20",
    "from": "MYM MANDABA SCI <mymmandaba@gmail.com>",
    "to": "Yannick Mandaba <y.mandaba@gmail.com>",
    "subject": "Re: Les habits de Tristan"
  },
  "proposals": [],
  "raw_excerpt": "ðŸ—• Date : 2025-05-20\nðŸ‘¤ From : MYM MANDABA SCI <mymmandaba@gmail.com>\nðŸ“¨ To   : Yannick Mandaba <y.mandaba@gmail.com>\nðŸ§• Subject : Re: Les habits de Tristan\n---\nÂ¡Me encanta!\n\nTout ce que je proposais Ã©tait Ã©cartÃ©...\n\nDonc, je propose Ã  nouveau,\nStage de dÃ©riveur Ã  Dinard, 7 jours.\nVisite Laurence, CÃ©line\nÃŽle de RÃ© 4 jours\nChez Marc jours 3 4 5 6....\nStage street dance Publier 1 semaine.\nEn passant par les chÃ¢teaux de la Loire, 3 jours.\nItalie du nord 1 semaine\nSi le sÃ©jour est d'au moins 7 semaines\n\n\n\nLe mar. 20 mai 2025, 00:18, Yannick Mandaba  a Ã©crit :\n\n> ---------- Forwarded message ---------\n> From: Yannick Mandaba \n> Date: Tue, May 20, 2025 at 5:16â€¯AM\n> Subject: Re: Les habits de Tristan\n> To: MYM MANDABA SCI \n>\n>\n> Tu gqspille des diizaines de nillions de THB il m'en fallait  juste 2.\n>\n> Et tu m en voies de photos d habils?\n>\n> On Mon, May 19, 2025 at 5:18â€¯PM MYM MANDABA SCI \n> wrote:\n>\n>> Je les donne ?\n>> Je les vends ?\n>>\n>>\n>>\n>\n> --\n> Yannick Mandaba\n> Mobile: +66.8782.00.622\n>\n>\n> --\n> Yannick Mandaba\n> Mobile: +66.8782.00.622\n>"
}