{
  "year": 2025,
  "seq": 127,
  "meta": {
    "date": "2025-02-02",
    "from": "Yannick Mandaba <y.mandaba@gmail.com>",
    "to": "Marc Mandaba <marcmandaba@gmail.com>",
    "subject": "PROCURATION SCI M.Y.M-MANDABA"
  },
  "proposals": [],
  "raw_excerpt": "ðŸ—• Date : 2025-02-02\nðŸ‘¤ From : Yannick Mandaba <y.mandaba@gmail.com>\nðŸ“¨ To   : Marc Mandaba <marcmandaba@gmail.com>\nðŸ§• Subject : PROCURATION SCI M.Y.M-MANDABA\n---\nYannick, Yves, Sala-Kosso MANDABA,               Le 2 fÃ©vrier 2025\n\n64 soi Barbot 2 Sukhumvit 42,\n\n Prakanong, Klong Toey,\n\n10110 Bangkok, Thailande\n\nÃ€ lâ€™attention de AssociÃ©s dans la\n*SOCIÃ‰TÃ‰ CIVILE *IMMOBILIÃˆRE\nÂ« SCI M.Y.M.-MANDABA Â»:\n\nMaryvonne Masseron-Mandaba\nMarc Olona Mandaba\nYannick, Yves, Sala-Kosso Mandaba\n\nJe vous annonce la dÃ©signation de Marc pour me reprÃ©senter physiquement aux\nAG/AGE si nÃ©cessaire cette annÃ©e 2025. Je pourrai le dÃ©gager de choix\ndifficiles en exprimant explicitement ma position.\n\n-- \nYannick Mandaba\nMobile: +66.8782.00.622"
}