{
  "year": 2025,
  "seq": 73,
  "meta": {
    "date": "2025-05-19",
    "from": "MYM MANDABA SCI <mymmandaba@gmail.com>",
    "to": "y.mandaba@gmail.com",
    "subject": "Fwd: Tes relevÃ©s de compte pour 2024"
  },
  "proposals": [
    {
      "index": -73,
      "etiquette": "Frais d'Ã©cole / bus Tristan",
      "category": "MIN",
      "duration": "LT",
      "source": "AI",
      "score": 1,
      "matched_from": [
        "ai_new"
      ]
    }
  ],
  "raw_excerpt": "ðŸ—• Date : 2025-05-19\nðŸ‘¤ From : MYM MANDABA SCI <mymmandaba@gmail.com>\nðŸ“¨ To   : y.mandaba@gmail.com\nðŸ§• Subject : Fwd: Tes relevÃ©s de compte pour 2024\n---\n---------- Forwarded message ---------\nDe : MYM MANDABA SCI \nDate: lun. 19 mai 2025, 16:21\nSubject: Re: Tes relevÃ©s de compte pour 2024\nTo: Yannick Mandaba \n\n\nJ'ai reÃ§u les codes chiffres\nMais tu ne me les as pas demandÃ©s\nJe ne les ai pas utilisÃ©s.\n\nIl faut que tu laisses toujours de quoi payer les impÃ´ts (environ 700â‚¬)\n\nPlus de quoi payer Montri,\n2 fois 850 â‚¬.\nCar je ne donnerai pas un centime pour le transport puisque j'avais proposÃ©\nl'achat cadeau d'une maison en face de l'Ã©cole franÃ§aise, concession\nSingapour.\n\n709631\n\nLa SG n'envoie pas de courrier Ã  l'Ã©tranger. Ni les impÃ´ts d'ailleurs. Tout\ndoit passer par le Web.\n\nLe lun. 19 mai 2025, 14:57, Yannick Mandaba  a Ã©crit :\n\n> Je te demande d'utiliser la procuration pour modifier l'adresse d'envoi de\n> mes relevÃ©s.\n>\n> Et surtout que je puisse recevoir mes codes d'accÃ¨s quand j'en ai besoin\n> je considÃ¨re que ce compte n'est pas sous mon contrÃ´le.\n>\n> J'ai Ã©crit Ã  la personne de l'agence j'ai eu aussi la dame du centre-ville\n> lÃ  les deux m'ont demandÃ© des justificatifs de logement que j'ai donnÃ© et\n> maintenant qu'est-ce qui se passe?\n>\n>\n> Donc si je n'ai mÃªme pas accÃ¨s Ã  la modification de mes donnÃ©es\n> personnelles je peux juste dÃ©noncer ce qu'on se demande Ã  le fermer.\n> Donc toi tu as ma procuration tu peux aller demander toutes les\n> informations que tu veux au guichet mais moi je veux un double qui me soit\n> envoyÃ© chez moi lÃ  oÃ¹ je vis sinon tu peux le fermer ce compte moi je l'ai\n> envoyÃ© un courrier.\n>\n> Tu comprends?\n> C'est toi qui parle toujours de la confusion entre ce qui Ã  toi et ce qui\n> Ã  moi mais pour moi c'est trÃ¨s clair.\n>\n> Yannick Mandaba\n> Mobile: +66.8782.00.622\n>\n> On Mon, May 19, 2025, 5:09â€¯PM MYM MANDABA SCI \n> wrote:\n>\n>> C'est compliquÃ©, car je dois tÃ©lÃ©charger de 6 mois en 6 mois, car tu m'as\n>> enlevÃ© le code d'accÃ¨s aux relevÃ©s mensuels.\n>>\n>>"
}