{
  "year": 2025,
  "seq": 3,
  "meta": {
    "date": "2025-01-23",
    "from": "MYM MANDABA SCI <mymmandaba@gmail.com>",
    "to": "\"Wadeekanya Soonthornsingha (Bee)\" <beebeau89@gmail.com>",
    "subject": "Re: Les vaccins"
  },
  "proposals": [],
  "raw_excerpt": "ðŸ—• Date : 2025-01-23\nðŸ‘¤ From : MYM MANDABA SCI <mymmandaba@gmail.com>\nðŸ“¨ To   : \"Wadeekanya Soonthornsingha (Bee)\" <beebeau89@gmail.com>\nðŸ§• Subject : Re: Les vaccins\n---\nMerci d'envoyer le certificat de la mise Ã  jour des vaccins au LFIB, et\naussi de m'envoyer copie pour que je puisse vous conseiller. AprÃ¨s Ã  13 ans\nil y a le vaccin contre L'HPV, et contre la varicelle s'il n'a pas encore\nfait cette maladie.\nCependant, le rappel des DTCP manque encore, sur le carnet, pour 6 ans et\n11 ans.\nMaryvonne MANDABA\n\nLe mar. 21 janv. 2025, 15:24, Wadeekanya Soonthornsingha (Bee)  a Ã©crit :\n\n> I already made appointment with doctor.\n> Thank you for reminding us.\n> Best Regards,\n>\n> Wadeekanya S. (Bee)\n>\n> > On 18 Jan 2025, at 19:05, maryvonne masseron-mandaba  maryvonnemm@hotmail.com> wrote:\n> > ï»¿\n> >\n> >\n> > EnvoyÃ© depuis mon tÃ©lÃ©phone HONOR\n> > \n>"
}