{
  "year": 2025,
  "seq": 35,
  "meta": {
    "date": "2025-03-07",
    "from": "MYM MANDABA SCI <mymmandaba@gmail.com>",
    "to": "Yannick Mandaba <y.mandaba@gmail.com>",
    "subject": "Re: THEME 1 = LA DONATION"
  },
  "proposals": [
    {
      "index": -35,
      "etiquette": "Visa / immigration",
      "category": "MIN",
      "duration": "LT",
      "source": "AI",
      "score": 1,
      "matched_from": [
        "ai_new"
      ]
    },
    {
      "index": -35,
      "etiquette": "Appartement PergolÃ¨se (vente/location)",
      "category": "MIN",
      "duration": "LT",
      "source": "AI",
      "score": 1,
      "matched_from": [
        "ai_new"
      ]
    }
  ],
  "raw_excerpt": "ðŸ—• Date : 2025-03-07\nðŸ‘¤ From : MYM MANDABA SCI <mymmandaba@gmail.com>\nðŸ“¨ To   : Yannick Mandaba <y.mandaba@gmail.com>\nðŸ§• Subject : Re: THEME 1 = LA DONATION\n---\nC'est notÃ©.\n- tu ne lis pas.\n- j'attends le document \" Compte bloquÃ© pour te garantir un visa Ã©tranger\"\n- si c'est un marchÃ© de dupe, cela bloque les autres discussions\n- ce chantage Ã  envoyer rapidement la somme pour le visa, m'a obligÃ© Ã \nvendre des actions, Ã  un moment oÃ¹ elles montaient encore, et juste avant\nla distribution des divedendes... D'oÃ¹ une perte nette de 5000 euros sur la\ndonation.\n- Ã©troitesse de vision.\n- actuellement, je refuse que nous vendions Pergolese.\n- et je redis que Tristan, de mÃªme que LÃ©a et Maxime, soient punis Ã  cause\nde votre mauvaise relation avec votre mÃ¨re.\n\nLe jeu. 6 mars 2025, 07:44, Yannick Mandaba  a Ã©crit :\n\n> J'ai arrÃªtÃ© de la premiÃ¨re ligne de lire.\n> Parce qu'une fois qu'on vous a mis dans un coin tout ce que vous pouvez\n> faire c'est essayer de rÃ©inventer l'histoire.\n> Cette donation a Ã©tÃ© faite parce que je t'ai mis dans un coin et je t'ai\n> forcÃ© et tu vas juste faire ce que je t'ai demandÃ© sinon je vais faire ce\n> que je t'ai dit que je ferai et merci de ne rien envoie de ne pas contacter\n> Tristan par email ou par tÃ©lÃ©phone sans ma permission.\n>\n>\n>\n> On Thu, Mar 6, 2025, 12:31â€¯AM MYM MANDABA SCI \n> wrote:\n>\n>> bonjour,.\n>> Cette donation-Partage a Ã©tÃ© faite, pour\n>> . Que Yannick puisse mettre la somme de 12000 â‚¬ sur un compte bloquÃ©,\n>> afin de rÃ©gulariser sa situation administrative en ThaÃ¯lande\n>> ,  que 2000 â‚¬ de sa pension alimentaire lui parvienne en mÃªme temps, avec\n>> peu de frais, et en toute transparence.\n>> . Que Marc reÃ§oive la mÃªme somme, et par voie notariÃ©e, pour l'Ã©quitÃ©,\n>> 14000â‚¬\n>>\n>> Ce dossier THEME 1\n>> sera clos lorsque je recevrai un exemplaire du contrat du compte bloquÃ©\n>> rÃ©munÃ©rÃ© Ã  8% comme je l'avais conseillÃ©.\n>> Je ne suis la secrÃ©taire de personne.\n>> Je suis le bailleur de fond, et j'entends que l'on respecte mes conseils,\n>> pour que l'on ne me reproche pas ensuite de ne pas avoir aidÃ©. En\n>> l'occurrence il s'agit du permis de sÃ©jour de Yannick Mandaba en ThaÃ¯lande.\n>>\n>>\n>>"
}