{
  "year": 2025,
  "seq": 17,
  "meta": {
    "date": "2025-02-13",
    "from": "MYM MANDABA SCI <mymmandaba@gmail.com>",
    "to": "Yannick Mandaba <y.mandaba@gmail.com>",
    "subject": "Je partage Â«Â Payment Methods.pdfÂ Â» avec vous sur WPS Office"
  },
  "proposals": [
    {
      "index": -17,
      "etiquette": "Visa / immigration",
      "category": "MIN",
      "duration": "LT",
      "source": "AI",
      "score": 1,
      "matched_from": [
        "ai_new"
      ]
    }
  ],
  "raw_excerpt": "ğŸ—• Date : 2025-02-13\nğŸ‘¤ From : MYM MANDABA SCI <mymmandaba@gmail.com>\nğŸ“¨ To   : Yannick Mandaba <y.mandaba@gmail.com>\nğŸ§• Subject : Je partage Â«Â Payment Methods.pdfÂ Â» avec vous sur WPS Office\n---\nVÃ©rifiez la piÃ¨ce jointe\n\nObtenir WPS Office gratuitement:\nhttps://kso.page.link/wps\n\n Pourquoi m'as-tu envoyÃ© une demande de paiement pour Montri Transport\nscolaire ???\n\nC'Ã©tait dÃ©jÃ  payÃ©\n850 euros (2 fois)\nEn novembre et en janvier...\n\nDu coup, j'ai cru que c'Ã©tait urgent de rÃ©gulariser, quoique pour moi tout\nÃ©tait en rÃ¨gle.\n\nJ'ai sollicitÃ© WISE\nDU COUP QUAND J'AI ANNULÃ‰ Montri, ils ont annulÃ© aussi ton virement...\n\nTu mets du dÃ©sordre partout.\n\n\nArrÃªte de harceler parce que tu t'angoisses ou parce que tu t' ennuies.\n\nQuand vas tu Ãªtre organisÃ© ???\n\nPour ton visa, tu n'as qu'Ã  t'en prendre qu'Ã  toi-mÃªme.\n\nJe n'ai plus de compte WISE,\nje dois tout reprendre Ã  zÃ©ro,\nPiÃ¨ces d'identitÃ©, photos etc...\nLes banquiers belges ne rigolent pas..."
}