{
  "year": 2025,
  "seq": 118,
  "meta": {
    "date": "2025-07-20",
    "from": "MYM MANDABA SCI <mymmandaba@gmail.com>",
    "to": "Yannick Mandaba <y.mandaba@gmail.com>",
    "subject": "Re: DÃ©part Kanchana buri demain"
  },
  "proposals": [
    {
      "index": -118,
      "etiquette": "Dossier de bourse Tristan",
      "category": "MIN",
      "duration": "LT",
      "source": "AI",
      "score": 1,
      "matched_from": [
        "ai_new"
      ]
    }
  ],
  "raw_excerpt": "ðŸ—• Date : 2025-07-20\nðŸ‘¤ From : MYM MANDABA SCI <mymmandaba@gmail.com>\nðŸ“¨ To   : Yannick Mandaba <y.mandaba@gmail.com>\nðŸ§• Subject : Re: DÃ©part Kanchana buri demain\n---\nbien compris...\n\nMais au Lac LÃ©man, tous mes amis ont louÃ© des mobilhomes au Camping de la\nCitÃ© de l'Eau, qui est prÃ¨s de la plage du Lac LÃ©man, prÃ¨s de la piscine\nolympique, prÃ¨s du lieu du stage...\nTristan connaÃ®t bien l'endroit, puisque dans le camping il y a un trÃ¨s bon\nrestaurant, pour toutes les bourses, et que nous avons dÃ©jeunÃ© avec\nCathy(prof de math Ã  Zola),Bruno (ingÃ©nieur), et leur fille. Ils seront lÃ \nencore cette annÃ©e, et aussi Tania (instit) et Vincent(instit et directeur\nd'Etablissement), avec leurs 3 enfants, dont l'un a juste l'Ã¢ge de Tristan.\n( nÃ© le 20 octobre 2013 ).\nMoi je prÃ©fÃ¨re l'hÃ´tel, soit Formule 1, soit Ibis Budget, soit Ibis rouge,\nil y a \" ans j'avais pris un studio au centre de Thonon les Bains, super...\nJe fais ce stage depuis 1997, sauf empÃªchements avec tante Jeannette ou\nGrand Mamie.\nSi tu veux un projet ensemble, il y a plein de villas Ã  louer l'Ã©tÃ© par\nbnb, mais il faut rÃ©server en janvier, dÃ¨s aprÃ¨s les locations pour le ski.\n\n\nLe dim. 20 juil. 2025 Ã  13:31, Yannick Mandaba  a\nÃ©crit :\n\n> Nous partons avec les cousins amÃ©ricains Ã  Kanchana buri demain.\n>\n> Nous sommes le 20.\n>\n> Je suis obligÃ© de prendre 2 commandes. Drs clients qui n'ont pas d'autre\n> choix, mais la sociÃ©tÃ© n'est plus autorisÃ©e. Je vais faire payer Ã  Bee...\n> Moi jai pas le droit.\n>\n> Je ne manipule pas tu le sais.\n> C'est comme Ã§a, 1 parmi les myriade de ricochets de tes tentatives de\n> contrÃ´le des informÃ©, ricochets que tu ne conÃ§ois mÃªme pas.\n>\n> Compensations pour dÃ©labrement et 2 ruptures d'accord ToaZikei restant :\n> 600E pour juillet.\n>\n> Aout est encore libre...\n> Mais tu as plus important Ã  faire je suppose que venir voir Tristan, comme\n> t'opposer vainement Ã  tes fils et aller faire ton stage rituel.\n>\n> Gba gna gna !\n> Croise les bras.\n> Va faire son truc toute seule.\n>\n> Comme tu veux.\n>\n> L'annÃ©e prochaine tu devrais louer quelque chose peut-Ãªtre Ã  GenÃ¨ve au\n> bord du lac ou je ne sais oÃ¹ est invitÃ© tous les petits-enfants Ã  venir te\n> voir.\n> Je pourrais venir avec Marc et les gamin. Je ne pense pas que les mamans\n> insistent particuliÃ¨rement pour se joindre Ã  nous....\n>\n> Parce que si tu n'as pas fait le choix de acheter quelque chose pour\n> pouvoir faire Ã§a tous les Ã©tÃ©s mais tu peux louer.\n>\n> Mais bon comme c'est pas ton idÃ©e... Moi que tu emmÃ¨nes notre Tristan se\n> promener Ã§a me dÃ©range pas mais tu devrais peut-Ãªtre penser Ã  emmener un\n> autre enfant avec lui.\n>\n> Je sais pas il y a tellement de choses simples auxquelles tu ne penses\n> pas....\n>\n> Tu es dans la complication lÃ  rigide dans des trucs oÃ¹ tu \"obliges\" (dans\n> son sens traditionnel) les uns et les autres Ã  subir tout ton machin lÃ  que\n> ce soit nous que ce soit les cousins ou les oncles les tantes qui vous\n> hÃ©bergent.\n>\n> Tout Ã§a c'est de l'ordre de la manipulation.\n>\n> Et de voir les cousins sÃ©parÃ©ment aussi d'ailleurs pourquoi il faut\n> sÃ©parer?\n> Qui est responsable de la sÃ©paration?\n> Pourquoi quand Tristan part en France il peut pas rester pendant une\n> semaine et pourquoi pas 15 jours avec sa mamie et ses deux autres cousins?\n>\n> C'est la faute Ã  qui encore?\n>\n> Yannick Mandaba\n> Mobile: +66.8782.00.622\n>"
}