{
  "year": 2025,
  "seq": 91,
  "meta": {
    "date": "2025-06-14",
    "from": "MYM MANDABA SCI <mymmandaba@gmail.com>",
    "to": "Yannick Mandaba <y.mandaba@gmail.com>, marcmandaba <marcmandaba@gmail.com>",
    "subject": "Comment faire un dossier de Bourse Scolaire..."
  },
  "proposals": [
    {
      "index": -91,
      "etiquette": "Dossier de bourse Tristan",
      "category": "MIN",
      "duration": "LT",
      "source": "AI",
      "score": 1,
      "matched_from": [
        "ai_new"
      ]
    },
    {
      "index": -91,
      "etiquette": "Paiements via Western Union",
      "category": "MIN",
      "duration": "LT",
      "source": "AI",
      "score": 1,
      "matched_from": [
        "ai_new"
      ]
    },
    {
      "index": -91,
      "etiquette": "Frais d'√©cole / bus Tristan",
      "category": "MIN",
      "duration": "LT",
      "source": "AI",
      "score": 1,
      "matched_from": [
        "ai_new"
      ]
    }
  ],
  "raw_excerpt": "üóï Date : 2025-06-14\nüë§ From : MYM MANDABA SCI <mymmandaba@gmail.com>\nüì® To   : Yannick Mandaba <y.mandaba@gmail.com>, marcmandaba <marcmandaba@gmail.com>\nüßï Subject : Comment faire un dossier de Bourse Scolaire...\n---\nEt c'est pourquoi je paye 5500‚Ç¨, chaque ann√©e, √† l'agence pour l'√©ducation\ndes fran√ßais √† l'√©tranger ...AEFE...\nParce que la bourse n'est que de 50%.\nAu lieu de donner ces 5500 ‚Ç¨ √† YANNICK et Tristan.\n\nDe plus, je dois donner 1000‚Ç¨ par mois √† Yannick. Ce que j'ai accept√© sous\nla menace/Chantage/Injures/mais qui dure depuis 2004 ... Et j'ai donn√© plus\nencore...\nPaiement r√©gulier du loyer, plus pension alimentaire. En g√©n√©ral 450 + 400.\nAvec des virements √† AGA, √† Mandja, et 2 fois des donations-partages.\n\nTout ce dont Yannick m'accuse est imputable √Ä une autre personne, qui brise\nles √©lans, fait perdre du temps, et √©puise les √©nergies.\n\nActuellement,\nL'√©cole de Tristan est enti√®rement PAY√âE. Avec :\nL'option britannique\nLes AES\nLa cantine\nLe piano 10 le√ßons.\n\nEt le transport Montri, par Pergo. Sans aucune facture... J'attends\ncelle-ci.\n\nJ'aimerais recevoir le bulletin scolaire de Tristan pour le 2eme trimestre.\n\nPour les virement par WU ou RIA, je voudrais changer de syst√®me, car il\nm'est p√©nible de rester debout attendre mon tour pendant 1 ou 2 heures...\nDe plus maintenant il y a un contr√¥le du fisc, comme √† Bangui, avec un\nmaximum par envoi, et par mois, par expediteur/destinataire.\n\nMerci de prendre en compte ces documents.\nEt r√©aliser que, tant que je suis en vie, je peux donner les fruits de ma\nretraite mensuelle, 1700‚Ç¨, mais qu'apr√®s, les revenus immobiliers seront\nminimes ( 8% apr√®s entretien et taxes), et qu'il faudra tout vendre..."
}