{
  "year": 2025,
  "seq": 34,
  "meta": {
    "date": "2025-03-05",
    "from": "MYM MANDABA SCI <mymmandaba@gmail.com>",
    "to": "Yannick Mandaba <y.mandaba@gmail.com>, marcmandaba <marcmandaba@gmail.com>",
    "subject": "THEME 1 = LA DONATION"
  },
  "proposals": [],
  "raw_excerpt": "ğŸ—• Date : 2025-03-05\nğŸ‘¤ From : MYM MANDABA SCI <mymmandaba@gmail.com>\nğŸ“¨ To   : Yannick Mandaba <y.mandaba@gmail.com>, marcmandaba <marcmandaba@gmail.com>\nğŸ§• Subject : THEME 1 = LA DONATION\n---\nbonjour,.\nCette donation-Partage a Ã©tÃ© faite, pour\n. Que Yannick puisse mettre la somme de 12000 â‚¬ sur un compte bloquÃ©, afin\nde rÃ©gulariser sa situation administrative en ThaÃ¯lande\n,  que 2000 â‚¬ de sa pension alimentaire lui parvienne en mÃªme temps, avec\npeu de frais, et en toute transparence.\n. Que Marc reÃ§oive la mÃªme somme, et par voie notariÃ©e, pour l'Ã©quitÃ©,\n14000â‚¬\n\nCe dossier THEME 1\nsera clos lorsque je recevrai un exemplaire du contrat du compte bloquÃ©\nrÃ©munÃ©rÃ© Ã  8% comme je l'avais conseillÃ©.\nJe ne suis la secrÃ©taire de personne.\nJe suis le bailleur de fond, et j'entends que l'on respecte mes conseils,\npour que l'on ne me reproche pas ensuite de ne pas avoir aidÃ©. En\nl'occurrence il s'agit du permis de sÃ©jour de Yannick Mandaba en ThaÃ¯lande."
}