{
  "year": 2025,
  "seq": 129,
  "meta": {
    "date": "2025-01-18",
    "from": "maryvonne.masseron@free.fr",
    "to": "maryvonne masseron-mandaba <maryvonnemm@hotmail.com>",
    "subject": "2eme paiement  scolaritÃ© 24-25 Tristan MANDABA lfib 6eme"
  },
  "proposals": [],
  "raw_excerpt": "ðŸ—• Date : 2025-01-18\nðŸ‘¤ From : maryvonne.masseron@free.fr\nðŸ“¨ To   : maryvonne masseron-mandaba <maryvonnemm@hotmail.com>\nðŸ§• Subject : 2eme paiement  scolaritÃ© 24-25 Tristan MANDABA lfib 6eme\n---\nVendredi 17 janvier 2025\n\nFRAIS VIR INTL INTERNET \n551623756985 REF 032025016847458570000000 1 FRAIS DE TRANSFERT POUR 13,00\nmoins- 13,00 â‚¬\n\nJeudi 16 janvier 2025\n\nVIR INTL EMIS INTERNET POUR: LYCEE FRANCAIS INTERNATIONAL DE BAN REF: 032025016847458570000000\nMotif : Scolarite Tristan MANDABA lfib 6eme \nCHEZ: UOVBTHBKXXX UNITED OVERSEAS BANK (TH UETR: c38370c9-cb54-4140-921f-74454ad13b5f\nmoins- 1â€¯180,00 â‚¬\n\nmaryvonne mandaba masseron - 41 rue du puits-mauger 35000 rennes 0299302000 0783359723"
}