{
  "year": 2025,
  "seq": 97,
  "meta": {
    "date": "2025-06-29",
    "from": "MYM MANDABA SCI <mymmandaba@gmail.com>",
    "to": "\"Wadeekanya Soonthornsingha (Bee)\" <beebeau89@gmail.com>",
    "subject": "Re: Lives Ã  acheter, pour Tristan"
  },
  "proposals": [
    {
      "index": -97,
      "etiquette": "Frais d'Ã©cole / bus Tristan",
      "category": "MIN",
      "duration": "LT",
      "source": "AI",
      "score": 1,
      "matched_from": [
        "ai_new"
      ]
    }
  ],
  "raw_excerpt": "ðŸ—• Date : 2025-06-29\nðŸ‘¤ From : MYM MANDABA SCI <mymmandaba@gmail.com>\nðŸ“¨ To   : \"Wadeekanya Soonthornsingha (Bee)\" <beebeau89@gmail.com>\nðŸ§• Subject : Re: Lives Ã  acheter, pour Tristan\n---\nBonjour,\nJ'ai tous les livres, et vais les envoyer par la poste, demain.\nJ'aurais prÃ©fÃ©rÃ© les remettre directement Ã  Tristan.\nJe souhaite reprendre les lectures de littÃ©rature franÃ§aise, pour continuer\nle chemin sÃ©rieux de structuration de la langue, du vocabulaire, et de\nl'Ã©tymologie, puisqu'il n'Ã©tudie pas le latin.\nCe serait 4 jours consÃ©cutifs, sinon la reconnection au sujet prend trop de\ntemps, pour lui, et pour moi.\nMerci pour lui.\n\n\nLe ven. 20 juin 2025, 10:08, Wadeekanya Soonthornsingha (Bee)  a Ã©crit :\n\n> Noted.\n> If there is any item missing, I can still order at Catnets dâ€™Asie BKK\n> until July 30th. Thank you.\n>\n> Best Regards,\n>\n> Wadeekanya S. (Bee)\n>\n> > On 19 Jun 2025, at 19:04, MYM MANDABA SCI  wrote:\n> >\n> > ï»¿\n> > Bonjour,\n> > Je vais acheter et envoyer les \" livres Ã  acheter\". De la littÃ©rature,\n> liste ci-dessous.\n> > Les manuels scolaires sont fournis par  l'Ã©cole, il faut leur Ã©crire\n> pour Ãªtre certain que la commande soit faite pour Tristan. Comme il est\n> boursier, il n'y a rien Ã  payer.\n> > Les fournitures scolaires sont Ã  acheter, vas avec lui, et la liste en\n> boutique, tu le sais, puisque nous avons fait ces achats Ã  Bangkok les\n> annÃ©es prÃ©cÃ©dentes.\n> > Mettre de cÃ´tÃ© sur sa table, tous les dictionnaires de franÃ§ais, et les\n> livres de grammaire et conjugaison, de la 6eme Ã  la 3eme. Il les a, pas\n> besoin de racheter.\n> > Y a-t'il un problÃ¨me ?\n> >\n> \n>"
}