{
  "year": 2025,
  "seq": 135,
  "meta": {
    "date": "2025-01-30",
    "from": "maryvonne masseron-mandaba <maryvonnemm@hotmail.com>",
    "to": "claudie mandaba <g.gazambert@hotmail.fr>, \"y.mandaba@gmail.com\"",
    "subject": "Document SODECA gml"
  },
  "proposals": [],
  "raw_excerpt": "ðŸ—• Date : 2025-01-30\nðŸ‘¤ From : maryvonne masseron-mandaba <maryvonnemm@hotmail.com>\nðŸ“¨ To   : claudie mandaba <g.gazambert@hotmail.fr>, \"y.mandaba@gmail.com\"\n\t<y.mandaba@gmail.com>, marcmandaba <marcmandaba@gmail.com>\nðŸ§• Subject : Document SODECA gml\n---\nBonjour, Claudie, Yannick, Marc.\n\nEn Octobre 2024, j'ai entrepris la rnovation du local de kinsithrapie, qui a t lou,  partir de janvier 1993 au Dr Yangu, pour effectuer des chographies, puis, en plus des radiographies. Le loyer a t pay pendant 8 mois seulement, sur 30 ans d'occupation.\n\nLes travaux, pour une valeur totale de 10Mcfa, ont dj t rgls, pour moiti,  l'entreprise de J. Fijalkowski.\nL'tanchit du toit est faite. La rfection des sanitaires et carrelages a t bloque  cause d'un souci d'adduction d'eau.\nLa socit para-tatique SODECA a suspendu son service pour impays.\n\nJ'ai demand au locataire, le Dr Yangu, de me produire les factures depuis le dbut de la location. Je n'ai reu que des attestations des services administratifs, mais aucun de la facturation. La seule facture reue a t celle du changement de compteur.\n\nLe dernier document reu vient encore de l'administration... Vous en jugerez...\nPice jointe.\n\nLes travaux sont suspendus depuis 3 mois.\nLa faon de grer du Dr Yangu n'ayant pas chang, je ne peux pas signer un nouveau bail. Il n'est pas autoris  occuper le local.\n\nVous pourrez expliquer la situation  la famille et  ceux qui seraient concerns.\n\nMaryvonne MANDABA\n\nEnvoy  partir de Outlook pour Android"
}