{
  "year": 2025,
  "seq": 38,
  "meta": {
    "date": "2025-04-08",
    "from": "MYM MANDABA SCI <mymmandaba@gmail.com>",
    "to": "Yannick Mandaba <y.mandaba@gmail.com>",
    "subject": "Re: Courrier de relance d'impayÃ©s"
  },
  "proposals": [],
  "raw_excerpt": "ðŸ—• Date : 2025-04-08\nðŸ‘¤ From : MYM MANDABA SCI <mymmandaba@gmail.com>\nðŸ“¨ To   : Yannick Mandaba <y.mandaba@gmail.com>\nðŸ§• Subject : Re: Courrier de relance d'impayÃ©s\n---\nYannick, pour que je puisse suivre la bonne rÃ©ception des virements par le\nlfib, il faudrait que je puisse accÃ©der Ã  Eduka, donc que tu me communiques\nle nouveau code.\nMerci\n\nEst-ce que tu peux proposer Ã  Tristan, pour dÃ©velopper son cardio, un treck\nau NÃ©pal, le tour des Anapurna, aux vacances de PÃ¢ques, ou un circuit vÃ©lo\nen OuzbÃ©kistan.\n\nSes amis l'attendent pour le stage street jazz, et comÃ©die musicale, Ã \nEvian.\nSes cousins, en Bretagne, et Joshua Ã  l'Ã®le de RÃ©, les filles de Vincent\nseront lÃ  aussi.\n\nLe mar. 8 avr. 2025, 09:25, Yannick Mandaba  a Ã©crit :\n\n> Compensation Bangui conformÃ©ment au conseil de famille Merci de bien\n> vouloir rÃ©gler cela.\n>\n> ---------- Forwarded message ---------\n> From: Facturation \n> Date: Tue, Apr 8, 2025, 2:11â€¯PM\n> Subject: Courrier de relance d'impayÃ©s\n> To: MANDABA Yannick \n>\n>\n> A l'attention de / To:  *MANDABA Yannick, SOONTHORNSINGHA Wadeekanya*\n> De la part de / From: *LycÃ©e FranÃ§ais International de Bangkok*\n>\n>  Madame, Monsieur\n>\n> Madame, Monsieur\n> A ce jour, et sauf erreur de notre part, malgrÃ© notre premiÃ¨re relance,\n> nous nâ€™avons toujours pas reÃ§u le versement permettant de solder le montant\n> de lâ€™Ã©chÃ©ance due. *Cette relance constitue donc la 2eme relance et\n> derniÃ¨re relance.*\n> A dÃ©faut dâ€™une rÃ©gularisation de votre part avant le *16-04-2025* et\n> comme le prÃ©voit notre rÃ¨glement financier des pÃ©nalitÃ©s de retard dâ€™un\n> montant de 5 % du montant restant dÃ» sâ€™appliqueront.\n>\n> Merci de nous adresser la preuve du virement Ã  lâ€™adresse\n> facturation@lfib.ac.th\n> ,\n> ou de nous la rÃ©adresser si vous avez dÃ©jÃ  procÃ©dÃ© au paiement\n> Cordialement\n>\n>\n> Madam, Sir\n>\n> To date, and unless we are mistaken, despite our first reminder, we have\n> still not received the payment required to settle the amount due. *This\n> relaunch is therefore the 2nd relaunch.*\n> If you fail to pay before *16-04-2025*, as stipulated in our financial\n> regulations, late payment penalties of 5% of the outstanding amount will\n> apply.\n> Please send proof of payment to facturation@lfib.ac.th\n> ,\n> or to send it to us again if you have already made the payment\n> Best regards\n>\n>\n> *Service ComptabilitÃ© / Accounts Department*\n> *LycÃ©e FranÃ§ais International de Bangkok*\n> LycÃ©e FranÃ§ais International de Bangkok\n> \n> 498, soi Ramkhamhaeng 39\n> \n> (Thep Leela 1)\n> Wangthonglang\n> Bangkok\n> \n> 10310\n> [image: Logo]\n>"
}