{
  "year": 2025,
  "seq": 117,
  "meta": {
    "date": "2025-07-20",
    "from": "MYM MANDABA SCI <mymmandaba@gmail.com>",
    "to": "Yannick Mandaba <y.mandaba@gmail.com>, BeeBaa <beebeau89@gmail.com>",
    "subject": "Re:"
  },
  "proposals": [
    {
      "index": -117,
      "etiquette": "Frais d'Ã©cole / bus Tristan",
      "category": "MIN",
      "duration": "LT",
      "source": "AI",
      "score": 1,
      "matched_from": [
        "ai_new"
      ]
    }
  ],
  "raw_excerpt": "ðŸ—• Date : 2025-07-20\nðŸ‘¤ From : MYM MANDABA SCI <mymmandaba@gmail.com>\nðŸ“¨ To   : Yannick Mandaba <y.mandaba@gmail.com>, BeeBaa <beebeau89@gmail.com>\nðŸ§• Subject : Re:\n---\nmerci pour les photos de Tristan.\nmerci pour les videos, mais oÃ¹ les archiver...?  mon cloud est plein, et je\nne sais pas oÃ¹ payer google qui me menace de supprimer mes films et\nphotos...\n\nMon mail Ã©tait postÃ© avant.\nMais pourquoi m'avez-vous envoyÃ© cette photo de vous, volontairement\nhostiles...?.\n\nLe film PARASITE a Ã©tÃ© Ã©lu meilleur film mondial de ces 20 derniÃ¨res annÃ©es.\nCe peut Ãªtre intÃ©ressant de voir pourquoi je le mentionne, outre que c'est\nvraiment la culture cinÃ©matographique mondiale\n\nMon souci est toujours que Tristan marine dans le mÃªme bain, des endroits\nartificiels, des repas, des amis plus jeunes que lui.\nPas de sport, pas de plein air, pas de challenge, pas de cardio, pas de\nlangue franÃ§aise, pas de littÃ©rature.\nJe suis dÃ©solÃ©e pour lui.\n\nMa vie n'a pas commencÃ© avec la naissance de Tristan. J'ai Ã©tÃ© contente de\nlui faire dÃ©couvrir des expÃ©riences, et toutes mes relations ont apprÃ©ciÃ©\nses progrÃ¨s physiques, et ses rÃ©ussites.\n\nMon avantage par rapport Ã  vous, est que je n'ai jamais Ã©tÃ© jalouse de\npersonne.\n\nJ'ai, depuis petite, dÃ©passÃ© mes frustrations, et les ai transformÃ©es en\npulsions positives, et envie de me passionner pour de nouvelles activitÃ©s\nou de nouveaux centres d'intÃ©rÃªt. Tristan est comme moi, il a une capacitÃ©\nde rÃ©silience. Mais le monde actuel est un challenge, il ne doit pas rester\nsur la touche..\n\nJ'avais prÃ©vu un beau programme pour Tristan, vous l'en privez. Si son Ã©lan\nvital diminue, s'il perd son dynamisme, vous en serez responsables. DÃ©jÃ \nvous ne me communiquez pas les bulletins scolaires, c'est un signe.\n\nPour le stage , voyez avec lui, regardez les photos et videos de 2024, je\nvais en commander.\nsite=  Stage International de Danse Publier 2025\n\nJe suis toujours disposÃ©e Ã  lui acheter son billet, j'ai regardÃ©, il reste\ndes place pour vols direct Enfants Non AccompagnÃ©s.\n\nVotre attitude est Ã©goÃ¯ste.\n\nS'il n'est pas accompagnÃ© dans sa scolaritÃ© par un adulte ayant Ã©tÃ© dans\ndes Etudes SupÃ©rieures, son niveau va baisser. L'Ecole ne suffit pas, c'est\ndit et Ã©crit partout. Il faut en plus un bain social et culturel porteur.\nEt, le niveau des collÃ©giens et lycÃ©ens dÃ©pend du niveau scolaire de la\nmÃ¨re, et du niveau socio-professionnel du pÃ¨re. Statistiques INSEE.\nSi vous ne voulez pas qu'il soit aidÃ©, cela corrobore la justesse des\nstatistiques. Vous refusez les conseils. Soyez pro-actifs, sinon Tristan\nsera peut-Ãªtre dÃ©Ã§u parce que ses efforts et son sÃ©rieux ne suffiront pas.\n\nLe dim. 20 juil. 2025 Ã  13:34, Yannick Mandaba  a\nÃ©crit :\n\n> Moi je ne demande pas le pouvoir par contre je demande qu'on me casse pas\n> les pieds\n>\n> Yannick Mandaba\n> Mobile: +66.8782.00.622\n>"
}