{
  "year": 2025,
  "seq": 137,
  "meta": {
    "date": "2025-02-26",
    "from": "maryvonne masseron-mandaba <maryvonnemm@hotmail.com>",
    "to": "\"marcmandaba@gmail.com\" <marcmandaba@gmail.com>, 'MYM MANDABA SCI'",
    "subject": "Re: Donation Partage"
  },
  "proposals": [],
  "raw_excerpt": "ðŸ—• Date : 2025-02-26\nðŸ‘¤ From : maryvonne masseron-mandaba <maryvonnemm@hotmail.com>\nðŸ“¨ To   : \"marcmandaba@gmail.com\" <marcmandaba@gmail.com>, 'MYM MANDABA SCI'\n\t<mymmandaba@gmail.com>\nðŸ§• Subject : Re: Donation Partage\n---\nMerci.\n\nEnvoy  partir de Outlook pour Android\n________________________________\nFrom: marcmandaba@gmail.com \nSent: Wednesday, 26 February 2025 00:20:41\nTo: 'MYM MANDABA SCI' \nCc: 'Yannick Mandaba' ; maryvonnemm@hotmail.com \nSubject: RE: Donation Partage\n\n\nBonsoir,\n\nVirement recu, merci.\n\nCi-joint le relev des oprations du 25 fvrier, et ci-dessous une copie dcran de la transaction.\n\nLes rfrences du virement sont visibles sur chacun des documents.\n\nMerci\n\nMarc\n\n\n\n[cid:image001.png@01DB87E4.1824CDC0]\n\n\n\n\n\nMarc Mandaba\n\nMobile +33 6 1119 3955 (WhatsApp)\n\n\n\nFrom: MYM MANDABA SCI \nSent: Tuesday, February 25, 2025 2:27 PM\nTo: marcmandaba \nCc: MYM MANDABA SCI ; Yannick Mandaba ; maryvonnemm@hotmail.com\nSubject: Donation Partage\n\n\n\nBonjour,\nJe viens deffectuer le virement de 12 000,00 EUR pour Donation Partage Notariee depuis l'application SG."
}