{
  "year": 2025,
  "seq": 79,
  "meta": {
    "date": "2025-06-05",
    "from": "MYM MANDABA SCI <mymmandaba@gmail.com>",
    "to": "Yannick Mandaba <y.mandaba@gmail.com>",
    "subject": "Re:"
  },
  "proposals": [
    {
      "index": -79,
      "etiquette": "Dossier de bourse Tristan",
      "category": "MIN",
      "duration": "LT",
      "source": "AI",
      "score": 1,
      "matched_from": [
        "ai_new"
      ]
    },
    {
      "index": -79,
      "etiquette": "Frais d'Ã©cole / bus Tristan",
      "category": "MIN",
      "duration": "LT",
      "source": "AI",
      "score": 1,
      "matched_from": [
        "ai_new"
      ]
    }
  ],
  "raw_excerpt": "ðŸ—• Date : 2025-06-05\nðŸ‘¤ From : MYM MANDABA SCI <mymmandaba@gmail.com>\nðŸ“¨ To   : Yannick Mandaba <y.mandaba@gmail.com>\nðŸ§• Subject : Re:\n---\nBien reÃ§u !\nOn dirait que c'est Marc qui parle.\nTu as eu plus de finesse, que cela.\nTu as beaucoup fait pour ton fils, je sais.\nMais actuellement que contrÃ´les-tu de son temps sur les rÃ©seaux sociaux.?.\nLui as-tu demandÃ©, devant moi, si il accepte ou refuse des vacances en\nFrance, avec ses amis et cousins cousines.?.\nPour ce qui est de l'apprÃ©ciation de son prof de franÃ§ais, tu me l'as dÃ©jÃ \nenvoyÃ©e, mais pas le bulletin du 2eme trimestre.\nTu retournes la situation, je ne fais aucun chantage, d'ailleurs je n'en ai\naucun objet. Toi par contre tu veux toujours plus d'argent. J'ai accordÃ©\n1500 euros par mois.1000 pour ton argent de poche, et 500 pour Tristan.\nJe suis rendu Ã  beaucoup plus... Et c'est ma retraite de travailleuse qui\npart pour rien. Je n'aurais pas Ã  payer autant de complÃ©ment de bourse, si\ntu ne t'Ã©tais pas vantÃ©, par courriel, auprÃ¨s du consulat d'avoir des\nbiens... C'est 5000 â‚¬ donnÃ©s Ã  l'Etat pour le lfib, alors que je paye\nbeaucoup d'impÃ´ts, Ã  l'Etat, justement pour les Ã©coles...\nRÃ©ponds Ã  mes demandes de documents, et le tiroir caisse s'ouvrira.\n\nLe jeu. 5 juin 2025, 14:19, Yannick Mandaba  a Ã©crit :\n\n>\n>\n> Il faut que tu te rendes compte quand mÃªme que si tu ne peux pas tenir\n> parole sur le troisiÃ¨me accord aprÃ¨s des annÃ©es de comportement\n> inacceptable....\n>\n> Un accord qui mentionne dans son intitulÃ© une mesure conservatoire\n> spÃ©cialement contre ta tendance az chantage....\n>\n> C'est-Ã -dire qu'on se doute dans l'accord que tu vas essayer de\n> conditionner ce Ã  quoi tu t'engagÃ© avec d'autres choses tout au long de du\n> chemin comme un malfrat quoi comme la mafia ou je sais pas quoi.\n>\n> Tu comprends que si tu peux pas te forcer non pas Ã  suivre scrupuleusement\n> les engagements mais ne serait-ce qu'Ã  en parler ouvertement quand tu ne\n> les suis pas ne serait-ce que de montrer que non cette mesure Ã©tait inutile\n> mais toi tu le conforte.\n>\n> C'est-Ã -dire qu'on est au bout du bout quoi. C'est-Ã -dire on a un accord\n> dans lequel il est Ã©crit maman ne devra pas essayer de rÃ©utiliser pour\n> faire d'autres chantages.\n>\n> Et maman rÃ©utilise pour faire d'autres chantages.\n>\n> Donc lÃ  on est pas devant la Cour de justice on n'est pas devant qui que\n> ce soit c'est juste que nous pouvons rien entreprendre prÃ©voir ou\n> programmer avec toi.\n>\n>\n> Je vois bien puisque de toute faÃ§on finale tu vas juste faire ce qui te\n> plaÃ®t.\n>\n> Et puis nous sommes qui tu te comportes comme Ã§a ?\n> Il est bien pas me raconter des mots nous savons qui nous sommes par la\n> maniÃ¨re dont tu nous traites.\n>\n>\n> 0k?\n>\n> Pour moi ces accords c'est le dernier fil du dernier brin de la derniÃ¨re\n> corde.\n>\n> En ce qui me concerne je n'ai rien d'autre Ã  discuter avec toi tant que tu\n> ne le respecte pas.\n>\n> PS:\n> Je t'ai envoyÃ© la remarque du prof de franÃ§ais de Tristan. Tu ne m'as pas\n> laissÃ© le temps de te fÃ©liciter pour ta participation.\n> Tu es empressÃ©e de m'envoyer un message qui sous-entend que tu es la seule\n> responsable de ce rÃ©sultat.\n> Ni moi ni Tristan lui-mÃªme nous sommes responsables de rien.\n>\n> Je lui ai apportÃ© l'attention que je n'ai pas eue de mes 3 ans je mangeais\n> des aiguilles Ã  la garderie jusqu'Ã  mes 6 ou 7 ans quand nous sommes\n> arrivÃ©s Ã  Bangui.\n>\n> Tristan je lui ai appris Ã  compter avant qu'il puisse s'asseoir j'ai la\n> vidÃ©o oÃ¹ il est assis sur ses poings et il compte jusqu'Ã  5.\n>\n> J'ai la vidÃ©o Ã  peine quelques mois plus tard oÃ¹ il est en train de lire\n> une fable de La Fontaine a mÃªme pas un an et demi et il suit du doigt mot Ã \n> mot, syllable par syllabe.\n> Et je l'endormais en lui faisant rÃ©citer les conjugaisons de tout\n> l'indicatif connaissait Ã  cet Ã¢ge-lÃ  dÃ©jÃ .\n> On rÃ©citait et il s'endormait en rÃ©citant Ã§a.\n>\n> Toi la grossiere paysanne je te donne un petit accÃ¨s Ã  mon fils quelques\n> minutes  par jour pour lire un peu et immÃ©diatement tu t'empresses de\n> revendiquer to"
}