{
  "year": 2025,
  "seq": 31,
  "meta": {
    "date": "2025-02-27",
    "from": "MYM MANDABA SCI <mymmandaba@gmail.com>",
    "to": "MYM MANDABA SCI <mymmandaba@gmail.com>, Yannick Mandaba <y.mandaba@gmail.com>,",
    "subject": "Fwd: ReÃ§u de paiement disponible / Payment receipt available"
  },
  "proposals": [
    {
      "index": -31,
      "etiquette": "Frais d'Ã©cole / bus Tristan",
      "category": "MIN",
      "duration": "LT",
      "source": "AI",
      "score": 1,
      "matched_from": [
        "ai_new"
      ]
    }
  ],
  "raw_excerpt": "ðŸ—• Date : 2025-02-27\nðŸ‘¤ From : MYM MANDABA SCI <mymmandaba@gmail.com>\nðŸ“¨ To   : MYM MANDABA SCI <mymmandaba@gmail.com>, Yannick Mandaba <y.mandaba@gmail.com>, \n\tmarcmandaba <marcmandaba@gmail.com>\nðŸ§• Subject : Fwd: ReÃ§u de paiement disponible / Payment receipt available\n---\nMerci du reÃ§u de la banque, des baths de la donation partage, sur document\nofficiel, pour adresser Ã  MaÃ®tre Chaudet.\n\n---------- Forwarded message ---------\nDe : MYM MANDABA SCI \nDate: jeu. 27 fÃ©vr. 2025, 16:47\nSubject: Re: ReÃ§u de paiement disponible / Payment receipt available\nTo: Yannick Mandaba \n\n\nBien reÃ§u.\nMais ce n'est pas ce que je demande. Les virements que je fais pour l'Ã©cole\nsont automatiquement versÃ©s au tableau Excel du lfib, aprÃ¨s que j'aie\nenvoyÃ© la preuve du virement.\nCe que je demande, c'est le document d'arrivÃ©e des baths de la donation\npartage sur ton compte en ThaÃ¯lande. Tu as juste envoyÃ© un ticket de\ncaisse, sans en-tÃªte... Merci d'un document correct pour verser au dossier\ndu Notaire.\n\nLe jeu. 27 fÃ©vr. 2025, 04:48, Yannick Mandaba  a\nÃ©crit :\n\n>\n> ---------- Forwarded message ---------\n> From: Facturation \n> Date: Thu, Feb 27, 2025, 9:55â€¯AM\n> Subject: ReÃ§u de paiement disponible / Payment receipt available\n> To: MANDABA Yannick \n>\n>\n> Bonjour,\n>\n> Nous avons bien encaissÃ© votre rÃ¨glement. Un reÃ§u a Ã©tÃ© gÃ©nÃ©rÃ© sur votre\n> portail Finance Eduka. Vous pouvez accÃ©der Ã  ce document en cliquant sur le\n> lien ci-dessous puis sur le module Finance.\n> https://lfib.eduka.school/\n> \n> Vous pouvez Ã©galement le trouver en piÃ¨ce jointe.\n>\n> We have received your payment and a new receipt is available on the Eduka\n> online portal for your account. To view it, click on the link below to log\n> in and go to the Finance module.\n> https://lfib.eduka.school/\n> \n> Find the document in attachment too.\n>\n> *Service ComptabilitÃ©*\n> *LycÃ©e FranÃ§ais International de Bangkok* LycÃ©e FranÃ§ais International de\n> Bangkok 498, soi Ramkhamhaeng 39\n> \n> (Thep Leela 1) Wangthonglang Bangkok 10310\n>"
}