{
  "year": 2025,
  "seq": 96,
  "meta": {
    "date": "2025-06-21",
    "from": "MYM MANDABA SCI <mymmandaba@gmail.com>",
    "to": "BeeBaa <beebeau89@gmail.com>",
    "subject": "Les livres de littÃ©rature"
  },
  "proposals": [],
  "raw_excerpt": "ğŸ—• Date : 2025-06-21\nğŸ‘¤ From : MYM MANDABA SCI <mymmandaba@gmail.com>\nğŸ“¨ To   : BeeBaa <beebeau89@gmail.com>\nğŸ§• Subject : Les livres de littÃ©rature\n---\nBonjour, Bee\n\nTu parles de commander quoi ?\nLes livres sont achetÃ©s.\nJe les envoie mardi.\n\nIl y a aussi le dictionnaire espagnol.\nMais je croyais qu'il allait faire Mandarin...\nEt le latin.?.\n\nLes habits aussi sont achetÃ©s.\nJ'espÃ¨re qu'il viendra aux vacances d'Ã©tÃ©, ou de Toussaint, ou de NoÃ«l...\n\nJe ne crois pas bon pour lui d'avoir abandonnÃ© les lectures Ã  haute voix de\nla littÃ©rature franÃ§aise.\nDes publications montrent que c'est une bonne faÃ§on d'apprendre une langue,\net d'augmenter les facultÃ©s d'imagination et de rÃ©flexion sur les\ncivilisations."
}