{
  "year": 2025,
  "seq": 99,
  "meta": {
    "date": "2025-07-03",
    "from": "MYM MANDABA SCI <mymmandaba@gmail.com>",
    "to": "Yannick Mandaba <y.mandaba@gmail.com>",
    "subject": "Tristan"
  },
  "proposals": [],
  "raw_excerpt": "ğŸ—• Date : 2025-07-03\nğŸ‘¤ From : MYM MANDABA SCI <mymmandaba@gmail.com>\nğŸ“¨ To   : Yannick Mandaba <y.mandaba@gmail.com>\nğŸ§• Subject : Tristan\n---\nBonsoir,\nVoici le document douanier pour les livres scolaires. Ils arriveront vers\nvendredi prochain.\nIl faut acheter les fournitures scolaires Ã  bkk.\nSi vous m'envoyez Tristan pour les vacances d'Ã©tÃ©, je lui achÃ¨terai ce\nqu'il faut, et lui donnerai ses habits.\nJe lui ferai ses vaccins.\nEt je lui offrirai de trÃ¨s belles vacances, comme l'an dernier, mais sans\nles chÃ¢teaux de la Loire, et avec l'Italie du Nord, puisque, Ã  Evian, nous\nsommes tout prÃ¨s, en passant par le tunnel sous le Mont Blanc.\nVous pouviez passer des vacances avec lui, 15j Ã  la Toussaint, 15j Ã  NoÃ«l,\n15j au Printemps, 15j Ã  PÃ¢ques... Cela faisait 2 mois... Vous avez dÃ» en\nprofiter pour aller dans les Ã®les...\nMaintenant, nous lui devons, puisqu'il a beaucoup travaillÃ©, des vacances\ndifficiles diffÃ©rentes, Ã©ducatives, sportives, avec des cousins et des\ncopains, et sans soucis d'argent.\nC'est ma proposition pour son bien-Ãªtre, cette annÃ©e encore, d'insouciance,\ncar ensuite il entrera, comme normalement, dans l'adolescence...\nJ'espÃ¨re que vous me comprenez."
}