{
  "year": 2025,
  "seq": 28,
  "meta": {
    "date": "2025-02-24",
    "from": "MYM MANDABA SCI <mymmandaba@gmail.com>",
    "to": "Yannick Mandaba <y.mandaba@gmail.com>",
    "subject": "Re: THEME 1 = suite = les honoraires du Notaire"
  },
  "proposals": [
    {
      "index": -28,
      "etiquette": "Visa / immigration",
      "category": "MIN",
      "duration": "LT",
      "source": "AI",
      "score": 1,
      "matched_from": [
        "ai_new"
      ]
    }
  ],
  "raw_excerpt": "ðŸ—• Date : 2025-02-24\nðŸ‘¤ From : MYM MANDABA SCI <mymmandaba@gmail.com>\nðŸ“¨ To   : Yannick Mandaba <y.mandaba@gmail.com>\nðŸ§• Subject : Re: THEME 1 = suite = les honoraires du Notaire\n---\nYannick. Tu as beaucoup changÃ©...\n\n OÃ¹ sont ton honnÃªtetÃ© et ta rigueur scientifique...?\n\n\nJ'ai virÃ© 14000 euros par WISE.\n\n\n12000 euros obligÃ©s pour ta caution de visa.\nEt 2000 euros que le notaire a ajoutÃ©, en don manuel, comme on donne\nhabituellement au Nouvel An.\n\nSauf que personne ne lui a dit que je verse beaucoup chaque mois...\n\nJ'espÃ¨re que tu as demandÃ© conseil Ã  Marc pour faire un compte bloquÃ©\nrÃ©munÃ©rÃ© , contrat conseillÃ© de 5 ans Ã  8%.\n\n\nDonc, cette annÃ©e encore je suis en avance dans mes aides envers toi\n1000 euros en janvier\n330 euros dÃ©but fÃ©vrier\n2000 euros le 17 fÃ©vrier, et :\n\n427 euros en frais de Notaire\n\nSoient dÃ©jÃ  3757 euros.\n\nAu lieu de 2000 euros.\n\nJe ne vois donc pas Ã  quel titre je ne peux plus Ã©crire, parler, lire avec\nTristan. Et non plus lui offrir les vacances qu'il mÃ©rite.\n\nCadeau de ses 11 ans : OuzbÃ©kistan en train et velo, en fÃ©vrier, Il en est\nprivÃ©.\n\nCadeau de NoÃ«l : en France, avec ma famille, ses stages, ses amis, comme\nl'an dernier. J'attends.\n\nMa conclusion = tu es autoritaire et  cruel. Nous en reparlerons.\n\nTu as calculÃ©, avec ton chantage, de quelques jours de retard dans les\nversements prÃ©tendument dus, que je ne verrai Tristan qu'en mai 2028...\n\nPour moi, j'aurais dÃ» reprendre la littÃ©rature en novembre, et le revoir\naux vacances de fÃ©vrier. C'est toi qui dÃ©cide de BRIMER. Sans aucune rÃ¨gle\nvalidÃ©e. J'ai un but pour Tristan, Il le sait et l'accepte. Je l'ai Ã©crit\nsouvent. Les 6 mois passÃ©s sont des mois perdus.\n\n\n\nLe dim. 23 fÃ©vr. 2025, 20:34, Yannick Mandaba  a\nÃ©crit :\n\n> Non seulement, j'avais prÃ©vu plusieurs mois en avance que tu manquerais la\n> date butoir du VISA, et je te l'ai dit, mais en plus tu as le toupet de\n> dire que tu es prise par surprise.\n>\n> Le pervers narcissique inverse toujours tout et se victimise en permanence\n> et surtout pour couvrir ses attaques mensongÃ¨res.\n>  Encore une case cochÃ©e.\n>\n> On Sun, Feb 23, 2025 at 7:51â€¯PM MYM MANDABA SCI \n> wrote:\n>\n>> Bonjour,\n>>\n>> Merci, Marc, de ton retour.\n>>\n>> Je n'avais pas anticipÃ© une limitation non modifiable de la hauteur de\n>> mes transferts depuis ma banque SG...\n>> Donc, je vais procÃ©der ainsi :\n>>\n>> - virement immÃ©diat de 1573 euros, au titre d'un don manuel, amputÃ© de\n>> 427 euros, qui reprÃ©sentent la moitiÃ© des frais de Notaire. Yannick recevra\n>> de ma part 427 euros thÃ©oriques sur notre compte de ce qu'il estime que je\n>> lui dois, et dont je n'avais pas connaissance le 7 fÃ©vrier quand j'ai\n>> provisionnÃ© WISE de 14000 euros ( 12 000 de donation plus 2000 de Don\n>> manuel)\n>> - dÃ¨s mardi, Ã  l'ouverture, je vais Ã  ma banque SG, avec mes\n>> justificatifs, pour relever le plafond ponctuellement, et virer les 12 000\n>> euros de la donation partage sur le compte de Marc.\n>>\n>> J'attends, de chacun de vous 2, les justificatifs bancaires, car maÃ®tre\n>> Chaudet m'a fait confiance pour les lui faire parvenir. Il a fait l'acte en\n>> externalisant la comptabilitÃ© de celui-ci.\n>>\n>> En attendant les documents bancaires que vous m'enverrez, je suis prÃªte Ã \n>> clore ce dossier.\n>>\n>> Maryvonne MANDABA Masseron\n>>\n>>\n>\n> --\n> Yannick Mandaba\n> Mobile: +66.8782.00.622\n>"
}