{
  "year": 2025,
  "seq": 125,
  "meta": {
    "date": "2025-08-03",
    "from": "MYM MANDABA SCI <mymmandaba@gmail.com>",
    "to": "Yannick Mandaba <y.mandaba@gmail.com>",
    "subject": "Re: IMPORTANT : Les compte pour MADAME"
  },
  "proposals": [],
  "raw_excerpt": "ðŸ—• Date : 2025-08-03\nðŸ‘¤ From : MYM MANDABA SCI <mymmandaba@gmail.com>\nðŸ“¨ To   : Yannick Mandaba <y.mandaba@gmail.com>\nðŸ§• Subject : Re: IMPORTANT : Les compte pour MADAME\n---\nIl n'y a pas de caractÃ¨re automatique.\nIl s'agit d'une aide familiale.\nJe paie quand je peux, et selon les cours, et selon les frais de transfert.\n\nLes annÃ©es prÃ©cÃ©dentes, effectivement, je versais beaucoup plus... Selon\nles justifications et explications. Mais cela n'a servi Ã  pas grand chose.\nEt surtout tes demandes Ã©taient assaisonnÃ©es, comme de la salade...\n\nActuellement encore, tes demandes sont destinÃ©es Ã  la lecture politique\nintÃ©rieure...\n\nLe ven. 1 aoÃ»t 2025, 10:01, Yannick Mandaba  a Ã©crit :\n\n> Bonjour,\n>\n> Nous sommes fin du mois.\n> Marcus vu le sabotage en cours ce mois-ci tu peux me verser tous les 300\n> Eur cette fois STP\n> Au cas oÃ¹ car j'ai promis le stage de voile, et j'ai des frais d'avocats Ã \n> prÃ©voir pour patente sur les cadre lÃ .... et Maman est en mode sabotage.\n> donc  voilÃ ...\n>\n> Caisse TZ Marc:\n> Reserve action Bangui: 200 Eur\n> Solde TZ Juillet 2025 : *300 EUR*\n> Solde TZ Aout 2025:  300 Eur (indiquÃ© pour symÃ©trie)\n>\n> Caisse TZ Maman :\n> Solde Juillet 2025 : 200 Eur\n> Solde Aout 2025 : 1000 Eur\n>\n> Ce jour. Je vais faire un CRON JOB pour faire des rappels et calculs\n> automatiques des comptes. C'est surtout pour Maman.Ce sera renvoyÃ© de\n> maniÃ¨re automatique. Il y aura un historique.\n>\n> --\n> Yannick Mandaba\n> Mobile: +66.8782.00.622\n>"
}