{
  "year": 2025,
  "seq": 2,
  "meta": {
    "date": "2025-01-02",
    "from": "MYM MANDABA SCI <mymmandaba@gmail.com>",
    "to": "Yannick Mandaba <y.mandaba@gmail.com>, BeeBaa <beebeau89@gmail.com>",
    "subject": "Fwd: maryvonne masseron-mandaba a partagÃ© Â«Â 2739BA12-F55C-4F6B-83D8-54960EC8BF31 (1)Â Â» avec vous"
  },
  "proposals": [],
  "raw_excerpt": "ğŸ—• Date : 2025-01-02\nğŸ‘¤ From : MYM MANDABA SCI <mymmandaba@gmail.com>\nğŸ“¨ To   : Yannick Mandaba <y.mandaba@gmail.com>, BeeBaa <beebeau89@gmail.com>\nğŸ§• Subject : Fwd: maryvonne masseron-mandaba a partagÃ© Â«Â 2739BA12-F55C-4F6B-83D8-54960EC8BF31 (1)Â Â» avec vous\n---\nVaccins de Tristan trÃ¨s en retard=\n2020  DTaP fait. ????\n2025  DTaP  Ã  prÃ©voir\n\n---------- Forwarded message ---------\nDe : maryvonne masseron-mandaba \nDate: jeu. 2 janv. 2025, 13:49\nSubject: maryvonne masseron-mandaba a partagÃ©\nÂ« 2739BA12-F55C-4F6B-83D8-54960EC8BF31 (1) Â» avec vous\nTo: mymmandaba@gmail.com \n\n\n[image: Partager lâ€™image]\n\nmaryvonne masseron-mandaba a partagÃ© un fichier avec vous\n\nmaryvonne masseron-mandaba a partagÃ© ce document avec vous.\n[image: icon] 2739BA12-F55C-4F6B-83D8-54960EC8BF31 (1)\n\n\n[image: permission globe icon] Ce lien fonctionne pour tous les\nutilisateurs.\nOuvrir\n\n[image: Microsoft logo] DÃ©claration de confidentialitÃ©"
}