{
  "year": 2025,
  "seq": 70,
  "meta": {
    "date": "2025-05-19",
    "from": "MYM MANDABA SCI <mymmandaba@gmail.com>",
    "to": "Yannick Mandaba <y.mandaba@gmail.com>",
    "subject": "Le dernier document des impÃ´ts reÃ§u ici"
  },
  "proposals": [
    {
      "index": -70,
      "etiquette": "Dossier de bourse Tristan",
      "category": "MIN",
      "duration": "LT",
      "source": "AI",
      "score": 1,
      "matched_from": [
        "ai_new"
      ]
    }
  ],
  "raw_excerpt": "ğŸ—• Date : 2025-05-19\nğŸ‘¤ From : MYM MANDABA SCI <mymmandaba@gmail.com>\nğŸ“¨ To   : Yannick Mandaba <y.mandaba@gmail.com>\nğŸ§• Subject : Le dernier document des impÃ´ts reÃ§u ici\n---\nPour que tu retrouves tes codes.\nC'est celui de 23, sur 2022\nJe n'ai pas copie de 24, sur 2023\n\nTu dois faire aujourd'hui , derniÃ¨re limite,  celui de 25, sur 2024\n\nPour avoir un peu de bourse pour Tristan,\nCar aprÃ¨s avoir laissÃ© ton travail, et Ã©crit aux administrations que ta\nfamille est riche, et que celle de la maman de Tristan est riche, mais\nqu'on ne vous aide pas... Il faut des PREUVES de votre pauvretÃ©. Et des\nAIDES reÃ§ues ou non reÃ§ues...\n\nJe suis disponible, en retard, car j'ai dÃ» aller Ã  Fidal ce matin."
}