{
  "year": 2025,
  "seq": 16,
  "meta": {
    "date": "2025-02-13",
    "from": "MYM MANDABA SCI <mymmandaba@gmail.com>",
    "to": "Yannick Mandaba <y.mandaba@gmail.com>",
    "subject": "Je vous ai envoyÃ© de l'argent avec Wise"
  },
  "proposals": [],
  "raw_excerpt": "ðŸ—• Date : 2025-02-13\nðŸ‘¤ From : MYM MANDABA SCI <mymmandaba@gmail.com>\nðŸ“¨ To   : Yannick Mandaba <y.mandaba@gmail.com>\nðŸ§• Subject : Je vous ai envoyÃ© de l'argent avec Wise\n---\nBonjour Mr Yannick Yves Sala-Kosso MANDABA,\n\nje viens de vous envoyer de l'argent avec Wise.\n\nVous devriez recevoir 489â€¯745,04 THB sur votre compte .\n\nSuivez le transfert Ã  l'aide de ce lien :\nhttps://wise.com/fr/track/853bdce7800d4f41953e74455d6434be?utm_source=web&utm_medium=email&utm_content=moneyTracker\n\nSi vous devez Ã©galement envoyer de l'argent Ã  l'Ã©tranger, pourquoi ne pas\nutiliser Wise pour profiter de frais bas et transparents ? Vous obtiendrez\nune carte gratuite ou un transfert gratuit en vous inscrivant avec mon\nlien : https://wise.com/invite/mrme/maryvonnejeaninejuliennem\n\nMaryvonne Jeanine Julienne Mandaba-Masseron"
}