{
  "year": 2025,
  "seq": 115,
  "meta": {
    "date": "2025-07-13",
    "from": "MYM MANDABA SCI <mymmandaba@gmail.com>",
    "to": "Yannick Mandaba <y.mandaba@gmail.com>",
    "subject": "Suivi des messages au 20250713"
  },
  "proposals": [],
  "raw_excerpt": "ğŸ—• Date : 2025-07-13\nğŸ‘¤ From : MYM MANDABA SCI <mymmandaba@gmail.com>\nğŸ“¨ To   : Yannick Mandaba <y.mandaba@gmail.com>\nğŸ§• Subject : Suivi des messages au 20250713\n---\nBonjour, Yannick.\nMes 2 derniers messages n'ayant pas Ã©tÃ© lus, je vais attendre que tu sois\nouvert au dialogue. Il s'agit de sujets importants.\nJe te rappelle que tu m'avais demandÃ©, pour les vacances de Tristan, de ne\npas prÃ©voir de trajets en voiture. C'est donc, en train, que j'ai commencÃ©\nla dÃ©couverte de la France, patrimoniale culturelle, avec un Tristan\nthÃ©orique, ou un cyber Tristan comme tu le veux.\nLes rÃ©servations de trains, hÃ´tel, visites, se font Ã  l'avance... Tout est\nfait.\nDonc, maintenant 1er passage Ã  l'Ã®le de RÃ©, mais Joshua regrette l'absence\nde Tristan...\nLe 2eme passage est prÃ©vu le 1er aoÃ»t. Puis Bergerac. Marc et sa famille,\ns'il le souhaite. RemontÃ©e par Chambord, Cluny, Lac Leman, du 9 au 16 stage\nde street dance Ã  Evian. Avec LÃ©a et Maxime s'ils le souhaitent.\nMes amies de Danse de Rennes, avec leurs petits enfants attendent Tristan.\nEt aussi ses copains de l'an dernier. Ils ont mÃªme souhaitÃ© que Tristan\nsuive le cours de ComÃ©die Musicale avec eux, en plus du street dance.\nMaintenant je vais repartir en Bretagne, de la famille l'attend, RÃ©mi,\nLaurence, CÃ©line.\nJe leur dit \"qu'il ne peut venir ? qu'il ne veut pas venir ? que sa famille\nveut venir avec ???.\nDonc, merci d'Ãªtre cohÃ©rent, et de ne pas  empÃªcher ton fils d'exister en\ntant que lui-mÃªme. Je l'aime comme il est, avec son appÃ©tit de\nconnaissances, de culture, de s'exprimer, et sa belle approche de la langue\nfranÃ§aise. Mais s'il devient un Consommateur lambda, sans rien de plus,\ncela peut me dÃ©courager de l'aider.\nJ'attends ta rÃ©ponse\n- reÃ§u du virement RIA mi juillet\n- paiement du billet d'avion de Tristan ThaÃ¯lande  France ThaÃ¯lande\n\nSi vous ne souhaitez pas qu'il vienne s'Ã©panouir en France, posez vous la\nquestion de pourquoi...\nAucune activitÃ© aux vacances de Toussaint, de NoÃ«l, de printemps, de\nPÃ¢ques...\nEt aucune activitÃ© aux grandes vacances, alors que l'an dernier, il en a\nÃ©tÃ© si Ã©panoui...\n\nJalousie, brimade, manque de confiance en ses capacitÃ©s ???\n\nC'est regrettable.\nCela lui cause un prÃ©judice intellectuel, et psychique.\n\nDe mÃªme que ne pas l'autoriser Ã  me parler."
}