{
  "year": 2025,
  "seq": 56,
  "meta": {
    "date": "2025-04-24",
    "from": "MYM MANDABA SCI <mymmandaba@gmail.com>",
    "to": "Yannick Mandaba <y.mandaba@gmail.com>, trs.mandaba@gmail.com,",
    "subject": "Fwd: Regardez \"Lâ€˜histoire de la street dance (2/2) | I Dance My Story! | ARTE\" sur YouTube"
  },
  "proposals": [],
  "raw_excerpt": "ðŸ—• Date : 2025-04-24\nðŸ‘¤ From : MYM MANDABA SCI <mymmandaba@gmail.com>\nðŸ“¨ To   : Yannick Mandaba <y.mandaba@gmail.com>, trs.mandaba@gmail.com, \n\tMasseron <maryvonne.masseron@free.fr>\nðŸ§• Subject : Fwd: Regardez \"Lâ€˜histoire de la street dance (2/2) | I Dance My Story! | ARTE\" sur YouTube\n---\n---------- Forwarded message ---------\nDe : MYM MANDABA SCI \nDate: jeu. 24 avr. 2025, 20:00\nSubject: Re: Regardez \"Lâ€˜histoire de la street dance (2/2) | I Dance My\nStory! | ARTE\" sur YouTube\nTo: Ymanda BKK \nCc: \n\n\nOui, j'ai lu.\nMais tu dois faire un effort, pour Ã©largir l'horizon de ton fils.\nTout ce qui est diffusÃ© sur Arte, passe ensuite sur YouTube...\nDonc tu cherches =\nYouTube l'histoire de la street dance 1/2\nYoutube l'histoire du street jazz 2/2\nYoutube Leonard de Vinci 1/2\nYoutube Leonard de Vinci 2/2\nSi cela ne rÃ©pond pas, tu me demandes et j'envoie une clÃ©, sauf si tu juges\nque c'est nul...\n\nLe jeu. 24 avr. 2025, 17:56, Ymanda BKK  a Ã©crit :\n\n> Je t ai explique qu on ne recoit pas ARTE ici tu nous bombarde avec des\n> trucs inutiles.\n> ArrÃªte Ã§a s'il te plait. Tu n'as donc rien lu de ce que j''ai Ã©crit?...\n>\n> On Wed, Apr 23, 2025 at 3:17â€¯PM MYM MANDABA SCI \n> wrote:\n>\n>> https://youtu.be/PrgDL-zdyZ8?si=fQf_2QD0oIb48Q1Y\n>>\n>\n>\n> --\n>\n> WebRep\n> Overall rating\n>\n>"
}