{
  "year": 2025,
  "seq": 60,
  "meta": {
    "date": "2025-05-06",
    "from": "MYM MANDABA SCI <mymmandaba@gmail.com>",
    "to": "Yannick Mandaba <y.mandaba@gmail.com>",
    "subject": "Re: Fin du mois."
  },
  "proposals": [
    {
      "index": -60,
      "etiquette": "Dossier de bourse Tristan",
      "category": "MIN",
      "duration": "LT",
      "source": "AI",
      "score": 1,
      "matched_from": [
        "ai_new"
      ]
    },
    {
      "index": -60,
      "etiquette": "Appartement PergolÃ¨se (vente/location)",
      "category": "MIN",
      "duration": "LT",
      "source": "AI",
      "score": 1,
      "matched_from": [
        "ai_new"
      ]
    }
  ],
  "raw_excerpt": "ðŸ—• Date : 2025-05-06\nðŸ‘¤ From : MYM MANDABA SCI <mymmandaba@gmail.com>\nðŸ“¨ To   : Yannick Mandaba <y.mandaba@gmail.com>\nðŸ§• Subject : Re: Fin du mois.\n---\n2000 euros inclus dans la donation\n475 euros retenus pour les frais de notaire, comme pour Marc.\nPas de frais de succession.\nLes 14000 ne sont pas Ã  dÃ©clarer, acte notariÃ© avec exemption des frais de\nsuccession.\n\n330 â‚¬ du 30 versÃ©s en avance, car vacances de Tristan.\n330 â‚¬ du 10 sont disponibles, sur demande, mÃªme aujourd'hui, , pour la 2eme\nsemaine des vacances de Tristan.\nProchain versement le 20.\n\nLe notaire vous a-t-il indiquÃ© la quotitÃ© disponible pour donation partage\navant mes 80 ans ?\nJe le ferai dÃ¨s que possible, afin de calmer le chantage.\n\nLe mar. 6 mai 2025, 06:09, Yannick Mandaba  a Ã©crit :\n\n> Bonjour,\n>\n> Marc  tu gardes 200 pour Bangui et 700 sur Bangkok, stp merci.\n>\n> De Maman j'ai reÃ§u le 20 , mais pas le 30.\n> Et les 2,400 E deviennent 2700\n> Et elle va justifier en disant que je n'ai plus les 400,000 alors que\n> c'est elle qui les sabote.\n>\n>\n> Cette fin de mois est une nouvelle trahison. Elle a 10k E par mois\n> minimum. Elle peut payer 10% pour la maison.\n> C'est trÃ¨s tenable.\n> Elle ment encore.\n>\n> Merci de me tenir au courant des dates pour l'AG PergolÃ¨se.\n> Et je n'ai plus trop les moyens de venir Ã  Bangui avec mes bambous. Elle a\n> su gÃ¢cher Ã§a aussi ...\n>\n> Marcus\n> Donc on fait comme prÃ©vu si elle ne tenait pas ses ultimes engagements.\n>\n> Je n'y croyais pas vraiment et toi non plus.  Ã‡a fait 20 ans qu'elle me\n> dÃ©stabilise et me maintient dans la dÃ©pendance et ne dÃ©pose pas mon\n> capital, c'est pas pour me donner tout d'un coup une rentre...\n>\n> Donc si je n'ai pas 3,000 Euro de Maman le 10, je te demande de prendre\n> tes dispositions pour la maison et louer aussi vite que possible pour\n> rembourser les travaux et me dÃ©gager de la part de Maman une petite tente\n> de compensation.\n>\n> Si maman ne t'envoie pas une copie de virement de 3,000 Euro tu prends\n> automatiquement tes dispositions.\n>\n> C'est son choix. C'est elle qui dÃ©cide.\n>\n> Yannick Mandaba\n> Mobile: +66.8782.00.622\n>"
}