{
  "year": 2012,
  "seq": 11,
  "meta": {
    "date": "2012-10-26",
    "from": "maryvonne.masseron@free.fr",
    "to": "Yannick Mandaba <y.mandaba@gmail.com>, marcmandaba@hotmail.com",
    "subject": "25 et 26 octobre"
  },
  "proposals": [],
  "raw_excerpt": "ğŸ—• Date : 2012-10-26\nğŸ‘¤ From : maryvonne.masseron@free.fr\nğŸ“¨ To   : Yannick Mandaba <y.mandaba@gmail.com>, marcmandaba@hotmail.com\nğŸ§• Subject : 25 et 26 octobre\n---\nbonsoir,\n\nje dois vous raconter ces deux journÃ©es:\n\n- 25 octobre 2012 = cÃ©rÃ©monies Ã  l'UniversitÃ© de Bangui: le matin Pr FranÃ§oise BarrÃ©-seloussi a Ã©tÃ© faite Dr Honoris causa de l'universitÃ© de Bangui;\npuis dÃ©corÃ©e dans l'ordre du mÃ©rite centrafricain;\n\n- l'aprÃ¨s- midi elle a donnÃ© une confÃ©rence remarquable, histoire de la connaissance du virus du Sida; traitements et perspectives; possibilitÃ©s vaccinales; stratÃ©gies de lutte...passionnant, mÃªme si l'on connait bien le sujet.\n\n- aujourd'hui, une cÃ©rÃ©monie pour le dÃ©cÃ¨s du Dr Alain GEORGES - dÃ©cÃ©dÃ© Ã  Lyon le 10 aout 2012 - il Ã©tait nÃ© en 1946 comme moi; hommage, dÃ©ciration de son Ã©pouse Marie-claude, elle aussi chercheur Ã  l'institut Pasteur de 1979 Ã  1991; discours multiples, et allocution de Alexis Georges, trÃ¨s bien . il salue Yannick; ce serait bien que Y mette un petit mot sur facebook, car vous vous y Ãªtes rencontrÃ©s , m'a-t'il dit.\n\n- demain Damara\n\nbonne soirÃ©e ou bonne nuit\nmaman\n\nmaryvone masseron - 41 rue du puits-mauger  35000  rennes  0299302000  0680078113"
}