{
  "year": 2012,
  "seq": 14,
  "meta": {
    "date": "2012-02-22",
    "from": "maryvonne masseron-mandaba <maryvonnemm@hotmail.com>",
    "to": "<y.mandaba@gmail.com>",
    "subject": "---"
  },
  "proposals": [
    {
      "index": -14,
      "etiquette": "ImpÃ´ts / fiscalitÃ©",
      "category": "MIN",
      "duration": "LT",
      "source": "AI",
      "score": 1,
      "matched_from": [
        "ai_new"
      ]
    }
  ],
  "raw_excerpt": "ðŸ—• Date : 2012-02-22\nðŸ‘¤ From : maryvonne masseron-mandaba <maryvonnemm@hotmail.com>\nðŸ“¨ To   : <y.mandaba@gmail.com>\nðŸ§• Subject : \n---\nmerci du message, due que dimanche tu ne te sois connect que tard sur Skype,je n'avais plus envie de faire ton papier des impots...pour moi il tait 17h...et j'avais eu trop de stress dj avec TJ et Mamie!en fait, je te l'aurais bien dict quand j'avais tout en tte, l'autre jour. pour moi ce genre de courrier c'est la prise de tte,quand j'ai eu fini les corves de ce style chez mamie et TJ,je n'ai plus de courage pour moi ou pout toi l je reviens de Cergy, travaux pour re-location;la cl USB va encore marcher un peu;ai dn au lance-pierre avec Marc hier soir  Paris ( en 45 mn tout compris ). Je vais essayer ce dimanche de faire ton courrier,mais avec toi ce serait plus facile bisousje vais lire ton courrier de ce soirmaman"
}