{
  "year": 2012,
  "seq": 30,
  "meta": {
    "date": "2012-10-03",
    "from": "maryvonne masseron-mandaba <maryvonnemm@hotmail.com>",
    "to": "marc mandaba <marcmandaba@hotmail.com>,cÃ©cile letocart <cecile.letocart@gmail.com>",
    "subject": "Bangui"
  },
  "proposals": [],
  "raw_excerpt": "ðŸ—• Date : 2012-10-03\nðŸ‘¤ From : maryvonne masseron-mandaba <maryvonnemm@hotmail.com>\nðŸ“¨ To   : marc mandaba <marcmandaba@hotmail.com>,cÃ©cile letocart <cecile.letocart@gmail.com>\nðŸ§• Subject : Bangui\n---\nBonjour toute la famille,\nje vous confirme mes dates de vol vers Bangui : Air France : aller le 17 et retour le 30 octobre.\nJe vous redis mon souhait d'emmener La avec moi, pour ce sjour de 2 semaines. Il me semble que je suis une personne responsable, et je ne prendrai aucun risque. Je me suis arrange avec les personnes qui gardent Mamie et TJ, pour pouvoir prendre qq jours avant et aprs, pour aller, ventuellement chercher La  Tunis, et l'y reconduire.\nC'est ma dernire proposition en ce sens. Aprs, l'cole sera importante. Pour l'instant, elle a besoin de connaitre ses familles, pour se situer dans le temps et dans l'espace. Elle doit vivre un peu dans la maison de ses grands-parents, et dormir dans la chambre de son papa, avant que cela ne soit plus possible.\nBonne soire\nmaryvonne"
}