{
  "year": 2012,
  "seq": 5,
  "meta": {
    "date": "2012-09-26",
    "from": "MYM MANDABA SCI <mymmandaba@gmail.com>",
    "to": "\"Charbel.braidy\" <charbel.braidy@hotmail.fr>",
    "subject": "Re: RE : location rue Pergolese"
  },
  "proposals": [
    {
      "index": -5,
      "etiquette": "ImpÃ´ts / fiscalitÃ©",
      "category": "MIN",
      "duration": "LT",
      "source": "AI",
      "score": 1,
      "matched_from": [
        "ai_new"
      ]
    }
  ],
  "raw_excerpt": "ðŸ—• Date : 2012-09-26\nðŸ‘¤ From : MYM MANDABA SCI <mymmandaba@gmail.com>\nðŸ“¨ To   : \"Charbel.braidy\" <charbel.braidy@hotmail.fr>\nðŸ§• Subject : Re: RE : location rue Pergolese\n---\ncher Monsieur,\n\ncomme l'an dernier, vous avez oubli le loyer du mois de juillet.\nLe dernier loyer reu \"rgulirement \", a t celui de juin ( reu le 02\njuillet 2012 ).\n\nLe montant reu le 07 septembre 2012, aprs sollicitation de ma part,\ncorrespond au loyer du mois de JUILLET.\nVous restez  nous devoir, et cette fois *aprs pointage auprs de notre\nbanque*, lemois de aout et septembre.\n\nCela devient urgent, car j'ai dj envoy un virement de 800 euros en aout\npour pallier votre dficience de juillet, et maintenant je fais 2 chques,\nde mon propre compte, pour rgler les impots fonciers, et les charges de la\ncoproprit.\n\nJe vous remercie de vous mettre en rgle\n\nmaryvonne mandaba\ngrante de la SCI mymy mandaba\n\nrennes le 26 septembre 2012\n\n\n\n2012/9/21 Charbel.braidy \n\n>\n> Bonjour Madame Mandaba,\n>\n> Le loyer qui manquait vous a t transfr ce matin.\n>\n> Restant  votre disposition\n>\n> Cordialement\n>\n> Charbel Braidy\n>\n>\n>\n> Envoy depuis un mobile Samsung\n>\n> MYM MANDABA SCI  a crit :\n> cher Monsieur,\n>\n> merci de bien vouloir rgulariser vos paiements de loyer; sauf erreur de\n> ma part, vous avez toujours du retard; de plus la fin du mois de septembre\n> approche...\n>\n> Nous avons des chances bancaires  honorer\n>\n> S'il s'agit d'un oubli, veuillez rgulariser, s'il s'agit de difficults\n> d'un autre ordre, merci de me le faire savoir, afin que je puisse\n> m'organiser pour approvisionner le compte , et pour les impts fonciers, et\n> pour le crdit, et pour les appels de charge de la coproprit.\n>\n> merci de bien vouloir m'informer de vos intentions.\n>\n> maryvonne mandaba,\n> grante de la SCI\n>"
}