{
  "year": 2012,
  "seq": 34,
  "meta": {
    "date": "2012-11-01",
    "from": "maryvonne masseron-mandaba <maryvonnemm@hotmail.com>",
    "to": "\"y.mandaba@gmail.com\" <y.mandaba@gmail.com>, marc mandaba",
    "subject": "de maman 1er nov 2012"
  },
  "proposals": [],
  "raw_excerpt": "ðŸ—• Date : 2012-11-01\nðŸ‘¤ From : maryvonne masseron-mandaba <maryvonnemm@hotmail.com>\nðŸ“¨ To   : \"y.mandaba@gmail.com\" <y.mandaba@gmail.com>, marc mandaba\n\t<marcmandaba@hotmail.com>\nðŸ§• Subject : de maman 1er nov 2012\n---\nchers yannick et marc,\nmon sjour se termine, avec une soire pour remercier les amis, comme d'habitude, les tagatio, nali, mokofio, gotilogue, yangue, lucie et jacques ndemanga.\nPas d'eau, je remplis la machine par le tiroir , comme au bon vieux temps, mais l je peine, car mon avion est  7h, et je dois tre  l'aroport ds que nous aurons fini lessive et vaisselle avec l'eau de rinage de la lessive.Je crois que c'est un fils perrire qui est parti avec notre 2eme ft pour rserve d'eau,  damara, et pas ramen.\nBref, une nuit blanche.\nJ'ai remerci en votre nom ces amis rassembls, surtout mme nali et lucie, qui ont bcp travaill  damara.\nJe vous signalerai mon aterrissage.\nAutre chose, mamie n'a pas t bien ces derniers jours, je lui tlphone rgulirement et ai constat des troubles de l'attention, des difficults d'locution, et ai fait appeler le mdecin: petits AVC  rptition; j'ai fait augmenter les interventions, kin et massages; et elle ne sera plus jamais seule; elle n'a pas beaucoup de forces, et tremble ce qui occasionne des pertes d'quillibre.Les dames qui s'en occupent sont trs vigilentes.\nj'irai  Vitr ds mon retour; marie-annick est arrive ce soir.\nje vous embrasse,ainsi que vos famillesmaman"
}