{
  "year": 2012,
  "seq": 32,
  "meta": {
    "date": "2012-10-21",
    "from": "maryvonne masseron-mandaba <maryvonnemm@hotmail.com>",
    "to": "\"y.mandaba@gmail.com\" <y.mandaba@gmail.com>, marc mandaba",
    "subject": "de maman"
  },
  "proposals": [],
  "raw_excerpt": "ðŸ—• Date : 2012-10-21\nðŸ‘¤ From : maryvonne masseron-mandaba <maryvonnemm@hotmail.com>\nðŸ“¨ To   : \"y.mandaba@gmail.com\" <y.mandaba@gmail.com>, marc mandaba\n\t<marcmandaba@hotmail.com>\nðŸ§• Subject : de maman\n---\nbonjour,\npour vous confirmer le programme, et vous y associer, actuellement il est 13h40  Bangui,- messe en la cathdrale, ce lundi 22 octobre  17h30- le samedi 27,  Damara  10h00, devant la tombe de papa.\nCe jour il y a eu une trs belle messe  la cathdrale, pour la clture de la semaine piscopale.La messe tait clbre par le nouveau cur de Damara, le Pre Narcisse Olimbi;parmi les co-clbrants, il y avait le Pre Francis Siki, que vous connaissez, l'actuel cur de la paroisse, qui dira la messe demain;et aussi un ancien cur de Damara, le Pre Baoua.\nLa procession des offrandes tait magnfique, avec une chorale de chanteurs, batteurs et danseurs; et aussi les diffrentes paroisses qui venaient en dansant apporter les fruits, lgumes, crales, boites de lait etc...avec les jeunes danseuses devant, soit avec des mouchoirs, soit avec des hochets en rotin...j'tais trs contente de me trouver l.\nJ'espre que vous vous portez bien, et vos proches galement.Je regrette de n'avoir aucune nouvelle.\nBisous\nmaman"
}