{
  "year": 2012,
  "seq": 9,
  "meta": {
    "date": "2012-10-24",
    "from": "maryvonne.masseron@free.fr",
    "to": "Yannick Mandaba <y.mandaba@gmail.com>",
    "subject": "Fid√®le Macpayen"
  },
  "proposals": [],
  "raw_excerpt": "üóï Date : 2012-10-24\nüë§ From : maryvonne.masseron@free.fr\nüì® To   : Yannick Mandaba <y.mandaba@gmail.com>\nüßï Subject : Fid√®le Macpayen\n---\nyannick, \n\nmerci de ton mot,\n\nFid√®le est tr√®s m√©ritant, et apr√®s son tr√®s grave accident de moto et coma durant plusieurs semaine, il a repris le dessus, avec la force mentale que nous lui connaissons.\n\nC'est lui qui est maintenant le chef d'atelier chez SCAR Renault,\ndepuis 1 semaine.\nIl a pr√©sent√© son dossier, et il a gagn√© le poste devant un expatri√©.\n\nJ'ai d√©pos√© ma voiture hier, pour poser les amortisseurs ramen√©s de Thailande. Malheureusement, le cylinbloc arri√®re gauche √©tait aussi en mauvais √©tat, il a tout fait cette nuit pour trouver les pi√®ces de remplacement de celles us√©es.\n\nIl a t√©l√©phon√© √† Marc ce matin, mais n'avait pas bcp d'unit√©s je crois.\nJ'ai donn√© vos mails et t√©l, et les miens, mais n'ai pas pris les siens.\n\nJe retourne demain car je trouve que le frein n'est plus comme avant. Je lui demanderai son t√©l, et tu l'appelleras, si tu veux. ( il aurait aussi un garage √† lui vers le Km 8, dit-on = ? ).\n\nDemain aussi j'irai √† l'universit√© pour une jourrn√©e sp√©ciale = r√©ception de MMe Dr Barre-Semoussi, co-d√©couvreur du virus du SIDA, avec Pr Montagn√©, avec les travaux de pasteur bangui et du Dr Lesbordes en 1982 - apr√®s inauguration d'une salle au nom du Dr Georges dcd il a 1 an - puis conf√©rence par mme Barre aux √©tudiants et profs de la FACSS.\n\nSAMEDI √† 10h messe √† Damara, puis repas familial, et retous dans l'apr√®s-midi.\n\nBisous √† tous les mandaba\n\nmaman\n\nmaryvone masseron - 41 rue du puits-mauger  35000  rennes  0299302000  0680078113"
}