{
  "year": 2012,
  "seq": 6,
  "meta": {
    "date": "2012-01-08",
    "from": "maryvonne.masseron@free.fr",
    "to": "y mandaba <y.mandaba@gmail.com>",
    "subject": "les impots, je vais joindre les documents si je peux, maintenant ou apr√®s"
  },
  "proposals": [
    {
      "index": -6,
      "etiquette": "Dossier de bourse Tristan",
      "category": "MIN",
      "duration": "LT",
      "source": "AI",
      "score": 1,
      "matched_from": [
        "ai_new"
      ]
    },
    {
      "index": -6,
      "etiquette": "Imp√¥ts / fiscalit√©",
      "category": "MIN",
      "duration": "LT",
      "source": "AI",
      "score": 1,
      "matched_from": [
        "ai_new"
      ]
    },
    {
      "index": -6,
      "etiquette": "Appartement Pergol√®se (vente/location)",
      "category": "MIN",
      "duration": "LT",
      "source": "AI",
      "score": 1,
      "matched_from": [
        "ai_new"
      ]
    }
  ],
  "raw_excerpt": "üóï Date : 2012-01-08\nüë§ From : maryvonne.masseron@free.fr\nüì® To   : y mandaba <y.mandaba@gmail.com>\nüßï Subject : les impots, je vais joindre les documents si je peux, maintenant ou apr√®s\n---\nyann,\nje vois que la d√©claration des impots est une chose difficile pour toi!\n\nl'an dernier, pour 2009,  tu l'avais commenc√©e sur internet, sans la terminer,\ndu coup tu en as r√©dig√©e une 2eme sur papier,\net sur 2010 pareil, sauf que tu as fait des erreurs;\nils ont tenu compte de ce qui les int√©resse;\n\ntu n'as pas report√© la mention pension alimentaire deux fois comme je te l'avais recommand√©,\nj'ai voulu voir....\n\ntu l'as mise dans la case qui faut,\nmais √† la fin, il fallait reporter √† la main que tu as re√ßu cette pension alimentaire de ta m√®re: madame mandaba maryvonne,\ncar eux pour authentifier la source de cet argent, ils doivent contacter le centre des impots de la personne qui a donn√© cette pension alimentaire, pour √™tre s√ªrs que ce n'est pas de l'argent frauduleux; et si tu ne dis pas la personne qui a donn√© la pension, ils ne peuvent pas scanner les d√©clarations de la france enti√®re....\n\nTU ES TROP FIER\n\net j'en ai marre\n\nj'ai pay√© ton impots sur 2009 , acceptable = 500 euros\n\nje ne paierai pas sur 2010; TU DOIS ECRIRE A L'INSPECTEUR DES IMPOTS QUI T'A FAIT LE COURRIER\nsinon ils vont penser que tu as de l'argent √† gogo, ce que tu crois d'ailleurs.\n\nEcris pour expliquer que tu ne pouvais te connecter, que tu n'avais pas compris qu'il fallait porter le revenu fiscal de r√©f√©rence pour acc√©der √† ton compte,....que les jours ont pass√©...moi je t'avais promis d'√©crire, mais l√† je ne peux pas, car cela doit te servir de le√ßon....( tu n'as pas √©cout√© qu'il faut sp√©cifier qui te donne la pension+++++++++++). Et r√©expliquer qui te donne la pension, et qu'elle ne peut t'aider √† payer cet impot- et tu demandes un √©chelonnement en trois fois pour payer.\n\nCet impot est juste, car tu as un bien en France, que tu as acquis par un don des parts de Pergol√®se que je t'ai fait. Et tu per√ßois 1/3 des loyers dont je me sers pour rembourser le cr√©dit.\n\nTu re√ßois aussi de l'argent de Clerville, dont Marc se sert pour se rembourser de ce que tu lui dois.\n\nSi tu ne te mets pas en r√®gle, ce qui va arriver un jour ou l'autre, c'est que tu seras oblig√© de vendre ta part de Pergol√®se, au besoin aux ench√®res, par les Services des Impots, et nous ne serons plus chez nous.\n\nMAMAN"
}