{
  "year": 2012,
  "seq": 17,
  "meta": {
    "date": "2012-06-06",
    "from": "maryvonne masseron-mandaba <maryvonnemm@hotmail.com>",
    "to": "Marc MANDABA <marcmandaba@hotmail.com>,cÃ©cile letocart <cecile.letocart@gmail.com>, <y.mandaba@gmail.com>",
    "subject": "FW: MASSERON MANDABA/MARYVONNE MRS 11JUN ORY TUN"
  },
  "proposals": [],
  "raw_excerpt": "ðŸ—• Date : 2012-06-06\nðŸ‘¤ From : maryvonne masseron-mandaba <maryvonnemm@hotmail.com>\nðŸ“¨ To   : Marc MANDABA <marcmandaba@hotmail.com>,cÃ©cile letocart <cecile.letocart@gmail.com>, <y.mandaba@gmail.com>\nðŸ§• Subject : FW: MASSERON MANDABA/MARYVONNE MRS 11JUN ORY TUN\n---\nbonjour,dsole pour les problmes de connection hier  Vitr,j'espre que cela conviendra,bonne journe  tous,bisous Subject: MASSERON MANDABA/MARYVONNE MRS 11JUN ORY TUN\nFrom: eticket@amadeus.com\nTo: MARYVONNEMM@HOTMAIL.COM\nDate: Wed, 6 Jun 2012 14:49:51 +0000\n\nMASSERON MANDABA/MARYVONNE MRS 11JUN ORY TUN------------------------------------------------------------------------------\n\nThis document is automatically generated.\nPlease do not respond to this mail.\n\n                            ELECTRONIC TICKET\n                       PASSENGER ITINERARY RECEIPT\n\n TUNISAIR AGENCE INTERNET           DATE: 06 JUN 2012\n TUNISAIR SIEGE                    AGENT: 0001\n CHARGUIA 2 2035 TUNIS CART         NAME: MASSERON MANDABA/MARYVONNE MRS\n TUNIS\n IATA     : 874 90896\n TELEPHONE: 216 71 941 285\n\n ISSUING AIRLINE                        : TUNISAIR\n TICKET NUMBER                          : ETKT 199 2402334764\n FORM OF IDENTIFICATION                 : PASSPORT 05FP86964\n BOOKING REF : AMADEUS: ZQ5HJT, AIRLINE: TU/ZQ5HJT\n\n FROM /TO        FLIGHT  CL DATE   DEP      FARE BASIS    NVB   NVA   BAG  ST\n\n PARIS ORLY      TU 719  N  11JUN  1440     NPR15         11JUN 11JUN 20K  OK\n TERMINAL:S\n TUNIS              SEAT: 15F     ARRIVAL TIME: 1605\n TERMINAL:M\n\n TUNIS           TU 720  A  19JUN  1315     ASX15D        19JUN 19JUN 20K  OK\n TERMINAL:M\n PARIS ORLY         SEAT: 21F     ARRIVAL TIME: 1635\n TERMINAL:S\n\n\n AT CHECK-IN, PLEASE SHOW A PICTURE IDENTIFICATION AND THE DOCUMENT YOU GAVE\n FOR REFERENCE AT RESERVATION TIME\n\n BAGGAGE POLICY - FOR TRAVEL TO/FROM, WITHIN THE US, PLEASE\n REFER TO THE WEBSITES OF THE AIRLINES IN YOUR ELECTRONIC\n TICKET PASSENGER ITINERARY RECEIPT. FOR MORE INFORMATION VISIT:\n HTTPS://BAGS.AMADEUS.COM?R=ZQ5HJT&N=MASSERON%20MANDABA\n\n ENDORSEMENTS  : NONREF/NOCHG/TU ONLY\n TOUR CODE     : CC000129\n\n\n FARE CALCULATION   :PAR TU TUN98.22TU PAR42.84NUC141.06END ROE0.758475XT\n                     24.47QX4.00IZ7.62FR12.75FR9.00RL1.60RK\n\n AIR FARE           : EUR     107.00\n TAX                : EUR     70.00YQ       3.00YR        59.44XT\n TOTAL              : EUR     239.44\n\n\nNOTICE\nCARRIAGE AND OTHER SERVICES PROVIDED BY THE CARRIER ARE SUBJECT TO CONDITIONS\nOF CARRIAGE, WHICH ARE HEREBY INCORPORATED BY REFERENCE. THESE CONDITIONS MAY\nBE OBTAINED FROM THE ISSUING CARRIER.\n\nTHE ITINERARY/RECEIPT CONSTITUTES THE PASSENGER TICKET FOR THE PURPOSES OF\nARTICLE 3 OF THE WARSAW CONVENTION, EXCEPT WHERE THE CARRIER DELIVERS TO THE\nPASSENGER ANOTHER DOCUMENT COMPLYING WITH THE REQUIREMENTS OF ARTICLE 3.\n\nNOTICE\nIF THE PASSENGER'S JOURNEY INVOLVES AN ULTIMATE DESTINATION OR STOP IN A\nCOUNTRY OTHER THAN THE COUNTRY OF DEPARTURE THE WARSAW CONVENTION MAY BE\nAPPLICABLE AND THE CONVENTION GOVERNS AND IN MOST CASES LIMITS THE LIABILITY\nOF CARRIERS FOR DEATH OR PERSONAL INJURY AND IN RESPECT OF LOSS OF OR DAMAGE\n TO BAGGAGE. SEE ALSO NOTICES HEADED ADVICE TO INTERNATIONAL PASSENGERS ON\nLIMITATION OF LIABILITY AND ''NOTICE OF BAGGAGE LIABILITY LIMITATIONS''."
}