{
  "year": 2012,
  "seq": 35,
  "meta": {
    "date": "2012-11-03",
    "from": "maryvonne masseron-mandaba <maryvonnemm@hotmail.com>",
    "to": "\"y.mandaba@gmail.com\" <y.mandaba@gmail.com>, marc mandaba",
    "subject": "---"
  },
  "proposals": [],
  "raw_excerpt": "ðŸ—• Date : 2012-11-03\nðŸ‘¤ From : maryvonne masseron-mandaba <maryvonnemm@hotmail.com>\nðŸ“¨ To   : \"y.mandaba@gmail.com\" <y.mandaba@gmail.com>, marc mandaba\n\t<marcmandaba@hotmail.com>\nðŸ§• Subject : \n---\nbonsoir,\nje suis contente de vous savoir ensemble,que Marc voie la socit de Yannick.LES difficults, et les succs.\nBien rentre de Bangui,frres et soeurs fchs que je soie partie  Bangui, et laiss maman,alors que de loin j'ai bien gr son AVC avec les dames: hydratation, massages, mobilisation, stimulation...alors que le mdecin tardait  venir...Elle n'a pas rcupr du tout la mmoire, mais la parole c'est bien, l'quillibre fragile, elle ne marche plus du tout.\nYangu m'a racont encore un sale plan de Alain avec sa soit-disant hpatite,il a tap tout le monde pour se faire vacuer au Cameroun, s'est sauv quand on a voulu lui faire la biopsie du foie,s'est fait payer un 2eme voyage, a eu la biopsie ( normale, gastro amie de Yangu ),s'est fait faire de fausses ordonances pour de l'interfron, que personne ne fait  Bangui, et qui cote trs cher.Il est guri sans aucun traitement, il ne boit plus de bire.\nIl a adopt la fille de Herv, cad qu'il a vid son petit compte d'enfant mineur.Maintenant qu'elle a 18 ans, elle vient me demander la part de son pre,je l'ai amene chez mme gotilogu, a qui elle a montr son \"faux\" acte de naissance.\nComme d'habne le prenez jamais en piti, il est florissant, pas malade du tout.Sa femme est trop bien ....\nPas pris de photostrop soucieuseTout le monde vous salueet espre votre venue\n\nmaman"
}