{
  "year": 2012,
  "seq": 8,
  "meta": {
    "date": "2012-10-23",
    "from": "maryvonne.masseron@free.fr",
    "to": "Yannick Mandaba <y.mandaba@gmail.com>, marcmandaba@hotmail.com",
    "subject": "bangui le 22 octobre 2012"
  },
  "proposals": [],
  "raw_excerpt": "ğŸ—• Date : 2012-10-23\nğŸ‘¤ From : maryvonne.masseron@free.fr\nğŸ“¨ To   : Yannick Mandaba <y.mandaba@gmail.com>, marcmandaba@hotmail.com\nğŸ§• Subject : bangui le 22 octobre 2012\n---\nchers yannick et marc\n\nles connexions sont difficiles,\nma boite hotmail est trop lourde !\naussi je prends free bien que ce une adresse uniquement professionnelle.\n\nLa messe hier Ã©tait trÃ¨s belle, le prÃªtre le pÃ¨re Francis Sinclair ZIKI nous connait bien maintenant. Il y avait beaucoup de monde, beaucoup d'amis de papa, et nos anciens collaborateurs de la Facss, de l'hopital, de l'OCSS.\n\nLes plus proches sont montÃ©s Ã  la colline, aprÃ¨s la cÃ©rÃ©monie, pour des rafraichissements.\n\nBeaucoup de personnes vous saluent particuliÃ¨rement : Tante Awa, les Nali, Seregaza, Jeanne Lacotte, les GotiloguÃ©, mr giuliani, les Mokofio, Fidele Macpayen ( vous enverra un mail ), mr Guimet, Olona , Kouma, mr Pendeoro ex DG de la BEAC Ã  la retraite, Yvon Kamach ( je vais aller ce jour me recueillir devant le mausolÃ©e de son papa, et il me fera parvenir un DVD des cÃ©rÃ©monies ).\n\nmesse Ã  Damara ce samedi Ã  10h\n\nJe pense bien Ã  vous\n\nmaman\n\nmaryvone masseron - 41 rue du puits-mauger  35000  rennes  0299302000  0680078113"
}