{
  "year": 2012,
  "seq": 7,
  "meta": {
    "date": "2012-01-09",
    "from": "maryvonne.masseron@free.fr",
    "to": "Yannick Mandaba <y.mandaba@gmail.com>",
    "subject": "RE: les impots, je vais joindre les documents si je peux, maintenant ou apr√®s"
  },
  "proposals": [
    {
      "index": -7,
      "etiquette": "Dossier de bourse Tristan",
      "category": "MIN",
      "duration": "LT",
      "source": "AI",
      "score": 1,
      "matched_from": [
        "ai_new"
      ]
    },
    {
      "index": -7,
      "etiquette": "Imp√¥ts / fiscalit√©",
      "category": "MIN",
      "duration": "LT",
      "source": "AI",
      "score": 1,
      "matched_from": [
        "ai_new"
      ]
    },
    {
      "index": -7,
      "etiquette": "Appartement Pergol√®se (vente/location)",
      "category": "MIN",
      "duration": "LT",
      "source": "AI",
      "score": 1,
      "matched_from": [
        "ai_new"
      ]
    }
  ],
  "raw_excerpt": "üóï Date : 2012-01-09\nüë§ From : maryvonne.masseron@free.fr\nüì® To   : Yannick Mandaba <y.mandaba@gmail.com>\nüßï Subject : RE: les impots, je vais joindre les documents si je peux, maintenant ou apr√®s\n---\nje t'ai dit sur un mail de hotmail, et sur tes 2 boites que les documents sont √† ta disposition sur notre boite gmail=======mymmandaba@gmail.com\net de ne pas modofier cette boite=======si tu ne sais plus le mot de passe je te le donnerai de vive voix ou sur sms\n\nmaman \n----- Mail d'origine -----\nDe: Yannick Mandaba \n√Ä: maryvonne masseron \nEnvoy√©: Mon, 09 Jan 2012 11:25:09 +0100 (CET)\nObjet: RE: les impots, je vais joindre les documents si je peux, maintenant ou apr√®s\n\nBonjour MAman,\n\nBien compris.\nPuis-je avoir le nom de l'inpecteur et l'adresse ainsi que le num√©ro de dossier ou r√©f√©rence pour ce cas, s'il y a...voire le courrier lui-m√™me si tu peux scanner?\nTu mentionne ce courrier et tu me demande d'y r√©pondre mais je n'ai pas le courrier en question.\n\nJe suis rentr√© hier de Pattaya. JE suis rest√© chez un ami et fait de la p√™che et nag√© un peu, pris le soleil, retrouv√© une couleur normale...\n\nBisous\n\n-----Original Message-----\nFrom: maryvonne.masseron@free.fr [mailto:maryvonne.masseron@free.fr] \nSent: Sunday, January 08, 2012 9:09 PM\nTo: y mandaba\nCc: ymanda@gmail.com\nSubject: les impots, je vais joindre les documents si je peux, maintenant ou apr√®s\n\nyann,\nje vois que la d√©claration des impots est une chose difficile pour toi!\n\nl'an dernier, pour 2009,  tu l'avais commenc√©e sur internet, sans la terminer,\ndu coup tu en as r√©dig√©e une 2eme sur papier,\net sur 2010 pareil, sauf que tu as fait des erreurs;\nils ont tenu compte de ce qui les int√©resse;\n\ntu n'as pas report√© la mention pension alimentaire deux fois comme je te l'avais recommand√©,\nj'ai voulu voir....\n\ntu l'as mise dans la case qui faut,\nmais √† la fin, il fallait reporter √† la main que tu as re√ßu cette pension alimentaire de ta m√®re: madame mandaba maryvonne,\ncar eux pour authentifier la source de cet argent, ils doivent contacter le centre des impots de la personne qui a donn√© cette pension alimentaire, pour √™tre s√ªrs que ce n'est pas de l'argent frauduleux; et si tu ne dis pas la personne qui a donn√© la pension, ils ne peuvent pas scanner les d√©clarations de la france enti√®re....\n\nTU ES TROP FIER\n\net j'en ai marre\n\nj'ai pay√© ton impots sur 2009 , acceptable = 500 euros\n\nje ne paierai pas sur 2010; TU DOIS ECRIRE A L'INSPECTEUR DES IMPOTS QUI T'A FAIT LE COURRIER\nsinon ils vont penser que tu as de l'argent √† gogo, ce que tu crois d'ailleurs.\n\nEcris pour expliquer que tu ne pouvais te connecter, que tu n'avais pas compris qu'il fallait porter le revenu fiscal de r√©f√©rence pour acc√©der √† ton compte,....que les jours ont pass√©...moi je t'avais promis d'√©crire, mais l√† je ne peux pas, car cela doit te servir de le√ßon....( tu n'as pas √©cout√© qu'il faut sp√©cifier qui te donne la pension+++++++++++). Et r√©expliquer qui te donne la pension, et qu'elle ne peut t'aider √† payer cet impot- et tu demandes un √©chelonnement en trois fois pour payer.\n\nCet impot est juste, car tu as un bien en France, que tu as acquis par un don des parts de Pergol√®se que je t'ai fait. Et tu per√ßois 1/3 des loyers dont je me sers pour rembourser le cr√©dit.\n\nTu re√ßois aussi de l'argent de Clerville, dont Marc se sert pour se rembourser de ce que tu lui dois.\n\nSi tu ne te mets pas en r√®gle, ce qui va arriver un jour ou l'autre, c'est que tu seras oblig√© de vendre ta part de Pergol√®se, au besoin aux ench√®res, par les Services des Impots, et nous ne serons plus chez nous.\n\nMAMAN"
}