{
  "year": 2012,
  "seq": 4,
  "meta": {
    "date": "2012-09-19",
    "from": "MYM MANDABA SCI <mymmandaba@gmail.com>",
    "to": "charbel Braidy <charbel.braidy@hotmail.fr>",
    "subject": "location rue Pergolese"
  },
  "proposals": [],
  "raw_excerpt": "ðŸ—• Date : 2012-09-19\nðŸ‘¤ From : MYM MANDABA SCI <mymmandaba@gmail.com>\nðŸ“¨ To   : charbel Braidy <charbel.braidy@hotmail.fr>\nðŸ§• Subject : location rue Pergolese\n---\ncher Monsieur,\n\nmerci de bien vouloir rgulariser vos paiements de loyer; sauf erreur de ma\npart, vous avez toujours du retard; de plus la fin du mois de septembre\napproche...\n\nNous avons des chances bancaires  honorer\n\nS'il s'agit d'un oubli, veuillez rgulariser, s'il s'agit de difficults\nd'un autre ordre, merci de me le faire savoir, afin que je puisse\nm'organiser pour approvisionner le compte , et pour les impts fonciers, et\npour le crdit, et pour les appels de charge de la coproprit.\n\nmerci de bien vouloir m'informer de vos intentions.\n\nmaryvonne mandaba,\ngrante de la SCI"
}