{
  "year": 2014,
  "seq": 11,
  "meta": {
    "date": "2014-02-09",
    "from": "maryvonne.masseron@free.fr",
    "to": "Yannick Mandaba <y.mandaba@gmail.com>",
    "subject": "Tristan"
  },
  "proposals": [],
  "raw_excerpt": "ğŸ—• Date : 2014-02-09\nğŸ‘¤ From : maryvonne.masseron@free.fr\nğŸ“¨ To   : Yannick Mandaba <y.mandaba@gmail.com>\nğŸ§• Subject : Tristan\n---\ntu m'as pris au dÃ©pourvu,\net tu m'as forcÃ© la main.\nSi Bee te met la pression ainsi, oubliez moi!!!!!\n\nJe n'ai pas encore donnÃ© Ã  Marc l'Ã©quivalent des 13 000 euros dont je t'ai fait donation il y a 3 ans, et ce n'est pas juste.\nJe te donne chaque annÃ©e de 6000 Ã  10000 euros, pour renflouer tes caisse. Et Marc n'a pas l'Ã©quivalent !\n\nEst-ce que tu as dit cela Ã  Bee.\n\nPour l'instant, si elle te force Ã  me demander quelquechose, en faisant du chantage avec le bÃ©bÃ©, moi je ne suis pas d'accord, et elle peut le garder pour elle seule. AprÃ¨s tout, je vais m'habituer Ã  vivre aussi sans LÃ©a et Maxime, et je me prÃ©pare Ã  partir en afrique, oÃ¹ les gans sont normaux, dans leurs relations familiales. \n\nAutrement dit \"ne me forcez Ã  rien, sinon je vais m'Ã©nnerver \".\n\n\nmaryvone masseron - 41 rue du puits-mauger  35000  rennes  0299302000  0680078113"
}