{
  "year": 2014,
  "seq": 27,
  "meta": {
    "date": "2014-05-06",
    "from": "maryvonne masseron-mandaba <maryvonnemm@hotmail.com>",
    "to": "\"y.mandaba@gmail.com\" <y.mandaba@gmail.com>",
    "subject": "RE: voici les adresses que j'ai - merci montrer invitations"
  },
  "proposals": [],
  "raw_excerpt": "ðŸ—• Date : 2014-05-06\nðŸ‘¤ From : maryvonne masseron-mandaba <maryvonnemm@hotmail.com>\nðŸ“¨ To   : \"y.mandaba@gmail.com\" <y.mandaba@gmail.com>\nðŸ§• Subject : RE: voici les adresses que j'ai - merci montrer invitations\n---\nDate: Tue, 6 May 2014 22:49:54 +0700\nSubject: Re: voici les adresses que j'ai - merci montrer invitations\nFrom: y.mandaba@gmail.com\nTo: maryvonnemm@hotmail.com\n\nLe passeport de Tristan est fait le 19.\n\nIl est sur mon NUMIC.\nOn fait le passeport tha a prend 5 jours.\nNe pas ajouter d'activits. Dj le 9 c'est assez loign du 7...\n\nOn va juste Tristan Bee Sophie Maman Yannick\nBise.\nYannick Mandaba\n\ntel : +66 878200622\n\nskype : Yannick.mandaba\nOn 4 May 2014 14:42, \"maryvonne masseron-mandaba\"  wrote:\n\n\n\n\njparmelle@yahoo.frhma.pommerolle@free.friemanja2@yahoo.com\ngilbertmasseron@gmail.com\n\ncelinepeigne@hotmail.co.uk\nludovic.peigne@orange.frlaurencemasseron@hotmail.com\nnathfertiti@yahoo.frs.pommerolle@yahoo.fr"
}