{
  "year": 2014,
  "seq": 14,
  "meta": {
    "date": "2014-04-12",
    "from": "maryvonne.masseron@free.fr",
    "to": "Yannick Mandaba <y.mandaba@gmail.com>",
    "subject": "bapteme tristan"
  },
  "proposals": [],
  "raw_excerpt": "ğŸ—• Date : 2014-04-12\nğŸ‘¤ From : maryvonne.masseron@free.fr\nğŸ“¨ To   : Yannick Mandaba <y.mandaba@gmail.com>\nğŸ§• Subject : bapteme tristan\n---\nURGENT,+++\n\nappeler le presbytÃ¨re Saint-Martin Ã  VITRE\n36, rue de Paris\n35500 VITRE\ntel 02 99 75 02 78\nfax 02 99 75 03 89\n\npour joindre le PÃ¨re CurÃ©\net dire oÃ¹ vous en Ãªtes pour la prÃ©paration du BaptÃªme et dire Ã  quelle paroisse de bangkok vous la faites,\n\nils ont un mail, mais je pensais te l'avoir donnÃ©,\net je ne le retrouve pas; il faut le leur demander.\nSi tu envoies un mail, fais attention Ã  la photo du profil, il y en a des moches !!!\n\nils n'ont pas l'air contents\ncar ils doivent prÃ©parer la cÃ©rÃ©monie avec les autres familles,\nil y aura 5 baptÃªmes le 7 juin Ã  18 heures\n\n\nmaman\n\nmaryvonne masseron - 41 rue du puits-mauger  35000  rennes  0299302000  0680078113"
}