{
  "year": 2014,
  "seq": 4,
  "meta": {
    "date": "2014-01-08",
    "from": "maryvonne.masseron@free.fr",
    "to": "Yannick Mandaba <y.mandaba@gmail.com>",
    "subject": "ReÂ : Fin d'annÃ©e pÃ©riode difficile"
  },
  "proposals": [],
  "raw_excerpt": "ğŸ—• Date : 2014-01-08\nğŸ‘¤ From : maryvonne.masseron@free.fr\nğŸ“¨ To   : Yannick Mandaba <y.mandaba@gmail.com>\nğŸ§• Subject : ReÂ : Fin d'annÃ©e pÃ©riode difficile\n---\nOui. Ton chq de 800 de mamie est pose.\nJe te vire 1500 des que possible.\nLe smarthone n est pas top pour moi.\nJe pars a vitre de suite.\nMaman\n\nJ ai besoin de l acte de naissance de tristan pour lui ouvrir un comptr epargne\n\nmaryvone masseron - 41 rue du puits-mauger 35000 rennes 0299302000 0680078113\n\n----- Mail d'origine -----\nDe: Yannick Mandaba \nÃ€: Y Mum \nEnvoyÃ©: Wed, 08 Jan 2014 07:22:42 +0100 (CET)\nObjet: Fin d'annÃ©e pÃ©riode difficile\n\nSinon comme tous les ans Ã  la pÃ©riode de NoÃ«l nous sommes un petit peu\njuste puisque les travailleurs ont beaucoup de vacances et que les clients\nmÃªme en vacances ne passe pas beaucoup de commandes.\nLe petit cadeau de mamie sera donc le bienvenu en ce moment et si tu\npouvais lui ajouter un peu de sous ce serait bien aussi.\n\nEnsemble nous sommes en cours de un peu plus de 2500 euros. Ce sera encore\nun peu juste mais je pense pouvoir me dÃ©brouiller avec les commandes en\ncours pour boucler notre budget d'ici notre dÃ©part\n\nPour ton information nous arrÃªtons ce mois-ci la location de cet immeuble\nles partons nous installer dans le petit atelier qui ne coÃ»tera le quart de\nce loyer.\n\n250 euros au lieu de 1000 euros. Le contrat prends fin en fÃ©vrier.\n\nLe but c'est donc de limiter la dÃ©pense le temps de commencer la vente de\nnos propres produits\n\nAccount Name: Mr. Yannick, Yves, Sala-kosso Mandaba\nAccount NÂ°: 118-5-127121\nBank/Branch: Bangkok Bank PCL, Head\nOffice\nBank Address: 333, Silom Road, Bangkok 10500, Thailand\nSWIFT Code (BIC): BKKBTHBK\nIBAN Code: BKKBTHBK1185127121\n\nYannick Mandaba\ntel : +66 878200622\nskype : Yannick.mandaba"
}