{
  "year": 2014,
  "seq": 18,
  "meta": {
    "date": "2014-12-14",
    "from": "maryvonne.masseron@free.fr",
    "to": "\"accueil.35142@notaires.fr\" <accueil.35142@notaires.fr>",
    "subject": "141214_J.B._luxation auriculaire main droite par le kinÃ© ce samedi 13dÃ©cembre 2014"
  },
  "proposals": [],
  "raw_excerpt": "ğŸ—• Date : 2014-12-14\nğŸ‘¤ From : maryvonne.masseron@free.fr\nğŸ“¨ To   : \"accueil.35142@notaires.fr\" <accueil.35142@notaires.fr>\nğŸ§• Subject : 141214_J.B._luxation auriculaire main droite par le kinÃ© ce samedi 13dÃ©cembre 2014\n---\nMaÃ®tre,\n\nje suis obligÃ©e d'aller Ã  VitrÃ©, en urgence, ce dimanche midi ( non prÃ©vu ),\ncar ma tante a eu, pendant sa sÃ©ance de marche avec le kinÃ©sithÃ©rapeute, hier samedi 13 dÃ©cembre,\nune luxation de l'annulaire, de sa main droite, qui reste sans soin jusqu'Ã  prÃ©sent.\n\nDans ces cas, la bonne pratique mÃ©dicale nÃ©cessite \n- consultation par un chirurgien orthopÃ©diste, \n- une radiographie, \n- la pose d'une atelle dorsale du doigt, garante d'une bonne rÃ©cupÃ©ration, sans rÃ©traction vicieuse.\n\nLe kinÃ©sithÃ©rapeute, gilbert masseron, a juste donnÃ© un doliprane et mis un bandage. Il a Ã©crit revenir le mardi, pour changer le bandage. C'est l'aide-soignante qui m'a prÃ©venue ce matin. Si joint l'enregistrement de son appel.\n\nJe suis bouleversÃ©e par cet incident, car ma tante est droitiÃ¨re, et doit conserver sa signature encore quelques mois.\n\nLe mÃ©decin, docteur Percheron a fait son expertise le jeudi 11 dÃ©cembre vers 11h30, au domicile de ma tante. Jusqu'au jugement de tutelle, il nous faut bien encore 3 Ã  4 mois !\n\nMÃªme si la luxation phalangiÃ¨re est accidentelle, il y a quand mÃªme une nÃ©gligence dans la conduite du bilan et du traitement...\n\nDÃ©solÃ©e de vous prendre Ã  tÃ©moin, mais je n'en puis plus.\n\nCordialement.\n\nmaryvone masseron - 41 rue du puits-mauger  35000  rennes  0299302000  0680078113"
}