{
  "year": 2014,
  "seq": 34,
  "meta": {
    "date": "2014-05-16",
    "from": "maryvonne masseron-mandaba <maryvonnemm@hotmail.com>",
    "to": "\"y.mandaba@gmail.com\" <y.mandaba@gmail.com>",
    "subject": "aidant de personnes Ã¢gÃ©es dÃ©pendantes"
  },
  "proposals": [
    {
      "index": -34,
      "etiquette": "Visa / immigration",
      "category": "MIN",
      "duration": "LT",
      "source": "AI",
      "score": 1,
      "matched_from": [
        "ai_new"
      ]
    }
  ],
  "raw_excerpt": "ğŸ—• Date : 2014-05-16\nğŸ‘¤ From : maryvonne masseron-mandaba <maryvonnemm@hotmail.com>\nğŸ“¨ To   : \"y.mandaba@gmail.com\" <y.mandaba@gmail.com>\nğŸ§• Subject : aidant de personnes Ã¢gÃ©es dÃ©pendantes\n---\npersonne ne peut me comprendre,car chacun est dans son gosme,il est trs difficile d'aider une personne ge en fin de vie,encore plus d'en aider deux;je suis au bout du rouleau;je n'ai plus une minute  moi,la nuit que j'ai d passer  faire vos billets m'a acheve,en plus j'tais consciente de mal faire, quant-aus dates;car je voulais parler avec vous du programme du sjour,et 4 dimanches d'affile vous tiez absents;\nc'est quasi impossible de payer des billets sur internet pour d'autres personnes que soi-mme!\nj'ai d changer de boite e-mail 4 fois car j'ai dj rserv  mon nom sur plein de sites,j'ai d changer de compagnie 6 foisj'ai d essayer mes 3 cartes de paiementcela fait presque 100 combinaisons ( j'ai fait cela toute la nuit ) et t au travail au petit matin...\ndangereusementje ne sais pas si beaucoup de personnes feraient celaet mes efforts ne sont pas compriscar je n'arrive plus  rester de bonne humeur\net je crois que vous n'avez pas t francs avec moi pour le projet des vacances en francevous voulez faire des choses sans moi\nvous vous foutez bien de ce qui me faire plaisir;c'tait tre ensemble  l'anniversaire de La;tu n'as rien compris, pourtant je te l'avais dit;tu pouvais parler  marc;et ne pas me dire aprs coup que les petits ne seront pas  istanbul\nalors que j'ai pass du temps aussi  chercher des billets  prix acceptables pour que vous puissiez passer par istanbul\nvous tes capricieuxet cela ne me fait plus riretante jeannette va trs bientt mourir;et je souhaite seulement que ce soit aprs l'anniversaire de mamieje suis dans l'inquitude, \net on m'envoie laurence pour me \"sermoner\"\nje ne suis pas n'importe qui;je peux utiliser des relations pour avoir un visa n'importe quand;il est impossible que wadee n'aie pas son visa, il s'agit d'une visite familiale,elle te gche la vie avec une connerie; et toi tu te laisses avoir, ce n'est qu'un dbut; fais attention;nos relations risquent de devenir trs mauvaises, car moi je ne me suis jamais laiss abattre par des conneries;\nlaurence est pouvantable, comme son pre, elle m'a mise trs mal, je ne suis pas prte  l'oublier;c'tait comme si wadee lui avait dit que je ne voulais pas faire les papiers, or wadee voulait \"juste\" avoir son billet;et elle a fait du thatre auprs de laurence;\nil y a trois ans laurence a fait un plan pas possible pour que je lui donne une k7 des obsques de ton papa, pour faire du voyeurisme avec son copain journaliste , et son pre, qui utilise toutes les faiblesses des gens pour les faire ployer;\nenvoie-moi un peu de web cam dimanche, car vous cachez bien tristan, vous n'avez jamais de temps pour moi, et vous ne me \"parlez\" jamais, juste vous demandez des choses...nous n'changeons pas ;vous avez des ides prconues,  votre chelle, me concernant, srement loin de la ralit;maman\n( traduire  wadee intgralement, sans adoucir, ni commentaires)(avez-vous reu le courrier, faut-il refaire l'original de l'attestation d'hbergement,???)(merci d'crire des mail, je ne parle plus sur skype, car c'est facile aprs de dire qu'on n'a pas dit d'envoyer le courrier par chronopost mais par collisssimo)"
}