{
  "year": 2014,
  "seq": 20,
  "meta": {
    "date": "2014-02-20",
    "from": "maryvonne masseron-mandaba <maryvonnemm@hotmail.com>",
    "to": "\"y.mandaba@gmail.com\" <y.mandaba@gmail.com>",
    "subject": "bangkok"
  },
  "proposals": [],
  "raw_excerpt": "ðŸ—• Date : 2014-02-20\nðŸ‘¤ From : maryvonne masseron-mandaba <maryvonnemm@hotmail.com>\nðŸ“¨ To   : \"y.mandaba@gmail.com\" <y.mandaba@gmail.com>\nðŸ§• Subject : bangkok\n---\nbonjour Yannick,si tu me dis que je pourrai passer une journe, avec mes enfants et petits-enfants runis, je prends l'avion. Sinon, je reste  Rennes. De toute faon, j'avais prvu mes vacances annuelles du 13 au 23 fvrier, pour tre avec La et Maxime. Si personne ne veut de moi, je vais en profiter pour me faire hospitaliser pour mes bilans. Puisque je ne bnficie pas d'arrts-maladie rmunrs.Une photo de Tristan s'il te plait.Il faut une prparation au baptme  l'glise catholique, je te scanne le document pour cela ds que je me sens mieux.Les dates possible, maintenant ne sont plus que le 7 juin, le le 21 et le 22 juin (5 baptmes  chaque fois )maman"
}