{
  "year": 2014,
  "seq": 9,
  "meta": {
    "date": "2014-01-28",
    "from": "maryvonne.masseron@free.fr",
    "to": "Yannick Mandaba <y.mandaba@gmail.com>",
    "subject": "ReÂ : Re: Tristan - 100 ans de mamie - anniversaire yannick -"
  },
  "proposals": [
    {
      "index": -9,
      "etiquette": "ImpÃ´ts / fiscalitÃ©",
      "category": "MIN",
      "duration": "LT",
      "source": "AI",
      "score": 1,
      "matched_from": [
        "ai_new"
      ]
    }
  ],
  "raw_excerpt": "ğŸ—• Date : 2014-01-28\nğŸ‘¤ From : maryvonne.masseron@free.fr\nğŸ“¨ To   : Yannick Mandaba <y.mandaba@gmail.com>\nğŸ§• Subject : ReÂ : Re: Tristan - 100 ans de mamie - anniversaire yannick -\n---\nOK,\npas encore virÃ©, car il fallait attendre le calcul des impots,\nreÃ§u hier ,\n\ndonc tu as juste de quoi payer les impots 1140,\naprÃ¨s il restera 730 des 800 de mamie, plus les frais bancaires.\n \nc'est mieux de les garder ici pour \n  1) pour juin et \n  2) payer la CFE sans faire de transfert d'argent qui coute cher +++( CFE c'est le mieux, car mÃªme si cher, couverture complÃ¨te, et avec aucun pb pour le sÃ©jour en france, avantage, avec une dÃ©claration de concubinage au consulat pour BEE, tu paieras le mm prix pour la famille, tristan et bee inclus, et elle pourra participer ? ); en plus il est souhaitable que tu cotises Ã  la CFE Ã  l'assurance vieillesse pour avoir un petit peu de retraite plus tard.... et mÃªme si tu n'as pas cotisÃ© beaucoup, tu auras droit au \"minimum vieillesse, 400 euros au minimum, chaque mois, toute ta viellesse, ce n'est pas nÃ©gligeable, par contre il faudra justifier d'un domicile en France, aussi quoiqu'il m'arrive ne vends pas un appartement dont tu pourrais hÃ©riter mÃªme si pÃ©nible Ã  entretenir... ). En plus, si elle veut BEE peut profiter pour faire sa demande de nationalitÃ© franÃ§aise, en tant que maman d'un bÃ©bÃ© franÃ§ais.\n\nDonc si tu veux une autonomie en juin, il faut garder cet argent, cela file trÃ¨s vite ici; et par rapport Ã  Marc, qui finalement sera lÃ , je veux que tu fasses preuve d'autonomie financiÃ¨re.\n \n\nJe te vire donc, de mon compte, 1000 euros, et dÃ¨s que j'ai des papiers d'identitÃ© de Tristan, copie certifiÃ©e conforme par le consulat, je vire aussi pour lui, un peu de temps en temps, sur ton compte personnel, mais avec la mention de son nom... Ã  cause de Marc.\n\nMarc va mal, il est aigri et mÃ©chant; il met tout sur mon dos, mais je te jure que CÃ©cile lui fait une vie d'enfer, elle est violente avec les petits, elle soigne leur apparence, mais nÃ©gligente pour leur Ã©ducation. Marc fait tout; j'ai peur Ã  l'infarctus; j'espÃ¨re qu'ils vont aller vous voir en fÃ©vrier!\n\nJe suis Ã©puisÃ©e par des allÃ©e et venues chaque jour Ã  VitrÃ©.\nCe week end je vais dormir,\nmais aujourd'hui, Ã  partir de 13 heures, je ne bouge pas de la maison.\nJe fais ma dÃ©claration d'impots.\nAppelez !\n \nDÃ¨s que possible, donnez vos dates, que je vois pour les billets, et mon travail.\nEt aussi rÃ©server un hotel au-dessus du restau, pour que vous arriviez Ã  la PeiniÃ¨re la veille, car je serai chez mamie, pour la fÃªte avec les dames, et aurai besoin de la voiture pour transporter les plats et les personnes.\n\nEst-ce qu'on peut profiter de l'anniversaire de mamie pour faire nos anniversaires le lendemain, ce serait bien de le faire Ã  la suite, le lundi 9, qui est fÃ©riÃ©, car tout le monde sera lÃ , et aprÃ¨s repartiront loin Ã  leurs occupations. Il faut prÃ©voir maintenant pour lancer les invitations!!!\n\n\nmaryvonne masseron - 41 rue du puits-mauger  35000  rennes  0299302000  0680078113"
}