{
  "year": 2014,
  "seq": 40,
  "meta": {
    "date": "2014-06-01",
    "from": "maryvonne masseron-mandaba <maryvonnemm@hotmail.com>",
    "to": "\"y.mandaba@gmail.com\" <y.mandaba@gmail.com>",
    "subject": "le programme prÃ©cisÃ© ce jour"
  },
  "proposals": [],
  "raw_excerpt": "ðŸ—• Date : 2014-06-01\nðŸ‘¤ From : maryvonne masseron-mandaba <maryvonnemm@hotmail.com>\nðŸ“¨ To   : \"y.mandaba@gmail.com\" <y.mandaba@gmail.com>\nðŸ§• Subject : le programme prÃ©cisÃ© ce jour\n---\n----- le samedi 7 juin 16h RV chez mamie pour Marc et sa famille et moi 16h30  l'glise Notre-Dame pour Tristan et ses parentsdbut de la crmonie de baptme  17hmesse  18haprs la messe, raffraichissements avec petit buffet dans la vieille ville , \"le baravel\", rue d'embas,19h15  20h30\n32 adultes prvus : 24 adultes avec alcool 8 adultes sans alcool12 enfants ( + 4 bbs )\n 2 Chambres rserves au Minotel pour 2 familles (guillemoteau et Guichard )et 1 pour Sophie\nChambres rserves  la Peinire :- 2 chambres contigues pour Marc et family ( pour 2 nuits ) 7 au soir, et 8 au soir- 1 chambre  3 couchages pour Yannick, Wadee ( et Sophie si elle prfre ) pour 2 nuits, idem\n---------le dimanche 8  la Peinire = programme jean-paulmidi et soir\n--------le lundi midi, 9 juin,  repas du baptme,\n32 adultes12 enfants4 bbs(il y a 3 chaises hautes sur place)\npour le lundi soir,2 chambres familiales rserves  la grenouillre\n( j'ai libr 3 chambres  la maison = Chambre d'amis 2 personnes)( chambre de Marc= 2 lits \"mousse\"; et un lit parapluie;)(chambre de yannick = 2 couchages)LE dressing est transfr  la cave.\n-------pour le RV chez le notaire, je tlphone ds demain  la secrtaire, mais a priori, selon notre rponse, Dominique Chaudet ( le fils) sera  Brest le 6 juin, et pour le 7, le samedi n'est habituellement pas ouvr.\nSI IL Y A QUELQUES EVENEMENTS QUI MODIFIERAIENT CE PROGRAMME, AVERTIR +++SACHANT QUE MES FRERES ET SOEURS SOULIGNENT QUE C'EST EN PRIORITE LES 100 ANS DE MAMIE,LE BAPTEME DE TRISTAN A ETE PROPOSE PAR MOI, JE PRENDS LA RESPONSABILITE DES COMPLICATIONS POSSIBLES."
}