{
  "year": 2014,
  "seq": 39,
  "meta": {
    "date": "2014-06-01",
    "from": "maryvonne masseron-mandaba <maryvonnemm@hotmail.com>",
    "to": "dolly gotilogue <dollygotilogue@yahoo.fr>, \"y.mandaba@gmail.com\"",
    "subject": "bangui 020820 page 6 acte roosalem"
  },
  "proposals": [],
  "raw_excerpt": "ðŸ—• Date : 2014-06-01\nðŸ‘¤ From : maryvonne masseron-mandaba <maryvonnemm@hotmail.com>\nðŸ“¨ To   : dolly gotilogue <dollygotilogue@yahoo.fr>, \"y.mandaba@gmail.com\"\n\t<y.mandaba@gmail.com>, Marc Mandaba <marcmandaba@hotmail.com>\nðŸ§• Subject : bangui 020820 page 6 acte roosalem\n---\nChre Dolly,mes enfants t'ont adress des louanges bien mrits,quant-au srieux,  la sagesse,  la persvrance, dont tu as fais preuve dans notre dossier.Moi aussi, mon plus grand souhait est de te dcharger de ce fardeau.Cependant, en accord avec l'esprit des runions du conseil de famille, le texte rdig par le notaire de la succession, ne dit aucunement que la somme doit tre partage entre les hritiers, que ce soit tt ou tard.Chaque anne, sauf en 2013, je me suis rendue  Bangui, et ai pu constater que la seule personne  mettre du temps, de l'nergie, et de l'argent, dans la prparation des crmonies, et dans l'entretien des tombes, du terrain, de la maison , pour recevoir le prtre, les amis, la famille, tait Christian, ( et moi, dans une moindre mesure ).Pourquoi ne pas lui confier le chquier, la signature, et le compte, pour qu'il gre, et, avec les intrts produits par ce compte bloqu, au renouvellement chaque anne , en Octobre , libre les intrts pour les crmonies. C'est peut-tre utopique ...Pour ma part, je sais par des indiscrtions, que ce compte bloqu, dans la mme institution financire que la caution hrite du dfunt, met notre maison  l'abri des concupiscences de la banque, propritaire de la maison voisine ! Cette maison appartient  mes enfants, je ne suis qu'usufruitire, encore un peu connue, et respecte, mais ma protection sur ce bien aura une fin !Les seules victimes possibles de ce projet de distribution de la caution, seront Yannick et Marc Mandaba, qui perdront le bien pour lequel leur papa ne voulait pas quitter la RCA,  le bien pour lequel j'ai donn les 2 maisons construites pour eux. Mais puisqu'ils sont , par ailleurs, en ce moment, tous les deux, dans une remise en question, et dans une logique de \"terre brle\", ils vont encore penser que je les freine dans leur lan vital ! pendant que moi je pense qu'ils me maltraitent dans ma logique de vieille dame prudente !Merci  toi Dolly,je dois en parler  Christian de toute faon.trs amicalementmaryvonne"
}