{
  "year": 2014,
  "seq": 41,
  "meta": {
    "date": "2014-06-04",
    "from": "maryvonne masseron-mandaba <maryvonnemm@hotmail.com>",
    "to": "\"y.mandaba@gmail.com\" <y.mandaba@gmail.com>, Wadeekanya Soonthornsingha",
    "subject": "RE: les billets de train ( direct de roissy TGV Ã  Rennes )"
  },
  "proposals": [],
  "raw_excerpt": "ðŸ—• Date : 2014-06-04\nðŸ‘¤ From : maryvonne masseron-mandaba <maryvonnemm@hotmail.com>\nðŸ“¨ To   : \"y.mandaba@gmail.com\" <y.mandaba@gmail.com>, Wadeekanya Soonthornsingha\n\t<beebeau89@hotmail.com>, BeeBaa <beebeau89@gmail.com>\nðŸ§• Subject : RE: les billets de train ( direct de roissy TGV Ã  Rennes )\n---\nsee railways tickets on my e-mail box =maryvonnemm@hotmail.frPRINTand take it at airport railways stationmmm\n\nFrom: maryvonnemm@hotmail.fr\nTo: y.mandaba@gmail.com; beebeau89@hotmail.com; maryvonnemm@hotmail.com\nSubject: les billets de train ( direct de roissy TGV  Rennes )\nDate: Tue, 3 Jun 2014 23:22:05 +0200\n\n\n\n\nHere you have your railways tickets,from Airport Roissy Charles de Gaulle  Rennes ( direct ). Into 3 hours.I will be in the station in Rennes to take you Sophie would be with you or not ?Does she take a train before, or a plane ?What may I do for Her ?\nTGV station is in the terminal 2 ,I think you arrive in terminal 2 with AIR FRANCE.The station is very well indicated, near terminal 2E, ( don't take R.E.R. which goes in Paris ) - take TGV which goes around Paris -\nPrint the tickets for control,and got the real tickets from GREAT YELLOW SETS, introducing the code , which is in the circle.You note your wagon = N16and seats= N25 and 26and the hour of start = 18h48( be 3 mns before starting because the train don't stop for a long time ( coming from belgium, and going to rennes )\nYou have to \"composter\" , it is introduce in LITTLE YELLOW SET, before going down on the rail way.\nI hope you have a nice trip !maryvonne\nps :  don't forget little bags for drages, because now it's too late to got that ( they sold only drages whithout bags ) - you need 50 bags; for chidren I bought sweets;"
}