{
  "year": 2014,
  "seq": 3,
  "meta": {
    "date": "2014-01-05",
    "from": "maryvonne.masseron@free.fr",
    "to": "Yannick Mandaba <y.mandaba@gmail.com>",
    "subject": "Re¬†: La peu de Tristan nous inqui√©t√© beaucoup"
  },
  "proposals": [],
  "raw_excerpt": "üóï Date : 2014-01-05\nüë§ From : maryvonne.masseron@free.fr\nüì® To   : Yannick Mandaba <y.mandaba@gmail.com>\nüßï Subject : Re¬†: La peu de Tristan nous inqui√©t√© beaucoup\n---\nc'est un eczema\nc'est √† dire une allergie alimentaire\n\na partir du moments o√π l'on fait le r√©gime\n- lui = un lait hypoallergenique, ou un lait de riz \"m√©dical\" pour nourrisson= me monter l'√©tiquette\n- sa maman = que des aliments naturels\n \nLA MALADIE CONTINUE PENDANT 3 MOIS m√™me si l'on fait attention = IL FAUT QUE SON ORGANISME ELIMINE TOUT CE QU'IL A MANGE DE MAUVAIS  +++++ (cela se fait en 3 mois )\n\nlui = voir si il y a un lait sans prot√©ines de lait de vache , c'est tr√®s cher, ici rembours√© par la s√©cu; il existe aussi des laits de riz pour b√©b√© = modilac expert riz - ou Picot riz - ou gallia Riz\nNE DONNER au b√©b√© aucun m√©dicament sauf la vit D ( zyma D que je vous ai donn√©)\n\nelle = ne manger que des choses pr√©par√©es √† la maison : rien achet√© au magasin = que des choses du march√© , sans sauces en sachet=\n---tous les l√©gumes sauf petits pois et tomates, achet√©s frais et cuits √† la maison\n----que des fruits frais ( √©viter la mangue, l'ananas, les fruits rouges, les fruits √† coques et les fruits d'arbre, l'arachide, ), sont √† privil√©gier = pomme poire p√™che banane raisin blanc melon blanc )\n---pas de jus de fruits achet√©s au magasin , ni smoothy\n---aucun g√¢teau ni dessert\n---pas de lait entier, mais des yaourts nature ( sans fruits dedans ni parfums ni colorants), ou des fromages\n\nL'enfant peut √™tre allergique aux prot√©ines du lait de vache\nou bien √† quelquechose que mange sa maman \n\nc'est fr√©quent avec la vie moderne\nCE N'est PAS GRAVE, mais pas joli !\n\nappelez moi dans la journ√©e\nje vous rappellerai avec skype\n( LINE NE ME PLAIT PAS pour l'instant - confidentialit√© )\n \n\n\nmaryvonne masseron - 41 rue du puits-mauger  35000  rennes  0299302000  0680078113\n\n----- Mail d'origine -----\nDe: Yannick Mandaba \n√Ä: Y Mum \nEnvoy√©: Sun, 05 Jan 2014 02:00:14 +0100 (CET)\nObjet: La peu de Tristan nous inqui√©t√© beaucoup\n\nYannick Mandaba\n\ntel : +66 878200622\n\nskype : Yannick.mandaba"
}