{
  "year": 2014,
  "seq": 29,
  "meta": {
    "date": "2014-05-14",
    "from": "maryvonne masseron-mandaba <maryvonnemm@hotmail.com>",
    "to": "\"beebeau89@gmail.com\" <beebeau89@gmail.com>, \"y.mandaba@gmail.com\"",
    "subject": "RE: Suivi courrier nÂ°1B00892882937"
  },
  "proposals": [],
  "raw_excerpt": "ðŸ—• Date : 2014-05-14\nðŸ‘¤ From : maryvonne masseron-mandaba <maryvonnemm@hotmail.com>\nðŸ“¨ To   : \"beebeau89@gmail.com\" <beebeau89@gmail.com>, \"y.mandaba@gmail.com\"\n\t<y.mandaba@gmail.com>\nðŸ§• Subject : RE: Suivi courrier nÂ°1B00892882937\n---\nle service de suivi s'arrte  l'aroport de Roissy,aprs il faut contacter la poste THAI\nmaryvonne\nje vais reprendre les documents et les scanner cette nuit,si le courrier n'est pas arriv ce jour,mais cela me perd mon temps,c'est un travail dj fait.\nmerci de m'avoir permis de me disputer avec Laurence\n\nDate: Wed, 14 May 2014 10:34:07 +0200\nFrom: csuivi@eservices-laposte.fr\nTo: maryvonnemm@hotmail.com\nSubject: Suivi courrier n1B00892882937\n\n\n\t\n\n\t\n\n\tCher client,\n\n\t\n\n\tVous avez demand  recevoir les informations lies  votre Lettre Recommande numro 1B00892882937 :\n\n\tDernier tat : Dpart\n\n\tHistorique :\n\n\t\n\n\t- Le 10/05/2014 : Dpart  ROISSY HUB COURRIER PIC (93)\n\n\t- Le 09/05/2014 : Pris en charge  LOUDEAC (22)\n\n\n\t\n\n\tCliquez ici pour consulter le dtail de votre pli sur notre site."
}