{
  "year": 2014,
  "seq": 26,
  "meta": {
    "date": "2014-05-06",
    "from": "maryvonne masseron-mandaba <maryvonnemm@hotmail.com>",
    "to": "\"y.mandaba@gmail.com\" <y.mandaba@gmail.com>",
    "subject": "RE: Dossier d'accueil pour le visa de Bee"
  },
  "proposals": [
    {
      "index": -26,
      "etiquette": "Visa / immigration",
      "category": "MIN",
      "duration": "LT",
      "source": "AI",
      "score": 1,
      "matched_from": [
        "ai_new"
      ]
    }
  ],
  "raw_excerpt": "ðŸ—• Date : 2014-05-06\nðŸ‘¤ From : maryvonne masseron-mandaba <maryvonnemm@hotmail.com>\nðŸ“¨ To   : \"y.mandaba@gmail.com\" <y.mandaba@gmail.com>\nðŸ§• Subject : RE: Dossier d'accueil pour le visa de Bee\n---\nle document est prt  la mairie,mais je n'irai le prendre que quand vous aurez envoy l'invitation  mes frres et soeurs....\nrectifier le dbut, comme dit  Wadee\"chers oncles et tantes\"\net envoyer aux adresses dj donnes dans mon prcdent mailVu Gilbert ce jour ... n'avait rien reu !!!!!!!!!!!!!!!\n\nDate: Tue, 6 May 2014 22:59:02 +0700\nSubject: Dossier d'accueil pour le visa de Bee\nFrom: y.mandaba@gmail.com\nTo: maryvonnemm@hotmail.com\n\nMerci de nous envoyer le dossier au plus vite pour le visa de Bee.\n\nSi tu as un problme tu me dis\nBisou.\nYannick Mandaba\n\ntel : +66 878200622\n\nskype : Yannick.mandaba"
}