{
  "year": 2014,
  "seq": 5,
  "meta": {
    "date": "2014-01-08",
    "from": "maryvonne.masseron@free.fr",
    "to": "Yannick Mandaba <y.mandaba@gmail.com>",
    "subject": "ReÂ : Tristan va mieux aprÃ¨s 1 jour de traitement."
  },
  "proposals": [],
  "raw_excerpt": "ğŸ—• Date : 2014-01-08\nğŸ‘¤ From : maryvonne.masseron@free.fr\nğŸ“¨ To   : Yannick Mandaba <y.mandaba@gmail.com>\nğŸ§• Subject : ReÂ : Tristan va mieux aprÃ¨s 1 jour de traitement.\n---\nNous ne donnons pas de cortisone chez les bb. Car cela part et revient plus grave. Avec les effets secondaires de la cortisone. Enfant bouffi. Fragilite aux infections.\n\n\n\nmaryvone masseron - 41 rue du puits-mauger 35000 rennes 0299302000 0680078113\n\n----- Mail d'origine -----\nDe: Yannick Mandaba \nÃ€: Y Mum \nEnvoyÃ©: Wed, 08 Jan 2014 06:55:35 +0100 (CET)\nObjet: Tristan va mieux aprÃ¨s 1 jour de traitement.\n\nLe pÃ©diatre nous a envoyÃ© d'office chez le pediatre dermatologue lors de la\nvisite.\nLa dame a donnÃ© une crÃ¨me et en 5 jours ce devrait Ãªtre fini.\nAprÃ¨s 1 jour dÃ©jÃ  c'est beaucoup mieux.\nLes stÃ©roÃ¯des Ã§a me fait un peu peur les corticoÃ¯des aussi. Bref c'est des\nmots qui me font un peu peur mais elle m'a m'assurer que ce ne serait pas\nun problÃ¨me.\n\nElle a dit que ta crÃ¨me et trÃ¨s bien mais plutÃ´t en prÃ©ventif et pour\nÃ©viter le grattage elle pense quand mÃªme que dans le cas de Tristan il\nvalait mieux traiter rapidement temps c'est pas trop Ã©tendu.\n\nElle pense plutÃ´t une rÃ©action allergique de contact parce que c'est\nlocalisÃ© sur les joues et qu'il n'a aucune trace sur le reste du corps.\n\nYannick Mandaba\ntel : +66 878200622\nskype : Yannick.mandaba"
}