{
  "year": 2014,
  "seq": 12,
  "meta": {
    "date": "2014-02-24",
    "from": "maryvonne.masseron@free.fr",
    "to": "Yannick Mandaba <y.mandaba@gmail.com>",
    "subject": "ReÂ : Chinese New year"
  },
  "proposals": [],
  "raw_excerpt": "ğŸ—• Date : 2014-02-24\nğŸ‘¤ From : maryvonne.masseron@free.fr\nğŸ“¨ To   : Yannick Mandaba <y.mandaba@gmail.com>\nğŸ§• Subject : ReÂ : Chinese New year\n---\nyannick,\n \nla photo que j'ai choisi , pour envoyer mes voeux ( en retard ) , et pour les aggrandissements, est celle du Nouvel An Chinois, l' annÃ©e du cheval de bois ! il te ressemble au mÃªme Ã¢ge ! et le thÃ¨me est intÃ©ressant, la pose aussi !\nEn poster, cela rend trÃ¨s bien !\nLes vieilles dames vont Ãªtre contentes +++\n\nCi-joint le document pour le baptÃªme, il faut confirmer la date dÃ¨s que possible; et que je prenne mes dispositions pour mon travail ! marchandage-Ã©change de jours prÃ©cieux !\nCependant, j'ai dÃ» me tromper Ã  noter les dates possibles, ce doit Ãªtre le 2 ou le 7, j'ai notÃ© le 7 un vendredi, ce serait bien, mais je ne suis pas sÃ»re de moi !  le 14 et le 22 juin; je retourne demain Ã  VitrÃ©. Le mail de la paroisse : paroisse.stmartin@orange.fr ( les 3 paroisses sont regroupÃ©es ).\nJe vais me renseigner Ã  Noyal-la PeiniÃ¨re, aussi pour le lendemain des 100 ans : le 9 juin...\n \nBonne semaine !\nmaman\n \n \n\n\nmaryvonne masseron - 41 rue du puits-mauger  35000  rennes  0299302000  0680078113"
}