{
  "year": 2014,
  "seq": 1,
  "meta": {
    "date": "2014-04-19",
    "from": "MYM MANDABA SCI <mymmandaba@gmail.com>",
    "to": "Yannick Mandaba <y.mandaba@gmail.com>, marcmandaba@hotmail.com",
    "subject": "PERGOLESE"
  },
  "proposals": [
    {
      "index": -1,
      "etiquette": "Appartement PergolÃ¨se (vente/location)",
      "category": "MIN",
      "duration": "LT",
      "source": "AI",
      "score": 1,
      "matched_from": [
        "ai_new"
      ]
    }
  ],
  "raw_excerpt": "ğŸ—• Date : 2014-04-19\nğŸ‘¤ From : MYM MANDABA SCI <mymmandaba@gmail.com>\nğŸ“¨ To   : Yannick Mandaba <y.mandaba@gmail.com>, marcmandaba@hotmail.com\nğŸ§• Subject : PERGOLESE\n---\nil y a eu une fuite d'eau dans la cuisine de PergolÃ¨se, le mois dernier,\nles frais 350 euros;\nmr Ayache a fait la rÃ©paration aussitÃ´t.\n\nPour continuer les travaux d'amÃ©lioration, j'ai fait faire le devis pour\nles deux grandes fenÃªtres, et dans le style de la rÃ©sidence, remplacement\ndu cadre , des fenÃªtres, en PVC, en double vitrage pour une meilleure\nisolation, du salon et de la chambre.\n\nDevis = 4213 euros.\n\nLa somme devrait Ãªtre lÃ  le mois prochain, aprÃ¨s paiement des charges de\ncopropriÃ©tÃ©.\nSi vous en Ãªtes d'accord, nous signerions l'accord lors de la rÃ©union du\nconseil d'administration le 7 ou 8 ou 9 juin 2014,\net proposerions Ã  Monsieur Braidy Charbel de choisir la date des travaux,\nen accord avec Mr Ayache, Ã  qui nous avions confiÃ© les travaux de la\ndouche, et de la cuisine.\n\nmerci de me donner une rÃ©ponse rapide car le locataire doit fixer ses dates\nde congÃ©s\n\nMMM"
}