{
  "year": 2016,
  "seq": 27,
  "meta": {
    "date": "2016-05-26",
    "from": "maryvonne masseron-mandaba <maryvonnemm@hotmail.com>",
    "to": "\"y.mandaba@gmail.com\" <y.mandaba@gmail.com>, Marc Mandaba",
    "subject": "vacances Ã  Publier ?"
  },
  "proposals": [],
  "raw_excerpt": "ðŸ—• Date : 2016-05-26\nðŸ‘¤ From : maryvonne masseron-mandaba <maryvonnemm@hotmail.com>\nðŸ“¨ To   : \"y.mandaba@gmail.com\" <y.mandaba@gmail.com>, Marc Mandaba\n\t<marcmandaba@hotmail.com>\nðŸ§• Subject : vacances Ã  Publier ? \n---\nVoici le lieu du stage de danse \nAMPHION - PUBLIER\n\nle stage = http://stage-danse-publier.fr/page8.html\n\n\nles activits = piscine olympiquestage de danse, classique , hip hop, moder, jazz, thatre, comdie musicale, etc ...stage de gymnastique fminine poussins championat national,et, en dehors, des cours de fitness, yoga, streching, pilates etc ...plage de gazon, baignades dans le lac,milieu courtois, trs \"suisse\", bien lev, paisible,proximit Genve d'un ct,Montreux et Lausanne, de l'autre\n\n\nune location possible =\nhttp://www.ot-publier.com/cgi-local/affiche_xml_sitra2_parametres.pl?mois=-&date_debut_resa=&date_fin_resa=&action=Detail&HTMLPage=/hebergement/locations-non-classees.htm&alea=&page=1&famille=5&parametre=5!4!5!9!1&ID=505400"
}