{
  "year": 2016,
  "seq": 48,
  "meta": {
    "date": "2016-08-12",
    "from": "maryvonne masseron-mandaba <maryvonnemm@hotmail.com>",
    "to": "\"y.mandaba@gmail.com\" <y.mandaba@gmail.com>, BeeBaa <beebeau89@gmail.com>",
    "subject": "Tristan - vacances de mi-trimestre"
  },
  "proposals": [],
  "raw_excerpt": "ðŸ—• Date : 2016-08-12\nðŸ‘¤ From : maryvonne masseron-mandaba <maryvonnemm@hotmail.com>\nðŸ“¨ To   : \"y.mandaba@gmail.com\" <y.mandaba@gmail.com>, BeeBaa <beebeau89@gmail.com>\nðŸ§• Subject : Tristan - vacances de mi-trimestre\n---\nbonjour,\nSi vous souhaitez que je vienne auprs de Tristan,je peux profiter de promotions ( vol  520 euros ) =,\n- soit pour ses vacances de l'colequi sont du 21 au 30 octobre,j'aurais un vol aller le 23 octobre, et retour le 2 novembre ( pour ce prix ),\n- soit pour son anniversaireje sais que c'est le 12 novembre, mais autour de cette date les vols sont chers,j'aurais un vol aller le 2 novembre, et retour  le 11 novembre ( pour ce prix ),\nIl faut me dire rapidement , car certains vols sont presque pleins.\nA la tlvision, on entend parler de bombes un peu partout surtout dans le sud du pays,c'est mieux de rester en famille, et viter les grands centres commerciaux, ainsi que hua hin.\nDommage que vous ne puissiez profiter de ce week-end prolong.\nJe pars bientt pour Vitr, puis en route pour Evian, j'aurai Skype  Evian, grce  mon modem et Lenovo ( fiable ), par contre accs  toutes mes boites pour peu que le tlphone soit ouvert !!! Merci de me dire si je dois venir pour Tristan.m"
}