{
  "year": 2016,
  "seq": 47,
  "meta": {
    "date": "2016-08-12",
    "from": "maryvonne masseron-mandaba <maryvonnemm@hotmail.com>",
    "to": "<y.mandaba@gmail.com>",
    "subject": "RE: cadeaux de voyage et anniversaire offerts Ã  LÃ©a et Maxime"
  },
  "proposals": [],
  "raw_excerpt": "ðŸ—• Date : 2016-08-12\nðŸ‘¤ From : maryvonne masseron-mandaba <maryvonnemm@hotmail.com>\nðŸ“¨ To   : <y.mandaba@gmail.com>\nðŸ§• Subject : RE: cadeaux de voyage et anniversaire offerts Ã  LÃ©a et Maxime\n---\nTrs dommage pour vous !!! J' appelle dans la journe. Vers quelle heure ? \n\nFrom: y.mandaba@gmail.com\nDate: Fri, 12 Aug 2016 10:35:36 +0700\nSubject: Re: cadeaux de voyage et anniversaire offerts  La et Maxime\nTo: maryvonnemm@hotmail.com\n\nOn a annul la balade  cause des bombes. A Hua Hin ou le roi a un palais de vacance les attaques sont au hasard des petites rue donc trs inquitant.\nNous serons donc a la maison.\n\nBisous\n\nOn Aug 12, 2016 04:11, \"maryvonne masseron-mandaba\"  wrote:\n  Provenance : Courrier pour Windows 10"
}