{
  "year": 2016,
  "seq": 26,
  "meta": {
    "date": "2016-05-19",
    "from": "maryvonne masseron-mandaba <maryvonnemm@hotmail.com>",
    "to": "\"y.mandaba@gmail.com\" <y.mandaba@gmail.com>",
    "subject": "revenus fonciers ( pour ta dÃ©claration des revenus )"
  },
  "proposals": [],
  "raw_excerpt": "ğŸ—• Date : 2016-05-19\nğŸ‘¤ From : maryvonne masseron-mandaba <maryvonnemm@hotmail.com>\nğŸ“¨ To   : \"y.mandaba@gmail.com\" <y.mandaba@gmail.com>\nğŸ§• Subject : revenus fonciers ( pour ta dÃ©claration des revenus )\n---\npour la SCI M.Y.M.-MANDABA ( 41 rue du Puits-mauger 35000 Rennes )= quote part des revenus bruts     3 396quote-part des frais et charges dductibles   576quote part des interets d'emprunts   0quote-part de deductions spcifiques    0quote part de l'amortissement  0quote part du revenu net      2820 \npour la SCI de Clerville ( 5 boulevard des rochers 35 500 Vitr )\nRevenus bruts                   764/2 = 382Charges dductibles       248/2 = 124Revenus nets                     516/2 = 258\n\nJe suis trop tard pour la dclaration papier, je devais l'envoyer avant-hier ( trop nerve ),tu dois la faire en ligne =ton N fiscal = 10 58 875 275 493ENTRE TON ADRESSE MAILcre un mot de passe  ne pas oublier = lettres chiffres et signes ( pour plus de 8 caractres ) - je peux le garder pour toi dans mes archives -\nTon 1/3 est pay en ligne, en temps utile,\nappelle moi maintenant si tu ne sais plus faire \nmaman"
}