{
  "year": 2016,
  "seq": 45,
  "meta": {
    "date": "2016-08-02",
    "from": "<maryvonnemm@hotmail.com>",
    "to": "Marc MANDABA <marcmandaba@hotmail.com>",
    "subject": "RE: interphones, rue PergolÃ¨se"
  },
  "proposals": [
    {
      "index": -45,
      "etiquette": "Appartement PergolÃ¨se (vente/location)",
      "category": "MIN",
      "duration": "LT",
      "source": "AI",
      "score": 1,
      "matched_from": [
        "ai_new"
      ]
    }
  ],
  "raw_excerpt": "ğŸ—• Date : 2016-08-02\nğŸ‘¤ From : <maryvonnemm@hotmail.com>\nğŸ“¨ To   : Marc MANDABA <marcmandaba@hotmail.com>\nğŸ§• Subject : RE: interphones, rue PergolÃ¨se\n---\nOk , Marc. IlÂ  faut aussi un badge pour nous, pour la cave. Je fais le nÃ©cessaire demain. Je confie la mission au locataire : interphone audio. Et trois badges. Et je lui envoie le chÃ¨que . Suggestions encore bienvenues jusqu'Ã  demain 16 h .\n\nM\n\nTÃ©lÃ©charger Outlook pour Android\n\n\n\nDeÂ : Marc MANDABA\n\nEnvoyÃ©Â : dimanche 31 juillet 12:25\n\nObjetÂ : RE: interphones, rue PergolÃ¨se\n\nÃ€Â : maryvonne masseron-mandaba, y.mandaba@gmail.com\n\n\n\nJe pense qu'il faudrait au moins 3 badge.\n\n\nMarc\n\n\n\n\n\nSent from my Samsung device\n\n\n\n\n-------- Original message --------\n\nFrom: maryvonne masseron-mandaba  \n\nDate: 7/31/16 09:36 (GMT+01:00) \n\nTo: y.mandaba@gmail.com, Marc Mandaba  \n\nSubject: interphones, rue PergolÃ¨se \n\n\nbonjour,\n\n\nde l'avis de Charbel Braidy, notre locataire au 4eme Ã©tage Gauche Cour au 9 rue PergolÃ¨se,\n\n\nqui m'a envoyÃ© les photos de l'affichage,\n\n\nil suffit d'un interphone audio.\n\n\nSauf avis contraire de votre part, \n\n\ndemain, lundi 1er Aout, Â je lui envoie un chÃ¨que de 115,50 euros Ã  l'ordre de SEBASTELEC\n\n\ncorrespondant Ã \n\n\n- un interphone audio = 97,90 TTC\n\n\n- deux badges pour ouvrir la porte de l'immeuble Ã  8,80 TTC/ piÃ¨ces.\n\n\nIl remettra le chÃ¨que Ã  Mr Dos Santos, en Ã©change des 2 badges et du RV pour intervention.\n\n\nBon dimanche\n\n\nm\n\n\n\nen Cci Ã  Nicolas Lanno du syndic C.E.C.A.\n\n\net Charbel Braidy, le locataire."
}