{
  "year": 2016,
  "seq": 54,
  "meta": {
    "date": "2016-09-04",
    "from": "maryvonne masseron-mandaba <maryvonnemm@hotmail.com>",
    "to": "\"y.mandaba@gmail.com\" <y.mandaba@gmail.com>",
    "subject": "RE: sur internet = Bangkok = pluie fine"
  },
  "proposals": [],
  "raw_excerpt": "ðŸ—• Date : 2016-09-04\nðŸ‘¤ From : maryvonne masseron-mandaba <maryvonnemm@hotmail.com>\nðŸ“¨ To   : \"y.mandaba@gmail.com\" <y.mandaba@gmail.com>\nðŸ§• Subject : RE: sur internet = Bangkok = pluie fine\n---\nc'est dcid aussi - de le faire manger seul- devant une tablette- allong sur un lit ou sur un sofa ou une moquette-  plat ventreDans notre famille, mme en Afrique, on mange assis, et avec les autres, et pas devant la tl ! ducation qui laissera des traces\n\nFrom: y.mandaba@gmail.com\nDate: Sun, 4 Sep 2016 20:47:47 +0700\nSubject: Re: sur internet = Bangkok = pluie fine\nTo: maryvonnemm@hotmail.com\n\nRoute mouille + scouter = accident\n\nPluie + voiture = bouchons.\nC'est une artre trs dangereuse.\n\nOn a dcid comme a.\n\nOn Sep 4, 2016 19:56, \"maryvonne masseron-mandaba\"  wrote:"
}