{
  "year": 2016,
  "seq": 49,
  "meta": {
    "date": "2016-08-20",
    "from": "maryvonne masseron-mandaba <maryvonnemm@hotmail.com>",
    "to": "\"y.mandaba@gmail.com\" <y.mandaba@gmail.com>, BeeBaa <beebeau89@gmail.com>",
    "subject": "RE: Tristan - vacances de mi-trimestre"
  },
  "proposals": [],
  "raw_excerpt": "ðŸ—• Date : 2016-08-20\nðŸ‘¤ From : maryvonne masseron-mandaba <maryvonnemm@hotmail.com>\nðŸ“¨ To   : \"y.mandaba@gmail.com\" <y.mandaba@gmail.com>, BeeBaa <beebeau89@gmail.com>\nðŸ§• Subject : RE: Tristan - vacances de mi-trimestre\n---\nbonsoir,je suis rentre d'Evian,de garde chez jeannette dimanche et lundi,Bee ne m'a pas encore dit, elle-mme, si elle souhaite ma venue, ou non, je ne sais si tu as perdu ton LENOVO, mais je reois des photos du Laos ???rponse pour rservation du vol, ds que possible, aprs ce sera trop cher.m\nFrom: y.mandaba@gmail.com\nDate: Sat, 13 Aug 2016 00:20:26 +0700\nSubject: Re: Tristan - vacances de mi-trimestre\nTo: maryvonnemm@hotmail.com\nCC: beebeau89@gmail.com\n\nOk l'anniversaire de Tristan c'est le 10 novembre. Moi je pense que venir pendant les vacances d'octobre c mieux.\n\nOn Aug 12, 2016 19:37, \"maryvonne masseron-mandaba\"  wrote:\n\n\n\nbonjour,\nSi vous souhaitez que je vienne auprs de Tristan,je peux profiter de promotions ( vol  520 euros ) =,\n- soit pour ses vacances de l'colequi sont du 21 au 30 octobre,j'aurais un vol aller le 23 octobre, et retour le 2 novembre ( pour ce prix ),\n- soit pour son anniversaireje sais que c'est le 12 novembre, mais autour de cette date les vols sont chers,j'aurais un vol aller le 2 novembre, et retour  le 11 novembre ( pour ce prix ),\nIl faut me dire rapidement , car certains vols sont presque pleins.\nA la tlvision, on entend parler de bombes un peu partout surtout dans le sud du pays,c'est mieux de rester en famille, et viter les grands centres commerciaux, ainsi que hua hin.\nDommage que vous ne puissiez profiter de ce week-end prolong.\nJe pars bientt pour Vitr, puis en route pour Evian, j'aurai Skype  Evian, grce  mon modem et Lenovo ( fiable ), par contre accs  toutes mes boites pour peu que le tlphone soit ouvert !!! Merci de me dire si je dois venir pour Tristan.m"
}