{
  "year": 2016,
  "seq": 36,
  "meta": {
    "date": "2016-06-30",
    "from": "maryvonne masseron-mandaba <maryvonnemm@hotmail.com>",
    "to": "\"y.mandaba@gmail.com\" <y.mandaba@gmail.com>, Marc Mandaba",
    "subject": "FW: Menace sur Android, Fin de la Surface 3, Sandisk booste l'iPhone, Fin du tÃ©lÃ©phone fixe,NouveautÃ©s WhatsApp, Disque WD WiFi, Lunettes Zungle et Solos, Echo : smartphone low-cost"
  },
  "proposals": [],
  "raw_excerpt": "ðŸ—• Date : 2016-06-30\nðŸ‘¤ From : maryvonne masseron-mandaba <maryvonnemm@hotmail.com>\nðŸ“¨ To   : \"y.mandaba@gmail.com\" <y.mandaba@gmail.com>, Marc Mandaba\n\t<marcmandaba@hotmail.com>\nðŸ§• Subject : FW: Menace sur Android, Fin de la Surface 3, Sandisk booste l'iPhone, Fin du tÃ©lÃ©phone fixe,NouveautÃ©s WhatsApp, Disque WD WiFi, Lunettes Zungle et Solos, Echo : smartphone low-cost\n---\nDate: Wed, 29 Jun 2016 22:29:47 +0000\nTo: maryvonnemm@hotmail.com\nSubject: Menace sur Android, Fin de la Surface 3, Sandisk booste l'iPhone, Fin du tlphone fixe,Nouveauts WhatsApp, Disque WD WiFi, Lunettes Zungle et Solos, Echo : smartphone low-cost\nFrom: actualite@b.commentcamarche.net\n\n\n\n\n\nComment a Marche (CCM) - Communaut informatique\n\n\n\n\n        \n\n\n \nMercredi\n29 Juin 2016 \n Commentcamarche.net\n          Le rendez-vous des passionns du Web et des nouvelles technologies   \n    \n          \n\n         A LA UNE\n            \n  \n\n    \n  90%\ndes Android menacs par Godless \n   \n  Un\nnouveau malware  Godless  se\npropage rapidement sur les smartphones et\ntablettes Android.  Lire\n            \n  \n\n    \n  Sandisk\nbooste le stockage de l'iPhone \n   \n  Les\nnouvelles coques Sandisk iXpand rajoutent\nde l'espace de stockage et de l'autonomie\naux iPhone d'Apple.  Lire\n            \n  \n\n    \n  Microsoft,\nclap de fin pour la Surface 3 \n   \n  Sortie\nil y a un an, la tablette de Microsoft na\npas trouv son public. La fin de\nsa production a t confirme.\n Lire\n         \n   Tlcharger\nl'Appli Forum pour iPhone et iPad\n et pour Android \n  \n\n     \n    LES ACTUS DE LA SEMAINE\n             \n  \n\n    \n  \nMercredi\n29 juin \n Echo\nlance ses smartphones low-cost \n   \n  La\nstart-up franaise va sortir quatre\nmodles  bas cot.\nUne arrive attendue dans un secteur\nen plein essor.  Lire\n             \n  \n\n    \n  \nMardi\n28 juin \n Orange\nveut la peau du tlphone\nfixe \n   \n  Loprateur\ntlphonique vient dannoncer\nquil commencera  fermer les\nlignes fixes classiques ds 2017.\n Lire\n              \n  \n\n     \n\nVendredi\n24 juin \n Lunettes\nZungle : la musique par conduction osseuse\n\n   \n  Zungle,\nune nouvelle marque californienne a rcemment\nlanc un projet de lunettes de soleil\ndiffusant de la musique par conduction osseuse.\n Lire\n           \n  \n\n    \n  \nJeudi\n23 juin \n Dcouvrez\nLyfe : Le pot de fleur en lvitation\n\n   \n  Simon\nMorris, le designer Sudois de la\nlampe Flyte continue sur sa lance,\net propose dsormais, sur le mme\nprincipe, le projet Lyfe.  Lire\n              \n  \n\n    \n  \nMercredi\n22 juin \n Pearl\nlance sa camra Rear Vision \n   \n  Cre\npar des ex-Apple, la marque d'accessoires\nauto Pearl lance son premier objet connect.\n Lire\n              Egalement cette semaine\n         \n   \nWhatsApp,\nla prochaine version dvoile\n\n  \n   \nLe\nnouveau disque WiFi Western Digital \n\n  \n   \nDcouvrez\nSolos : les lunettes connectes pour les\ncyclistes \n\n  \n   \n\nVisions of the Future  : des posters exclusifs\nde la NASA  tlcharger\n*\n\n \n        \nL'article\nde NextPlz\n             \n  \n\n   \n  Comment\nempcher Snapchat d'utiliser toute\nvotre batterie ? \n   \n  Snapchat\nest connu pour utiliser notre batterie.\nEt pour remdier  cela, il\nsuffit de rgler certains paramtres.\nNextPlz vous explique.  Lire\n         \n    DOSSIERS ET ASTUCES\n             \n  \n\n    \n  Tlcharger\ndes photos Instagram sur votre ordinateur\n\n   \n  Puisque\nle rseau social offre la possibilit\nde tlcharger des photos,\nil y a des outils qui permettent simplement\nde les rcuprer en taille\nrelle.  Lire\n            \n  \n\n    \n  Extraire\nle son d'une vido \n   \n  Vous\navez un fichier vido dont vous voulez\nrcuprer la bande-son ? \nLire\n                  \n       \n\n\nLogiciels recommands\n\n   \n \n    \n  \n\n Snapchat   \n\n\nSnapChat n'est disponible en tlchargement\nque sur tlphone mobile.\nLa solution consiste  installer\nun mulateur Android pour PC, Bluestacks.\n \n   \n    \n  \n\n Picasa  \n\n\nLa retouche d'image ncessite toujours\nun savoir-faire et des outils adquats,\ntel que Picasa.  \n    \n    \n  \n\n Audacity  \n\n\nest un logiciel de traitement et d'dition\naudio gratuit. Il permet notamment de modifier\ndes "
}