{
  "year": 2016,
  "seq": 38,
  "meta": {
    "date": "2016-07-05",
    "from": "maryvonne masseron-mandaba <maryvonnemm@hotmail.com>",
    "to": "\"y.mandaba@gmail.com\" <y.mandaba@gmail.com>, BeeBaa <beebeau89@gmail.com>",
    "subject": "betamethasone ( nom de spÃ©cialitÃ© franÃ§aise = CÃ©lestÃ¨ne )"
  },
  "proposals": [],
  "raw_excerpt": "ðŸ—• Date : 2016-07-05\nðŸ‘¤ From : maryvonne masseron-mandaba <maryvonnemm@hotmail.com>\nðŸ“¨ To   : \"y.mandaba@gmail.com\" <y.mandaba@gmail.com>, BeeBaa <beebeau89@gmail.com>\nðŸ§• Subject : betamethasone ( nom de spÃ©cialitÃ© franÃ§aise = CÃ©lestÃ¨ne )\n---\nMdicamentsDispositifs mdicaux,parapharmacie...Interactions, quivalencesRecommandations,protocolesCommunaut VidalBase de toxicologieAccueil > Mdicaments > CELESTENE 0,05 % sol buv en gteCELESTENE 0,05 % sol buv en gteBETAMETHASONE 0,05 % sol buv (CELESTENE)Mise  jour : 23 Mars 2016 Ajouter aux interactions Forum mdicament     27MONOGRAPHIESynthseFormes et prsentationsCompositionIndicationsPosologie et mode d'administrationContre-indicationsMises en garde et prcautions d'emploiInteractionsFertilit / grossesse / allaitementEffets indsirablesSurdosagePharmacodynamiePharmacocintiqueModalits de conservationModalits manipulation / liminationPrescription / dlivrance / prise en chargeMdicament(s) proche(s)Fiche VIDAL de la familleDocuments de rfrence (4)Avis de la transparence (SMR/ASMR) (1)RCP (3) SYNTHESEClassification pharmacothrapeutique VIDAL :Anti-inflammatoires : Anti-inflammatoires strodiens (AIS) : corticodes : AIS voie orale : Btamthasone : Pneumologie : Asthme et bronchopneumopathies chroniques - Corticodes : Voie orale(Btamthasone)Classification ATC :HORMONES SYSTEMIQUES, HORMONES SEXUELLES EXCLUES :CORTICOIDES A USAGE SYSTEMIQUE - CORTICOIDES A USAGE SYSTEMIQUE NON ASSOCIES : GLUCOCORTICOIDES(BETAMETHASONE)SubstanceBtamthasoneCommercialisExcipients : orange douce arme, sucralose, phosphate disodique anhydre,orange douce alcoolature, eau purifie, orange douce essence, acide citrique, orange douce teintureExcipients  effet notoire : glycrol, propylneglycol Prsentation(s)ConservationListes% RembCELESTENE 0,05 % S buv en gouttes Fl/30mlcip : 3400930195086Liste 165%Autres formes & dosage ?Formes disponibles :Comprim dispersible scableSolution buvable en gouttesSolution injectableDosage(s) disponible(s) pour cette forme :0,05%  Noter le siteInformations laboratoireMSD France 34, av Lonard-de-Vinci. 92418 Courbevoie cdxInfo mdic, pharmacovigilance : Tl : 01 80 46 40 40Site web :  http://www.msd-france.com VIDAL Recos (17)Asthme aigu graveAsthme de l'enfant : traitement de fondAsthme de l'enfant : traitement des crisesBPCOCancers : complications des chimiothrapiesCrohn (maladie de)HypercalcmieLymphome non hodgkinien ganglionnaire de l'adultePolyarthrite rhumatodePurpura thrombopnique immunologique de l'enfantRectocolite hmorragiqueRhinite allergiqueSclrose en plaquesSinusite aigu de l'adulteSinusite aigu de l'enfantSoins palliatifsTuberculose pulmonaireESPACE PARTENAIRESEspace diteursVIDAL sur votre siteSERVICE CLIENTContactAideFAQForumESPACE PRODUITDictionnaireVIDAL ExpertVIDAL HoptimalVIDAL OfficineeVIDALVIDAL MobileVIDAL RecosTAREXESPACE INSTITUTIONNELVIDAL FranceVIDAL GroupCarriresMentions lgales (CGU)Charte forumCharte commentaires"
}