{
  "year": 2016,
  "seq": 57,
  "meta": {
    "date": "2016-10-19",
    "from": "maryvonne masseron-mandaba <maryvonnemm@hotmail.com>",
    "to": "\"Yannick Mandaba (Perso)\" <y.mandaba@gmail.com>",
    "subject": "Fwd: RE: arrivÃ©e BKK"
  },
  "proposals": [],
  "raw_excerpt": "ðŸ—• Date : 2016-10-19\nðŸ‘¤ From : maryvonne masseron-mandaba <maryvonnemm@hotmail.com>\nðŸ“¨ To   : \"Yannick Mandaba (Perso)\" <y.mandaba@gmail.com>\nðŸ§• Subject : Fwd: RE: arrivÃ©e BKK\n---\nBonsoir. Je suis dans le train . Arrive CDG  17:30 . Turkish air lines  19:30 . C'est tout bon !\n\nTlcharger Outlook pour Android\n\n\n---------- Forwarded message ----------\nFrom: \"Yannick Mandaba\" >\nDate: Fri, Oct 14, 2016 at 7:07 PM +0200\nSubject: RE: arrive BKK\nTo: \"maryvonne masseron-mandaba\" >\n\n\n\nOk. Il commence a faire des phrases et lire des phrases courtes. Tu vas bien apprcier. Laisse lui ,2 ou 3 jour pour se sentir libre sans contrainte de dmontrer ton savoir et il se lache.\nBise\n\nOn Oct 15, 2016 00:03, \"maryvonne masseron-mandaba\" > wrote:\n\nbien reu, je prends le taxi  l'aroport.\n\nMa valise est pleine de choses pour Tristan =\n\n10 livres, en anglais et franais, avec mthodes Montessori, trs intressantes;\n\net 5 boites de jeux, et un grand jeu de construction, en bois... 23 kg de matriel pour le petit prince !\n\nNous les dcouvrirons avec Tristan, et en garderons certains pour la fte de l'anniversaire,\n\nque nous ferons avec le papa et la maman de Bee, un peu avant la vraie date.\n\n________________________________\nDe : Yannick Mandaba >\nEnvoy : vendredi 14 octobre 2016 16:48:21\n : maryvonne masseron-mandaba\nObjet : Re: arrive BKK\n\n\nSi tu prends le taxi fais direct de l aroport. C'est la fin du parcours qui sera embouteill. Tu ne gagnes rien  crapahuter.\n\nNous serons dans le nouvel appart des ce dimanche. 3 me tage, numro 3. Not 28/3 sur la porte.\nDe l'ascenseur tourne  gauche, puis ce sera une porte sur ta gauche milieu de couloir.\nPetit mais propre.\nTristan s'y plait il connat dj il dit 'on va dans la nouvelle maison ascenseur 3 numro 3'\n\nOn Oct 14, 2016 23:23, \"maryvonne masseron-mandaba\" > wrote:\n\narrive BKK le 19 octobre vers 16h\n\nje me rendrai seule en ville, BTS puis taxi.\n\ndpart BKK le 31 octobre vers 11h\n\nje partirai en taxi vers 7:30.\n\nJ'espre que votre dmnagement se passe bien.\n\nNous avons appris la mort du Roi de Thalande.\n\nm"
}