{
  "year": 2016,
  "seq": 8,
  "meta": {
    "date": "2016-02-14",
    "from": "maryvonne masseron-mandaba <maryvonnemm@hotmail.com>",
    "to": "\"y.mandaba@gmail.com\" <y.mandaba@gmail.com>, Marc Mandaba",
    "subject": "intÃ©ressant +++"
  },
  "proposals": [],
  "raw_excerpt": "ğŸ—• Date : 2016-02-14\nğŸ‘¤ From : maryvonne masseron-mandaba <maryvonnemm@hotmail.com>\nğŸ“¨ To   : \"y.mandaba@gmail.com\" <y.mandaba@gmail.com>, Marc Mandaba\n\t<marcmandaba@hotmail.com>\nğŸ§• Subject : intÃ©ressant +++\n---\nhttp://positiveeconomy.co/fr/construire-un-monde-positif-a-lhorizon-2030/\nintressant dans l'esprit de la pense collaborative et positive,et par la liste des experts dont nous pouvons consulter les ouvrages,et par l'ide de mettre ce document  disposition des citoyens , des collectivits, et du prochain prsident, quel qu'il soit...\nJ'espre que tout se passera dans le calme et la transparence  Bangui,Touadera semble en bonne position, du fait du report des voix de 27 des ex-candidats,mais cela est-il significatif dans un pays avec peu de traditions dmocratiques \" l'occidentale\", et avec d'autres traditions peut-tre tout aussi respectables, sauf le npotisme...\nbonne journeje vais  Vitrm"
}