{
  "year": 2016,
  "seq": 42,
  "meta": {
    "date": "2016-07-29",
    "from": "<maryvonnemm@hotmail.com>",
    "to": "Yannick Mandaba <y.mandaba@gmail.com>",
    "subject": "Fwd: RE: 9 rue pergolese Paris 16"
  },
  "proposals": [
    {
      "index": -42,
      "etiquette": "Appartement PergolÃ¨se (vente/location)",
      "category": "MIN",
      "duration": "LT",
      "source": "AI",
      "score": 1,
      "matched_from": [
        "ai_new"
      ]
    }
  ],
  "raw_excerpt": "ğŸ—• Date : 2016-07-29\nğŸ‘¤ From : <maryvonnemm@hotmail.com>\nğŸ“¨ To   : Yannick Mandaba <y.mandaba@gmail.com>\nğŸ§• Subject : Fwd: RE: 9 rue pergolese Paris 16\n---\nNon, ce n'est pas exactement cela\n\n Quand quelqu'un sonne en bas, Ã  son appartement, chacun est libre d'ouvrir ou non, selon qu'il reconnaÃ®t la personne ou pas. \n\nNotre locataire trouve que audio est suffisant. Voir le mail envoyÃ© par charbel Braidy.Â  Et ma reponse. De plus cette entreprise est chÃ¨re. Ã€ Rennes, pour vidÃ©o, cela m'a coÃ»tÃ© moins deÂ  200 E. J'attends votre consensus. \n\n Bonne soirÃ©e \n\n\n\nDeÂ : Yannick Mandaba\n\nEnvoyÃ©Â : vendredi 29 juillet 21:20\n\nObjetÂ : RE: 9 rue pergolese Paris 16\n\nÃ€Â : maryvonne masseron-mandaba\n\nCcÂ : marcmandaba\n\n\n\nIl suffit qu'un seul proprio choisisse audio pour que le niveau de sÃ©curitÃ© de l'ensemble soit diminuÃ©.\n\nIl fallait sue le syndic fasse un choix unique.\n\nDonc prenons audio. \n\nY\n\n\n\nOn Jul 29, 2016 03:27, \"maryvonne masseron-mandaba\"  wrote:\n\n\nYannick, Marc,\n\n\nque voulez-vous que nous choisissions ?\n\n\ninterphone vidÃ©o ( c'est ce que j'ai pris pour Rennes, c'est pratiqueÂ ), ou interphone audio seulement ?\n\n\nVoir les prix sur le mail du syndic.\n\n\nRÃ©ponse urgente.\n\n\nMerci\n\n\nFrom: nicolas.lanno@ceca-immobilier.fr\n\nTo: maryvonnemm@hotmail.com\n\nSubject: 9 rue pergolese Paris 16\n\nDate: Thu, 28 Jul 2016 16:57:00 +0200\n\n\nMadame,\n\n\nÂ \n\n\nFaisant suite Ã  notre conversation tÃ©lÃ©phonique,\n\n\nÂ \n\n\nPouvez â€“vous me dire si vous souhaitez un poste audio ou vidÃ©o dans votre appartement ,\n\n\nÂ \n\n\nPrix unitaireÂ :Â Â Â Â Â  Poste VidÃ©oÂ : 295 â‚¬ HT (tva 10%)\n\n\nÂ Â Â Â Â Â Â Â Â Â Â Â Â Â Â Â Â Â Â Â Â Â Â Â Â Â Â Â Â  Poste AudioÂ : 89 â‚¬ HT (tva 10%)\n\n\nÂ \n\n\nMerci de votre retour ,\n\n\nÂ \n\n\nCordialement,\n\n\nÂ \n\n\nÂ \n\n\nNicolas Lanno\n\n\nGestionnaire\n\n\nCeca Immobilier\n\n\nÂ \n\n\nÂ \n\n\nhttp://ceca-immobilier.fr"
}