{
  "year": 2016,
  "seq": 6,
  "meta": {
    "date": "2016-02-01",
    "from": "maryvonne masseron-mandaba <maryvonnemm@hotmail.com>",
    "to": "BeeBaa <beebeau89@gmail.com>, \"y.mandaba@gmail.com\" <y.mandaba@gmail.com>",
    "subject": "Ã  bien traduire pour Bee, voyage mars 2016"
  },
  "proposals": [],
  "raw_excerpt": "ðŸ—• Date : 2016-02-01\nðŸ‘¤ From : maryvonne masseron-mandaba <maryvonnemm@hotmail.com>\nðŸ“¨ To   : BeeBaa <beebeau89@gmail.com>, \"y.mandaba@gmail.com\" <y.mandaba@gmail.com>\nðŸ§• Subject : Ã  bien traduire pour Bee, voyage mars 2016\n---\nbonsoir,j'avais rserv il y a longtemps ce vol pour bkk, pour aller  un congrs en Chine, du 3 au 7 mars.Cependant, si vous en tes d'accord, je peux rester avec vous tout mon sjour, chez vous ou bien  l'hotel.Mon vol arrive est le 29 fvrier  11h35 ( qatar airways en provenance de Doha )Mon vol retour est le 15 mars  8h35 ( qatar airways vers Doha)J'ai eu un prix intressant (420 e)Mon objectif est m'occuper de Tristan , vous aider  mettre les limites, calmer les angoisses de sparation.Aussi les soins dentaires de Yannick, que je veux faire en totalit, car sa prsentation est vraiment \"moche\".Aprs je ne viendrai plus, car ma retraite vient d'tre value  1000 euros par mois, ce qui est trs peu.Je n'ai pas trouv de travail pour ce semestre.Donnez-moi votre rponse.Merci.Je vous embrassem"
}