{
  "year": 2016,
  "seq": 12,
  "meta": {
    "date": "2016-03-09",
    "from": "Yannick Mandaba <y.mandaba@gmail.com>",
    "to": "christophe galian <christophegalian@centre-acacia.com>",
    "subject": "Inscription Tristan Mandaba"
  },
  "proposals": [],
  "raw_excerpt": "ðŸ—• Date : 2016-03-09\nðŸ‘¤ From : Yannick Mandaba <y.mandaba@gmail.com>\nðŸ“¨ To   : christophe galian <christophegalian@centre-acacia.com>\nðŸ§• Subject : Inscription Tristan Mandaba\n---\nBonsoir,\n\nMerci pour cette deuxieme entrevue.\nNous souhaitons proceder le plus vite possible a l inscription de Tristan\npour septembre 5j/semaine.\nInscription et paiement immmediat du premier trimestre.\n\nLe formulaire en piece jointe sera depose demain dans sa version originale.\nMerci d envoyer facture et RIB par email. Premier paiement en cash, les\nsuivants par virement.\n\nPour la \"prepa\" du 25 avril au 30 juin nous reflechissons peut-etre\ncommencer meme avant cela. La priorite etant de securiser une place a la\nrentree, nous voulons commencer par cela.\n\nMerci. Cordialement.\n\nYannick Mandaba\nCondominium \"Fortynine plus two\"\n98/28 Sukhumvit soi 49\nKlong Tan Nua, Wattana,\n10110 Bangkok\nThailand\n+66 8 7820 0622"
}