{
  "year": 2016,
  "seq": 43,
  "meta": {
    "date": "2016-07-30",
    "from": "maryvonne masseron-mandaba <maryvonnemm@hotmail.com>",
    "to": "\"y.mandaba@gmail.com\" <y.mandaba@gmail.com>",
    "subject": "RE: 9 rue pergolese Paris 16"
  },
  "proposals": [
    {
      "index": -43,
      "etiquette": "Appartement PergolÃ¨se (vente/location)",
      "category": "MIN",
      "duration": "LT",
      "source": "AI",
      "score": 1,
      "matched_from": [
        "ai_new"
      ]
    }
  ],
  "raw_excerpt": "ðŸ—• Date : 2016-07-30\nðŸ‘¤ From : maryvonne masseron-mandaba <maryvonnemm@hotmail.com>\nðŸ“¨ To   : \"y.mandaba@gmail.com\" <y.mandaba@gmail.com>\nðŸ§• Subject : RE: 9 rue pergolese Paris 16\n---\nYannick,tu n'as pas lu la pice jointe=le locataire nous a joint tous les documents affichs=il pense que AUDIO suffit , il attend qq'un, quand il a entendu la personne parler dans l'interphone, il ouvre la gachette; en VIDEO, il trouve que cela n'apporte rien de plus ! et c'est trs cher ! (  Rennes je l'ai pris car c'est pour moi, et quand j'aurai des employes en fonction de mon vieil ge, cela sera une scurit...Et  Rennes ce n'tait pas aussi cher )Nous esprons tous que cette solution va nous librer des Dos Santos concierges  vie et nervants, devenus copropritaires ...\n\nDate: Sat, 30 Jul 2016 12:59:48 +0700\nSubject: Re: Fwd: RE: 9 rue pergolese Paris 16\nFrom: y.mandaba@gmail.com\nTo: maryvonnemm@hotmail.com\n\nOui c'est bien a que je dis.\n\nMais bon il y a une camra dj dissuasif.\n\nAprs sentiment de confort de voir la tte des gens avant d'ouvrir la porte mais c'est pour le locataire. On peut lui demander s'il veut payer 100eur pour avoir la camera....\n\n\n\nOn Jul 30, 2016 02:41,   wrote:\nNon, ce n'est pas exactement cela\n\n Quand quelqu'un sonne en bas,  son appartement, chacun est libre d'ouvrir ou non, selon qu'il reconnat la personne ou pas. \n\nNotre locataire trouve que audio est suffisant. Voir le mail envoy par charbel Braidy.  Et ma reponse. De plus cette entreprise est chre.  Rennes, pour vido, cela m'a cot moins de  200 E. J'attends votre consensus. \n\n Bonne soire \n\nDe : Yannick Mandaba\n\nEnvoy : vendredi 29 juillet 21:20\n\nObjet : RE: 9 rue pergolese Paris 16\n\n : maryvonne masseron-mandaba\n\nCc : marcmandaba\n\nIl suffit qu'un seul proprio choisisse audio pour que le niveau de scurit de l'ensemble soit diminu.\n\nIl fallait sue le syndic fasse un choix unique.\n\nDonc prenons audio. \n\nY\n\nOn Jul 29, 2016 03:27, \"maryvonne masseron-mandaba\"  wrote:\nYannick, Marc,\nque voulez-vous que nous choisissions ?\ninterphone vido ( c'est ce que j'ai pris pour Rennes, c'est pratique ), ou interphone audio seulement ?\nVoir les prix sur le mail du syndic.\nRponse urgente.\nMerci\nFrom: nicolas.lanno@ceca-immobilier.fr\n\nTo: maryvonnemm@hotmail.com\n\nSubject: 9 rue pergolese Paris 16\n\nDate: Thu, 28 Jul 2016 16:57:00 +0200\nMadame,\n \nFaisant suite  notre conversation tlphonique,\n \nPouvez vous me dire si vous souhaitez un poste audio ou vido dans votre appartement ,\n \nPrix unitaire :      Poste Vido : 295  HT (tva 10%)\n                              Poste Audio : 89  HT (tva 10%)\n \nMerci de votre retour ,\n \nCordialement,\n \n \nNicolas Lanno\nGestionnaire\nCeca Immobilier\n \n \nhttp://ceca-immobilier.fr"
}