{
  "year": 2016,
  "seq": 3,
  "meta": {
    "date": "2016-01-06",
    "from": "maryvonne masseron-mandaba <maryvonnemm@hotmail.com>",
    "to": "BeeBaa <beebeau89@gmail.com>, \"y.mandaba@gmail.com\" <y.mandaba@gmail.com>",
    "subject": "photos"
  },
  "proposals": [],
  "raw_excerpt": "ğŸ—• Date : 2016-01-06\nğŸ‘¤ From : maryvonne masseron-mandaba <maryvonnemm@hotmail.com>\nğŸ“¨ To   : BeeBaa <beebeau89@gmail.com>, \"y.mandaba@gmail.com\" <y.mandaba@gmail.com>\nğŸ§• Subject : photos\n---\nMerci Ã  vous deux pour les belles photos,\nJe ne comprenais pas pourquoi je ne recevais rien,\nJâ€™ai tellement souffert dâ€™aller deux fois par an Ã  Istanbul, et ne pas voir les petitsâ€¦\nEt aussi de passer beaucoup de temps avec mamie et jeannette, et tous leurs problÃ¨mes â€¦\nMaintenant , je sais que je perds la tÃªte, et si vous voulez bien mâ€™accueillir de temps en temps, cela ira mieux.\nJâ€™ai la haine de ceux qui nâ€™ont pas lâ€™intelligence Â«Â du cÅ“urÂ Â», comme Armelle et HervÃ©,\nLes autres , câ€™est zÃ©ro, leur langue ne parle que dâ€™argentÂ !\nIls me font beaucoup de malÂ !\nA NoÃ«l, quand jâ€™ai eu couchÃ© Jeannette Ã  22h, jâ€™ai envoyÃ© un sms pour dire que je les rejoindrais bien pour une Ã  deux heures, pas de rÃ©ponseÂ !!! le lendemain on mâ€™a dit que tous les portables Ã©taient restÃ©s en haut.\nSamedi Gilbert est aller faire son inspection chez Jeannette, pour tout critiquer, alors que je suis la tutrice, le dimanche il Ã©tait absent quand maman a crisÃ© pour ne pas mettre son dentier, et jâ€™ai dÃ» faire le trajet depuis RennesÂ !\nEt il dit partout quâ€™il est le seul prÃ©sent, Ã  sâ€™occuper de mamanÂ !\nJâ€™en ai marre de la mÃ©chancetÃ© ++++\nJe vais maintenant voir les films sur mym\nProvenanceÂ : Courrier pour Windows 10"
}