{
  "year": 2016,
  "seq": 7,
  "meta": {
    "date": "2016-02-10",
    "from": "maryvonne masseron-mandaba <maryvonnemm@hotmail.com>",
    "to": "\"y.mandaba@gmail.com\" <y.mandaba@gmail.com>",
    "subject": "RE: R.I.B Bangkok Bank Yannick Perso"
  },
  "proposals": [],
  "raw_excerpt": "ðŸ—• Date : 2016-02-10\nðŸ‘¤ From : maryvonne masseron-mandaba <maryvonnemm@hotmail.com>\nðŸ“¨ To   : \"y.mandaba@gmail.com\" <y.mandaba@gmail.com>\nðŸ§• Subject : RE: R.I.B Bangkok Bank Yannick Perso\n---\nyannick,bien reu les rfrences du compte;\npour Bee : ne pas oublier de rserver pour moi 10 cours de danse, au BANGKOK CITY BALLET, niveau avanc, ( pas niveau professionnel, ni pr-professionnel ), les lundi mardi mercredi jeudi vendredi,  partir du mardi 1 er jusqu'au lundi 14 mars , demander un tarif spcial pour 10 cours. J'en ai besoin , car malade depuis un mois, donc trs peu de danse. Demander aussi les horaires. Comme c'est tout prs, je ne perds pas de temps en transport, s'il faut prendre la nounou en plus, je la paierai, si toutefois elle n'a pas d'autres obligations;  j'aimerais aussi que Tristan, si c'est accept, vienne regarder 10 mn de dbut de cours, ou de fin de cours, une ouverture pour lui, la musique et les mouvements du corps. ( au mme ge, j'avais amen La voir un cours  Tunis, elle tait reste 2 heures sans bouger, et avait mmoris tous les exercices ) . Pour Tristan toujours, on peut aller visiter l'cole o il va rentrer en septembre ?\n- mon sjour ( si vous tes d'accord ) , arrive par Qatar= lundi 29  11h35 ( je viendrai par le BTS, jusqu'au plus prs possible sans escaliers, puis taxi, ne vous souciez pas pour moi ) ,dpart par Qatar=  le 15 mars  8h35 ( je partirai en taxi, comme la dernire fois , vers 6h00 ) .\nbisousm\n\nDate: Wed, 10 Feb 2016 11:17:31 +0700\nSubject: R.I.B Bangkok Bank Yannick Perso\nFrom: y.mandaba@gmail.com\nTo: maryvonnemm@hotmail.com; mymmandaba@gmail.com\n\nAccount\nName: Mr. Yannick, Yves, Sala-kosso Mandaba\n\nAccount\nNumber: 118-5-127121\n\nBank/Branch:\nBangkok Bank PCL, Head Office\n\nBank Address:\n333, Silom Road, Bangkok 10500, Thailand\n\nSWIFT Code\n(BIC): BKKBTHBK\n\nIBAN\nCode: BKKBTHBK118-5127121\n-- \nYannick Mandaba\nMobile: +66.782.00.622"
}