{
  "year": 2016,
  "seq": 41,
  "meta": {
    "date": "2016-07-28",
    "from": "maryvonne masseron-mandaba <maryvonnemm@hotmail.com>",
    "to": "\"y.mandaba@gmail.com\" <y.mandaba@gmail.com>, Marc Mandaba",
    "subject": "RE: 9 rue pergolese Paris 16"
  },
  "proposals": [
    {
      "index": -41,
      "etiquette": "Appartement PergolÃ¨se (vente/location)",
      "category": "MIN",
      "duration": "LT",
      "source": "AI",
      "score": 1,
      "matched_from": [
        "ai_new"
      ]
    }
  ],
  "raw_excerpt": "ðŸ—• Date : 2016-07-28\nðŸ‘¤ From : maryvonne masseron-mandaba <maryvonnemm@hotmail.com>\nðŸ“¨ To   : \"y.mandaba@gmail.com\" <y.mandaba@gmail.com>, Marc Mandaba\n\t<marcmandaba@hotmail.com>\nðŸ§• Subject : RE: 9 rue pergolese Paris 16\n---\nYannick, Marc,que voulez-vous que nous choisissions ?interphone vido ( c'est ce que j'ai pris pour Rennes, c'est pratique ), ou interphone audio seulement ?Voir les prix sur le mail du syndic.Rponse urgente.Merci\n\nFrom: nicolas.lanno@ceca-immobilier.fr\nTo: maryvonnemm@hotmail.com\nSubject: 9 rue pergolese Paris 16\nDate: Thu, 28 Jul 2016 16:57:00 +0200\n\n\nMadame, Faisant suite  notre conversation tlphonique, Pouvez vous me dire si vous souhaitez un poste audio ou vido dans votre appartement , Prix unitaire :      Poste Vido : 295  HT (tva 10%)                              Poste Audio : 89  HT (tva 10%) Merci de votre retour , Cordialement,  Nicolas LannoGestionnaireCeca Immobilier  http://ceca-immobilier.fr"
}