{
  "year": 2016,
  "seq": 60,
  "meta": {
    "date": "2016-12-02",
    "from": "maryvonne masseron-mandaba <maryvonnemm@hotmail.com>",
    "to": "Leone MEFFRAY <meffrayl@wanadoo.fr>",
    "subject": "salaires employÃ©es de Jeanne BONHOMME pour Novembre 2106"
  },
  "proposals": [
    {
      "index": -60,
      "etiquette": "Paiement salaires atelier",
      "category": "MIN",
      "duration": "LT",
      "source": "AI",
      "score": 1,
      "matched_from": [
        "ai_new"
      ]
    }
  ],
  "raw_excerpt": "ðŸ—• Date : 2016-12-02\nðŸ‘¤ From : maryvonne masseron-mandaba <maryvonnemm@hotmail.com>\nðŸ“¨ To   : Leone MEFFRAY <meffrayl@wanadoo.fr>\nðŸ§• Subject : salaires employÃ©es de Jeanne BONHOMME pour Novembre 2106\n---\nbonjour, madame,\nveuillez trouver ci-jointes les dclarations de salaires des employes de ma tante pour le mois de Novembre 2016,\nj'ai effectu de mon compte , hier, un virement de 3000 euros , pour faire face  la masse salariale ,\n( 3190 euros ),\nLes autres dpenses, charges sociales, frais de la maison, pourront tre assurs par la retraite, l'APA, et les loyers, ( environ 2000 euros )\nVeuillez me confirmer que la maison , rue Ducoudray, sera bien vendue avant la fin de l'anne.\nJe vous remercie.\nMaryvonne masseron mandaba\n\n\ntat de mes dclarations au 01/12/2016\n\n\n\nRcapitulatif des salaires dclars et des cotisations dues pour l 'anne fiscale 2016 :\nSalaires :      37580 EUR\nCotisations :   18003 EUR\nTotal : 55583 EUR\n\n\n\n[https://www.cesu.urssaf.fr/images/cesweb/filet_orange.jpg]\n\nDclarations en cours de traitement :   [https://www.cesu.urssaf.fr/images/cesweb/inter.gif]\n\nRfrence       Date de saisie  Personne employe       Priode d'emploi        Heures dclares        Total net pay\n216337A53237    02/12/2016      BEUNEUX\nJEANNE  du 01/11/2016\nau 30/11/2016   65      650.00 EUR\n216337A53296    02/12/2016      BODIN\nMARIE   du 01/11/2016\nau 30/11/2016   66      660.00 EUR\n216337A53356    02/12/2016      GARNIER\nCLAUDE  du 01/11/2016\nau 30/11/2016   19      190.00 EUR\n216337A53442    02/12/2016      HERVAGAULT\nTHERESE         du 01/11/2016\nau 30/11/2016   47      470.00 EUR\n216337A53594    02/12/2016      PRATAS\nMARIA   du 01/11/2016\nau 30/11/2016   61      610.00 EUR\n216337A53524    02/12/2016      MOREAU\nMARTINE         du 01/11/2016\nau 30/11/2016   59      590.00 EUR\n\n[https://www.cesu.urssaf.fr/images/cesweb/filet_orange.jpg]\n\n\n[Dtail de la dclaration]      :       Dtail de la"
}