{
  "year": 2016,
  "seq": 21,
  "meta": {
    "date": "2016-05-15",
    "from": "maryvonne masseron-mandaba <maryvonnemm@hotmail.com>",
    "to": "\"y.mandaba@gmail.com\" <y.mandaba@gmail.com>",
    "subject": "dÃ©ception"
  },
  "proposals": [],
  "raw_excerpt": "ðŸ—• Date : 2016-05-15\nðŸ‘¤ From : maryvonne masseron-mandaba <maryvonnemm@hotmail.com>\nðŸ“¨ To   : \"y.mandaba@gmail.com\" <y.mandaba@gmail.com>\nðŸ§• Subject : dÃ©ception\n---\nyannick,je suis dsole de te dire que l'attitude de Bee me doit.Elle veut avoir raison  tout prix, mme si elle a fait des erreurs.Elle a des angoisses irraisonnes, les virus avec fivre du jeune enfant sont frquents. (51 adnovirus).Sa motivation pour la scolarit de Tristan est nulle, elle a gch ses chances d'une bonne intgration .Si elle ne connait pas le systme, elle peut demander avant de faire des btises. Les institutrices ont compris qu' la maison il n'y a aucune discipline.Tristan la manipule comme il veut. C'est un enfant-roi. Il est entrain de se dvoyer. Il est intelligent, c'est dommage !. Comme nous en avons convenu, Tristan ira  l'cole le matin, pour une semaine. Puis nous aviserons.Si elle trouve des prtextes pour ne pas l'amener  l'cole, tu dois tre ferme, et aller toi-mme l'y conduire.Les enfants prfrent les parents qui mettent la fermet, car il y a un cadre; l'absence de limites rend \"fou\".Le directeur de l'cole connait son travail, et a souhait une priode d'adaptation, avant la rentre de septembre.Je ne souhaite pas qu'elle vienne s'occuper de Jeannette, qui est une personne duque et intuitive.Suis  votre disposition, pour venir quand vous voulez, Tristan est la personne la plus importante en ce moment.maman"
}