{
  "year": 2011,
  "seq": 2,
  "meta": {
    "date": "2011-12-13",
    "from": "maryvonne masseron-mandaba <maryvonnemm@hotmail.com>",
    "to": "<y.mandaba@gmail.com>",
    "subject": "RE: CARTE VISA"
  },
  "proposals": [
    {
      "index": -2,
      "etiquette": "Visa / immigration",
      "category": "MIN",
      "duration": "LT",
      "source": "AI",
      "score": 1,
      "matched_from": [
        "ai_new"
      ]
    }
  ],
  "raw_excerpt": "ðŸ—• Date : 2011-12-13\nðŸ‘¤ From : maryvonne masseron-mandaba <maryvonnemm@hotmail.com>\nðŸ“¨ To   : <y.mandaba@gmail.com>\nðŸ§• Subject : RE: CARTE VISA\n---\nok\n From: y.mandaba@gmail.com\nTo: maryvonnemm@hotmail.com\nSubject: CARTE VISA\nDate: Tue, 13 Dec 2011 18:48:52 +0700\n\n\n\n Maman, Jai besoin de ractiver la carte Visa car des clients ne veulent pas payer par transfert.Il faut que tu tires une somme minime car la carte na pas t utilise depuis trop longtemps.Cest une mesure de scurit. Je dois lenregistrer sur Verisign afin que les clients puissent me payer sur la France par carte bleue.Il y a un retrait de 2 Euros par Verisign,  juste pour vrifier que je suis bien le propritaire de la carte.Le service sert uniquement  recevoir des paiements par carte ce nest pas pour payer. Donc il faut que tu prennes ma carte et que tu retires une somme modique.Attention il faut laisser au moins quelques euros pour que Verisign puisse faire le retrait de vrification de 2 euros. Bisous , Yannick"
}