{
  "year": 2018,
  "seq": 57,
  "meta": {
    "date": "2018-06-29",
    "from": "maryvonne masseron-mandaba <maryvonnemm@hotmail.com>",
    "to": "\"Yannick Mandaba (pro)\" <y.mandaba@gmail.com>",
    "subject": "Re: assurance"
  },
  "proposals": [],
  "raw_excerpt": "ðŸ—• Date : 2018-06-29\nðŸ‘¤ From : maryvonne masseron-mandaba <maryvonnemm@hotmail.com>\nðŸ“¨ To   : \"Yannick Mandaba (pro)\" <y.mandaba@gmail.com>\nðŸ§• Subject : Re: assurance\n---\nOK, 1300 euros, encore pour les vacances de madame.\nTu sais que je n'aime pas payer pour rien !\nEntre nous, j'avais analys le document de l'assurance, et... pas convainquant ! Juste pour avoir des fonds.\nC'est la dernire fois, que je renfloue ton compte. D'autant plus que madame a plus de moyens que moi. Et doit, soit travailler, soit diminuer son train de vie, pour assumer ses choix de vie.\nJe croyais t'avoir dit dj que je tolrais de payer certaines factures pour Tristan, en virant directement de mon compte, vers ses fournisseurs, mais pas d'envoyer des sous dans votre puits sans fond.\nM\n\n\nTlcharger Outlook pour Android\n\n________________________________\nFrom: Yannick Mandaba (pro) \nSent: Friday, June 29, 2018 6:40:55 AM\nTo: 'maryvonne masseron-mandaba'\nSubject: assurance\n\nBonjour maman, je tai envoy un whatsapps hier.\nPour te dire que jai grand besoin de laide que tu as propos le mois dernier 1,300 euro pour lassurance de Tristan.\nJe lai serte paye mais en me mettant en mauvaise situation pour dautre dpenses.\n\nPourrais-tu faire leffort de faire aujourdhui Vendredi un virement ?\nMerci de me dire  si oui ou non tu veux/peux le faire et  quand cest fait jai besoin de savoir aujourdhui.\n\nBisous."
}