{
  "year": 2018,
  "seq": 55,
  "meta": {
    "date": "2018-06-22",
    "from": "maryvonne masseron-mandaba <maryvonnemm@hotmail.com>",
    "to": "Yannick Mandaba <y.mandaba@gmail.com>",
    "subject": "Re: de maman"
  },
  "proposals": [],
  "raw_excerpt": "ðŸ—• Date : 2018-06-22\nðŸ‘¤ From : maryvonne masseron-mandaba <maryvonnemm@hotmail.com>\nðŸ“¨ To   : Yannick Mandaba <y.mandaba@gmail.com>\nðŸ§• Subject : Re: de maman\n---\nJe t'ai achet en France, et amen  Bangkok un clavier AZERTY.\n\nTlcharger Outlook pour Android\n\n________________________________\nFrom: Yannick Mandaba \nSent: Friday, June 22, 2018 1:23:54 PM\nTo: maryvonne masseron-mandaba\nSubject: Re: de maman\n\nMon clavier anglais n'a pas d'accents. La grammaire reste correcte, je ne pense pas qu'on me prenne pour un analphabte.\n\nBisous.\n\nYannick Mandaba\n+66878200622\n\nOn Fri, Jun 22, 2018, 17:48 maryvonne masseron-mandaba > wrote:\n\nyannick,\n\n1 - ton courrier comprend trop de fautes de franais,\n\nnervant pour moi,\n\net pour le monsieur Felix,\n\nil a raison de ne pas donner suite...\n\nPourquoi ne pas reprendre l'ancien courrier que tu avais rdig ?  adresser au nouveau responsable, disons dans un mois.\n\n2 - Bee m'envoie 7 pages en pdf ( dossier acacia ) sur WhatsApp, je ne peux l'ouvrir, car mmoire sature,\n\nqu'elle l'envoie sur maryvonnemm@hotmail.com\n\n3 - je vous avais fait un courrier  toi et Marc, concernant la succession de mamie, rdig sur mon nouveau smartphone, il n'est pas pass  cause d'une mauvaise connexion internet. Je vais le refaire.\n\nbisous\n\n\n[https://ipmcdn.avast.com/images/icons/icon-envelope-tick-green-avg-v1.png]     Garanti sans virus. www.avg.com"
}