{
  "year": 2018,
  "seq": 11,
  "meta": {
    "date": "2018-02-05",
    "from": "maryvonne masseron-mandaba <maryvonnemm@hotmail.com>",
    "to": "\"y.mandaba@gmail.com\" <y.mandaba@gmail.com>",
    "subject": "Maman Ã  Bangui"
  },
  "proposals": [],
  "raw_excerpt": "ðŸ—• Date : 2018-02-05\nðŸ‘¤ From : maryvonne masseron-mandaba <maryvonnemm@hotmail.com>\nðŸ“¨ To   : \"y.mandaba@gmail.com\" <y.mandaba@gmail.com>\nðŸ§• Subject : Maman Ã  Bangui\n---\nBonjour,\nTu avais oubli ton smartphone au bureau...\nJe n'ai pu te joindre.\nTu devais m'envoyer un double d'un mail  l'cole ?\nAs-tu rellement fait la prinscription ?\nDossier avec les documents de Tristan, de vraies photos d'identit....\nBee est-elle prte  le mettre  l'cole. ? Avec un vrai ramassage scolaire, tt chaque matin, et qui n'accepte aucune parent ?\nPersonnellement, je pense toujours que le mieux est que j'achte un petit appartement prs de l'cole pour un an, en attendant d'affiner le projet de maison, pour lequel je n'ai reu aucune proposition pratique, ni de prix, ni de gestion de la construction, ni de proprit pour Tristan.\nDe plus, le ramassage scolaire ne passe pas par l...\nLe but est : une trs bonne scolarit pour Tristan.\nLe reste m'est gal.\n\n\nTlcharger Outlook pour Android"
}