{
  "year": 2018,
  "seq": 117,
  "meta": {
    "date": "2018-09-14",
    "from": "maryvonne masseron-mandaba <maryvonnemm@hotmail.com>",
    "to": "\"maryonnemm@hotmail.com\" <maryonnemm@hotmail.com>, \"y.mandaba@gmail.com\"",
    "subject": "TR: Re : succession de Madame Marie Louise MASSERON"
  },
  "proposals": [
    {
      "index": -117,
      "etiquette": "Frais bus Tristan",
      "category": "MIN",
      "duration": "LT",
      "source": "AI",
      "score": 1,
      "matched_from": [
        "ai_new"
      ]
    }
  ],
  "raw_excerpt": "ðŸ—• Date : 2018-09-14\nðŸ‘¤ From : maryvonne masseron-mandaba <maryvonnemm@hotmail.com>\nðŸ“¨ To   : \"maryonnemm@hotmail.com\" <maryonnemm@hotmail.com>, \"y.mandaba@gmail.com\"\n\t<y.mandaba@gmail.com>, Marc MANDABA <marcmandaba@hotmail.com>,\n\t\"maryvonne.masseron@free.fr\" <maryvonne.masseron@free.fr>\nðŸ§• Subject : TR: Re : succession de Madame Marie Louise MASSERON\n---\nPour information\n\nMMM\n\n________________________________\nDe : JP A \nEnvoy : jeudi 30 aot 2018 09:30\n : 'maryvonne masseron-mandaba'; 'JP A'; ttranchevent@hotmail.fr; hma.pommerolle@free.fr; 'gilbert masseron'; Office Notarial de Me CHAUDET\nObjet : Re : succession de Madame Marie Louise MASSERON\n\n\nJean-Paul MASSERON\n\n06 12 20 32 41\njparmelle@yahoo.fr                                                       KK, le 30 Aot 2018\n\n\n                                                                                 Monsieur CHAUDET Dominique\n                                                                                 Etude CHAUDET Dominique\n                                                                                 Place Villajoyosa\n                                                                                 35500 VITRE\nEnvoi par mail \ndc.chaudet.35142@notaires.fr\n\n\nDossier MASSERON MLouise\n\n\n\nMonsieur,\n\nEn rponse  votre mail du 28/08/2018 relatif au calcul des droits de succession de ma Mre MASSERON Marie Louise,\nje vous donne mon accord pour faire procder, par commissaire-priseur,  linventaire mobilier  sur les sites :\n        de VITRE, 5, Bd des Rochers\n        du POULIGUEN, Rue des Grillons.\n\nRecevez, Monsieur, lexpression de mes sentiments distingus\n\n\n                Jean-Paul Masseron\n\n\n--------------------------------------------\nEn date de : Mar 28.8.18, Office Notarial de Me CHAUDET  a crit :\n\n Objet: succession de Madame Marie Louise MASSERON\n : \"'maryvonne masseron-mandaba'\" , \"'JP A'\" , ttranchevent@hotmail.fr, hma.pommerolle@free.fr, \"'gilbert masseron'\" \n Date: Mardi 28 aot 2018, 16h39\n\n\n Mesdames,Messieurs,\n  Je reviens vers vous\n dans le cadre de la succession de votre\n mre.\n  Comme voqu\n ensemble, jai sollicit des grances locatives des\n attestations de valeurs ; avec les priodes\n dabsence, je demeure dans\n lattente.Je ne manquerais pas,\n le cas chant, de relancer\n utilement.\n  Concernant un point\n relatif aux droits de succession, je vous avais expliqu le\n principe du forfait mobilier fiscal de 5% qui sapplique\n sur lactif. Il ne fait pas dbat sur le fait de le\n neutraliser par la production dun inventaire mobilier\n opposable  ladministration afin de relater la ralit\n de la valeur de lensemble du\n mobilier.Ce mobilier porte sur\n la boulevard des Rochers  Vitr et sur Le\n Pouliguen.Aprs change et\n rflexion avec lAdministration fiscale, lanciennet\n de linventaire existant (2000, soit 18 ans) ne sera pas\n recevable tant pour des questions de valeur en 2018\n (par rapport  2000) quen raison dabandon de biens ou\n mise au rebus.En consquence, il\n mapparat indispensable de dresser inventaire pour\n Vitr et le Pouliguen compte tenu des enjeux fiscaux, en\n prsence dun commissaire-priseur afin dviter toute\n remise en cause.Je peux solliciter des\n devis, mais cela ne devrait pas dpasser 3 000  en tout,\n au regard dune conomie certaine de droits de\n succession.\n  Je vous remercie de me\n confirmer vos accords afin de pouvoir caler une date ds\n septembre, notamment pour Le\n Pouliguen.\n  Bien \n vous.\n\n  ______________________\n  Dominique\n CHAUDET\n  - OFFICE\n NOTARIAL de la\n TREMOILLE\n -\n  Matre Dominique\n CHAUDET\n  BP 30204 - 35502\n VITREGPS Pl\n Villajoyosa02 99 75 01\n 34www.chaudet.notaires.fr\n\n  Les informations ou pices\n jointes contenues dans ce message sont tablies \n l'attention exclusive de ses destinataires. L'OFFICE\n NOTARIAL dcline toute responsabilit de ce message en cas\n de modification ou falsification. Non destinataire de ce\n message, merci de le dtruire et d'en avertir\n l'expditeur. This message and possibly any\n attachment contain privileged and confidential informa"
}