{
  "year": 2018,
  "seq": 6,
  "meta": {
    "date": "2018-09-06",
    "from": "maryvonne.masseron@free.fr",
    "to": "redaction.35142@notaires.fr",
    "subject": "Succession Marie Louise Masseron"
  },
  "proposals": [],
  "raw_excerpt": "üóï Date : 2018-09-06\nüë§ From : maryvonne.masseron@free.fr\nüì® To   : redaction.35142@notaires.fr\nüßï Subject : Succession Marie Louise Masseron\n---\nLA SOUSSIGNEE :\nPr√©noms, Nom, adresse, date et lieu de naissance ,\nMaryvonne Jeanine Julienne MASSERON, veuve de Jean-Luc MANDABA, non remari√©e,\nn√©e le 17 juin 1946 √† 35500 Vitr√©\ndemeurant 41, rue du Puits-Mauger √† 35000 Rennes\n \nAgissant en qualit√© d‚Äôayant droit √† la succession de : \nMadame Marie Louise Jeanne BONHOMME, en son vivant retrait√©e, veuve de Monsieur Ren√© Louis Stanislas MASSERON, demeurant √† VITRE (35500) 5 Boulevard des Rochers. N√©e √† VITRE (35500), le 9 juin 1914. D√©c√©d√©e √† VITRE (35500), le 9 juin 2018.\n \nMANDATENT EXPRESSEMENT Ma√Ætre Dominique CHAUDET √† VITRE  (Ille et Vilaine), La Tr√©moille, B.P. 30204 35502 VITRE cedex\nA l‚Äôeffet d'interroger les fichiers FICOBA et FICOVIE.\nLe fichier FICOBA recense la liste des √©tablissements financiers d√©tenant des comptes financiers de toute nature d√©tenus par des personnes physiques.\nLe fichier FICOVIE recense les contrats de capitalisation et d‚Äôassurance d‚Äôun montant sup√©rieur √† 7.500 euros ainsi que l‚Äôidentit√© des assur√©s. \n\nLa recherche sera √† effectuer sous les identit√©s\nMarie MASSERON\nMarie Louise MASSERON\nMarie-Louise MASSERON, identit√© usuelle, mais non correcte ( cf son compte bancaire, et les contrats de location ))\nMarie Louise Jeanne MASSERON\n \nElle donne d√®s √† pr√©sent toutes d√©charges √† cet effet aux responsables de ces √©tablissements.\n \nFait √†       Rennes\nLe 28 Aout 2018     \nmaryvonne masseron mandaba\nmaryvonnemm@hotmail.com\n\nmaryvonne masseron mandaba - 41 rue du puits-mauger  35000  rennes  0299302000  0680078113"
}