{
  "year": 2018,
  "seq": 91,
  "meta": {
    "date": "2018-08-16",
    "from": "maryvonne masseron-mandaba <maryvonnemm@hotmail.com>",
    "to": "\"Yannick Mandaba (pro) \" <y.mandaba@gmail.com>, BeeBaa",
    "subject": "RE: Summary / RÃ©sumÃ©"
  },
  "proposals": [
    {
      "index": -91,
      "etiquette": "Frais bus Tristan",
      "category": "MIN",
      "duration": "LT",
      "source": "AI",
      "score": 1,
      "matched_from": [
        "ai_new"
      ]
    }
  ],
  "raw_excerpt": "ðŸ—• Date : 2018-08-16\nðŸ‘¤ From : maryvonne masseron-mandaba <maryvonnemm@hotmail.com>\nðŸ“¨ To   : \"Yannick Mandaba (pro) \" <y.mandaba@gmail.com>, BeeBaa\n\t<beebeau89@gmail.com>\nðŸ§• Subject : RE: Summary / RÃ©sumÃ©\n---\nbonjour,\n\n\ntrop tard pour la commande par le Net,\n\nlimite 15 juin,\n\npar contre achat possible  l'Alliance Francaise, en y allant.\n\nPour la GSM trs peu de marriel demand,\n\npar contre, si admis en CP, aller  l'Alliance Francaise.\n\n\nJe me propose d'aller avec Bee pour l'accueil  l'cole le 30 juin,\n\ndans quelle liste veut-elle tre inscrite ?\n\naccueil en franais ? en anglais ? en Tha ?\n\n\nPrvoir les activits extra-scolaires,\n\nje propose la natation, la chorale,\n\nle foot ?\n\nles activits sont aprs les cours.\n\npour le piano, mieux vaut continuer avec sa prof tha ?\n\n\nJe relance la proposition d'acheter un petit appartement prs du lyce.\n\nJe vais me serrer la ceinture.\n\nSi il faut prvoir 1H30 de trajet chaque matin, c'est l'puisement garanti pour tous.\n\nOu location d'un petit studio  utiliser du lundi soir au vendredi matin.???\n\n\nA VOIR !!!\n\n________________________________\nDe : Yannick Mandaba (pro) \nEnvoy : mercredi 15 aot 2018 10:10:27\n : beebeau89@gmail.com; 'maryvonne masseron-mandaba'\nObjet : Summary / Rsum\n\n\n\n\nJai envoy les documents du LFIB qui sont importants.\n\nCertaines options sont passe mais bon :\n\n-        Ramassage scolaire (hors de prix)\n\n-        Thai renforc (je me mfie de la stigmatisation de cette classe, professeurs moins bons, etc). La France et sa diversite non assume quoi\n\n-        Fourniture de livres. Merci de voir pour moi (Bee et Maman).\n\n\n\nBises.\n\n\n\nI sent emails with important information.\n\nSome of the options are already passed and irrelevant by now, but still please consider this:\n\n-        Pickup bus\n\n-        Thai re-enforced class (carefull he could be with kids of low French level and teachers not as good as what the French-french will have.  BEWARE OF BIAS French system.\n\n-        Books and tools required.\n\n\n\nMy mum can buy some of the books in France. She will tell you what she found and what we should order. Maybe order ALL I dont think it will be much more expensive.\n\nYM"
}