{
  "year": 2018,
  "seq": 88,
  "meta": {
    "date": "2018-08-15",
    "from": "\"Yannick Mandaba \\(pro\\) \" <y.mandaba@gmail.com>",
    "to": "<administration@lfib.ac.th>,",
    "subject": "RE: [LFIB] / Documents pour l‚Äôinscription d√©finitive (rentr√©e septembre 2018) // pri√®re de nous les envoyer avant le 12 juillet 2018"
  },
  "proposals": [
    {
      "index": -88,
      "etiquette": "Frais d'√©cole / bus Tristan",
      "category": "MIN",
      "duration": "LT",
      "source": "AI",
      "score": 1,
      "matched_from": [
        "ai_new"
      ]
    }
  ],
  "raw_excerpt": "üóï Date : 2018-08-15\nüë§ From : \"Yannick Mandaba \\(pro\\) \" <y.mandaba@gmail.com>\nüì® To   : <administration@lfib.ac.th>,\n\t<secretariat.primaire@lfib.ac.th>\nüßï Subject : RE: [LFIB] / Documents pour l‚Äôinscription d√©finitive (rentr√©e septembre 2018) // pri√®re de nous les envoyer avant le 12 juillet 2018\n---\nBonjour,\n\n \n\nCi-joint le bulletin de note de Tristan Ren√© Sawad MANDABA, dont la pr√©-inscription est faite.\n\n \n\nVeuillez nous excuser d‚Äôavoir manqu√© l‚Äô√©ch√©ance du 12 Juillet.\n\nNous avons le bulletin de notes depuis fin Juin mais nous attendions le Certificat de Radiation et de passage pour fournir le dossier complet.\n\nOr il nous a √©t√© dit que pour le certificat de Radiation et de passage, le Centre ACACIA (branche Ekamai) correspondrait directement avec le LFIB.\n\n \n\nCentre Acacia \n\nwww.centre-acacia.com  \n\nTel : 02 249 1411 \n\nMobile : 062 849 9224\n\nemail : administrator@centre-acacia.com  \n\n \n\nLe cas √©ch√©ant merci de nous pr√©venir afin que nous allions chercher les documents originaux. \n\n \n\nCordialement,\n\n \n\nYannick Mandaba\n\n+66 8782 00 622\n\n \n\n \n\nFrom: Administration LFIB [mailto:thamon.s@lfib.ac.th] \nSent: Monday, July 9, 2018 12:04\nCc: Chuanphit Khamdee \nSubject: [LFIB] / Documents pour l‚Äôinscription d√©finitive (rentr√©e septembre 2018) // pri√®re de nous les envoyer avant le 12 juillet 2018\n\n \n\nSi vous avez d√©j√† envoy√© les documents pour l‚Äôinscription d√©finitive, merci de ne pas tenir compte de ce message. Tous les documents d'inscription peuvent nous √™tre envoy√©s par scan. Nous n'avons pas besoin des originaux. \n\nIl est n√©cessaire de scanner ces documents et les joindre obligatoirement √† la fiche de pr√©-inscription en pi√®ces attach√©es. Attention nous n‚Äôacceptons pas les documents simplement pris en photo. Si vous n‚Äôavez pas de scanner, veuillez nous envoyer les documents par la poste.\n\nIf you have already sent the documents for final registration, please ignore this message. All of the documents can be sent by scan, we don't need the original.\n\nIt is necessary to scan all the documents to be attached to the pre-registration form. Be careful, we don‚Äôt accept the photographed documents. If you don‚Äôt have a scanner, please send the documents by post.\n\n-----------------------------------------------\n\nMadame, Monsieur,\n\nAfin de compl√©ter le dossier d‚Äôinscription, il est indispensable de nous fournir les documents suivants :\n\n1.\tLe certificat de radiation (Exeat) (copie ou original) √† demander √† l‚Äô√©tablissement actuel, pour les √©l√®ves scolaris√©s dans le syst√®me scolaire fran√ßais (public, priv√© sous contrat, r√©seau AEFE).\n2.\tLe dossier scolaire :\n\nSecondaire : copies des bulletins du 1er, 2√®me et 3√®me trimestre 2017-2018. La d√©cision de passage devra appara√Ætre soit dans le bulletin du 3√®me trimestre, soit dans une fiche dialogue. \n\nPrimaire et maternelle : copies du livret d‚Äô√©valuation 2017-2018. La d√©cision de passage devra appara√Ætre dans le livret du 3√®me trimestre. (Veuillez envoyer directement les livrets scolaires √† l‚Äôassistante de l‚Äô√©cole primaire :   secretariat.primaire@lfib.ac.th )\n\nLa rentr√©e est le lundi 3 septembre 2018, nous ne pourrons pas accepter vos enfants en classe sans avoir re√ßu pr√©alablement les documents demand√©s et le r√®glement complet des droits de premi√®re d‚Äôinscription (DPI).\n\n*************************\n\nDear Sir or Madam,\n\nIn order to complete the inscription file, you need to provide the following documents:\n\n1.\tCertificate of resignation (Exeat), only if student comes from French system (copy)\n2.\tSchool report:\n\nFor Secondary: copies \"bulletins\" term 1, 2 and 3 of 2017-2018, accompanied by \"avis de passage\" (a report proving that the student has passed the previous level).\n\nFor Primary or Kindergarten, \"livret d'√©valuation\" of 2017-2018 (the evaluation report of 2017-2018), accompanied by \"avis de passage\" (a report proving that the student has passed the previous level, only if student comes from French system). Please send the report directly to the primary school service:   secretariat.primaire@lfib.ac."
}