{
  "year": 2018,
  "seq": 7,
  "meta": {
    "date": "2018-10-22",
    "from": "maryvonne.masseron@free.fr",
    "to": "\"Yannick Mandaba (Personnal)\" <y.mandaba@gmail.com>, marcmandaba@hotmail.com",
    "subject": "TRÂ : RE: SUCCESSION MASSERON Marie Louise - estimations biens immobiliers"
  },
  "proposals": [],
  "raw_excerpt": "ğŸ—• Date : 2018-10-22\nğŸ‘¤ From : maryvonne.masseron@free.fr\nğŸ“¨ To   : \"Yannick Mandaba (Personnal)\" <y.mandaba@gmail.com>, marcmandaba@hotmail.com\nğŸ§• Subject : TRÂ : RE: SUCCESSION MASSERON Marie Louise - estimations biens immobiliers\n---\nsuccesssion grand-mamie,\nmerci de vos avis et suggestions.\n\npour le 5 bd des rochers, et la fabrique,\nje pense demander un bornage selon l'ancienne configuration, lors de l'achat par votre arriÃ¨re grand-pÃ¨re J.B.Bonhomme:\n\ndemander Ã  remettre la partie de la fabrique nouvellement construite, aux dÃ©pends du jardin, annÃ©es 60, dans la propriÃ©tÃ© de la maison du 5 bd des rochers.\nmurer l'accÃ¨s entre l'ancienne fabrique, mur du bÃ¢timent principal en brique, et la nouvelle partie ( en blocs de ciments), qui pourrait devenir abri de jardin , et salle de jeu, \n ou bien  Ãªtre dÃ©truite, \n \nce qui agrandit le terrain, et Ã©loigne le risque de vis-Ã -vis, qui , du coup, dÃ©valorise la maison Ã  la vente. \n\n De plus la configuration initiale Ã©tait un mur borgne, avec 3 fenÃªtres, trÃ¨s en hauteur, sans battants, et en verre dÃ©poli. ( On peut le constater encore ).\n\n C'est une suggestion que je pense faire ( dans l'intÃ©rÃªt de tous ). S'ils ne l'acceptent pas, c'est qu'ils font exprÃ¨s de dÃ©valoriser, pour payer moins de frais de succession.\n\nJe vais vous faire des photos.\n\nJe ne vous implique pas, j'explique, et demande votre avis.\n\nmaman"
}