{
  "year": 2018,
  "seq": 53,
  "meta": {
    "date": "2018-06-18",
    "from": "maryvonne masseron-mandaba <maryvonnemm@hotmail.com>",
    "to": "\"y.mandaba@gmail.com\" <y.mandaba@gmail.com>",
    "subject": "de maman"
  },
  "proposals": [],
  "raw_excerpt": "ðŸ—• Date : 2018-06-18\nðŸ‘¤ From : maryvonne masseron-mandaba <maryvonnemm@hotmail.com>\nðŸ“¨ To   : \"y.mandaba@gmail.com\" <y.mandaba@gmail.com>\nðŸ§• Subject : de maman\n---\nCher Yannick,\nMerci de tes 3 messages, reus par Messenger. Merci du tmoignage lu par Laurence, et dpos dans le cercueil de ta mamie.\nLa crmonie  l'glise tait magnifique : orgue, Ave maria de Gounod \"a capella\",\nRmi portait la grande croix,\nMarc le crucifix de la chambre de mamie, Cline, Hlne, Solenn, Nathalie, les bougies,\nTous, les roses rouges.\nTmoignages de Gilbert, Stephane lu par Gilbert, Charlotte lu par Gilbert, Laurence, Marc, Rmi.\nMesse et bndictions par le pre sebillet.\nCimetire, avec deux laques.\nCollation  la grenouillre.\nJe t'embrasse.\nMaman\n\nTlcharger Outlook pour Android"
}