{
  "year": 2018,
  "seq": 31,
  "meta": {
    "date": "2018-04-14",
    "from": "maryvonne masseron-mandaba <maryvonnemm@hotmail.com>",
    "to": "\"y.mandaba@gmail.com\" <y.mandaba@gmail.com>, BeeBaa <beebeau89@gmail.com>",
    "subject": "TR: Confirmation de votre rÃ©servation : hotelF1 Roissy AÃ©roport CDG PN 2 No GHFLBRCC"
  },
  "proposals": [
    {
      "index": -31,
      "etiquette": "Dossier de bourse Tristan",
      "category": "MIN",
      "duration": "LT",
      "source": "AI",
      "score": 1,
      "matched_from": [
        "ai_new"
      ]
    }
  ],
  "raw_excerpt": "ðŸ—• Date : 2018-04-14\nðŸ‘¤ From : maryvonne masseron-mandaba <maryvonnemm@hotmail.com>\nðŸ“¨ To   : \"y.mandaba@gmail.com\" <y.mandaba@gmail.com>, BeeBaa <beebeau89@gmail.com>\nðŸ§• Subject : TR: Confirmation de votre rÃ©servation : hotelF1 Roissy AÃ©roport CDG PN 2 No GHFLBRCC\n---\nnuit du 28 au 29 dans tous les cas !!!\n\n________________________________\nDe : AccorHotels \nEnvoy : vendredi 13 avril 2018 07:55\n : maryvonnemm@hotmail.com\nObjet : Confirmation de votre rservation : hotelF1 Roissy Aroport CDG PN 2 No GHFLBRCC\n\n\n\n\nAvertissement : Cet e-mail de confirmation tant gnr de faon automatique, nous vous remercions de ne pas utiliser l'adresse d'origine de ce mail pour nous contacter. Pour toute consultation ou annulation de la rservation, merci de vous reporter  la rubrique Consultation / Annulation de notre site en utilisant le numro de confirmation ou de rservation prcis dans le-mail.\n\n\n\n\n\n[img]\n\n\n\nBonjour Docteur MASSERON,\n\n\nMerci d'avoir choisi le hotelF1 Roissy Aroport CDG PN 2 pour votre prochain sjour  ROISSY CHARLES DE GAULLE.\n\nNous avons le plaisir de vous communiquer ci-dessous les dtails de votre rservation.\n\nNous vous souhaitons un agrable sjour !\n\nCordialement,\nLe Service Clients AccorHotels\n\n\n\n\n\n\n[img]\n        [http://m.mid.accor-mail.com/barcode/tQRCode/h500/w500/eH/vR0hGTEJSQ0M=/barcode.gif]\n\n\n\nVotre rservation est confirme.\n\n\n\n\n\n\n\n\n\nNumro de rservation :         GHFLBRCC\n\n\nNumro de transaction : GHFLBRCC_0200000033534110PP\n\n\n\n\n\n\n\nDate du sjour :        Du 28/04/2018 au 29/04/2018\n\n\nVotre sjour :  1 chambre, 1 nuit\n        1 adulte, 0 enfant\n\n\n\n\n\n\n\n\nConservez bien le numro de rservation, il vous sera demand pour toute information lie  votre rservation.\n\n\n\n\n\n\n[ONLINE CHECK-IN]   ONLINE CHECK-IN\n\n\n\n\n\nConsulter\n\nAnnuler\n\nRserver\n\n\n\n\n\n\n\n\n[img]   Votre sjour\n\n\n\n[img]\n\n\nhotelF1 Roissy Aroport CDG PN 2\n\n\n\n\n\n335, rue de la Belle Etoile, ZAC Paris Nord 2, Roissy en France - Cedex\n95974 ROISSY CHARLES DE GAULLE - FRANCE\n\n\n\n[img]   Voir la carte\n\n\n\nTl : 33 891705436\nH3506@accor.com\n\n\n\n\n\n\nDcouvrir l'htel\n\n\n\n\n\n\n\n\n\n\nChambre\n\n\n\n\n\n\n\n\n\nRservation effectue au nom de : Docteur MARYVONNE MASSERON\n\nChambre TRIO pour 3 pers. maximum. Idale en famille, en couple ou entre amis.\n\n1 adulte , 0 Enfant\nUn lit double (150x200), un lit simple superpos, un espace \" brin de toilette \" avec lavabo et miroir, TV cran plat, connectique pour console, MP3... A 2 pas de la chambre, WC et douches spacieuses.\n\n\n\n\n\n\n\nTarif Anticip, Chambre uniquement\n\n\n\n\n36.00 EUR\n\n\n\n\n\n\nVos options\n\n\n\nSERVIETTE MICROFIBRE\n\n\n        1 x 3.00 EUR\n\n3.00 EUR\n\n\n\n\n\nPetit djeuner\n\n\n        1 x 4.00 EUR\n\n4.00 EUR\n\n\n\n\n\n\n\n\n\nMontant total du sjour\n\n\n\nMontant total TVA incluse\n\n\n\n\n\n\n43.00 EUR\n\n\n\n\nAutres taxes exclues\n\n\n\n\n\n\n0.88 EUR\n\n\n\n\nMONTANT TOTAL\n\n\n\n\n\n\n43.88 EUR\n\n\n\n\nVotre paiement\n\n\n\n        Montant prpay - 43.88 EUR\n\n        Montant restant  payer  l'htel       0.00 EUR\n\n\n\n\n\n\n\n\n\nGagnez du temps  votre arrive\n\n[http://t.accorhotels.com/img/2015/mail-confirmation/ico-online.jpg]        ONLINE CHECK-IN\n\n\n\n\n\n\n[http://t.accorhotels.com/img/gain/Gain600x160_fr.png]\n\n\n[http://t.accorhotels.com/img/AMC/TARS/banner_apps_d_fr.jpg]\n\n\n[http://t.accorhotels.com/img/watch/planet21_fr_600-2.png]\n\n\n[http://t.accorhotels.com/img/AMC/TARS/banner-tp-fr-600px.jpg]\n\n\n\nInformations pratiques\n\n\nImportant : Sauf spcificit locale du pays de sjour, cette demande de rservation ne peut pas engager lhtel sur une demande de titre, quel quil soit, auprs des autorits consulaires.\n\nExigences particulires\n\n\nSi vous avez des demandes spciales pour faciliter votre sjour (par exemple, l'assistance pour une personne handicape, un lit de bb, une chambre communicante, etc.), n'hsitez pas  contacter l'htel pour l'informer. Les quipes feront au mieux pour les satisfaire  votre arrive.\n\nGarantie\n\n\nAPOL PREPAYMENT\n\n\nConditions de vente\n\n\nLe prix indiqu est par chambre, pour le nombre de personnes et les dates pralablement slectionns, sauf indication contraire (prix fixes). Cependant, vous pourrez payer des taxes additionnelles  votre "
}