{
  "year": 2018,
  "seq": 62,
  "meta": {
    "date": "2018-07-04",
    "from": "maryvonne masseron-mandaba <maryvonnemm@hotmail.com>",
    "to": "\"y.mandaba@gmail.com\" <y.mandaba@gmail.com>",
    "subject": "par cesaria evora....... (suite)"
  },
  "proposals": [],
  "raw_excerpt": "ğŸ—• Date : 2018-07-04\nğŸ‘¤ From : maryvonne masseron-mandaba <maryvonnemm@hotmail.com>\nğŸ“¨ To   : \"y.mandaba@gmail.com\" <y.mandaba@gmail.com>\nğŸ§• Subject : par cesaria evora....... (suite)\n---\nBesame, besame mucho embrasse-moi, embrasse-moi fort\ncomo si fuera esta noche comme si c'Ã©tait cette nuit\nla ultima vez la derniÃ¨re fois\nbesame, besame mucho\nque tengo miedo tenerte que je te tiens\ny perderte despuÃ©s et je te perds ensuite\n\nBesame, besame mucho\ncomo si fuera esta noche\nla ultima vez\nÂ¡ay! bÃ©same, bÃ©same mucho\nque tengo miedo tenerte\ny perderte despuÃ©s\n\nQuiero tenerte muy cerca je veux te tenir proche de moi\nmirarme en tus ojos, verte junto a mi me regarder dans tes yeux, te voir Ã  cÃ´tÃ© de moi\npiensa que tal ves maÃ±ana ya (se prononce \"magnana\"\nestarÃ© lejos muy lejos de aquÃ­\n\nBesame, besame mucho\ncomo si fuera esta noche\nla ultima vez\nbesame, besame mucho\nque tengo miedo tenerte\ny perderte despuÃ©s\nbesame, besame mucho... ce n'est pas une critiqueâ€¦ mais il doit apprendre \"tout parfait\", car il le peut bisous j'aimerais Ãªtre lÃ  pour lui apprendre ce que je saisï»¿"
}