{
  "year": 2018,
  "seq": 28,
  "meta": {
    "date": "2018-04-08",
    "from": "maryvonne masseron-mandaba <maryvonnemm@hotmail.com>",
    "to": "\"Yannick Mandaba (pro) \" <y.mandaba@gmail.com>, Marc MANDABA",
    "subject": "MAMIE"
  },
  "proposals": [
    {
      "index": -28,
      "etiquette": "Visa / immigration",
      "category": "MIN",
      "duration": "LT",
      "source": "AI",
      "score": 1,
      "matched_from": [
        "ai_new"
      ]
    }
  ],
  "raw_excerpt": "ðŸ—• Date : 2018-04-08\nðŸ‘¤ From : maryvonne masseron-mandaba <maryvonnemm@hotmail.com>\nðŸ“¨ To   : \"Yannick Mandaba (pro) \" <y.mandaba@gmail.com>, Marc MANDABA\n\t<marcmandaba@hotmail.com>\nðŸ§• Subject : MAMIE\n---\nbonjour,\n\nje suis alle pour un bon moment auprs de mamie cet aprs-midi.\n\nThrse et Marie-Annick sont l depuis vendredi,\n\nles assistantes de vie sont l aussi, selon leur planning habituel.\n\nOn m'avait donn des nouvelles alarmistes,\n\nen fait mamie est sereine, sans aucun calmant, elle est consciente , et coute les uns et les autres,\n\nmais elle est trs fatigue, et s'endort souvent par tranches de 10  15 mn.\n\nElle reconnat parfaitement les personnes  la voix, et manifeste si elle est intresse ou pas.\n\nElle parle un peu, quand elle a un message fort  passer, et nous la comprenons,\n\nelle attend Yannick, a bien compris qu'il va venir, je ne lui pas encore parl de Marc,\n\nelle aime depuis toujours le prnom de Tristan, et demain je lui dirai qu'il viendra.\n\nQue Yannick soit serein, il reverra sa mamie.\n\nSi Marc veut venir, il peut l'envisager, car le seul souci est de la faire manger, pour qu'elle tienne un peu mieux, elle s'affaiblit car a perdu le got de manger.\n\nJe vous embrasse tous les deux et vos familles\n\nmaman"
}