{
  "year": 2018,
  "seq": 38,
  "meta": {
    "date": "2018-04-28",
    "from": "maryvonne masseron-mandaba <maryvonnemm@hotmail.com>",
    "to": "\"y.mandaba@gmail.com\" <y.mandaba@gmail.com>",
    "subject": "HÃ´tel Ã  Roissy 2 nuits dÃ©jÃ  payÃ©es"
  },
  "proposals": [],
  "raw_excerpt": "ğŸ—• Date : 2018-04-28\nğŸ‘¤ From : maryvonne masseron-mandaba <maryvonnemm@hotmail.com>\nğŸ“¨ To   : \"y.mandaba@gmail.com\" <y.mandaba@gmail.com>\nğŸ§• Subject : HÃ´tel Ã  Roissy 2 nuits dÃ©jÃ  payÃ©es \n---\nYannick,\n\nTu ne vas pas venir honorer cette rservation ?\n90 euros la nuit\nTu aurais pu me prvenir .\nAinsi je n'aurais pas rserv une autre chambre pour moi, que je viens de payer, et on me dit que vous n'tes pas arrivs ...\n\nTu me fais lever  7 heures, pour aller  Vitr,  l'ouverture de la banque, je fais le transfert en urgence, et pas un merci,\nJ'attrape le dernier TGV pour passer la journe de demain avec Tristan. Je ne l'ai mme pas vu pendant les vacances de madame, et il trouvait que c'tait bien ennuyeux tous ces repas...\n\nQue se passe-t-il ?\n\nTu pourrais au moins rpondre au tlphone.\n\nTlcharger Outlook pour Android"
}