{
  "year": 2018,
  "seq": 99,
  "meta": {
    "date": "2018-08-27",
    "from": "maryvonne masseron-mandaba <maryvonnemm@hotmail.com>",
    "to": "\"Yannick Mandaba (pro)\" <y.mandaba@gmail.com>",
    "subject": "Re: RAPPEL LFIB/Matin√©e d'accueil des nouvelles familles"
  },
  "proposals": [
    {
      "index": -99,
      "etiquette": "Frais d'√©cole / bus Tristan",
      "category": "MIN",
      "duration": "LT",
      "source": "AI",
      "score": 1,
      "matched_from": [
        "ai_new"
      ]
    }
  ],
  "raw_excerpt": "üóï Date : 2018-08-27\nüë§ From : maryvonne masseron-mandaba <maryvonnemm@hotmail.com>\nüì® To   : \"Yannick Mandaba (pro)\" <y.mandaba@gmail.com>\nüßï Subject : Re: RAPPEL LFIB/Matin√©e d'accueil des nouvelles familles\n---\nSuper !\nJe viens le 28 arriv√©e √† bkk le 29 √† 14h, heure calme, je prendrai un taxi.\nLe 30 nous irons √† l'√©cole avec b√©e et Tristan, entre, 10h et 11h.\nJe repars le 18 septembre.\n√Ä 23 heures.\nBises\nMaman\n\nT√©l√©charger Outlook pour Android\n\n________________________________\nFrom: Yannick Mandaba (pro) \nSent: Monday, August 27, 2018 10:41:07 AM\nTo: 'maryvonne masseron-mandaba'\nSubject: FW: RAPPEL LFIB/Matin√©e d'accueil des nouvelles familles\n\nBonjour,\n\nIl n‚Äôy a pas de r√©servation √† faire pour la visite. On y va c‚Äôest tout le 30.\n\nAujourd‚Äôhui la visite s‚Äôest bien pass√©e avec la directrice.\nLa lecture d‚Äôun paragraphe  suffi √† le qualifier sans discussions.\nEnsuite quelques question pour la compr√©hension, trois grands chiffres et voil√†.\n\nNormalement elle doit le mettre en GS pendant 1 mois sauf si le niveau est flagrant en quel cas elle seule peut accorder. Elle l‚Äôa fait sans h√©siter.\n\nTr√®s gentille.\nElle l‚Äô√©valuera en fin CP ou d√©but CE1 pour aller en CE2\nPareil en CM1 pour aller en CM2.\nUne fois diagnostiqu√©s les √©l√®ves pr√©coces sont √©valu√©s sur demande des parent ou des professeurs pour sauter CE1 ou CM1.\nOn ne saute jamais CP CE2 ou CM2 car jointure avec autre cycle.\n\nMerci de confirmer ton heure d‚Äôarriv√©e\n\nFrom: LFIB Communication [mailto:ruthairat.d@lfib.ac.th]\nSent: Monday, August 27, 2018 09:48\nTo: undisclosed-recipients:\nSubject: RAPPEL LFIB/Matin√©e d'accueil des nouvelles familles\n\n\nMadame, Monsieur,\n\nVous √™tes cordialement invit√©s √† une visite de l'√©tablissement avant la rentr√©e scolaire, organis√©e par des parents d'√©l√®ves volontaires. Elle aura lieu le jeudi 30 ao√ªt 2018 de 09 h 45 √† 12 h 00. Les futurs √©l√®ves sont bien √©videmment invit√©s !\n\nCette visite sera assur√©e en fran√ßais, en anglais et en tha√Ølandais.\n\nPour toute question pour cette journ√©e de visite aux nouvelles familles, vous pouvez contacter :\nMme St√©phanie Zoccola (zoccola_s@yahoo.fr), Mr. Henri de Reboul (dereboul@yahoo.com), ou Mme Ruthairat Dauguet (communication@lfib.ac.th)\n\nAu plaisir de vous retrouver.\n\nLes parents √©lus au Conseil d'Etablissement\n\nPOUR INFORMATION :\nVous trouverez sur le site www.lfib.ac.th des informations importantes pour la rentr√©e scolaire :\nFournitures scolaires : http://www.lfib.ac.th/inscriptions/liste-des-fournitures\nCalendrier scolaire : http://www.lfib.ac.th/actualites/calendriers\nPlan d‚Äôacc√®s au lyc√©e : http://www.lfib.ac.th/contacts\n\n----------------------------------------------------------------------------------------------------------\n\nDear Parents,\n\nYou are warmly invited to a tour of the LFIB. This visit is organised by the parents at the beginning of each new school year. This year it will take place on Thursday 30th August 2018 from 09.45 to noon. Our future students will of course be most welcome too! This visit will be conducted in French, English and Thai.\n\nPlease feel free to contact the following volunteers should you have questions relating to this visit : Mrs. St√©phanie Zoccola (zoccola_s@yahoo.fr), Mr. Henri de Reboul (dereboul@yahoo.com), or Mrs. Ruthairat Dauguet (communication@lfib.ac.th).\n\nSincerely yours,\nParent representatives' committee\n\nFOR YOUR INFORMATION:\nYou will also find on the school‚Äôs website www.lfib.ac.th important information, such as:\nBooks and stationery: http://www.lfib.ac.th/en/admissions/liste-des-fournitures\nSchool calendar:  http://www.lfib.ac.th/en/newss/calendriers\nMap of school: http://www.lfib.ac.th/en/contacts-en\n\n----------------------------------------------------------------------------------------------------------\n\n‡πÄ‡∏£‡∏µ‡∏¢‡∏ô ‡∏ó‡πà‡∏≤‡∏ô‡∏ú‡∏π‡πâ‡∏õ‡∏Å‡∏Ñ‡∏£‡∏≠‡∏á\n\n‡∏ú‡∏π‡πâ‡∏õ‡∏Å‡∏Ñ‡∏£‡∏≠‡∏á‡∏ô‡∏±‡∏Å‡πÄ‡∏£‡∏µ‡∏¢‡∏ô‡∏õ‡∏±‡∏à‡∏à‡∏∏‡∏ö‡∏±‡∏ô‡∏à‡∏±‡∏î‡∏ß‡∏±‡∏ô‡πÄ‡∏¢‡∏µ‡πà‡∏¢‡∏°‡∏ä‡∏°‡πÇ‡∏£‡∏á‡πÄ‡∏£‡∏µ‡∏¢‡∏ô‡∏™‡∏≥‡∏´‡∏£‡∏±‡∏ö‡∏ú‡∏π‡πâ‡∏õ‡∏Å‡∏Ñ‡∏£‡∏≠‡∏á‡πÅ‡∏•‡∏∞‡∏ô‡∏±‡∏Å‡πÄ‡∏£‡∏µ‡∏¢‡∏ô‡πÉ‡∏´‡∏°‡πà‡πÉ‡∏ô‡∏ß‡∏±‡∏ô‡∏û‡∏§‡∏´‡∏±‡∏™‡∏ö‡∏î‡∏µ‡∏ó‡∏µ‡πà 30 ‡∏™‡∏¥‡∏á‡∏´‡∏≤‡∏Ñ‡∏° 2561 ‡πÄ‡∏ß‡∏•‡∏≤ 09.45 ‚Äì 12.00 ‡∏ô.\n\n‡∏à‡∏∂‡∏á‡πÄ‡∏£‡∏µ‡∏¢‡∏ô‡∏°‡∏≤‡πÄ‡∏û‡∏∑‡πà‡∏≠‡∏Ç‡∏≠‡πÄ‡∏£‡∏µ‡∏¢‡∏ô‡πÄ‡∏ä‡∏¥‡∏ç‡∏ó‡πà‡∏≤‡∏ô‡πÅ‡∏•‡∏∞‡∏ö‡∏∏‡∏ï‡∏£‡∏Ç‡∏≠‡∏á‡∏ó‡πà‡∏≤‡∏ô‡πÄ‡∏Ç‡πâ‡∏≤‡∏£‡πà‡∏ß‡∏°‡∏Å‡∏≤‡∏£‡πÄ‡∏¢‡∏µ‡πà‡∏¢‡∏°‡∏ä‡∏°‡∏ï‡∏≤‡∏°‡∏ß‡∏±‡∏ô‡πÅ‡∏•‡∏∞‡πÄ‡∏ß‡∏•‡∏≤‡∏Ç‡πâ‡∏≤‡∏á‡∏ï‡πâ‡∏ô ‡πÅ‡∏•‡∏∞‡∏ó‡πà‡∏≤‡∏ô‡∏™‡∏≤‡∏°‡∏≤‡∏£‡∏ñ‡πÄ‡∏•‡∏∑‡∏≠‡∏Å‡∏Å‡∏•"
}