{
  "year": 2018,
  "seq": 81,
  "meta": {
    "date": "2018-07-26",
    "from": "maryvonne masseron-mandaba <maryvonnemm@hotmail.com>",
    "to": "\"Yannick Mandaba (pro)\" <y.mandaba@gmail.com>",
    "subject": "Re: Oublie mon portable a charger au bureau"
  },
  "proposals": [],
  "raw_excerpt": "ðŸ—• Date : 2018-07-26\nðŸ‘¤ From : maryvonne masseron-mandaba <maryvonnemm@hotmail.com>\nðŸ“¨ To   : \"Yannick Mandaba (pro)\" <y.mandaba@gmail.com>\nðŸ§• Subject : Re: Oublie mon portable a charger au bureau\n---\nNon, j'tais seulement inquite, car je t'avais fix un rendez-vous tlphonique hier, puis aujourd'hui. Bee partait au moment du RV avec Tristan et sa sur, et elle ne savait pas me dire o tu tais !\nEn mme temps, aucun mouvement sur ton WhatsApp depuis 8h08...\nBisous\n demain 20h est trop tt, 20h30 donc ou 21h ???\nMaman\n\nTlcharger Outlook pour Android\n\n________________________________\nFrom: Yannick Mandaba (pro) \nSent: Thursday, July 26, 2018 4:47:14 PM\nTo: 'maryvonne masseron-mandaba'\nSubject: Oublie mon portable a charger au bureau\n\nBonjour Maman,\n\nMo portable est  charger au bureau. JE vais le chercher ce soir si tu veux parler urgent. Sinon demain midi je le rcupre.\nOu plus tard ce soir, l je nai pas encore mang."
}