{
  "year": 2018,
  "seq": 36,
  "meta": {
    "date": "2018-04-26",
    "from": "maryvonne masseron-mandaba <maryvonnemm@hotmail.com>",
    "to": "\"y.mandaba@gmail.com\" <y.mandaba@gmail.com>, BeeBaa <beebeau89@gmail.com>",
    "subject": "Le pauvre Tristan !!!"
  },
  "proposals": [],
  "raw_excerpt": "ðŸ—• Date : 2018-04-26\nðŸ‘¤ From : maryvonne masseron-mandaba <maryvonnemm@hotmail.com>\nðŸ“¨ To   : \"y.mandaba@gmail.com\" <y.mandaba@gmail.com>, BeeBaa <beebeau89@gmail.com>\nðŸ§• Subject : Le pauvre Tristan !!!\n---\nLe virement international n'arrivera pas avant le 30 !!!\nJ'tais  Vitr ce jour, l o est ma banque\nMais vous ne m'avez pas tlphon\nJe me suis occupe de mamie\nJe n'ai pas regard mes mails.\n mon retour  Rennes  21 h , je vois le mail...\n\nIci les banques sont fermes du samedi 11h au mardi 10h\n\nTout cela pour les vacances de madame, qui va aux toilettes au moment o j'appelle\n\nIl n'y a pas de concessions dans l'administration franaise !\n\nVous foutez en l'air la vie de votre fils\n\nVolontairement\n\nJe vais essayer de retourner  vitres main\nMais normalement j'ai un train, il n'y en a qu'un, vers Roissy\n\nEt puis aprs allez vous faire foutre\nIls ont crit que si l'argent non reu, le dossier sera revu en juin, liste d'attente\n\nVous tes des zros\n\n\nTlcharger Outlook pour Android"
}