{
  "year": 2018,
  "seq": 96,
  "meta": {
    "date": "2018-08-19",
    "from": "maryvonne masseron-mandaba <maryvonnemm@hotmail.com>",
    "to": "\"y.mandaba@gmail.com\" <y.mandaba@gmail.com>",
    "subject": "ReÃ§u message"
  },
  "proposals": [
    {
      "index": -96,
      "etiquette": "Paiement salaires atelier",
      "category": "MIN",
      "duration": "LT",
      "source": "AI",
      "score": 1,
      "matched_from": [
        "ai_new"
      ]
    }
  ],
  "raw_excerpt": "ðŸ—• Date : 2018-08-19\nðŸ‘¤ From : maryvonne masseron-mandaba <maryvonnemm@hotmail.com>\nðŸ“¨ To   : \"y.mandaba@gmail.com\" <y.mandaba@gmail.com>\nðŸ§• Subject : ReÃ§u message\n---\nBien reu ton message.\n\nJe ne souhaite pas d'incomprhension =\n\nIci en France, une retraite n'est ni un hritage, ni un gros lot, c'est un salaire que l'on touche chaque mois, en fonction des annes de cotisation, et du montant des cotisations mensuelles verses. Donc cela me permet de vivre, au jour le jour.\n\nPour aider Tristan, je prlve dans mon assurance-vie, une cagnotte faite pour quand j'aurai besoin d'aides  la maison.\nJe ne peux compter sur toi, pas de sous, ni sur Marc, pas d'empathie. Donc si je donne trop, je ne pourrai aller voir Tristan, et je raccourcis ma vie, devant aller en maison de retraite.\n\nJ'ai vu que le trajet pour l'cole est de 1h30, c'est pourquoi je veux faire un geste, immdiatement.\nTlcharger Outlook pour Android"
}