{
  "year": 2018,
  "seq": 128,
  "meta": {
    "date": "2018-10-08",
    "from": "\"Yannick Mandaba \\(pro\\) \" <y.mandaba@gmail.com>",
    "to": "<comptabilite@lfib.ac.th>",
    "subject": "AES-201809-00353 & AES-: Tristan MANDABA , CP B"
  },
  "proposals": [],
  "raw_excerpt": "ðŸ—• Date : 2018-10-08\nðŸ‘¤ From : \"Yannick Mandaba \\(pro\\) \" <y.mandaba@gmail.com>\nðŸ“¨ To   : <comptabilite@lfib.ac.th>\nðŸ§• Subject : AES-201809-00353 & AES-: Tristan MANDABA , CP B\n---\nBonjour,\n\n \n\nTrouvez les 2 reus de paiement en pice jointe pour:\n\n \n\nAES-201809-00353 : Tristan MANDABA , CP B\n\nHip hop, fri 14:10, ms / gs\nFull Package\n\nItem number vhh14/42\nQuantity 1\nTotal amount 3900 THB\n\nGymnastics beginner apparatus (for girls and boy), fri 15:10, cp / ce1/ ce2\nFull Package\nItem number mgrs/404\nQuantity 1\nTotal amount 7280 THB\n\nTotal 11180 THB\n\n \n\nEt pour\n\n \n\nAES-201809-00488 : Tristan MANDABA , CP B\n\nZumba, jeu 14:10, ms / gs\nFull Package\nNumro article jz/75\nQuantit 1\nMontant total 3900 THB\nTotal 3900 THB\n\n \n\nCordialement,\n\n \n\nYannick Mandaba"
}