{
  "year": 2018,
  "seq": 35,
  "meta": {
    "date": "2018-04-25",
    "from": "maryvonne masseron-mandaba <maryvonnemm@hotmail.com>",
    "to": "\"y.mandaba@gmail.com\" <y.mandaba@gmail.com>",
    "subject": "Les virements ont Ã©tÃ© faits Ã  15 h ce 25, seront effectifs demain Ã  8h"
  },
  "proposals": [
    {
      "index": -35,
      "etiquette": "ImpÃ´ts / fiscalitÃ©",
      "category": "MIN",
      "duration": "LT",
      "source": "AI",
      "score": 1,
      "matched_from": [
        "ai_new"
      ]
    }
  ],
  "raw_excerpt": "ðŸ—• Date : 2018-04-25\nðŸ‘¤ From : maryvonne masseron-mandaba <maryvonnemm@hotmail.com>\nðŸ“¨ To   : \"y.mandaba@gmail.com\" <y.mandaba@gmail.com>\nðŸ§• Subject : Les virements ont Ã©tÃ© faits Ã  15 h ce 25, seront effectifs demain Ã  8h\n---\nCaractristiques de la prestation n 01713 00050105599\n Solde au dernier relev le 05/04/2018 :         +1 773,52 EUR\n\nDtail des oprations au 25/04/2018\n\nAfficher toutes les oprations\n\nAfficher les oprations en cours de traitement\n\nAfficher les oprations comptabilises\n  [Relevs en ligne]   [Version imprimable]\nDate    [https://particuliers.secure.societegenerale.fr/img/restitution/pictohorlogebleu.gif]   Libell Montant\n25/04/2018      [VIREMENT EN LIGNE]     VIREMENT EN LIGNE       -700,00 \n25/04/2018      [VIREMENT EN LIGNE]     VIREMENT EN LIGNE       -300,00 \n24/04/2018              VIREMENT        +2 000,00 \n12/04/2018              FRAIS DE TENUE DE COMPTE ACTIF  -6,00 \n26/03/2018              PRLV EUROP PONCTUEL 8105260759 POUR CPTE DE:D.G.F.I.P IMPOT B3001 ID: FR46ZZZ005002 MOTIF: 600095686919TLR1798030289066 TLR     -530,00 \n21/03/2018              REGULARISATION DE COMMISSION FRAIS SUR OPERATIONS CLIENTELE EXO FRAIS VIR INT   +16,00 \n26/02/2018              PRLV EUROP PONCTUEL 5106249055 POUR CPTE DE:D.G.F.I.P IMPOT B3001 ID: FR46ZZZ005002 MOTIF: 600095685887TLR1898003452991 TLR     -392,00 \n11/01/2018              FRAIS DE TENUE DE COMPTE ACTIF  -6,00"
}