{
  "year": 2018,
  "seq": 89,
  "meta": {
    "date": "2018-08-15",
    "from": "\"Yannick Mandaba \\(pro\\) \" <y.mandaba@gmail.com>",
    "to": "<beebeau89@gmail.com>,",
    "subject": "FW: LFIB : FOURNITURES SCOLAIRES // SCHOOL BOOKS"
  },
  "proposals": [],
  "raw_excerpt": "ğŸ—• Date : 2018-08-15\nğŸ‘¤ From : \"Yannick Mandaba \\(pro\\) \" <y.mandaba@gmail.com>\nğŸ“¨ To   : <beebeau89@gmail.com>,\n\t\"'maryvonne masseron-mandaba'\" <maryvonnemm@hotmail.com>\nğŸ§• Subject : FW: LFIB : FOURNITURES SCOLAIRES // SCHOOL BOOKS\n---\nFrom: Coges Minute [mailto:ape.coges-minute@lfib.ac.th] \nSent: Wednesday, June 6, 2018 15:24\nTo: undisclosed-recipients:\nSubject: LFIB : FOURNITURES SCOLAIRES // COMMANDE EN LIGNE\n\n \n\n\n\n\n\n\nLycÃ©e FranÃ§ais International de Bangkok\nAssociation des Parents d'ElÃ¨ves \n\n\n\n\nCoGes Minute \n\nJUIN 2018\nFOURNITURES SCOLAIRES 2018-2019 // COMMANDE EN LIGNE\nSCHOOL SUPPLIES 2018-2019 // ONLINE ORDER\n \n\nLettre d'informations du Bureau de l'APE                    Juin 2018 \n\n \n\n\n\t\n\n\n\n   \n\n\nLe service de commande en ligne de fournitures scolaires 2018-2019 est ouvert !\nThe online order service for school supplies 2018-2019 is opened!\n\nCe service FACULTATIF a pour but de faciliter votre achat de fournitures et dâ€™ouvrages de rÃ©fÃ©rence Â« franÃ§ais Â» qui ne sont pas faciles Ã  trouver en ThaÃ¯lande.\nThis OPTIONAL service is to facilitate your purchase of Â« French Â» school supplies and reference books that are not easily found in Thailand.\n \n\n \n\n\n\t\n\n \n\n\n\n\nChaque commande sera livrÃ©e en paquet individuel Ã©tiquetÃ© au LFIB fin aoÃ»t et sera remise directement Ã  lâ€™Ã©lÃ¨ve le jour de la rentrÃ©e.\nEach order will be delivered in an individual labeled package at the LFIB at the end of August and will be handed out to the student on the back to school day. \n\n \n\n \n\n\n\t\n\n \n\n\n\n\nRetrouver les listes de fournitures scolaires sur la page du LFIB :\n\n  https://lfib.ac.th/inscriptions/liste-des-fournitures\n\nYou can find the list of school supplies on the LFIBâ€™s page:\n  https://lfib.ac.th/en/admissions/liste-des-fournitures\n\n \n\n\n\n\nMODE Dâ€™EMPLOI / HOW TO ORDER\n\n\nUne fois sur la page du fournisseur, / Once that you are on the supplier's page, \n\n   \n \n\nChoisissez le pays / Choose the country - ThaÃ¯lande\nChoisissez la ville / Choose the city - Bangkok\nChoisissez lâ€™Ã©tablissement / Choose the school â€“ LycÃ©e FranÃ§ais International-ElÃ©mentaire ou Secondaire\n\n- 1 liste commune pour lâ€™ElÃ©mentaire avec / 1 common list for Elementary with \n\n*\tAgenda scolaire franÃ§ais / French school agenda\n*\tDictionnaire franÃ§ais pour le Primaire / French dictionary for Elementary school\n*\tGuide de conjugaison poche / Pocket guide to French verbs\n\n              ***ATTENTION : le dictionnaire et le guide de conjugaison\nne sont demandÃ©s qu'Ã  partir de CE2.\nThe Dictionary and the pocket guide to French verbs are required only from the CE2 up to the CM2 ***\n\n\n- 7 listes pour le Secondaire, du 6Ã¨me Ã  la Terminale / 7 lists for Secondary, from 6Ã¨me to Terminale\n\n \nEn choisissant le niveau, la liste des fournitures et des ouvrages de rÃ©fÃ©rence Â« franÃ§ais Â» du niveau sâ€™affiche automatiquement. / After choosing the level, the list of Â« French Â» school supplies and reference books will appear automatically.\n  \nUne commande par Ã©lÃ¨ve / One order per student\n\nLes choix / The choices\n\n   \n\nVOUS DEVEZ CLIQUER LES 3 GROUPES DE MENU. / YOU MUST CLICK ALL THE 3 MENU GROUPS.\n\nLes ouvrages de rÃ©fÃ©rence sont dans le groupes \"Manuels scolaires\". / Dictionaries and books are in the group \"Manuels scolaires\".\n \n\nLe kit dÃ©jÃ  prÃ©parÃ© est dans le groupe \"Kits de fournitures\". / The already prepared kit is in the group \"Kits de fournitures\".\n\nLes fournitures Ã  la carte sont toujours Ã  votre disposition dans le 3Ã¨me groupe \"Fournitures Ã  la carte\". / You also have all the choices for stationary Ã  la carte in the 3rd group \"Fournitures Ã  la carte\".\n\n***2 menus seulement pour lâ€™Ã©lÃ©mentaire : Â« Manuels scolaires Â» et Â« Fournitures Ã  la carte Â».***\n***Only 2 menus for Elementary: \"Manuels scolaires\" and â€œFournitures Ã  la carteâ€.***\n\nFrais de dossier / Order fees\n\n1.50â‚¬ par commande pour lâ€™ElÃ©mentaire / 1.50â‚¬ per order for the Elementary\n\n2,50â‚¬ par commande pour le Secondaire / 2.50â‚¬ per order for the Secondary\n     \nCliquez Â« Recalculer Â» pour avoir le montant total. / Click Â« Recalculer Â» for the total amo"
}