{
  "year": 2018,
  "seq": 92,
  "meta": {
    "date": "2018-08-17",
    "from": "maryvonne masseron-mandaba <maryvonnemm@hotmail.com>",
    "to": "\"Yannick Mandaba (pro)\" <y.mandaba@gmail.com>",
    "subject": "Re: LFIB/Matin√©e d'accueil des nouvelles familles"
  },
  "proposals": [
    {
      "index": -92,
      "etiquette": "Frais d'√©cole / bus Tristan",
      "category": "MIN",
      "duration": "LT",
      "source": "AI",
      "score": 1,
      "matched_from": [
        "ai_new"
      ]
    }
  ],
  "raw_excerpt": "üóï Date : 2018-08-17\nüë§ From : maryvonne masseron-mandaba <maryvonnemm@hotmail.com>\nüì® To   : \"Yannick Mandaba (pro)\" <y.mandaba@gmail.com>\nüßï Subject : Re: LFIB/Matin√©e d'accueil des nouvelles familles\n---\nBonjour,\nVeux-tu inscrire Bee pour la visite en fran√ßais, tu seras avec elle, ou moi. C'est mieux effectivement. Mais pas √† moi de le faire.\nJe financerai les activit√©s extra-scolaires, en priorit√© natation, et chorales, puis foot si compatible avec l'emploi du temps.\nPour le syst√®me anglais, je n'ai pas les moyens... J'aurais pr√©f√©r√©, mais c'est au-del√† de ce qui me reste.\nJ'ai bousill√© ma retraite en t'envoyant trop d'argent, je ne payais que 3 trimestres sur 4. Donc au total amput√©e d'un quart.\nPour la ruine qu'est Rennes, merci. Les voyages en Tha√Ølande, et les frais pour Tristan, me prennent tous mes revenus actuels.\nAvec cette incompr√©hension, au lieu de remerciements, je ne sais pas si je dois encore t'√©couter.\nT√©l√©charger Outlook pour Android\n\n________________________________\nFrom: Yannick Mandaba (pro) \nSent: Friday, August 17, 2018 9:44:39 AM\nTo: 'maryvonne masseron-mandaba'\nSubject: RE: LFIB/Matin√©e d'accueil des nouvelles familles\n\nhttps://lfib.ac.th/images/LFIB/1_ADMIN_LFIB/inscription/Fourniture/2017-2018/primaire/cp_francais_2018_2019.pdf\n\nRien.\nComme tu vois la liste pour CP n‚Äôa meme pas de livre.\nIls parlent d‚Äôavoir si possible le Larousse compact, Becherel conjugaisons et une grammaire pour les CP CE1 et comme il est en maternel‚Ä¶\n\n1) On a d√©j√† le Becherel Conjugaisons quelque part.\n2) Grammaire (faut que je fouille leur site pour trouver la ref ou c‚Äôest dans un des email que j‚Äôai envoy√©s\n3) Dictionnaires ils en a plein\n\n\nNon il n‚Äôa besoin de rien pour l‚Äô√©cole a part une grammaire bien scolaire.\nSi possible avec exercices en un ou s√©par√©s, niveau CP et CE1. Il en a mais on a presque tout fait qui soit de son niveau il manque la quantit√©/vari√©t√© d‚Äôouvrgaes car il se lasse vite d‚Äôun style (d‚Äôun livre toujours le meme ou il peut faire les premier 60%.)\n\nDonc voil√† de la grammaire et exercice, mais ne te fatigue pas trop dessus non plus.\n\n\n\n\nFrom: maryvonne masseron-mandaba [mailto:maryvonnemm@hotmail.com]\nSent: Wednesday, August 15, 2018 23:35\nTo: Yannick Mandaba (pro) \nSubject: Re: LFIB/Matin√©e d'accueil des nouvelles familles\n\nJe serai l√† pour accompagner Tristan et b√©e le 30 ao√ªt. Pour la matin√©e d'accueil.\nPar contre la commande de mat√©riel p√©dagogique est close depuis le 17 juin,...\nQue dois-je apporter,?\nT√©l√©charger Outlook pour Android\n\n________________________________\nFrom: Yannick Mandaba (pro) >\nSent: Wednesday, August 15, 2018 11:57:56 AM\nTo: beebeau89@gmail.com; 'maryvonne masseron-mandaba'\nSubject: FW: LFIB/Matin√©e d'accueil des nouvelles familles\n\n\n\nFrom: LFIB Communication [mailto:ruthairat.d@lfib.ac.th]\nSent: Monday, June 11, 2018 15:10\nTo: undisclosed-recipients:\nSubject: LFIB/Matin√©e d'accueil des nouvelles familles\n\n\nMadame, Monsieur,\n\nVous √™tes cordialement invit√©s √† une visite de l'√©tablissement avant la rentr√©e scolaire, organis√©e par des parents d'√©l√®ves volontaires. Elle aura lieu le jeudi 30 ao√ªt 2018 de 09 h 45 √† 12 h 00. Les futurs √©l√®ves sont bien √©videmment invit√©s !\n\nCette visite sera assur√©e en fran√ßais, en anglais et en tha√Ølandais.\n\nPour toute question pour cette journ√©e de visite aux nouvelles familles, vous pouvez contacter :\nMme St√©phanie Zoccola (zoccola_s@yahoo.fr), Mr. Henri de Reboul (dereboul@yahoo.com), ou Mme Ruthairat Dauguet (communication@lfib.ac.th)\n\nAu plaisir de vous retrouver.\n\nLes parents √©lus au Conseil d'Etablissement\n\nPOUR INFORMATION :\nVous trouverez sur le site www.lfib.ac.th des informations importantes pour la rentr√©e scolaire :\nFournitures scolaires : http://www.lfib.ac.th/inscriptions/liste-des-fournitures\nCalendrier scolaire : http://www.lfib.ac.th/actualites/calendriers\nPlan d‚Äôacc√®s au lyc√©e : http://www.lfib.ac.th/contacts\n\n----------------------------------------------------------------------------------------------------------\n\nDear Parents,\n\nYou are"
}