{
  "year": 2018,
  "seq": 95,
  "meta": {
    "date": "2018-08-19",
    "from": "\"Yannick Mandaba \\(pro\\) \" <y.mandaba@gmail.com>",
    "to": "\"'maryvonne masseron-mandaba'\" <maryvonnemm@hotmail.com>,",
    "subject": "Construction Bangkok Sukhumvit 25"
  },
  "proposals": [
    {
      "index": -95,
      "etiquette": "Dossier de bourse Tristan",
      "category": "MIN",
      "duration": "LT",
      "source": "AI",
      "score": 1,
      "matched_from": [
        "ai_new"
      ]
    },
    {
      "index": -95,
      "etiquette": "Paiement salaires atelier",
      "category": "MIN",
      "duration": "LT",
      "source": "AI",
      "score": 1,
      "matched_from": [
        "ai_new"
      ]
    }
  ],
  "raw_excerpt": "ðŸ—• Date : 2018-08-19\nðŸ‘¤ From : \"Yannick Mandaba \\(pro\\) \" <y.mandaba@gmail.com>\nðŸ“¨ To   : \"'maryvonne masseron-mandaba'\" <maryvonnemm@hotmail.com>,\n\t<marcmandaba@gmail.com>\nðŸ§• Subject : Construction Bangkok Sukhumvit 25 \n---\nhttps://www.whitehouseconstructionline.co.th/construction.php?cate=Home\n\n \n\nCe lien est celui du cabinet architecte et construction.\n\nCest eux qui rnovent actuellement la maison du pre de Bee, qui comporte\ndu gros uvre comme la toiture et des murs non porteurs, llectricit\ncomplte.\n\n \n\nEn construction ils sont un peu au-dessus du  march mais le prix du\nmarch ce sont des checs et des abandons de projets comme chez la cousine\nde Bee en ce moment mme (3eme reprise du chantier).\n\n \n\nSPECIFICATIONS :\n\nLe march : entre 16,000 et 25,000 THB du mtre carr\n\nIl sont  22,000 avec matriaux milieu de gamme.\n\nHauteur max 3 tages au-dessus du RDC.\n\nNous prvoyons 10m de large par 16m de long (2 fois 80m2 = 160m2 par tage)\nquelque soit la hauteur.\n3,500,000 THB par tage de 160m2 au prix fort de 22,000THB/m2.\n\nRESUME : \n\nAvec la valeur d1 condo on peut construire 160m2 ,donc 2 apparts de 80m2\n(lun habitable et lautre a louer par exemple) voire 240m2 mais en effet\navec parking souterrain et parties communes je prfre minorer. Mais bon 1\ncondominium 2 chambres 60-80m2 ailleurs (dans la zone de lcole FR par\nexemple) cest entre 2 et 3 apparts de 80m2 ici.\n\nOn utilisera aussi en comparaison (question comptitivit) les prix dun\ncondominium dans la zone mme de ce terrain si vraiment cela nest pas\nconvainquant.\n\n\nJe reviendrai avec un plan simple, chiffr et ingnieux au niveau du\njardin/parking.\n\n\n6 units\n\n\nTRISTAN-  Louer\n- MMM Remboursable 5+2.5 ans location pleine\n- Approx 2,000,000 (parties communes incl.)\n80m2\n\nTRISTAN-  Louer\n- MMM Remboursable 5+2.5  ans location pleine\n- Approx 2,000,000  (parties communes incl.)\n80m2\n\n\nMARC\n- Pleine possession , a ngocier avec Bee, quelque part entre 60 et 70% du\nprix du march sur la zone.\n- Location Saisonnire / au mois / 15 jours\n80m2\n\nTRISTAN PAPA MAMAN\n- Approx 2,000,000\n80m2\n\n\nBEE \n Prt joint (garanti sur soi 17 + P.Ae salaire)\n80m2\n\nBEE \n Prt joint (garanti sur soi 17 + P.Ae salaire)\n80m2\n\n \n\n \n\nRetour sur investissement:\n\n80m2 dans mon immeuble cest 45,000 THB par mois  louer et la zone nest\npas spcialement rsidentielle.\n\nOn peut tabler sur 50,000 THB par mois par unit en tant bon march\n\nSi je table sur le cout gonfl de2,500,000 par unit de 80m2 il se rembourse\nsur 5 ans de locations.\n\nIl me semble quune opration comme cela samortie sur 15-20 ans en gnral.\n\n \n\nCadre lgal :\n\nA partir du moment o lon fait dans les rgles statuts condominium  les\nrisques sont les mmes que nimporte o ailleurs il me semble, sauf que cela\ndevient un placement exceptionnel (pt de vue strictement financier) : On\npaye uniquement la construction sur un terrain ultra bien plac qui est dj\nacquis.\n\nPourquoi tant de gnrosit ? Parce que Bee na pas les moyens construire.\n\n \n\nBlocage principal :\n\n-        Capital\n\n-        Cadre juridique.\n\nSi Bee est ok pour mettre au nom de Tristan et monter un projet condo, on\nest sur la bonne voie.\n\n \n\nIl reste une inconnu de taille : \n\nBee veut construire les 3 tages (max autoris) pour sassoir sur une belle\nrente (sans blague !).\n\nAu mieux avec le budget que Maman semble vouloir  mavancer pour un condo,\non peut faire entre 2 et 3 units.\n\nMarc pourrait tre intress par une unit (il me dira).\n\nDonc on arrive  2 tages (1 habit, 1 lou  lanne, 1 lou a la saison\nquand Marc nest pas la)\n\n \n\nBee travail  mettre son autre terrain en garantie pour obtenir de quoi\nfinir le 3 eme (2 apparts) Pour elle cest capital car elle veut tirer\nrevenu de son terrain, pas juste les Mandaba et pour elle la simple survie\ndans son appart. \n\nEt cest l que le projet reste incertain, mais si on pouvait dj se\ndcider sur le reste, sa sur sera prte pour un co-emprunt et mettre sa\nfiche de paye dans e dossier. \n\n \n\n \n\nEn ce qui me concerne je ne vois pas vraiment de placement plus sur ou de\nprojet plus sr que celui-l pour"
}