{
  "year": 2018,
  "seq": 61,
  "meta": {
    "date": "2018-07-04",
    "from": "maryvonne masseron-mandaba <maryvonnemm@hotmail.com>",
    "to": "\"Yannick Mandaba (pro) \" <y.mandaba@gmail.com>",
    "subject": "RE: Andrea Bocelli - Besame Mucho (Feat. Tristan Mandaba)"
  },
  "proposals": [],
  "raw_excerpt": "ğŸ—• Date : 2018-07-04\nğŸ‘¤ From : maryvonne masseron-mandaba <maryvonnemm@hotmail.com>\nğŸ“¨ To   : \"Yannick Mandaba (pro) \" <y.mandaba@gmail.com>\nğŸ§• Subject : RE: Andrea Bocelli - Besame Mucho (Feat. Tristan Mandaba)\n---\nok,\n\nla prononciation , par cesaria evora est la meilleure !\n\n  *\n\nbocelli est italienâ€¦ et aveugleâ€¦ et prend des libertÃ©s mÃªme avec le solfÃ¨geâ€¦ il n'en fait qu'Ã sa tÃªte !\n\nla chanson est en espagnol\nje te mets les paroles, et tu peux lui traduire, c'est facile\n\n---------------------------------------------------------------------------\n\nMonika Azetil y a 1 an (modifiÃ©)\nBesame, besame mucho\ncomo si fuera esta noche\nla ultima vez\nbesame, besame mucho\nque tengo miedo tenerte\ny perderte despuÃ©s\n\nBesame, besame mucho\ncomo si fuera esta noche\nla ultima vez\nÂ¡ay! bÃ©same, bÃ©same mucho\nque tengo miedo tenerte\ny perderte despuÃ©s\n\nQuiero tenerte muy cerca\nmirarme en tus ojos, verte junto a mi\npiensa que tal ves maÃ±ana ya\nestarÃ© lejos muy lejos de aquÃ­\n\nBesame, besame mucho\ncomo si fuera esta noche\nla ultima vez\nbesame, besame mucho\nque tengo miedo tenerte\ny perderte despuÃ©s\nbesame, besame mucho...ï»¿\n\n\n\n\n\n\nhttps://www.youtube.com/watch?v=LLsg_Lk819s\n[https://www.bing.com/th?id=OVP.qDZKTnGKTuBzHQMgqcci1AHfFn&pid=Api]\n\nBesame Mucho Cesaria Evora\nwww.youtube.com\n09-2009.. een kus , ik blijf van je houden xxx . 09-2016.. it,s reaning in my heart .. xxx https://www.youtube.com/watch?v=MHaRN35YFGs\n\n\n\n\n________________________________\nDe : Yannick Mandaba (pro) \nEnvoyÃ© : mercredi 4 juillet 2018 07:16\nÃ€ : 'maryvonne masseron-mandaba'\nObjet : RE: Andrea Bocelli - Besame Mucho (Feat. Tristan Mandaba)\n\n\nCe nâ€™est pas du francais donc il ne comprends ni comment prononcer ni le sens.\n\nIl a appris tout seul sur le piano, les parole sont sur la partitionâ€¦ On a decouvert ca cette semaine quâ€™il connqissait les parolesâ€¦\n\n\n\nBise\n\n\n\nFrom: maryvonne masseron-mandaba [mailto:maryvonnemm@hotmail.com]\nSent: Wednesday, July 4, 2018 13:20\nTo: Yannick Mandaba (pro) \nSubject: Re: Andrea Bocelli - Besame Mucho (Feat. Tristan Mandaba)\n\n\n\nMerci,\n\nBelle musicalitÃ© !\n\nMais paroles incomprÃ©hensibles...\n\nBisous Ã  vous 3\n\nBelle journee\n\nMamie\n\nTÃ©lÃ©charger Outlook pour Android\n\n\n\n________________________________\n\nFrom: Yannick Mandaba (pro) >\nSent: Wednesday, July 4, 2018 7:47:39 AM\nTo: 'maryvonne masseron-mandaba'; marcmandaba@gmail.com\nCc: 'jean-paul et armelle'; 'hervÃ© et marie-annick pommerolle'; 'thÃ©rÃ¨se tranchevent'; gilbertmasseron@gmail.com\nSubject: Andrea Bocelli - Besame Mucho (Feat. Tristan Mandaba)\n\n\n\nSalut Ã  Tous,\n\n\n\nVideo attachÃ©e.. Tristan vous chante Besame Mucho.\n\n\n\nBises de nous 3"
}