{
  "year": 2018,
  "seq": 140,
  "meta": {
    "date": "2018-12-04",
    "from": "maryvonne masseron-mandaba <maryvonnemm@hotmail.com>",
    "to": "\"y.mandaba@gmail.com\" <y.mandaba@gmail.com>, BeeBaa <beebeau89@gmail.com>",
    "subject": "Cadeau pour tristan"
  },
  "proposals": [],
  "raw_excerpt": "ðŸ—• Date : 2018-12-04\nðŸ‘¤ From : maryvonne masseron-mandaba <maryvonnemm@hotmail.com>\nðŸ“¨ To   : \"y.mandaba@gmail.com\" <y.mandaba@gmail.com>, BeeBaa <beebeau89@gmail.com>\nðŸ§• Subject : Cadeau pour tristan\n---\nCe livre des fables d'Esope, a t achet au Muse de Bayeux, l o l'on peut voir la tapisserie de Bayeux, longue de 60 mtres, qui  relate la vie de Guillaume le conqurant.\nCette tapisserie, en fait plutt une broderie,  t tisse vers 1066, peu aprs que Guillaume II duc de Normandie, soit devenu Guillaume I d'Angleterre. Cette uvre d'art raconte sa conqute.\nJ'ai visit Bayeux, son muse, sa cathdrale, il y a un mois, avec mon amie Maryvonne Delisle, du Canada, cependant que notre amie Maryvonne Meuric s'en allait des suites d'un cancer du sein.\nJe l'ai accompagne  partir du 10 novembre. Elle est dcde le 20 novembre, enterre  Plerguer le 23.\nNous tions toutes nes en 1946.\nMaryvonne Meuric est cette amie avec laquelle je faisait de petits voyages chaque anne, de 3  4 jours, Milan, Rome, Madrid, cordoue, Grenade, et Milan le dernier, pour l'exposition universelle de 2015.\nM\n\nTlcharger Outlook pour Android"
}