{
  "year": 2018,
  "seq": 82,
  "meta": {
    "date": "2018-07-26",
    "from": "maryvonne masseron-mandaba <maryvonnemm@hotmail.com>",
    "to": "\"Yannick Mandaba (pro)\" <y.mandaba@gmail.com>",
    "subject": "Re: problÃ¨mes ???"
  },
  "proposals": [],
  "raw_excerpt": "ðŸ—• Date : 2018-07-26\nðŸ‘¤ From : maryvonne masseron-mandaba <maryvonnemm@hotmail.com>\nðŸ“¨ To   : \"Yannick Mandaba (pro)\" <y.mandaba@gmail.com>\nðŸ§• Subject : Re: problÃ¨mes ???\n---\nRien de plus que le \"dj trop\"...\nHier tu n'tais pas l  20h.\nJ'avais dit  bee que j'appellerai  20h00 ce jour.\nElles taient dj dans la voiture !\nLe problme est = on s'en fout de moi.\n\n\nTlcharger Outlook pour Android\n\n________________________________\nFrom: Yannick Mandaba (pro) \nSent: Thursday, July 26, 2018 5:02:14 PM\nTo: 'maryvonne masseron-mandaba'\nSubject: RE: problmes ???\n\nJe suis a la maison. On est parti un peu vite du bureau avec Gautier, il tait dj tard on avait faim.\nBee tant partie en me prvenant  la dernire minute, j ai un peu oubli.\nElle a ton numro pour WhatsApp pour voir Tristan.\n\nMoi demain je passe cherche mon tel au bureau\n\nFrom: maryvonne masseron-mandaba [mailto:maryvonnemm@hotmail.com]\nSent: Thursday, July 26, 2018 20:08\nTo: y.mandaba@gmail.com\nSubject: problmes ???\n\n\nYannick,\n\nje t'avais dit que j'appelais ce soir  20 h,\n\nparce qu'hier tu n'tais pas l !!!\n\nQue se passe-t'il encore  ?\n\nBee part avec Tristan chez sa sur, et elles ne savent pas o tu es.\n\nJe n'ai pas besoin de soucis en plus !\n\nmaman"
}