{
  "year": 2018,
  "seq": 52,
  "meta": {
    "date": "2018-05-30",
    "from": "maryvonne masseron-mandaba <maryvonnemm@hotmail.com>",
    "to": "Yannick Mandaba <y.mandaba@gmail.com>",
    "subject": "Re: WhatsApp Messenger : Android + iPhone + Windows Phone"
  },
  "proposals": [],
  "raw_excerpt": "ðŸ—• Date : 2018-05-30\nðŸ‘¤ From : maryvonne masseron-mandaba <maryvonnemm@hotmail.com>\nðŸ“¨ To   : Yannick Mandaba <y.mandaba@gmail.com>\nðŸ§• Subject : Re: WhatsApp Messenger : Android + iPhone + Windows Phone\n---\nLe WhatsApp s'accroche  mon adresse mail, et non  mon tlphone, que faire ?\nEn attendant, envoyez toutes vos photos et films de vacances sur une cl USB, soit par la poste Thai , soit par des gens qui viennent en  france  et par la poste franaise. Merci.\n\nTlcharger Outlook pour Android\n\n________________________________\nFrom: Yannick Mandaba \nSent: Tuesday, May 29, 2018 3:39:12 PM\nTo: maryvonne masseron-mandaba\nSubject: Re: WhatsApp Messenger : Android + iPhone + Windows Phone\n\nOui\n\nYannick Mandaba\n+66878200622\n\nOn Tue, May 29, 2018, 20:11 maryvonne masseron-mandaba > wrote:\nWhatsApp Messenger est une application rapide, simple et sre que j'utilise pour envoyer des messages et appeler les personnes qui me sont chres.\n\nEn tlchargement gratuit ici : https://www.whatsapp.com/download/.\n\nTlcharger Outlook pour Android"
}